Perfect!	完璧だ！
The new medicine saved his life.	新薬が彼の命を救った。
What is the new leader like?	新しい指導者はどんな人ですか。
Is there anything on the floor?	床の上に何がありますか。
Girls mature faster than boys.	女の子は男の子より早熟だ。
Thank you for your help.	助けていただいてありがとうございます。
Please give me a sheet of paper.	書く紙を一枚ください。
Actually I wrote her a card.	実は彼女にカードを書いたんだ。
Wasn't he killed by a car?	自動車にひかれたのではないですか。
We waited for him to turn up.	私達は彼が現れるのを待った。
We'd better call the police.	私達は警察を呼んだほうがいい。
We aided him with money.	私達はお金を出してあげて彼を援助した。
We eat many kinds of food.	私達はいろいろな食べ物を食べます。
I will be back at half past six.	私は六時半に帰ります。
I study for 3 hours every day.	私は毎日３時間勉強します。
I have to help my mother.	私は母の手伝いをしなければならない。
I want my room painted white.	私は部屋を白く塗って欲しい。
I am certain of his coming.	私は彼が来ることを確信している。
I am sure of his success.	私は彼が成功するものと確信している。
I let the cat out of the house.	私は猫を家の外に出した。
I have been here for two hours.	私は二時間ここにいます。
I made my son see the doctor.	私は息子を医者に診察させた。
I felt my way to the door.	私は手探りで戸口まで歩いていった。
I suggested going for a walk.	私は散歩に行こうと提案した。
I am not happy with my job.	私は今の自分の仕事に不満である。
I had the boy carry my bag.	私は鞄をボーイに運んでもらった。
I don't feel like eating anything.	何も食べたくない。
I feel like eating something.	何か食べたいような気がする。
I am good at speaking English.	私は英語を話すのが上手だ。
At length, I found his house.	私はやっと彼の家を見つけた。
I thanked Mary for her help.	私はメアリーの助けに感謝した。
I helped carry those bags.	私はそれらの袋を運ぶのを手伝った。
I know none of the three men.	私はその３人の誰も知らない。
I met a certain Mr Smith.	私はスミスさんとかいう人に出会った。
I got this book for nothing.	私はこの本をただで手に入れた。
I paid $200 for this bag.	私はこのバッグに２００ドル支払った。
I was an outsider, so to speak.	私はいわば部外者だった。
I'm ready to leave now.	私はいつでも出かける準備はできています。
I will do anything for you.	私はあなたの為に何でもしますよ。
My mother made me a bag.	私の母は私にかばんを作ってくれました。
My home is on the eighth floor.	私の家は８階にあります。
I'm about ready to go.	私のほうは出かける支度はほぼできています。
Please explain the rule to me.	私に規則を説明して下さい。
I had no idea who she was.	私には彼女が何者か分からなかった。
I have two foreign friends.	私には外国人の友達が２人います。
I have nothing to hide.	私にはうしろめたいことは全くありません。
I have nothing to do with him.	私と彼とは何の関係も無い。
We average 8 hour's work a day.	私たちは平均八時間働く。
We gave way to their demands.	私たちは彼らの要求に屈した。
We took his story on trust.	私たちは彼の話を頭から信用した。
We aided him in his business.	私たちは彼の仕事を援助した。
We did nothing in particular.	私たちは特に何もしなかった。
We are not all that safe.	私たちは思っているほど安全ではない。
We'd better call the doctor.	私たちは医者を呼んだ方がいい。
We danced about the fire.	私たちはたき火の周囲を踊って回った。
We own a dog and a cat.	私たちは１匹の犬と１匹の猫を飼っている。
Children like playing outside.	子供は外で遊ぶのが好きだ。
You had better have your hair cut.	散髪した方がよい。
Spring is late coming this year.	今年は春の訪れが遅い。
I must return his call.	今度は私の方が彼を訪ねなければならない。
It's too late to turn back now.	今引き返すには遅すぎる。
A police station is close at hand.	交番が近くにある。
I just can't seem to make contact.	交信が出来ません。
I'll clean up the kitchen later.	後で台所を片づけます。
Words serve to express ideas.	言葉は思想を表すのに役立つ。
The dog walked across the street.	犬がとおりを渡った。
The police charged into the bar.	警察がバーに突入した。
Can you speak English at all?	君は本当に英語が話せるのか。
You can always count on Tom.	君はトムをいつもあてに出来る。
Write your name in capitals.	君の名前を大文字で書きなさい。
Bring your brother with you.	君の弟を一緒に連れてきなさい。
How is your work coming along?	君の仕事の調子はどうだい。
I don't quite follow you.	君の言っていることはよくわからない。
I will go along with your plan.	君の計画を受け入れよう。
Was the money actually paid?	金は実際に支払われたのですか。
A strong wind began to set in.	強風が陸の方へ吹き始めた。
How did you enjoy your vacation?	休暇はいかがでしたか。
The customer is always right.	客の言うことはいつも正しい。
Please drop in on your way home.	帰りに寄って下さいよ。
It's as deep as it is wide.	間口も広いが奥行きも同様に深い。
School will break for the summer.	学校は夏休みになる。
My school grades were average.	学校の成績は普通でしたよ。
Let's drive as far as the sea.	海までドライブしましょう。
I have nothing particular to say.	改めて言う事はない。
This hall was full of people.	会場は聴衆でいっぱいだった。
We gave our mother a watch.	我々は母に時計をプレゼントした。
We made camp near the lake.	我々は湖の近くでキャンプをした。
Our family budget is in the red.	我が家の家計は赤字だ。
Everything comes to those who wait.	果報は寝て待て。
Don't you have anything better to do?	暇なやつだ。
Are you happy in your house?	家庭にいてあなたは幸せですか。
How's your summer vacation going?	夏休みはどうですか。
The summer drew near to its end.	夏が終わりに近づいた。
I want something hot to drink.	何か温かい飲み物がほしい。
Do you have anything to eat?	何か食べる物を持っていますか。
Bring me something to eat.	何か食べるものを持ってきて欲しい。
Nothing will stop his going.	何があっても彼は行くでしょう。
Music makes our life happy.	音楽は私達の暮らしを楽しくする。
We saw a mountain in the distance.	遠くに山が見えた。
Is it hard to speak English?	英語を話すことは難しいですか。
To speak English is not easy.	英語を話すことは簡単でない。
English is not spoken here.	英語はここでは話されていません。
It was the same all year round.	一年中いつも同じでした。
Can you speak English at all?	一体君は英語が話せるのかね。
Will you send for a doctor?	医者を呼びにやってくれませんか。
The doctor may have said so.	医者はそういったかもしれない。
We should respect the old.	われわれは老人を尊敬すべきである。
I am more beautiful than you.	わたしは、あなたより美しい。
Linda came home late at night.	リンダは夜遅く帰ってきた。
I had my radio repaired by him.	ラジオを彼に修理させた。
He was flying down the road.	ものすごい勢いで駆けていった。
Do you have anything cheaper?	もっと安い部屋はありますか。
Do you have any cheaper seats?	もっと安い席がありますか。
Mary has a social nature.	メアリーは社交的な気質を持っている。
Everyone attacked my opinion.	みんなが僕の意見を攻撃した。
She looks as if she were drunk.	まるで酔っているようだ。
Madeira is the name of a wine.	マデイラはワインの名前だ。
Look, here comes your mother.	ほら、お母さんが来られたよ。
I know almost nothing about it.	ほとんど何も知りません。
Two sheets were on the bed.	ベッドの上にシーツが２枚あった。
France is in western Europe.	フランスは西ヨーロッパにある。
Do you have any French wine?	フランスのワインはありますか。
Mr Brown has four children.	ブラウンさんには子供が４人いる。
Bill really drinks like a fish.	ビルは本当に飲んべえだ。
Paris is the capital of France.	パリはフランスの首都だ。
What a nice face she has!	なんとすてきな顔をしているのだろう。
I've no idea what's happening.	なんだか見当がつきません。
Why did he change his plans?	なぜ彼は計画を変えたのですか。
What made him change his mind?	なぜ彼は気が変わったのか。
How come you didn't say anything?	なぜ何も言わないの。
What kind of wine do you have?	どんなワインがありますか。
What kind of sports do you do?	どんなスポーツをしますか。
Tom does anything but study.	トムは勉強以外なら何でもする。
Which airport do I leave from?	どの空港から出発しますか。
How are you getting along?	どのようにして生活していきますか。
How do you want your hair cut?	どのようにカットしますか。
What sport do you like best?	どのスポーツが一番好きですか。
I had no choice but to stay.	とどまるより他に仕方なかった。
You're not fit to be seen.	とても見られたかっこうじゃないよ。
Where did you get the idea?	どこでそんなこと覚えてきたんだ。
I managed to finish the book.	どうにかその本を読み終えた。
Please remain seated.	どうぞ、そのままお座りになっていてください。
May I turn on the television?	テレビを点けてもいいですか。
Carry the table out, please.	テーブルを運びだしてください。
Is there a cat under the table?	テーブルの下に猫がいる？
His true colors are coming out.	だんだん地金が出てきた。
Probably he will come soon.	たぶん彼はまもなく来るでしょう。
Danny has no sense of beauty.	ダニーには美的センスがない。
We can but wait for the results.	ただ結果を待つのみだ。
A lot of trees were cut down.	たくさんの木が切り倒された。
Most boys know his name.	たいていの少年は彼の名前を知っている。
Most students like sports.	たいていの学生はスポーツが好きだ。
Don't speak so fast, please.	そんなに速く話さないで下さい。
Will you carry it out for me?	それを運び出してくれますか。
You shall have it for nothing.	それをただで君にあげよう。
It has nothing to do with you.	それはまったく関係がない。
It made my hair stand on end.	それで私の髪の毛は逆立った。
I would do anything but that.	それだけは勘弁してください。
The old man has enough money.	その老人は金には事欠かない。
The old man made out his will.	その老人は遺言を作成した。
That medicine worked well for me.	その薬はよく効いた。
I met her late in the evening.	その夜遅くに彼女に会った。
Don't cut down those trees.	その木を切り倒さないでください。
The couple led a happy life.	その夫婦は幸福な生活を送った。
The hospital opened last month.	その病院は先月開業した。
Is there anything in the box?	その箱の中に何かありますか。
That car is quite up to date.	その電車はなかなか最新式だ。
I care nothing for the news.	その知らせなんかなんともない。
The water is not fit to drink.	その水は飲むのに不適当だ。
Did he look like a doctor?	その人はお医者さんのようでしたか。
You're not fit to be seen.	その身なりでは人前に出られません。
That car is quite up to date.	その車なかなか最新式である。
I hit upon a good idea then.	その時私は良い考えが浮かんだ。
The game resulted in a draw.	その試合は引き分けに終わった。
The work cost him his life.	その仕事のために彼は命を失った。
The idea formed in his mind.	その考えがかれの心に浮かんだ。
The lake is deep at this point.	その湖はこの地点が深い。
The plan was put into operation.	その計画は実施された。
The machine is now in operation.	その機械は今運転中だ。
It's all up with the firm.	その会社は完全におしまいになった。
I explained the process to him.	その過程を彼に説明した。
The house stands among trees.	その家は木立に囲まれている。
The glass is full of wine.	そのグラスは、ワインでいっぱいだ。
Well, I watch television.	そうですね、テレビを見たりしますね。
Is there a telephone near by?	すぐ近くに電話はありますか。
Send for the doctor at once.	すぐに医者を呼びにやりなさい。
Send for the doctor at once.	すぐに医者を呼びにやってくれ。
Let the door be closed at once.	すぐにドアを閉めなさい。
John is as old as my brother.	ジョンは私の弟と同じ年です。
John kept the door open.	ジョンはドアを開けたままにしておいた。
Could you press this button?	シャッターを押してくれますか。
I will do anything but this.	これ以外のことなら何でもする。
Can you cash these for me?	これを現金に換えていただけますか。
Choose one from among these.	これらの中から１つ選びなさい。
This is by far the best method.	これは断然最善の方法だ。
This is very nice to look at.	これは見た目に気持ちがよい。
This has nothing to do with you.	これは君に関係がない。
This is a picture of an airport.	これは空港の写真です。
This is a picture of my mother.	これが私の母の写真です。
This story is based on facts.	この話は事実に基づいている。
This theory is true of Japan.	この理論は日本にあてはまる。
Must I take this medicine?	この薬を飲まなければ行けませんか。
This medicine will do you good!	この薬はよく効きますよ。
This book seemed interesting.	この本は面白いように思えた。
I enjoyed this book so much!	この本とてもおもしろかったわ。
There is no chair in this room.	この部屋には椅子がない。
This hospital is run by the city.	この病院は市立です。
There's nothing in this box.	この箱の中には何もありません。
This telephone is out of order.	この電話は故障している。
These goods are in great demand.	この商品の需要は多い。
This task is too much for me.	この仕事は私の手におえない。
I'm listening to this band.	このバンドの演奏を聞いているの。
Don't open this door, please.	このドアを開けないで下さい。
This door leads to the study.	このドアは書斎に通じている。
This table is made of wood.	このテーブルは木で作られている。
We have several bags here.	ここにいくつかのバッグがあります。
Kazu likes sports very much.	カズはスポーツがとても好きだ。
Money has changed his life.	お金が彼の人生を変えてしまった。
Did you go to see a doctor?	お医者さんに見てもらいましたか。
I can't really trust Toshiba.	いまいち東芝は信用できない。
You can always count on me.	いつでも私を頼りにしていいです。
What on earth are you doing?	いったい何をしているのだろう。
The capital of Italy is Rome.	イタリアの首都はローマです。
We have some local wine.	いくつかこの土地のワインもございます。
In a sense, you are right.	ある意味であなたの言う事は正しい。
I have more than enough time.	ありあまるほどの時間がある。
Please don't walk too fast.	あまり速くあるかないでください。
You shouldn't trust that man.	あの男を信用してはいけない。
How that woman runs on!	あの女のおしゃべりはまったくきりがない。
That lake looks like the sea.	あの湖は海のように見えます。
Are you listening to him?	あなたは彼の話を聞いているのですか。
You know nothing of the world.	あなたは世間知らずですね。
Do you have anything to say?	あなたは何か意見がありますか。
You are listening to English.	あなたは英語を聞いています。
Your dreams have come true.	あなたの夢が現実のものとなった。
I am happy to hear your voice.	あなたの声を聞いて嬉しい。
What flight were you on?	あなたの乗ってきた飛行機は何便ですか。
You shall want for nothing.	あなたには何も不自由はさせない。
Let me exchange seats with you.	あなたと席を交換しよう。
Do you walk hand in hand?	あなたたちは手をつないで歩きますか。
There were two women on board.	２人の女性が乗船していた。
He will be back in an hour.	１時間もたてば彼は帰ってきます。
Nine players make up a team.	１チームは９人の選手から成る。
Pick up your things and go away.	荷物を持って出て行け。
I always think X would be nice.	Xがいいなといつも思います
There are a lot of X among them.	Xがなかには多々有ります
Everyone watches today's video.	みんなで本日のビデオを見る
Most of the children were nice.	結構いい感じの子が多かった
He needs to put his focus on X.	彼はXを視野に入れるべきだ
My family has 10 cats at home.	私の家には、猫が１０匹います
X became popular among users.	Xがユーザーの人気を集めました
I'm already looking forward to X.	Xがもう今から楽しみだ
It also improves my ability.	それがまた自分の能力を向上させる
This kind of method is effective.	このような方法が有効だ
I've never dated any guys.	私はこれまで男の人と付き合わなかった
Everyone, thank you so very much.	本当に皆さんに感謝です
They don't get along together.	二人の間がしっくり行かない。
Talking is a human ability.	話すことは人間の能力の一つである。
I just want someone to talk to.	話し相手が欲しいだけです。
Thanks for bringing me here.	連れてきてもらえてうれしいです。
The water cooler is out of order.	冷水機は故障している。
They are not my real parents.	両親は本当の親ではありません。
She is a trial to her parents.	両親は彼女に手を焼いている。
My parents made me go there.	両親は無理に私をそこへ行かせた。
A fallen rock barred his way.	落石が彼の行く手をさえぎった。
Next spring I want to graduate.	来年の春は卒業したいなあ。
Is there a flight in the evening?	夕方の便はありますか。
I study for many hours at night.	夜に何時間も勉強します。
I am no more happy than you are.	僕も君と同様楽しくない。
I am certain of your success.	僕は君の成功を確信しているよ。
My mother took me to the park.	母は私を公園に連れていった。
Mother has made me what I am.	母は私を今日の私にしてくれた。
My mother is in the hospital now.	母は今入院しています。
Mother cleared away the table.	母、は食卓のものを片付けた。
Could you find me an attorney?	弁護士をお世話願えませんか。
I think the wind's picking up.	風が強くなってきたようだね。
They have finished their work.	彼等は作業を終えてしまった。
She has grown up to be a woman.	彼女も一人前の女になった。
She has taken to painting in oils.	彼女は油絵を始めた。
She walked side by side with me.	彼女は僕と並んで歩いた。
She thanked us for our help.	彼女は僕たちの手助けに感謝した。
She looks on him as her master.	彼女は彼を師と仰いでいる。
She is doing her hair simply.	彼女は髪を無造作に束ねている。
She was told off for being late.	彼女は遅刻して怒られた。
She is a local government officer.	彼女は地方公務員だ。
She knew it by a sixth sense.	彼女は第六感でそれが分かった。
She must keep early hours.	彼女は早寝早起きしなければならない。
She can speak Spanish well.	彼女は上手にスペイン語を話せます。
She finished reading the letter.	彼女は手紙を読み終えた。
She put sheets on her bed.	彼女は自分のベッドにシーツを引いた。
She is like a mother to me.	彼女は私に母親のようにしてくれる。
She asked me about my mother.	彼女は私に母についてたずねた。
She takes a walk with her dog.	彼女は犬と一緒に散歩します。
She didn't seem interested.	彼女は関心がなさそうな様子だった。
She waited for him for hours.	彼女は何時間もの間彼を待った。
She likes to listen to music.	彼女は音楽を聞くことが好きだ。
She should help her mother.	彼女はお母さんの手伝いをすべきだ。
The woman's hair is quite short.	彼女の髪の毛は結構短い。
Her efforts were to good purpose.	彼女の努力は報われた。
Her advice amounts to an order.	彼女の助言は命令も同然だ。
Her ideas are quite original.	彼女の考えはほんとに独創的だ。
Take a seat over against her.	彼女の向い側の席をとりなさい。
I was happy to see her again.	彼女に再び会えてうれしかった。
She has an eye for the beautiful.	彼女には審美眼がある。
That she was there is certain.	彼女がそこにいたのは確かだ。
All we can do is wait for him.	彼を待つよりほか仕方がない。
They live in our block.	彼らは私たちと同じブロックに住んでいます。
They have nothing in common.	彼らは共通した物をもっていない。
They looked really happy.	彼らはほんとうに幸福そうに見えました。
They had the work finished.	彼らはその仕事を仕上げてしまった。
They fight like cat and dog.	彼らは、猛烈にいがみあっている。
They are breaking down the wall.	彼らは、壁を壊している。
Not all of them are happy.	彼らがみな幸福であるとはかぎらない。
He saved money for his old age.	彼は老後に備えて貯金した。
He often writes to his parents.	彼は両親によく手紙を書く。
He's not talking theory.	彼は理屈を言っているのではありませんね。
He came home late in the evening.	彼は夕方遅く帰宅した。
He painted all the walls green.	彼は壁を全て緑色に塗った。
He walked up and down the room.	彼は部屋をあちこち歩いた。
He gave her a piece of advice.	彼は彼女に一言忠告を与えた。
He cleaned his room on Sunday.	彼は日曜日に部屋を掃除した。
He is able to speak Japanese.	彼は日本語を話すことができる。
He lives just across the road.	彼は道の反対側に住んでいる。
He liked history among others.	彼は中でも歴史が好きだった。
He tried to reduce his weight.	彼は体重を減らそうと努めた。
He is better than anyone else.	彼は他の誰より優れています。
He asked for a drink of water.	彼は水を１杯くれとたのんだ。
He showed off his new watch.	彼は新しい時計を見せびらかした。
He tried many different methods.	彼は種々の方法を試みた。
He is as ready to talk as to work.	彼は手八丁口八丁だ。
He is master of his own time.	彼は自分の時間は自由に使える。
He gave away all his money.	彼は自分の金すべてをくれてやった。
He developed his own theory.	彼は自分なりの理論を発展させた。
He has to work on his own.	彼は自分で仕事をしなければならない。
He is three years senior to me.	彼は私より３歳年上である。
He gave me a piece of advice.	彼は私に忠告を１つしてくれた。
He took us back in his car.	彼は私たちを車で送り返してくれた。
He has his office in town.	彼は市の中心部に事務所を持っている。
He has taken to drinking recently.	彼は最近飲みすぎだ。
He drew $100 from his account.	彼は口座から百ドル下ろした。
He has a liking for modern music.	彼は現代音楽が好きだ。
He never counts on my help.	彼は決してわたしの助けをかりない。
He was standing by his brother.	彼は兄のそばに立っていた。
He was cross with his student.	彼は自分の生徒に腹を立てた。
He walked about the streets.	彼は街のあちこちを歩きまわった。
He has a good command of English.	彼は英語がペラペラだ。
He took out a piece of paper.	彼は一枚の紙切れを取り出した。
He remained single all his life.	彼は一生独身で過ごした。
He submitted his written opinion.	彼は意見書を提出した。
He drove his car to Yokohama.	彼は愛車を駆って横浜へ行った。
He often stays up late at night.	彼はよく夜更かしをする。
He has a cat and two dogs.	彼はネコを一匹と犬を二匹飼っている。
