Perfect!	完璧だ！
The girl sat beside me.	その少女は私のそばにすわった。
He got lost in the park.	その子は公園で迷子になった。
Both sisters are pretty.	その姉妹の２人ともきれいだ。
The party was a success.	そのパーティーは成功だった。
Can the news be true?	そのニュースは一体本当でしょうか。
Can the news be true?	そのニュースははたして本当かしら。
I'll catch up with you soon.	すぐに追い着きます。
Take this box away soon.	すぐにこの箱を片付けなさい。
Let's build on your plan.	じゃあ君のプランで行こう。
I'm sorry to trouble you.	ご迷惑をかけてすみません。
May I take a message for him?	ご伝言を承ります。
This is an important event.	これは重要な行事です。
This report is not perfect.	この報告書は不十分だ。
This box is made of paper.	この箱は紙で出来ている。
How wide is this river?	この川の幅はどのぐらいですか。
You're wrong in this case.	この場面は君が良くない。
Who does the gun belong to?	この銃は誰の物だろう。
How big is this park?	この公園はどのくらい広いのですか。
This guard is very strong.	この見張りはとても強い。
I can't use this machine.	この機械が使えないのです。
Could I check my bags?	この荷物を預ける事が出来ますか。
The cup is made of gold.	このカップは金でできている。
I am quite a stranger here.	ここは全く不案内です。
Can I park my car here?	ここに車を止めてもいいですか。
Did you see a bag here?	ここに鞄がありませんでしたか。
This is how I cook fish.	こうして私は魚を料理します。
Ken was running beside me.	ケンは私と並んで走った。
The whole class was quiet.	クラス全体が静かだった。
Kumi did not make a box.	クミは箱を作りませんでした。
You must be a good cook.	きっとお料理上手なんですね。
Please turn up the gas.	ガスの火を大きくしてください。
I can't thank you enough.	お礼の申し上げようもない。
Mr Wood had no sons.	ウッドさんには息子がいませんでした。
Keep your hands clean.	いつも手を綺麗にしておきなさい。
I'm fine, too, thank you.	ありがとう、私も元気です。
Look at that red building.	あの赤い建物を見なさい。
That child is impossible.	あの子はしょうがない子だ。
How high mountain that is!	あの山はなんて高いんだ。
Is that dog male or female?	あの犬はオスかメスか。
That house belongs to him.	あの家は彼のものである。
Look above that building.	あのビルの上を見てごらん。
It's next to that building.	あのビルのとなりです。
Who is that pretty girl?	あのきれいな少女は誰ですか。
Can you ride a horse?	あなたは馬に乗ることができますか。
I hear you're very rich.	あなたは大金持ちと評判です。
Your student called me.	あなたの生徒は私に電話をした。
I hope for your success.	あなたの成功を望んでいます。
A year has twelve months.	１年には１２か月あります。
Let's take a 10-minute break.	１０分休憩しよう。
Did I hurt your feelings?	お気に障ったのでしょうか。
Don't cry, there's a dear.	いい子だから泣かないで。
They advanced to the river.	彼らは川まで前進した。
Ken hit on a good idea.	ケンはうまい考えを思いついた。
I love that combination.	センスのある着こなしですね。
She was afraid of the dog.	彼女はその犬を怖がった。
He regards X as an objective.	彼がXを目標にします
There many opinions on X.	Xにはいろいろ意見が有ります
Various opinions will be heard.	色々意見が出ます
It's very useful to people.	それがとても人の役に立つ
It is not difficult to imagine.	容易に想像がつく
He explores ways of support.	彼が支援のあり方を探る
Companies are expected to X.	Xが企業には求められる
It requires a lot of work.	実に多くの作業が必要になる
X was revealed on the 25th.	Xが２５日に判明しました
The girl finally woke up.	ようやく女の子が眼を覚ました
I'm better at writing novels.	小説を書く方が得意だ
Please wake me up at 6:30.	六時半に起こしてください。
All's fair in love and war.	恋と戦争は手段を選ばず。
You are a good cook, aren't you?	料理うまいね。
Fallen rocks closed the way.	落石が道路をふさいだ。
Thank you for coming.	来てくださってありがとうございます。
Shall I cook dinner for you?	夕食を作りましょうか。
Are you ready for dinner?	夕食の用意は出来ていますか。
The main street is very broad.	本通りは大変広い。
We played around the farm.	僕達は農場の近くで遊んだ。
I am often in difficulties.	僕はしばしばお金に困る。
Don't laugh at my failure.	僕の失敗を笑わないでくれ。
I will go to encourage him.	僕が彼を励ましに行こう。
Walking is a good exercise.	歩くことはよい運動です。
I've gone and caught a cold.	風邪を引いてしまった。
When you lose, you actually win.	負けるが勝ち。
Tomiko guessed my weight.	富子は私の体重を言い当てた。
Where is the ladies' room?	婦人用手洗いはどこですか。
It's all but impossible.	不可能以外のなにものでもない。
He seems to have been ill.	病気であったように見える。
Your secret is safe with me.	あなたの秘密は守るわ。
She is used to cooking.	彼女は料理をするのに慣れている。
She gazed with wide eyes.	彼女は目を丸くして見つめた。
She goes to school on foot.	彼女は歩いて学校に行く。
She works for a hospital.	彼女は病院につとめています。
She has gone shopping.	彼女は買い物に行ってしまいました。
She slowly closed her eyes.	彼女は静かに目を閉じた。
She gave me a strange look.	彼女は私を変な目で見た。
She has an advantage over me.	彼女は私より有利だ。
She turned down my request.	彼女は私の依頼を断った。
She must have been rich.	彼女は金持ちだったに違いない。
It is said that she is rich.	彼女は金持ちだそうだ。
She dreamed a strange dream.	彼女は奇妙な夢を見た。
She came with good news.	彼女はよい知らせを持ってきた。
She hit upon a good idea.	彼女はふと名案を思いついた。
She cried out in surprise.	彼女はびっくりして叫んだ。
She is a very dear girl.	彼女はとてもかわいい少女です。
She pushed the door open.	彼女はそのドアを押し開けた。
She lives in the village.	彼女はこの村に住んでいます。
She is all skin and bone.	彼女はがりがりに痩せている。
She fell ill a week ago.	彼女は１週間前に病気になった。
She is right in her opinions.	彼女の意見は正しい。
She doesn't have any enemies.	彼女には敵はいない。
I saw her enter the room.	彼女が部屋にはいるのを見た。
He is impossible to beat.	彼を打ち負かすのは不可能だ。
They explored the Antarctic.	彼らは南極を探索した。
They fought against the enemy.	彼らは敵と戦った。
The news made them happy.	彼らは知らせを聞いて喜んだ。
They gave in to my opinion.	彼らは私の意見に従った。
They are high school students.	彼らは高校生です。
They broke away the bars.	彼らはその格子を取り壊した。
They are out shopping.	彼らはショッピングに出かけている。
They had a baby last week.	彼らに先週子供が生まれた。
He was promoted to general.	彼は陸軍大将に昇進した。
He ran away for dear life.	彼は命からがらにげさった。
He was shocked into silence.	彼は呆れて黙っていた。
He was very old and ill.	彼は非常に年老いて病気でした。
He keeps a store in Tokyo.	彼は東京に店を持っている。
He grew up to be a doctor.	彼は成長して医者になった。
He traveled around the world.	彼は世界一周をした。
He was brought up to riding.	彼は乗馬を仕込まれた。
It looks like he will win.	彼は勝利したように見える。
He is framed for hard work.	彼は重労働に向いている。
He laughed off my idea.	彼は私のアイデアを笑い飛ばした。
He knows neither of us.	彼は私たちのどちらもしりません。
He thanked me for coming.	彼は私がきたことに感謝した。
He lost himself in thought.	彼は思索にふけっていた。
He seems to be in trouble.	彼は困っているようである。
He is Japanese to the bone.	彼は骨の髄まで日本人だ。
He was counted as lost.	彼は行方不明になったと思われた。
He made a mistake on purpose.	彼は故意に間違った。
He passed among the crowd.	彼は群衆の中を通り抜けた。
He seems to have been rich.	彼は金持ちだったらしい。
He was in critical condition.	彼は危篤状態だった。
It appears that he's a student.	彼は学生らしい。
When do you expect him back?	彼は何時に戻りますか。
He's no judge of music.	彼は音楽の良し悪しがわからない。
He had dinner by himself.	彼は一人で夕食を食べました。
He made a mistake on purpose.	彼はわざと間違えた。
He performed duty at last.	彼はついに責務を果たした。
They say he is very rich.	彼はたいへん金持ちだそうだ。
He threw the big man down.	彼はその大男を投げ倒した。
He is equal to the task.	彼はその仕事をやる能力がある。
He is not equal to the task.	彼にこの仕事は無理だ。
Whatever he says is true.	彼が言うことは何でも正しい。
He acted as our guide.	彼がわたしたちの案内役をつとめた。
He hit me, not her.	彼がなぐったのは私であって彼女ではない。
The sun is about to rise.	日がまさに昇ろうとしている。
Between us, she was ill.	内緒だけれど彼女は病気だった。
An animal has no moral sense.	動物に道徳感はない。
I couldn't catch the train.	電車に間に合わなかった。
The enemy attacked the town.	敵はその町を攻撃した。
Stop the advance of the enemy.	敵の前進を止めよ。
Nagano beat Tokyo 2 to 3.	長野は東京を２対３で破った。
The audience was very large.	聴衆はとても多かった。
Someone! Catch that man!	誰か尾の男を捕まえてください。
Who told you the news?	誰が君にそのニュースを知らせたの？
Who attended the meeting?	誰が会合に参加したのですか。
Large cars use lots of gas.	大型車はガソリンを食う。
Don't raise your voice at me.	大きな声でどなるな。
Sorry to have kept you waiting.	待たせてごめん。
The sun gives light and heat.	太陽は光と熱を出す。
The sun is about to set.	太陽はまさに沈もうとしている。
The other children laughed.	他の子供達が笑いました。
He who laughs last laughs best.	早まって喜ぶな。
The war wasted the country.	戦争でその国は荒廃した。
It was very cold last month.	先月は非常に寒かった。
The baby cried all night.	赤ん坊は夜通しなきつづけた。
A stone hit him on the head.	石が彼の頭にあたった。
I really miss the old days.	昔は本当に良かったわね。
I'll drop you a few lines.	数行、手紙を書き送ります。
Don't make a scene in public.	人前で大騒ぎするな。
Life is not an empty dream.	人生は空虚な夢ではない。
All men are created equal.	人は皆平等に創られている。
My heart is beating fast.	心臓の鼓動が速く打っている。
Food is essential to life.	食物は生きるために必要だ。
We have no chance of winning.	勝てる見込みがない。
Never keep a lady waiting.	女性を待たせてはいけない。
The experiment was successful.	実験は成功だった。
May I have your next dance?	次に踊ってもらえますか。
We had better sit down here.	私達は座った方がいい。
We waste a lot of time.	私達は、多くの時間を無駄にする。
I'm a stranger here myself.	私もこの辺は始めてです。
I like neither of them.	私は彼らのどちらも好きではない。
I told him to be quiet.	私は彼に静かにするように言った。
I caught up with him soon.	私は彼にすぐに追いついた。
I saw him enter the room.	私は彼が部屋に入るのを見た。
My heart is full of trouble.	私は悩んでばかりいる。
I tried to avoid conflict.	私は争いを避けようとした。
I worked hard last month.	私は先月一生懸命働きました。
I could not but laugh.	私は笑わないわけにはいかなかった。
I couldn't help but laugh.	笑わずにはいられなかった。
I skied for the first time.	私は初めてスキーをした。
I accounted for the failure.	私は失敗の説明をした。
I made up for lost time.	私は失った時間を埋め合わせた。
I have no ear for music.	私は音楽のことは分かりません。
I'm not afraid any more.	私はもう怖くありませんでした。
I opened the door slowly.	私はドアをゆっくりと開けた。
I tried writing a novel.	私はためしに小説を書いてみた。
My mother cleans the room.	私の母が部屋を掃除します。
My house is near the station.	私の家は駅から近い。
My house is backed by woods.	私の家の後ろは森です。
Please don't laugh at me.	私のことを笑わないで下さい。
We made him our guide.	私たちは彼を私たちの案内人にした。
We walked along the river.	私たちは川に沿って歩いた。
We took a walk in the park.	私たちは公園を散歩した。
We danced to the music.	私たちはその曲にあわせて踊った。
We sat round the fire.	私たちはいろりの周りに座りました。
I wrote the song for her.	私が彼女の歌を作曲しました。
If only I were a doctor.	私が医者であればいいのになあ。
It's not even worth a thought.	思う価値さえない。
The worst situation resulted.	最悪の事態が生じた。
Shall I cook dinner today?	今日夕食を作りましょうか。
I go to the hospital today.	今日私は病院に行きます。
I'll come to pick it up later.	後で取りに来ます。
A stranger spoke to me.	見知らぬ人が私に話しかけてきた。
The dog sat down by the man.	犬は男のそばに座った。
Never speak ill of others.	決して他人の悪口を言うな。
Never judge by appearance.	決して見かけで判断するな。
Are you a Japanese student?	君は日本人の学生ですか。
He is equal to the task.	君の助けがないと完成できない。
It's strange you say that.	君がそんな事を言うとはな。
Fishing is not in my life.	魚つりは私の得意ではない。
The printer needs paper.	給紙トレーに紙が入ってないよ。
The train was due at six.	汽車は６時到着の予定だった。
Don't throw away your chance.	機会をむだにするな。
I can't thank you enough.	感謝のしようもございません。
I can't attend the meeting.	会議には出席できません。
All the members were present.	会員は全員出席した。
We argued him into going.	我々は彼を説得して行かせた。
I gazed at the sea for hours.	何時間も海を眺めた。
What do you think you're doing?	何を考えてんだ？
Do you have anything hot?	何か熱い飲み物がありますか？
Something is hiding me off.	何かがオレを覆い尽くす。
You have good taste in music.	音楽の趣味がいいね。
Is your wife a good cook?	奥様はお料理がお上手ですか。
I have been to the station.	駅へ行って来たところだ。
To master English is hard.	英語を習得するのは難しい。
I've spent $500 a day.	一日で５００ドルつかってしまった。
Rome was not built in a day.	一朝一夕にはできない。
There is no time to be lost.	一刻の猶予もならない。
The doctor gave it to her.	医者は彼女にそれを与えた。
I'd like to see a doctor.	医者に診てもらいたいのです。
Where is the lost and found?	遺失物係はどこですか。
Ill news comes too soon.	悪い噂はよい噂より早く伝わる。
Bad news travels quickly.	悪い噂はすぐに伝わるからね。
Aoi dances very well.	葵さんは踊るのが何と上手なのだろう。
Certainly. What can I do?	わかりました。何でしょうか。
Good students study hard.	よい学生は一生懸命勉強する。
Correct errors, if any.	もし間違いがあるなら直しなさい。
It'll soon be time for dinner.	もうすぐ夕食です。
The sun will come up soon.	もうすぐ太陽が昇るだろう。
I'll wait another five minutes.	もう５分待とう。
We all like cycling.	私たちみんな自転車に乗るのが好きです。
It only takes a few minutes.	ほんの２、３分ですよ。
Thank you for your present.	プレゼントをありがとう。
I picked up some French.	フランス語を少しかじりました。
One of my bags is missing.	バッグが一つ見あたらない。
I'd like to attend the party.	パーティーに出たい。
In New York I lost my way.	ニューヨークで道に迷った。
What pretty eyes you have!	なんて美しい目なのだろう！
Which car is less crowded?	どの車両がすいていますか。
It was a beautiful sight.	とても素晴らしい光景だった。
It's too hot for us to work.	とても暑くて働けない。
How can I become rich?	どうしたら金持ちになれるのかしら？
But I enjoyed farm work.	でも農場の仕事は楽しかったわ。
At length, he began to cry.	ついに彼は泣きはじめた。
Let me think for a minute.	ちょっと考えさせて下さい。
It is impossible to do it.	それをすることは不可能だ。
Anyone can do it easily.	それは誰にでもたやすくできる。
That's quite to my taste.	それは全くわたしの趣味です。
It's none of my business!	それは私に関係のないことだ。
That gives me great pleasure.	それはとても楽しい。
He cried, "That's good!"	それはすてきだとかれは叫んだ。
It is none the less true.	それでもそれはやはり本当だ。
The old man died of cancer.	その老人はガンで死んだ。
The train is running fast.	その列車は速く走っている。
The lady is over eighty.	その婦人は８０歳を越えている。
The shop is closed today.	その店は今日はしまっている。
The store closes at seven.	その店は７時に閉店します。
The store closes at eleven.	その店は１１時に閉まる。
The street is very narrow.	その通りはとても狭いんだ。
The news quickly spread.	その知らせはたちまち広まった。
The man hit me on the head.	その男は私の頭を殴った。
The man gave a big cry.	その男は、大きな叫び声をあげた。
The girls began to laugh.	その少女たちは笑いはじめた。
The girl entered the room.	その女の子は部屋に入った。
Raise your hand to the sky.	その手を空へ突き上げろ。
She put it in the box.	その子はそれを箱の中に入れました。
The boy can count to ten.	その子は１０まで数えられる。
I've spent all the money.	その金をみな使ってしまった。
None of the money is mine.	その金はわたしのではない。
The news made him happy.	そのニュースは彼を幸せにした。
You won't get it so easily.	そうは問屋がおろさない。
Can you guess how happy I am?	すごく嬉しいのです。
I'll be back in a few minutes.	すぐ戻ってきます。
Send for the doctor at once.	すぐ医者を呼んでくれ。
Call the doctor right away.	すぐ医者に電話しなさい。
Here we are at Ueno Station.	さぁ上野駅に着いたぞ。
Here we are at the station.	さあ、駅に着きましたよ。
I am sorry to trouble you.	ご面倒をかけてすいません。
This is too easy, I guess.	これはやさしすぎると思う。
This is a little gift for you.	これはお土産です。
They are in for trouble.	これから悩むことになりそうだ。
This was built long ago.	これからずっと昔、建てられた。
Is there any tax on this?	この品には税がかかりますか。
This film is worth seeing.	この映画は見る価値がある。
What does this mark mean?	この印はどういうものですか。
This lighter won't catch.	このライターは火がつかない。
You're going the wrong way.	君は違う方にいきますよ。
This is true of students.	このことは学生に当てはまる。
Thank you. Please stop here.	ここで止めてください。
We're running out of gas.	ガソリンが切れかかっている。
These are my thank-you notes.	お礼状のカードです。
I can't thank you enough.	お礼の申しようもありません。
Don't use all the hot water.	お湯を全部使わないで。
Thank you for your trouble.	お手数をおかけしました。
I'm sorry to bother you.	お手数かけてどうもすいません。
Thank you for your trouble.	お手間をおかけしました。
Thank you for your trouble.	お骨折り感謝いたします。
Money counts for little.	お金なんかたいしたことはない。
Can the news be true?	いったいそのニュースは本当だろうか。
Shall I get you a chair?	いすを持ってまいりましょうか。
No, thank you. I'm so full.	いえ結構、もう十分です。
That book is worth reading.	あの本は読む価値がある。
Have you tried that store?	あの店は行ってみましたか。
Look at that high mountain.	あの高い山をご覧なさい。
Both you and I are students.	あなたも私も学生です。
You will be laughed at.	あなたは笑われてしまうでしょう。
Did you get good marks?	あなたはよい点数をとりましたか。
Did you clean your room?	あなたの部屋を掃除しましたか。
Is your baby sleeping?	あなたの赤ちゃんは眠っていますか。
I hope for your success.	あなたの成功を期待しています。
Your guess is quite wrong.	あなたの推量は的はずれだ。
Do whatever you want.	あなたのしたいことは何でもしなさい。
You're so set in your ways!	あなたって本当に頑固ね。
Let's check that shop, too.	あっちの店も見てみよう。
Turn at that corner there.	あそこの角を曲がりなさい。
I'm sorry, my father is out.	あいにく父は留守です。
I'm sorry my father is out.	あいにく父は今留守です。
A UFO is flying in the sky.	ＵＦＯが空を飛んでいる。
Please wait for five minutes.	５分お待ちください。
Come back within a month.	１ヶ月以内に帰ってきなさい。
I'll be back in ten minutes.	１０分したら戻ります。
The gas is running out.	ガソリンが無くなりつつあります。
Shall I carry your bag?	あなたの鞄をお持ちしましょうか。
It's exactly half-past eight.	８時半ちょうどです。
Two of them have a conversation.	二人が会話をする
There are many serious opinions.	厳しい意見が多い
The possibility has been raised.	可能性が出てきた
He received medical benefits.	彼が療養の給付を受けた
The enemies used special moves.	敵が必殺技を使った
Adults create an environment.	大人が環境を作っている
There is a high risk of cancer.	がんのリスクが高い
He was struck by questions.	彼がふと疑問をいだきました
That is much more appropriate.	そちらのほうが適当だ
Trees are lit up by the sun.	木々が日の光に照らされる
How late can I ring?	何時くらいまでなら電話してもいいですか。
Jim tends to go too far.	ジムくんは行き過ぎの嫌いがある。
I helped an old lady across.	老婦人が渡るのを助けた。
The workers are on strike.	労働者達はストライキ中です。
All is fair in love and war.	恋といくさは道を選ばず。
The train approached the town.	列車は町に近づいた。
I tried to get good marks.	良い点を取ろうと努力をした。
Attend to your own business.	余計なおせっかいはよせ。
I've got to get some shots.	予防接種を受けとかなきゃ。
Let me pay for the dinner.	夕食代は私に払わせて下さい。
You mustn't sit up late.	夜遅くまで起きていてはならない。
I am used to sitting up late.	夜更かしになれている。
Look at the sleeping baby.	眠っている赤ん坊を見なさい。
Could I have a sample taste?	味見させてもらえますか。
My sister has perfect vision.	妹の視力は申し分ない。
The court will sit next week.	法廷は来週開廷される。
The mother kissed her baby.	母親は赤ちゃんにキスした。
He is walking very slowly.	歩き方がとてもゆっくりだね。
There is a map on the wall.	壁に地図がかかっています。
Peace is of great importance.	平和はとても大切です。
The wind is blowing hard now.	風がひどくなってきた。
There was quiet in the room.	部屋はシーンとしていた。
Can you keep it a secret?	秘密にしておいてくれないかね。
She seems to be a good cook.	彼女は料理が上手そうだ。
She struggled to get up.	彼女は立ちあがろうと、もがいた。
She spoke with a soft voice.	彼女は優しい声で話した。
She returned safe and sound.	彼女は無事に戻ってきた。
