Perfect!	完璧だ！
This city has a big TV station.	この都市には大きなテレビ局がある。
Go two blocks and turn left.	この通りを二つ目の角で左へ曲がりなさい。
There is nothing new under the sun.	この世に新しいものはない。
I have enjoyed reading this novel.	この小説を読んで楽しかった。
Can you clearly define this word?	この語を明確に定義できますか。
This building is off limits now.	この建物は、現在立ち入り禁止だ。
There is a military base near here.	この近くに軍の基地がある。
This machine sometimes breaks down.	この機械は時々故障します。
This song is not loved by girls.	この歌は女の子に愛されていない。
This song's name is "Only You".	この歌の名前はオンリー・ユーです。
This house belongs to Mr Yamada.	この家は山田さんが所有している。
Are you going away this summer?	この夏休みはどこかへ行くのですか。
This message doesn't make sense.	このメッセージは意味をなさない。
What do you have in this bag?	このバッグの中には何が入っていますか。
Who is responsible for this class?	このクラスの担任は誰ですか。
Will you please hold this edge?	こっちの端を持っていてくれますか。
It is a great pleasure to be here.	ここにいるのはとても楽しい。
Is this one of the local hot spots?	ここが地元の人気スポット？
This is how I usually cook fish.	こうして私はいつも魚を料理する。
Kenya became independent in 1963.	ケニアは１９６３年に独立した。
Our class has forty-five students.	クラスには４５人生徒がいる。
It is too warm for a fire today.	きょうは暖かいから火はいらない。
You may spend or save at will.	お金を使うも貯めるも自由にしなさい。
No more, thank you. I'm full.	いや結構です。たくさんいただきました。
When did you miss your watch?	いつ時計がないことに気がつきましたか。
I can trust him to a certain extent.	ある程度彼を信用できる。
You are right to a certain extent.	ある程度君の言い方は正しい。
The U.S. economy is in good health.	アメリカ経済は順調ですよ。
That box is bigger than this one.	あの箱はこの箱ほど小さくない。
I often go fishing in that river.	あの川へはよく釣りに行きます。
Look at that pretty little girl.	あのかわいい少女をごらんなさい。
Do you go to school on foot?	あなたは歩いて学校へ通っているのですか。
Were you in America last month?	あなたは先月アメリカにいましたか。
Did you catch the first train?	あなたは始発電車に間にあいましたか。
Do you believe in any religion?	あなたは何か宗教を信じていますか。
Have you heard the news yet?	あなたはもうそのニュースを聞きましたか。
You are right to a certain extent.	あなたはある程度まで正しい。
I can't thank you enough.	あなたにはどんなに感謝しても感謝しきれません。
That building must be on fire.	あそこの建物が燃えているに違いない。
A crowd of more than three thousand.	３０００人を超える群集。
The 21st century belongs to Asia.	２１世紀はアジアの時代である。
"Look, Mike!", Hiroshi cries.	「ほら、マイク！」と博が声を上げます。
I don't want to risk losing it.	私はそれを失う危険を冒したくない。
That will save me a lot of trouble.	それでだいぶ手間が省ける。
What time does the first train leave?	始発は何時に出ますか。
At last, I managed to find him.	やっと、どうにかして彼を見つけた。
We will make your thoughts a reality.	私たちが想いを形にします
There are a lot of shops that aren't open.	休みの店が多い
Further consideration will be needed.	さらに今後の検討が必要だ
He/She will take X into consideration.	Xを本人が考慮に入れる
Almost all of the users use 3G.	ほぼすべてのユーザーが３Ｇを利用する
It will achieve the perfect body.	それが理想の体型作りを実現します
It reaches an almost constant level.	ほぼ一定のレベルに達します
Such person leads the next generation.	そんな人が、次代を担う
I have nothing left to say except 〜.	〜としかもう言いようがない
The store is always full of energy.	店内がいつも活気に満ちている
I passed by the store several times.	私が何回か店の前を通過した
How many people are aware of X?	Xをどれくらいの人が意識しているのか
The leaves are blowing in the wind.	木々の葉が風に吹かれています
Please accept this little gift.	つまらないものですがご笑納ください。
A friend to all is a friend to none.	万人の友は誰の友でもない。
I didn't request you to do that.	そんなことリクエストしていません。
I caught sight of her in the train.	列車の中で彼女の姿が見えた。
Good books are always worth reading.	良書はすべて読むに値する。
A blow from a falling stone killed him.	彼は落石で即死した。
The point is they're too young.	要するに彼らは若すぎるということだ。
In a word, you hate me, don't you?	要するに君は私が嫌いなんだね。
I'm afraid it's not a good idea.	余りよい考えではないと思いますが。
Again I was able to escape death.	又しても死を免れることができた。
Don't judge a book by its cover.	本をその表紙で判断してはいけない。
I know little of the recent situation.	僕は最近の情勢に疎い。
I keep nothing a secret from you.	僕は何も君にはかくしだてしない。
I managed to get there in time.	僕はなんとか時間までにそこに着いた。
We're already high up in the sky.	僕たちはもう空高くにいるんだね。
Mother was surprised at the news.	母はそのニュースを聞いて驚いた。
I would walk, except it's too hot.	歩いてもいいんだが、暑すぎる。
Keep down, or you'll be shot.	伏せたままでいろ、さもないと撃たれるぞ。
Will you help me clean the room?	部屋の掃除を手伝ってくれませんか。
My father objected to our marriage.	父は私たちの結婚に反対した。
Their baby is able to walk already.	彼等の赤ちゃんはもう歩ける。
I am responsible for her protection.	彼女を保護する義務がある。
She may have missed the train.	彼女は列車に乗り遅れたのかもしれない。
She spends much money on dresses.	彼女は洋服にたくさんお金を使う。
She was very surprised at the news.	彼女は知らせに非常に驚いた。
She lost herself in the crowd.	彼女は人混みにまぎれてみえなくなった。
She tends to speak ill of others.	彼女は人の悪口を言う傾向がある。
She drew the chair towards her.	彼女は自分のほうに椅子を引き寄せた。
She advanced her watch ten minutes.	彼女は時計を１０分進ませた。
She is aware of my secret plan.	彼女は私の秘密の計画に気づいている。
She seems short beside her sister.	彼女は姉のそばでは低く見える。
She entered this school last year.	彼女は昨年この学校に入学した。
She asked the police for protection.	彼女は警察に保護を求めた。
She turned to the left at the corner.	彼女は角で左に曲がった。
She has been ill since about summer.	彼女は夏頃から病気だった。
She will leave the hospital soon.	彼女はまもなく退院するでしょう。
She hasn't cleaned her room yet.	彼女はまだ部屋を掃除していません。
She's not yet heard the news.	彼女はまだそのニュースを聞いてはいない。
She majors in French literature.	彼女はフランス文学を専攻している。
She managed to drive a car.	彼女はどうにか車の運転ができるようになった。
She looks pretty in that dress.	彼女はその服を着るとかわいく見える。
She can speak English pretty well.	彼女はかなり上手に英語を話す。
She always keeps her hair clean.	彼女はいつも髪をきれいにしている。
She left the hospital an hour ago.	彼女は１時間前に退院しました。
She caught it for coming late.	彼女は、遅刻してさんざん油を絞られた。
Her death was a great blow to him.	彼女の死は彼には大打撃だった。
You must attend to what she says.	彼女の言うことをよく聞きなさい。
She aims at becoming a teacher.	彼女のねらいは教師になることである。
She has been ill for three weeks.	彼女が病気になってから３週間だ。
I'll take him with me to the hospital.	彼を病院に連れて行く。
They fought in the cause of justice.	彼らは正義のために戦った。
They are our dearest friends.	彼らは私たちのもっとも親しい友達である。
They were dancing to the music.	彼らは音楽に合わせて踊っていました。
They all sought for the lost child.	彼らはみんなで迷子を探した。
They brought the trouble to an end.	彼らはその紛争を終わらせた。
Both he and I are high school students.	彼も私も高校生です。
He runs to the station every morning.	彼は毎朝駅まで走ります。
He drew a straight line on the wall.	彼は壁の上に直線を書いた。
He worked hard to promote peace.	彼は平和を促進するために尽力した。
I should say he has caught cold.	彼は風邪をひいているのでしょうね。
He made nothing of her success.	彼は彼女の成功を何とも思わなかった。
He is by far the best student.	彼は誰よりもはるかに良く出来る学生だ。
He is laboring under a great error.	彼は大きな心違いをしている。
He has a strong sense of responsibility.	彼は責任感が強い。
He has a firm purpose in life.	彼は人生に確固とした目的を持っている。
He sat up all night reading a novel.	彼は小説を読んで徹夜した。
He did not go out, but sat down.	彼は出て行かないで座ってしまった。
He threw the letter into the fire.	彼は手紙を火の中に投げ込んだ。
He looked me straight in the eyes.	彼は私の目をまともに見つめた。
He dealt me a blow on the shoulder.	彼は私の肩をいっぱつ打った。
He mistook me for my younger brother.	彼は私と弟を取り違えた。
He responded to the signal I gave.	彼は私が送った合図に反応した。
He has built two houses so far.	彼は今までのところ２軒の家を建てた。
He traveled throughout the country.	彼は国中をくまなく旅行した。
He is not a high school student.	彼は高等学校の生徒ではありません。
He had little freedom of action.	彼は行動の自由がほとんどなかった。
He is afraid of making mistakes.	彼は間違いを犯すことを恐れている。
He has experience of foreign travel.	彼は海外旅行の経験がある。
He sprang a new request on us.	彼は我々に急に新しい要求を持ち出した。
He managed to be on time for class.	彼は何とか授業に間に合った。
He came across her at the station.	彼は駅でばったり彼女に会った。
He has a perfect command of English.	彼は英語を自由に駆使する。
He looks nothing like a doctor.	彼は医者のようにはぜんぜん見えない。
He hurt her feelings on purpose.	彼はわざと彼女の気持ちを傷つけた。
He is said to be a good doctor.	彼はよいお医者さんだと言われている。
He fell head-long into the river.	彼はまっさかさまに川に転落した。
He couldn't help laughing at it.	彼はそれを笑わずにいられなかった。
He explained the reason at length.	彼はその理由を詳しく説明した。
He must have reached the station.	彼はその駅に到着したに違いない。
He was lost in thought for a while.	彼はしばし、考えにふけった。
He has been ill in bed for a week.	彼はこの一週間病気で寝ている。
He is, as it were, a grown-up baby.	彼はいわば成人した赤ん坊だ。
He is, as it were, a grown-up baby.	彼はいわば、大きな赤ん坊だ。
He knows all manner of animals.	彼はあらゆる種類の動物を知っている。
He is, as it were, a grown up baby.	彼は、いわば大人の赤ん坊だ。
He didn't mean to hurt you.	彼には君を傷つけるつもりなんてなかったのだ。
Can it be true that he is ill?	彼が病気だというのは一体本当だろうか。
What he said counts for nothing.	彼が言ったことは全然重要ではない。
He was seen to enter the building.	彼が建物にはいるのが見られた。
I have no idea how he escaped.	彼がどうやって逃げたか全くわからない。
It was a sight to see him dance.	彼がダンスをする様子は見物だった。
The horse is a very useful animal.	馬はとても役に立つ動物である。
There is a man working on the farm.	農場で一人の男が働いている。
Don't stay in the sun too long.	日向にあまりながくいてはいけません。
The two men were drinking in a bar.	二人の男はバーで飲んでいた。
Animal bodies are made up of cells.	動物の体は細胞でできている。
Know yourself as well as your enemy.	敵を知り、自分自身も知れ。
My brother will often sit up all night.	弟はよく徹夜をする。
Do you mind if we cross your garden?	庭を通っても構いませんか。
Why don't you ask for a pay raise?	賃上げを要求したらどうですか。
The man walked around the corner.	男は角を曲がってあるいていった。
Don't give the secret away to anyone.	誰にも秘密をもらすなよ。
Who will take care of the baby?	誰がこの赤ちゃんを世話してくれるの。
A big rock rose out of the sea.	大きな岩が一つ海面から突き出ていた。
An option is now under consideration.	代替案を現在検討中です。
The sun gives us light and heat.	太陽は私達に光と熱を与えてくれる。
One should not speak ill of others.	他人を悪く言うのはよくない。
There were no people in the village.	村には誰も人がいなかった。
Give my thanks to your son.	息子さんに僕からありがとうと伝えてください。
The former is better than the latter.	前者より後者の方がいい。
The doctor had me lying in bed.	先生は横になっているように言われた。
I forgot that I met her last month.	先月彼女に会ったのを忘れた。
Do whatever you think is right.	正しいと思うことなら何でもしなさい。
The world is changing every minute.	世の中は刻々と変わっている。
Sleep is essential to health.	睡眠は健康に欠くことができないものです。
Life is, at best, a sea of troubles.	人生はせいぜい苦難の海だ。
Man is a social animal by nature.	人間は生まれつき社会的な動物だ。
There is no limit to human progress.	人間の進歩には限度がない。
A man's worth lies in what he is.	人間の価値はその人の人格にある。
There is no accounting for tastes.	人の好みは説明できないものだ。
Thank you for your kind letter.	親切なお手紙をくださってありがとう。
I'm sorry, but he is out now.	申し訳無いけど今あの子は出かけているの。
I thank you from the bottom of my heart.	心より感謝します。
The signal turned from red to green.	信号は赤から青に変わった。
You'd better not count on a raise.	昇給を当てにしないほうがよい。
The girl played the baby to her mother.	少女は母親に甘えた。
At least they should have a map.	少なくとも地図ぐらいはあるだろう。
Living on a small income is hard.	少ない収入で生活する事は難しい。
The girl came dancing toward me.	女の子は踊りながら私のほうに来た。
Books add to the pleasures of life.	書物は人生の楽しみを増やす。
Thank you for coming to meet me.	出迎えにきてくださってありがとう。
There is no accounting for tastes.	趣味は説明することができない。
You don't have to cover your mistake.	謝りを隠すことはないよ。
Don't be afraid to ask questions.	質問をする事を恐れてはいけない。
Don't be afraid to ask questions.	質問することを恐れてはいけない。
The question was discussed in detail.	質問が詳細に討議された。
Why don't you admit your mistake?	自分の過ちを認めてはどうですか。
Change trains at the next station.	次の駅で列車を乗り換えなさい。
The next station is where you get off.	次が君の降りる駅です。
We lost sight of Jim in the crowd.	私達は人込みでジムを見失った。
We all have our tasks to perform.	私達はみな果たすべき仕事がある。
None of us have been to Hawaii.	私達の誰もハワイへ行ったことがない。
Seeing me, the baby began to cry.	私を見てその赤ん坊は泣き出した。
I hit my head hard against the wall.	私は壁に強く頭をぶつけた。
I am afraid I have a touch of a cold.	私は風邪気味のようです。
I took a close shot of her face.	私は彼女の顔を近くから一枚撮った。
I forgot to give him the message.	私は彼に伝言するのを忘れました。
I saw him caught by the police.	私は彼が警察に捕まえられるのを見た。
I changed trains at Tokyo Station.	私は東京駅で電車を乗り換えた。
I am waiting for the store to open.	私は店が開くのを待っている。
I walked the length of the street.	私は通りを端から端まで歩いた。
I was hurt by many people.	私は多くの人達によって、気持ちを傷つけられた。
I didn't go to school last month.	私は先月学校に行きませんでした。
I want to travel all over the world.	世界中を旅行をしたいんだ。
I lost sight of her in the crowd.	私は人込みの中で彼女を見失った。
I heard a little girl crying.	私は小さな女の子がないているのを聞いた。
I like to sleep on a soft bed.	私は柔らかいベッドで眠るのが好きです。
I put my family before my career.	私は仕事より家庭のほうが大事だ。
I like to walk in the mountains.	私は山の中を歩くのが好きなんです。
I am now under a doctor's care.	私は今医者のやっかいになっています。
I am going to Hokkaido in the summer.	私は夏北海道に行きます。
I must pay a visit to the doctor.	私は医者に行かなければならない。
I wasted away to skin and bone.	私はやせ衰えて骨と皮ばかりになった。
I'm not in the least afraid of it.	私はそんな事が少しも恐くない。
I know nothing whatever about it.	私はそれについて全く知りません。
I'm going to attend the meeting.	私はその会議に出席するつもりです。
I've never woken up this early.	私はこんなに早く目覚めたことはない。
I am quite a stranger here.	私はこの土地は初めてで、まったく不案内です。
I returned to my home this spring.	私はこの春、故郷に戻ってきた。
I want to know about this mountain.	私はこの山について知りたい。
I go to the country every summer.	私はいつも夏はいなかへ行きます。
I like reading American novels.	私はアメリカの小説を読むのが好きだ。
I was asked to give you a message.	私はあなたへの伝言を頼まれた。
I can't eat or drink very hot things.	私はとても猫舌なんです。
My watch loses three minutes a day.	私の腕時計は日に３分遅れる。
My watch loses three minutes a week.	私の時計は週に３分遅れる。
My children really like animals.	私の子どもたちは動物が大好きです。
My sister is afraid of all doctors.	私の姉は医者をみんな怖がる。
My opinion is different from yours.	私の意見はあなたのとは違う。
What did you expect me to do?	私に何をしてほしいと思っていたのですか。
We expect him to come back soon.	私たちは彼がすぐ戻ってくると思う。
We got behind the car and pushed.	私たちは車の後ろに回って押した。
We sat speaking this and that.	私たちは座ってあれやこれやの話をした。
We'll cross the river in a boat.	私たちはボートでその川を渡ります。
We sat in the center of the room.	私たちはその部屋の中央に座った。
We are the students of this school.	私たちはこの学校の生徒です。
Our train leaves at eight-thirty.	私たちの列車は８時半に出発する。
I really like Jiro Akagawa's novels.	私、赤川次郎の小説大好き。
An idea is expressed in terms of action.	思想は行動に出る。
The children started in pairs.	子供らは二人一組になったスタートした。
The children were being very quiet.	子供たちはやけに静かだった。
My sister is cooking in the kitchen.	姉は台所で料理しています。
I'd like to find out my bank balance.	残高を知りたいのですが。
The judge sentenced him to a fine.	裁判官は彼に罰金を言い渡した。
The last train has already gone.	最終列車はすでに出発してしまった。
The final score was two to nothing.	最終スコアは２対０であった。
My vision is getting worse these days.	最近視力が落ちてきた。
Let's sit down and catch our breath.	座って、一息いれましょう。
It was cold in the summer of this year.	今年の夏は寒かった。
Today is the hottest day this year.	今日は今年になって一番暑い。
What is the most popular play now?	今、人気のある芝居は何ですか。
The people enjoyed a taste of freedom.	国民は自由を味わった。
What train is Mr Takase coming on?	高瀬さんは何時の電車で来るの？
You can take whatever you like.	好きなものは何でもとっていいですよ。
Drop me a line when you get there.	向こうに着いたら手紙を下さい。
The result was what I had expected.	結果は私が思った通りだった。
The police required him to appear.	警察は彼に出頭するよう命じた。
What time will you get to the station?	君は何時に駅に着くの。
Which party do you belong to?	君は、どちらの派に所属しているのですか。
I don't like your taste in color.	君の色に対する好みは感心しない。
Don't you have a sense of justice?	君には心配することが無いのか。
I saw something strange in the sky.	空に何か奇妙なものが見えた。
The rich are not always happy.	金持ちが必ずしも幸福であると限らない。
Spring will be here before long.	近いうちに春が当地に訪れるだろう。
You must work very hard on duty.	勤務中は一生懸命働かねばならない。
They say we're going to get high winds.	強風になるらしいよ。
Eating fish is good for your health.	魚を食べることは体にいい。
I'm very sorry about the mistake.	間違いを犯して申し訳ありません。
Don't be afraid of making mistakes.	間違いを恐れてはいけません。
The two of us don't belong here.	我々二人がここにいるのは不自然だ。
We regard the situation as serious.	我々は事態を重要視している。
We enjoyed our travels in Europe.	我々はヨーロッパの旅を楽しんだ。
All our effort ended in failure.	我々の努力はすべて失敗に終わった。
Our boat followed a school of fish.	我々の船は魚の群れを追った。
There is a garden in front of the house.	家の前に庭がある。
As the summer has come, so it will go.	夏は来たがやがて去る。
I was in London most of the summer.	夏の大半私はロンドンにいた。
We must prevent war at any cost.	何としても戦争は防がねばならない。
May I have something hot to drink?	何か熱い飲み物をもらえますか。
Something strange caught my eye.	何かおかしな物が私の目にとまった。
There is a bank in front of the station.	駅前に銀行がある。
It is not easy to master English.	英語を習得するのは容易ではない。
Our store hours are from 10 to 7.	営業時間は十時から七時までです。
The motorman slowed down the train.	運転士はスピードを落とした。
Doctors have a difficult problem.	医者は困難な問題を抱えています。
We made a contract with the firm.	わが社はあの会社と契約を結んだ。
A strange thing happened last night.	ゆうべ奇妙なことがあった。
If I got rich, I would buy it.	もし金持ちになったらそれを買うんだが。
Could you give me a few more minutes?	もう少し待ってください。
Everyone hoped that she would win.	みんな彼女が勝つことを望んだ。
Mayuko is dancing to the music.	マユコは音楽に合わせておどっている。
By and by Mt. Fuji came into sight.	まもなく富士山が見えてきた。
Who is heavier, Ben or Mike?	ベンとマイクではどちらの方が重いのですか。
Heavy sound is being looked for.	ヘヴィなサウンドが求められている。
Personal computers are of great use.	パソコンはとても役に立つ。
Why do you want to be a doctor?	なぜあなたは医者になりたいのですか。
It's an ill wind that blows no good.	どんな風も誰かの得になる。
What's the daily rate for a Toyota?	トヨタの１日あたりの料金は？
Tomoko almost started to cry.	トモコはもう少しで泣き出すところだった。
