Perfect!	完璧だ！
We broke off our conversation.	私たちは話をするのをやめた。
We usually eat cooked fish.	私たちは普通料理された魚を食べる。
We saw her enter the room.	私たちは彼女が部屋にはいるのをみた。
We may have made a mistake.	私たちは間違いをしたかもしれない。
We used to play in the park.	私たちはよく公園で遊んだものだ。
We watch it and laugh a lot.	私たちはそれを見て大笑いします。
We were surprised at the sight.	私たちはその光景に驚いた。
We soon caught up with them.	私たちはすぐに彼らに追いついた。
There is no end to our troubles.	私たちの悩みはつきない。
Our plan resulted in failure.	私たちの計画は失敗に終わった。
I'll do the shopping for you.	私が買い物をしてあげましょう。
Do I have to make a speech?	私が演説をしなければなりませんか。
He cried off at the last moment.	最後の最後に断ってきた。
He laughs best who laughs last.	最後に笑う者の笑いが最上。
Where is the nearest station?	最寄りの駅はどこにありますか。
Please give me a ring this evening.	今晩お電話下さい。
It's going to be another hot day.	今日も暑くなりそうだ。
I woke up at five this morning.	今朝は５時に目を覚ました。
You may play at your pleasure.	好きなように遊んでよろしい。
It is a short drive to the park.	公園までは車ですぐです。
Light and sound travel in waves.	光や音は波の形で伝わる。
Don't judge others by yourself.	己をもって他人を律するな。
The plan was being discussed.	計画は議論されているところだ。
I didn't mean to hurt you.	君を傷つけるつもりはなかったのです。
I'm certain of your success.	僕は君が成功すると確信している。
What time are you going on duty?	君は何時に勤務につくの？
Your guess is almost right.	君の考えは当たらずとも遠からずだ。
You are in part responsible for it.	君にも責任がある。
It's clear that you're wrong.	君が間違っている事は明らかだ。
It's clear that you're wrong.	君が間違っているのは明らかだ。
It's clear that you're wrong.	君が間違っていることは明白だ。
The sky was as clear as ever.	空は相変わらず晴れ渡っていた。
The sky is as blue as blue can be.	空はあくまでも青い。
Hard work is the price of success.	勤勉は成功の代価だ。
Thank you for the information.	教えていただいてありがとう。
I almost missed the train.	危なく電車に乗り遅れるところだった。
Spring will be here before long.	間もなく春がやってくる。
A student wants to see you.	学生がお会いしたいと言っています。
We have achieved all our aims.	我々は目的をすべて達成した。
We are a peace-loving nation.	我々は平和を愛する民族である。
We called upon him for a speech.	我々は彼に演説を頼んだ。
Could you carry my bags for me?	荷物を運んでもらえますか。
Science rests upon observation.	科学は観察に基づいている。
What time shall I pick you up?	何時に迎えに行きましょうか。
We just got to first base.	何とか足がかりをつかんだ程度ですよ。
Let's eat while the food is warm.	温かいうちに食べよう。
Imagine that you have a wife.	奥さんがいると仮定してごらん。
Shots were heard in the distance.	遠くに銃声が聞こえた。
I had to run to the station.	駅まで走らなければならなかった。
How far is it to the station?	駅まではどのくらいありますか。
How can I get to the station?	駅へはどういけばよいのですか。
The station is not far from here.	駅はここから遠くない。
A car passed by at top speed.	一台の車が全速力で通り過ぎた。
Won't you go shopping with me?	一緒に買い物に行きませんか。
Come along with me and go fishing.	一緒に釣りに行こう。
The party returned safe and sound.	一行は無事に戻った。
What he said really hurt me.	わたしはかれのことばに傷ついた。
Do you have any rock CDs?	ロックのＣＤはいくらか持っていますか。
Have you cleaned your room yet?	もう部屋を掃除しましたか。
I almost got a perfect score.	もう少しで満点がとれたのにな。
I'll try again, thank you.	もういちどかけ直します、ありがとう。
Mary is a very pretty girl.	メアリーはとてもかわいい少女です。
Mary told John the secret.	メアリーはジョンにその秘密を話した。
Mayuko argued for the plan.	マユコはその計画に賛成をとなえた。
Mayuko dreamed a strange dream.	マユコはおかしな夢をみた。
Dinner will be ready soon.	まもなく夕食の準備が出来るでしょう。
Look, here comes your train.	ほら、あなたの乗る電車が来たわ。
He managed to run the machine.	なんとかその機械を動かした。
Any house is better than none.	どんな家でもないよりはよい。
I can't thank you enough.	どんなに感謝しても十分とはいえません。
Tom thanked me for the gift.	トムは彼に贈り物のお礼を言った。
Tom and my secret came to light.	トムと僕の秘密が漏れた。
Tom and my secret came to light.	トムと僕の秘密がばれた。
Which team is likely to win?	どちらのチームが勝ちそうですか。
Give me your opinion, please.	どうぞ君の意見を言って下さい。
But I am able to cook well.	でも料理は上手に作ることができる。
But we're just on our way home.	でもこれから帰るところさ。
Dan bought a new computer.	ダンは新しいコンピューターを買った。
The chances are that he will win.	たぶん彼は勝つだろう。
Do not vary your plan so often.	そんなに計画を変更するな。
Don't raise my hopes like that.	そんなに気を持たせないで。
Those are not your chairs.	それらは君たちの椅子ではありません。
Please put those chairs away.	それらの椅子を片づけて下さい。
It was a great shock to me.	それは僕には大変なショックだった。
It's a waste of time and money.	それは時間とお金の浪費だ。
It was a great blow to us.	それは私達にとってひどい打撃だった。
It was none other than the king.	それは王その人であった。
The train has already left.	その列車はすでに出発してしまった。
The tree is four feet around.	その木は周囲が４フィートある。
The tree is four feet around.	その木の周囲は４フィートある。
Look at the sleeping baby.	その眠っている赤ちゃんを御覧なさい。
What is the title of the book?	その本のタイトルは何ですか。
All were quiet in the room.	その部屋ではみんな静かにしていた。
The secret will soon get out.	その秘密は直ぐにもれるだろう。
The box is too heavy to carry.	その箱は重たくて運べません。
Leave that box where it is.	その箱はそのままにしておきなさい。
The parking lot is free of charge.	その駐車場は無料だ。
The news was a blow to him.	その知らせは彼にとって打撃だった。
The news came out of the blue.	その知らせは突然やってきた。
The chest is three feet wide.	その大箱は幅が３フィートある。
The river flows down to the sea.	その川は流れて海に注ぐ。
The river was not so clean.	その川はあまりきれいではなかった。
The baby did nothing but cry.	その赤ん坊は泣いてばかりいた。
The boy sat among the girls.	その少年は少女たちの間に座った。
Who is the author of the novel?	その小説の作者は誰ですか。
I hit upon a good idea then.	その時私は良い考えを思い付いた。
The city has many broad streets.	その市には広い道が多い。
This child did nothing but cry.	その子はただ泣くばかりだ。
The issue is in the balance.	その件はまだはっきりしていない。
The money belongs to the company.	その金は会社のものだ。
The song caught on with the public.	その歌は流行した。
The doctor is a man of culture.	その医者は教養のある人だ。
There are such shops about.	そのような店はあちらこちらにある。
It's at the back of the building.	そのビルの後ろですよ。
I'm sorry to hear the news.	そのニュースを聞いて気の毒に思う。
How did the news get out?	そのニュースはどうして漏れたのだろう。
The sun was coming up then.	そのとき太陽がのぼるところだった。
I am very pleased at the news.	そのしらせでとてもうれしい。
I'd like to use a safe.	セーフティーボックスを利用したいのですが。
Sorry, I wish you wouldn't.	すみません、ご遠慮いただけますか。
Someone is hiding in the corner.	すみに誰かが隠れている。
All the villages were beautiful.	すべての村が美しかった。
A doctor was called in right away.	すぐに医者を呼んだ。
A doctor was sent for at once.	すぐに医者が呼びにやられた。
Mr Jordan woke up suddenly.	ジョーダンさんは突然目を覚ました。
But they never lose their way.	しかし彼らは道に迷いません。
This is a strange kind of fish.	これは珍しい種類の魚です。
This is a very strange letter.	これはとても奇妙な手紙です。
This book is missing two pages.	この本は２ページ足りない。
Put this sentence into English.	この文を英語に訳しなさい。
This story is worth reading.	この物語は読むだけの価値がある。
This road leads to the station.	この道を行くと駅に出ます。
Go straight along this street.	この道をまっすぐ行きなさい。
This news is important to us.	この知らせは私たちには重要だ。
What is the name of this river?	この川は何というのですか。
This building is made of stone.	この建物は石で出来ている。
Is there a hospital near here?	この近くに病院はありますか。
May I carry this bag on?	このバッグは機内に持ち込みたいんですが。
What is a cancer cell like?	ガン細胞とはどのようなものですか。
I can never thank you enough.	お礼の申し上げ様もありません。
I'm sorry to have kept you waiting.	お待たせしました。
Mr Wood came into the field.	ウッドさんが畑にやって来ました。
How soon are you going shopping?	いつ買い物に出かけるの？
When did you hear the news?	いつそのニュースを聞いたのですか。
Bring a couple more chairs.	いすをもう２、３脚持って来なさい。
In any case, I did my duty.	いずれにせよ、私は義務を果たした。
I can't bear the sight of him.	あんな男見ても胸くそが悪い。
That is a very complex machine.	あれはとても複雑な機械だ。
In a way, you're wrong.	ある意味であなたのいうことは間違っている。
Thanks, but no thanks.	ありがとうございます。でもご遠慮いたします。
Thank you. We'll do our best.	ありがとう。最善を尽くします。
Thank you, I've had enough.	ありがとう、充分にいただきました。
I came across him in that store.	あの店で彼に出くわした。
Those two really hit it off.	あの２人はとてもうまが合います。
I'm sorry, I can't help you.	あなたを助けられなくて残念です。
Be on your guard against her.	あなたは彼女には用心しなさい。
You believe him completely.	あなたは彼を完全に信用しています。
You must attend to your work.	あなたは仕事に精を出すべきだ。
You'd better see a doctor.	あなたは医者に見てもらった方がいい。
You are no longer a baby.	あなたはもう赤ちゃんじゃないんですよ。
I'll pick you up at your home.	あなたの家に迎えに行きます。
I missed school for six days.	６日間学校に行けませんでした。
I will pick you up around six.	６時ごろ車で迎えに行きます。
The average of 3, 4 and 5 is 4.	３と４と５の平均は４です。
I'm catching the 11:00 train.	１１時の列車に乗るつもりです。
The river runs through the town.	川が町の中を流れている。
Is Mr Sato good at literature?	里さんって文学が上手ですか。
I didn't eat dinner last night.	昨夜は夕飯を食べなかった。
I never imagined anything like this.	想定の範囲外だ。
Adults have dreams for the future.	大人が、未来に夢を持つ
X is required to achieve the goal.	Xが目的の達成に必要だ
The screen will go back to normal.	画面が通常の画面に戻る
The sun appears every now and then.	時々太陽が顔を見せる
Summer is around the corner.	そろそろ夏の足音が聞こえてきました
Men enjoy cooking with me/them.	男性が一緒に料理を楽しみます
What exactly does it mean?	それが具体的には何を意味するのだろうか
Future applications are expected.	今後の応用が期待されます
He will open a location in Kyoto.	彼が京都市に店舗を構える
He often gets left holding the bag.	彼がよく貧乏籤をひく
Nothing whatever is known of him.	杳として行方が知れない。
He may have missed the train.	列車に乗り遅れたのかもしれない。
We need a woman able in cooking.	料理のうまい女性が欲しい。
I hear you are good at cooking.	料理がお上手と聞いています。
How long will it be to dinner?	夕食までどれくらいありますか。
Some animals are active at night.	夜に活動する動物もいる。
The streets emptied in the night.	夜は人通りが無くなった。
A good idea suddenly struck her.	名案が突然彼女に浮かんだ。
I wake him at six every morning.	毎朝六時に彼を起こします。
We must do away with violence.	暴力は排除しなければならない。
The court sentenced him to death.	法廷は彼を死刑に処した。
Mother is setting dinner ready.	母は夕食の支度をしています。
How long does it take on foot?	歩いてどれくらいかかりますか。
Maybe you are working too hard.	勉強のし過ぎなんじゃないの。
Please take me to the hospital.	病院へ連れて行ってください。
Be sure to drop in at my house.	必ず私の家に立ち寄りなさい。
We'll fly there in 50 minutes.	飛行機で５０分で着くでしょう。
Her son makes life worth living.	彼女は息子が生きがいです。
She was in America last month.	彼女は先月アメリカにいました。
She contributed to the Red Cross.	彼女は赤十字に寄付した。
She left the baby crying.	彼女は赤ん坊を泣かせたままにしておいた。
She laid her baby on the bed.	彼女は赤ん坊をベッドに寝かせた。
She appears to have been rich.	彼女は昔金持ちであったらしい。
She is her own worst enemy.	彼女は自分に損なことばかりしている。
She revealed her secret to us.	彼女は私達に秘密を打ち明けた。
I'd rather she sat next to me.	彼女は私の横に座るほうがよい。
She is having dinner now.	彼女は今ディナーを食べているところです。
She laughed to cover her fear.	彼女は恐怖心を隠すため笑った。
She was afraid to travel alone.	彼女は一人旅が恐ろしかった。
Why did she go to the station?	彼女はなぜ駅に行ったのですか。
What did she buy at the shop?	彼女はその店で何を買いましたか。
She was encouraged by the news.	彼女はその知らせに力を得た。
She was surprised at the sight.	彼女はその光景におどろいた。
She put the machine in motion.	彼女はその機械を動かし始めた。
She always keeps the garden.	彼女はいつも庭の手入れをしている。
She was across in ten minutes.	彼女は１０分で反対側に着いた。
Her father has a general store.	彼女の父は雑貨店をしている。
Imagine yourself in her place.	彼女の身になって考えてごらん。
Her watch is ten minutes slow.	彼女の時計は１０分遅れている。
Her job brings in a high income.	彼女の仕事は高収入である。
Her house is across the river.	彼女の家は川の向こう側にある。
Her speech moved the audience.	彼女の演説は聴衆を感銘させた。
She has a son who is a doctor.	彼女には医者である息子がいる。
Tell me why she is crying.	彼女が泣いている理由を教えてください。
Their effort resulted in success.	彼らは努力して成功した。
They drove to the station by car.	彼らは駅まで車で行った。
They dropped out of their school.	彼らは、学校を中退した。
Their plan resulted in failure.	彼らの計画は失敗に終わった。
He will leave for Paris next month.	彼は来月パリに発つ。
He got a master's degree in law.	彼は法学修士の学位を得た。
He tried to bring about peace.	彼は平和をもたらす努力をした。
He acted as if he were ill.	彼は病人であるかのようにふるまった。
I am told that he is ill in bed.	彼は病気で寝ているそうだ。
He built the house for himself.	彼は独自で自分の家を建てた。
He picked up cans in the street.	彼は道で空き缶をひろった。
He'll not live to make old bones.	彼は長生きしないだろう。
He is by far the best student.	彼は誰よりも良く出きる生徒だ。
He argued away her concern.	彼は説得して彼女の不安を取り除いた。
He is a man of high social status.	彼は身分の高い人です。
He is working on a new novel.	彼は新しい小説に取り組んでいる。
He gave no further detail.	彼は詳しいことはそれ以上言わなかった。
He sat down to read a novel.	彼は小説を読むために腰を下ろした。
Did he admit that he was wrong?	彼は自分の非を認めましたか。
He answered my question easily.	彼は私の質問に易々と答えた。
He helped me to carry the bag.	彼は私のかばんを持ってくれた。
He'll go to the hospital today.	彼は今日病院へ行くつもりだ。
He didn't go, and neither did I.	彼は行かなかったし僕もだ。
He set fire to the school building.	彼は校舎に放火した。
He goes to London once a month.	彼は月に一度ロンドンにいく。
He's rich, but he isn't happy.	彼は金持ちだが、幸福ではない。
He majors in modern literature.	彼は近代文学を専攻している。
He is successful in everything.	彼は何をやってもうまくいく。
He majors in English literature.	彼は英文学を専攻している。
He carried six boxes at a time.	彼は一度に６個の箱を運んだ。
He likes to travel by himself.	彼は一人で旅行するのが好きだ。
He was given up on by the doctors.	彼は医者に見放された。
He was none other than the king.	彼はまさしく生きた王様だ。
He is a man of great importance.	彼はとても重要な人物です。
They say that he is very rich.	彼はとてもお金持ちだそうです。
He put the box on the table.	彼はその箱をテーブルの上に置いた。
He was master of the situation.	彼はその情況を把握していた。
He got the lady some water.	彼はその女性に水を持ってきてあげた。
He was successful in the attempt.	彼はその試みに成功した。
He was admitted to the school.	彼はその学校に入れてもらった。
He is the richest man on earth.	彼はこの世で一番の金持ちだ。
He keeps this gun loaded.	彼はこの銃に弾丸を込めたままにしている。
He came here ten minutes ago.	彼はここに１０分前にやってきた。
He is always kind to animals.	彼はいつも動物にはやさしくする。
He will leave by train at 6:30.	彼は６時半の列車で出発する。
Every other day he goes fishing.	彼は１日おきに釣りに行く。
He read the letter slowly.	彼は、その手紙をゆっくりと読みました。
What he said counts for nothing.	彼の言った事に意味はない。
Thanks to him, I could get a job.	彼のおかげで就職できた。
My attitude towards him changed.	彼に対する態度が変わった。
Let's wait until he wakes up.	彼が目を覚ますまで待ちましょう。
I led him to expect success.	彼が成功を期待するようにしむけた。
He is certain to win the game.	彼が試合で勝つのは確かである。
There came to Japan a foreigner.	日本へ１人の外国人がきた。
In Japan, we are paid by the month.	日本では、月給です。
It is getting warmer day by day.	日ごとに暖かくなっていく。
Which is the heavier of the two?	二つのうちどっちが重いの。
Suddenly I hit on a happy idea.	突然私は妙案を思い浮かべた。
Don't throw away cans on the street.	道に缶をすてるな。
A fallen tree blocked the path.	倒れた木が通り道をふさいだ。
The train headed for the station.	電車は駅に向かっていた。
I met her by chance on a train.	電車の中で偶然彼女に会った。
Will we be in time for the train?	電車に間に合うだろうか。
Would you like to leave a message?	伝言を承りましょうか。
Would you like to leave a message?	伝言をうけましょうか。
The shop is across from the bank.	店は銀行の向かいにある。
My brother paid double the price.	弟は値段の２倍を払った。
The garden is in front of the house.	庭は家の前にある。
All the houses in town were empty.	町のどの家も空っぽだ。
I was afraid I might be late.	遅刻するのではないかと心配した。
The boy threw a stone at the dog.	男の子が犬に石を投げた。
None can get away from death.	誰も死から逃れることはできない。
Who is going to sit in for you?	誰が君の代わりをするんだい。
Who bought a book at the shop?	誰がその店で本を買いましたか。
How will you travel to Osaka?	大阪にはどうやって行くんですか。
I helped Mommy in the kitchen.	台所でママのお手伝いをしたの。
Try to build up your strength.	体力を増やすように努めなさい。
Never speak ill of others.	他人のかげで悪口を言ってはなりません。
I was out of breath and sat down.	息を切らして座り込んだ。
A good person is a moral person.	善人とは道徳的な人である。
Do you want me to pay in advance?	前払いしてほしいですか。
Not to advance is to go back.	前進しないことは後退につながる。
The river flowed over its banks.	川が土手を越えてあふれた。
The baby's age is now two years.	赤ん坊の年は今は２歳です。
Babies are interesting to watch.	赤ちゃんは見ていて楽しい。
Please check the correct answer.	正解に印をつけてください。
Don't speak ill of him in public.	人前で彼の悪口を言うな。
Everyone laughed at the story.	人々は皆その話を聞いて笑った。
Don't judge people by appearance.	人を見かけで判断するな。
What forms do we need to file?	申告にはどの書類が必要ですか。
I'm sorry, but it's impossible.	申し訳ないけど、できません。
Sorry, but we're booked up.	申し訳ありません、全席予約済みです。
The new system proved a success.	新制度は成功だと分かった。
Every success in your new job.	新しい仕事がんばってください。
Don't wake up the sleeping child.	寝ている子供を起こすな。
The little girl just kept crying.	少女はただ、泣き続けた。
It will hurt a little, but not much.	少しだけ痛いです。
Let me know where you're staying.	宿泊先を教えてください。
It's heavy, but I can manage it.	重いけど、何とか運べます。
I've had enough, thank you.	十分頂きました、有り難うございます。
My husband is a very good cook.	主人は料理がとても上手です。
Young people like popular music.	若い人はポップスが好きだ。
Young people tend to think so.	若い人はそう考える傾向がある。
I signaled the car to go slow.	車に徐行するようにと合図した。
Correct the following sentences.	次の文の誤りを直しなさい。
I'll get off at the next station.	次の駅で降りるつもりだ。
Which judge heard the case?	事件を審議したのはどの裁判官ですか。
The event came about like this.	事件は、こんなふうに起きた。
We called on him for a speech.	私達は彼を講演のためによんだ。
We reached the top of the mountain.	私達は山頂に着いた。
I gave up my seat to an old lady.	私は老婦人に席を譲った。
I stopped and gazed at them.	私は立ち止まってそれらを見つめた。
I don't care for foreign food.	私は洋食はあまり好きではない。
I could not catch her words.	私は彼女の言葉が理解できなかった。
I can't bear to see her cry.	私は彼女がなくのを見ていられない。
I thought that he was a doctor.	私は彼が医者だと思いました。
I hear from him once a month.	私は彼から月に一度便りをもらう。
I work every day except Sunday.	私は日曜日のほかは毎日働く。
He can neither read nor write.	読むことも書くこともできない。
I like this scene in particular.	私は特にこの場面が好きだ。
I suggested that we go fishing.	私は釣りに行こうと提案した。
I changed my address last month.	私は先月、住所を変更した。
