Perfect!	完璧だ！
He has quite a few records.	彼はかなりたくさんのレコードを持っている。
He is always true to his friends.	彼はいつも友人に対して忠実だ。
He was always as good as his word.	彼はいつも約束を守っていた。
He doesn't always come late.	彼はいつも遅れてくるというわけではない。
He would have his own way.	彼はあくまで自分の思いどおりにやろうとした。
He is waiting for a telephone call.	彼は、電話がなるのを待つ。
I couldn't remember his name.	彼の名前を思い出すことが出来なかった。
His wish was to go to America.	彼の望みはアメリカへ行くことでした。
His political career has ended.	彼の政治家としての生涯は終わった。
Is there any hope of his success?	彼の成功の見込みはありますか。
His job has to do with telephones.	彼の職業は電話と関係がある。
Remember to answer his letter.	彼の手紙に返事を出すことを忘れるな。
His car has just been repaired.	彼の車は修理が終わったばかりです。
His office is on the eighth floor.	彼の事務所は８階にあります。
His house is across the street.	彼の家は通りの向こう側にあります。
I do not know anything about him.	彼のことはまったく知りません。
You have only to ask for his help.	彼に援助を求めるだけでいい。
I will have him repair this watch.	彼にこの時計を修理させよう。
I have nothing in common with him.	彼と私には共通点が何もない。
Who can guarantee his success?	彼が成功するとだれが保証できようか。
He is actually not the manager.	彼が支配人だというのは事実でない。
Sport has made him what he is.	彼が今日あるのはスポーツのおかげだ。
He is the man who drew the picture.	彼がその絵をかいた人です。
Don't put the cart before the horse.	馬車を馬の前につなぐな。
Don't put the cart before the horse.	馬の前に荷車を付けるな。
The farm owner has a large farm.	農園主は大きな農場を持っている。
Do I have to stay in the hospital?	入院しなければいけませんか。
Where in Japan did you grow up?	日本のどこであなたは育ちましたか。
There is nothing new under the sun.	日のもとに新しきものなし。
All at once we heard a shot outside.	突然外で銃声が聞こえた。
The same is true of the nation.	同じ事が国家についても当てはまる。
Efforts do not always pay off.	努力は必ずしも報われるものではない。
May I see the telephone directory?	電話帳をみせてもらえますか。
I want to have a telephone installed.	電話を引きたいのです。
Play out of doors on a fine day.	天気の良い日には外で遊びなさい。
My brother has been friendly to him.	弟は彼に優しくしてきた。
My brother is not yet in school.	弟はまだ、学校に行っていません。
There are stores along the street.	通りに沿って店が並んでいる。
The Chinese are a friendly people.	中国人はとても友好的ですよ。
Can you count to ten in Chinese?	中国語で10まで数えられますか？
Can you explain why you were late?	遅刻の理由を言ってください。
The earth is made up of sea and land.	地球は海と陸からなる。
Men make houses, women make homes.	男は家を造り女は家庭を作る。
I'll transfer you to the right person.	担当者とかわります。
No one respected men like him.	誰一人彼のような男を尊敬しなかった。
I'd like to run a big stock farm.	大きな牧場を経営してみたいな。
No one else can fill that job.	他にその仕事をこなせる人はいないよ。
Mr Hayakawa was respected by him.	早川先生は彼に尊敬されていた。
I've had just about enough of her.	全く彼女にはうんざりしたよ。
All the players were in position.	選手達はみな位置についていた。
The baby is looking for its mother.	赤ん坊は母親を探している。
Bring me a glass of water, please.	水を一杯持ってきてください。
When did man start to use tools?	人間はいつ道具を使い始めたのか。
A person is either male or female.	人は男か女のどちらかである。
One should love one's own mother.	人はその母親を愛すべきである。
I've been waiting for love to come.	心の傷を癒してくれる愛を。
Do you eat at home or eat out?	食事は家庭で食べますか、外食ですか。
The boy enjoyed painting a picture.	少年は絵を描いて楽しんだ。
All the boys spoke, each in turn.	少年達はみんな順にしゃべった。
Woods grow greener in the spring.	春になると森は青々としてくる。
Try to live within your income.	収入内で生活をするようにしなさい。
Try to live within your income.	収入ないで生活するようにしなさい。
My income has gone down by 10 percent.	収入が１０％減った。
Nothing is more important than time.	時間ほど大切な物はない。
The flight took us ten hours.	私達は飛行機に１０時間乗っていました。
We will do anything for you.	私達はあなたがたのためになんでもします。
Please take me along with you.	私もいっしょに連れて行ってください。
I've finished typing the report.	私は報告書のタイプを終えました。
I hear from my mother every month.	私は母から毎月便りをもらう。
I don't like the way she speaks.	私は彼女の話し方は好きではない。
I felt bad about picking on him.	私は彼をいじめたことを後悔した。
I am to pick him up at five.	私は彼を５時に車で迎えに行く予定である。
I was not interested in his life.	私は彼の生活に興味がなかった。
I'm looking over his report.	彼のレポートに目を通しているところです。
I don't like the way he speaks.	私は彼のしゃべり方が気に入らない。
I had my brother clean the room.	私は弟に部屋を掃除してもらった。
I was quite at a loss for words.	私は大変当惑し言葉がでなかった。
I'll buy a watch for my son.	私は息子に腕時計を買ってやるつもりです。
I got my room cleaned by my son.	私は息子に私の部屋を掃除させた。
I make it a rule to get up early.	私は早く起きることにしている。
I live an hour away from work.	私は職場から１時間の所に住んでいる。
I must have my car repaired.	私は車を修理してもらわなければならない。
I did not reach school in time.	私は時間までに学校に着かなかった。
I don't feel like going for a walk.	私は散歩に行く気など無い。
I graduated from Kyoto University.	私は京都大学を卒業しました。
I didn't see a doctor last year.	私は去年医者に行きませんでした。
I will pick him up at the station.	私は駅に彼を迎えに行きます。
I looked for the book for an hour.	私は一時間その本をさがした。
I shall will my money to a hospital.	私は遺産を病院に贈ろう。
I would walk along the river.	私はよくその川に沿って散歩したものだ。
I feel as if I were dreaming.	私はまるで夢を見ているような気がする。
I'm not able to speak so fast.	私はそんなに早く話すことができない。
I agreed with him on that point.	私はその点で彼と意見が一致した。
I know every inch of the town.	私はその町の隅から隅まで知っている。
I have nothing to do with the case.	私はその件とは関係はない。
I would like to carry out the plan.	私はその計画を実行したい。
I was the happiest man on earth.	私はこの世で一番の幸せ者でした。
I will act on your advice.	私はあなたの助言に従って行動するつもりです。
I have been studying for two hours.	私は２時間勉強しています。
I stopped listening to the radio.	私は、ラジオを聞くのをやめた。
I have nothing particular to do.	私は、やることは特にありません。
I will carry through the work.	私は、その仕事をやり遂げるでしょう。
Both my parents are quite well.	私の両親は二人ともとても元気です。
My mother looks young for her age.	私の母は年の割に若く見える。
My hair is longer than Jane's is.	私の髪はジェーンの髪より長い。
My hair is the longest in my class.	私の髪はクラスで一番長い。
You will do well to take my advice.	私の忠告を聞いた方がいい。
He looks older than my brother.	彼は私の兄よりも年が上に見えます。
A small stream runs by my house.	私の家の近くを小川が流れている。
Would you like to dance with me?	私と一緒に踊っていただけますか。
We keep three dogs and a cat.	私たちは犬を３匹と猫を１匹飼っている。
Let us give you a piece of advice.	私たちは君に一つ忠告したい。
We'll soon be happy, won't we?	私たちはもうじき幸福になるのですね。
We stood talking for half an hour.	私たちは３０分立ち話をした。
I think we can get along well.	私たち、うまくやっていけると思うの。
There was nothing left over.	残ったものはなにひとつありませんでした。
Kill me! Kill me! Kill all of me!	殺せ！殺せ！俺のすべてを殺せ！
He dropped in on me last night.	昨晩彼はひょっこり私を訪ねてきた。
The first attack missed the target.	最初の攻撃は目標を外れた。
It's time to move in for the kill.	最後のつめにはいるときです。
I haven't seen much of him recently.	最近彼とあまり会わない。
How about eating out this evening?	今夜外食するのはどうですか。
We had a very hot summer this year.	今年の夏はとても暑かった。
You may take anything you like.	好きな物を持っていってもよろしい。
I'm looking forward to your reply.	御返事を御待ちしております。
They won't be ready for another month.	後１ヶ月かかります。
You seem to be a little under the weather.	元気ないね。
No, thank you. I'm just looking.	結構です。ただ見ているだけです。
The police checked up on each car.	警官は車を１台１台検問した。
My brother died of cancer last year.	兄は昨年癌で死にました。
You should get your hair cut.	君は髪の毛を刈ってもらったほうがいい。
Are you not able to speak English?	君は英語を話せないのですか。
You will not take Bob's advice.	君はボブの忠告に従おうとはしない。
You are responsible for the result.	君はその結果に責任がある。
Your dream will come true some day.	君の夢はいつか実現するさ。
If only I had taken your advice.	君の忠告に従ってさえいればなあ。
Your shirt button is coming off.	君のシャツのボタンとれそうだよ。
I have no idea what you mean.	君のいわんとする事が僕にはわからない。
I will find you a good doctor.	君に良い医者を見つけてあげましょう。
It seems like there's no money left.	金が残っていないようだ。
I have not heard from her recently.	近ごろ彼女から便りがない。
Fish and red wine don't go together.	魚と赤ワインは合わない。
Last summer I traveled to Italy.	去年の夏私はイタリアへ旅行した。
The stock market has dropped today.	株式市場は今日、下落した。
Each country has its own customs.	各国にはそれぞれの習慣がある。
Learning a foreign language is fun.	外国語を学ぶことは楽しい。
Everyone looked on me as a leader.	皆が私をリーダーとみなした。
We must die sooner or later.	我々は遅かれ早かれ死ななければならない。
We must carry out that plan.	我々はその計画を実行しなければならない。
All the family set off on the trip.	家族全員が旅行にでかけた。
May I bring my family along?	家族もいっしょに連れてきてもいいですか。
My advice is for you to go home.	家に帰った方が良いと忠告します。
The summer had gone before I knew.	夏は知らない間に過ぎていた。
In doing anything, do your best.	何をするときでも全力でしなさい。
Do you have anything to talk about?	何か話すことがありますか。
A certain problem may come about.	何か問題が起こるかもしれない。
I sensed what was happening.	何が起こっているのか、私は気づいていた。
I sounded him out about his views.	遠まわしに彼の意見を探った。
The station is the middle of the city.	駅は市の中央にある。
Can you pick me up at the station?	駅に迎えに来てくれませんか。
The driver felt like taking a rest.	運転手は休みたい気がした。
The driver maintained a high speed.	運転者は高速を出し続けた。
Space travel is no longer a dream.	宇宙旅行はもはや夢ではない。
What on earth are you doing here?	一体全体君は何をしているんだ。
How on earth did you know that?	一体どうしてその事を知っていたの。
Hard work has brought him success.	一所懸命働いて彼は成功した。
Please draw water from the well.	井戸から水をくんできてください。
His doctor ordered him to rest.	医者は彼に休養するように命令した。
You should drive at a safe speed.	安全なスピードで運転すべきだ。
Yumi can't finish it in a day.	ユミは１日でそれを仕上げられません。
Do your best in anything you do.	やることには何でも全力を尽くせ。
Spanish is spoken in Mexico.	メキシコではスペイン語が話されています。
Mary stayed up late last night.	メアリーは昨夜遅くまで起きていた。
Mary is helping her mother.	メアリーはおかあさんの手伝いをしています。
I have not finished the task yet.	まだ、その仕事を終えていない。
Does Mike call his dog Pochi?	マイクは彼のイヌをポチと呼ぶのですか。
Please connect me with Dr. White.	ホワイト博士につないで下さい。
Bob reached the finish line first.	ボブは１着でゴールインした。
Almost no one believed her.	ほとんど誰も彼女の言うことを信じなかった。
Is the hotel close to the airport?	ホテルは空港に近いのですか。
The ball rolled across the road.	ボールは道の向こう側に転がった。
Bern is the capital of Switzerland.	ベルンはスイスの首都です。
The party was such a great success.	パーティーは大盛会だった。
Napoleon was a man of authority.	ナポレオンは権威がある男だった。
Give me something nice to drink.	なにかおいしい飲み物をください。
Why did you turn down his offer?	なぜ彼の申し出を断ったのですか。
The late Mr Smith was a doctor.	なくなったスミスさんは医者でした。
What kind of sport do you like?	どんな種類のスポーツが好きですか。
As it is, I can do nothing.	ところが実はどうすることもできないのです。
Oh, I don't know if I agree with you.	どうも賛成しかねます。
Why did you come home so late?	どうして帰りがこんなに遅くなったの。
There is a glass on the table.	テーブルの上にガラスのコップがある。
I wanted to do some telephoning.	ちょっと電話をかけたいと思った。
Takeshi carried on his hard work.	たけしは、つらい仕事を続けた。
What's the sense of working so hard?	そんなに働いて何になる。
I never heard anything like that.	そんなことは聞いたことがない。
It would break if you dropped it.	それは落としたら割れるだろう。
Is it made of wood or metal?	それは木製ですか、それとも金属製ですか。
It runs against his character.	それは彼の人格を阻害することになる。
Please have someone else do it.	それは誰か他の人にやらせて下さい。
That's what I said all along.	それは私が初めからいってきたことです。
That's what I said all along.	それは最初から僕が言っていたことです。
It is still in the testing stage.	それはまだ実験段階にあります。
It's an interesting piece of news.	それはおもしろいニュースだ。
I don't remember agreeing to that.	それに同意した覚えはないよ。
Do you have any ideas about it?	それについて何か考えがありますか。
The old man was loved by everyone.	その老人は皆に愛されていた。
The tree is green all year round.	その木は１年中青々としている。
Parts of the book are quite good.	その本は所々非常にすばらしい。
The lady came from a good family.	その婦人は良家の出身であった。
The store is open all the year round.	その店は年中無休です。
The man was no better than a horse.	その男は、馬同然であった。
The river runs through the valley.	その谷間には川が流れている。
Will there be anything else?	その他購入するものはありますでしょうか。
The ship stands in need of repairs.	その船は修理が必要である。
The boy drew a picture on the wall.	その少年は壁に絵を描いた。
The girl had flowing hair.	その少女はすらりとたれさがった髪をしていた。
The goods are advertised on TV.	その商品はテレビで宣伝されている。
The copy agrees with the original.	その写しは原本と合っている。
The facts became known to everyone.	その事実は皆に知れ渡った。
Don't force the child to eat.	その子に無理に食べさせてはいけません。
The work has been almost completed.	その仕事は大部分完成した。
Carrying out the plan was easy.	その計画を実行するのは容易だった。
How much is the whole package?	そのパッケージは全部でいくらですか。
I love music as well as sports.	スポーツだけでなく、音楽も好きだ。
The switch didn't work on time.	スイッチは時間通りに働かなかった。
John can't keep his family.	ジョンは自分の家族を養うことができません。
John can't speak French well.	ジョンはフランス語が上手に話せません。
Jack is three years senior to me.	ジャックは私より3つ年上です。
Jack may speak Spanish, too.	ジャックはスペイン語も話すかもしれない。
I'll give you anything but this.	これ以上のものは何でも君にやる。
This is the reason why I came late.	これが私が遅れた理由です。
Never be late for school again.	これからは二度と学校に遅刻するな。
Do I have to take this medicine?	この薬を飲まないといけませんか。
This medicine does not agree with me.	この薬は僕に合わない。
This book has a certain value.	この本にはある程度の価値はあります。
This method is of wide application.	この方法は適用範囲が広い。
This room is used as a kitchen.	この部屋は台所として使われている。
There is a television in this room.	この部屋にはテレビがある。
This box is light enough to carry.	この箱は持ち運べるほど軽い。
This cat is as big as that one.	この猫はあの猫と同じくらい大きい。
How long will this battery last?	この電池はどれくらいもちますか。
Go two blocks and turn left.	この通りを二つ目の角で左へ曲がりなさい。
Will you keep this seat for me?	この席を取っておいてくれませんか。
There is nothing new under the sun.	この世に新しいものはない。
This food does not agree with me.	この食べ物は私の体に合わない。
This food does not agree with me.	この食べ物は、私には合わない。
Can you cash this check for me?	この小切手を現金にしてくれますか。
This car is going 60km an hour.	この車は時速６０キロで走っている。
The lake is deepest at this point.	この湖はこの箇所が一番深い。
This building is off limits now.	この建物は、現在立ち入り禁止だ。
There is a military base near here.	この近くに軍の基地がある。
This rule applies to all cases.	この規則は全ての場合に当てはまる。
This rule applies to all cases.	この規則はどの場合にも当てはまる。
This rule applies to all cases.	この規則はどの場合でも当てはまる。
It is me that painted this picture.	この絵を描いたのは私です。
Are you going away this summer?	この夏休みはどこかへ行くのですか。
This message doesn't make sense.	このメッセージは意味をなさない。
What do you have in this bag?	このバッグの中には何が入っていますか。
The color of the shirt held fast.	このシャツは色が落ちなかった。
Who is responsible for this class?	このクラスの担任は誰ですか。
Kenya became independent in 1963.	ケニアは１９６３年に独立した。
The whole class passed the test.	クラス全員がその試験に合格した。
Do they speak French in Canada?	カナダではフランス語を話しますか。
Don't answer your mother back.	お母さんに口答えしてはいけませんよ。
I look forward to hearing from you.	お便りをお待ちしています。
I'm looking forward to your reply.	お返事を心待ちにしています。
Would you like something to drink?	お飲み物はどうなさいますか。
I don't want to hear you speak.	おまえらの声なんか聞きたくもない。
Amy made an effort to stand up.	エイミーは立ち上がろうと努力した。
What is the population of India?	インドの人口はどのくらいですか。
No more, thank you. I'm full.	いや結構です。たくさんいただきました。
When will you get ready to leave?	いつ出かける準備ができますか。
You can always ask for his help.	いつでも彼の援助を求められます。
That is the picture that he painted.	あれは彼が書いた絵です。
In a sense what he says is true.	ある意味で彼の言うことは本当だ。
In a sense, life is but a dream.	ある意味で、人生は夢にすぎない。
He doesn't seem to be an American.	アメリカ人ではないようです。
He's going to have a heart attack.	あの人心臓発作を起こすわよ。
Do you have anything to read?	あなたは何か読むものを持っていますか。
Can you think of anything else?	あなたは何かほかに思いつけますか。
What sport do you like best?	あなたはどんなスポーツが一番好きですか。
You have only to wait here.	あなたはここで待ってさえいればいいのです。
You speak like your mother.	あなたはお母さんみたいな喋り方をするのね。
When did you finish the work?	あなたはいつその作品を仕上げましたか。
Your answer doesn't make sense.	あなたの答えは答えになっていない。
Did your mother make those?	あなたのお母さんがそれらを作ったのですか。
Can your brother drive a car?	あなたのお兄さんは車を運転できますか。
I can't thank you enough.	あなたにはどんなに感謝しても感謝しきれません。
You can trust him with any job.	あいつに仕事を任せておけば安心だ。
I was late, so I missed flight 501.	５０１便に乗り遅れました。
Two years is a long time to wait.	２年とは、待つには長い時間だ。
Quite a few people have two cars.	２台の車をもつ人はかなり多い。
Flight 226 takes off at 10:30.	２２６便は１０時３０分に離陸します。
Down fell the house a week later.	１週間後に、その家は倒壊した。
I'll call you up again in an hour.	１時間後にまたお電話します。
This medicine has no side effects.	この薬に副作用はありません。
Can foreign students be in the club?	留学生も入れるのかしら。
He listened to music in his room.	彼は自分の部屋で音楽を聴いた。
I made a different choice from that.	それとは別の選択を私がする
He doesn't consider X to be a problem.	彼がXを問題にしません
He looks inside the shopping basket.	彼が買い物カゴの中身を見る
The product labels have been printed.	商品ラベルの印刷が出来た
X is considered one of the reasons.	Xが原因の１つに考えられます
Almost all of the users use 3G.	ほぼすべてのユーザーが３Ｇを利用する
X protected their own way of life.	Xが自分たちの生活を守りました
X made something happen inside him.	Xが原因で彼の身に何か起こる
All images are shown by default.	省略時にはすべての画像を表示します
He got an e-mail from someone.	彼がある人から一通のメールを貰いました
Each treatment method is different.	それぞれ治療の方法が違います
He's heading directly to her house.	彼がそのまま彼女の家に向かう
I listen to their music in the car.	私が車の中で彼らの音楽を聴く
You can enjoy fishing each season.	四季おりおりの釣りが楽しめます
That thought filled my mind again.	その思いが再び私の心を満たした
It would develop children's ability.	それが子どもの能力を育てる
I was happier about X than anything.	Xが私には何より嬉しかった
The couple had their third child.	夫婦に３人目の子供が生まれました
X is very popular among customers.	Xがお客様に大変喜ばれています
His classes are centered around X.	彼がXを学習活動の中心に据える
