Generally speaking, women live longer than men by almost ten years.	一般的に言えば、女性は男性よりほぼ１０年長生きする。
Generally speaking, women live longer than men.	一般的に言うと、女性は男性よりも長生きする。
Generally speaking, women live longer than men.	一般的に言えば、女性は男性よりも長生きしている。
Generally speaking, women live longer than men.	一般的に言って、女性は男性より長生きである。
Generally speaking, women live longer than men.	一般的に言って女性は男性よりも長く生きる。
Generally speaking, women live longer than men.	概して言えば、女性は男性より長生きだ。
Generally the Americans are a kind people.	概してアメリカ人は親切な国民である。
George calculated the cost of the trip.	ジョージは旅行の費用を計算した。
George encouraged Ellie to study hard again.	ジョージはエリーにもう一度懸命に勉強するよう励ました。
George failed in business.	ジョージは事業に失敗した。
George felt the train begin to move.	ジョージは、列車が動き出すのを感じた。
George is poor, but he's always happy.	ジョージは貧乏だがいつも幸せである。
George put a chain on the dog.	ジョージはその犬に鎖をつけた。
George set up as a merchant.	ジョージは商人として身を立てた。
George was laid off when his company cut back production last year.	昨年会社が生産調整をしたとき、ジョージは一時解雇された。
Get in touch with your agent right away.	すぐにあなたの代理人に連絡を取りなさい。
Get me a cup of coffee.	私にコーヒー１杯持ってきて下さい。
Get me the newspaper.	新聞を取って。
Get off at the next stop and take a bus headed to the airport.	次の停留所で下車し、空港行きのバスに乗りなさい。
Get on the bus in turn.	順番にバスに乗って下さい。
Get on the bus one by one.	１人ずつバスに乗りなさい。
Get out of here, and quickly.	ここから出ていけ。いますぐにだ。
Get ready in advance.	前もって準備しておけよ。
Get ready quickly.	早く用意して。
Get the meaning of a word from its context.	文の前後関係から単語の意味を知る。
Get up at once, or you will miss the 7:00 bus.	すぐ起きなさい、さもないと７時のバスに乗り遅れますよ。
Get up early in the morning.	朝早く起きなさいよ。
Get up fifteen minutes earlier in the morning.	朝１５分早く起きなさい。
Getting a sports car is easy, compared to the maintenance one must do on it.	維持することに比べれば、スポーツカーを持つことは簡単だ。
Getting to the bus stop, he found the bus had left.	バス停に着いた時、彼はバスがもう出てしまったことに気づいた。
Getting up late, I missed the bus.	遅く起きたので私はバスに乗れなかった。
Girls think much of fashion.	女の子はファッションを重んじる。
Give him a fair half.	彼にちゃんと半分分けてあげなさい。
Give me a coffee, please.	コーヒーを一杯下さい。
Give me a cup of coffee.	コーヒー一杯ください。
Give me a second chance.	もう一度チャンスをくれ。
Give me another chance to try.	もう１度やるチャンスを与えてください。
Give me another cup of coffee.	コーヒーをもういっぱいください。
Give me some coffee if there is any left.	コーヒーが残ってたら、少し下さい。
Give me something cold to drink.	私に何か冷たい飲み物を下さい。
Give me the details of it.	その内訳は？
Give me your attention, please.	御注目ください。
Give medicine to the patient right away.	患者にすぐ薬を飲ませなさい。
Give up on this one. You're wasting your time.	今回はあきらめな。しょうがないよ。
Give your argument against going.	行かない理由を述べなさい。
Give your whole attention to what you are doing.	あなたのやっていることによく注意を向けなさい。
Given a high level of bond issues, the cost to service them will increase.	国債発行が高水準なので、それらの元利支払コストが増加するだろう。
Given only thirty minutes, we couldn't answer all the questions.	３０分しかなかったので、私達はすべての問題には答えられなかった。
Glass breaks easily.	ガラスはすぐ割れる。
Glass breaks easily.	ガラスは壊れやすい。
Gloria, don't let him feed you that line about his wife not understanding him.	グローリア、奥さんが彼のことを理解してないなんていう彼の言葉を真に受けるようじゃだめだよ。
Go along this street about five minutes.	この道を５分行って下さい。
Go and see for yourself what has happened.	何がおこったのか、自分で行って確かめてよ。
Go and sit by your father.	お父さんのそばに座りなさい。
Go at once, otherwise you will be late.	すぐ行きなさい、そうでないと遅れるよ。
Go down the street for about five minutes, and you will see the department store to the right.	５分ばかりこの道を行けば、右手にその百貨店があります。
Go home quickly.	早く帰宅しろ。
Go jump in the lake.	離れて邪魔にならないようにする。
Go on running for thirty minutes.	３０分間走り続けなさい。
Go out and have a good time once in a while instead of just studying all the time.	終始勉強ばかりしていないで、たまには外出して楽しみなさい。
Go tell him yourself.	自分で話してこい。
Go to your respective seats.	各自席につきなさい。
Gold is far heavier than water.	金は水よりずっと重い。
Gold is heavier than silver.	金は銀より重い。
Golf is a waste of land in such a small country as Japan.	日本のように国土の狭い国では、ゴルフは土地の無駄遣いだ。
Good books are always worth reading.	良書はすべて読むに値する。
Good leather will wear for years.	よい皮は何年ももつものだ。
Good leather will wear for years.	良い革は何年ももつ。
Good morning, Mike.	おはよう、マイク。
Good morning, everyone.	皆さん、おはようございます。
Good words are worth much, and cost little.	良い言葉は多大の価値があるが、金はほとんどかからない。
Got the tools in my pocket.	道具はポケットに入れた。
Government ministers are certain to welcome such proposals.	大臣たちはきっとそのような提案を歓迎する。
Government spending is getting a little out of hand.	政府の支出は少し放漫に流れている。
Granting that it is true, it does not concern me.	それが事実であるとしても、私に関係ないことです。
Granting that the aim is right, how will you carry out the plan?	目的はよいとしても、どのようにその計画を実行するのか。
Great Britain is no longer in control of world politics.	英国はもはや世界政治を支配してはいない。
Great effort was one factor in his success.	大変な努力が彼の成功の一因であった。
Greek is difficult to learn.	ギリシャ語は覚えにくい。
Had it not been for his help, I should have failed.	彼の助けがなかったら、私は失敗したろう。
Half the class say that they drink coffee.	クラスの半数の生徒はコーヒーを飲む。
Half-forgotten music danced through his mind.	半分忘れかけた音楽が彼の心の中で踊りました。
Hanako came all the way from Hokkaido in order to see her father.	花子さんは父に会うために、はるばる北海道からやって来た。
Hanako has attended an American college for four years.	花子は４年間アメリカの大学に通っている。
Hand me the dictionary there, please.	そこの辞書をとってください。
Handle it with great care.	十分注意してそれを扱いなさい。
Handle with care.	取り扱いに十分注意しましょう
Happy is a man who lives in peace and content.	平和に満足している人は、幸せである。
Happy were the students who had such a good teacher.	そんないい先生を持った生徒たちは幸福だった。
Hard use has worn this bag.	よく使ったのでこのバッグは擦り切れた。
Has Father come home yet?	もうお父さんは帰ってきたの。
Has Flight 123 been delayed?	１２３便は遅れていますか。
Have a good weekend!	よい週末を！
Have a nice weekend!	良い週末を。
Have a nice weekend.	楽しい週末をね。
Have another cup.	もう１杯召し上がれ。
Have fun, but don't get lost.	楽しく遊んできなさい。でも道に迷わないように。
Have him wait a moment.	彼をちょっと待たせておいて下さい。
Have my eyes also started to fail?	儂の目もガタがきたかの。
Have some coffee?	コーヒー飲みますか。
Have you a dictionary today?	今日、辞書を持っていますか。
Have you ever been to that village?	君はあの村へ行ったことがありますか。
Have you ever heard that music played on the guitar?	その曲がギターで演奏されるのを聞いたことがありますか。
Have you ever learned how to play the guitar?	あなたはギターのひき方を習ったことがありますか。
Have you ever ridden a horse?	馬に乗ったことがありますか。
Have you ever seen Mt. Fuji? It is beautiful beyond description.	君、富士山を見たことあるかい。言葉では言い表せないほどの美しさだよ。
Have you ever subscribed to any English language newspaper?	あなたは英字新聞を定期購読したことがありますか。
Have you ever visited the office where your father works?	君はお父さんが働いている会社を訪れたことがあるかい。
Have you fed the dog yet?	もう犬に餌やった？
Have you fed the dog?	犬にえさをやりましたか。
Have you finished dressing?	服を着ましたか。
Have you got a cold now?	今風邪をひいているのですか。
Have you got over your cold yet?	もう風邪は治りましたか。
Have you learned cooking or anything?	料理か何か習ったりしましたか。
Have you lost weight?	体重減りましたか。
Have you lost your reason?	あなたは物事の分別がつかなくなったのか。
Have you lost your sense to say so?	そんなことを言うなんて気でも狂ったのか。
Have you lost your senses to say so?	そんなことを言うとは気でも狂ったのか。
Have you made much progress in English in America?	アメリカであなたの英語は上達しましたか。
Have you made progress in your studies?	研究ははかどりましたか。
Have you made sure the door is locked?	ドアに鍵がかかっていることを確かめましたか。
Have you made up your mind to become a teacher?	お前は教員になる決心をしたのか。
Have you taken your temperature?	熱をお計りになりましたか。
Have you visited the town where your father was born?	君はお父さんの生まれ故郷を訪ねたことがありますか。
Having a driver's license is an advantage for this job.	運転免許証を持っていると、この仕事には有利だ。
Having been living in New York for three years, he knows many good restaurants there.	彼はニューヨークに３年住んでいるので、そこのいいレストランをたくさん知っている。
Having failed many times, he never gave up the plan.	何度も失敗したけれども、彼は決してその計画をあきらめなかった。
Having failed several times, he tried to do it again.	何回も失敗したが、彼は再度やってみようとした。
Having finished his work, he telephoned his wife.	彼は仕事を終えてから、妻に電話をかけた。
Having graduated from college, she became a teacher.	大学を卒業した後、彼女は教師になった。
Having lost the game over and over again, he finally gave in.	何度も何度も負けたあとで、ついに彼は降参した。
Having nothing, nothing can he lose.	何も持っていないのだから、何も失うはずがない。
He abused our trust.	彼は我々の信頼を裏切った。
He abuses his authority.	彼は職権を乱用する。
He accepted her gift.	彼は彼女から贈り物を受け取った。
He accepted her gift.	彼は彼女の贈り物を受け取った。
He accepted my idea.	彼は私の意見を受け入れた。
He accepted my idea.	彼は私の考えを受け入れた。
He accepted my present.	彼は私のプレゼントを受け取ってくれた。
He accepted our offer.	彼は私たちの申し出を受け入れた。
He accepted the job.	彼はその仕事を引き受けてくれた。
He achieved great success in life.	彼は非常に出世した。
He achieved his aim at last.	彼はついに目的を果たした。
He achieved his purpose.	彼は目的を達成した。
He acted behind the manager's back.	支配人の背後で暗躍した。
He acted like a saint.	彼は聖者のようにふるまった。
He acted quickly and put out the fire.	彼は機敏に動いて火事を消し止めた。
He acts quickly.	彼は動作がはやい。
He advanced a new plan.	彼は新計画を提出した。
He aimed at the bird.	彼は小鳥を狙った。
He aims at X.	彼がXを目標とする
He aims at X.	彼がXを目的とする
He aims to become a driving services professional.	彼が運転サービスのプロを目指します
He always aims for improvement.	彼は常に上を目指します
He always forgets the time.	彼がついつい時間を忘れる
He always leaves the window open while he sleeps.	彼はいつも眠っている間、窓を開けたままにしておく。
He always left the problem of his children's education to his wife.	彼は自分の子供達の教育の問題を妻に任せきりだった。
He always remained poor.	彼は相変わらず貧乏だった。
He always sits up late at night.	彼はいつも夜更かしする。
He always speaks at random.	彼はいつも口からでまかせを言う。
He always takes his coffee strong.	彼はいつもコーヒーを濃くして飲む。
He always teaches from notes.	彼はいつも原稿を見ながら教える。
He always tells at random.	彼はいつもでまかせなことを言う。
He always values his wife's opinions.	彼はいつも奥さんの意見を尊重している。
He always wears blue shirts.	彼はいつも青いシャツをきている。
He always wears dark glasses.	彼はつねに黒眼鏡をかけている。
He always wears dark glasses.	彼は常に黒メガネをかけている。
He and I are pretty much the same build.	彼と私とはだいたい同じような体の造りです。
He and I are teachers.	彼と私は先生です。
He and his wife tried to work out their problems, but couldn't.	その夫婦は自分たち二人の問題を解決しようとしたがだめだった。
He answered all the questions in ten minutes.	彼は１０分で全部の問いの答えを出した。
He answered an advertisement in the paper and got the job.	彼は新聞の広告に応募して職を得た。
He answered in brief.	彼は手短に答えた。
He answered my question easily.	彼は私の質問に易々と答えた。
He answered my questions by the exercise of his excellent memory.	彼は優れた記憶力を発揮してわたしの質問に答えた。
He appealed to a higher court against the decision.	彼はその判決を不服として上級裁判所に上告した。
He appealed to lack of funds as a reason for the failure of his enterprise.	事業の失敗の理由として彼は資金不足をあげた。
He appealed to us for help.	彼は私たちに援助を求めた。
He applied for the job but was turned down on the spot.	彼は仕事に応募したがその場で断られた。
He applied the money to the payment of debts.	彼はその金を借金の返済に充てた。
He as good as accepted my offer.	彼は私の申し出を承諾したも同然である。
He as well as you is in the wrong.	あなたはもちろん彼も間違っている。
He asked his father to take him to the store.	彼は父に、その店へつれていってくれるように頼んだ。
He asked his teacher several questions.	彼は先生にいくつか質問をした。
He asked his wife if she was coming with him.	彼は妻に一緒にくるかどうかをたずねた。
He asked me if I had slept well the night before.	昨晩はぐっすりお休みになりましたか、と彼は私にたずねた。
He asked me if I knew his father.	彼は私に、彼の父を知っているかと尋ねた。
He asked me to keep him company on the weekends.	彼は私に週末には一緒にいてくれと頼んだ。
He asked me to keep him company on the weekends.	彼は週末を一緒に過ごそうと私に頼んだ。
He asked me what I expected.	彼は私に、私が期待しているとおりのことを尋ねた。
He asked questions at random.	彼は手当たりしだいに質問した。
He asked the first person he met near the village.	彼は村の近くで出会った最初の人にたずねました。
He assisted me with my business.	彼は私の仕事を助けてくれた。
He assumed that the train would be on time.	電車は時間通りに来るものだと彼は考えていた。
He ate all of the apple.	彼はそのりんごを全部食べた。
He attended the high school for three years without missing a single day or being late.	彼は高校３年間無遅刻無欠席だった。
He attended the meeting as our company representative.	彼はわが社の代表として会議に参加しました。
He attended the meeting for his father.	彼がおとうさんの代わりにその会合に出ました。
He attended the meeting in my place.	私の代わりに彼がその会合に出席した。
He attended the regular meeting that same day.	彼が同日、定期総会に出席した
He attended the scientific conference.	彼は学術会議に出席した。
He attended to his business.	彼は仕事に精を出した。
He attends the same school that I do.	彼は私が通っている同じ学校に通っている。
He avoided meeting her on the way.	彼は途中で彼女に会うのを避けた。
He avoids keeping company with those ladies.	彼はあの女性たちと付き合うのを避けている。
He bade me stay behind.	彼は私に後に残れと命じた。
He beat the dog with a stick.	彼は犬を棒でたたいた。
He became rich at the cost of his health.	彼は自分の健康を犠牲にして金持ちになりました。
He became rich.	彼は金持ちになった。
He became rich.	金持ちになった。
He believed in getting up early in the morning.	彼は早起きを信条にしていた。
He believed that the war was fought in the cause of justice.	彼はその戦争は正義のための戦争だと信じていた。
He blew the deal.	彼のおかげで取引がダメになった。
He bought a dress for her.	彼は彼女に服を買ってやった。
He bought books at random.	彼は手当たり次第本を買った。
He bought me a new dictionary.	彼は私に新しい辞書を買ってくれた。
He broke through many problems easily.	彼は多くの問題をたやすく切り抜けてしまった。
He brought off the difficult act quite easily.	彼はその難しい行為をごく簡単にやって退けた。
He brought pressure to bear on our decision.	彼は我々の決定に圧力をかけた。
He buys and sells leather goods.	彼は革製品の売買をしている。
He calculated the speed of light.	彼は光の速度を計算した。
He called in to say he could not attend the meeting.	彼は会に出席できないと電話を入れてきた。
He calls upon the government for an improvement. 	彼が国に改善を要望する
He came by bus.	彼はバスできました。
He came by car instead of by train.	彼は列車ではなく車できた。
He came close to losing an eye.	彼はあやうく片目を失明するところだった。
He came down with a cold and had to be away from work.	彼はかぜをひいて仕事を休まなければならなかった。
He came down with a cold.	彼は風邪でダウンした。
He came down with a cold.	彼は風邪にかかった。
He came early in the morning.	彼は朝早く来た。
He came forward as a candidate for Congress.	彼は議員に自分から進んで立候補した。
He came here ten minutes ago.	彼はここに１０分前にやってきた。
He came home earlier than I expected.	彼は思ったより早く帰ってきた。
He came home in high spirits.	彼は意気揚々と帰宅した。
He came home in high spirits.	彼は意気揚々と引き返した。
He came to see me on the morning of May 15.	彼は５月１５日の朝に私に会いに来た。
He can cook as well as his wife.	彼は奥さんに劣らず料理がうまい。
He can handle English well.	彼は上手に英語を使うことができる。
He can read English easily.	彼は楽に英語が読める。
He can ride a horse.	彼は乗馬ができる。
He can speak both Japanese and English with facility.	彼は日本語と英語の両方をたやすく話せる。
He can't attend the meeting in person, so I'm going for him.	彼は自分でその会議に出られないので、代わりに私が参ります。
He can't say anything to his father's face.	彼は父親の前では何もものが言えない。
He can't stick to anything very long.	彼は何事でも三日坊主だ。
He can't tell fact from fiction.	彼には事実と虚構の区別がつかない。
He can't tell right from wrong.	彼には善悪の区別がつかない。
He can't tell right from wrong.	彼は善悪の区別が付かない。
He carried a bag full of apples.	彼はリンゴを詰め込んだ袋を持っていた。
He carried on the restaurant in Italy for many years.	彼はイタリアで長年レストランを経営していた。
He carried out all his aims.	彼は自分の目的を全て達成した。
He carried out the plan he had made in detail.	彼は綿密に立てた計画を実行に移した。
He carried out the plan he had made in detail.	彼は緻密に立てた計画を実行した。
He cast his line into the lake.	彼は釣り糸を湖に投げた。
He cast off the problem from his mind.	彼はその問題を頭の中から放り出した。
He catches cold very easily.	彼は非常に風邪を引きやすい。
He caught her hand.	彼は彼女の手をつかまえた。
He caught hold of my hand.	彼は私の手をつかんだ。
He caught me by the hand.	彼は私の手を捕まえた。
He caught the ball with his left hand.	彼は左手でボールをキャッチした。
He caught the first train and got there just in time.	彼は始発列車に乗って、やっとそこに間に合った。
He caught the first train and got there just in time.	彼は始発列車に乗り、ちょうど間に合ってそこに着いた。
He caught three fish.	彼は魚を３匹釣った。
He changed trains at Sendai Station.	彼は仙台駅で列車を乗り換えた。
He chose a good wife.	彼はよい奥さんを選んだ。
He chose the wrong man to pick a fight with.	相手が悪かったな。
He chose to live in Tokyo instead of Osaka.	彼は大阪でなく東京に住む事にした。
He claimed his share of the profits.	彼は利益の分け前を要求した。
He co-operates with the city's policies.	彼が市の施策に協力する
He comes from England, but is very poor at English.	彼はイギリス生まれだが、英語がとても下手である。
He comes here without fail on Sunday.	彼は日曜日に必ずここへやって来る。
He comes home almost every weekend.	彼はたいてい毎週、週末に帰ってきます。
He comes to meet me sometimes.	彼は時々私に会いに来る。
He comes to school by bus or train.	彼はバスか電車で学校に来る。
He commented that the economy was likely to get better.	彼は景気は良くなりそうだと述べた。
He confirmed that something was wrong with his car.	彼は車の具合がおかしいことを確認した。
He confirms the following items.	彼が以下の事を確認する
He considers the safety of when it's used for sports and exercise.	彼が運動使用時の安全性を考慮する
He considers what it is like in winter and in summer.	彼が冬と夏の状況を考慮する
He contributed a lot of money to the hospital.	彼はその病院に多額の寄付をした。
He contributed much to the development of the economy.	彼は経済の発展に大きな貢献をした。
He contributed to the development to the city.	彼はその町の発展に貢献した。
He contributed to the good of the community.	彼は社会の福利のために貢献してくれた。
He could find her house easily.	彼はたやすく彼女の家を探すことが出来た。
He could no longer stand the pain.	痛くて我慢しきれなくなった。
He could not bear to see the scene.	彼はその光景を見るのに耐えられなかった。
He could not go on a trip for lack of money.	彼は金がないため旅行に行けなかった。
He could not sleep because of the heat.	暑くて彼は眠れなかった。
He could ski well when he was young.	彼は若いころスキーがうまかった。
He crossed the river in a small boat.	彼は小さなボートに乗ってその川を渡った。
