I want to reach the hotel before it gets dark.	暗くなる前にホテルに着きたい。
I want to ride a horse.	僕は馬に乗ってみたい。
I want to see you for a moment.	ちょっと会いたいのだけれど。
I want to sleep a little more.	もう少し眠りたい。
I want to sleep.	僕は寝たい。
I want to teach history when I grow up.	おとなになったら歴史を教えたい。
I want you to play the guitar for me.	私は君にギターを弾いてもらいたい。
I want you to put the room in order quickly.	部屋をいそいでかたづけてほしいの。
I want you to search high and low for a writer who's just right for this project. Leave no stone unturned.	この企画にぴったりのライタ？、草の根分けてでも探しだしてほしい。
I wanted the teacher to write a letter in English.	私は先生に英語で手紙を書いてもらいたかった。
I wanted to be a bus driver when I was five.	５歳の時は、バスの運転手になりたかった。
I wanted to catch the bird, but I found it too difficult.	私はその鳥を捕まえたかったが、それは無理だと分かった。
I wanted to go back to your village.	私はあなたの村に戻りたかった。
I was a little behind in my loan payments.	私はローンの支払いが少しとどこおっていた。
I was a rich man.	私は金持ちでした。
I was able to catch the last train.	終電に乗ることが出来た。
I was able to finish the work earlier than I had expected.	私は思ったより早く仕事を終わらせることができた。
I was about to leave home when an old friend of mine dropped in.	私が出かけようとした際、旧友が訪ねてきた。
I was active in politics when I was in the university.	私が大学にいたとき政治の活動をしていた。
I was all but dead at that time.	私はそのとき死んだも同然だった。
I was at a loss when I lost my house key.	私は家の鍵を失って途方にくれた。
I was at my best this morning.	私はけさ実に体の調子がよかった。
I was bidden to stay behind.	私は後に残るよう命ぜられた。
I was born and raised in Tokyo.	私は生まれも育ちも東京だ。
I was born and raised in the country.	田舎で生まれて育てられた。
I was caught in traffic.	渋滞にひっかかった。
I was expecting a letter from her.	私は彼女から手紙が来るかと待っていた。
I was expecting you at 11:00 a.m.	あなたが１１時に来るものと思っていました。
I was expecting you last night.	ゆうべはおいでになるかとお待ちしていました。
I was forced to accept her proposal.	わたしはやむなく彼女の申し出を受け入れさせられた。
I was given a computer game by my father.	私は父からコンピューターゲームがあたえられた。
I was given training in that school.	わたしはその学校で訓練された。
I was in good spirits.	私は上機嫌だった。
I was just in time for the last train.	きわどいところで終電に間に合った。
I was just in time for the last train.	僕は終電にすれすれのところで間に合った。
I was just in time for the last train.	私は終電にぎりぎりのところで間に合った。
I was late as a result of the train delay.	僕は電車が遅延したので遅刻した。
I was late as a result of the train delay.	私は電車が遅れたので遅刻した。
I was late because of heavy traffic.	交通渋滞のため、私は遅れました。
I was late for school this morning.	私は今朝学校に遅れました。
I was late for the last bus.	私は最終バスに遅れた。
I was late for the last train.	僕は終電車に乗り遅れた。
I was late for the last train.	終電に乗り遅れたんだよ。
I was late for the train.	私は電車に乗り遅れた。
I was leaving for Paris the next morning.	私は翌朝パリに向かう予定だった。
I was left out in the cold by everyone.	みんなで私をのけ者にした。
I was made to wait for over 30 minutes.	私は３０分以上もまたされた。
I was not as strong as my father.	私は私の父ほど強くなかった。
I was off duty at the time.	その時、私は勤務時間外だった。
I was on the spot when he had a heart attack.	彼が心臓発作を起こしたとき、私はその場にいた。
I was poor at English.	私は英語が不得意だった。
I was raised in Yokohama.	私は横浜で育った。
I was taken for a ride.	私はいっぱい食わされた。
I was taught English by a foreigner.	私は外国人に英語を教えてもらった。
I was ten minutes late for school.	私は学校に１０分遅刻した。
I was told to be ready to speak at a moment's notice.	私は予告なしに話すように言われた。
I was too happy to sleep.	私は幸福すぎて眠れなかった。
I was very poor in those days.	その頃、私は非常に貧乏だった。
I was waiting for the bus at that time.	私はそのバスを待っていた。
I was watching TV half sleeping.	夢うつつでテレビを見ていた。
I was wondering if I could take a vacation next week.	来週休みを取ってもよろしいでしょうか。
I was wondering if you could help me.	ひとつお手伝いいただけないでしょうか。
I was wondering if you could help us.	私たちを助けてくれませんか。
I was wondering if you'd let me stay with you for a few days.	しばらく君のとこに泊めてもらえないかなあ。
I was worn out because I had to take care of so many children.	あまりに多くの子供たちの世話で私は疲れてしまった。
I was wrong all along.	私は初めから間違っていた。
I was wrong all the same.	何といっても私がまちがっておりました。
I was wrong.	私が間違っていました。
I wasn't in time for school this morning.	私は今朝学校に間に合いませんでした。
I watched for the last chance.	私は最後のチャンスを待ち構えた。
I watched television instead of studying.	私は勉強するかわりにテレビを見た。
I will accept full responsibility for this.	これについては私がすべて責任を負います。
I will accept his request.	私は彼の要求を承諾するだろう。
I will accept the work, provided that you help me.	あなたが私を助けてくださるならば、その仕事を引き受けます。
I will answer for the failure.	私は失敗の責任はとります。
I will be back in less than five minutes.	５分とはかからないで戻ってきます。
I will be back to square one and have to take the classes over.	振り出しに戻ってその授業をまた取らなければならない。
I will be free in ten minutes.	あと１０分で手が空く。
I will be happy to attend your party.	あなたのパーティーに喜んで出席させていただきます。
I will be waiting for the bus at seven.	７時にバスを待つ事になっています。
I will call you without fail.	私は必ず君に電話するよ。
I will carry out my aims.	私は自分の目的の全てを達成するつもりだ。
I will come, time permitting.	もし時間があれば来ます。
I will come, weather permitting.	天気が許せば、私は行きます。
I will describe the course of treatment for each stage of the disease below.	以下に、病期ごとの治療方針を示します
I will discuss the question with you in detail.	あなたと詳しくその問題について議論しましょう。
I will do my duty to the best of my ability.	私は能力の限り職務を遂行します。
I will dry your T-shirt.	君のＴシャツを乾かしてあげましょう。
I will explain the reasons for the proposal one by one.	順次提案理由のご説明を申し上げます
I will find you your lost ring.	あなたのために紛失した指輪を探してあげましょう。
I will get in touch with him as soon as possible.	できるだけ早く彼と連絡をとりましょう。
I will get in touch with you next week.	来週連絡いたします。
I will get in touch with you.	いずれご連絡いたします。
I will give him another chance.	今度だけは許してやろう。
I will give you a ride in my car.	あなたを車に乗せて上げましょう。
I will give you permission to do it.	それをしてもよろしい。
I will give you ten minutes to work out this problem.	この問題を解くのに１０分あげよう。
I will go between you and your father.	ぼくは君と君のおとうさんとの中にはいってあげよう。
I will go on foot.	私は歩いて行きます。
I will go skiing in Hokkaido.	北海道にスキーに行く。
I will go to encourage him.	僕が彼を励ましに行こう。
I will go to see him instead of you.	あなたの代わりに私が彼に会いに行きます。
I will have him call you the moment he gets back.	戻りましたらすぐ電話させます。
I will have joined the ski tour five times when I join it again.	今度そのスキーツアーに参加したら、５回参加したことになります。
I will have obtained a driver's license by the end of the year.	年末までには運転免許を取得しているでしょう。
I will have spent all this money in three months.	３ヶ月もたてば、私はこの金をすっかり使ってしまっているでしょう。
I will have to take over Father's business in the future.	私は将来父の仕事の後を継がなければならないだろう。
I will let you know in advance.	私は前もってあなたに知らせる。
I will look it up in the dictionary.	私はそれを辞書で調べます。
I will lose weight.	私は必ず減量するつもりだ。
I will make some coffee.	コーヒーを作るわ。
I will make up for the lost time by studying as hard as I can.	出来るだけ一生懸命勉強することによって失った時間を取り返します。
I will make up for the lost time by working as hard as I can.	できるだけ勉強して、浪費した時間を取り戻すつもりです。
I will most likely choose him as our president.	私は多分彼を私達の会長に選びます。
I will never forget meeting that popular writer last year.	私は昨年あの人気作家にあったことを決して忘れないだろう。
I will never forget seeing you.	君に会ったことを私は決して忘れません。
I will never forget seeing you.	君に出会ったことを決して私は忘れません。
I will never forget the day when I first met him.	私は彼と初めて会った日のことを決して忘れません。
I will never ride in his car again.	私はもうあの人の車には乗りません
I will not attend the party.	私はそのパーティーに出席しません。
I will pay my debt as soon as possible.	出来るだけ早く借金は返済します。
I will play the guitar for you.	私はあなたにギターを弾いてあげましょう。
I will return to the house before dark.	暗くなる前に家に帰ろう。
I will send you a tape of my voice.	私の声のテープを送ります。
I will soon catch up with you.	私はすぐに君に追いつくであろう。
I will start, weather permitting.	天候が許せば、私は出発します。
I will teach you how to fish next Sunday.	来週の日曜日に釣りを教えてあげよう。
I will tell the teacher all about it.	先生にみんな言いつけてやるぞ。
I will tell you a secret.	君に秘密を打ち明けよう。
I will tell you about the winter event.	皆さんに冬のイベントを紹介します
I will try my best, whether I shall be successful or not.	成否に関わらず、私はできるだけのことをやってみます。
I will wire you when I get there.	着いたら電報で知らせるよ。
I will write him a civil answer.	彼に丁寧な返事を書くつもりです。
I wish I could buy that guitar.	あのギターが買えたらなあ。
I wish I could fly like a bird.	鳥のように空を飛べたらいいのになあ。
I wish I could make up for lost time.	遅れを取り戻す事ができればよいのに。
I wish I could show you the pretty ice on the trees.	きれいな樹氷を見せてあげたいものです。
I wish I could speak English the way my teacher does.	先生のように英語が話せたらなぁ。
I wish I had been a bird.	私が鳥だったらよかったのになあ。
I wish I had enough time to sleep.	睡眠時間が十分あればいいのに。
I wish I had not spent so much money.	あんなにお金を使わなければよかった。
I wish I had studied harder in my youth.	若いとき、もっと勉強しておけばよかったのになあ。
I wish I hadn't spent so much money.	あんなにたくさんお金を使わなければよかったなあ。
I wish I knew what is wrong with my car.	私の車のどこが故障しているかが分かればいいのになあ。
I wish I was dead.	死んでしまいたい！
I wish I were a bird.	ああ、私は鳥であればよいのに。
I wish I were a bird.	私が鳥であればなあ。
I wish I were a bird.	私が鳥であればよいのに。
I wish I were a bird.	私が鳥ならいいのになあ。
I wish I were a bird.	私が鳥になれたらなあ。
I wish I were a bird.	私は鳥であればいいのだがなあ。
I wish I were a bird.	鳥だったらよかったのになぁ。
I wish I were a bird.	鳥になりたいな。
I wish I were a stone.	自分が石であればいいのになあ。
I wish I were as rich as he.	私が彼と同じくらい金持ちだったらよいのだが。
I wish I were as smart as you are.	僕は君くらい利口だといいのだが。
I wish I were rich.	金持ちであればいいのに。
I wish he had attended the meeting.	彼が会議に出ていたらなぁ。
I wish my father had lived longer.	父がもっと長生きしていたらなあ。
I wish that we could spend more time together.	もっと一緒にいられたらいいのに。
I wish there was more variety in my work.	もっと仕事に変化があったならばなあ。
I wish to see my father.	ぼくは父に会いたい。
I wish to work in the laboratory some day.	いつかその研究所で働きたいものだ。
I wish you to go there instead.	かわりに君にそこへ行って欲しい。
I wish you to go there instead.	代わりに君にそこへ行ってほしい。
I wish you would take me to a restaurant for a change.	たまには私をレストランに連れて行ってくれるといいのだが。
I wish you would take me to a restaurant for a change.	気分転換にレストランに連れていってもらいたいのですが。
I won't leave you behind.	私はあなたを置き去りにはしない。
I won't pay any attention to someone like that.	そういう人を相手にしません
I wonder about X.	Xの方がどうかと思う
I wonder how it is when the web server uses cookies?	ウェブ・サーバーがクッキーを利用している場合はどうなるのでしょうか。
I wonder how many times I've come here with her.	彼女とここに来るのは何回目になるのだろう。
I wonder if a third world war will break out.	第３次世界大戦が起こるのかしら。
I wonder if anything happened to him.	彼の身に何かあったのだろうか。
I wonder if he can reserve the flight for me.	彼は私のためにその飛行機の予約をしてくれるだろうか。
I wonder if he enjoyed the last match.	彼は最後の試合をエンジョイしたんだろうか。
I wonder if he loves me.	彼は私を愛しているかしら。
I wonder if he will come.	彼は来るかしら。
I wonder if he's at home.	彼は在宅かしら。
I wonder if he's at home.	彼は在宅だろうか。
I wonder if it will be nice.	晴れるのかなあ？
I wonder if my brother will ever come back.	兄はいつか帰ってくるかしら。
I wonder if she is staying at that hotel.	彼女はあのホテルに泊まっているのかしら。
I wonder if someone could help me do this.	誰かこれを手伝っていただけませんか。
I wonder if that is the sort of thing you should do as a man.	そういうのは男として正しいことなんでしょうか。
I wonder if the first week or so of July is too early to go to the beach.	７月の上旬は、海に行くのは早いかな？
I wonder if the teacher works here.	先生はここで働いているのだろう。
I wonder if the weather will hold.	天気は持つかなあ。
I wonder if we could have the table over there.	あそこのテーブルに座れますか。
I wonder if what I wrote was correct.	私の書いたことが正しかったかしら。
I wonder if you can really try.	君は本当にやってみることができるかな。
I wonder if you could find some time to see me.	会っていただく時間はおありでしょうか。
I wonder if you could tell me if there is a post office in this area.	この近くに郵便局があったら教えてくださらないかしら。
I wonder if you have something to write with.	何か書くものを持っているかい。
I wonder if you have something to write with.	君は何か書くものを持っているかしら。
I wonder if you received my e-mail on January 10, since I have not heard anything from you yet.	あなたからご連絡がないので、１月１０日付であなた宛に出した電子メールは着いたのだろうかと思っています。
I wonder if you'd like to go out with me this Sunday.	次の日曜日ぼくとつき合ってもらえないかな。
I wonder what I should do today.	今日私は何をしたらよいだろう。
I wonder what ever will become of the child.	あの子は一体どうなってしまうのかしら。
I wonder what ever will become of them.	いったい彼らはどうなるのでしょう。
I wonder what happened to Paul.	ポールの身に何があったのかしら。
I wonder what happened to her.	彼女に何が起こったんだろう。
I wonder what happened to that lost child.	あの迷子の子供はどうなったのかしら。
I wonder what happened.	何が起こったんだろう。
I wonder what has become of her.	彼女はどうなったかしら。
I wonder what has become of her.	彼女はどうなったのだろうか。
I wonder what has become of him.	彼はどうなったのかしら。
I wonder what has become of the friend I used to go fishing with.	よく一緒に魚つりに行ったあの友人は、今どうなっているだろうか。
I wonder what has happened to her.	彼女に何か起こったのかな。
I wonder what has made him change his mind.	どうして彼は考えを変えたのかしら？
I wonder what he will say.	彼は何と言うかしら。
I wonder what it is like to travel through space.	宇宙旅行するってどんなものだろう。
I wonder what language they speak in Brazil.	ブラジルではどんな言葉を使うのだろう？
I wonder what she means by those words.	彼女の言葉の真意は何だろうか。
I wonder what they have in store for us under the big top?	何をやってみせてくれるのかしら？
I wonder what you were referring to.	あなたは何のことを言おうとしていたのかしら。
I wonder what's on her mind.	彼女は何を心配しているのだろう。
I wonder what's wrong with him. He keeps breaking his word these days.	彼どうしたのかしら。このところ約束を破りっぱなしだよ。
I wonder when Anne will come.	アンはいつ来るのかしら？
I wonder when Jane will come next time.	ジェーンは今度いつ来るのだろう。
I wonder when Jane will come next time.	私はジェーンが今度いつ来るか心配です。
I wonder when he will come next time.	彼は今度いつ来るのだろう。
I wonder when the Civil War started.	南北戦争はいつ始まったのかしら。
I wonder where I put my glasses.	私はどこにメガネを置いたのだろう。
I wonder where he has gone.	彼はどこへ行ったのかしら。
I wonder where he is hiding.	あいつどこに雲隠れしたのかな。
I wonder where he is now.	彼は今どこにいるのかしら。
I wonder where he is now.	彼は今どこに居るのか知らない。
I wonder where she has gone.	彼女はどこへ行ってしまったのかしら。
I wonder where she lives.	彼女は一体どこに住んでいるのかしら？
I wonder whether man could live with only two hours' sleep a night.	一晩にたった２時間寝るだけで、人間は生きていけるのかしら。
I wonder whether to write or phone.	手紙を書くか、電話をかけるか、どちらにしようか。
I wonder which of you will win.	君たちのどっちが勝つのだろう。
I wonder which train I should take for Tokyo.	東京行きはどの列車に乗ったらよいのかな。
I wonder which way is the shortest.	どちらの道が一番近いかしら。
I wonder which way to go.	どちらへ行けばよいのだろう。
I wonder who discovered it.	だれがそれを発見したのかと思う。
I wonder who has come.	誰が来たのかしら。
I wonder who she is.	彼女は誰かしら。
I wonder who that girl is.	あの女の子は誰だろう。
I wonder who the man over there may be.	向こうにおられる方はどなたかしら。
I wonder who they are.	あの人たちは誰だろう。
I wonder who.	誰かしら。
I wonder whose car this is.	これは誰の車かしら。
I wonder why John is always late for school.	ジョンはどうしていつも学校に遅れるのだろう？
I wonder why Tom didn't call me.	なんでトムは電話してくれなかったんだろう。
I wonder why he did not come to the party.	彼はなぜパーティーにこなかったのだろう。
I wonder why he is late.	彼の帰りの遅いのが気になる。
I wonder why she didn't tell him about it.	彼女はどうしてそのことを彼に話さなかったのだろう。
I wonder why they left my name off the list.	どうしてリストから私の名前を外したのかしら。
I wonder why women live longer than men.	女性が男性よりも長生きするのはなぜだろう。
I wonder why.	なぜなんだろう。
I wondered if I could do such a thing.	私は自分にそんな事ができるかしらと思った。
I wondered if I had ever really understood anyone.	私は一体、自分が本当に誰かを理解したことがあったのだろうか、と思った。
I wondered if her story was true.	彼女の話は本当かなと思った。
I work best under pressure.	僕は追い込まれると一番仕事をする。
I work every day except Sunday.	日曜日以外は働いています。
I work every day except Sunday.	私は日曜日のほかは毎日働く。
I work every morning in Central Park at 6 a.m.	私は毎朝６時に中央公園で仕事をします。
I work hard in the garden in the morning.	私は午前中、庭で熱心に働く。
I work hard to catch up with the class.	私は級友に追いつく為に一生懸命勉強する。
I work not so much for money as for the work itself.	僕は金のためというよりは仕事そのものが好きで働くのだ。
I worked as hard as I could so I didn't fail.	私は、失敗しないように、一生懸命働いた。
I would buy it, except that it costs too much.	そんな高くなかったら、買うのに。
I would buy the car, but I am poor.	貧しくなければ車を買うのに。
I would buy the car, but I am poor.	貧乏でなければその車を買うのだが。
I would have failed but for his help.	彼の助けがなかったら私は失敗しただろう。
I would have failed but for his kind help.	彼の親切な助けがなかったなら私は失敗していただろう。
I would have you apply yourself to your studies.	あなたには研究に専念していただきたいのです。
I would have you apply yourself to your study.	私はあなたにその研究に専念していただきたいのです。
I would like to attend the party on November 1st.	１１月１日のパーティーに参加します。
I would like to be an English teacher.	英語の教師になりたいのです。
I would like to confirm the following for our meeting at our office on February 27.	２月２７日の弊社でのミーティングについて下記のご確認させて下さい。
I would like to focus attention on the particular design that best represents Emmet's concept.	エメットのコンセプトをもっともよく表現しているデザインに特に焦点を当てたい。
I would like to have a cup of coffee.	コーヒーが１杯飲みたいのですが。
I would like to have another cup of coffee.	コーヒーをもう１杯いただきたい。
I would like to meet his father.	私は彼のお父さんに会いたいと思います。
I would like to purchase some boots.	ブーツを買いたいんですけど。
I would like to see the festival.	私はそのお祭りをみたいのですが。
I would like to see the trees from which you picked these apples.	あなたがこれらのりんごをもいだ木がみたいものだ。
I would like to thank you in advance for any help that you are able to give her.	彼女にご協力いただけますことについて、あらかじめお礼を申し上げます。
I would like to try this dress on.	私は試しにこの服を着てみたいわ。
I would like you to assist me with my gardening.	あなたに庭の手入れを手伝って頂きたいのですが。
