He'll be back by Monday morning at the latest.	彼は、遅くとも月曜の朝までには戻るでしょう。
He'll be back in a minute.	彼はすぐに帰ってきます。
He'll be here any moment.	彼は今にもここに来るでしょう。
He'll catch up with us in an hour.	彼は一時間で我々に追いつくだろう。
He'll catch up with us in an hour.	彼は１時間で追いつくだろう。
He'll come to see me without fail.	彼はきっと私のところへ来るでしょう。
He'll come to see me without fail.	彼は必ず会いに来るだろう。
He'll fail, unless he tries harder.	彼は、もっと一生懸命やらなければ失敗するだろう。
He'll know the secret sooner or later.	彼はいずれその秘密を知るでしょう。
He'll know the secret sooner or later.	彼は遅かれ早かれその秘密を知るでしょう。
He'll make a good lawyer sooner or later.	彼は遅かれ早かれ、よい弁護士になるでしょう。
He'll never achieve anything unless he works harder.	彼はもっと頑張らないと何も成し遂げられないだろう。
He'll probably win in the next election.	次の選挙では彼が当選するだろう。
He'll soon catch up with Tom.	彼はすぐにトムに追いつくでしょう。
He's a difficult person to deal with.	彼は付き合いにくい人だ。
He's a difficult person to deal with.	彼は気難しい人だ。
He's a student of Japanese literature.	彼は日本文学の研究者だ。
He's a student who I'm teaching English to this year.	彼は今年私が英語を教えている生徒なんだ。
He's a teacher and so am I.	彼は教師だ。そして私もそうである。
He's always on the go, from morning to night.	彼は一日中、いつも忙しい。
He's beating me, three to zip.	３対０で彼には負けています。
He's been taught to accept things as they are.	彼は物事をあるがままに受け入れなさいと教わってきた。
He's behind the times in his methods.	彼の方法は時代遅れだ。
He's beyond help.	彼は救い難い。
He's dry and unemotional.	彼はドライですからね。
He's eating an apple.	彼はりんごを食べています。
He's getting cold feet.	彼は怖じ気づいちゃっているよ。
He's good at fund raising.	彼は資金集めが上手い。
He's in debt to the bank because he bought that big house.	彼はあの大きな家を買ったので銀行に借金がある。
He's likely to be late so you'd better tell him again that the meeting time is seven to make double sure.	あいつまた待ち合わせの時間に遅れてくるかもしれないから、集合は７時だって駄目を押しておいてよ。
He's making a table in his workshop.	彼は仕事場でテーブルを作っているところだ。
He's no judge of music.	彼は音楽の良し悪しがわからない。
He's not cut out for teaching.	彼は先生に向いてない。
He's not cut out for teaching.	彼は教師に向いていない。
He's not rich or able.	彼は金持ちでも有能でもない。
He's not rich, but he's happy.	彼は金持ちではないが、とにかく幸福である。
He's out of his mind with pain.	彼は苦痛で頭がどうかなっている。
He's really in good shape.	彼は本当に調子がいい。
He's rich, but he isn't happy.	彼は金持ちだが、幸福ではない。
He's rich, but he isn't happy.	彼は金持ちだが幸せではない。
He's selling hot dogs to beat the band.	彼は一生懸命ホットドッグを売っている。
He's sitting in the waiting room.	彼は待合室に座っています。
He's sleeping like a baby.	彼は赤ん坊のように眠っています。
He's thought long and hard for this election. Very long and hard for the country he loves.	彼はこの選挙運動において長く熱心に戦い、愛する国のためにずっと長く、熱心に戦った。
He's three years older than my father.	彼は父より３つ年上です。
He's used to getting up early in the morning.	彼は朝早く起きるのになれている。
He's very fair-minded.	彼はフェアな人間だ。
He's waiting at the bus stop.	彼はバス停で待ってます。
He's working on the president's security detail.	彼は大統領警備隊の一員だ。
He/She calls out to people easily.	気軽にこえをかける
He/She is immaculately dressed.	清潔なものを身につけている
Hearing the news, he jumped out of his chair.	彼はその知らせを聞くといすから跳び降りた。
Heat changes ice into water.	熱は氷を水に変える。
Heat expands most things.	熱はたいていの物を膨張させる。
Heat turns ice into water.	熱によって氷は水に変わる。
Heavy industry always benefits from war.	重工業はいつも戦争で利益を得る。
Heavy sound is being looked for.	ヘヴィなサウンドが求められている。
Heavy taxes are laid on wine.	ワインに重税が課せられている。
Helen is more pretty than beautiful.	ヘレンは美しいというよりかわいい。
Help me move this stone.	この石を動かすのを手伝ってください。
Help yourself to a drink.	飲み物を自由にお取り下さい。
Help yourself to anything you like.	なんでもお好きなものをご自由にとって食べてください。
Help yourself to anything you like.	なんでもお好きなものをご自由に召し上がってください。
Help yourself to anything you like.	何でもお好きなものを召し上がって下さい。
Help yourself to anything you like.	何でも好きなものを召し上がって下さい。
Help yourself to anything you'd like to eat.	何でもご自由に召し上がってください。
Help yourself to more cookies.	もっとクッキーをどうぞ。
Help yourself to these cookies.	クッキーを召し上がれ。
Help yourself, please.	どうぞお上がりください。
Help yourself, please.	どうぞご自由に召しあがってください。
Help yourself.	ご自由にお取りください。
Hemingway had a poor writing style.	ヘミングウェイの文章は悪文だった。
Henry James was an American by birth.	ヘンリー・ジェイムズは生まれはアメリカ人だった。
Her aim in life is to become a movie star.	彼女の人生の目的は映画スターになることだ。
Her argument was not based on facts.	彼女の議論は事実に基づいていなかった。
Her attention is focused on children.	彼女の注意は子供たちに集中している。
Her beautiful dress drew my attention.	彼女の美しい服が私の注意を引いた。
Her beauty drew his attention.	彼女の美しさが彼の注意を引いた。
Her beauty was beyond description.	彼女の美しさは言葉では表現できないほどだった。
Her beauty was beyond description.	彼女の美しさは言葉では言い表せないほどだった。
Her bedroom is just above.	彼女の寝室はちょうどこの上です。
Her books sell pretty well.	彼女の本はかなりの売行きだ。
Her boots wear out much more quickly than mine.	彼女のブーツは私のものよりずっと早くだめになる。
Her death is a blow to my feelings.	彼女の死はぼくの気持ちには打撃です。
Her death was a great blow to him.	彼女の死は彼には大打撃だった。
Her debts amount to more than she can pay.	彼女の負債は支払い限度以上に達している。
Her doctor wants to refer her to a specialist.	彼女の主治医は彼女を専門家のほうに行かせた。
Her dream is to lead a life full of variety.	彼女は変化に富んだ生き方をするのが夢である。
Her dress has white spots on a blue background.	彼女のドレスは青い地に白の水玉模様がある。
Her dress looked cheap.	彼女のドレスは安物に見えた。
Her dress was made of very cheap material.	彼女の服はとても安っぽい生地でできていた。
Her duties include making copies of letters.	手紙のコピーをとるのも彼女の仕事だ。
Her election is in the bag.	彼女の当選は確実だ。
Her eyes rested on the young man reading newspaper.	彼女の視線は新聞を読んでいる若者にじっと向けられた。
Her face became pink.	彼女の顔が赤くなった。
Her face was not clear in the poor light.	薄暗い照明の中で、彼女の顔がはっきり見えなかった。
Her father has a general store.	彼女の父は雑貨店をしている。
Her father has a general store.	彼女の父は雑貨店を所有している。
Her father is Japanese.	彼女の父親は日本人だ。
Her father made her tell him everything.	彼女のお父さんは、彼女に何でも話させた。
Her father never let her go to town with her friends.	彼女の父親は決して彼女が友達と一緒に町に行くのを許さなかった。
Her father passed away last week.	彼女のお父さんは先週、お亡くなりになりました。
Her father works at the bank.	彼女の父は銀行で働いている。
Her hair was similar in color to mine.	彼女の髪は色が私のと似ていた。
Her hands were as cold as ice.	彼女の手は氷のように冷たかった。
Her health isn't equal to that heavy task.	彼女の健康ではそのつらい仕事に絶えられない。
Her house is at the foot of a mountain.	彼女の家は山のふもとにあります。
Her idea is very similar to mine.	彼女のアイデアは、私のアイデアとたいへん似ています。
Her ideas on education are very different from mine.	彼女の教育についての考えは私とは全く違います。
Her knowledge of French is greater than mine.	彼女のフランス語の知識は、私よりすぐれている。
Her lack of money kept her from going with me.	彼女はお金が無かったので私と行けなかった。
Her mind is at peace.	彼女の心は安らかだ。
Her mind would not accept that new idea.	彼女の心はその新しい考えを受け入れなかった。
Her mother made her a new dress.	彼女のお母さんは彼女に新しい服を作ってあげました。
Her mother's death was a blow to the little girl.	母親の死は少女にとって打撃であった。
Her name was referred to in the meeting.	彼女の名前が会議で出た。
Her only purpose in life was to get rich.	彼女の、人生のたった一つの目的は金持ちになることだった。
Her son makes life worth living.	彼女は息子が生きがいです。
Her story touched my heart.	彼女の話は私を感動させた。
Her success encouraged me to try the same thing.	彼女の成功で私も同じ事をやってみようという気になった。
Her voice began to rise as she spoke.	彼女は話しているうちに語気が強くなった。
Her voice was soft and beautiful.	彼女の声は優しく綺麗だった。
Her wish is to become a good teacher.	彼女の希望は良い教師になることです。
Here are two pencils: one is hard, and the other soft.	ここに鉛筆が二本ある。一本は堅く、もう一本は柔らかい。
Here comes a bus. We might as well take it.	さあ、バスが来たぞ。これに乗った方がよさそうだ。
Here comes our teacher, Robert Brown.	ロバートブラウン先生が来られました。
Here comes our teacher.	先生がいらっしゃったよ。
Here comes the bus!	ほらバスがきましたよ。
Here comes the bus.	さあバスが着いたぞ。
Here comes the bus.	バスが来ましたよ。
Here comes the train!	あ、汽車が来た。
Here comes the train.	さあ列車がきた。
Here comes the train.	ほら、列車が来る。
Here comes the train.	列車が入ってくるよ。
Here is a weekly magazine.	ここに週刊誌が１冊あります。
Here is the demand forecast for 1998.	１９９８年の需要予測です。
Here is your dog. Where is mine?	ここに君の犬がいる。ぼくの犬はどこにいるのか。
Here we are finally at the airport.	さあ、やっと空港に着いたぞ。
Here we took the boat for Alaska.	ここで私たちはアラスカ行きの船に乗った。
Here's the bus.	そらバスが来た。
High-rises are going up all over the place.	あたり一帯に超高層ビルが建っています。
Hiromi wears a new dress.	ヒロミは新しい洋服を着ている。
His English is coming along pretty well.	彼の英語はいい線いってるよ。
His action throughout was correct.	彼の行為は始めから終わりまで正しかった。
His actions run counter to his words.	彼の行為は言うこととは反対だ。
His advanced age prevents him from getting a job.	高齢の為に彼は就職できない。
His advice encouraged me to try it again.	彼のアドバイスのおかげで、私はもう一度やってみようという気になった。
His advice to us was that we should play fair.	私達への彼の助言は、正々堂々と勝負せよということであった。
His advice touched me to the quick.	彼の忠告が骨身に染みた。
His advice was very helpful.	彼の助言は非常に役に立った。
His advice was very helpful.	彼の忠告は非常に役立った。
His aim in life is to save money.	彼の人生の目的は貯金することだ。
His aim in life was to become a great doctor.	彼の人生の目的は名医になることだった。
His aim is to become a doctor.	彼の目標は医者になることだ。
His aim is to become a lawyer.	彼の目標は弁護士になることだ。
His answer came quickly.	すぐに彼から返事が来ました
His answer is different from mine.	彼の答えは私の答えと違っている。
His answer was to strike me on the head.	彼は口では答えず私の頭を殴りつけた。
His argument was based on facts.	彼の議論は事実に基づいたものだった。
His attempt ended in failure.	彼の企ては結局失敗に終わった。
His attempt proved to be a failure.	彼の企ては失敗に終わった。
His boat has been at sea for two hours.	彼の舟は２時間、海に出ている。
His brother goes to school by bus.	彼の兄さんはバスで学校へ行きます。
His brother goes to school by bus.	彼の兄はバスで学校に行きます。
His brother is more patient than he is.	彼の兄さんは彼よりも我慢強い。
His brother was lost in the town.	彼の弟は町で道に迷った。
His business resulted in heavy losses.	彼の商売は大損失に終わった。
His business returned a good profit.	彼の新事業はかなりの利益を得た。
His car has no wheels.	彼の車にはホイールがありません。
His car is gaining on us.	彼の車が我々に追いつきつつある。
His car is in fact worn out.	彼の車は、実際はがらくた同然だ。
His car is similar to mine.	彼の車は私のと似ている。
His car remained locked.	彼の車はかぎが掛けられたままになっていた。
His company was singled out as the most successful small business in the region.	彼の会社は地域におけるもっとも成功した小企業として特に選ばれた。
His condition is if only, better than in the morning.	彼の状態はどちらかといえば午前中よりもよくなっている。
His condition is, if anything, better than in the morning.	彼の状態は、どちらかといえば、午前中より良い。
His cooking is of the classic French style that he studied in France.	彼の料理はフランス仕込みの本格派だ。
His debts amount to $2,000.	彼の借金は総計２０００ドルにのぼる。
His debts amount to more than he can pay.	彼の負債は支払い限度以上に達している。
His debts amount to over $1000.	彼の借金の合計は１０００ドル以上になる。
His debts amount to over $1000.	彼の借金は合計１０００ドル以上になる。
His designs are highly original.	彼のデザインは大変独創的だ。
His dog appeared from behind the door.	彼の犬がドアの後ろから現れた。
His dream has finally come true.	彼の夢がついに叶った。
His effort contributed to my company's growth.	彼の努力は会社の成長に貢献した。
His effort contributed to success.	彼の努力が成功のもとになった。
His efforts resulted in failure.	彼の努力は失敗に終わった。
His efforts were attended with success.	彼は努力して成功した。
His eyes failed him.	彼は視力を失った。
His eyes fixed on her.	彼の目は、彼女にくぎ付けになった。
His eyes fixed on her.	彼の目は彼女にくぎ付けだ。
His eyes were heavy with sleep.	彼は眠くて瞼が重かった。
His face says that he lost.	彼が負けたことは顔つきでわかる。
His failure has nothing to do with me.	彼の失敗は私にはなんのかかわりもない。
His failure has nothing to do with me.	彼の失敗は私には何の関係もない。
His failure is out of the question.	彼の失敗は考えられない。
His failure led him to drink every night.	彼は失敗したため毎晩酒を飲むようになった。
His failure seems to have something to do with his character.	彼の失敗は性格と関係がありそうだ。
His failure seems to have something to do with his character.	彼の失敗は性格と関係がありそうだ。
His failure was the last thing that I expected.	彼の失敗は私が絶対に予想しなかったことである。
His family lacks for nothing.	彼の家族には何の不自由もない。
His family was poor, and poor people did not often hear music.	彼の家は貧しく、貧しい人々はあまり音楽を聞かなかったのです。
His farm is remote from any town.	彼の農場はどの町からも遠い。
His father allows him $10 a week as spending money.	父親は彼に小遣いを週１０ドル与えている。
His father always comes home late.	彼の父はいつも帰宅が遅い。
His father brought him up to be a doctor.	彼の父は彼に医者になる教育を受けさせた。
His father calls him Tom.	彼のお父さんは彼をトムと呼んでいる。
His father doesn't play golf.	彼のお父さんはゴルフをしません。
His father failed in business.	彼の父は事業に失敗した。
His father got records of bird songs for him.	彼の父親は彼に小鳥の歌のレコードを買ってやった。
His father had a good influence on him.	彼の父親は彼によい影響を与えた。
His father had asked the same question the year he was fourteen.	父は１４歳のときに同じ質問をしたことがあった。
His father had died of cancer 10 years ago.	彼の父親は１０年前にガンで死んでいた。
His father passed away last night in the hospital.	夕べお父さんが病院で死んだ。
His father passed away last night in the hospital.	昨夜、彼のお父さんが病院で亡くなった。
His grades took a big jump.	彼は成績が急に上がった。
His hair style is behind the time.	彼の髪型は時代遅れだ。
His hands had turned blue because of the cold.	彼の手は寒さで青白くなっていた。
His hands were deep in his pockets.	彼は両手をポケットに深く突っ込んでいた。
His heart beat fast at the news.	その知らせで彼はどきんとした。
His house is at the foot of Mt. Fuji.	彼の家は富士山の麓にある。
His house is at the foot of the hill.	彼の家は丘のふもとのある。
His house is beyond the hill.	彼の家は丘の向こうにある。
His house is on the other side of the bridge.	彼の家は橋の向こうにあります。
His house is three times larger than mine.	彼の家は私の家の３倍の大きさだ。
His idea is beyond the reach of my understanding.	彼のアイデアは私の理解を越えている。
His idea is very different from mine.	彼の考えは、私とはたいへんちがっている。
His ideas are difficult to understand.	彼の考えは理解しにくい。
His ideas are quite different from mine.	彼の考えは私のと全く違う。
His ideas do not fit in with mine.	彼の考えは私の考えと一致しない。
His ideas were far in advance of the age in which he lived.	彼の考え方は彼の生きていた時代より、はるかに進んでいた。
His ideas were in advance of his times.	彼の考えは時代の先を行っていた。
His income is larger than that of his wife.	彼の収入は彼の妻の収入より多い。
His income is three times larger than mine.	彼の収入は私の３倍だ。
His job is to promote sales.	彼の仕事は販売の促進です。
His job is to teach English.	彼の仕事は英語を教えることだ。
His knowledge of English is poor.	彼の英語の知識は貧弱である。
His knowledge of French is poor.	彼のフランス語の知識は未熟だ。
His knowledge of art is poor.	彼の美術の知識は貧弱だ。
His latest work is an advance on his previous one.	彼の最近作は前作に比べて進歩がある。
His latest work proved to be a great success.	彼の最新作は大ヒットした。
His latest works are on display at the square.	彼の最新の作品がその広場に展示されている。
His life was a long series of failures.	彼の生涯は長い失敗の連続だった。
His life was full of variety.	彼の一生は変化に富んだものだった。
His life was full of variety.	彼の人生は変化に富んでいた。
His love grew cold.	彼の愛は冷めていった。
His main object in life was to become rich.	彼の人生の主な目的は金持ちになることだった。
His methods are not scientific.	彼の方法は科学的ではない。
His mind kept running on his dead child.	彼の心は死んだ子から離れなかった。
His mind was at work on the new proposal.	彼の頭は新しい提案のことでいっぱいだった。
His mother is an English teacher.	彼のお母さんは英語の先生だ。
His mother sat up all night waiting for her son.	母親は一晩中起きて息子を待った。
His mother was a school teacher.	母親は教師であった。
His music and words appeal to young people.	彼の音楽と言葉は若者に受ける。
His music appeals to young people.	彼の音楽は若者に受ける。
His name is very difficult to remember.	彼の名前は覚えるのがとても難しい。
His name is very difficult to remember.	彼の名前を覚えるのがとても難しい。
His name will soon be forgotten.	彼の名前はまもなく忘れられるだろう。
His new film is worth seeing.	彼の新作映画は見るだけの価値がある。
His office is very close to mine.	彼の会社は私の会社のつい目と鼻の先にある。
His old clunker isn't worth anything.	彼の古い車じゃ、一銭にもならないよ。
His opinion is different from mine.	彼の意見は私のと違う。
His opinion is for the birds.	彼の意見はくだらない。
His opinion is generally correct.	彼の意見は大体において正しい。
His opinion was not accepted.	彼の意見は受け入れられなかった。
His opinion will probably be accepted.	彼の意見は多分通るだろう。
His opinions aren't worth listening to.	彼の意見は聞くに値しない。
His oral agreement may not mean anything without his signed contract.	彼が署名した契約書がなければ、彼の口頭での同意は何の意味もないだろう。
His parents expect too much of him.	彼の両親は彼に期待し過ぎている。
His parents were too poor to send their son to college.	彼の両親はたいへん貧乏だったので、むすこを大学にやれなかった。
His picture got accepted.	彼の絵が入選した。
His picture was in the newspaper.	彼の写真が新聞に載っていた。
His plan is to build a bridge over that river.	彼の計画は、その川に橋を架けることです。
His policy was in advance of his times.	彼の政策は時代に先んじていた。
His poor grades may come from lack of study.	彼の悪い成績は勉強不足の結果かも知れない。
His powers are failing.	彼の体力は衰えてきた。
His project ended in failure.	彼の計画は失敗に終わった。
His proposal counted for nothing.	彼の提案はまったく価値がなかった。
His proposal has been watered down.	彼の提案は骨抜きになった。
His proposal is not worth talking about.	彼の提案は話にとりあげるほどのこともない。
His proposal is not worth talking about.	彼の提案は話にならない。
His proposal is out of the question.	君の提案は問題外だ。
His proposal is out of the question.	彼の意見は問題外だ。
His proposal is out of the question.	彼の提案は問題にならない。
His proposal is out of the question.	彼の提案は問題外だ。
His proposal was out of the question.	彼の提案は全く問題にならなかった。
His proposals did not fit in with our aims.	彼の提案は我々の目的に合わなかった。
His raised his spirits back up quickly.	彼がすぐに気を取り直した
His secret life came to light at last.	彼の秘密の生活がとうとう明るみに出てしまった。
His secretary can speak three languages well.	彼の秘書は３カ国語が上手に話せる。
His son wants to be a lawyer.	彼の息子は弁護士になりたがっている。
His son was lost in the town.	彼の息子は町で迷った。
His son was lost in the town.	彼の息子は街で道に迷った。
His story is highly colored.	彼の話はそうとう大袈裟だ。
His story is well worth listening to.	彼の話は聞くだけの価値が十分ある。
