I agree.	同感です。
You had better stop smoking.	あなたはタバコを止めた方が良い。
He won't do you any harm.	あなたに危害を加えることはありません。
I'm very glad to see you.	あなたにお目にかかれて私は大変嬉しい。
Who is taller, you or Ken?	あなたと健とどちらが背が高いですか。
I don't mind your smoking.	あなたがたばこを吸ってもかまわない。
Look! There's a plane taking off.	ああ飛行機が離陸する。
It rained for three days on end.	３日間続いて雨が降った。
It kept on raining for a week.	１週間も雨が降り続きました。
Don't rely too much on others.	あまり人を頼ってはいけない。
I still feel I lack skills.	私はまだまだ自分の技術不足を感じます
There is definitely something wrong.	やっぱり何かが違う
I have broken off our engagement.	私は婚約を解消しました。
Tears were rolling down her cheek.	涙が彼女の頬に流れた。
Tears ran down Alice's cheeks.	涙がアリスのほほを流れ落ちた。
I'm very glad to see you again.	又お会いできてうれしいです。
Translation is by no means easy.	翻訳は決して容易ではない。
These are truly the best products.	本当に最高の商品です。
I parted from my friend in anger.	僕は友達と喧嘩別れした。
I agree with him on that point.	僕はその点で彼と意見が合う。
My mother didn't mention it.	母はそのことについてふれなかった。
Prices ought to come down soon.	物価はまもなく下がるはずだ。
The room was packed with people.	部屋は人でいっぱいだった。
We had to write off the debt.	負債は帳消しにするしかなかった。
Father does not eat much fruit.	父はそんなに果物を食べない。
Please come in an ordinary dress.	普段着でおいでください。
Mt. Fuji was above the clouds.	富士山は雲の上にそびえていた。
It's so nice to be by ourselves.	夫婦水入らずが気楽でいい。
The plane flew out of sight.	飛行機は飛び去って見えなくなった。
The plane flew over the mountain.	飛行機は山の上を飛んだ。
She maintained a calm manner.	彼女は落ち着いた態度に終始した。
She will not stick to her word.	彼女は約束を守らないだろう。
She shot a glance at her mother.	彼女は母親をちらっと見た。
She shut herself up in her room.	彼女は部屋に閉じこもった。
She's a beauty from a distance.	彼女は美人だ遠くから見ると。
She made a new suit for him.	彼女は彼にスーツを新調してやった。
She found a ball in the garden.	彼女は庭でボールを見つけた。
She prayed for her son's return.	彼女は息子の帰還を祈った。
She bought me a nice coat.	彼女は素敵なコートを買ってくれました。
She set off on a trip last week.	彼女は先週旅行に出発した。
She set off on a trip last week.	彼女は先週旅行に出かけた。
She keeps her youth very well.	彼女は若さを十分に持っている。
She is afraid of her own shadow.	彼女は自分の影におびえる。
I found her in tears in her room.	彼女は自室で泣いていた。
She served us a good meal.	彼女は私たちによい食事を出してくれた。
She got angry about my talk.	彼女は私が言ったことで腹を立てた。
She called me in the afternoon.	彼女は午後に私に電話をした。
She is engaged in social work.	彼女は社会福祉に携わっている。
Has she finished her work yet?	彼女はもう仕事を終えましたか。
She was doing the washing then.	彼女はその時洗濯をしていた。
She won't be back till five.	彼女は５時まで戻って来ないだろう。
You should not make fun of him.	彼をからかってはいけません。
They have access to the library.	彼らは図書館を利用できる。
They are much taller than us.	彼らは私たちよりずっと背が高い。
They stood on the top of the hill.	彼らは丘の上に立った。
They are more emotional than we.	彼らは我々よりも感情的だ。
He treated himself to a new car.	彼は奮発して新車を買った。
He is also very famous in Japan.	彼は日本でもとても有名だ。
He was silent for quite a while.	彼は長い間、だまっていた。
He is taller than any other boy.	彼は他の少年より背が高い。
He is engaged upon a new novel.	彼は新しい小説を書いている。
He wants to engage in business.	彼は商売をやりたがっている。
He loved and helped weak people.	彼は弱い者を愛し、助けた。
He sometimes says nice things.	彼は時々気の利いたことを言う。
He tried solving the problem.	彼は試しにその問題を解いてみた。
He struck at me with a stick.	彼は私にステッキで殴りかかった。
He has taken to drinking recently.	彼は最近飲みはじめた。
Modern music is familiar to him.	彼は現代音楽に通じている。
He is the chief of a police station.	彼は警察署長です。
He stopped smoking last year.	彼は去年たばこを吸うのをやめた。
He doesn't care for sweet things.	彼は甘いものを好まない。
He was beside himself with joy.	彼は楽しみで我を忘れている。
He is engaged in foreign trade.	彼は外国貿易に従事している。
He pocketed the company's money.	彼は会社の金に手をつけた。
He lives in that yellow house.	彼は黄色いあの家に住んでいる。
He neither smokes nor drinks.	彼は煙草も吸わず、酒も飲まない。
He is ahead of us in English.	彼は英語では私達より進んでいる。
He made a sharp turn to the right.	彼は右に急カーブした。
He tried hard, but he failed.	彼は一生懸命やったが、失敗した。
He tried hard, but failed.	彼は一生懸命にやってみたが、失敗した。
He's been grounded for a week.	彼は一週間、外出を禁止された。
He would often go to the hill.	彼はよくその丘へ行ったものだ。
He still has three servants.	彼はまだ召し使いを三人おいている。
He has a background in business.	彼はビジネスの経歴がある。
He was every inch a king.	彼はどこから見ても申し分のない王でした。
He supported himself with a stick.	彼はつえで体を支えた。
He is not much of an artist.	彼はたいして立派な芸術家ではない。
He is familiar with the topic.	彼はその話題によく通じている。
He saved money for the trip.	彼はその旅行のためにお金を貯めた。
He always teaches from notes.	彼はいつも原稿を見ながら教える。
He is the tallest of the three.	彼は３人の中で一番背が高い。
He has a straight-A report card.	彼の通信簿はオールＡだよ。
I could hardly believe him.	彼の言うことはとても信じがたかった。
I will wait here till he comes.	彼が来るまでここで待ちます。
It's natural for him to get angry.	彼が怒るのも当然です。
The horse is a domestic animal.	馬は飼い慣らされた動物です。
Rainforests should be preserved.	熱帯雨林は残されるべきだ。
Japanese eat three meals a day.	日本人は一日３回食事します。
The road goes north from here.	道路はここから北へ延びている。
There are many bridges in this city.	当市には橋が多い。
May I introduce Mr. Tanaka to you?	田中氏をご紹介します。
I can wait to love in heaven.	天国で愛しあえるまで待ってるよ。
No one can operate this machine.	誰もこの機械を動かせない。
Tears rolled down her cheeks.	大粒の涙が彼女の頬を流れ落ちた。
Would you please shut the window?	窓をしめてくれませんか。
We agreed on an early start.	早く出発することに意見が一致した。
He is just an ordinary person.	全くありふれた人間にすぎない。
The ship is bearing due north.	船はまっすぐ北に向かっている。
Go and help wash up, will you?	洗い物を手伝いに行って下さい。
We had a lot of rain last month.	先月はたくさん雨が降った。
I want to ask you a big favor.	折り入って頼みたいことがある。
It rained for several days on end.	数日間雨が降り続いた。
Truth is more important than beauty.	真は美よりも高し。
It is your shadow in the deep sea.	深海で君の影がゆれる。
A new topic came up in conversation.	新しい話題が出た。
I'm cooked meals by my mother.	食事は母に作ってもらっている。
Take time to eat your meals.	食事はゆっくりとるようにしなさい。
Something is flashing up ahead.	上部前方で何かが光っている。
Please call the fire department.	消防署に連絡してください。
Hot tears ran down her cheeks.	熱い涙が彼女のほほを伝わった。
The supply-demand balance is tight.	需要関係がタイトだ。
Did you really fly the plane?	実際に飛行機を操縦したのですか。
Don't leave your stuff behind.	自分の持ち物を忘れないように。
Solve this problem on your own.	自分でその問題を解きなさい。
We took turns in washing the car.	私達は交代で車を洗った。
I am glad to have her company.	私は彼女と同席できてうれしい。
I wrote the answers carefully.	私は注意深く答えを書きました。
I took a trip to Nikko last week.	私は先週日光へ旅行した。
I am the tallest of the three.	私は三人のうちで一番背が高い。
I have seen him quite recently.	私は最近彼に会ったばかりだ。
I have recently given up smoking.	私は最近タバコをやめた。
I have not felt well recently.	私は最近あまり体調が良くない。
I slept the whole afternoon away.	私は午後を寝て過ごした。
I like winter better than summer.	私は夏より冬が好きです。
I must decide what to do.	私は何をなすべきか決めなければならない。
I caught the ball with one hand.	私はボールを片手で受けた。
I'm too busy to help her.	私はとても忙しいので彼女を手伝えません。
I measured the board in inches.	私はその板をインチで計った。
I participated in the discussion.	私はその討論に加わった。
I am familiar with this subject.	私はこの事に精通している。
I'm fed up with working here.	私はここで働くのもううんざりだ。
I'll take my coffee black.	私はコーヒーをブラックで飲みましょう。
I agree with you to some extent.	私はある程度は君に賛成だ。
I would rather have a coffee.	私は、むしろコーヒーを飲みたい。
My mother likes tea very much.	私の母はとてもお茶が好きです。
My coat has finally worn out.	私のコートはついにだめになった。
It's no use telling me anything.	私に何を言っても無駄です。
Will you make coffee for me?	私にコーヒーを入れてくれませんか。
We sat at the back of the hall.	私たちは会場の後ろに座った。
We listened to the shooting.	私たち、撃ち合いに耳をすましたわ。
Is using fingers uncivilized?	指を使うことは野蛮なのだろうか。
We've had a lot of rain this year.	今年はよく雨が降った。
There is no chance of rain today.	今日雨は降りそうにない。
It was very hot this afternoon.	今日の午後はとても暑かった。
We've had a lot of rain this month.	今月は雨が多かった。
Black clouds spread over the sky.	黒雲が空一面に広がった。
Would you care for a cup of tea?	紅茶を召し上がりませんか。
Have a cup of tea, won't you?	紅茶を１杯お飲みになりませんか。
It will clear up in the afternoon.	午後には晴れるだろう。
A dog has a sharp sense of smell.	犬はにおいの感覚が鋭い。
Ken has not washed the car yet.	健はまだ車を洗っていません。
The result was clear at a glance.	結果は一目瞭然であった。
I bought the same shirt as yours.	君と同じシャツを買った。
You have good reason to be angry.	君が怒るのももっともだ。
Money is the root of all evil.	金銭はすべてのあくの根である。
To my surprise, he has failed.	驚いたことには、彼は失敗した。
Competition is not bad in itself.	競争それ自体は悪くない。
Suppose we change the subject.	議題を変えてみたらどうだろう。
It is not my intention to return.	帰るつもりはありません。
There are some books on the desk.	机の上に何冊か本がある。
Was there a book on the desk?	机の上に一冊の本がありましたか。
Is there an information counter?	館内に案内所がありますか。
The patient is out of danger now.	患者は今や危機を脱した。
Each man must cast a vote.	各人が１票ずつを投じなければならない。
There is a low hill near the sea.	海の近くに低い丘がある。
We all agree to the new plan.	我々全員がその新計画に賛成する。
We should stick to our plan.	我々は我々の計画に固執するべきだ。
We eat a meal three times a day.	我々は一日三回食事をする。
We made fun of him about this.	我々はこの事で彼をからかった。
Suppose we change the subject.	課題を変えてみたらどうだろう。
There is no smoke without fire.	火のないところに煙は立たず。
The fruits are dried in the sun.	果実は天日で乾燥させます。
Whatever happens, keep calm.	何が起こっても冷静にしていなさい。
Pass me the salt, would you?	塩をこっちへまわしてくれませんか。
Salt is necessary for a cook.	塩は料理人にとって必要なものだ。
The clouds are getting darker.	雲がだんだん黒くなっています。
The rain lasted through the night.	雨は夜通し降り続いた。
Because it rained, I didn't go.	雨が降ったから行かなかった。
Let's wait for the rain to stop.	雨がやむのを待ちましょう。
It is raining worse than ever.	雨がますますひどく降っている。
The rain is raining all around.	雨があたり一帯に降っている。
Where's the nearest library?	一番近い図書館はどこにありますか。
There are four seasons in a year.	一年には四季があります。
Give credit where credit is due.	悪人でも手柄は認めてやれ。
Pass me the wine, please.	わたしのところへブドウ酒を回して下さい。
Lincoln set the slaves free.	リンカーンは奴隷たちを自由にした。
You ought to eat more slowly.	もっとゆっくり食べた方がいいよ。
Now there is neither God nor Buddha.	もう神も仏もない。
I can no longer remain silent.	もうこれ以上だまってられない。
Mayuko got a cut on her finger.	マユコは指に切り傷を作った。
Mayuko has dropped the ball.	マユコはボールを落としてしまった。
It will stop raining before long.	まもなく雨はやむだろう。
I'm a little angry with you.	ぼくは少々君に腹が立っているんだ。
I'd like you to meet Mr Brown.	ブラウンさんを紹介しましょう。
Could I ask a favor of you?	ひとつお願いをしてもいいでしょうか。
Who will host the party?	パーティーでは誰がホストを勤めるのですか。
Tom sat two rows ahead of me.	トムは私の２列前にすわっていた。
What fruit do you like the best?	どの果物が一番好きですか。
Which road goes to city hall?	どちらの道が市役所に行けますか。
Can you possibly help me?	どうにかしてわたしを助けてくれませんか。
At length, my wish was realized.	とうとう私の望みは叶った。
Would you please do me a favor?	どうかお願いがあるのですが。
Now she lay weak in bed.	でも今では、病気で弱って寝ているのだった。
I've just finished packing.	ちょうど荷造りが終わったところです。
Would you mind not smoking?	たばこを吸わないでいただけませんか。
Smoking is bad for your health.	たばこを吸うことは体に悪い。
We need a tool to open it with.	それを開ける道具が必要です。
Some of the dogs are alive.	それらのイヌの何匹かは生きています。
It is an index of her character.	それは彼女の性格の表れだ。
It is something like a ball.	それは何かボールみたいなものです。
The topic is worth discussing.	その話題は話し合う価値がある。
Both of the means are dangerous.	その方法は両方とも危険だ。
The city is hosting the fair.	その都市はフェアを開催している。
It is clear that the ship sank.	その船が沈んだのは明らかだ。
The work is not finished yet.	その仕事はまだ終えられていない。
That job is pretty much finished.	その仕事はほぼ終わった。
The noise gets on my nerves.	その雑音は、私の神経にさわります。
That country has a severe climate.	その国の気候は厳しい。
I realized it only then.	そのときはじめてわたしはそのことを悟った。
O.K. I'm glad you could come.	そう、私きてくれて嬉しかったわ。
Not all animals are wild.	すべての動物が野生であるとはかぎらない。
Spanish is her native language.	スペイン語が彼女の母語です。
Driving too fast is dangerous.	スピードの出し過ぎは危険です。
John is above telling a lie.	ジョンは嘘をつくような人ではない。
I have to iron my shirt.	シャツにアイロンをかけなければなりません。
We look forward to your entries.	ご参加お待ちしております。
This happened under my nose.	これは僕の眼前で起こったことです。
This medicine is good for a cold.	この薬は風邪に効きます。
This suit is too good for me.	この服はわたしにはもったいない。
You can smoke in this room.	この部屋ではたばこを吸ってもいいよ。
This noise should be put up with.	この騒音は我慢すべきだ。
What do you think of my new coat?	この新しいコート、どう？
Put your name on this document.	この書類にサインして下さい。
You can't rely on this machine.	この機械は当てにできません。
This song is familiar to us.	この歌は私たちによく知られている。
We have had much rain this summer.	この夏は雨が多かった。
This hotel does not take dogs.	このホテルは犬は受け入れない。
This hotel was built last year.	このホテルは去年建てられた。
This hall holds 2,000 people.	このホールには２千人収容できる。
This shirt is the standard size.	このシャツは標準サイズだ。
This coat may well fit you.	このコートがきっときみにあうだろう。
Let's drink the cup of tea here.	ここで紅茶を飲みましょう。
It almost never rains here.	ここではほとんど雨が降ることがない。
Do you mind my smoking here?	ここでタバコを吸ってもいいですか。
Do you mind if I smoke here?	ここでタバコを吸っていいんですか。
Would you like a cup of coffee?	コーヒーを一杯いかがですか。
Please make me a cup of coffee.	コーヒーを１杯入れて下さい。
Could I have a cup of coffee?	コーヒーを１杯、おねがいします。
How do you like your coffee?	コーヒーはどのようにいたしますか。
The desk that Ken uses is old.	ケンが使っている机はもう古い。
Would you like to have a cup of tea?	お茶を一杯いかが。
Would you like another cup of tea?	お茶をもう一杯いかが。
Would you like tea or coffee?	お茶かコーヒーでもいかがですか。
Would you bring me some salt?	お塩を持ってきてもらえませんか。
Tell me truly what you think.	おもうことを正直に話してごらん。
When will you go on a journey?	いつ旅行においでになりますか。
When did you buy this video?	いつ、このビデオを買ったのですか。
I agree with you to some extent.	ある程度は君に賛成します。
He said that you ought to go.	あなたは行くべきだと彼は言った。
I'm busy all day keeping house.	私は一日中家事で忙しいのよ。
Beauty is but skin deep.	綺麗だってことは皮膚の深さ分のことだけだ。
There are some books on the desk.	机の上に数冊の本がある。
The world did not recognize him.	世はこの方を知らなかった。
Tom certainly has a nice voice.	トムは実にいい声をしている。
X is definitely necessary for us.	Xが私たちには絶対に必要だ
X seems cool to people.	Xはかっこいいというイメージを周りの人に与える
There is a very high chance of rain.	かなり雨の確率が高い
He shot a video of the children.	彼が子供たちのビデオを撮った
I didn't even glance across at X.	Xには全く目が向かなかった
X was investigated by the government.	Xを政府が検討した
The plane flies for the first time.	飛行機が初めて空を飛ぶ
He finally decided to buy it.	彼が買うしかないとやっと腹を括った
It's just more than I can handle.	それはもう私の手に負えない
I will become God of the new world.	僕は新世界の神となる。
You should definitely ask him out.	彼を誘わなくちゃだめよ。
I wish something nice would happen.	何かいいことないかな。
Have my eyes also started to fail?	儂の目もガタがきたかの。
Don't make fun of old people.	お年寄りをからかってはいけません。
The train pulled into the station.	列車は駅にすべりこんだ。
Where is the money exchange counter?	両替所はどこですか。
I had a good time during the trip.	旅行中楽しい思いをした。
He told me that the trip was off.	旅行はやめにすると言った。
Are you all set for the trip?	旅行の準備はすべて終わりましたか。
I'd be very glad if you'd come.	来てくださればとてもうれしい。
It came on to rain toward evening.	夕方近く雨が降りだした。
It said rain from this evening.	夕方から雨だっていっていたよ。
In the north it is cold in winter.	北の方では冬が寒いです。
The mother seemed busy cooking.	母は忙しそうに料理をしていた。
My mother is busy in the kitchen.	母は台所で忙しくしている。
Mother is busy keeping house.	母は家事を切り盛りするのに忙しい。
Let's put all the cards on the table.	腹を割って話そう。
The wind is blowing from the north.	風は北から吹いている。
I have finished cleaning my room.	部屋の掃除が終わりました。
My father was promoted to president.	父は社長に昇進した。
What is the temperature of the ice?	氷の温度は何度ですか。
Don't fail to call me back.	必ずそちらから電話をかけ直して下さい。
The plane will get in on time.	飛行機は定刻に到着するでしょう。
The plane was soon out of sight.	飛行機はすぐ見えなくなった。
She must be angry with me.	彼女は僕に腹を立てているのにちがいない。
She turned up her nose at him.	彼女は彼を素っ気なくあしらった。
She teaches reading and writing.	彼女は読み書きを教えている。
She gave me an appealing look.	彼女は訴えるような目で私を見た。
She finished writing a letter.	彼女は手紙を一通書き終えました。
She handed me a sheet of paper.	彼女は私に１枚の紙を手渡した。
She got good grades in English.	彼女は英語でよい成績を取った。
She finally reached the hotel.	彼女はやっとそのホテルに着いた。
She put aside a lot of money.	彼女はお金をたくさん貯金している。
Do you think her story is false?	彼女の話は嘘だと思いますか。
Her explanation was to the point.	彼女の説明は的を得ている。
Her belief in God is very firm.	彼女の神への信仰はとても堅い。
Her hands were as cold as ice.	彼女の手は氷のように冷たかった。
Her wish was realized at last.	彼女の願いがとうとう実現された。
It would be nice to tell her.	彼女に話すのが親切になるでしょう。
The doctor she visited is famous.	彼女が訪ねた医者は有名だ。
She gave an address of welcome.	彼女が歓迎のあいさつを述べた。
I can't help making fun of him.	彼をからかわずにはいられない。
They go camping every summer.	彼らは毎年夏にキャンプに行きます。
They chose him for their leader.	彼らは彼をリーダーに選んだ。
They camped at the water's edge.	彼らは水際でキャンプをした。
They decided to build a bridge.	彼らは橋をつくることに決めた。
They agreed on a joint statement.	彼らは共同声明に同意した。
They did away with the bad habit.	彼らはその悪習を打破した。
They came to our aid at once.	彼らはすぐ私達を助けに来てくれた。
He changed the topic of conversation.	彼は話題を変えた。
He is busy preparing for the trip.	彼は旅行の準備で忙しい。
He stopped short at the gate.	彼は門のところで急に立ち止まった。
He is nothing but an ordinary man.	彼は普通の人にすぎない。
He ran out of the room in anger.	彼は怒って部屋を飛び出した。
He worked from morning till night.	彼は朝から晩まで働いた。
He will be named for President.	彼は大統領に任命されるだろう。
He was admitted to the college.	彼は大学への入学が許可された。
He studies history at college.	彼は大学で歴史の勉強をしている。
