I agree.	同感です。
I want to drink a cup of tea.	紅茶を一杯飲みたい。
I am not as busy as Yoshio.	私は吉雄ほど忙しくない。
I'm above telling lies.	私は嘘をつくような人間ではない。
I am majoring in medicine.	私は医学を専攻しています。
I made the woman angry.	私はその婦人を怒らせてしまった。
I am in favor of the option.	私はその意見に賛成だ。
I like my coffee strong.	私はコーヒーは濃いのが好きだ。
I don't care for green tea.	私はお茶が好きじゃない。
I got up early as usual.	私はいつものように早く起きた。
I quite agree with you.	私はあなたとまったく同意見です。
I'm not as tall as you.	私はあなたほどに背が高くはない。
I agree with your opinion.	私はあなたの意見に賛成だ。
I had my T-shirt washed.	私はＴシャツを洗ってもらった。
I have been busy for two days.	私は２日間忙しい。
I waited for him till ten.	私は１０時まで彼を待った。
I never agree with him.	私は、決して彼には同意しません。
My dream is soon realized.	私の夢はもうすぐ実現する。
Father is angry with me.	私の父は私のことを怒っている。
How do you like my new suit?	私の新しい服はいかが？
My work is almost finished.	私の仕事は大概片付いた。
Listen to me carefully.	私の言う事を注意して聞きなさい。
Will you do me a favor?	私のお願いを聞いてもらえますか？
Will you do me a favor?	私の願いを聞いていただけますか。
My father is very nice.	私のお父さんはとてもよい人です。
Please give me a cup of tea.	私に紅茶を一杯下さい。
Don't break off the branch.	枝をもぎ取らないように。
We had a nice time last night.	昨夜は楽しかった。
Whom the gods love die young.	才子多病、佳人薄命。
I've got a big wash today.	今日は洗濯物が山ほどある。
Are you free this afternoon?	今日の午後は暇ですか。
I have been busy this week.	今週はずっと忙しいんだ。
There is every sign of rain.	今にも一雨降りそうだ。
It may rain any minute.	今すぐにも雨がふるかもしれない。
Would you care for some tea?	紅茶は、いかがですか。
Are you referring to me?	君は僕のことを言っているのか。
You can get ahead in the world.	君は成功するよ。
You are as white as a sheet.	君は顔色がまっ青だよ。
You ought to do it at once.	君はすぐそれをすべきだ。
Leave your desk as it is.	君の机をそのままにしておけ。
I'll make you a new suit.	君に新しい服を作ってやろう。
The air is a medium for sound.	空気は音の媒体だ。
There are no clouds in the sky.	空には雲がない。
I haven't slept well recently.	近頃良く眠れない。
I've been on edge recently.	近頃いらいらしています。
It was dark under the bridge.	橋のしたは暗かった。
Is there a place I can smoke?	喫煙所はありますか？
Smoking is bad for the health.	喫煙は健康に悪い。
There is a book on the desk.	机の上に本があります。
There is a book on the desk.	机の上に本が１冊ある。
There is a map on the desk.	机の上に地図があります。
I agree with you to a degree.	幾分は君に賛成です。
I will be glad to help you.	喜んでお手伝いしますよ。
I'm glad you enjoyed it.	喜んでいただけてよかったです。
I hope you're having fun.	楽しくやっているのでしょう。
The sea is far from calm.	海は穏やかなところではない。
We debated the problem.	我々はその問題について討議した。
Would you like some fruit?	果物を召し上がりませんか。
Can you keep the noise down?	音を下げてくれないか。
It rains a lot in Okinawa.	沖縄ではたくさん雨が降る。
The king created him a peer.	王は彼を貴族に列した。
Would you pass me the salt?	塩を回してくれませんか。
Salt is used to season food.	塩は味付けに使われる。
English is my mother tongue.	英語は私の母国語です。
It will stop raining soon.	雨は間もなくやむでしょう。
When did it begin to rain?	雨はいつ降り始めましたか。
The rain fell even harder.	雨はいっそう激しくなった。
I like to walk in the rain.	雨の中を歩いてみたいな。
I was late because of the rain.	雨で私は遅れた。
It rained five days on end.	５日間続けて雨が降った。
Right and left are opposites.	右と左は反対語です。
May I ask a favor of you?	一つお願いしてもいいですか。
Mr Ito teaches history.	伊藤先生は、歴史を教えています。
We'd like to have some wine.	ワインをいただきます。
I tried, only to fail.	やってみたが、失敗しただけだった。
Can I have some more tea?	もう少しお茶をもらえますか。
Have you washed your hands yet?	もう手は洗った？
We have had enough of rain.	もう雨にはあきあきした。
Give me another cup of tea.	もう一杯お茶をください。
Meg agreed to Ken's plan.	メグはケンの意見に賛成した。
Meg is as tall as Ken.	メグは、ケンと同じぐらい背が高い。
Mayuko failed to see Meg.	マユコはメグに会えなかった。
I neither drink nor smoke.	ぼくは酒も煙草もやらない。
Welcome to Best Products.	ベストプロダクツへようこそ。
I want Mr Brown paged.	ブラウン氏を呼び出してもらいたい。
The Hilton Hotel, please.	ヒルトン・ホテルまでお願い。
May I ask you a favor?	ひとつお願いしてもよろしいですか。
May I ask a favor of you?	ひとつお願いしたいのですが。
Picasso is a famous artist.	ピカソは有名な画家です。
Why did you get so angry?	なぜ君はそんなに怒ったのか。
Tom escaped from the danger.	トムは危険から逃れた。
Which platform is it on?	どのホームで乗ればいいですか。
Tony was not busy then.	トニー君はその時忙しくなかった。
Tony is a very tall boy.	トニーは大変背の高い少年です。
Please drive carefully.	どうぞ注意深く運転してください。
Why are you under the desk?	どうして机の下にいるの。
Would you do me a favor?	ちょっとお願いしていいですか。
Do you mind if I smoke?	タバコを吸ってもよろしいですか。
Do you mind if I smoke?	タバコを吸ってもかまいませんか。
You'd better give up smoking.	たばこをやめなさい。
Don't make so much noise.	そんなに騒いではいけません。
Let's finish it right away.	それをすぐ終えましょう。
Keep it in a cool place.	それは涼しい所に保存しなさい。
What does it refer to?	それは何の事を言っているのですか。
It's entirely up to you.	それはまったくあなた次第です。
That would be sufficient.	それだけで十分足りるだろう。
Let's suppose it's true.	それが真実であると仮定しよう。
I cut a branch from the tree.	その木の枝を切った。
Put the book on the desk.	その本を机の上に置いてくれ。
The lady remained silent.	その婦人は黙ったままだった。
How thick is the board?	その板の厚さはどのくらいですか。
The boy began to make noise.	その少年は騒ぎ始めた。
The word is out of fashion.	その言葉は流行遅れです。
How long is the bridge?	その橋はどれくらいの長さですか。
I will keep the fish alive.	その魚は生かしておこう。
Roll the ball to me.	そのボールを僕の方に転がしてください。
The shirt is large for me.	そのシャツは私には大きい。
Everything looked nice.	すべてのものがすばらしく見えた。
Jill is engaged to Jack.	ジルはジャックと結婚している。
George failed in business.	ジョージは事業に失敗した。
Please take off your shirt.	シャツを脱いでください。
Please iron the shirt.	シャツにアイロンをかけてください。
It is likely to rain soon.	じきに雨が降ってきそうだ。
Welcome to San Francisco.	サンフランシスコへようこそ。
Can you copy this for me?	これをコピーしてくれますか。
This is making me really angry.	これは頭にくる。
This isn't finished at all.	これは全然終わってない。
This is a very good tea.	これはなかなかおいしい紅茶だ。
This tree bears no fruit.	この木は実が一つもならない。
Give me a copy of this book.	この本を１部ください。
This answer made him angry.	この返事が彼を怒らせた。
This room smells of gas.	この部屋はガスのにおいがする。
This coat doesn't fit me.	この上着は私の体に合わない。
Go ahead with this work.	この仕事をどんどん進めなさい。
Is this fish still alive?	この魚はまだ生きていますか。
This fish has a bad smell.	この魚はいやな臭いがする。
This desk is made of wood.	この机は木で作られている。
This desk is used by me.	この机はわたしに使われている。
When will this rain let up?	この雨はいつやむだろう。
This hotel faces the sea.	このホテルは海に面している。
This table is at an angle.	このテーブルは傾いている。
This shirt wants washing.	このシャツは洗う必要がある。
How much is this T-shirt?	このＴシャツはいくらですか。
Would you like more coffee?	コーヒーをもっといかが？
Could I have a cup of coffee?	コーヒーをください。
Would you like some coffee?	コーヒーをいかがですか。
Ken is busy now, isn't he?	ケンは今忙しいんですよね？
Kent is a born leader.	ケントは生まれながらの指導者です。
Can I use a credit card?	クレジットカードは使えますか。
Can I pay with a credit card?	カードは使えますか。
Come and have tea with me.	お茶を飲みにいらっしゃい。
Will you have a cup of tea?	お茶を一杯飲みませんか。
Have some tea, won't you?	お茶をお召し上がりください。
How glad I am to see you!	お会いできて本当にうれしい！
I'm very glad to see you.	お会いできてとてもうれしい。
Is this all you have, sir?	お荷物はこれで全部ですか。
Certainly. I'd be glad to.	お引き受けいたしましょう。
Good morning, my sweet dog.	おはよう僕のかわいい犬。
Oh my God, I can't believe this.	えっ嘘でしょ。
My son is taller than me.	うちの息子は私より背が高い。
When was this car washed?	いつこの車は洗われましたか。
Did you have a nice summer?	いい夏をすごしましたか。
Look at those black clouds.	あの黒い雲を見てごらん。
Look at that tall building.	あの高い建物を見なさい。
You aren't busy, are you?	あなたは忙しくありませんね。
I suppose you like her.	あなたは彼女が好きなのでしょう。
You ought not to go out.	あなたは出かけるべきではない。
You should pay your debts.	あなたは借金を払うべきだ。
You are a very good artist.	あなたは絵が上手ですね。
Why are you busy today?	あなたは何故今日忙しいのですか。
Did you finish the job?	あなたはその仕事を終えましたか。
You've finished your work.	あなたの仕事は済みました。
I'm glad to see you again.	あなたに再び会えて嬉しい。
It's cool today for July.	７月にしては今日はすずしい。
It rains a lot in June.	６月にはたくさんの雨が降ります。
It rained three days on end.	３日続けて雨が降った。
It has kept raining all day.	１日中雨が降り続いた。
Heat turns ice into water.	熱によって氷は水に変わる。
Have you taken your medicine yet?	お薬飲んだ？
She doesn't believe in God.	彼女は神を信じていない。
We'll do it mainly as follows.	概ね次のとおりとする
He makes more profit with X.	彼がXでさらに利益を得る
First, we should know ourselves.	まず自分を知ろう
Those words stuck with me.	その言葉がとても、心に残った
You can watch videos for free.	動画が無料で見られる
X will make it much sweeter.	Xでさらに甘みが増します
I will throw the ball there.	そこに僕がボールを投げる
He actually plays the video.	彼が実際に動画を再生する
Tears rolled down my cheeks.	涙が私の頬を流れ落ちた。
I feel like going on a trip.	旅に出かけたい気がする。
Fashions grow old and die.	流行は古くなって消えていく。
The medicine had no effect.	薬がまったく効かなかった。
I gave up smoking a year ago.	僕は一年前に禁煙した。
Mother is preparing dinner.	母は夕飯の仕度をしている。
The room was full of smoke.	部屋は煙でいっぱいだった。
There are desks in the room.	部屋の中に机があります。
My father stopped smoking.	父はタバコを吸うのをやめた。
My father is as busy as ever.	父は相変わらず忙しい。
Now it rises, now it sinks.	浮かんだと思うとまた沈む。
Will the ice bear our weight?	氷は乗っても大丈夫か。
You must come without fail.	必ず来なければいけません。
The plane took off at 2:30.	飛行機は二時半に離陸した。
The plane is due at 7 p.m.	飛行機は午後七時着の予定だ。
The plane took off at seven.	飛行機は７時に離陸した。
She answered with tears.	彼女は涙を流しながら答えました。
She told her story in tears.	彼女は涙まじりに話した。
She is a slave of fashion.	彼女は流行にとらわれている。
She was ironing her dress.	彼女は服にアイロンをかけた。
She must be from the South.	彼女は南部出身に違いない。
She is a short story writer.	彼女は短編小説作家です。
She decided on the red coat.	彼女は赤い上着に決めた。
She is much taller than I.	彼女は私よりずっと背が高い。
She appealed to me for help.	彼女は私に助けを求めた。
She dared to call on him.	彼女は思い切って彼にたずねた。
She lives in comfort now.	彼女は今は気楽に暮らしている。
She had bright black eyes.	彼女は輝く黒い目をしていた。
She is quick at everything.	彼女は何事もするのが早い。
She played cards with Roy.	彼女はロイとトランプをした。
She hardly ate anything.	彼女はほとんど何も食べなかった。
Why is she so silent?	彼女はなぜあんなに黙っているのですか。
She has to stop smoking.	彼女はタバコを止めざるをえない。
She is a credit to her class.	彼女はクラスの名誉だ。
She is more famous than you.	彼女はあなたより有名だ。
Her eyes flashed with joy.	彼女の目はよろこびに輝いた。
Her husband is in prison.	彼女の夫は刑務所に入っている。
Her smile expressed joy.	彼女の微笑みが喜びを表していた。
Her heart was full of joy.	彼女の胸は喜びで溢れていた。
She gave birth to a baby boy.	彼女に子供が生まれた。
She and I usually agree.	彼女とはたいてい意見が一致する。
You ought not to believe him.	彼を信じるべきでない。
They have treated her well.	彼らは彼女を待遇してきた。
They will never agree.	彼らは決してうまくはいかないだろう。
They will agree on that.	彼らはそれで合意に達するだろう。
He hardly ever opens a book.	彼は滅多に本を開かない。
He washes the car every week.	彼は毎週車を洗います。
He tore the book apart.	彼は本をばらばらに裂いてしまった。
He was angry at her words.	彼は彼女の言葉に腹を立てた。
He kissed her on the cheek.	彼は彼女のほおにキスした。
He taught himself French.	彼は独学でフランス語を学んだ。
He failed to come on time.	彼は定刻どおりに来なかった。
He is fresh from college.	彼は大学を出たてのほやほやだ。
He never touched wine.	彼は絶対ワインには手をつけなかった。
He is famous as an oil king.	彼は石油王として有名だ。
He is a kind and nice fellow.	彼は親切でいいやつだ。
He is not a man to rely on.	彼は信頼できる人ではない。
He is not a man to rely on.	彼は信頼すべき人ではない。
He is a danger to society.	彼は社会にとって危険人物だ。
He was in reality a criminal.	彼は実は犯罪者だった。
He decided to give it a try.	彼は試してみる事にした。
He is engaged to my sister.	彼は私の妹と婚約している。
He made me a new suit.	彼は私に新しいスーツを作ってくれた。
He appealed to us for help.	彼は私たちに援助を求めた。
He passed across the border.	彼は国境を越えて行った。
He beat the dog with a stick.	彼は犬を棒でたたいた。
He is by no means bright.	彼は決して頭のいい方ではない。
He's the president of the bank.	彼は銀行の頭取だ。
He was aware of the danger.	彼は危険に気がついていた。
He saved me from danger.	彼は危ないところを助けてくれた。
He had cut down on sweets.	彼は甘いものの量を減らした。
He is entirely in the wrong.	彼は完全に間違っている。
He is busy learning English.	彼は英語の勉強で忙しい。
He is a man of weak character.	彼は意志の弱い人だ。
He is over the hill, you know.	彼はもう下り坂だね。
He finished the opening.	彼はほんの冒頭部分を書き終えた。
He is almost six feet tall.	彼はほぼ６フィート上背だ。
What a tall boy he is!	彼はなんて背の高い男の子なのだろう。
He can cut the cards well.	彼はトランプを上手に切れる。
He is, if anything, tall.	彼はどちらかと言えば背が高い。
He moved the table aside.	彼はテーブルをわきへ動かした。
He did it just for fun.	彼はただの冗談でそれをやったのだ。
He picked it up carefully.	彼はそれをそっと摘み上げた。
Is he in favor of the plan?	彼はその計画に賛成ですか。
He solved all the problems.	彼はすべての問題を解いた。
He set all offers aside.	彼はすべての申し込みを無視した。
He is busy doing something.	彼はしきりに何かしている。
He bears the title of Sir.	彼はサーの称号を持っている。
He is as healthy as ever.	彼はいつもと代わらず健康です。
Let's wait till he comes back.	彼が戻るまで待とう。
No wonder he is so angry.	彼が怒っているのは無理もない。
Tokyo doesn't agree with me.	東京は私の性に合わない。
Who are you referring to?	誰のことを言っているのですか。
I am only too glad to do so.	大喜びでそういたします。
Choose a present carefully.	贈り物は慎重に選びなさい。
Can you keep the noise down?	騒音を下げてくれないか。
Quick at meal, quick at work.	早飯の人は仕事が早い。
May I have your birth date?	生年月日を教えてください？
It's the trend that counts.	世の中の動きが問題ですね。
The water is nice and cool.	水は冷たくて気持ちが良い。
Did you request a new desk?	新しい机を要求しましたか。
We were back to square one.	振り出しに戻ってしまった。
Please have some copies made.	焼き増ししてください。
Women are easily moved to tears.	女性は涙もろい。
The gate was left open.	出入り口は開けたままになっていた。
Youth has its advantages.	若さにはそれなりの利点がある。
I have a favor to ask.	実はおねがいしたいことがありまして。
Help yourself to the fruit.	自由に果物をお食べ下さい。
Allow me to introduce myself.	自己紹介させて下さい。
We have three meals a day.	私達は日に３度食事をします。
We traveled in South America.	私達は南米を旅行した。
We saw smoke in the distance.	私達は遠方に煙をみた。
All our attempts failed.	私達の試みはどれもみな失敗した。
I wash my face every morning.	私は毎日顔を洗います。
I think he's a great writer.	私は彼を大作家だと思う。
I took him for Mr Brown.	私は彼をブラウンさんと間違えた。
I asked him to make tea.	私は彼にお茶を入れるよう頼んだ。
I found him a bright boy.	私は彼が利口な少年とわかった。
I wasn't busy last week.	私は先週忙しくありませんでした。
By God, I never tell a lie.	私は誓って嘘はいいません。
I put my coat on inside out.	私は上着を裏返しに着た。
I am short of pocket money.	私は小遣いが不足している。
I was beside myself with joy.	私は喜びで我を忘れた。
I washed my shirt clean.	私はワイシャツをきれいに洗った。
Each time I tried, I failed.	私はやるたびに失敗した。
I finally gave up smoking.	私はとうとうタバコをやめた。
I'm so glad to hear that.	私はそれを聞いて大変うれしい。
I was aware of the danger.	私はその危険に気付いていた。
I don't like the coffee.	私はそのコーヒーが好きではない。
This song is familiar to me.	この歌はよく知ってるよ。
I'm very busy these days.	私はこのごろとても忙しいです。
I washed my hands as usual.	私はいつも通り手を洗った。
I meant you no harm.	私はあなたに害を与えるつもりはなかった。
I quite agree with you.	私はあなたとまったくの同意見です。
My mother tongue is Japanese.	私の母語は日本語です。
My job is teaching English.	私の仕事は英語の先生です。
Listen to me carefully.	私の言うことを注意深く聞きなさい。
Get me a cup of coffee.	私にコーヒー１杯持ってきて下さい。
We have three meals a day.	私たちは１日３度食事をする。
Wait here till I return.	私が戻るまでここで待ってなさい。
I ought to ask, oughtn't I?	私が依頼すべきでしょうね。
Wait till I count to ten.	私が１０数えるまで待ちなさい。
A tree is known by its fruit.	子を見れば親がわかる。
I've seen much of him recently.	最近よく彼と会う。
I started using PCs recently.	最近パソコンを始めた。
It is truly a nice day today.	今日は実によい天気だ。
This is a special occasion.	今回は特別な行事なんです。
It may rain at any moment.	今にも雨が降るかもしれない。
The sun is about to sink.	今しも太陽が沈もうとしている。
Please give me a cup of tea.	紅茶をいっぱいください。
You'd better hold your tongue.	口を慎んだらどうだ。
It's not even worth mentioning.	語る価値さえない。
It will rain in the afternoon.	午後雨が降るだろう。
You don't have to be so formal.	固いこと言うなよ。
Language is unique to man.	言語は人間特有のものである。
Speech is silver, silence is gold.	言わぬが花。
Ken is tall, but I'm not.	健は背が高いが、私は高くない。
Monday is my busiest day.	月曜日は私が一番忙しい日です。
The cycle of blood is not regular.	血液の循環。
How tall is your brother?	お兄さんの身長はいくつですか。
Your study will bear fruit.	君の研究は実を結ぶだろう。
The sky was bright and clear.	空は晴れて明るかった。
I read about All Ball.	私はオールボールについて読みました。
It is still fresh in my memory.	記憶にまだ新しい。
We must observe the rules.	規則は守らなければならない。
So nice that you are back.	帰ってきてホントに良かった。
Look at the book on the desk.	机の上の本を見なさい。
A book is lying on the desk.	机の上に本が置いてある。
There is a bag on the desk.	机の上にかばんがあります。
I hope you had a nice trip.	楽しい旅行だったでしょう。
It only adds fuel to the fire.	火に油を注ぐだけだ。
All was silent in the house.	家の中はしんとしていた。
I left my card at home.	家にクレジットカードを忘れてきた。
Is there any fresh news?	何か新しいニュースはありますか。
I have her in my pocket.	俺は彼女を完全にものにしている。
Will you pass me the salt?	塩を取ってくださいませんか。
There is no fire without smoke.	煙のない火はない。
In case it rains, I won't go.	雨の場合私は行かない。
He won't come if it rains.	雨が降れば彼は来ないだろう。
If only the rain would stop!	雨がやみさえすればなあ。
May I ask a favor of you?	一つ願いを聞いて頂けませんか。
Would you do me a favor?	一つお願いを聞いて頂けませんか。
I have a favor to ask of you.	一つお願いがあります。
You ought to see a doctor.	医者にみてもらうべきですよ。
Our country is in a crisis.	わが国は危機に陥っている。
How dare you laugh at me!	よくも私のことを笑えるものだ。
Yumiko was a little angry.	ユミコは少し腹を立てていた。
You should eat more fruit.	もっと果物を食べるべきです。
Bob is really a brown noser.	ボブは本当にごますりだ。
I'm up to my ears in debt.	ぼくは借金で首が回らないよ。
I gave up smoking for a year.	ぼくは１年間禁煙した。
Throw the ball back to me.	ボールを投げ返してください。
France borders Italy.	フランスはイタリアと国境を接している。
Peter came in your absence.	ピーターが君の留守にきた。
Why did he stop smoking?	なぜ彼はタバコをやめたのですか。
