I agree.	同感です。
One should not make fun of others.	他の人をばかにすべきではない。
You won't be in time unless you run.	走らなければ間に合わない。
Be quick! We haven't much time.	早くしなさい。あまり時間が無いんだ。
Would you like to have your hair washed?	洗髪いたしますか。
The teacher finished today's lesson.	先生は今日の授業を終えた。
We must not speak in the library.	図書館の中で話をしてはいけない。
You ought to be quiet in a library.	図書館では静かにするべきだ。
This is the season to pick fresh tea.	新茶を摘む季節になった。
The new President is well spoken of.	新しい大統領は評判がよい。
The boy acknowledged having lied.	少年はうそをついたことを認めた。
Women are said to be weak at figures.	女性は計算に弱いと言う。
Fall is a good season for reading.	秋は読書にもってこいの季節だ。
I'll put you through to the president.	社長に電話を回します。
We must take care of ourselves.	自分の健康に注意しなければいけない。
It is truly said that time is money.	時は金なりとは至言である。
The game will be held even if it rains.	試合は雨天決行です。
Will you take me to the gate?	私を門まで連れて行ってくださいませんか。
I have all my suits made to order.	私は服はすべて注文で作らせる。
I treated her as my own daughter.	私は彼女を実の娘のように扱った。
I know that she has been busy.	私は彼女が忙しかったことを知っている。
I always catch a cold in the winter.	私はいつも冬に風邪をひく。
I am not angry, far from it.	私は怒ってなどいない、それどころではない。
I have a habit of getting up early.	私は朝早く起きる習慣がある。
I gave up running for president.	私は大統領に立候補するのを諦めた。
I like going on trips in my car.	私は自分の車で旅をするのが好きだ。
I am the tallest in our class.	私は私たちのクラスの中で一番背が高い。
I'm sticking to my original plan.	私ははじめの計画だけに専念する。
I had my fingers caught in the door.	私はドアに指をはさまれた。
I wish I could give up smoking.	私はタバコをやめたいとおもっている。
I'm not in favor of such a plan.	私はそんなプランには賛成できない。
I have already finished the job.	私はすでにその仕事をしてしまった。
I agree with you to some extent.	私はあなたにある程度は同意できる。
I talked my father out of smoking.	私は、父を説得して禁煙させた。
My friend was angry at the news.	私の友人はその知らせに怒っていた。
My sister became a college student.	私の姉は大学生になりました。
As to me, I agree to the plan.	私に関して言えば、その計画には賛成だ。
We are prepared for the worst.	私たちは最悪の場合の覚悟はできている。
We delayed the meeting for a week.	私たちは会議を一週間延ばした。
We thought it was a nice plan.	私たちはそれがよい計画であると思った。
We put the desk by that window.	私たちはその机をあの窓の側に置いた。
We talked over a cup of coffee.	私たちはコーヒーをのみながら話した。
We should save wild animals.	私たちは、野生動物を救わなくてはならない。
Our confidence in him is gone.	私たちの彼への信頼は失われてしまった。
Our efforts will soon bear fruit.	私たちの努力はまもなく実を結ぶ。
I don't know how to handle children.	子供の扱い方がわからない。
I haven't seen much of him recently.	最近私は彼と会っていない。
We have had much rain this summer.	今年の夏はとても雨が多かった。
We haven't had much rain this year.	今年あまり雨が降らなかった。
She was cool toward me today.	今日の彼女は私に対してよそよそしかった。
I would rather die than yield.	降伏するくらいなら死んだほうが増しだ。
I ought to go there, but I won't.	行くべきなのだが、私は行かない。
The park was extended to the river.	公園は川の所まで拡張された。
Are you angry at what I said?	君は僕が言ったことに腹を立てているのか。
You ought not to have done that.	君はそれをすべきではなかったのに。
Are you in favor of the plan or not?	君はその案に賛成か反対か。
You've drunk three cups of coffee.	君はコーヒーを３杯も飲んだよ。
The ice will give under your weight.	君の重さじゃ氷が割れるよ。
Your ideas are quite old fashioned.	君の考えは完全な時代遅れだ。
I have a nice present to give you.	君にいい贈り物をあげましょう。
It is strange that you should fail.	君が失敗するなんて不思議だ。
Smoking has an ill effect upon health.	喫煙は体に弊害である。
There is only one book on the desk.	机の上には本が１冊しかない。
Look at that picture on the desk.	机の上にあるその写真を見なさい。
I'll be only too glad to go with you.	喜んでお受けしましょう。
The cold winter will soon be over.	寒い冬はもうすぐ終わりますよ。
Stick the bag down under the seat.	鞄を座席の下に置いてください。
Students have access to the library.	学生は図書館は利用できる。
We shared the profit among us all.	我々は全員で利益を分け合った。
We enjoyed ourselves to the fullest.	我々は心ゆくまで楽しんだ。
Allow me to introduce Mr Kato to you.	加藤さんをご紹介します。
There is no telling what will happen.	何が起こるか分からない。
We can see the island in the distance.	遠方にその島が見える。
The rain hasn't stopped yet, has it?	雨はまだやんでいませんね。
The rain prevented me from coming.	雨のために来られませんでした。
The rain prevented me from going out.	雨で外出ができなかった。
The rain was driving in our faces.	雨が我々の顔に吹き付けてきた。
You have to pull that door to open it.	引けばドアが開きます。
Can you move this desk by yourself?	一人でこの机を動かせますか。
Won't you have some more coffee?	もう少しコーヒーをいただけますか。
I tried it again, only to fail.	もう一度試したが失敗しただけだった。
Everyone looked on me as a leader.	みんなが私をリーダーと認めた。
There was a large crowd in the hall.	ホールには聴衆が大勢いた。
There were many people in the hall.	ホールには人がいっぱいいた。
A ball flew in through the window.	ボールが窓から飛び込んできた。
There is no water left in the bottle.	ビンに水は残っていない。
It doesn't pay to play video games.	ビデオゲームは割に合わない。
Stay calm whatever happens.	どんなことが起ころうとも落ち着いていなさい。
Tom is the proper boy for the job.	トムはその仕事に適した少年だ。
Miss Thomas teaches us history.	トマス先生は私達に歴史を教えている。
It was so hot I took my coat off.	とても暑かったので上着を脱いだ。
To all appearances, she is healthy.	どう見ても彼女は元気そうだ。
To all appearances, she is healthy.	どう見ても彼女は健康そうだ。
Can you get the door to shut?	ドアが閉まるようにすることができますか。
Dennis can be very wild sometimes.	デニスは時々乱暴なことをする。
I have a favor to ask of you.	ちょっとお願いしたいことがあるんだけど。
It's okay to take it easy sometimes.	たまには気楽にしていいよ。
Smoking does much harm but no good.	たばこは百害あって一利なし。
You ought not to smoke so much.	そんなにたばこをすってはいけません。
You shouldn't smoke so much.	そんなにたくさんタバコを吸わない方がよい。
You ought not to say such a thing.	そんなことを言うべきではない。
You ought not to say such a thing.	そんなことは言うべきではない。
I can recall seeing those pictures.	それらの絵を見た覚えがある。
It's a whole new ball game for me.	それは私には全く新たな状況だ。
It is at best a second-rate hotel.	それはせいぜい二流のホテルだ。
He knows hardly anything about it.	それについてほとんど知らない。
The story brought tears to her eyes.	その話は彼女の涙を誘った。
The trip calls for a lot of money.	その旅行には多くの金が必要だ。
The gate is too narrow for a car.	その門は狭すぎて車は入れません。
The island is easy to reach by boat.	その島は船で容易に行ける。
The island is very easy to reach.	その島にはとても近づきにやすい。
The town is an industrial community.	その町は産業共同体である。
It hardly ever rains in the area.	その地域はめったに雨が降らない。
I'm very glad to hear the news.	その知らせを聞いてたいへんうれしい。
It seems that the news was false.	その知らせは間違っていたらしい。
The washing machine is out of order.	その洗濯機は故障している。
There is a bridge across the river.	その川には橋が架かっている。
The teacher is fresh from college.	その先生は大学を出たばかりだ。
The new bridge is under construction.	その新しい橋は建造中だ。
The new bridge is under construction.	その新しい橋は建設中だ。
The ice is thick enough to walk on.	その上を歩けるほど氷は厚い。
It's your duty to finish the job.	その仕事を終えるのは君の義務だ。
Please finish the work at once.	その仕事を一気にやってしまいなさい。
I'm not familiar with that subject.	その件には明るくないのです。
The company shares give a high yield.	その会社の株は高配当だ。
It's a very big and busy city.	そこはとても大きくてにぎやかな都市だ。
Has John decided on a career yet?	ジョンはもう職業を決めましたか。
It was raining around Chicago.	シカゴのあたりでは雨が降っていました。
I am only too glad to be with you.	ご一緒できとてもうれしいです。
This is a difficult problem to solve.	これは始末の難い問題だ。
This does not square with your story.	これは君の話と合わない。
This may not suit your taste.	これはあなたの口に合わないかもしれない。
The trip is farther than I expected.	この旅は思った以上に遠い。
This medicine will do you good.	この薬はあなたの病気に効くでしょう。
This gate allows access to the garden.	この門から庭に入れる。
You may not smoke in this room.	この部屋では喫煙をしてはいけません。
Go straight ahead on this street.	この道をまっすぐ行ってください。
This road leads to the public hall.	この道は公会堂に続いている。
This car is not so nice as that one.	この車はあれほど良くない。
This desk is better than that one.	この机はあの机よりも上等です。
The coat doesn't have any pockets.	このコートにはポケットがない。
Let the tea draw for ten minutes.	このお茶は、１０分間煎じなさい。
My fingers left marks on the glass.	コップに私の指の跡がついた。
Don't talk in a loud voice here.	ここでは大声で話してはいけません。
Would you like to have some coffee?	コーヒーを少しいかがですか。
Let's talk over a cup of coffee.	コーヒーを飲みながら話しましょう。
Please bring us two cups of coffee.	コーヒーを２杯お願いします。
It's about time you got the tea ready.	お茶を準備すべき頃だ。
It's nice of you to see me off.	お見送りくださってどうもありがとう。
Put your coat on my account.	おまえの上着は私の勘定につけておきなさい。
I did nothing out of the ordinary.	おかしなことは何もしなかった。
Some day we'll take a trip to India.	いつかインドへ旅行しよう。
Move the chair nearer to the desk.	いすをもっと机に近づけなさい。
The English are a practical people.	イギリス人は実際的な国民だ。
That's a problem difficult to solve.	あれは解決が困難な問題だ。
To some extent I agree with you.	ある程度まで私はあなたに同意する。
I agree with you to a certain extent.	ある程度まで君に賛成だ。
Don't be too dependent on others.	あまり他人を頼ってはいけません。
Have you finished reading that book?	あの本は読み終えましたか。
I think you're a really nice guy.	あなたは本当にいい人だと思うよ。
I asked him if he was busy.	あなたは忙しいのですかと私は彼に聞きました。
Apart from you, we are all poor.	あなたは別として、我々は皆貧しい。
You must speak in a loud voice.	あなたは大声で話さなければならない。
You don't have to talk so loud.	あなたはそんな大声で話す必要はない。
You will be welcome at any time.	あなたはいつでも歓迎されています。
You could be right, I suppose.	あなたの言うことは正しいかもしれない。
Let me introduce my mother to you.	あなたに母を紹介させて下さい。
Don't give up. Stick with the job.	あきらめるな。仕事に頑張れよ。
It has rained for three days on end.	３日間雨が降り続いている。
John is the taller of the two.	２人のうちでは、ジョンの方が背が高い。
I have a previous engagement at ten.	１０時には先約があります。
"Give me a fresh bottle," he said.	「もう一本くれ」と彼が言った。
Did you read that thick book?	あなたは、あの分厚い本を読んだのですか。
I don't agree with you smoking.	あなたがタバコを吸うのは感心しない。
There is no telling who did this.	誰がこれをしたのかはわからない。
I can't believe it's raining again.	また雨だなんて信じられない。
X was supposed to be above everything else.	Xを第一とした
He is finally starting college life.	いよいよ大学生活が始まります
He eats three meals with the bear.	彼がクマと一緒に３度の食事をとる
Both are showing an increasing trend.	共に増加の傾向が見られます
He gets angry with X all of the time.	彼がXにいちいち腹を立てる
June is a social season in London.	六月はロンドンでは社交の季節だ。
It rained three times during the trip.	旅行中に雨が三回降った。
Don't come unless I tell you to.	来なさいと言わない限り来ないように。
All the family meet at evening meals.	夕食には家族全員がそろう。
We've got to stick to the point.	問題点からそれないようにしましょう。
Just shut up and get on with your work!	黙って仕事をしなさい。
The trees kept me out of the rain.	木のおかげで雨にぬれずにすんだ。
Making a model plane is interesting.	模型飛行機を作るのは楽しい。
I don't quite agree with you.	僕は君と全く同意見であるというのではない。
Mother was very busy most of the time.	母は大抵大変忙しかった。
I'm sorry for the delay in responding.	返事が遅れてすいません。
Flat land has no mountains or hills.	平らな土地には山も丘もない。
I wore a coat lest I catch a cold.	風邪引かないようにコートを着た。
Would you like another glass of wine?	葡萄酒を一杯いかがですか。
Father gave an angry look at me.	父は怒った顔をして私をちらっと見た。
My father is the tallest of us all.	父は私たちの中で一番背が高い。
Father is now busy writing a letter.	父は今手紙を書くのに忙しい。
The plane took off exactly at six.	飛行機はちょうど六時に離陸した。
The plane takes off in ten minutes.	飛行機は１０分後に離陸します。
Make a clean breast of your secrets.	秘密を残らず打ち明けなさい。
She mentioned my name in her book.	彼女は本の中で私の名前に触れた。
She extended a warm welcome to them.	彼女は彼らを暖かく歓迎した。
She felt herself torn apart.	彼女は自分自身が引き裂かれるような気がした。
She treated me to a cup of tea.	彼女は私に紅茶を１杯ふるまってくれた。
She introduced the lady to me.	彼女は私にその婦人を紹介してくれました。
She didn't appear to recognize me.	彼女は私と分からなかったようだ。
She is wearing a nice dress now.	彼女は今はすてきなドレスを着ている。
She is almost as tall as you.	彼女は君とほとんど同じぐらいの背の高さだ。
She broke herself of the habit of smoking.	彼女は禁煙した。
She pressed the child to her breast.	彼女は胸に子供を抱きしめた。
She is said to be a domestic woman.	彼女は家庭的な女性だそうです。
She answered with hardly a smile.	彼女はろくに微笑みをみせず答えた。
She wants to become thin very much.	彼女はとても痩せたがっている。
She taught music for thirty years.	彼女は３０年間音楽を教えました。
She is equal to the occasion.	彼女にはその場を切り抜けるだけの力がある。
Why was it that she got angry?	彼女が腹を立てたのはいったいなぜだろう。
They looked on him as their leader.	彼らは彼をリーダーとみなした。
He took a room at the Yaesu Hotel.	彼は八重洲ホテルに一室をとった。
They are in the hands of the gods.	彼らは神の手の中にいるのである。
They required me to keep silent.	彼らは私に黙っているように要求した。
They agreed to work together.	彼らは協力して働くことに意見がまとまった。
They welcomed as many men as came.	彼らはきた人をみな喜んで迎えた。
There was a long winter before them.	彼らの前には長い冬があった。
My love for him has already cooled.	彼への愛はもう冷めてしまった。
He cut some branches off the tree.	彼は木の枝を何本か切り落とした。
He proved to be a good writer.	彼は文章を書くのが上手であるとわかった。
He never fails to come here at three.	彼は必ず３時にここに来る。
He finished the work for himself.	彼は独力でその仕事を完成しました。
He's saving up to go to college.	彼は大学に行けるように貯金している。
He remained silent like a stone.	彼は石のように黙り込んだままだった。
He has a deep feeling for the weak.	彼は弱者に深い思いやりがある。
He asked us not to make any noise.	彼は私達に騒がないように頼んだ。
He asked us not to make any noise.	彼は私達に騒がないように言った。
He has engaged himself to help me.	彼は私を助けてくれると約束した。
He treats me as if I am a stranger.	彼は私をまるで他人行儀に扱う。
He came to see me during my absence.	彼は私の留守中に会いに来た。
He looked at me for an explanation.	彼は私の顔を見て説明を求めた。
He studies contemporary literature.	彼は現代文学を研究しています。
He is studying at Kyoto University.	彼は京都大学で学んでおります。
He appears to be strong and healthy.	彼は頑丈で健康そうに見える。
The section chief keeps him down.	彼は課長に頭を抑えつけられている。
He tried several times, but failed.	彼は何度か試みたが、失敗した。
He was engaged in medical research.	彼は医学の研究に従事していた。
He is less healthy than he used to be.	彼は以前ほど健康でない。
I wonder if he dares try again.	彼はもう一度やる勇気があるのだろうか。
He got out of the habit of smoking.	彼はたばこを吸う習慣をやめた。
He should have finished it by now.	彼はそれをもう終えているはずだ。
He was merely sitting in the place.	彼はその場所でただ座っていた。
He had no confidence to do it.	彼にはそれをするだけの大胆さがなかった。
He is acting for the chief director.	彼が理事長の代行をしている。
Please wait till he comes back.	彼が帰ってくるときまでお待ちください。
It's obvious that he's in the wrong.	彼が間違っているのは明白だ。
It's obvious that you told a lie.	彼が嘘をついたということは明白だ。
He has good reason to get very angry.	彼がひどく怒るのも当然だ。
I stepped aside for him to pass.	彼が通れるように、私はわきに寄った。
He may well respect the artist.	彼がその画家を尊敬するのはもっともだ。
Sunday is the day when I am busiest.	日曜日は私が最も忙しい日だ。
Empty vessels make the most sound.	頭の空っぽな者ほど良くしゃべる。
He and I were in the same camp then.	当時彼と私は味方同士だった。
You may extend your stay in Tokyo.	東京滞在を延ばしてもいいですよ。
You should never fail to make efforts.	努力を怠ってはいけない。
Ice turns to water when it gets warm.	暖かくなると氷は水になる。
No one could solve the problem.	誰もその問題を解くことはできなかった。
Who taught them table manners?	誰が彼らにテーブル・マナーを教えますか。
Make the most of your college life.	大学生活を有効に過ごしなさい。
What do you want to study at college?	大学では何を勉強したいの？
What are you going to do in college?	大学で何をするつもりですか。
The heavy rain kept us from going out.	大雨で外出できなかった。
Many students have failed the test.	多くの生徒がその試験に落ちた。
The ship was ready to sink any time.	船は今にも沈みそうであった。
Traveling by boat is a lot of fun.	船で旅行するのは大変面白いです。
It was a very busy month last month.	先月はとても忙しい月でした。
There used to be a hotel about here.	昔この辺りにホテルがあった。
The drunk rolled up to him.	酔っぱらいはよろよろと彼のところへやって来た。
Do you ever study in the library?	図書館で勉強することがありますか。
God created the world in six days.	神は、この世を６日間で創造した。
Do you believe in the existence of God?	神の存在を信じますか。
Don't make fun of the new student!	新入生をからかってはいけません。
I must get a new suit made.	新しいスーツを仕立ててもらわなければならない。
The table was loaded with fruit.	食卓には果物がどっさりのせてあった。
Terumi gave me a thin smile again.	照美は私に再びうっすら微笑んだ。
Junko is quite familiar with English.	純子は英語に精通している。
It's very nice of you to help me.	手伝って下さって本当にありがとう。
It is a lot of fun to drive a car.	車を運転することは非常に楽しい。
You should stick to what you say.	自分の言った事に忠実であるべきだ。
The game was put off because of rain.	試合は雨のため延期された。
The issue is quite familiar to us.	私達はその問題をよく知っている。
I am short of money for my trip.	私は旅行のための費用が不足している。
I introduced my father to the teacher.	私は父を先生に紹介した。
She and I are about the same height.	私は彼女とほぼ同じ身長です。
I want him to solve the problem.	私は彼にその問題を解いてもらいたい。
I cast my fishing line into the sea.	私は釣り糸を海に投げ入れた。
I am the tallest of all the boys.	私は全ての少年の中で一番背が高い。
I made an effort to finish my work.	私は仕事を終えようと努力した。
I have a black and a white coat.	私は黒の上着と白の上着をもっている。
I'm very much in favor of cutting taxes.	私は減税に大賛成だ。
I found it easy to solve the problem.	私は楽にその問題を解いた。
I don't mind walking in the rain.	私は雨の中を歩くのは気にならない。
I recognized him at first glance.	私は一目見ただけで彼だとわかった。
I am a student at London University.	私はロンドン大学の学生です。
I decided not to go to Europe.	私はヨーロッパへ行かないことを決心した。
I have already finished this book.	私はもうこの本を読み終えました。
I've never gotten on a plane yet.	私はまだ飛行機に乗ったことがない。
I can't feel at home in a hotel.	私はホテルでくつろいだ気になれない。
I can't decide which to choose.	私はどちらを選んでよいか決められない。
I am familiar with this subject.	私はこの問題についてよく知っている。
I can't put up with this smell.	私はこの臭いを我慢することが出来ない。
I am going to America by plane.	私は、飛行機でアメリカへ行くつもりだ。
None of my friends drink coffee.	私の友人はだれもコーヒーを飲まない。
My father gave a nice watch to me.	私の父は私に素敵な時計をくれた。
My father gave up smoking last year.	私の父は去年たばこをやめた。
My father neither smokes nor drinks.	私の父はタバコも酒もしない。
We introduced ourselves to each other.	私たちは自己紹介をした。
We were studying all afternoon.	私たちは午後中ずっと勉強していました。
