It felt empty.	虚しい感じがしました
I did X myself.	Xを私自身がした
It makes a noise when it turns.	曲がるたびに音がする
The family is getting ready for the birthday.	家族が誕生日の準備をします
X will be evaluated.	Xを評価の対象とします
See Appendix.	別表のとおりとする
He introduced the product.	彼が商品の紹介をした
We will make your thoughts a reality.	私たちが想いを形にします
I am in love with my sister.	僕が妹に恋をする
I made a funny face.	自分がおかしな表情をする
It tastes like blood.	血の味がします
He goes through the procedure for a change of address.	彼が住所変更の手続をします
He is about to prepare for the September issue.	彼がそろそろ９月号の準備をする
The teacher pays a visit and gives instructions.	先生方が訪問指導をします
It's geared towards experienced people.	経験がある人を対象にしています
He conducted an experiment.	彼がある実験をした
Everyone in the class evaluated it well.	クラスの誰もが好評価をした
It was decided that plans should be submitted within one year.	計画案の提出期限を、原則として一年以内としました
The majority of people have action training.	ほとんどの人がアクションの訓練をする
There are indeed appropriate reasons for X.	Xにはちゃんとそれなりの理由が有る
There are three ways to specify it.	指定方法には３つ方法が有ります
That place is still nearby.	くだんの場所が近くにまだ有る
The hospital, and I, the director of hospital, certainly take full responsibility.	もちろん院に、そして院長の私に全ての責任が有る
The father has a permanent disability.	父親が一定の障害の状態に有る
Nearly every island has one like that.	ほとんどの島にこのような物が一つは有る
The words are very powerful.	とても言葉に力が有りました
Someone has said clearly ～.	〜と誰かがはっきり言った
He clearly tells his teacher and friends about his own opinions.	彼が先生や友達にはっきり自分の意見を言う
He spent nearly ten years working in parts of more than 60 countries.	彼が６０カ国以上の地域で１０年ちかくの活動を行った
He made old-fashioned toys with me/them.	彼が一緒に昔のおもちゃ作りを行いました
He delivered an 18-minute speech on the subject	彼があのタイトルで１８分の発表を行った
He will review how the seminar is implemented.	彼がセミナーの実施方法の検討を行う
He determines future directions.	彼が今後の方向付けを行います
We provide the following array of services to our company employees:	われわれが社員向けに以下の各種サービスを行います
The following behavior is not allowed during the provision of this service.	本サービスを提供するにあたり、以下の行為を行ってはならない
Seven proposals were put forward at the educational reform meeting	教育再生会議が、７つの提言を行いました
The cultural club will exhibit their works.	文化系のサークルが作品の展示を行う
I will provide advice concerning the usage to those who are currently using it.	実際に使用している方には私が使用方法のアドバイスを行います
He conducts X approximately 50 times.	彼がXを５０回ほど行います
Specifically, I have two methods in my mind.	私が具体的には２つの方法を考えている
He thinks about yesterday's problems.	彼が昨日の問題を考える
We think about the challenges and future directions of environmental problems.	環境問題について、課題と将来の方向を考える
Thought should be given to building a society where it is not easy to obtain guns.	銃が入手しにくい社会の仕組みを考えるべきだ
He will see himself for the first time.	彼が初めて自分の姿を見る
It just suits X.	Xにちょうど都合が良い
There are many serious opinions.	厳しい意見が多い
Most of the contents could be put into practical use immediately.	すぐに授業に活かせる内容が多かった
I myself have my own firm ideas. 	自分自身がしっかり自分の考えを持つ
31 people have some sort of disability.	３１人が身体に何らかの障害を持つ
I am responsible for their behavior.	彼らの行動には私が責任を持ちます
I have a disability certificate.	私は障害者手帳を持っています
He has the experience working for the labor union.	彼が組合活動の経験を持っている
That has three elements.	それが三つの要素を持っています
He had very little accurate information.	彼は正確な情報をほとんど持っていなかった
Anyone who needs nursing care can use the external nursing care insurance service.	要介護者の場合は、外部の介護保険サービスの利用が出来ます
When this is used, the date and delivery time can be specified.	これを利用する場合、期日、配達時間の指定が出来ます
A Japanese restaurant opened nearby.	近所に日本料理の店が出来ました
I can judge by myself.	自分で判断が出来る
My brain couldn't keep up with the current situation.	頭が今の状況についていけなかった
X immediately caught my eye.	Xがすぐ目についた
There are always errors for over 8 meters.	８Ｍ以上の所で必ずエラーが出ます
Everyone leaves the university together at 5 o'clock.	５時には，みんなで大学を出る
The possibility has been raised.	可能性が出てきた
No one famous is taking part in the competition.	有名な人が大会に出ない
X seems to be a popular circuit.	Xが庶民的サーキットの印象を受ける
That was confirmed by the chairman later.	それが委員長の後閲を受けた
He received the nursing care insurance service.	彼が介護保険のサービスを受ける
I didn't receive any notification.	私は連絡を受けていなかった
I was treated in that way.	自分がそういう扱いを受ける
The chairman said X was everything.	Xが全てと会長に言われました
He doesn't get stressed at all in these situations.	彼はこの状況に全くストレスを感じない
I feel that he is powerful.	私は彼にすごいパワーを感じます
He felt that he had reached the limits of his strength.	彼は体力の限界を感じました
He heard the sound of waves for the first time.	彼は初めて波の音を聞きました
In this case, you must follow the set procedures by the end of February.	この場合は、２月末日までに所定の手続きが必要だ
Considerations need to be taken.	配慮が必要だ
Further consideration will be needed.	さらに今後の検討が必要だ
That mechanism is really needed.	その仕組みがどうしても必要だ
In this case, please use the special conversion software.	この場合は専用の変換ソフトを使え
I use this lens.	私はこのレンズを使います
I used a straight cable to connect it to the computer.	パソコンとの接続にはストレートケーブルを使った
It takes a lot of brains to do that.	それにはかなり頭を使う
I'm using the regular expression as it is in the search.	検索に正規表現をそのまま使っています
Someone used teleportation magic.	誰かが場所移動の魔法を使った
I was shocked and couldn't hear anything the professor said.	ショックで教授の声がまったく耳に入らなかった
He took a bath with his children.	彼が子どもと一緒に風呂に入った
In the winter of my junior year, I got a call from a friend.	３年生の冬、友人から１本の電話が入る
The computer turns on automatically.	勝手にパソコンの電源が入る
He reads the next part immediately.	彼が早速その続きを読む
We especially put effort into training personnel.	当社は特に人材育成に力を入れています
I put my cold hands into my jacket pocket.	私は冷たい手をジャケットの懐に入れた
The parents and I give the children a bath.	私が親と一緒に子供を風呂に入れる
He/She will take X into consideration.	Xを本人が考慮に入れる
I understood X very clearly.	Xが、はっきりと分かりました
Please change the bookmark settings.	ブックマークなどの設定変更をお願いします
We asked Professor Yamada at Kyoto University to give a special lecture.	この特別講演を京都大学教授の山田先生にお願いいたしました
He will introduce the work in a high-definition video that's about three minutes long.	彼が作品を３分ほどの高画質動画で紹介します
I will show my recommended sites for each genre.	私がジャンルごとにお勧めのサイトを紹介します
He teaches people how to make Chinese dishes in detail.	彼が詳細に丁寧に中華料理の作り方を紹介します
Japan still doesn't have anyone who can provide proper direction.	正しく指導できる人が日本にまだいなかった
I have a daughter in the second grade.	私には、小学２年生の娘が一人います
Many people aim to pass the certification exam.	多くの人が検定試験の合格を目指します
He will write a song for himself for the first time.	彼が初めて自分の曲を作る
I'll be making the game myself.	自分がゲームを作る
I ate ramen here by myself.	一人でここのラーメンを食べた
He immediately writes the morning report.	彼が早速、午前中の記事を書きます
He writes sentences in Japanese.	彼が日本語の文章を書く
Every time it's shown on the display, I write a program myself.	画面に表示するたびに私がプログラムを自分で書く
Write the conclusion first.	結論を先に書く
He immediately turns on the TV.	彼がすぐにテレビをつける
I/We will have dinner with him/her/them.	一緒にご飯を頂く
It takes a lot of labor to complete it.	完成するまでには多くの人手がかかります
I'm sorry I caused everyone so much trouble.	本当にみなさんにお世話をかけました
I'm sorry to trouble you.	お手数をおかけいたします
The principal got a board approval in advance.	校長はあらかじめ理事会の承認を得た
He got approval from the chair in advance.	彼があらかじめ議長の許可を得た
He earns money over the internet.	彼はネットで収入を得ている
They got a golden opportunity.	彼らが絶好の機会を得た
He quickly came to a conclusion.	彼がすぐに結論を出した
He doesn't know the shocking facts yet.	彼はまだ衝撃の事実を知らない
The city government expressed its view that it was reasonable.	市はそれが妥当との見解を示した
That indicates the performance in ideal conditions.	それは理想的な場合の性能を示します
I will present one of these directions.	私が、その一つの方向性を示します
We implemented improvements to the administrative evaluation system.	私たちは事務事業評価システムの改善を実施しました
I'm going to the nearby park with them.	一緒に近くの公園に行く
It was my first time going to the live concert on New Year's Eve.	私は今回、初めて３１日の年越しライブに行きました
The ball comes in any direction I want.	欲しいところに必ずボールが来る
My father keeps walking on ahead.	父がどんどん先に行く
It certainly damages the hair root.	それが確実に毛根にダメージを与える
The chairman gives the member an opportunity to explain.	会長はその会員に弁明の機会を与えた
A healthy exchange of ideas will be generated.	活発に意見の交換等が行われます
He will verify all of the movements.	彼が全ての動作を確認します
He immediately returned to home.	彼がすぐに自分の家に戻った
It immediately goes back to its original state.	すぐ元の状態に戻る
The authors hold regular seminars in various regions.	著者が各地で定期セミナーを開催します
Our company will have an admission-free event.	弊社は無料開放イベントを開催します
Let’s play baseball together.	いっしょに野球をやろう
My brother runs the shop by himself.	兄さんが一人で店をやっている
There are live concerts on late-night TV.	ライブを深夜にテレビでやる
There is a possibility of changes.	変更の可能性が御座います
Don't take the medicine immediately.	すぐ薬を飲むな
It got in front of the automatic door again.	それが再び自動ドアの前に立ちました
Those who can work on their own initiative are leaders. 	自ら働ける人が人の上に立つ
He searches for nearby stores.	彼が周辺の店を探す
He looks for a part-time job nearby.	彼が周辺エリアのアルバイトを探す
We have collected items that are especially popular with women.	特に女性に人気の商品を集めました
He used it as a raw material.	彼がそれを原料に使用した
We used fresh, 47% high-fat cream.	生クリームに高脂肪４７％のクリームを使用しました
We use cookies to collect information.	情報の収集にクッキーを使用しています
Each lens is a high resolution lens.	各レンズに高解像度のレンズを使用しています
He took the train before 9 o'clock for the first time in a while.	彼が久しぶりに９時前の電車に乗った
He immediately bought a CD.	彼が早速１枚のＣＤを買った
He immediately bought a book.	彼が早速一冊の本を買いました
Rather, the possibility of that is higher.	むしろ、その可能性のほうが高い
There is a very high chance of rain.	かなり雨の確率が高い
X can be clearly seen.	Xが目にはっきりと見える
I can see the ocean over there from the window of my room.	部屋の窓からは向こうに海が見える
 We can see the tournament directors over there. 	あそこに大会役員のすがたが見える
The agency announced ～ on the 24th.	〜と所属事務所が２４日に発表した
Now it works for terminal cancer patients.	それが現在では末期癌患者の治療に一定の効果を上げています
The company earns a profit from X.	企業がXで利益を上げる
The counter has already exceeded 5,000.	カウンターが既に５０００を超えました
The counter finally exceeded one million.	とうとうカウンターが百万番を超えました
The percentage of people with 1 BMI above 30 is more than 20% of the population.	ＢＭＩが３０以上の人の割合が人口の２０％を超えています
It goes beyond the company scope.	それが企業の枠を超えています
He realized that there was something wrong with him.	彼が体の異変に気付く
It will determine the direction for training in the future.	それが今後の調教の方向性を定める
That will determine policy direction.	それが施策の方向を定めます
This labor union set the following as a basic policy for personal information.	当組合は個人情報の保護のための基本方針を以下のとおりに定めました
One of them had their second birthday on the 14th.	その内の一人が１４日、２歳の誕生日を迎えました
The battle began.	戦いが始まりました
The following screen will be shown automatically.	自動的に以下の画面が表示される
You can decide the period of the contract.	自由に契約期間の設定が可能だ
I will give my thoughts at the end.	最後に私の感想を述べます
77% of people are receiving services covered by nursing insurance.	７７パーセントの人が介護保険のサービスを利用しています
He uses a well-established dating site.	彼が老舗の出会い系サイトを利用する
He took the highway bus to go to Kyoto.	彼が京都への移動に，高速バスを利用した
Now national conventions are held in various regions.	現在、各地で全国大会が開催されています
Next week, the lecture will be held at last.	講演会がいよいよ来週に開催されます
Completely dry it off.	水気をしっかり切ります
If I/we call him, he hangs up immediately.	こっちからかけると彼がすぐに電話を切る
He studies the Yamada Therapy with keywords.	彼が山田療法をキーワードで学びます
He learns basic English expressions.	彼が英語の基本表現を学びます
I remember that feeling very well.	はっきりとその感覚を覚えている
At first, you have to learn how to use the kana-kanji conversion software.	まずあなたが日本語変換ソフトの使い方を覚えます
I clearly remember what happened on that day.	僕はその日の事をはっきりと覚えている
They've been talking about baseball for a while.	しばらく野球の話が続きます
I like big-sister types.	姉さんタイプの女の人が好きだ
Let's take some measures immediately.	すぐになんらかの行動を起こしましょう
We will tell you about the images and wallpapers.	画像や壁紙などの案内を致します
X is the most important part of prevention.	Xが予防には何より大切だ
He prepared a report.	彼が報告書を作成しました
The city government prepared the balance sheet for 2001.	市が２００１年度のバランスシートを作成しました
He cracked his eyes open.	彼がわずかに目を開いた
Those who passed the national exam account for more than 60% of the total.	国家試験合格者が全体の六割以上を占める
X accounts for a large percentage	Xが大きな割合を占める
He immediately appeals to people nearby for assistance.	彼がすぐに近所の人に助けを求めます
Evaluate the values for B1-B6.	Ｂ１〜Ｂ６の値を求めます
A look of surprise flashed on his face when he received the offer.	彼はその申し出に一瞬驚きの表情を見せた
He doesn't express himself to his loved ones.	彼は愛する人に自分の思いを伝えていない
Tell people clearly what you want to know.	自分が何を知りたいかを人にはっきり伝えましょう
That doesn't mean that he started his current job immediately.	彼がすぐいまの仕事を始めたわけではない
The sound of waves can be heard clearly.	はっきりと波の音が聞こえる
X has already passed three o'clock.	Xが既に３時を過ぎていた
Yesterday, I finally finished this year's work.	昨日、やっと今年の仕事が終わりました
The work was finally done at 11 o'clock.	作業が何とか１１時に終わった
～ and the new chairmen talked about their plans for the future.	〜と新会長が抱負を語りました
His/Her eyes immediately lit up.	すぐに目の色が変わった
He'll use this experience in his future junior high school career.	彼がこの体験を、今後の中学校生活に生かします
He chooses the method of operation himself.	彼が運用方法を自分で選びます
I completely forgot X.	Xを私がすっかり忘れた
You can gain economic knowledge without realizing.	自然に経済の知識が身に付きます
That kind of situation happens frequently.	そういう事態がしばしば発生する
He immediately opened the windows in the room.	彼がすぐ部屋の窓を開けた
Click the image to see the enlarged image.	画像をクリックすると更に拡大画像が見られます
He got his nursing assistant certification.	彼が介護福祉士の資格を取る
It takes measures immediately.	それが直ちに措置を取る
He decided on X as his theme.	彼がXを自分でテーマに決める
Then, he will decide on treatment policy for the next time.	彼がその上で次回の治療方針を決めます
The users should never touch the keys on the keyboard.	ユーザーが絶対にキーボードのキーを押さない
He keeps going on Route 38 towards Kyoto.	彼が３８号線をそのまま京都方面に進む
He takes Route 6 towards Kyoto for 10 km.	彼が国道６号線を京都方面へ１０ｋｍ進む
He immediately calls the people in the shop.	彼がとりあえず、店の人を呼ぶ
The live performances generate a reaction in every area.	ライブパフォーマンスが各地で反響を呼ぶ
Each person must first establish an annual sales target.	一人一人がまず年間の売上目標を立てる
I got up at 9 o'clock without fail.	ちゃんと９時頃には起きました
Movement to introduce it into different areas spread.	各地に導入の動きが広がった
The sea spread before my eyes.	海が私の目の前に広がりました
Now, the circle has grown all over the country.	今では全国に輪が広がった
The waves of exchange are growing.	どんどん交流の輪が広がる
I found X by accident.	Xを私が偶然見付けました
He found this website by accident.	彼が偶然このサイトを見付ける
He found the following report by accident.	彼がたまたま以下の記事を見付けました
He always dresses in all-black suits.	彼がいつも黒ずくめのスーツを着る
He is expecting X from my sister and me.	彼がXを姉とあたしに期待する
He will notify the latest information.	彼が最新情報を知らせる
He notifies the user of X.	彼がXをユーザーに知らせる
X is critical for prevention.	Xが予防に大変重要だ
Management is of particular importance during the project.	特に工事期間の管理が重要だ
He bought a book yesterday.	彼が昨日、一冊の本を購入した
Their eye color is slightly different.	微妙に目の色が違う
In addition, the 4th seminar is scheduled for February.	なお、四回目の同セミナーの開催を２月に予定しています
The Happy Birthday song is played.	ハッピーバースデーの音楽が流れる
I have to change myself at first.	私がまず自分を変える
X sees it through a completely different lens.	Xが１８０度視点を変えます
He sits up straight.	彼が背筋をピンと伸ばします
I put my wishes on the strip of paper.	短冊にわたしの願いを込めました
He prepares more than 60 kinds of dishes.	彼が６０種類以上のメニューを用意します
All of our offices will obtain ISO14001 certification by the end of 1999.	当社は１９９９年度末までに、ＩＳＯ１４００１の認証をすべての事業所で取得する
It obtained ISO9001 certification on the 28th.	それがＩＳＯ９００１を２８日に取得した
We do wholesale business and develop IP telephone service.	当社がホールセールビジネスや、ＩＰ電話サービスを展開する
The North Korean nuclear issues catch the world's attention.	北朝鮮の核をめぐる問題が、世界の注目を浴びる
At the same time, it will achieve cost reduction.	それが同時にコストの削減を実現します
He will cross the 100 meter or so bridge.	彼が１００メートルほどの橋を渡る
Next year, he will move to America by himself.	彼が翌年単身でアメリカに渡ります
I realized X.	Xに思いが至った
Our company establishes the system to provide 24-hour support.	当社が２４時間のサポート体制を整えています
Our hospital is prepared to receive patients twenty-four hours.	当院が２４時間の救急受け入れ態勢を整える
His ability is equal or higher than that of the Level 1 piping construction management engineer.	彼が１級管工事施工管理技士と同等以上の能力を有する
The provision is still in effect.	規定がなお効力を有する
That has no particular limit on the disk size.	それが特にディスク容量に制限を設けていません
He left behind puzzling words.	彼が謎の言葉を残す
They reached a negative conclusion at the end of the discussion.	議論の結果、彼らは消極的結論に達した
It reaches an almost constant level.	ほぼ一定のレベルに達します
He reports the facts and results immediately to the committee.	彼がすみやかに経緯及び結果を委員会に報告する
Three parties decided X at the end of May.	Xを三党が五月末に決定しました
He decides policy.	彼が方針を決定する
We haven't gotten any snow in Tokyo yet this year.	まだ今年、東京には雪が降りません
There will be light rain on the morning of 15th.	１５日の朝、小雨がまだ降る
The temperature difference is extreme.	かなり寒暖の差が大きい
He will carry his bags to the room himself.	彼が自分で荷物を部屋に運びます
Today's paper is carrying an article from yesterday again.	また、今日の新聞に昨日の記事が載っています
It will certainly have a good effect on your body.	それが確実にあなたの体にプラスの効果をもたらします
The translation search function was very useful.	訳語検索機能が大いに役立ちました
Thirteen people have been already lost their lives in traffic accidents.	すでに１３人が交通事故で命を落としている
The train slows down little by little.	電車が、徐々にスピードを落とす
He is the current chairman of the folk song association.	彼が現在、民謡協会の会長を務める
I'm really sorry for my poor health causing so much trouble. 	病気ばかりの日々で皆様には、大変ご迷惑をお掛けしております
Our efforts will finally bear fruit.	ようやく努力が実を結ぶ
