He got all the worse because he took the medicine.	彼はその薬を飲んだためにかえっていっそう病気が悪くなった。
He must have forgotten all about the promise.	彼はその約束のことなんかまったく忘れてしまったにちがいない。
He has made the baseball team.	彼はその野球チームのメンバーになった。
He tried to solve the problem, only to fail.	彼はその問題を解決しようとしたが、失敗した。
He tried to solve the problem, which he found very difficult.	彼はその問題を解こうとしたが、とても難しいことがわかった。
He tried to solve the problem.	彼はその問題を解こうとした。
We think it possible for him to solve the problem.	彼はその問題を解けると思います。
He found it difficult to solve the problem.	彼はその問題を解くのに苦労した。
It took him ten minutes to solve the problem.	彼はその問題を解くのに１０分かかった。
He was able to solve the problem.	彼はその問題を解くことができた。
He solved the problem by himself.	彼はその問題を一人で解決した。
He solved all of the problems simply.	彼はその問題をすべて簡単に解いた。
He solved the difficult problem easily.	彼はその問題をあっさり解いた。
He does not know how to solve the problem.	彼はその問題の解き方が解らない。
He doesn't seem to be aware of the problems.	彼はその問題に気づいていないようだ。
He debated on the problem with his parents.	彼はその問題について両親と討論した。
He connects himself with the law firm.	彼はその法律事務所に関係している。
He started at the noise.	彼はその物音にぎょっとなった。
He had the room to himself.	彼はその部屋を一人で使っていた。
He was alone in the room.	彼はその部屋でひとりだった。
He took a picture of the beautiful landscape.	彼はその美しい風景をカメラに収めた。
He kept the secret to himself.	彼はその秘密を人にもらさなかった。
He made a profit of ten thousand dollars on the sale.	彼はその販売で１万ドルの利益をあげた。
He did hard manual labor through the day.	彼はその日ずっと、つらい手仕事をやった。
He participated in the debate.	彼はその討論に参加した。
He drew his conclusions based on that survey.	彼はその調査から結論を引き出した。
He seemed surprised at the news.	彼はその知らせを聞いて驚いているようだった。
He knew the news, but he kept it to himself.	彼はその知らせを知っていたが、自分の胸にしまっておいた。
He was surprised at the news.	彼はその知らせに驚いた。
He threw the big man down.	彼はその大男を投げ倒した。
He was granted admission to the university.	彼はその大学への入学を許可された。
He threw a stone at the big dog.	彼はその大きな犬に向かって石を投げた。
He served as the pilot of the ship.	彼はその船の水先人を勤めた。
He is said to have taken part in the battle.	彼はその戦いに参加していたと言われている。
He put on the red jacket.	彼はその赤い上着を着た。
He decided on the red car.	彼はその赤い車に決めた。
He assumed the leadership of the political party.	彼はその政党の主導権をにぎった。
He assumed the leadership of the political party.	彼はその政党の指導権をにぎった。
He did not repeat the truth to anyone.	彼はその真相を誰にも知らせなかった。
It seems that he is aware of the fact.	彼はその真実に気付いているようだ。
He was surprised at the scene.	彼はその場面を見て驚いた。
He applied for admission to the riding club.	彼はその乗馬クラブへ入会を申しこんだ。
He reported the details with accuracy.	彼はその詳細を正確に報告した。
It took him three years to write the novel.	彼はその小説を書くのに３年かかった。
When he met the lady, he raised his hat.	彼はその女性に会うと、帽子を上げて会釈した。
He seems not to have realized its importance.	彼はその重要さを理解していなかったようだ。
He is an expert at solving such problems.	彼はその種の問題を解決する名人だ。
When he got the letter, he burned it without reading it.	彼はその手紙を受け取ると、読みもしないでそれを燃やした。
He decided to sell the car.	彼はその車を売る決心をした。
He doesn't have to wash the car.	彼はその車を洗う必要はない。
He tried the experiment again and again.	彼はその実験を何度も試みた。
He was the first to carry out the experiment.	彼はその実験をした最初の人でした。
He was puzzled at the question.	彼はその質問に当惑した。
He may have been ill then.	彼はその時病気だったのかもしれない。
He was late as a result of the accident.	彼はその事故の結果遅刻した。
He gave a detailed description of the accident.	彼はその事故のことをくわしく述べた。
He is responsible for the accident.	彼はその事故に対して責任がある。
He is responsible for the accident.	彼はその事故に責任がある。
He is a third party to the accident.	彼はその事故には関係ありません。
He described the accident in detail to the police.	彼はその事故について警察に詳しく説明した。
He has something to do with the traffic accident.	彼はその事故と関係がある。
He studies hard to pass the exam.	彼はその試験に合格するために熱心に勉強します。
He got a fair mark in the examination.	彼はその試験でまあまあの点をとった。
He liked the boy's frank way of speaking.	彼はその子の率直なものの言い方が好きだった。
He gave the child a toy.	彼はその子におもちゃを与えた。
He has decided to carry on the work.	彼はその仕事を続けることに決めた。
He did the work for himself.	彼はその仕事を自分でやった。
He has done the work completely.	彼はその仕事を完全にやった。
He labored to complete the work.	彼はその仕事を完成しようと努力した。
He applied himself to the task.	彼はその仕事に打ち込んだ。
He is the last man that is suited for the job.	彼はその仕事にまったく適していない人だ。
He is aware that the work is difficult.	彼はその仕事が困難であることを承知している。
He has got over the trouble.	彼はその困難をきりぬけた。
He put on the black coat.	彼はその黒いコートを着た。
He is the principal of the high school.	彼はその高校の校長です。
He may not have known the formula.	彼はその公式を知らなかったのかもしれない。
He has something to do with the traffic accident.	彼はその交通事故と関係がある。
He threw a stone at the dog.	彼はその犬に石を投げた。
He threw a stone at the dog.	彼はその犬に石ころをなげつけた。
He played a minor part in the play.	彼はその劇でわき役を演じた。
He decided to get on with the plan.	彼はその計画を続ける決心をした。
He made a speech in support of the plan.	彼はその計画を支援する演説をした。
He made a speech in support of the plan.	彼はその計画に支持する演説をした。
He contributed fifty dollars to the project.	彼はその計画に５０ドル寄付をした。
He regarded the money as gone.	彼はその金をなくなったものと考えた。
He won the race easily without being fully extended.	彼はその競争にやすやすと勝った。
He wants to participate in the contest.	彼はその競技に参加したがっている。
He paid as much as a million dollars for the painting.	彼はその絵に１００万ドルも支払った。
He made great efforts to stop the reform as best he could.	彼はその改革を止めさせようと出来るだけ努力した。
He made a speech in English at the meeting.	彼はその会合で英語で演説した。
He entered up the sum in his account book.	彼はその会計簿に金額を記入した。
He was dressed in a dark suit at the meeting.	彼はその会議で黒っぽいスーツを着ていた。
He has decided not to go to the meeting.	彼はその会にでかけないことに決めた。
He was burned to death in the fire.	彼はその火事で焼け死んだ。
He was the brains behind the plot.	彼はその陰謀の陰の指導者だった。
He represented the labor union on the committee.	彼はその委員会で労働組合の代表をつとめた。
He won the race easily.	彼はそのレースに簡単に勝った。
He bought me the radio for ten dollars.	彼はそのラジオを１０ドルで買ってくれた。
He wasn't the kind of father to make much of such matters.	彼はそのような事柄を重視するような父親ではなかった。
He makes a rule of attending such meetings.	彼はそのような会には必ず出席するようにしている。
He asked me to throw the ball back.	彼はそのボールを投げ返してくれと言った。
The translation of the French novel took him more than three months.	彼はそのフランスの小説を翻訳するのに３か月以上かかった。
He found the party was rather slow.	彼はそのパーティーはかなり退屈でした。
He looked surprised at the news.	彼はそのニュースを聞いて驚いたように見えた。
He was surprised to hear the news.	彼はそのニュースを聞いて驚いた。
I'm sure that he will take part in the contest.	彼はそのコンテストに参加するだろう。
He thought it over and decided not to go.	彼はそのことを熟考し、行かないことに決めた。
He thought it over and decided not to go.	彼はそのことをよく考えてみて、いかないことに決めた。
He is in great trouble about that.	彼はそのことでひどく困っている。
He applied for admission to the club.	彼はそのクラブへの入会を申し込んだ。
He wanted the toy worse than before.	彼はそのおもちゃを前よりもいっそう欲しがった。
We'd better leave him alone.	彼はそっとしておいてやろう。
He forgot his promise to go there.	彼はそこへ行くという約束を忘れた。
He knows better than to go there alone.	彼はそこへ一人で行くようなばかなことはない。
He lived there all by himself.	彼はそこに全く一人で住んでいた。
He forgot his promise to go there.	彼はそこに行くという約束を忘れた。
He was alone there.	彼はそこに一人でいた。
He examined the house with an eye to opening a store there.	彼はそこで店を開く為にその家を調べた。
No sooner had he said it than he was sorry.	彼はそう言ったとたんに後悔した。
He said it, and what was more surprising, he did it himself.	彼はそう言ったが、さらに驚いたことには、自分自身でそれを実行した。
He has at most 100 dollars.	彼はせいぜい持っていて１００ドルだ。
He will pay 20 dollars at most.	彼はせいぜい２０ドルしか払わないだろう。
He paid at most ten thousand dollars.	彼はせいぜい１万ドル払っただけだ。
He has not more than 10 dollars.	彼はせいぜい１０ドルしか持っていない。
He has a hundred dollars at most.	彼はせいぜい１００ドル足らずしか持っていない。
He has a hundred dollars at most.	彼はせいぜい１００ドルだけしか持っていない。
He's keeping a straight face.	彼はすました顔をしていますね。
He solved all the problems.	彼はすべての問題を解いた。
He used to try very hard to get straight As.	彼はすべてＡをとるために大変な努力をしたものだった。
He applied himself to the study of Spanish.	彼はスペイン語の研究に専心した。
He ignored the speed limit and drove very fast.	彼はスピード制限を無視して、とても速く走った。
He proved to be a spy.	彼はスパイだと判明した。
He found a nice apartment for Mary.	彼はすてきなアパートをメアリーにみつけてやった。
He was completely worn out.	彼はすっかり疲れきっていた。
He left immediately.	彼はすぐに出発した。
He didn't keep his promise that he would telephone me soon.	彼はすぐに私に電話するという約束を破った。
He is quick to speak but slow to act.	彼はすぐに口に出すが、なかなか実行しない。
He took the initiative in carrying out the plan.	彼はすぐに計画を実行した。
He gave me a promise to come back soon.	彼はすぐにここに戻ると私に約束した。
He has to get up immediately.	彼はすぐおきなければならない。
He fell and broke his arm while he was skiing.	彼はスキーをしているときに、転んで腕を折った。
He bought a suit for cash.	彼はスーツを現金でかった。
He promised that he would treat John as his own son.	彼はジョンを自分の息子として扱うことを約束した。
He got fired for making waves too often.	彼はしょっちゅう悶着を起こしたため、首になった。
He came to listen to jazz.	彼はジャズを聴くようになった。
He is a good enough authority on jazz.	彼はジャズに関しては十分信頼できる権威者だ。
He knows everything that there is to know about jazz.	彼はジャズについて知るべきすべてのことを知っている。
He likes jazz, and so do I.	彼はジャズが好きだが、私もまたそうだ。
We decided to leave him alone for a while.	彼はしばらく構わずにほっておくことにした。
He often acted without regard to the feelings of others.	彼はしばしば他人の感情を無視して行動した。
He often eats breakfast there.	彼はしばしばそこで朝食をとる。
He took Jane out for dinner.	彼はジェーンを食事に連れ出した。
He was contemporary with Shakespeare.	彼はシェークスピアと同時代の人だった。
He had jeans on.	彼はジーンズをはいていた。
He got himself up as Santa Claus.	彼はサンタクロースの扮装をした。
He chooses his job only in term of salary.	彼はサラリーだけによって仕事を選びます。
He is a frank person and easy to talk to.	彼はざっくばらんな人柄なので話しやすい。
He was a regular member of the soccer club.	彼はサッカー部のレギュラーだった。
He is a soccer player.	彼はサッカー選手です。
He likes soccer a lot.	彼はサッカーを大いに楽しんでいる。
He likes playing soccer.	彼はサッカーをするのが最も好きだ。
He plays soccer.	彼はサッカーをしている。
He is noted as a soccer player.	彼はサッカーの選手として有名だ。
He got his arm broken while he was playing soccer.	彼はサッカーの競技中に腕を骨折した。
He is good at soccer.	彼はサッカーが得意だ。
He likes soccer.	彼はサッカーが好きだ。
He will pass the coming examination.	彼はこんどの試験に合格するだろう。
He doesn't look willing to come to the concert.	彼はコンサートに喜んで来るようには見えない。
He wants these shirts washed.	彼はこれらのワイシャツを洗ってもらいたいのです。
He is in trouble.	彼は困っている。
He has a great attachment to this town.	彼はこの町に強い愛着を持っている。
It took him five years to write this novel.	彼はこの小説を書くのに５年かかった。
He has spent three years writing this novel.	彼はこの小説を書くのに３年を費やした。
He keeps this gun loaded.	彼はこの銃に弾丸を込めたままにしている。
He finished this work for himself.	彼はこの仕事を独力で完成した。
He has this large room to himself.	彼はこの広い部屋を独り占めしている。
He lives in this neighborhood.	彼はこの近所に住んでいる。
He made good progress in handling this machine.	彼はこの機械の操作が大変進歩する。
He has been ill in bed for a week.	彼はこの一週間病気で寝ている。
He's a regular at the bars and pubs around here.	彼はこのあたりの店では顔がきくんだ。
He took Connie for my sister.	彼はコニーを私の姉だと誤解した。
He emptied his glass.	彼はコップの中身を飲み干した。
He told a funny story.	彼はこっけいな話をした。
He promised me to come here.	彼はここに来ると私に約束した。
He turned his coat inside out.	彼はコートを裏返しにした。
He put on his coat and left the house.	彼はコートを着て、家を出た。
He took his coat off and set to work.	彼はコートを脱いで、仕事にとりかかった。
He took off his coat.	彼はコートを脱いだ。
He has taken all this trouble for nothing.	彼はこう行った面倒なことをすべて引き受けたが無駄だった。
He graduated from Cambridge with honors.	彼はケンブリッジ大学を優等で卒業した。
He is the last person to speak ill of others.	彼はけっして他人の悪口を言うような人ではない。
He doesn't look himself this morning.	彼はけさいつものような元気がない。
He promised to come, but hasn't turned up yet.	彼はくると約束したが、まだ現れない。
He makes a point of attending class meetings.	彼はクラス会には必ず出席する。
He towers above the rest of the class.	彼はクラスの誰よりもずば抜けて背が高い。
He makes a point of attending class meetings.	彼はクラスの会合には必ず出席している。
He can play tennis better than any other boy in his class.	彼はクラスのどの少年よりも上手にテニスをすることができる。
He can play tennis better than any other boy in his class.	彼はクラスのどの少年よりもテニスを上手にできる。
He set out on a trip yesterday.	彼はきのう旅行に出発した。
He wrote a letter yesterday.	彼は昨日手紙を書いた。
He is the doctor about whom I talked yesterday.	彼はきのう私が話題にした医者です。
He is the doctor about whom I talked yesterday.	彼はきのう私が課題にした医者です。
He walked in the park yesterday.	彼はきのう公園を散歩した。
What did he do yesterday?	彼はきのう何をしましたか。
He is not the boy who came here yesterday.	彼は昨日ここへきた少年ではない。
I'm sure he will carry out his promise.	彼はきっと約束を果たすよ。
He is sure to pass the examination.	彼はきっと試験に合格するだろう。
I am sure of his passing the examination.	彼はきっと試験にパスすると思う。
I'm sure he'll pass the coming exam.	彼はきっと今度の試験に合格するだろう。
I am sorry to have missed the TV program last night.	私は昨晩そのテレビ番組を見逃してしまって残念だ。
Who is that woman holding the flowers?	花を持っているあの女性は誰ですか。
I'm sure that he will take part in the contest.	彼はきっとそのコンテストに参加するだろう。
He appeared at 5 o'clock to the minute.	彼はきっかり５時に姿を見せた。
He cut his finger in opening a can.	彼は缶詰をあけているうちに指を切った。
His sisters as well as he are now living in Kyoto.	彼ばかりでなく彼の姉妹達も今は京都に住んでいます。
He is quite good at his job, but lacks initiative.	彼はかなり仕事が出来るが率先力にかける。
He has earned a lot of money.	彼はかなりの金をもうけた。
He won but only at a price.	彼はかなりの犠牲を払ってやっと勝った。
He cut some branches off the oak tree.	彼はカシの木の枝を何本か切り取った。
He drank a cup of tea and then asked for another.	彼はお茶を一杯飲んでから、お代わりを頼んだ。
He is no less kind than his sister.	彼はお姉さんに劣らず親切だ。
He's got money to burn.	彼はお金を腐るほど持っている。
He won a sum of money, and not such a small one, either.	彼はお金を手にしたが、それもそんなに小額ではない。
He received a ticket in return for the money.	彼はお金と引換に切符を受け取った。
He hid his toys under the bed.	彼はおもちゃをベッドの下に隠した。
He left for America the day before yesterday.	彼はおとといアメリカに向かった。
He lives in a large house by himself.	彼は大きな家に一人で住んでいます。
He earns a great deal.	彼はおおいに稼ぐ。
He passed the examination.	彼はうまく試験に合格した。
He has come out of his shell.	彼は打ち解けた。
He is not going to get ahead.	彼はうだつがあがらないようさ。
He wore a light blue tie.	彼はうすい青色のネクタイをしていた。
He soiled his white shirt when he changed the ink cartridge.	彼はインクカートリッジを交換していて白いシャツを汚した。
He is what is called a walking encyclopedia.	彼はいわゆる歩く百科事典だ。
He is, so to speak, a walking encyclopedia.	彼はいわば歩く百科事典だ。
When did he fall ill?	彼はいつ病気になったのですか。
He didn't specify when he would return.	彼はいつ帰るかはっきり言わなかった。
He always make good his promises.	彼はいつも約束を果たす。
He always tells the truth.	彼はいつも本当のことをいいます。
He always speaks ill of his father behind his back.	彼はいつも父親の陰口を言います。
He usually looks through the newspapers before breakfast.	彼はいつも朝食前に新聞に目を通す。
He seems to be always in conflict with someone.	彼はいつも誰かと衝突しているようだ。
He has always associated with large enterprises.	彼はいつも大企業に参加してきている。
He is always giving people a lot of trouble.	彼はいつも人に迷惑をかけている。
He always puts himself first.	彼はいつも自分の利益を第一に考える。
He always troubles himself about minor things.	彼はいつも些細な事で頭を悩ましている。
He always gets home at six o'clock in the evening.	彼はいつも午後６時に帰宅する。
He always wears his school tie.	彼はいつも学校のネクタイをしています。
He is always speaking ill of his wife.	彼はいつも奥さんの悪口を言っている。
He is as healthy as ever.	彼はいつもと代わらず健康です。
That is how he always treats me.	彼はいつもそんなふうに私をあしらうのです。
He is always throwing his weight around.	彼はいつもいばりちらしています。
He always treats me like a child.	彼はいつでも私を子供扱いする。
How is it that he solved the problem?	彼はいったいどうやってその問題を解いたんだ。
He collected various information.	彼はいくつかの情報を集めた。
He's an Englishman, and, I guess, has known better days.	彼はイギリス人で、たぶん昔はよい時代もあったのだろう。
He earns a good salary.	彼はいい給料をもらっている。
I wonder if he can live on such a small salary.	彼はあんな安月給で暮らしていけるのかしら。
He says he has achieved his goal to a certain extent.	彼はある程度目標を達成したと言っている。
He had the honor of being presented to a great writer.	彼はある偉大な作家に紹介される栄光に浴した。
He never drinks alcohol.	彼はアルコールを一切飲まない。
He knows all manner of animals.	彼はあらゆる種類の動物を知っている。
He was nearly run over at a crossing.	彼はあやうく交差点でひかれそうになった。
He became the finest actor on the American stage.	彼はアメリカの舞台で最も優れた俳優になった。
He is studying the origin of jazz in America.	彼はアメリカのジャズの起源を研究している。
He is not much better, and there is a little hope of recovery.	彼はあまり良くなっていないが、回復の望みは少しある。
He lives alone in an apartment.	彼はアパートに一人で住んでいます。
He earns more than five hundred dollars a month in that job.	彼はあの仕事で月に５００ドル以上稼ぐ。
He is in fear of the dog.	彼はあの犬を恐れている。
Did he tell you the truth?	彼はあなたに本当のことを言いましたか。
He looked as if he had been ill.	彼はあたかも病気であったかのような顔つきをしていた。
He pointed to the tower over there.	彼はあそこの塔を指さした。
He enjoys eating ice cream.	彼はアイスクリームを食べて楽しむ。
He does not care for ice cream.	彼はアイスクリームが好きではない。
He gave a series of lectures on Japanese literature at UCLA.	彼はＵＣＬＡで日本文学に関して一連の講義をした。
He came back at nine o'clock.	彼は９時に帰ってきた。
He said that it was nine o'clock.	彼は９時だと言った。
Though he is over eighty, he is still healthy.	彼は８０歳を超えているが、まだ元気だ。
He got home at seven sharp.	彼は７時ぴったりに家に着いた。
He achieved a throw of seventy meters.	彼は７０メートル投げた。
He promised me he would be here at six.	彼は６時にここに来ると私に約束した。
