She found a nice tie for me.	彼女は私にすてきなネクタイをみつけてくれた。
She made tea for me.	彼女は私にお茶を入れてくれた。
She brought a cup of tea to me.	彼女は私にお茶を一杯持って来ました。
She told me not to go there alone.	彼女は私に１人でそこに行ってはいけないと言った。
She asked me who I thought would win the tournament.	彼女は私に、誰がトーナメントで勝つと思うか、と尋ねました。
She didn't exactly agree with me.	彼女は私とすっかり同意見だったわけではない。
She treated each of us to an ice cream.	彼女は私たち一人一人にアイスクリームをおごってくれた。
She asked us to dinner.	彼女は私たちを晩餐に招いた。
She made a beautiful dinner for all of us.	彼女は私たちみんなに素敵なご馳走を作ってくれた。
She has been a wonderful role model for us.	彼女は私たちにとって素晴らしいお手本でした。
She showed us a beautiful hat.	彼女は私たちにきれいな帽子を見せた。
She told us not to make a noise.	彼女は私たちに、騒ぐな、といった。
She works as an assistant to the manager.	彼女は支配人の助手として働いている。
She's good at handling children.	彼女は子供を扱うのがうまい。
She has a wonderful hand with children.	彼女は子供の扱いがうまい。
She can't stand being treated like a child.	彼女は子供のように取り扱われることには我慢ならない。
She bought a toy for her child.	彼女は子供におもちゃを買ってやりました。
She bought a nice toy for her child.	彼女は子供に、素敵なおもちゃを買ってやりました。
She always pays attention to her children's behavior.	彼女は子供たちの行儀にはいつも注意を払っている。
She told her children to put away their toys.	彼女は子供たちにおもちゃをかたづけるように言った。
She didn't let her children go out in the rain.	彼女は子供たちが雨の中を出て行くのを許さなかった。
She is no less beautiful than her sister.	彼女は姉劣らずうつくしい。
She is no less beautiful than her sister.	彼女は姉同様きれいだ。
She is less beautiful than her sister is.	彼女は姉ほど美しくはない。
She's not as beautiful as her sister.	彼女は姉ほど美しくない。
She doesn't study as hard as her sister.	彼女は姉ほど一生懸命勉強しない。
She put on her sister's jeans and looked in the mirror.	彼女は姉のジーンズをはいて鏡を見た。
She is not less beautiful than her sister.	彼女は姉に劣らず美人だ。
She is no less beautiful than her sister.	彼女は姉に劣らず美しい。
She is not less beautiful than her sister.	彼女は姉に優るとも劣らぬ美人だ。
She is no less beautiful than her sister is.	彼女は姉にも劣らず美しい。
She is no less beautiful than her older sister.	彼女は姉と同様にきれいだ。
She is no less beautiful than her sister.	彼女は姉とまったく同じくらい美人だ。
She is different from her sister in every way.	彼女は姉とは一から十まで性格が違う。
She is different from her sister in every way.	彼女は姉とは１から１０まで違う。
She is less beautiful than her sister.	彼女は姉さんほど美しくない。
She is no less beautiful than her sister.	彼女は姉さんと同じように美しい。
She left home early in the morning for fear that she would miss the first train.	彼女は始発列車に乗り遅れないように朝早く家を出た。
She proceeded with the work.	彼女は仕事を進めた。
She said that her job gave her a sense of identity.	彼女は仕事によって自分が自立していると感じるといっていた。
She was washing the dishes.	彼女は皿洗いをしていた。
She didn't want to wash the dishes, but she made the best of it.	彼女は皿洗いはいやだったが、我慢してやった。
She washed the dishes and she dried them.	彼女は皿を洗い、それから乾かした。
She cooked us Chinese dishes last night.	彼女は昨晩私達に中華料理を作ってくれた。
She had her hat blown off yesterday.	彼女は昨日帽子を吹き飛ばされた。
She didn't go shopping yesterday, did she?	彼女は昨日買い物に行きませんでしたね。
She left Tokyo for New York yesterday.	彼女は昨日東京を発ってニューヨークへ向かった。
She seems to have left for Tokyo yesterday.	彼女は昨日東京へ向けて出発したようです。
She left for Osaka yesterday.	彼女は昨日大阪へ立った。
She got a new CD player yesterday.	彼女は昨日新しいＣＤプレーヤーを手に入れた。
She was slightly better yesterday.	彼女は昨日少し具合がよかった。
She must have finished the work yesterday.	彼女は昨日仕事を終えてしまったにちがいない。
She started for Kyoto yesterday.	彼女は昨日京都に向けて出発した。
She came to see us yesterday.	彼女は昨日我々に会いに来た。
She played tennis all day yesterday.	彼女は昨日一日中テニスをした。
She left for London yesterday.	彼女は昨日ロンドンへ出発した。
She is far better today than yesterday.	彼女は昨日より今日の方がずっと元気です。
She's much better today than yesterday.	彼女は昨日よりずっと体の具合がいい。
She did not show up at the party yesterday.	彼女は昨日パーティーに現れなかった。
She didn't show up at the party yesterday.	彼女は昨日のパーティーに現れなかった。
She had a blue dress on at the party yesterday.	彼女は昨日のパーティーで青のドレスを着ていた。
She had nothing to do yesterday.	彼女は昨日、何もすることがなかった。
She earns a living as a writer.	彼女は作家として生計を立てている。
She was looking at the fine snow falling on the lake.	彼女は細かな雪が湖面に降るのを眺めていた。
She's been feeling a little on edge recently.	彼女は最近少しいらいらしている。
She got her left hand burned.	彼女は左手をやけどした。
She wore a diamond ring on her left third finger.	彼女は左手の薬指にダイヤの指輪をはめていた。
She was always willing to help people in trouble.	彼女は困っている人々にはいつでも快く援助の手を差しのべた。
She was always ready to help people in trouble.	彼女は困っている人にいつでも喜んで援助の手を差し伸べた。
She asked me for help when she was in trouble.	彼女は困っているときに私に助けを求めた。
She seems to be in trouble. Tell her what to do.	彼女は困ったいるようです。どうしたらいいか教えてあげてください。
She is having dinner now.	彼女は今夕食を食べているところです。
She did two washes today.	彼女は今日２回洗濯をした。
She lives in comfort now.	彼女は今は気楽に暮らしている。
She is having dinner now.	彼女は今ディナーを食べているところです。
She loves antiques.	彼女は骨董品がとても好きだ。
She is going to have an international marriage.	彼女は国際結婚をするつもりです。
She decided to go.	彼女は行く決心をした。
She was in a position to decide where to go.	彼女は行き先を決定できる立場にあった。
She decided not to go.	彼女は行かないことに決めた。
She bought a tea set.	彼女は紅茶道具一式を買った。
She ordered a cup of tea.	彼女は紅茶を注文した。
She was none the worse for the traffic accident.	彼女は交通事故にあっても何ともなかった。
She lost her memory in a traffic accident.	彼女は交通事故で記憶を失った。
She took night classes in the science of self-defense.	彼女は護身術の夜間講座を取った。
She may realize later on what I meant.	彼女は後で私の真意に気づくでしょう。
She pulled the door open.	彼女は戸を引いて開けた。
She is a woman with a classical education.	彼女は古典の教育を受けている。
She gave birth to a healthy baby.	彼女は健康な赤ん坊を出産した。
She was a Brown before her marriage.	彼女は結婚前はブラウン家の人であった。
She was a Smith before her marriage.	彼女は結婚前スミス姓だった。
She majored in economics.	彼女は経済学を専攻している。
She looked up at the sky.	彼女は空を見上げた。
She was a girl with golden hair.	彼女は金髪の少女だった。
She is a blonde girl.	彼女は金髪で色白の少女だ。
She paid to attend the concert.	彼女は金を払って演奏会を聞いた。
She liked throwing her money about.	彼女は金をばらまくのが好きだった。
She was different from most women in the neighborhood, for she was able to read and write.	彼女は近所のたいていの女たちとは違っていた、というのは彼女は読み書きができたから。
She keeps him at arm's length these days.	彼女は近ごろ彼を遠ざけている。
She stood before the mirror.	彼女は鏡の前に立った。
She earns her living by teaching.	彼女は教師をして生計を立てている。
She earns her living by teaching.	彼女は教師として生計を立てている。
She earns her living by teaching.	彼女は教えることで生計を立てている。
Fear fell upon her.	彼女は恐怖に襲われた。
She had her hat blown off by the strong wind.	彼女は強い風で帽子を吹き飛ばされた。
She was none the worse for drinking spirits.	彼女は強い酒を飲んだが何ともなかった。
She hates fish and never eats any.	彼女は魚が大嫌いで、決して食べない。
She hates fish and never eats any.	彼女は魚がひどく嫌いで、少しも食べない。
She hung a little Picasso on the wall of the drawing room.	彼女は居間の壁に小さなピカソの絵を掛けた。
As soon as she got her salary, she spent it all.	彼女は給料をもらうとすぐに使い切ってしまった。
She gets a high salary.	彼女は給料をたくさんもらっている。
She was taken ill on holiday and had to find a doctor.	彼女は休みの日に突然病気になり、医者をさがさなければならなかった。
She was taken ill on holiday.	彼女は休みの日に突然病気になった。
She was named as chairman.	彼女は議長に指名された。
She is a lady and expects to be treated as such.	彼女は貴婦人であり、そのような人として扱われるものと思っている。
She removed the papers from the desk.	彼女は机の上の書類を片付けた。
She is not less beautiful than her sister.	彼女は器量の点では姉に劣らない。
She will get over the shock soon.	彼女は間もなくそのショックから回復するだろう。
She became a nurse.	彼女は看護婦になった。
She is a nurse.	彼女は看護婦です。
She is not a nurse, but a doctor.	彼女は看護婦ではなく、医者だ。
She may be a nurse. I am not sure.	彼女は看護婦かもしれない、確信はもてないが。
Her mind is broad enough to listen to his son.	彼女は寛大に息子の話を聞く。
She earns money by taking in students.	彼女は学生を下宿させて収入をえている。
She is an honor to our school.	彼女は学校の名誉です。
It seems that she lives in the neighborhood of the school.	彼女は学校の近くに住んでいるようだ。
She lives within a stone's throw of the school.	彼女は学校のすぐ近くに住んでいる。
She put on her hat to go out.	彼女は外出するための帽子をかぶりました。
She was a foreigner and was treated as such.	彼女は外国人だったので外国人として扱われた。
She stood looking out toward the sea.	彼女は海の方を見ながら立っていた。
She'd better bone up on company policy.	彼女は会社の方針をもっと頭にたたきこんだ方が良い。
She decided not to attend the meeting.	彼女は会議には出席しないことを決めた。
She likes to talk in our presence.	彼女は我々の前で話すのが好きだ。
She picked flowers.	彼女は花を摘んだ。
She is watering the flowers.	彼女は花に水をやっています。
She tried to bring the flowers into focus.	彼女は花にピントと合わせようとした。
She says that she likes flowers.	彼女は花が好きだと言っている。
She was carrying a basket full of flowers.	彼女は花がいっぱい入ったかごを提げていた。
She spends as much money as she earns.	彼女は稼ぐのと同じだけお金を使う。
She spends as much money as she earns.	彼女は稼ぐのとおなじだけのお金を使う。
She is said to be a domestic woman.	彼女は家庭的な女性だそうです。
She wore a plain blue dress.	彼女は家財気のない青いドレスを着ていた。
She has been ill since about summer.	彼女は夏頃から病気だった。
Though she repeated that she was a college student, I could not bring myself to believe it.	彼女は何度も自分は大学生だと言ったが私はどうしてもそれを信じる気にはなれなかった。
She believes whatever he says.	彼女は何でも彼の言うことを信じる。
She discovered that she had run out of salt.	彼女は塩を切らしているのに気付いた。
She wore a blue dress made by her mother for the concert.	彼女は演奏会のためにお母さんに作ってもらった青いドレスを着ていた。
She made references to World War II in her speech.	彼女は演説の中で第２次世界大戦に言及した。
She is excellent at making speeches.	彼女は演説がうまい。
She gives instruction in English.	彼女は英語を教えている。
She took an examination in English.	彼女は英語の試験を受けた。
She had an oral examination in English.	彼女は英語の口頭試験を受けた。
She really showed her stuff in the English speech contest.	彼女は英語のスピーチコンテストでいかんなくその才能を発揮した。
She walked on and on in the rain.	彼女は雨の中どんどん歩き続けた。
She got burnt in the right hand.	彼女は右手をやけどした。
She took to him immediately.	彼女は一目で彼が好きになった。
She was chosen from ten thousand applicants.	彼女は一万人の応募者の中から撰ばれた。
She passed the examination by working hard.	彼女は一生懸命勉強して試験にパスした。
She worked hard, only to fail the examination.	彼女は一生懸命勉強したが、試験に不合格した。
She is used to living alone.	彼女は一人暮らしになれている。
She brought up the three children alone.	彼女は一人で三人の子供を育てた。
She came alone.	彼女は一人で来た。
She lives in an apartment alone.	彼女は一人でアパートに住んでいる。
She has worn the same hat for a month.	彼女は一ヶ月同じ帽子をかぶっている。
She decided to be a doctor.	彼女は医者になろうと決心した。
She could not get over her fear of the dark.	彼女は暗闇の恐怖に打ち勝つことができなかった。
She lives in comfort.	彼女は安楽に暮らしている。
She works hard in the office for a small salary.	彼女は安い給料にもかかわらずその会社で一生懸命働いている。
She was sorry to hear the bad news.	彼女は悪い知らせを聞いて残念に思いました。
She was sorry to hear the bad news.	彼女は悪いニュースを聞いて残念に思いました。
She lives in an apartment above us.	彼女はわれわれの上のアパートに住んでいます。
She would often go to the theater when she was in London.	彼女はロンドンにいたころよくその劇場に行ったものだ。
She was frequently late for school.	彼女はよく学校に遅刻した。
She was caught in a shower and got wet to the skin.	彼女はゆうだちにあいずぶぬれになった。
She is looking for a large apartment.	彼女はもっと広いマンションを捜している。
She's old enough to know the truth.	彼女はもう本当のことを知ってもいい歳だ。
She is having second thoughts about buying another car.	彼女はもう１台車を買うことを考え直してる。
She speaks English as if she were a native speaker.	彼女はまるで母語を話すように英語を話します。
She looked as if she had been ill.	彼女はまるで病気であったかのように見えた。
She is yet to know the truth.	彼女はまだ真実を知らない。
She made a great discovery while yet a young student.	彼女はまだ若い研究生のうちに大発見をした。
She did not promise to come here again.	彼女はまたここに来るとは約束しなかった。
She seems to have seen the very accident.	彼女はまさしくその事故を目撃したらしい。
She pulled up near the hotel office.	彼女はホテルのオフィス近くに車を止めた。
She lost no time in reading a best-selling novel.	彼女はベストセラーの小説を早速読んだ。
She is a native speaker of French.	彼女はフランス語を母語として話す。
She doesn't even speak her own language well, let alone French.	彼女はフランス語は言うに及ばず母語すらろくに話せない。
It is said that she is the best tennis player in France.	彼女はフランスで一番のテニス選手だと言われている。
She gave birth to twins.	彼女は双子を産んだ。
She bought a pair of boots.	彼女はブーツを一足買った。
She wasn't able to open the bottle.	彼女はびんをあけることができなかった。
She doesn't like to associate with Bill.	彼女はビルと交際したくないと思っている。
She promised not to go out alone.	彼女はひとりでは外出しないと約束した。
She lives alone in the room.	彼女はひとりでその部屋にすんでいる。
She wanted to be alone.	彼女はひとりでいたかった。
The moment she was alone, she opened the letter.	彼女はひとりきりになったとたん、その手紙をあけた。
She applied for a visa.	彼女はビザを申請した。
She speaks clearly enough to be easily understood.	彼女ははっきりとした口調で話すので分かりやすい。
She speaks clearly to be easily understood.	彼女ははっきりとした口調で話すのがわかりやすい。
She is a member of the basketball club.	彼女はバスケット部に入っている。
She is a member of the basketball club.	彼女はバスケットボール部の一員だ。
She played basketball.	彼女はバスケットボールをした。
She got off the bus and ran towards him.	彼女はバスから降りて彼の方に走った。
She kissed me like anything.	彼女ははげしく私にキスした。
She was cleaning the house in preparation for a party.	彼女はパーティーに備えて家の掃除をしていた。
She was happy to be introduced to him at the party.	彼女はパーティーで彼に紹介されてうれしかった。
She introduced me to her friends at the party.	彼女はパーティーで私を友達に紹介した。
She has an eye on a good bargain.	彼女はバーゲンには抜け目がない。
She wrote down something in her notebook.	彼女はノートに何かを書き込みました。
Why did she break off her speech?	彼女はなぜ話を急にやめたのか。
However ill she is, she always works.	彼女はどんなに体の具合が悪くてもいつも働く。
She pushed the door open.	彼女は戸を押し開けた。
She's Tom's sister.	彼女はトムのお姉さんです。
She has lived alone for ages.	彼女はとても長い間一人で暮らしている。
She looks nice and healthy.	彼女はとても健康そうだ。
She seems to be very ill.	彼女はとても具合が悪そうに見える。
She is as modest as anything.	彼女はとても穏やかだ。
She is as modest as anything.	彼女はとてもおしとやかだ。
She is, if anything, a little better today than yesterday.	彼女はどちらかと言えば、今日は昨日より少しは快方に向かっている。
She sometimes has her sister write her term papers.	彼女はときどき妹にレポートを書かせる。
She pulled the door open.	彼女はドアを引いて開けた。
She put the chain on the door and opened it a crack.	彼女はドアにチェーンをかけてから、ちょっと開けた。
She tuned her television set to Channel 6.	彼女はテレビを６チャンネルに合わせた。
She loves watching tennis matches on TV.	彼女はテレビでテニスの試合を見るのが大好きです。
She had an accident that ended her life as a tennis player.	彼女はテニス選手としては致命的な事故に会った。
She is good at playing tennis.	彼女はテニスをするのが上手です。
She is given to tennis.	彼女はテニスに熱中している。
She likes tennis as well as basketball.	彼女はテニスと同様にバスケットボールも好きだ。
She liked tennis and became a tennis coach.	彼女はテニスが好きで、テニスのコーチになった。
She can play tennis very well, but I can play just about as well as she can.	彼女はテニスがとてもうまいが、私も同じ位うまい。
She plays tennis very well.	彼女はテニスがとてもうまい。
She can play tennis, and so can I.	彼女はテニスができます。そして私もできます。
She is a good tennis player.	彼女はテニスがうまい。
She is having dinner now.	彼女はディナーを食べているところです。
She does not take a rest for an instant.	彼女はちょっとの間も休まない。
She loves chocolate, too.	彼女はチョコも大好きだ。
She has just finished washing dishes.	彼女はちょうどさらを洗い終わりました。
It happened that she was taking a bath.	彼女はたまたま入浴中だった。
She has no more than fifteen dollars.	彼女はたった１５ドルしか持っていない。
She got the ticket for nothing.	彼女はただでその切符を手に入れ得た。
She had to speak before a large audience.	彼女はたくさんの聴衆の前で話しをしなければならなかった。
She was surprised that it was that late.	彼女はそんなに遅いので驚いた。
She must have done it yesterday.	彼女は昨日それをしたに違いない。
She worked on it with her all soul.	彼女はそれに精魂を込めた。
She ran to the station for fear that she would miss the train.	彼女はその列車に乗り遅れるといけないので、駅まで走った。
She completely cleaned her plate.	彼女はその料理をきれいにたいらげた。
She must have forgotten all about the promise.	彼女はその約束のことをすっかり忘れてしまったにちがいない。
She indicated that the problem was serious.	彼女はその問題が重大であることを指摘した。
She carried the box under her arm.	彼女はその箱を小脇に抱えて運んだ。
She deposited the box on the table.	彼女はその箱をテーブルの上に置いた。
She was not a little surprised at the news.	彼女はその知らせに少なからず驚いた。
She looked troubled by the news.	彼女はその知らせで困っているようだった。
She looked surprised at the letter.	彼女はその手紙に驚いたようだった。
She was doing the washing then.	彼女はその時洗濯をしていた。
She was playing with her sister at that time.	彼女はその時、妹と遊んでいました。
She stripped the child and put him in the bath.	彼女はその子を裸にして、お風呂に入れた。
She did the work alone.	彼女はその仕事を一人でやった。
She had a great attachment to that old house.	彼女はその古い家に強い愛着を持っていた。
She looked out through the hole.	彼女はその穴から外をのぞいた。
She suggested that the customer buy a blue tie.	彼女はその客にブルーのネクタイを勧めた。
She can't bear the noise.	彼女はその音に我慢できない。
She was not a little surprised at the news.	彼女はそのニュースを聞いて少なからず驚いた。
She was surprised at the news.	彼女はそのニュースを聞いて驚いた。
She was cooking dinner at that time.	彼女はそのとき夕食を作っているところだった。
She was washing the dishes then.	彼女はそのとき皿を洗っていました。
She pushed the door open.	彼女はそのドアを押し開けた。
She took part in the contest.	彼女はそのコンテストに参加した。
She won the contest.	彼女はそのコンテストで優勝した。
She was fined 10 dollars for that.	彼女はそのことで罰金を１０ドル課せられた。
She hung the calendar on the wall.	彼女はそのカレンダーを壁にかけた。
She won the one hundred meter race.	彼女はその１００メートル競争で優勝した。
She was alone there.	彼女はそこに一人きりだった。
She will pay 50 dollars at most.	彼女はせいぜい５０ドルしか払わないだろう。
She was very nearly run over by a truck.	彼女はすんでのところでトラックにひかれるところだった。
She got wet to the skin.	彼女はずぶぬれになった。
She is a wonderful woman.	彼女はすばらしい女性だ。
