Birds fly.	鳥は飛ぶ。
You need to eat more fiber.	もっと繊維質を取りなさい。
Meg has a lovely face.	メグはかわいらしい顔つきをしている。
My mistake cost me my fortune.	ミスで財産を失った。
As yet he has not succeeded.	まだ彼は成功していない。
Don't hang up yet, please.	まだ電話を切らないで下さい。
The paint hasn't dried yet.	ペンキはまだかわいてない。
The forward kicked a goal.	フォワードがゴールを決めた。
What about a glass of beer?	ビールを一杯いかがですか。
It is cheaper to go by bus.	バスで行った方が安くつく。
What a stupid boy he is!	なんてばかな子なんだ、あいつは！
Tom is an electrical engineer.	トムは電気技師です。
How formal is this ceremony?	どの程度正式なのですか。
Fortune has turned in my favor.	つきが回ってきた。
May I use your telephone?	ちょっと電話を貸してください。
Do you have any tickets left?	チケットはありますか。
I'll be hanged if it's true.	そんなことは絶対にない。
That will never disappear.	それは決して消えることなく。
The plane crashed suddenly.	その飛行機は突然墜落した。
The museum is closed now.	その博物館は今は閉鎖している。
They are having a chat.	その人たちはおしゃべりをしている。
The idea is very attractive.	その考えは実に魅力的だ。
The dog awoke to the danger.	その犬は危険に気付いた。
The dog looks hungry.	その犬はお腹がすいているように見える。
The house is not occupied now.	その家は今空き家だ。
Then twelve o'clock came.	そうすると１２時になりました。
Not every bird can sing.	すべての鳥が歌えるとは限らない。
Everybody is subject to law.	すべての人は法律に従う。
He is going like the devil.	すごい勢いで飛ばしてるよ。
John skied up the slope.	ジョンは坂をスキーで上りました。
Joe looked sad yesterday?	ジョーは昨日悲しそうに見えた。
I appreciate your cooperation.	ご協力に感謝します。
Thank you for your cooperation.	ご協力ありがとう。
This medicine tastes bitter.	この薬はにがい味がする。
This box contains apples.	この箱にはりんごが入っている。
This pan has several uses.	この鍋は色々な使い道がある。
May I use this telephone?	この電話を使ってもいいですか。
This flower is very beautiful.	この花は大変美しい。
This house is not for sale.	この家は売りもんではない。
Does this skirt suit me?	このスカートは私に似合いますか。
I don't like this jacket.	このジャケットは気に入らない。
This coffee tastes bitter.	このコーヒーは苦い味がする。
I have an acute pain here.	ここに急性の痛みがあります。
This is Uncle Tom's farm.	ここがトムおじさんの農場です。
Do not eat too much cake.	ケーキを食べ過ぎないようにね。
We have run out of cream.	クリームを使い切ってしまった。
Were you at home yesterday?	きみは昨日家にいましたか。
I bet all will turn out well.	きっと万事うまくいく。
I bet he doesn't make it.	きっと彼はそれに失敗をするさ。
May I use the bathroom?	お手洗いをお借りしても良いですか。
I can't lend you any money.	お金を貸す事は出来ません。
What is your waist size?	ウエストのサイズはいくつですか。
I write articles regularly.	いつも記事を書いています。
Come whenever you like.	いつでも好きなときにいらっしゃい。
I can't read Arabic script.	アラビア文字は読めません。
What he lacks is courage.	あの男に欠けているのは勇気だ。
Look at that brilliant star.	あの輝く星をご覧なさい。
Don't sit on that bench.	あのベンチに座ってはいけません。
Are you going anywhere?	あなたはどこかへ出かけるのですか。
Lend me your book, please.	あなたの本を貸してください。
There were flowers all around.	あたり１面花だった。
That man is a wet blanket.	あいつがいると座がしらける。
Would 9 o'clock be all right?	９時でよろしいですね。
Let's wait until six o'clock.	６時まで待ちましょう。
Will six o'clock suit you?	６時で都合はよろしいですか。
A bird flew into the tree.	１羽の鳥が木に飛んでいった。
I hit the mark with the arrow.	私は矢を的に当てた。
He has a good constitution.	彼は立派な体格をしている。
We stayed at our uncle's.	私達はおじの家に泊まりました。
You don't have to wrap it up.	包む必要はありません。
That place is still nearby.	くだんの場所が近くにまだ有る
It has earned a good reputation. 	それが好評を得る
He used it as a raw material.	彼がそれを原料に使用した
The cat always gets on my lap.	猫がすぐに膝の上に乗る
He shows an unexpected side.	彼が意外な一面を人に見せる
He bought a book yesterday.	彼が昨日、一冊の本を購入した
He meets certain requirements.	彼が一定の要件を満たす
He relaxed in a hot spring.	彼が温泉にゆっくりと漬かった
I regret nothing of my life.	我が生涯に一片の悔いなし。
Green is associated with grass.	緑は草を連想させる。
A dragon is a creature of fancy.	龍は空想の動物だ。
Eggs tend to go bad in summer.	卵は夏には腐りやすい。
Eggs are sold by the dozen.	卵は１ダース単位で売られる。
I was late for the appointment.	約束の時間に遅れた。
I like studying wild flowers.	野生の花の研究が好きだ。
Do you offer any night tours?	夜のツアーはありますか。
I awoke to find it snowing.	目が覚めると雪が降っていた。
I'd like one more blanket.	毛布をもう一枚ほしいのですが。
Everything fell into my lap.	万事トントン拍子にいった。
I had intended to go there.	僕はそこへ行くつもりだった。
I'm off cigarettes for good.	僕はこれっきりで禁煙する。
The court found him guilty.	法廷では彼を有罪と判決した。
There is a clock on the wall.	壁に時計が掛かっている。
My father works for a factory.	父は工場で働いている。
I am afraid it is a reject.	不良品ではないかと思います。
I allow for the unexpected.	不足の事態を頭にいれておく。
They invited me to dinner.	彼等は私を食事に招いてくれた。
She tried not to shed tears.	彼女は涙を流すまいとした。
She decided to study abroad.	彼女は留学する事に決めた。
She wanted to get a divorce.	彼女は離婚したがっていた。
She was forced to confess.	彼女は無理矢理白状させられた。
She was intent on her book.	彼女は本に夢中になっていた。
She gave him a tender kiss.	彼女は彼に優しくキスをした。
She stared me down with anger.	彼女は怒って私を見た。
She has flowers in her hand.	彼女は手に花を持っている。
She tried to commit suicide.	彼女は自殺をしようとした。
She attracted our attention.	彼女は私達の注目を集めた。
She spoke to me in a whisper.	彼女は私に小声で話した。
She left for Osaka yesterday.	彼女は昨日大阪へ立った。
She endured to the bitter end.	彼女は最後まで耐えた。
She has never gone abroad.	彼女は海外に行ったことがない。
She couldn't utter a word.	彼女は一言も発せられなかった。
The news distressed her.	彼女はその知らせを聞いて悲しんだ。
She was eager to go home.	彼女はしきりに帰りたがっていた。
She has a passion for cake.	彼女はケーキが大好きなんだ。
She quoted a poem by Keats.	彼女はキーツの詩を引用した。
She bought a yard of cloth.	彼女は１ヤールの布を買った。
Her skirt fits closely.	彼女のスカートはぴったり合っている。
She has a brilliant future.	彼女には輝かしい将来がある。
Does she have any merit?	彼女にはなにかとりえがありますか。
She has a talent for dance.	彼女にはダンスの才能がある。
They were not brave at all.	彼らは全然勇敢ではなかった。
They are immune to attack.	彼らは攻撃を受ける心配はない。
They painted the wall white.	彼らはその壁を白く塗った。
He is supposed to be guilty.	彼は有罪だと思われている。
He has a remarkable memory.	彼は優れた記憶力の持ち主だ。
He is a man of good reputation.	彼は評判のよい人だ。
He whispered something to her.	彼は彼女に何か囁いた。
He intended to marry her.	彼は彼女と結婚するつもりだった。
He behaved in a cheap manner.	彼は卑しい振舞いをした。
He's talking on the telephone.	彼は電話で話している。
He is popular with everybody.	彼は誰からも人気がある。
I think that he will succeed.	彼は成功すると私は思う。
He recovered little by little.	彼は少しずつ回復した。
He prefers poetry to fiction.	彼は小説よりも詩を好む。
He committed a serious crime.	彼は重大な犯罪を犯した。
He considered himself lucky.	彼は自分を幸運だと思った。
He kissed me on the forehead.	彼は私の額にキスをした。
He got engaged to my cousin.	彼は私のいとこと婚約した。
He raised a weapon against me.	彼は私に武器を向けた。
He whispered something to me.	彼は私に何かささやいた。
He was hanged for murder.	彼は殺人罪で絞首刑に処せられた。
He got himself committed to it.	彼は言質をとられた。
He advocated reduction of taxes.	彼は減税を唱えた。
He said, "It's nine o'clock."	彼は「九時だ」と言った。
He fixed the broken table.	彼は壊れたテーブルを修理した。
He held on to the rope.	彼はロープにしっかりつかまっていた。
He was an utter stranger.	彼はまったくの見知らぬ人だった。
He seated himself on the bench.	彼はベンチに座った。
He interfered with the fans.	彼はファンのじゃまをした。
He is anxious to see you.	彼はとても君に会いたがっている。
He is eager to go there.	彼はとてもそこへ行きたがっている。
She just leaned against me.	彼女はちょっと私にもたれた。
He asked for a cigarette.	彼はタバコを一本くれとせがんだ。
He said that with dignity.	彼はそれを威厳をもって言った。
He works in the laboratory.	彼はその実験室で働いている。
He owns a good few sheep.	彼はかなり多くの羊を持っている。
He is eager to succeed.	彼はうまくいくように強く願っている。
He drinks too much beer.	彼はあまりにも多量のビールを飲む。
Let him use the telephone.	彼に電話を使わせてあげなさい。
I don't intend to marry him.	彼と結婚するつもりはない。
When he awoke it was day.	彼が目を覚ました時は昼間だった。
He came to see you yesterday.	彼が昨日君に会いにきた。
He moved into my neighborhood.	彼が近所に越してきた。
It'll be a pity if he fails.	彼がしくじったら気の毒だ。
Setting a wolf to guard the sheep.	猫にかつお節。
The Japanese live on rice.	日本人は米を食べて生きている。
Let's take a rest in the shade.	日陰で一休みしよう。
I'd like a twin room, please.	二人部屋をお願いします。
We have quoted special prices.	特別価格の見積りです。
Don't handle the tools roughly.	道具を乱暴に扱うな。
Write your answer with a pen.	答えはペンで書きなさい。
When can I use my telephone?	電話はいつから使えますか。
It's eight o'clock in the morning.	朝の八時です。
Nobody answered the telephone.	誰も電話に出なかった。
Everybody shouted for joy.	誰もが喜びの歓声を上げました。
Everybody demanded happiness.	誰でも幸福を望んでいる。
I heard somebody cry out.	誰かが大声で叫んだのが聞こえた。
I'm chilled to the bone.	体の芯まで冷え切ってしまいました。
The sun rose over the horizon.	太陽は地平線に昇った。
Many a man has predicted it.	多くの人がそれを予言した。
I hope you'll recover quickly.	早く治るといいですね。
My grandfather is very healthy.	祖父は非常に健康だ。
That is not altogether false.	全く嘘と言う訳ではない。
That is not altogether bad.	全く悪いというわけではない。
The ship sailed up the Thames.	船はテムズ川を上った。
The snow will soon disappear.	雪はすぐに消えるだろう。
Keep quiet and behave well!	静かにして行儀よくしなさい。
People were eager for peace.	人々は平和を熱望していた。
People ran out of the castle.	人々は城外に走り出した。
I feel deep sympathy for you.	深くご同情申し上げます。
The girl let the bird loose.	少女は鳥を逃がしてやった。
There is a little chill in the air.	少し肌寒い。
We're confident of our victory.	勝利を確信している。
Look on both sides of the shield.	盾の両面を見よ。
My uncle gave me the watch.	叔父は私にその時計をくれた。
What time does the curtain fall?	終演は何時ですか。
Time is the most precious thing.	時間は一番大切だ。
The game ended at nine o'clock.	試合は９時に終った。
We heard the bomb go off.	私達は爆弾が爆発するのを聞いた。
We got to London yesterday.	私達は昨日ロンドンに着いた。
We are badly in want of water.	私達はひどい水不足だ。
I telephoned him the message.	私は彼に電話で伝言した。
I informed him of the result.	私は彼に結果を知らせた。
I spoke to him by telephone.	私は電話で彼と話しました。
I've detected a big mistake.	私は大きな誤りを見つけた。
I bought a red sports car.	赤いスポーツカーを買ったんだ。
I like reading mysteries.	私は推理小説を読むのが好きです。
I'm anxious for a promotion.	私は昇進を切に願っている。
I am looking for an assistant.	私は助手を探している。
I arrived in Tokyo yesterday.	私は昨日東京に到着した。
I caught five fish yesterday.	私は昨日魚を五匹とった。
I was home all day yesterday.	私は昨日は終日家にいた。
I have several silver coins.	私は銀貨を数枚持っている。
I am aching to go abroad.	私は外国へ行きたくてたまらない。
I am watering the flowers.	私は花に水をやっている所です。
I will let myself loose.	私は何もかも言ってしまうつもりだ。
I would rather order beer.	私はむしろビールを注文したい。
I have never been abroad.	私はまだ海外にいったことがない。
I was invited to the party.	私はパーティーに招待された。
I just followed convention.	私はただ因習に従ったまでだ。
I regret having said so.	私はそう言ったことを後悔している。
I excused myself for a minute.	私はしばらく中座した。
I bought this book yesterday.	私はこの本を昨日買った。
I have an appointment at 3.	私は３時に約束があるのです。
I like Azuchimomoyama Castle.	私は、安土桃山城が好き。
My dream is to study abroad.	私の夢は留学することです。
There is no clock in my room.	私の部屋には時計がない。
I have a magazine in my room.	私の部屋には雑誌がある。
I forbid smoking in my room.	私の部屋での喫煙を禁ずる。
My telephone is out of order.	私の電話は故障している。
There is a castle in my town.	私の町には城があります。
It is ten o'clock by my watch.	私の時計は１０時です。
It's four o'clock by my watch.	私の時計では４時です。
My brother became an engineer.	私の兄は技師になった。
My robot's name is Multi.	私のロボットの名前はマルチです。
I have a previous appointment.	私には先約があります。
We are a conservative people.	私たちは保守的な国民だ。
We left him some cake.	私たちは彼に少しケーキを残しておいた。
We walked about five miles.	私たちは五マイルほど歩いた。
We saw a castle ahead of us.	私たちの前方に城が見えた。
I wish I had been a bird.	私が鳥だったらよかったのになあ。
I flew to Osaka yesterday.	昨日飛行機で大阪に行きました。
Where did he go yesterday?	昨日彼はどこへ出かけましたか。
We had nice weather yesterday.	昨日はよい天気だった。
This is Fire Prevention Week.	今週は火災予防週間です。
I will telephone you later on.	後でお電話いたします。
It's two o'clock in the afternoon.	午後二時です。
It's no use playing tough.	肩肘張って生きることはないよ。
A crowd gathered at the scene.	群衆が現場に群がった。
Would you like to go abroad?	君は外国へ行きたいですか。
We will miss you badly.	君がいないとどんなに寂しい事だろう。
The bridge is one mile above.	橋は１マイル上流にある。
The church bells are ringing.	教会堂の鐘が鳴っている。
Bite down tightly, please.	強くかみ合わせていてください。
Put your affairs in order.	貴方の仕事をきちんとしなさい。
Have you ever been abroad?	外国に行ったことがありますか。
Have you ever been abroad?	海外へ行ったことがありますか。
The accounts have been audited.	会計の監査があった。
We Japanese live on rice.	我々日本人は米を常食としている。
We sailed against the wind.	我々は風に逆らって航海した。
We arrived at a compromise.	我々は妥協することになった。
Our friendship did not last.	我々の友情は続かなかった。
What flower do you like best?	何の花が一番好きですか。
Lend me some books to read.	何か読む本を貸してください。
We saw a castle in the distance.	遠方に城が見えた。
Please put your cigarette out.	煙草を消してください。
Wind accompanied the rain.	雨が降っている所に風もふいた。
The rice crop is already in.	稲の取り入れはもう済んだ。
You should consult your doctor.	医者にかかるべきだ。
Nothing is as precious as love.	愛より尊い物はない。
Long skirts are in fashion.	ロングスカートは今はやりだ。
Add a little more pepper.	もう少しこしょうを利かせなさい。
It is already past five o'clock.	もう５時過ぎです。
Mary and Jane are cousins.	メアリーとジェーンはいとこだ。
I think that everybody knows.	みんなに知られちゃうよ。
Everyone burst into laughter.	みんなが突然笑い出した。
Mayuko wore a flower crown.	マユコは花の冠をつけていた。
You've got plenty of time.	まだたっぷり時間がありますよ。
A pound is a unit of weight.	ポンドは重さの単位である。
Would you lend me your pen?	ペンを貸していただけますか。
This paint comes off easily.	ペンキがすぐはげてしまう。
Helen, this is my cousin.	ヘレン、この人は私のいとこです。
I don't drink much beer.	ビールはあまりたくさん飲みません。
Somehow it's been a rough day.	なんだかすごく辛いの。
Why were you absent yesterday?	なぜ昨日休みましたか。
Why should you suspect me?	なぜあなたは私を疑うのですか。
Tom is in bed with a fever.	トムは熱を出して寝ています。
Can you recommend a good play?	どの芝居がいいですか。
You can go anywhere you like.	どこでも好きな所へ行け。
Please paint the door white.	ドアを白く塗ってください。
Finally, my father compromised.	ついに父は妥協した。
Can I use your telephone?	ちょっと電話を借りていいですか。
They are very big apples.	それらはとても大きなりんごです。
It is both good and cheap.	それは品質がよく、しかも安い。
It is sold by the pound.	それはポンドいくらで売られている。
Don't lean against the wall.	その壁に、もたれかかるな。
The rice field lies waste.	その田んぼは荒れ果てたままだ。
The new building is enormous.	その新しい建物は巨大だ。
The magazines were sold out.	その雑誌は売り切れだった。
The idea is very attractive.	その考えはとても魅力的だ。
The lake is ten miles about.	その湖は周囲１０マイルだ。
The house is painted white.	その家は白色に塗られている。
Birds flew away at the sound.	その音で鳥は飛び去った。
I intended to start at once.	すぐ出発するつもりだった。
However, it is too expensive.	しかしながら、高すぎる。
Their flowers smell sweet.	これらの花はいいにおいがする。
This wasn't cheap, was it?	これは安くは無かったでしょう。
This book is not for sale.	この本は売り物ではありません。
This book is pleasant to read.	この本は読んで楽しい。
This book is worthy of praise.	この本は賞賛に値する。
This meal is adequate for two.	この食事は二人分ある。
What do you call this flower?	この花は何と言いますか。
How pretty is this flower!	この花はなんときれいなことか。
This flower is very beautiful.	この花はとても美しい。
These oranges are good to eat.	このみかんは食べ頃だ。
Here's a pen for you to use.	このペンをお使いください。
Can I try on this jacket?	このジャケットを試着できますか。
This bag cost me 6 pounds.	このかばんは６ポンドしました。
I caught three fish yesterday.	きのう魚を３匹とった。
The poor girl shed tears.	かわいそうに少女は涙をこぼした。
The curtains were taken down.	カーテンは取り外された。
I am charmed to see you.	お目にかかれてほんとにうれしいわ。
My uncle called on a woman.	おじさんは女の人を訪問した。
I regularly go to bed at nine.	いつも９時には寝ます。
Did you have a good weekend?	いい週末を過ごしましたか。
Some kinds of birds can't fly.	ある種の鳥は飛べない。
Do you believe in ghosts?	あなたは幽霊がいると信じますか。
You are an angel of a child.	あなたは天使のような子だ。
What did you do yesterday?	あなたはきのう何をしましたか。
Please lend me your book.	あなたの本を私に貸してください。
I painted a picture for you.	あなたのために絵を書いた。
I can't lend you this book.	あなたにこの本は貸せません。
Many peoples live in Asia.	アジアには多民族が住んでいる。
We'd like a deposit of $50.	５０＄の内金をお願いします。
I had a sustaining breakfast.	栄養のある朝食をとった。
This chair is uncomfortable.	この椅子は座り心地が悪い。
Their cattle are all fat.	彼らの畜牛はみなよく肥えている。
I think X is more convincing.	Xの方が納得いくと思います
Courage will save many people.	勇気が多くの人を救います
He grasped my hand tightly.	彼がぎゅっと私の手を握り締めた
For example, this is a pen.	例えば、これは一本のペンです。
I think she will divorce him.	離婚するんじゃないかしら。
How would you like your eggs?	卵はどう料理しましょうか。
The price of eggs is going up.	卵の値段があがっている。
The dawn is just breaking.	夜がちょうど明けようとしている。
Could you bring me a blanket?	毛布を持ってきてください。
I got along with everybody.	僕はみんなと仲良くやっている。
I got the ticket for nothing.	僕はただで切符をもらった。
What have you done with my pen?	僕のペンはどうしたの。
The wall was coated with paint.	壁にペンキが塗られた。
The rice crop is poor this year.	米作は今年は凶作だ。
The rice crop is large this year.	米作は今年豊作だ。
The price of rice has come down.	米の値段が下がった。
My father is absent on business.	父は商用で不在です。
I want it with plenty of ice.	氷をたくさんいれて下さい。
She died in a plane crash.	彼女は飛行機事故で命を落とした。
She left her ticket at home.	彼女は切符を家に置き忘れた。
She absented herself from class.	彼女は授業を休んだ。
She has too much chat about her.	彼女は自慢が過ぎる。
She screamed and fainted.	彼女は金切り声を上げて、気絶した。
She has a good hand for painting.	彼女は絵がうまい。
She is watering the flowers.	彼女は花に水をやっています。
She disappeared in the dark.	彼女は暗闇の中に姿を消した。
She is hungry for affection.	彼女は愛情を強く求めている。
She's still chatting away.	彼女はまだおしゃべりをしている。
She imposed the work on him.	彼女はその仕事を彼に課した。
She drank the beer down.	彼女はそのビールをグイと飲みほした。
She whispered it in my ear.	彼女はそっと私の耳元で言った。
She insisted on going there.	彼女はそこに行くと主張した。
She gave me a meaningful look.	彼女の態度は意味深長だ。
Her boss is hard to deal with.	彼女の上司は扱いにくい。
A smile played on her lips.	彼女の口元に微笑みが浮かんだ。
Her dress was a cheap affair.	彼女のドレスは安物だった。
She has some literary talent.	彼女には文学の才能がある。
I called him to the telephone.	彼を電話口に呼び出した。
