Birds fly.	鳥は飛ぶ。
Everybody wants permanent peace.	誰もが永久平和を望んでいる。
My grandfather keeps early hours.	祖父は早寝早起きをします。
The ship sailed along the coast.	船は海岸沿いに航行していた。
The teacher's name was Mr Grey.	先生の名前はグレイ先生でした。
May I have a look at your ticket?	切符を見せてくれませんか。
Babies cry when they are hungry.	赤ん坊はおなかがすくと泣く。
They substituted coal for oil.	石炭を石油の代わりに使いました。
Aota was not worthy of your trust.	青田は信じるに値しない。
All the students like holidays.	生徒たちはみんな休日が好きだ。
Nothing succeeds like success.	成功ほど続いて起こるものはない。
Stick with it and you'll succeed.	成功するまでへこたれるな。
A new tax was imposed on wine.	新しい税金がワインにかせられた。
Steam is rising from the pot.	蒸気がポットから立ちのぼっている。
Were you shouting at my wife?	女房にどなってたのはおまえさんか。
Woman as she was, she was brave.	女ながらも彼女は勇敢だった。
I hear my uncle died of cancer.	叔父の死因は癌だったそうです。
My uncle has made me what I am.	叔父が今日の私を育ててくれた。
Behave yourself like a young man.	若者らしくふるまいなさい。
The car ran at 40 miles an hour.	車は時速４０マイルで走った。
The clock has just struck three.	時計がちょうど３時を打った。
Don't interfere in private concerns.	私事に口出しするな。
Everybody knows it except me.	私以外の誰もがそれを知っています。
I awoke three times in the night.	私は夜中に３度目が覚めた。
I informed her about the success.	私は彼女に成功を知らせた。
I'll give her some flowers.	私は彼女に花を何本かあげるつもりです。
I associate with him in business.	私は彼と共同で事業をやる。
I accompanied him on the trip.	私は彼といっしょに旅行に行った。
I was brought up by my grandmother.	私は祖母に養育された。
I was brought up by my grandmother.	私は祖母に育てられた。
I thought that I should succeed.	私は成功するだろうと思った。
Do I have to change my diet?	私は食事のとり方を変えるべきですか。
I've deposited the papers with him.	私は書類を彼に預けた。
I will study abroad on my own.	私は自分の力で留学するつもりだ。
I was abroad on an assignment.	私は仕事で外国に行っていました。
I had a funny dream last night.	私は昨夜おかしな夢を見ました。
I had to go there yesterday.	私は昨日そこへいかねばならなかった。
I had some money stolen yesterday.	私は昨日お金を取られた。
I regret becoming a teacher.	私は教員になったことを後悔している。
I intended to have gone abroad.	私は外国へ行くつもりだったが。
I painted the roof light blue.	私は屋根をライトブルーに塗った。
I completely walked ten miles.	私はたっぷり１０マイルは歩いた。
I regretted having done it.	私はそれをしてしまったことに後悔した。
I came in view of the castle.	私はその城が見えるところまで来た。
I like this blend of coffee.	私はこのブレンドのコーヒーが好きだ。
I don't like cheese very much.	私はあまりチーズが好きではない。
I read your letter yesterday.	私はあなたの手紙を昨日読みました。
I like that tie of yours.	私はあなたのあのネクタイが気に入っている。
I have an appointment at 8 o'clock.	私は８時に約束がある。
I'll stay there till six o'clock.	私は６時までそこにいます。
I walked three-fourths of a mile.	私は４分の３マイル歩いた。
My father sometimes goes abroad.	私の父は時々外国へ行きます。
My grandfather keeps early hours.	私の祖父は早寝早起きです。
My grandfather likes to walk.	私の祖父は散歩することが好きです。
My aunt is older than my mother.	私の叔母は母よりも年上です。
My uncle never writes letters.	私の叔父は決して手紙を書かない。
I have a cousin who is a lawyer.	私には弁護士のいとこがいる。
I have a friend who is a pilot.	私にはパイロットの友人がいる。
Will you pick out a tie for me?	ネクタイを選んでくれませんか？
Can you lend me some money?	私にいくらかお金を貸してくれませんか。
We had six guests to dinner.	私たちは夕食に６人の客を迎えました。
We employed her as an assistant.	私たちは彼女を助手に雇った。
We had a wonderful weekend.	私たちはすばらしい週末を過ごしました。
Our teacher is in a good temper.	私たちの先生はごきげんです。
Are there any tours of the city?	市内観光ツアーはありますか。
The pity is that he has failed.	残念なのは彼が失敗したことだ。
Yesterday I was caught in a shower.	昨日私は夕立にあった。
The weather was very bad yesterday.	昨日は天候が悪かった。
Did you have a good time yesterday?	昨日は楽しかったかい？
I took a paid day off yesterday.	昨日、有給休暇を取りました。
We're having five guests tonight.	今晩お客を５人招く予定だ。
Two students are absent today.	今日は二人の生徒が欠席している。
I regret that I can't come today.	今日は伺えなくて残念です。
It is as hot a day as yesterday.	今日は昨日と同じくらい暑い。
Have you ever seen a wolf?	今までにオオカミを見たことがありますか。
600 problems will be tough going.	合わせて６００題はきつい。
The factory did not want him.	工場では彼を欲しがりませんでした。
You may come whenever you like.	好きなときはいつでも来てよい。
You may come whenever you like.	好きなときにいつでも来てよい。
We have an opening at two o'clock.	午後二時なら開いてます。
Building materials are expensive now.	建築資材は今高い。
I feel sick whenever I see blood.	血を見ると具合が悪くなる。
A crowd gathered to see the fire.	群衆が火事を見に集まった。
You have to obey your parents.	君は両親に従わなければならない。
You have worked hard to succeed.	君の成功は一生懸命勉強した。
Your pen is better than mine.	君のペンは僕のペンよりも上等です。
Your chair is identical to mine.	君のいすは私のと全く同じだ。
I'm so glad that you succeeded.	君が成功してうれしく思います。
I stared back at her in surprise.	驚いて彼女の顔を見返した。
The holiday ended all too soon.	休暇はあっという間に終わった。
Are there any pens on the desk?	机の上にペンが何本ありますか。
There are no pens on the desk.	机の上にペンが一本もありません。
There is an apple under the desk.	机の下にリンゴがあります。
I am tied to my desk and chair.	机と椅子にへばりついています。
A curious disease struck the town.	奇妙な病気が町を襲った。
Do you play a musical instrument?	楽器をなにか演奏しますか。
Thank you for the pleasant evening.	楽しい夜をありがとう。
All the students shouted with joy.	学生はみな歓声をあげた。
We are anxious about her health.	我々は彼女の心配をしている。
We are anxious for world peace.	我々は世界平和を熱望している。
The flowers died for lack of water.	花は水がなくて枯れた。
I've finished watering the flowers.	花の水やり終わったよ。
Music has settled her nerves.	音楽を聴いて彼女の神経が静まった。
You should clean your dirty room.	汚い部屋の掃除をしなさい。
Even the worthy Homer sometimes nods.	猿も木から落ちる。
Exercise is vital for a dog.	運動は犬にとって絶対不可欠なものだ。
Drivers should wear seat belts.	運転手はベルトを締めるべきだ。
Strong winds accompanied the rain.	雨に激しい風が加わった。
The most expensive thing is land.	一番高いものは、土地です。
Those who work hard will succeed.	一生懸命働く人は成功する。
If he tries hard, he will succeed.	一生懸命やれば成功する。
London was bombed several times.	ロンドンは数回爆撃を受けた。
The lamp hung from the ceiling.	ランプは天井から下がっていた。
Good leather will wear for years.	よい皮は何年ももつものだ。
Good fences make good neighbors.	よい垣根はよい隣人をつくる。
Show me a cheaper one, please.	もっと安いものを見せてください。
Do you have less expensive ones?	もっと安いものはありますか。
Meg acquired many new friends.	メグは新しい友達をたくさん得た。
Everybody washed in the kitchen.	みんな台所で体を洗いました。
Mayuko took a bite of my apple.	マユコは私の林檎を一口食べた。
We still have plenty of time left.	まだ時間はたっぷりある。
Paul's success was a myth.	ポールが成功したというのは作り話だった。
Anywhere with a bed will do.	ベッド付きのところならどこでもいい。
Pink and rose are similar colors.	ピンクとばら色は似た色だ。
Bill did not commit the crime.	ビルはその罪を犯していなかった。
Bill replaced Jim as captain.	ビルはジムに代わり、主将になった。
Bill has no sense of adventure.	ビルには冒険心がまったくない。
What a pleasant journey we had!	なんて楽しい旅だったんだろう。
What sort of flower do you like?	どんな種類の花が好きですか。
Tom is eager for the apple.	トムはそのリンゴがほしくてたまらない。
Tom came home early yesterday.	トムはきのう早く帰って来ました。
What sports do you go in for?	どのようなスポーツをなさいますか。
How long have you been abroad?	どのくらい洋行していたのですか。
How come she hung up on you?	どうして彼女は電話を切ったのですか。
I was caught in a shower just now.	ついさっき夕立に遭った。
There was a slight chill in the air.	ちょっと肌寒かった。
Excuse me, could I get past?	ちょっと失礼、通していただけますか。
Want to hear something funny?	ちょっと、おかしな話聞きたくない？
Nobody likes being laughed at.	だれでも笑われるのは好きでない。
Who can put a bell on the cat?	だれがその猫に鈴をつけられるか。
Do you have Time magazine?	あなたはタイムマガジンを持っていますか？
Most Japanese live on rice.	たいていの日本人は米を主食にしている。
It has cost me $100 altogether.	それは全部で１００ドルでした。
That is not altogether false.	それは全くウソというわけではない。
She is charming for all that.	それにもかかわらず彼女は魅力的だ。
The arrow fell wide of the mark.	その矢は的から大きく外れた。
The dress is newly designed.	その服は新しくデザインされたものだ。
The museum is worth visiting.	その博物館はいってみる価値がある。
That boy watches over the sheep.	その男の子は羊の番をします。
Everybody laughed at the boy.	その男の子はみんなに笑われました。
The river discharges into a lake.	その川は湖に注いでいます。
The castle dates back to 1610.	その城は１６１０年に建てられた。
This fault admits of no excuse.	その失策には弁解の余地がない。
He goes to bed at eight o'clock.	その子は８時に床につきます。
That boy has a great talent.	その子どもにはすばらしい才能がある。
The murder remains a mystery.	その殺人事件は依然として謎である。
The old castle is in a sad state.	その古城は荒れ果てている。
This painting has poor composition.	その絵は構造がまずい。
The flower gave out a sweet smell.	その花はよい匂いがした。
The house was very badly built.	その家はひどい建てつけだった。
The house is fenced around.	その家の周りは垣根がめぐらされている。
That tie suits you very well.	そのネクタイとても似合っています。
The skirt is too wide for me.	そのスカートは私にはだぶだぶです。
I had no chance to relax there.	そこではくつろぐ暇がなかった。
We have safety deposit boxes.	セーフティーボックスがございます。
Excuse me. May I get through?	すみません、ちょっと通して下さい。
Sports keep us in good shape.	スポーツはからだの調子をよくする。
John is mad about pop music.	ジョンはポップスに夢中になっている。
John broke the window yesterday.	ジョンがきのう窓をこわした。
George accompanied me home.	ジョージは私の家までついて来てくれた。
Jim kicked the ball very hard.	ジムはとても強くボールを蹴った。
Jane is talking with somebody.	ジェーンは誰かと話をしています。
Jane is the president's secretary.	ジェーンは社長秘書です。
Two tickets to San Diego, please.	サンディエゴ２枚ください。
What lovely flowers these are!	これらはなんて綺麗な花でしょう。
These are on sale everywhere.	これらの物はどこででも売っている。
What a beautiful flower this is!	これは何と美しい花でしょう。
Is this your first trip abroad?	これが初めての海外旅行ですか。
This medicine is a natural poison.	この薬は、本来毒である。
This book makes pleasant reading.	この本は面白い読み物です。
I can't stand this stomach-ache.	この腹痛には耐えられません。
Is there a museum in this town?	この町には博物館がありますか。
I want this letter registered.	この手紙を書類にしてもらいたい。
I want this letter registered.	この手紙を書留にしてもらいたい。
This clock gains one minute a day.	この時計は一日１分進む。
This magazine is issued every month.	この雑誌は毎月出る。
This ticket is good for two weeks.	この券は２週間有効です。
This society has a large membership.	この会は会員が多い。
This flower is beautiful, isn't it?	この花は美しいですね。
This shirt is a little bit loose.	このシャツは少し緩いです。
This led to unexpected results.	このことが思わぬ結果を招いた。
Help yourself to these cakes.	このお菓子をご自由におとり下さい。
I bought this T-shirt on sale.	このＴシャツはバーゲンで買った。
You put far too much pepper in it.	コショウを入れすぎたね。
Do you sell desk lamps here?	ここで電気スタンドは売っていますか。
We can get many coals here.	ここで石炭をたくさん取ることができる。
You have already eaten the cake.	ケーキをもう食べてしまった。
I met your parents yesterday.	きのう、あなたの両親に会いました。
I bet we'll have a test today.	きっと今日テストがあるでしょう。
Can we effect a compromise?	お互いに歩み寄ってはいかがでしょうか。
My uncle now lives in comfort.	おじは今では安楽に暮らしている。
My uncle lives near the school.	おじは学校の近くに住んでいる。
He had no luck in finding work.	運悪く仕事が見つからなかった。
By good fortune, they escaped.	運よく彼らは逃れることができた。
My daughter loves jumping rope.	うちの娘は縄跳びが大好きです。
Our cow doesn't give us any milk.	うちの牛は全く乳が出ない。
Whenever you come, you are welcome.	いつ来ても歓迎します。
When is she to go abroad?	いつ彼女は外国に行くことになっていますか。
I was discharged without notice.	いきなり解雇を言い渡された。
That is not altogether false.	あれは全く誤りというわけではない。
That's the boy I saw yesterday.	あれは私が昨日会った少年です。
Alice has a flower in her hair.	アリスは頭に花をさしています。
That horse may be a good bet.	あの馬に賭ければ勝つかもしれない。
That baby has charming eyes.	あの赤ん坊は目もとに愛きょうがある。
The young man is a handsome figure.	あの少年は格好がいい。
Are you done with that magazine?	あの雑誌はもうすみましたか。
Do you think her attractive?	あなたは彼女を魅力的だと思いますか。
You can succeed in your life.	あなたは人生に成功する事が出来る。
What did you do on the weekend?	あなたは週末に何をしましたか。
Did you go to Nikko yesterday?	あなたは昨日日光に行きましたか。
How long did you stay abroad?	外国にはどのくらい滞在しましたか。
Will you lend me your knife?	あなたのナイフを貸してくれませんか。
Your skirt is out of fashion.	あなたのスカートは時代遅れですよ。
May I request a favour of you?	あなたに頼んでもよろしいですか。
Come here before seven o'clock.	７時より前にここに来るように。
In March, many flowers come out.	３月になると多くの花が咲く。
"She is lovely." "So she is."	「彼女はきれいだね」「まったくだ」
"Excuse me", Ann broke in.	「失礼ですが」とアンが話に割って入った。
The museum is open from 9 a.m.	博物館は午前九時から開いている。
Koyomi bought a bow and arrows.	コヨミちゃんは弓と矢を買った。
He is the boss's private secretary.	彼は社長の個人秘書だ。
I was personally very shocked.	かなり私なりにショックを受けました
He uses Internet only for X.	彼がXのみにインターネットを使っている
X has already passed three o'clock.	Xが既に３時を過ぎていた
I'll see what my neighbors are like.	われらが隣人の姿を探る
It meets the certain requirements.	それが一定の要件に該当する
He emphasizes education of the mind.	彼が心の教育を重視する
This one is definitely much cheaper.	断然こっちのほうが安い
It emphasized the importance of X.	それがXの重要性を強調した
He blows the chance of a lifetime	彼がせっかくのチャンスを逃す
We have all kinds of items.	当店はすべてのアイテムを取り揃えています
Her red lips forms words slowly.	紅色の唇がゆっくりと言葉を紡ぐ
It takes a long time to convert.	変換にはかなりの時間がかかる。
The train was full of passengers.	列車は乗客でいっぱいだった。
Faint grew the sound of the train.	列車の音がかすかになった。
How do you like your eggs done?	卵はどのように調理しましょうか。
The shell of an egg is easily broken.	卵の殻は壊れやすい。
Call me when you get settled in.	落ち着いたら電話してください。
I want to study abroad next year.	来年、私は外国に留学したい。
Courage is required of everyone.	勇気がみんなに求められている。
Does the end justify the means?	目的は手段を正当化するだろうか。
I awoke to find myself famous.	目が覚めてみると有名になっていた。
It was cool in the shade of the trees.	木陰は涼しかった。
Ring the bell in an emergency.	万一の場合にはベルを鳴らしなさい。
I follow my routine every day.	毎日、決まりきったことをしている。
We are staying at our uncle's.	僕たちは叔父の家に泊まっています。
Mother is anxious about my future.	母は私の将来を案じている。
I caught a cold, and I have a fever.	風邪をひいて熱がある。
The wind scattered the leaves about.	風が葉を吹き散らした。
The goods were sent out yesterday.	品物は昨日出荷されました。
That was a very delicate situation.	非常に微妙な状況だった。
They endured many difficulties.	彼等は多くの苦難をたえしのんだ。
I'll try her out as a secretary.	彼女を秘書として使ってみよう。
She charmed everyone present.	彼女は来た人全部に愛嬌を振りまいた。
She behaved with a great courage.	彼女は勇気を持って行動した。
She believes that he is innocent.	彼女は彼の無実を信じている。
She wrote a book about the bird.	彼女は鳥についての本を書いた。
She made an excuse for being late.	彼女は遅刻の言い訳をした。
She could not cope with anxiety.	彼女は心労に打ち勝てなかった。
She is always immune to criticism.	彼女は常に批判に動じない。
She came to live with her aunt.	彼女は叔母と暮らすようになった。
She cried that she was innocent.	彼女は自分は無実ですと叫んだ。
She asserted that she was right.	彼女は自分が正しいと断言した。
She played a trick on my sister.	彼女は私の妹にいたずらをした。
She was told to accompany me.	彼女は私のお供をするように言われた。
She was always telephoning me.	彼女は私に電話をかけてばかりいた。
She gave me these old coins.	彼女は私にこれらの古いコインをくれた。
She absented herself from the lesson.	彼女は稽古を休んだ。
She says that she likes flowers.	彼女は花が好きだと言っている。
She is curious about anything.	彼女は何にでも首を突っ込みたがる。
She doesn't wear the cheap stuff.	彼女は安物は身につけません。
She is often absent without leave.	彼女はよく無断欠席をする。
She poured the milk into a bowl.	彼女はミルクをボールに注いだ。
She proposed giving a party.	彼女はパーティーを開くことを提案した。
What lovely eyes she has!	彼女はなんてきれいな目をしているのでしょう。
I find her appearance attractive.	彼女はとても魅力的だと思う。
She lives in an expensive style.	彼女はぜいたくに暮らしている。
She saw a tall man yesterday.	彼女はきのう背の高い男性を見ました。
Her son is sure to succeed.	彼女の息子さんはきっと成功するでしょう。
Half her goods were sold cheap.	彼女の商品の半分は安く売られた。
Her way of thinking was rational.	彼女の思考法は合理的だった。
I informed him of her arrival.	彼女が到着したことを彼に知らせた。
He reminds me of my grandfather.	彼を見ると祖父を思い出します。
They surprised the enemy at dawn.	彼らは夜明けに敵を急襲した。
They knocked the box to pieces.	彼らは箱をこなごなに打ち壊した。
They fought for their liberty.	彼らは自分達の自由のために戦った。
They named their dog Lucky.	彼らは自分たちの犬をラッキーと名付けた。
They invited me to the party.	彼らは私をパーティーに招いてくれた。
Originally they were farmers.	彼らはもともと農業をやっていました。
They are leading a loose life.	彼らはだらしのない生活をしている。
They asserted that it was true.	彼らはそれが本当だと言い張った。
They all longed for the holiday.	彼らはその休暇を待ちこがれた。
They shed tears at the news.	彼らはそのニュースを聞いて涙を流した。
He spared no pains to help me.	彼は労をいとわず私を助けてくれた。
She made up her mind to go abroad.	彼女は洋行する決心をした。
He behaved like he was afraid.	彼は怖がっているような行動をした。
He was crowned with eternal victory.	彼は不滅の栄冠を得た。
He likes a most beautiful flower.	彼は非常に美しい花が好きだ。
He thought her very charming.	彼は彼女をとても魅力的だと思います。
He is anxious for her to come.	彼は彼女がくることを熱望している。
He is nothing but a minor artist.	彼は二流の芸術家にすぎない。
He killed himself by taking poison.	彼は毒を飲んで自殺した。
He graduated from Tokyo University.	彼は東京大学を卒業した。
He hung a lamp from the ceiling.	彼は天井からランプをつるした。
He yielded the castle to the enemy.	彼は敵に城を明け渡した。
He protested that he was innocent.	彼は誓って無事だといった。
He has a reputation for integrity.	彼は誠実さで知られている。
He works hard so as to succeed.	彼は成功のために熱心に勉強する。
He has recovered little by little.	彼は少しずつ回復してきた。
He is sometimes absent from school.	彼は時々学校を休みます。
He is not my father but my uncle.	彼は私の父ではなく、叔父だ。
He took me for my twin brother.	彼は私の事を双子の兄と間違えた。
He earns three times as much as me.	彼は私の給料の３倍稼ぐ。
He got hurt in the game yesterday.	彼は昨日試合でけがをした。
He was absent from school yesterday.	彼は昨日学校を休んだ。
He was late for school yesterday.	彼は昨日学校に遅刻しました。
He did not eat anything yesterday.	彼は昨日何も食べなかった。
He was late for school yesterday.	彼は昨日、授業に遅れました。
He started for America yesterday.	彼は昨日アメリカに出発した。
He rescued a cat from a high tree.	彼は高い木から猫を救った。
He had the fortune to find a job.	彼は幸運にも仕事を見つけた。
He sat on the bench in the park.	彼は公園のベンチに腰をかけた。
He has plenty of money in the bank.	彼は銀行預金が相当ある。
