Duck!	頭を下げろ！
Poets have compared life to a voyage.	詩人は人生を航海にたとえてきた。
We had an unpleasant experience there.	私達はそこで不快な経験をした。
I've made a first draft of my thesis.	私は論文の１回目の下書きをした。
I don't have much interest in cooking.	私は料理にはあまり興味がない。
I'll invite whoever wants to come.	私は来たい人は誰でも招待するつもりだ。
I always take a bath in the morning.	私は毎朝、入浴することにしている。
I'm supposed to be sensible human.	私は分別のある人間でなければならない。
I was too tired to walk any more.	私は疲れていたのでそれ以上歩けなかった。
I was offended by her crude manners.	私は彼女の粗野な態度に腹が立った。
I'll hire whoever he recommends.	私は彼が推薦する人なら誰でも雇うつもりだ。
I finished writing the letter by noon.	私は昼までに手紙を書き終えた。
I was confronted with many difficulties.	私は多くの障害に直面した。
I was confronted with many difficulties.	私は多くの困難に直面した。
I bought a dictionary the other day.	私は先日、一冊の辞書を買いました。
My husband and I are calling it quits.	私は主人と別れる事にしました。
I'd like to see the Statue of Liberty.	私は自由の女神像を見たいです。
I sometimes enjoy my leisure in fishing.	私は時々よかにつりをする。
We had to cooperate with each other.	私は互いに協力せざるをえなかった。
I met with my teacher in the theater.	私は劇場で先生にばったり会った。
I'm not a bit interested in chemistry.	私は化学にまったく興味がない。
I got a letter written with a pencil.	私は鉛筆書きの手紙を受け取った。
I'm very tired from working all day.	私は一日中働いてとても疲れている。
I spent two hours playing the piano.	私はピアノを弾いて２時間すごした。
I am very tired from the hard work.	私はつらい仕事でとても疲れています。
I tried to get it, but in vain.	私はそれを手に入れようとしたが、無駄だった。
I can't help opposing the marriage.	私はその結婚に反対せざるを得ません。
I bought two tickets for a concert.	私はコンサートの入場券を２枚買った。
I wish to be buried in this country.	私はこの国に骨を埋めるつもりです。
I met her by accident on Third Avenue.	私は３番街で偶然彼女にあった。
I was taught to respect my elders.	私は、年上の人を敬うように教えられた。
I am ashamed of my poor English.	私は、自分の下手な英語を恥じているのです。
There is little furniture in my room.	私の部屋にはほとんど家具がない。
My little brother can scarcely swim yet.	私の弟はほとんど泳げない。
My grandfather is living on a pension.	私の祖父は年金で生活している。
My new pair of shoes are made of leather.	私の新しい靴は革製です。
My remarks were not aimed at you.	私の言葉は君をねらったものではなかった。
My health is not equal to the voyage.	私の健康では航海に耐えられない。
My home town is adjacent to the ocean.	私の郷里の町は海に接している。
There is little furniture in my house.	私の家には家具がほとんどない。
We were seated at the supper table.	私たちは夕食のテーブルに座っていた。
We rented the apartment by the week.	私たちは週ぎめでアパートを借りた。
I reckon we'll see him once more.	私たちはもういちど彼に会おうと思います。
We used to swim in this river a lot.	私たちはこの川でよく泳いだものだ。
We got a little bored with each other.	私たちはお互い少しあきてきた。
He will be my deputy while I am away.	私が不在の時は彼が私の代理です。
He can no more swim than I can fly.	私が空を飛べないように彼は泳げない。
Death ends man's finite existence.	死によって人間の限りある人生は終わる。
The mayor addressed the general public.	市長は大衆を前に演説をした。
Do you have an extra shelf I can use?	使っていない整理棚はありますか。
I'm afraid I must say goodbye.	残念ですが、もうおいとましなければなりません。
Visitors may not feed the animals.	参観者は動物にえさをやってはいけない。
She was a bundle of nerves last night.	昨夜彼女は神経が高ぶっていた。
Did you feel an earthquake last night?	昨夜、地震に気がつきましたか。
Will you help me look for my purse?	財布を探すのを手伝ってくれませんか。
Pro baseball is interesting these days.	最近のプロ野球はおもしろい。
The most effective defense is offense.	最も効果的な防御は攻撃である。
The trouble with him is that he is lazy.	困ったことに彼は怠け者だ。
I resolved to keep a diary this year.	今年は日記をつけようと決心した。
The football game is now in action.	今フットボールの試合が行われている。
The heavy rain was accompanied with thunder.	豪雨は雷を伴った。
The house was undermined by the flood.	洪水で家の土台が削り取られた。
There is a pond in the middle of the park.	公園の中央に池がある。
The negotiations made little progress.	交渉はほとんど進展しなかった。
Replace the old tires with new ones.	古いタイヤを新しいのと取り替えて。
We give a 10% discount for cash.	現金払いには１０パーセント割引いたします。
I have lost both principal and interest.	元も子もなくしてしまった。
A strange man caught me by the collar.	見知らぬ男が私の襟をつかんだ。
The dogs were closing in on the deer.	犬たちが鹿の周りを包囲していた。
Art is not a luxury, but a necessity.	芸術は贅沢品ではない、必需品だ。
The policemen said to them, "Stop."	警官達は彼らに止まりなさいと言った。
Seeing the policeman, the man ran away.	警官を見ると男は走り去った。
He ran away at the sight of a policeman.	警官を見て彼は逃げ去った。
The policeman commanded them to stop.	警官は彼らに止まるように命じた。
You certainly play the piano well.	君は本当にじょうずにピアノを弾くねえ。
Do you know how to use a dictionary?	君は辞書の使い方を知っていますか。
You are expected to pass the exam.	君は試験に合格するものと思われている。
You are to apologize to her for it.	君はその事について彼女に謝るべきだ。
Your remark amounts almost to insult.	君の言葉はほとんど屈辱に等しい。
You two are the nucleus of the team.	君たち二人はこのチームの中心です。
What was the cause of your quarrel?	君たちの喧嘩の原因はなんだったのか。
Please remove the mud from your shoes.	靴から泥を取り除いてください。
I had a hard time getting to the airport.	空港に行くのに苦労した。
Money is not a criterion of success.	金銭は成功を計る基準にはならない。
Kyoto depends on the tourist industry.	京都は観光産業に依存している。
We punished him according to the rules.	規則に当てはめて彼を罰した。
Basically, I agree with your opinion.	基本的にあなたの意見に賛成です。
A hedge between keeps friendship green.	間の垣根は友情を新鮮に保つ。
My patience has come to the breaking point.	堪忍袋の緒が切れる。
Students are longing for the vacation.	学生は休暇を待ち焦がれている。
The students revolted against authority.	学生たちは権威に反抗した。
Every member of the cabinet was present.	閣僚はみんな出席していた。
Hans sold the patent to a company.	ハンスさんが会社へ特許権を売りました。
We were looking for buried treasure.	我々は埋められた宝をさがしていた。
We arranged the books according to size.	我々は大きさの順に並べた。
We will get to Tokyo Station at noon.	我々は正午に東京駅に着くだろう。
Our interest converges on that point.	我々の関心はその一点に集中する。
When I got home, I was very tired.	家に着いた時、私はたいへん疲れていた。
The summer vacation ended all too soon.	夏休みはとても早く終わった。
Can I borrow something to write with?	何か書くものを貸してくれますか。
Is there anybody who knows first aid?	応急処置のできる人はいませんか。
Every time it rains, the roof leaks.	雨が降ると必ず屋根から雨水が漏る。
Let's play baseball when the rain stops.	雨がやんだら野球をしよう。
Lightning is an electrical phenomenon.	稲妻は電気による一現象である。
A festival is held at the rice harvest.	稲の収穫期にはお祭りをする。
The committee approved the draft budget.	委員会は予算案を承認した。
Our committee consists of ten members.	委員会は１０人からなっている。
We must go without luxuries.	われわれはぜいたく品なしですまさなければならない。
Who taught you to play the piano?	誰があなたにピアノを弾くのをおしえたの。
We've got to catch the lion alive.	ライオンを生け捕りしなくてはならない。
The lion ate the rabbit in one bite.	ライオンはウサギをひと口で食べた。
All work and no play makes Jack a dull boy.	よく学び、よく遊べ。
Fatigue follows a flight to Europe.	ヨーロッパに、行った後は疲労が残る。
I have finally regained my regular form.	やっと本調子を取り戻した。
At last, the end-of-term exams are over.	やっと期末試験が終わった。
Have patience for another day or two.	もう一日か二日我慢してください。
Mary paid five dollars for her lunch.	メアリーは昼食代を五ドル払った。
There are some cookies in the jar.	瓶の中にいくつかクッキーが入っている。
The baseball season opens before long.	まもなく野球シーズンが始まる。
First of all, we must dismiss him.	まず第一に彼を解雇しなければならない。
You really like comic books, don't you?	ほんとに君は漫画が好きだね。
Bob wanted to keep the fox at home.	ボブはそのキツネを家で飼いたかった。
Almost all boys can play baseball.	ほとんどすべての少年は野球ができます。
We are to go on a hike tomorrow.	ぼくたちは明日ハイキングに行く予定なんだ。
Benjamin shot a bear with a rifle.	ベンジャミンはライフルでクマを撃った。
Maybe I'll just wander off on my own.	ぶらりと一人旅でもしてくるかな。
Bill has not less than six dollars.	ビルは少なくとも６ドルは持っている。
A boy was driving a flock of sheep.	ひとりの少年が羊の群れを追っていた。
I bumped into an old friend on the bus.	バスで旧友にばったり会った。
Would you like another helping of pie?	パイのおかわりをいかがですか。
Napoleon was exiled to St. Helena.	ナポレオンはセントヘレナ島へ流された。
Which is stronger, a tiger or a lion?	トラとライオンとどちらが強いか。
By the way, have you seen him lately?	ところで、最近彼に会いましたか。
Why did he live in the United States?	どうしてアメリカに住んでいたの？
What are you punishing them for?	どうしてあなたは彼らを罰しているのですか。
Why should I apologize to you?	どうしてあなたにお詫びする理由があるのですか。
One swallow does not make a summer.	ツバメ１羽来ただけで夏にはならない。
Stop shooting the breeze and get to work!	ダベってないで仕事しろ。
Maybe he has lots of girlfriends.	たぶんガールフレンドがたくさんいるのよ。
Tobacco smoke is productive of cancer.	タバコの煙はガンを引き起こす。
A lot of policemen guarded the hall.	たくさんの警官がホールを警備した。
It is bold of you to say such a thing.	そんな事を言うとは君は大胆だ。
Not hardly. He eats like a goat.	そんなことないですよ。何でも食べますから。
It was a manifest error of judgement.	それは明らかに判断の誤りだった。
It's the fastest railroad in the world.	それは世界で一番速い鉄道だ。
It is like letting a tiger run loose.	それは虎を野に放つようなものだ。
Whoever wants it may take it.	それがほしい人なら誰でもそれをもって行ってよい。
Put the book on the bottom shelf.	その本はいちばん下の棚に置いてください。
Whoever wants the book may have it.	その本が欲しい人はだれでももらえる。
The tower is as high as 220 meters.	その塔は高さが２２０メートルもある。
The population of the town was wiped out.	その町の住民は全滅した。
The population of the town was wiped out.	その町の住人は全滅した。
The pond was alive with tiny fishes.	その池は小さな魚でいっぱいだった。
The earthquake brought about disaster.	その地震は大災害をもたらした。
Food is still scarce in the region.	その地域ではまだ食料が不足している。
The baby is playing with some toys.	その赤ちゃんはおもちゃで遊んでいる。
The student's progress is satisfactory.	その生徒の進歩は申し分ない。
The food tasted slightly of garlic.	その食べ物は少しニンニクの味がした。
He says things on the spur of the moment.	その場限りのことを言う。
The portrait was taken from the wall.	その肖像画は壁から取り除かれた。
The boy grew up to be a scientist.	その少年は大きくなって科学者になった。
The car is waxed every other day.	その車は１日おきにワックスがかけられる。
Probe into the cause of the accident.	その事故の原因を徹底的に調べる。
That kid is a little bundle of energy.	その子どもは元気そのものです。
The three sisters look very much alike.	その三姉妹はとても似ている。
The word has unpleasant associations.	その言葉には不愉快な連想がある。
The bridge has a span of 100 meters.	その橋は長さが１００メートルある。
The company published a new magazine.	その会社は新しい雑誌を出版した。
The firm publishes educational books.	その会社は教育的な本を出版する。
The hotel can accommodate 500 guests.	そのホテルは５００人宿泊できる。
The cat lay hidden behind the bushes.	そのネコは茂みの影に隠れていた。
The manager of the team quit suddenly.	そのチームの監督が突然やめた。
Better wear out shoes than sheets.	すり減らすのはシーツではなく靴にしろ。
All human beings are legally equal.	すべての人間は法律的には対等である。
Everybody is bound to obey the laws.	すべての人は法律に従うべきである。
All children are potential geniuses.	すべての子供には天才の素質がある。
I think the soup needs a bit of salt.	スープに多少の塩が必要だと思う。
John played cat and mouse with Dick.	ジョンはディックを、もてあそんだ。
Jones was born in the United States.	ジョーンズさんは合衆国で生まれた。
Take the jam down from the top shelf.	ジャムを上の棚から降ろしてくれ。
Jim boasts of having passed the exam.	ジムは試験に通ったのを自慢する。
But my older sister is good at swimming.	しかし、姉は水泳が得意だ。
Jane and I play the piano very well.	ジェーンと私はピアノを上手にひく。
How long would a sandwich take?	サンドイッチだったらどれくらいかかりますか。
Sam, this is gonna take you hours.	サム、これをやるのに何時間も掛かるぞ。
Let's look it up in the dictionary.	さあ、辞書でそれを調べて見ましょう。
To talk during a concert is rude.	コンサートの最中に喋るのは無作法である。
What do you say to going to the concert?	コンサートに行きませんか。
This is a portrait of my late father.	これは亡くなった父の肖像画です。
What sauce do you use for this dish?	この料理にソースはどんな味ですか。
This medicine helps relieve muscle pain.	この薬は筋肉痛を和らげる。
The meaning of this sentence is obscure.	この問題の意味は不明瞭だ。
This tree measures three meters around.	この木は周囲３メートルある。
This book contains forty photographs.	この本は中に４０枚の写真を含む。
There is much furniture in this room.	この部屋には家具がたくさんある。
This area is rich in marine products.	この地方は海産物に恵まれている。
The river flows too fast to swim in.	この川は泳ぐのには流れが速すぎる。
This river flows too fast to swim in.	この川は泳ぐには流れが速すぎる。
I am uncomfortable in these new shoes.	この新しい靴は履き心地が悪い。
This hut is in danger of falling down.	この小屋は倒壊のおそれがある。
This gun has a range of 300 meters.	この銃は３００メートルの射程がある。
This dictionary is written in English.	この辞書は英語で書かれている。
Do you have any objection to this plan?	この計画に異議はありますか。
Do you have these shoes in my size?	この靴で私に合うサイズはありますか。
This theory consists of three parts.	この学説は３部から成り立っている。
I swam a lot during this summer vacation.	この夏休みはよく泳いだ。
I am going to try to get a good tan.	この夏はこんがり焼こうと思います。
This remark is not applicable to you.	この意見は貴方に当てはまらない。
Please hold this ladder steady.	このはしごをしっかりと押さえておいて下さい。
This table accommodates six people.	このテーブルなら６人は掛けられます。
You must not speak so loudly here.	ここではそんな大声で話してはならない。
The clean towels are in the drawer.	きれいなタオルは引き出しにあります。
I'm sure your endeavor will bear fruit.	きっと努力が実を結びますよ。
You may invite whoever wants to come.	きたい人は、誰でも招待してよい。
I'm ashamed to say that it's true.	お恥ずかしいことですがそれは本当です。
It's very decent of you to help me.	お手伝いくださってどうもありがとう。
Would you put the dishes in the sink?	お皿を流しに置いてもらえますか。
I will borrow it then, if you insist.	お言葉に甘えてお借りいたします。
Australia exports a lot of wool.	オーストラリアは多くの羊毛を輸出している。
Any dish will do if it is delicious.	おいしいならばどんな料理でもよい。
Are we allowed to use the elevator?	エレベーターに乗ってもよいのですか。
Inflation is getting out of control.	インフレは抑えられなくなっている。
Anne is the envy of all her friends.	アンは友人みんなの羨望の的である。
Refugees in Africa are seeking help.	アフリカの難民が救いを求めている。
Does that store keep textile goods?	あの店には織物類が置いてありますか。
Do they sell notebooks at that store?	あの店でノートは売っていますか？
Do you know if he has a girlfriend?	あの人に彼女がいるかどうか知ってる？
I wonder who's buried in that tomb.	あのお墓には誰が入っているのだろう。
You must go, like it or lump it.	あなたは否でも応でも行かなければならない。
You must not indulge in drinking.	あなたは好き放題に酒を飲んではならない。
You must never resort to violence.	あなたは決して暴力に訴えてはならない。
Where will you go for the vacation?	あなたは休みの日にどこへ行きますか。
You are a good painter, aren't you?	あなたは絵を書くのがじょうずですね。
Is your sister swimming in the river?	あなたの妹は川で泳いでいますか。
I will follow you wherever you go.	あなたの行くところどこまでも参ります。
Your ideas are in accord with ours.	あなたの考えは私たちと一致している。
You may invite whoever you like.	あなたが好きな人をだれでも招待してもいい。
Einstein was a mathematical genius.	アインシュタインは数学の天才だった。
He is the dumbest kid in the class.	あいつはクラスでいちばんのまぬけだ。
He cried how silly he had been.	ああ、何と愚かだったんだろう、と彼は言った。
Each of the three boys got a prize.	３人の少年のそれぞれが賞をもらった。
Could you give me change for a dollar?	１ドルをくずしてくれませんか。
Oxygen from the air dissolves in water.	空気中の酸素は水に溶解する。
I was interested in your remark.	あなたのおっしゃった事に興味を持ちました。
Chris defeated the vampire knight!	クリスはヴァンパイア・ナイトを倒した！
Japanese people in general are polite.	日本人は一体に礼儀正しいです。
He actively conducts personnel exchanges.	彼が積極的に人事交流を行う
There are live concerts on late-night TV.	ライブを深夜にテレビでやる
The brick wall is over two meters high.	ブロック塀の高さが２ｍを超える
I bumped the person next to me with my elbow.	肘が隣の人に当たる
The unemployment figures keep rising.	益々、失業者が増加の一途を辿ります
Festivals and events add color to life.	祭りと行事が生活に彩りを添える
A six-meter wide road lies between them. 	それが間に６ｍの道路を挟む
Attach the accompanying cover on it.	本体側には付属のカバーを取り付けます
Stop administering this drug immediately.	直ちに本剤の投与を中止する
I broke up with my boyfriend two days ago.	私はおととい彼氏と別れた
The team consists of four members.	チームが４人のメンバーで構成されています
The lion bared its teeth even further.	ライオンはさらに牙をむき出した。
All those bastards do is complain.	どいつもこいつも不平ばかり言いやがって。
He shouldered the swing door open.	彼は肩で押してそのスイングドアを開けた。
Well, broadly speaking that's right.	まあ、広義的には間違っていませんね。
One can't see through a brick wall.	煉瓦の壁は透かして見ることはできない。
Don't talk about work. We're on vacation.	旅先で仕事の話しないでよ。
Did the trip live up to your expectations?	旅行は期待通りでしたか。
When I stood up, my head was swimming.	立ち上がったら頭がくらくらした。
They announced that a storm was coming.	嵐が接近していると発表された。
Don't put all your eggs in one basket.	卵をすべて一つのかごに入れるな。
Thunder indicates that a storm is near.	雷は、嵐が近づいている徴候だ。
You may bring whoever wants to come.	来たい人は誰でも連れてきてよろしい。
You may invite whoever wants to come.	来たい人は誰でも招待してよろしい。
In brief, the party was splendid.	要するに、そのパーティーはすばらしかった。
Playing baseball is an outlet for energy.	野球は精力のはけ口になる。
Love watching baseball and football.	野球とフットボールを見るのが大好き。
I heard our dog barking all night.	夜通しうちの犬が吠えているのが聞こえた。
There was no need for verbal communication.	黙っていて心が通った。
What do you say to going swimming tomorrow?	明日、泳ぎに行こうよ。
I shall never forget your kindness.	命がある限りあなたのご恩は忘れません。
A boat suddenly appeared out of the mist.	霧の中から突然船が現れた。
A curtain of mist blocked our view.	霧が立ちこめて見晴らしがきかなかった。
Get hold of the rail just in case.	万一の時に備えて手すりにつかまりなさい。
I'll be off duty at noon on Saturday.	僕は土曜日は正午に勤務からひける。
I can play the piano, he thought.	僕はピアノが弾けるのだ、と彼は思いました。
I borrowed the book from this library.	僕はこの図書館でその本を借りた。
You'll be punished if you break the law.	法を破れば罰せられるだろう。
According to the report, he is alive.	報告によれば彼は生きているそうだ。
There isn't much furniture in my room.	部屋にはあまり家具はありません。
Feeling himself insulted, he got angry.	侮辱されたと感じて彼は怒った。
My father put a ladder against the tree.	父は木にはしごを立てかけた。
My father gave me a new fountain pen.	父は私に新しい万年筆をくれました。
My father allowed me to go swimming.	父は私が泳ぎに行くのを許してくれた。
Father seldom comes home before eight.	父は８時にはめったに帰宅しない。
The couple quarreled, but soon made up.	夫婦喧嘩したがすぐ仲直りした。
Please attach a certificate of quality.	品質証明書を添付してください。
The plane buzzed the control tower.	飛行機は管制塔の上をすれすれに飛んだ。
The expenses average ten dollars a day.	費用は平均して１日１０ドルだ。
