Duck!	頭を下げろ！
This drug acts against headache.	この薬は頭痛に効く。
The medicine is hard to swallow.	この薬は飲みにくい。
This medicine tastes horrible.	この薬はひどい味がする。
This cloth adheres to the skin.	この布は肌にくっつく。
Where's this train bound for?	この電車はどこ行きますか。
This district forms a basin.	この地方は盆地になっている。
This word has two meanings.	この単語には二つの意味がある。
This statue is as large as life.	この像は実物大です。
This river is safe to swim in.	この川は泳いでも安全だ。
This stone weighs five tons.	この石は５トンの重さがある。
This water has an ugly smell.	この水は嫌なにおいがする。
This dictionary has 12 volumes.	この辞書は１２冊ある。
Rain is scarce in this country.	この国は雨がとぼしい。
Oil is scarce in this country.	この国には石油が乏しい。
How is the word accented?	この語のアクセントはどこにあるか。
These shoes are made in Italy.	この靴はイタリア製です。
No one dwells in this house.	この家には誰も住んでいない。
How long is this pencil?	この鉛筆はどのくらい長いでしょうか？
This bread is very delicious.	このパンはとてもおいしい。
This soup tastes of onions.	このスープは玉ねぎの味がする。
The soup tastes of garlic.	このスープはニンニクの味がする。
This soup is really good.	このスープはとてもおいしいですね。
I'm not feeling well lately.	この頃、気分が優れないんだ。
This cake is very delicious.	このケーキはとてもおいしい。
Can I catch a taxi here?	ここでタクシーをつかまえられますか。
The bright sun was shining.	きらきらする太陽が輝いていた。
Canada produces good wheat.	カナダは良質の小麦を生産する。
I gave her a doll in return.	お返しに彼女に人形をあげた。
The elevator is out of order.	エレベータが故障している。
Thank you for your kindness.	いろいろご親切にありがとう。
Were you sober at that time?	あの時は素面だったのですか。
I'm dying for that camera.	あのカメラが欲しくてたまらない。
You are a beautiful butterfly.	あなたは美しい蝶々です。
Where are you bound for?	あなたは何処へ向かっているのですか。
Who is your favorite actor?	あなたの好きな俳優は誰ですか。
I have urgent business with you.	あなたに急用がある。
Unfortunately, she is absent.	あいにく、彼女は不在です。
That fellow is a thorough fool.	あいつは全くの馬鹿だ。
I had an abortion two years ago.	２年前中絶しました。
An elephant was hunted there.	１頭の象がそこで狩られた。
UN stands for United Nations.	UNは[国連]を表します。
He has no interest in politics.	彼は政治に関心が無い。
An absorbing tale of adventure.	素敵に面白い冒険物語。
Watch him and do likewise.	彼をよく見て同じようにしなさい。
I assure that you can make money.	私が収入の約束をする
Everyone has a definite goal.	一人一人が目標をしっかり持つ
He got a one-hour massage.	彼が１時間のマッサージを受けました
It was absolutely useless.	それがまったく使い物にならなかった
Mt. Fuji was very impressive. 	富士山がとても印象に残った
He cited two examples among X.	彼がXを二つ例にあげました
It fulfills certain conditions.	それが一定の条件を満たす
He represents the United States.	彼がアメリカを代表する
It reduces the growth of mold.	それがカビの発生を抑えます
He finally changed the tire.	彼がやっと車のタイヤを交換した
She's got a Turkish boyfriend.	彼女はトルコ人の彼がいる。
It's a magnificent view, isn't it?	壮大な眺めですね。
I'm surrounded by fuckwits!	どいつもこいつもばかばっかりだ。
The car was stuck in the mud.	車がぬかるみに填まり込んだ。
Acid soil is neutralised by ash.	酸性土を灰で中和する。
The wound in the arm left a scar.	腕の傷は跡を残した。
Mr Suzuki is a great scientist.	鈴木氏は偉大な科学者だ。
I have a confirmed reservation.	予約は確認されています。
It snowed as was forecast.	予報されていたとおり、雪が降った。
What would you like for supper?	夕食は何にしましょうか。
Friendship bound them together.	友情が彼らを結びつけた。
I don't like baseball at all.	野球はちっとも好きではない。
The baseball season has opened.	野球シーズンが始まった。
The eye is bigger than the belly.	目は胃袋より大きい。
Evidently, he's made a mistake.	明らかに彼はミスをした。
We could see nothing but fog.	霧の他には何も見えなかった。
It's useless to try and resist.	無駄な抵抗をやめなさい。
Wake not a sleeping lion.	眠っているライオンを目覚めさせるな。
I belong to the swimming club.	僕は水泳部に入っています。
I took a fancy to the singer.	僕はその歌手が好きになった。
My shoes are bigger than yours.	僕の靴は君のより大きい。
Barking dogs seldom bite.	吠える犬はめったに噛み付く事はない。
I'd like to breast-feed my baby.	母乳で育てたいのです。
My father is an expert surgeon.	父は熟練した外科医です。
My father made a shelf for me.	父は私に棚を作ってくれた。
She was consumed with ambition.	彼女は野望に燃えていた。
She smiled and said goodbye.	彼女は微笑んで、別れを告げた。
She testified against him.	彼女は彼に対して不利な証言をした。
She is as intelligent as he.	彼女は彼と同じくらい頭がいい。
She shows a shy disposition.	彼女は内気な性格の持ち主です。
She indulged herself in reading.	彼女は読書にふけった。
She used up a cake of soap.	彼女は石鹸を一個使ってしまった。
Should she be there at noon?	彼女は正午にそこにいましたか。
She tried to smile in vain.	彼女は笑おうとしたがだめだった。
She tried to conceal the fact.	彼女は事実を隠そうとした。
She has a set of irregular teeth.	彼女は歯並びが悪い。
She made a polite bow to me.	彼女は私に丁寧におじぎをした。
She lost interest in her work.	彼女は仕事に興味を失った。
She dislikes going to school.	彼女は学校へ行くのを嫌がる。
She is keen to go abroad.	彼女は外国へ行きたいと熱望している。
She was trained as a singer.	彼女は歌手として訓練を受けた。
She was wearing long boots.	彼女はロングブーツを履いている。
She's as clever as they make 'em.	彼女はとても利口だ。
She dried her face on a towel.	彼女はタオルで顔を拭いた。
She gasped out the news.	彼女はその知らせをあえぎながら伝えた。
She hurried across the lawn.	彼女は芝生を横切っていそいだ。
She is no ordinary singer.	彼女はけっして並みの歌手ではない。
One of her shoes dropped off.	彼女の片方の靴が脱げました。
Her hair is streaked with gray.	彼女の髪は白髪まじりだ。
Her hair feels like silk.	彼女の髪は絹のようなてざわりがする。
Her son is a jet pilot.	彼女の息子はジェット機のパイロットです。
Her thick makeup is disgusting.	彼女の厚化粧が嫌らしい。
You should apologize to her.	彼女に謝ったほうがいいですよ。
They swam against the stream.	彼らは流れに逆らって泳いだ。
They contended against prejudice.	彼らは偏見と戦った。
They became citizens of Japan.	彼らは日本の国民となった。
They were tired of waiting.	彼らは待つことに飽きがきていた。
They are living on charity.	彼らは施しを受けて暮らしている。
They accomplished their mission.	彼らは使命を果たした。
They rose against oppression.	彼らは圧制に反抗して立った。
They fell to quarreling again.	彼らはまたけんかを始めた。
They carried water in buckets.	彼らはバケツで水を運んだ。
They bumped against each other.	彼らはお互いぶつかった。
I was moved by their kindness.	彼らの親切に私は感動した。
He is a fine classical scholar.	彼は立派な古典学者です。
He is a famous baseball player.	彼は有名な野球選手です。
He's an excellent brain surgeon.	彼は優秀な脳外科医だ。
He is a man to be reckoned with.	彼は無視できない人だ。
He washes the bike every week.	彼は毎週バイクを洗います。
He will not abandon all hope.	彼は望みを捨てようとしない。
He tried to accumulate wealth.	彼は富を蓄積しようとした。
He was in the depth of misery.	彼は不幸のどん底にあった。
It is probable that he is ill.	彼は病気なのかもしれない。
He is sure to pass the exam.	彼は必ず試験に合格すると思う。
He frowned and turned away.	彼は眉をひそめてそっぽをむいた。
He is prejudiced against her.	彼は彼女に偏見を持っている。
He didn't like to be punished.	彼は罰を受けたくなかった。
He was rightly punished.	彼は罰せられたが、それは当然のことだ。
He formed the clay into a bowl.	彼は粘土で鉢をつくった。
He shaped the statue from clay.	彼は粘土で像を形作った。
He hesitated before answering.	彼は答える前にためらった。
He dashed out like a bullet.	彼は鉄砲玉のように飛び出した。
He put her savings to good use.	彼は貯金を上手に使った。
He likes geography and history.	彼は地理と歴史が好きだ。
He is humble towards everyone.	彼は誰に対しても腰が低い。
He was a man of great ambition.	彼は大変な野心家だった。
He is a Parisian born and bred.	彼は生粋のパリっ子です。
He is earnest for success.	彼は成長しようと夢中になっている。
He is earnest for success.	彼は成功しようと夢中になっている。
He is swimming against the tide.	彼は世の風潮に逆らう。
He bought a new pair of shoes.	彼は新しい靴を一足買った。
He studied on a scholarship.	彼は奨学金をもらって勉強した。
He is my junior by three years.	彼は私より３年後輩です。
He is junior to me by two years.	彼は私より２歳年下だ。
He is less intelligent than me.	彼は私ほど利口ではない。
He shook hands with the mayor.	彼は市長さんと握手をした。
He breeds cattle for market.	彼は市場に出す牛を育てている。
He stared at the steep slope.	彼は険しい斜面をじっと見た。
He is more clever than wise.	彼は賢明というより利口である。
He is anything but a scholar.	彼は決して学者などではない。
He was bursting with fury.	彼は激怒で張り裂けんばかりだった。
He was surrounded by the crowd.	彼は群衆に取り囲まれた。
He is well versed in geometry.	彼は幾何学に精通している。
He attached a label to the bag.	彼は鞄にラベルを貼った。
He is thought of as a scholar.	彼は学者だと思われている。
He made fun of our ignorance.	彼は我々の無知をからかった。
He hardly studies chemistry.	彼は化学はほとんど勉強しない。
He began to study in earnest.	彼はまじめに勉強をし始めた。
He is mad about football.	彼はフットボールに夢中になっている。
He made a dash for the bus.	彼はバスを目指して懸命に走った。
What a nonsense he talks.	彼はなんてばかげた事をいうのだろう。
He is a very thoughtful person.	彼はとても思慮深い人だ。
He finally bent to my wishes.	彼はついに私の要望に従った。
He is something of a scholar.	彼はちょっとした学者である。
He bought it for five dollars.	彼はそれを５ドルで買った。
He was absorbed in the book.	彼はその本に夢中になっていた。
He is hostile to the proposal.	彼はその提案に反対である。
He was puzzled at the question.	彼はその質問に当惑した。
He shot an arrow at the deer.	彼はその鹿めがけて矢を射た。
He was excluded from the club.	彼はクラブから除外された。
He came as lately as yesterday.	彼はきのう来たばかりだ。
He is bound to win the match.	彼はきっと試合に勝つはずだ。
He sent a message by wireless.	彼は、無電で通信を送った。
He is no better than a murderer.	彼は、人殺しも同然だ。
He is blind to her kindness.	彼には彼女の親切がわからない。
He has something to complain of.	彼には何か不安がある。
I accommodated him with money.	彼にお金を用立ててあげた。
He sent me a birthday card.	彼が誕生日カードを送ってくれた。
The criminal confessed to theft.	犯人は窃盗を自供した。
Judgement will be given tomorrow.	判決は明日下される。
I repeat it by way of caution.	念のためもう一度いいます。
I get nervous at immigration.	入国手続きって緊張しちゃう。
Japan consumes a lot of paper.	日本は紙を大量に消費する。
Copper conducts electricity well.	銅はよく電気を通す。
I greet my teacher on the street.	道で先生に挨拶する。
Don't be cruel to animals.	動物に残酷なことをしてはいけない。
How do I report a theft?	盗難届はどのようにすればいいのですか。
I flew on a Tokyo-bound plane.	東京行きの飛行機に乗った。
The island has a mild climate.	島の天候はとても温暖です。
The telephone is a convenience.	電話は便利なものである。
The telephone rang repeatedly.	電話は繰り返し鳴っていた。
Should I cancel the call?	通話の申し込みを取り消しましょうか。
I am tired from a long walk.	長く歩いたので私は疲れている。
Let's enjoy the long vacation.	長い休暇を楽しみましょう。
I am ashamed to see her.	恥ずかしくて彼女に顔を合わせられない。
Who will succeed to the throne?	誰が王位を継ぐのですか。
I wonder who can swim fastest.	誰が一番速く泳げるかしら。
Somebody has broken this dish.	誰かがこの皿を割りました。
Bite down on the cotton roll.	脱脂綿をかんでいてください。
We took refuge behind a big tree.	大木の陰に避難した。
The sun glared down on us.	太陽はギラギラと我々に照りつけた。
It takes two to make a quarrel.	相手のいない喧嘩はない。
May I use the vacuum cleaner?	掃除機を貸してもらえますか。
Put everything in my basket.	全部私のかごの中に入れなさい。
Thanking you in anticipation.	前もってお礼を申し上げます。
The snow melted away in a day.	雪は１日で溶けてしまった。
The baby crept into the room.	赤ちゃんは部屋に這ってきた。
Honestly, I can't trust him.	正直に言って彼は信頼できない。
Cross out the incorrect words.	正しくない語は消しなさい。
Men are subject to temptation.	人間は誘惑にかかりやすい。
My wisdom teeth are coming in.	親知らずがはえかけてきた。
I'm breaking in my new shoes.	新しい靴を履き慣らしている。
I have a cold sore on my lip.	唇にヘルペスができています。
There are abundant food supplies.	食料の供給は十分だ。
The food disagreed with him.	食べ物が体に合わなかったのだ。
The girl made an awkward bow.	少女はぎこちなく頭を下げた。
Flour is sold by the pound.	小麦粉は１ポンド単位で売られる。
Let's go hiking this weekend.	週末にハイキングに行こうよ。
The prisoners are in chains.	囚人たちは鎖につながれている。
Sovereignty resides in the people.	主権は人民にある。
I make so bold as to ask you.	失礼ながらお尋ねいたします。
A dictionary defines words.	辞書は単語を定義するものである。
The dictionary is close at hand.	辞書はすぐそこにある。
Don't be ashamed of yourself.	自分自身を恥じてはいけない。
She maintains her innocence.	自分は無実だと言い張っている。
It's a dull job to clean a bike.	自転車の掃除は退屈だ。
We defeated them in baseball.	私達は野球で彼らを負かした。
We are bound to obey the law.	私達は法律に従う義務がある。
We enjoyed playing football.	私達はフットボールで楽しんだ。
I want to be a baseball player.	私は野球選手になりたい。
I'm really attached to my mother.	私は母が大好きです。
I can't get rid of this cold.	私は風邪を治す事ができない。
I gave my father a silk tie.	私は父に絹のネクタイをあげた。
I caught a beautiful butterfly.	私は美しい蝶を捕まえた。
I prefer comedy to tragedy.	私は悲劇より喜劇の方が好きです。
I thought her very clever.	私は彼女をたいへん利口だと思った。
I will take my revenge on him.	私は彼に報復するつもりだ。
I warned him not to smoke.	私は彼に煙草を吸うなと警告された。
I was concentrating on reading.	私は読書に集中していた。
I've run out of my savings.	私は貯金を使い果たしてしまった。
I prefer history to geography.	私は地理より歴史が好きだ。
I had my son water the lawn.	私は息子に芝生に水を撒かせた。
I had my son water the lawn.	私は息子に芝生に水をまかせた。
I belong to the swimming club.	私は水泳部に入っています。
I will sweep out my room.	私は自分の部屋を掃除するつもりです。
I was ashamed of my behavior.	私は自分のふるまいを恥じた。
I want to build up my vocabulary.	語彙力を増強したい。
I don't dislike him at all.	私は決して彼が嫌いなのではない。
I spent my vacation in Hakone.	私は休暇を箱根で過ごした。
I am interested in swimming.	私は泳ぐことに興味があります。
I was surprised to see a lion.	私はライオンを見て驚いた。
I am familiar with the piano.	私はよくピアノを知っている。
I've got another dollar coming.	私はもう１ドルもらえる。
I belong to the brass band.	私はブラスバンドに入っています。
I have a bat and ball.	私はバット１本とボール１個を持っています。
I poured water into the bucket.	私はバケツに水を入れた。
I can't do without tobacco.	私はタバコなしではすまされない。
I found the track of the tire.	私はタイヤの跡を見つけた。
I am quite opposed to the plan.	私はその計画に大反対だ。
I don't want any sandwiches.	私はサンドイッチが欲しくない。
I'm as tired as tired can be.	私はこの上もなく疲れている。
I feel very lonely these days.	私はこのごろとても寂しい。
I am reluctant to help him.	私はあの人に手を貸す気がしない。
I am not going to betray you.	私はあなたを裏切りませんよ。
I'm a management consultant.	私は、経営コンサルタントです。
I haven't my dictionary at hand.	私の手元に辞書がない。
It was sink or swim with me.	私にとってのるかそるかだった。
We are liable to be lazy.	私たちはとかく怠惰になりがちである。
The thunder scared the children.	子供達は雷におびえた。
Children delight in comic books.	子供達は漫画本を喜ぶ。
Kids really want balloons.	子供達は風船が欲しくてたまらない。
Children are fond of adventure.	子供は冒険が好きである。
I was very tired last night.	昨晩、私は大変疲れていました。
My wife is ignorant of the world.	妻は世間知らずです。
Drive with the utmost care.	最大の注意を払って運転しなさい。
Recently I have had no appetite.	最近食欲がないのです。
Have you seen any movies lately?	最近映画を見ましたか。
Let's toast the guest of honor!	今夜の主賓に乾杯しよう。
Did you feed the dog this morning?	今朝犬に餌やった？
The mayor is not available now.	今は市長には会えません。
I met her on campus yesterday.	構内で昨日彼女に会ったよ。
Happiness consists of good health.	幸福は健康にある。
The door bolts on the inside.	戸は内側でかんぬきがかかる。
Language is peculiar to man.	言語は人間に特有のものである。
The moon is the Earth's satellite.	月は地球の衛星だ。
I found the theater crowded.	劇場に行ってみたら混んでいた。
The police detected the spy.	警察は、そのスパイを見破った。
Seeing a policeman, he ran away.	警官を見て逃げ出した。
Brothers should not quarrel.	兄弟はけんかをしてはいけない。
You should conform to the rules.	君は規則に従うべきだ。
I admire you for your courage.	君の勇気には全く感服する。
May I borrow your dictionary?	君の辞書を借りていいですか。
We'll give you your revenge.	君に雪辱のチャンスを与えよう。
I don't approve your decision.	君たちの決定に賛成しない。
What size shoes do you wear?	靴のサイズはどれくらいですか。
Hunger drove him to steal.	空腹に耐えられず彼は盗みを働いた。
The sun is shining in the sky.	空には太陽が輝いています。
I have butterflies in my stomach.	胸がドキドキするわ。
There is a hut below the bridge.	橋の下流に小屋がある。
A fish swims by moving its tail.	魚は尾を動かして泳ぐ。
The milk froze and became solid.	牛乳は凍って固まった。
How did you enjoy your vacation?	休暇はいかがでしたか。
I wish you a pleasant voyage.	楽しい旅行でありますように。
He is a clever boy, to be sure.	確かに彼は利口な少年だ。
There was a thick fog around.	回りに濃霧が立ちこめていた。
Whenever they meet, they quarrel.	会えば必ず喧嘩する。
We are bound to obey the law.	我々は法律に従う義務がある。
How's your summer vacation going?	夏休みはどうですか。
When is it convenient for you?	何時がご都合がいいですか。
The concert was a great success.	音楽会は大成功でした。
Don't cut in with your remarks.	横から口を差しはさむな。
The satellite is now in orbit.	衛星は今軌道に乗っている。
English is useful in commerce.	英語は商業において役立つ。
It is easy for me to swim.	泳ぐことは私にとっては簡単である。
I should like to go for a swim.	泳ぎに行きたいものです。
The fare is one dollar each way.	運賃は片道１ドルです。
Secret gifts are openly rewarded.	陰徳あれば陽報あり。
In a word, it's ridiculous.	一言で言えばそれはばかげている。
Wine is not harmful in itself.	ワインは本来害にならない。
What's the fare to Liverpool?	リバプールまでいくらですか。
The lion is the king of beasts.	ライオンは百獣の王です。
Barking dogs seldom bite.	よく吠える犬はめったにかみつかない。
If you are tired, go to bed.	もし疲れているなら、寝なさい。
Meg bought a can of tomatoes.	メグはトマトの缶詰を買った。
Let's pretend we are aliens.	みんな宇宙人になったつもりで。
I'd like a hotel reservation.	ホテルの予約をお願いします。
I can easily touch my toes.	ぼくは手が足の指に楽々とどくよ。
I put on an air of interest.	ぼくは興味ありそうな風をした。
My pet cat died yesterday.	ペットのネコが昨日しんじゃったの。
France is adjacent to Spain.	フランスはスペインに隣接する。
Bill is my junior by two years.	ビルは私より２つ年下だ。
The hunter shot at the bird.	ハンターは鳥をねらって撃った。
That concert wasn't rocking.	ノリの悪いコンサートだったね。
The mice ate some of the bread.	ネズミがパンをかじった。
Take steady aim at the tiger.	トラをしっかりねらいなさい。
I'll have tomato and onion.	トマトと玉ねぎをのせてください。
Which airport do I leave from?	どの空港から出発しますか。
What size shoes do you wear?	どのサイズの靴をおはきですか。
Please refrain from smoking.	どうぞタバコを控えてください。
Kindly refrain from smoking.	どうかたばこはご遠慮ください。
Can I use your toilet, please?	トイレをお借りできますか。
But I was always too lazy.	でも、僕は怠けてばかりいたからね。
The dip burned my tongue.	ディップが辛くて、舌がヒリヒリした。
The swallow is a sign of summer.	ツバメは夏の前触れだ。
Swallows are flying in the sky.	つばめが空を飛んでいる。
I got a little revenge on him.	ちょっと仕返ししてやった。
Anybody can make a mistake.	だれでも間違いを犯すことがある。
Somebody is playing the piano.	誰かがピアノを弾いている。
Kindly refrain from smoking.	たばこは、おつつしみください。
I had trouble getting a taxi.	タクシーを拾うのに苦労した。
Can you call a taxi for me?	タクシーを呼んでもらえませんか。
The taxi is waiting outside.	タクシーが外で待っていますよ。
Diamond is essentially hard.	ダイヤモンドは本来堅いものだ。
It is abnormal to eat so much.	そんなに食べるのは異常だ。
Look it up in the dictionary.	それを辞書で調べてみなさい。
That is why he failed the exam.	それで彼は試験に落ちた。
