Duck!	頭を下げろ！
How did you spend your vacation?	休暇をどのように過ごしましたか。
A customs declaration is required.	関税申告書が必要になります。
The stock has gone down overnight.	株式は一晩のうちに下がった。
Shine your shoes before going out.	外へ出る前に靴を磨きなさい。
Swimming in the sea is great fun.	海で泳ぐのはとてもおもしろい。
Mere decay produces richer life.	壊滅そのものが豊かな生命を生む。
The company abandoned that project.	会社はその計画を放棄した。
We should not resort to violence.	我々は暴力に訴えるべきでない。
Our baseball diamond is very small.	我々の野球場は非常に狭い。
Our team came home in triumph.	我がチームは大勝利を収めて帰国した。
The fire broke out toward midnight.	火事は真夜中近くに起きた。
The fire consumed the whole building.	火事で建物は全焼した。
I am determined to be a scientist.	科学者になる決心をしている。
Chemistry gave us plastics.	科学が私たちにプラスチックを与えてくれた。
Our family consists of five members.	家の家族は五人からなる。
You have no need to be ashamed.	何も恥ずかしがる必要はありません。
Don't hesitate to ask for advice.	遠慮しないで助言を求めなさい。
A monkey is climbing up a tall tree.	猿が高い木に登っていく。
England established many colonies.	英国は多くの植民地を設けた。
Learning English requires patience.	英語を学ぶには忍耐が要る。
Could you take me to the cinema?	映画に連れて行ってくれませんか。
Empty the drawer of its contents.	引出しの中身をからにしなさい。
Where's the nearest art gallery?	一番近い画廊はどこにありますか。
A strange sight greeted her eyes.	異様な光景が彼女の目に留った。
The committee was summoned at once.	委員会が直ちに召集された。
I captured butterflies with a net.	わたしはあみで蝶を捕まえた。
Keep a good dictionary at hand.	よい辞書を手元に置いておきなさい。
How about some more roast beef?	もっとローストビーフを召し上がれ。
Excuse me. That fare is not enough.	もしもし、料金不足ですよ。
Let's play baseball with everyone.	みんなと一緒に野球をしよう。
Mayuko dived into the cold water.	マユコは冷たい水に飛び込んだ。
Is the hotel close to the airport?	ホテルは空港に近いのですか。
Football is my favorite game.	フットボールはわたしの好きなゲームだ。
Bill is seldom ever on time.	ビルは時間を違えないことはめったにない。
Bill was able to pass the exam.	ビルは試験に合格することができた。
Bill came to see me last autumn.	ビルは去年の秋に私に会いに来た。
Painters such as Picasso are rare.	ピカソのような画家は珍しい。
Stand the ladder against the wall.	はしごを壁に立てかけなさい。
The cat rubs its face against her.	ネコは彼女に顔をすりつける。
Tolstoy achieved worldwide fame.	トルストイは世界的名声を博した。
Do you charge separately for drinks?	ドリンク料金は別ですか。
Tom is more clever than honest.	トムは誠実というより抜け目がない。
Tom saw a play in the new theater.	トムは新しい劇場で劇を観た。
Tom is more wise than clever.	トムは、頭が良いというより知恵がある。
I hesitated about which road to take.	どの道を行くか迷った。
I'm too tired to walk any longer.	とても疲れたのでもう歩けない。
You may go wherever you like.	どこでも好きなところへ行ってよろしい。
A fierce dog attacked the girl.	どう猛な犬が女の子に飛びかかった。
How can I get rid of him?	どうやったら彼と縁を切ることが出来るだろうか。
Please accept my humble apologies.	どうかひらにご容赦ください。
Germany produced many scientists.	ドイツは多くの科学者を生んだ。
Could we have a table on the terrace?	テラスがいいのですが。
One swallow does not make a summer.	ツバメ一羽で夏にはならぬ。
Swallows migrate to a warm climate.	つばめは温かい土地へ移る。
Anyone can use this dictionary.	だれでもこの辞書を使ってよろしい。
Who will compensate for the loss?	だれがその損害を償うのですか。
Who has torn the envelope open?	だれがこの封筒を破って開けたのか。
Tell whoever comes that I'm out.	だれかきても留守だといってくれ。
There is a heavy tax on tobacco.	タバコにかけられている税は高い。
But my mind is still in chaos.	だけど俺の心はまだカオスの中にいる。
I think you should go by taxi.	タクシーで行くほうがいいと思います。
Traffic downtown is all backed up.	ダウンタウンは交通渋滞だね。
Nothing is as hard as a diamond.	ダイヤモンドほど硬いものはない。
It is nothing less than an invasion.	それはまさに侵略行為だ。
It is not very polite, either.	それはあまり礼儀正しくもありません。
You've got your priorities backwards.	それって本末転倒だろ。
Sit on the sofa and feel at ease.	ソファーでおくつろぎください。
The train departs at 7:15 a.m.	その列車は午前７時１５分に発車する。
Take down the book from the shelf.	その本を棚から下ろしなさい。
That hat cost around fifty dollars.	その帽子は５０ドルでした。
Boil down the report to one page.	その報告を１ページに要約せよ。
The lawyer's fee was very high.	その弁護士の謝礼はとても高かった。
The secretary proved to be a spy.	その秘書はスパイだと判明した。
Does the soil suit vegetables?	その土地は野菜栽培に向いていますか。
The town has an air of prosperity.	その町は繁栄しているようだ。
The sculptures are of great value.	その彫刻は非常に貴重である。
There is little water in the pond.	その池にはほとんど水がない。
I saw the boy in brown shoes.	その男の子は茶色の靴を履いていました。
The product carries a high price tag.	その製品は値段が高い。
Those people appreciate clarity.	その人たちは明瞭さをよしとする。
The girl was gazing at the doll.	その少女は人形をじっと見ていた。
The practice is peculiar to Japan.	その習慣は日本独特のものだ。
The ring has a diamond in it.	その指輪にはダイヤモンドがついている。
Both of the children won a prize.	その子供達２人が賞を獲得した。
He was adapted to the circumstances.	その子供は環境に慣れた。
The murderer is still at large.	その殺人犯はまだ逮捕されていない。
The country advanced in civilization.	その国は文化が進んだ。
The factory produces cotton goods.	その工場は綿製品を生産する。
The park is governed by the city.	その公園は市に管理されている。
Its mechanism will cease to work.	その機能は働かなくなるだろう。
The singer has a beautiful voice.	その歌手は美しい声をしている。
The house is said to be haunted.	その家には幽霊が出るといわれる。
The taxi abruptly turned left.	そのタクシーはいきなり左に曲がった。
The sofa takes up too much room.	そのソファーは場所をとりすぎる。
The remark was aimed at you.	そのことばはあなたに向けて言われたのだ。
You have to have a piece of pie.	ぜひパイをお召し上がりください。
Do you have a bowl for soup?	スープを入れるくぼんだお皿がありますか。
Susan is indifferent to politics.	スーザンは政治に無関心である。
It is rude to stare at strangers.	じろじろ見るのは無作法である。
I'll have rice, miso soup and natto.	ご飯に味噌汁と納豆です。
A thousand thanks for your kindness.	ご親切本当にありがとう。
I'm quite aware of your kindness.	ご親切は十分わかっております。
I shall never forget your kindness.	ご親切は決して忘れません。
May you be blessed with good health.	ご健康に恵まれますよう。
I can't put up with these insults.	こんな侮辱には耐えられない。
Pardon me for being in this dress.	こんな格好でしつれいします。
Do these paintings appeal to you?	これらの絵は気に入りましたか。
We are beginning our descent.	これより次第に高度を下げてまいります。
This is luxury beyond my income.	これは身分不相応な贅沢なものだ。
The cost of the book is 4 dollars.	この本の値段は、４ドルです。
This room gets little sunshine.	この部屋はあまり日光が当たらない。
This shop is a rental video shop.	この店はレンタルビデオ店です。
Do you have any regional dishes?	この地方の名物料理がありますか。
This area is extremely isolated.	この地域はきわめて孤立している。
This expedition will be expensive.	この探検には、お金がかかる。
This river is dangerous to swim in.	この川を泳ぐのは危険です。
Is it safe to swim in this river?	この川で泳ぐのは、安全ですか。
This soap makes a lot bubbles.	この石けんはすばらしく泡だちがいい。
Did you make this doll by yourself?	この人形は独りで作ったの。
Has anybody solved this mystery?	この神秘を解いたものはいますか。
This new singer is really great.	この新人歌手は本当にすばらしい。
These conditions amount to refusal.	この条件では拒絶に等しい。
The novel was adapted for a film.	この小説は映画用に脚色された。
This dictionary is by far the best.	この辞書は群を抜いてよい。
This word is derived from Greek.	この語はギリシャ語から出ている。
It's dangerous to swim in this lake.	この湖で泳ぐのは危険だ。
These shoes are big enough for me.	この靴は私にはちょうどいい。
This pair of shoes is a size larger.	この靴は１サイズ大きい。
This is the most delicious apple.	このリンゴがいちばんおいしい。
This taxi only sits five people.	このタクシーは５人しか乗れない。
Recently we have had many mild days.	このごろ暖かい日が多い。
The coat is lined with fur.	このコートには毛皮の裏地が付けられている。
This toy car runs on batteries.	このおもちゃの自動車は電池で動く。
This engine consumes the most oil.	このエンジンが一番油を食う。
Please refrain from smoking here.	ここでの喫煙はご遠慮ください。
I found that Kate was wealthy.	ケイトは金持ちであることがわかった。
The fox hid in the hollow tree.	キツネは穴があいた木の中へ隠れた。
Please introduce me to a cute girl.	かわいい子紹介してくれよ。
Don't put the saddle on the wrong horse.	お門違いですよ。
You have only to sweep the floor.	お前は床を掃きさえすればよい。
I'm quite out of patience with you.	お前には全く愛想が尽きる。
Spending money is as easy as pie.	お金を使うことはとても簡単だ。
You're barking up the wrong tree.	オレを非難するのはお門違いだ。
How long should we leave it in the oven?	オーブンで何分？
We jammed into the elevator.	エレベーターにぎっしりいっぱいに乗った。
My boss is very cheerful today.	うちの社長は今日とても機嫌がいい。
It's an inflation-adjusted figure.	インフレを考慮した数値です。
You may always use my dictionary.	いつでも私の辞書を使っていい。
Ann has a weakness for chocolate.	アンはチョコレートに目がない。
What do those lights signify?	あの明かりは何を意味しているのですか。
That store employs eight clerks.	あの店は８人の店員を雇っている。
That girl is far from being shy.	あの女の子は内気どころではない。
Those shoes don't go with the suit.	あの靴はその服とあわない。
Look at that boy who is swimming.	あの泳いでいる少年を見なさい。
There was hatred between us then.	あのころ私達は憎み合っていた。
You have to make a reservation.	あなたは予約をしなければならない。
Your record in mathematics is good.	あなたは数学の成績がよい。
You should refrain from smoking.	あなたは喫煙をひかえるべきです。
You can go wherever you want.	あなたはどこでも行きたい所へ行けます。
I will compensate you for your loss.	あなたの損失は償います。
Please show me your stamp album.	あなたの切手帳を見せてください。
Your dog always barks at me.	あなたの犬はいつも私に向かってほえつく。
I'll make you a present of a doll.	あなたに人形をお贈りします。
What's the forecast for tomorrow?	あしたの天気予報はどうですか。
Unfortunately he refused to come.	あいにく彼は来ることを拒んだ。
Can I borrow five pounds from you?	５ポンドお借りできませんか。
The salary will be raised from April.	４月から給料があがる。
I have a reservation for two nights.	２日間予約してあります。
They have announced their engagement.	２人は婚約を発表した。
"How do you feel?" he inquired.	「気分はどうですか」と彼は尋ねた。
He bound the package with a string.	彼はひもで荷物をしばった。
He placed the book on the shelf.	彼はその本を棚の上に置きました。
Do you feel birthdays are important?	誕生日って大事だと思う？
The staff attended to the visitors.	スタッフが見学者の対応をした
He looks inside the shopping basket.	彼が買い物カゴの中身を見る
One book has been already published.	すでに１冊の本が出ています
The mayor's decision is required.	町長の決定を受けなければならない
The computer turns on automatically.	勝手にパソコンの電源が入る
Please read the manual carefully.	ちゃんとマニュアルを読みましょう
He will verify all of the movements.	彼が全ての動作を確認します
The flavor spreads in your mouth.	香りがふわっと口の中に広がります
He will notify the latest information.	彼が最新情報を知らせる
A current flows in the circular coil.	円形コイルに電流が流れる
First, shape the nails with a file.	まず、やすりで爪の形を整える
It's enough just to admire it.	見惚れてしまうほどの満足感が得られます
People at the company lament that 〜.	〜と会社の人が嘆いています
He actively goes all over the world.	彼が元気に世界中を飛び回る
Your body floats in the air for a moment.	一瞬体が宙に浮く
The lion is the king of the beasts.	ライオンは動物の王さまです。
I swung my leg over the fence.	フェンスの向こう側に片足を振り出した。
The belly is not filled with fair words.	話では腹は張らぬ。
Many of the workers died of hunger.	労働者の多くは飢えで死んだ。
The hunting dog headed for the woods.	猟犬が森のほうにいった。
A shooting star dashed through the sky.	流れ星が空を駆けた。
A young child has a small vocabulary.	幼い子供は語いが少ない。
I had a slight headache last night.	夕べ、ちょっと頭痛がしたの。
Some children do not like vegetables.	野菜の嫌いな子供もいる。
Pull one's rank on one's inferiors.	目下に対して上役風を吹かす。
Silence is an admission of guilt.	黙っているのは罪を認めることだ。
Fools rush in where angels fear to tread.	盲ヘビに怖じず。
Where is the missing dollar?	無くなった１ドルはどこへ行ったのでしょう。
Don't put the cart before the horse.	本末を転倒してはいけない。
I frequently correspond with her.	僕はしばしば彼女と文通している。
My behavior put him out of humor.	僕の行為でかれはきげんを損じた。
We were going to play baseball.	僕たちは野球をしようとしていました。
The refugee crossed the line safely.	亡命者は無事国境を越えた。
Spare the rod and spoil the child.	鞭を惜しむと子供は駄目になる。
Quick to adapt to changing circumstances.	変わり身が早い。
Complaining won't change anything.	文句を言っても始まらないだろ。
Prices have been rising steadily.	物価はずっと上がりつづけている。
The balloon was caught in the tree.	風船が木に引っかかっている。
What is the best remedy for colds?	風邪に一番良い薬はなんですか。
The export of weapons was prohibited.	武器の輸出が禁止された。
Cut your coat according to your cloth.	布に応じて衣服を裁て。
My heart ached for the dying birds.	瀕死の鳥たちを哀れに思った。
As long as it doesn't freeze!	氷点下まで冷えさえしなければいいですよ。
I'm too tired to walk any further.	疲れていてこれ以上歩けません。
They usually shear sheep in spring.	彼等は普通春に羊の毛を刈る。
She is quite ignorant of cooking.	彼女は料理のことは全く知らない。
She cabled us that she was coming.	彼女は来ると電報を打ってきた。
She came in with her eyes shining.	彼女は目を輝かせて入って来た。
She dusts the furniture every day.	彼女は毎日家具のほこりを払う。
She practiced the piano every day.	彼女は毎日ピアノの練習をした。
She identified him as the murderer.	彼女は彼を殺人犯だと認めた。
She warned him not to go alone.	彼女は彼に１人で行かぬよう警告した。
She complained about the sentence.	彼女は判決に不満の意を表した。
She was wearing dark brown shoes.	彼女は濃い茶色の靴を履いていた。
She grows tomatoes in her garden.	彼女は庭でトマトを栽培している。
She was all kindness to everybody.	彼女は誰に対しても親切だった。
She is giving the baby a bath.	彼女は赤ん坊を入浴させているところだ。
She made a point of complaining.	彼女は常に不平ばかりを言っていた。
She fell in a heap to the floor.	彼女は床に崩れるようにして倒れた。
She hummed her child to sleep.	彼女は小声で歌って子供を寝かしつけた。
She was living alone in a hut.	彼女は小屋で一人ぼっちで暮らしていた。
She lived up to our expectations.	彼女は私達の期待通りに成長した。
She took advantage of my ignorance.	彼女は私の無知に付け込んだ。
She inspired me with confidence.	彼女は私に自信を吹き込んでくれた。
She was shy in her high school days.	彼女は高校時代内気でした。
She is honest in deeds and in words.	彼女は行動も言葉も誠実だ。
She bolted the doors and windows.	彼女は戸口と窓をさし錠で締めた。
She spends a lot of money on shoes.	彼女は靴にたくさん金を使う。
She was scared to cross the road.	彼女は恐くて道路が渡れなかった。
She quit her job for some reason.	彼女は何かの理由で仕事をやめた。
She can't swim and neither can I.	彼女は泳げないし、私も泳げない。
She is a woman of singular beauty.	彼女はまれにみる美しい女性だ。
She blinked to stop the tears.	彼女はまばたきして涙を止めようとした。
She is good at playing the piano.	彼女はピアノをひくのが上手です。
She has an eye on a good bargain.	彼女はバーゲンには抜け目がない。
She greeted me with a big smile.	彼女はにっこり笑って僕に挨拶した。
What an intelligent woman she is!	彼女はなんて頭がいいのでしょう。
How well she plays the piano!	彼女はなんて上手にピアノを弾くのだろう。
She plays the piano very well.	彼女はたいへんじょうずにピアノをひく。
She was washing the dishes then.	彼女はそのとき皿を洗っていました。
She likes her eggs hard-boiled.	彼女は、卵を固ゆでにするのがすきだ。
Mathematics occupied her mind.	彼女の頭は数学のことでいっぱいだった。
She hopes to become a designer.	彼女の希望はデザイナーになることだ。
Her coat is fur on the inside.	彼女のコートの内側は毛皮になっている。
I struck up an acquaintance with her.	彼女と知り合いになった。
Well may she admire her father.	彼女が父親を尊敬するのはごく当然だ。
They cleared the pavement of snow.	彼らは舗道から雪を取り除いた。
They are thought of as competent.	彼らは能力があると思われている。
They abandoned the sinking ship.	彼らは沈みゆく船を見捨てて逃げた。
They ate sandwiches for lunch.	彼らは昼食にサンドイッチを食べました。
They were constantly quarreling.	彼らは絶えずけんかばかりしていた。
They splashed water over me.	彼らは水をはねかして、私を水だらけにした。
They are contending for the prize.	彼らは賞を目指して争っている。
They run like pigs from a gun.	彼らは銃でねらわれ豚のように逃げ回る。
They were destined never to meet.	彼らは決してあえない運命だった。
Every time they meet, they quarrel.	彼らは会えば必ずけんかする。
They armed themselves with rifles.	彼らはライフルで武装していた。
They are in need of volunteers.	彼らはボランティアを必要としている。
They eat with a knife and fork.	彼らはナイフとフォークで食事をする。
They exposed the books to the sun.	彼らはその書物を日光に当てた。
They are keen on outdoor sports.	彼らはアウトドアスポーツに熱心だ。
I am quite ignorant of their plan.	彼らの計画は僕は全く知らない。
Their patience was about to give out.	彼らの我慢も限界だった。
They scarcely need it at all.	彼らにそれをほとんど少しも必要としない。
He didn't look like a clever boy.	彼は利口な子供には見えなかった。
He departed in spite of the storm.	彼は嵐にもかかわらず出発した。
He got down the book from the shelf.	彼は本棚から本を降ろした。
He was summoned to appear in court.	彼は法廷へ出頭を命じられた。
He is bound to solve this question.	彼は必ずこの問題を解決する。
He invited her to go to the concert.	彼は彼女を音楽会へ誘った。
He bought her some chocolates.	彼は彼女にチョコレートを買ってやった。
He bothered her with questions.	彼は彼女にうるさく質問して困らせた。
He persisted in marrying her.	彼は彼女と結婚すると言ってきかなかった。
He is nothing but a minor composer.	彼は二流の作曲家にすぎない。
He advanced on me fiercely.	彼は怒り狂ったように私のほうへ向かってきた。
He believes in the supernatural.	彼は超自然的なものが有ると信じる。
He made bold to speak to the King.	彼は大胆にも王様に話し掛けた。
He's active doing charity work.	彼は積極的に人々に善行を施している。
He is superior to me in mathematics.	彼は数学で私に優っている。
He got a good grade in mathematics.	彼は数学でよい成績をとった。
He is ahead of us in mathematics.	彼は数学では私達より進んでいる。
He has a good name for reliability.	彼は信頼できるという評判だ。
He was confronted with the evidence.	彼は証拠を突きつけられた。
He is likely to win the scholarship.	彼は奨学金を得られそうだ。
He departed from the old custom.	彼は従来の習慣と違ったことをした。
He refrained from drinking too much.	彼は酒の飲みすぎを控えた。
He raised tomato plants from seed.	彼は種からトマトの苗を育てた。
He was leaning against the rail.	彼は手すりに寄りかかっていました。
He affirmed himself to be innocent.	彼は自分は無実だと主張した。
He affirmed himself to be innocent.	彼は自分が無実だと主張した。
He thought that he was a genius.	彼は自分が天才であると思っていた。
I expected him to fail the exam.	彼は試験に落ちると思っていました。
He is not my son, but my nephew.	彼は私の息子ではなく、おいである。
He told me to be here at noon.	彼は私に正午にここへ来るように言った。
He has done me many kindnesses.	彼は私にいろいろと親切にしてくれた。
He gave me no less than ten dollars.	彼は私に１０ドルもくれた。
He arrived here safely yesterday.	彼は昨日無事にここに着きました。
At first, he sounded very sincere.	彼は最初とても誠実そうだった。
He laid by 100 dollars this month.	彼は今月１００ドルを貯金した。
He was educated at a public school.	彼は公立学校で教育を受けた。
He was raised in an artistic family.	彼は芸術的な家庭に育った。
He ran at the sight of the policeman.	彼は警察を見ると走った。
He is absorbed in scientific work.	彼は科学の仕事に熱中している。
He suggested that we go for a swim.	彼は泳ぎに行こうと提案した。
He boasts that he can swim well.	彼は泳ぎがうまいのを自慢している。
He likes to take a solitary walk.	彼は一人で散歩をするのが好きだ。
He would often swim in this river.	彼はよくこの川で泳いだものだ。
What an impressive person he is!	彼はなんと印象的な人なのでしょう。
