He lives in Tokyo.	彼は東京で暮らしている。
He started from Tokyo to Paris.	彼は東京からパリへ出発した。
He lives in Nagasaki.	彼は長崎に住んでいる。
He wrote a book on China.	彼は中国について本を書いた。
He had come back from China.	彼は中国から帰ってきた。
He has just bought a used car.	彼は中古車を買ったばかりです。
He should have bought a used car.	彼は中古車を買うべきだったのに。
If he had known about it, he would have come.	彼は知っていたら来ただろう。
Who do you think he is?	彼は誰だと思う？
He called out for help.	彼は大声で助けを求めた。
He may be a good man for all I know.	彼は多分よい男であるかも知れない。
He is in great want.	彼は生活に困っている。
He lived to be ninety.	彼は生きて９０歳になった。
He started from Narita for Paris.	彼は成田からパリに向けて出発した。
He is known to the public.	彼は世間に顔を知られている。
He is a man of the world.	彼は世慣れた人だ。
He is the greatest man in the world.	彼は世界中で一番偉大な人です。
He bought a new car.	彼は新車を買った。
He wants a new car.	彼は新しい車を欲しがっている。
He has bought a new car.	彼は新しい車を買った。
He is working on the new plan.	彼は新しい計画に取り組んでいる。
He lived in Matsue for seven years.	彼は松江に７年間住んでいた。
He has at least one thousand books.	彼は少なくとも１、０００冊の本をもっている。
He has no less than five English books.	彼は少なくても５冊の英語の本を持っている。
He came up to Tokyo on business.	彼は商用で上京した。
He called for help.	彼は助けを呼んだ。
He called for help.	彼は助けを求めた。
He called for help.	彼は助けてくれと叫んだ。
He was about to start.	彼は出発しようとしていた。
He will come nine cases out of ten.	彼は十中八九来るだろう。
He has a car.	彼は車を持っている。
Was he in the car or by the car?	彼は車の中にいましたか、それとも車のそばにいましたか。
He started from Tokyo for Osaka by car.	彼は車で東京を出発し大阪へ向かった。
He came by car.	彼は車で来た。
He thinks he is an Edison.	彼は自分をエジソンのような発明家だと思っている。
He wrote to me from time to time.	彼は時々手紙を書いた。
He called me by name.	彼は私を名指しでよんだ。
He came here to help me.	彼は私を手伝いに来てくれた。
He called me out.	彼は私を呼びだした。
He calls me Pete.	彼は私をピートと呼ぶ。
He lives next to me.	彼は私の隣に住んでいる。
He called my name.	彼は私の名前を呼んだ。
He is the last man I want to see.	彼は私の一番会いたくない人だ。
He came up with me.	彼は私に追いついた。
He didn't give me time to think.	彼は私に考える時間を与えてくれなかった。
He came to see me.	彼は私に会いにきた。
He showed me the way to the store.	彼は私にその店への道を教えてくれた。
He gave me this book.	彼は私にこの本をくれた。
He knows us very well.	彼は私たちをとてもよく知っている。
He was as good a man as I had thought.	彼は私が思っていた通り良い人だった。
He's the last man that I want to see.	彼は私が最も会いたくない人物だ。
He is the last man I want to see.	彼は私が一番会いたくない人だ。
He was given a book by me.	彼は私から本をもらいました。
He is the very man that I'm looking for.	彼は私がさがしているまさにその人である。
He will come back at four.	彼は四時にもどるでしょう。
He is at work now, but will be coming home at seven.	彼は仕事中ですが、７時には帰宅します。
He writes books.	彼は作家です。
He did not know what to do to the end.	彼は最後まで何をしてよいかわからなかった。
He has just come back.	彼は今戻ったところです。
He is reading a book.	彼は今本を読んでいるところです。
He is reading a book.	彼は今本を読んでいます。
He's writing a book now.	彼は今本を書いています。
He is living in Tokyo.	彼は今東京に住んでいる。
He's now on the phone.	彼は今電話中です。
He is not available.	彼は今電話に出られません。
He is at work now, but will come back at seven.	彼は今仕事に行っていますが、７時には戻ってきます。
He will come afterwards.	彼は後で来ます。
He is to come here at five.	彼は五時にここへくるはずである。
He was sent for and had to go.	彼は呼ばれていて行かなければならなかった。
In the end, he did not come.	彼は結局姿を現さなかった。
You can make book on it that he won't help you.	彼は金輪際君を助けてくれないだろう。
He lives in Kyoto.	彼は京都に住んでいる。
He can't write any kanji.	彼は漢字が全く書けない。
He set up for learning.	彼は学者ぶっている。
He is a learned man.	彼は学識ある人だ。
He is doing very well at school.	彼は学校で立派にやっている。
Where did he go?	彼は何処に行ったのですか。
What do you think he is?	彼は何をしている人だと思いますか。
He is playing music.	彼は音楽を演奏しています。
He can read and write English as well.	彼は英語を読めるし、そのうえ書けもする。
He read a book written in English.	彼は英語で書かれた本を読みました。
He set out to read the book through in a day.	彼は一日で読み切るつもりでその本を読み始めた。
He wanted to come with us.	彼は一緒に来たがった。
He lived here for a time.	彼は一時ここに住んでいた。
He used to come here on Mondays.	彼は以前はいつも月曜日にここへ来ていた。
He is not the man that he used to be.	彼は以前のような人物ではない。
He used to live here.	彼は以前ここに住んでいた。
He has started for London.	彼はロンドンへ向かって出発した。
He lived in the center of London.	彼はロンドンの中心部に住んでいた。
He is a man who will do what he wants.	彼はやりたいことを通す人だ。
He came all the way from Kyushu to see the Mona Lisa.	彼はモナリザを見るためにはるばる九州から来た。
He was about to start.	彼はまさに出かけるところだった。
He came back by way of Honolulu.	彼はホノルル経由で帰ってきた。
He lives in Boston.	彼はボストン市に住んでいる。
He came here by way of Boston.	彼はボストンを経由してここにやって来た。
He has come from Boston.	彼はボストンからやってきた。
He came here all the way from London.	彼ははるばるロンドンから当地へやってきた。
He came to see me all the way from Pakistan.	彼ははるばるパキスタンから私に会いに来た。
He came all the way from Chicago.	彼ははるばるシカゴからやってきた。
He played the part of Hamlet.	彼はハムレットの役を演じた。
How well he played!	彼はなんとうまくプレーしたことでしょう。
What line is he in?	彼はどんな職業に就いていますか。
How did he work out the plan?	彼はどのようにしてその問題を解決したのですか。
He did not know where to go.	彼はどこへ行ったらいいか分からなかった。
Where did he go?	彼はどこへ行った。
Where was he going?	彼はどこへ行くところでしたか。
Where do you think he lives?	彼はどこに住んでいると思いますか。
How did he come here?	彼はどうやってここへ来たのですか。
How did he come?	彼はどうやってきましたか。
He didn't come back in the end.	彼はとうとう戻ってこなかった。
He did come at last.	彼はとうとう本当にやってきた。
He came home just now.	彼はついさっき帰宅した。
He has just come home.	彼はちょうど今帰宅したところだ。
He came home just now. Didn't you know that?	彼はちょうど今、帰ってきたところだ。知らなかったの？
He came home just now.	彼はちょうど今、帰ってきたところだ。
He has just come back.	彼はちょうど帰ったところです。
He has just come back from Paris.	彼はちょうどパリから帰ってきたところだ。
He may be a good man for all I know.	彼はたぶん良い男であるかもしれない。
He has come home just now.	彼はたった今到着した。
He came home just now.	彼はたった今帰宅したところです。
I think he can't do that.	彼はそれができないと思う。
He wanted to buy the book.	彼はその本を買いたかった。
He read the book through.	彼はその本を通読した。
He was to have started that day.	彼はその日出発する予定だったのだが出発しなかった。
He is at university.	彼はその大学に在学している。
He was reading a book at that time.	彼はその時本を読んでいた。
He backed us up in the case.	彼はその事件で私たちを支援してくれた。
He need not give up the plan.	彼はその計画をあきらめる必要はない。
He didn't give up the plan.	彼はその計画をあきらめなかった。
He is pleased with the plan.	彼はその計画が気に入っている。
He got over the end.	彼はその苦境を克服した。
He is playing there.	彼はそこで遊んでいます。
He is a captious man.	彼はすぐ人の揚げ足を取る。
He came to London by way of Siberia.	彼はシベリア経由でロンドンにやってきた。
He took a line from Shakespeare.	彼はシェークスピアから一行引用した。
He didn't know Shakespeare wrote Romeo and Juliet.	彼はシェイクスピアが「ロミオとジュリエット」を書いたことを知らなかった。
He knows well how to use a computer.	彼はコンピューターの使い方をよく知っている。
He can come.	彼なら来られる。
He came back last August.	彼はこの前の８月に戻ってきた。
He is the best for this project.	彼はこの計画に最適である。
He is playing here.	彼はここで遊んでいます。
He has been living here these ten years.	彼はここ１０年間ずっとここに住んでいます。
He came back from Canada.	彼はカナダから帰ってきた。
He thinks he is an Edison.	彼はエジソンのような発明家だと思っている。
When did he come back from Osaka?	彼はいつ大阪から戻ったのですか。
When did he come over to see you?	彼はいつ会いに来たの。
When did he come here?	彼はいつここに来ましたか。
He will come to see us some day.	彼はいつか私たちに会いにくるでしょう。
He wants to be an Edison some day.	彼はいつかエジソンのような人になりたいと思っている。
He comes from England.	彼はイギリス出身である。
He won't be a good player.	彼はいい選手にならないだろう。
He came back from America.	彼はアメリカから帰ってきた。
He wants to go to Africa.	彼はアフリカに行きたがっている。
He is playing over there.	彼はあそこで遊んでいます。
He should have done it that way.	彼はああやれば良かったのに。
He came back to Japan for the first time in eight years.	彼は８年ぶりに日本に帰った。
Will he come home by seven?	彼は７時までに帰ってくるでしょうか。
Will he come home at six?	彼は６時に帰宅するでしょうか。
He has no less than five hundred books.	彼は５００冊もの本を持っている。
He has lived in Kobe for three years.	彼は３年間神戸に住んでいます。
Has he lived here for two years?	彼は２年間ここに住んでいるのですか。
He has been living in Kobe for two days.	彼は２日間神戸に住んでいます。
He has written two books.	彼は２冊の本を著している。
He was called up in August, 1942.	彼は１９４２年８月に召集された。
He came home at ten.	彼は１０時に帰宅した。
He started just now.	彼は、たった今出発した。
That's the way he is.	彼の性分だからしかたない。
What he writes comes to this.	彼の書いていることはこういう意味だ。
He is learned in Russian.	彼にはロシア語が通じる。
He has no less than three hundred books.	彼には３００冊もの蔵書がある。
He is my type!	彼って私のタイプ！
He is the very man I want.	彼こそ私が必要としている人物だ。
He is the very man that we've been looking for.	彼こそ我々が探し求めていた人だ。
He may be the very man that I need.	彼こそが私に必要な人なのかもしれない。
He is the very man that we've been looking for.	彼こそがわれわれが捜し求めていた人だ。
We will start when he comes.	彼が来たら出発します。
The day came at last when he had to part from her.	彼が彼女と別れなければならない日がついにやってきた。
I had been reading a book when he came in.	彼が入って来た時私は本を読んでいた。
I had been reading a book for some time when he called.	彼が電話したとき、私はしばらくの間本を読んでいた。
Who do you think he is?	彼は誰だと思いますか。
He was the first to come.	彼が最初に来た。
You should read such a good book as he is reading now.	彼が今読んでいるような本を読むべきだ。
I can't make out what he wants.	彼が何を欲しているのか分からない。
What do you think he did?	彼が何をしたと思いますか。
There is no way of knowing where he's gone.	彼がどこへ行ってしまったか知る由もない。
I don't know where he comes from.	彼がどこの出身なのか私は知りません。
I don't know where he lives.	彼がどこに住んでいるか知らない。
He designed the car.	彼がその車を設計した。
He can't have read this book.	彼がこの本を読んだはずがない。
I will go out if he comes here.	彼がここに来るなら、外出します。
I want to know if he'll come here.	彼がここに来るかどうか知りたい。
I will go when he comes back.	彼が戻ってきたら行きます。
I don't know when he will come.	彼がいつ来るか分かりません。
Do you know when he will come?	彼がいつ来るかご存知ですか。
I don't know when he'll come back.	彼がいつ戻ってくるかわかりません。
It will be reported when he is coming to Japan.	彼がいつ日本に来るか報道されるだろう。
I don't know when he'll come back.	彼がいつ帰ってくるのか私にはわからない。
It is not known when he came up to London.	彼がいつロンドンに出て来たかは知られていない。
I don't know when he'll come here.	彼がいつここに来るか知りません。
Is he the owner of that car?	彼があの車の持ち主ですか。
He will call for me about six.	彼が６時ごろ迎えにくるだろう。
I will call you when I have done my shopping.	買い物を済ませてしまったら電話します。
I will call you when I have done my shopping.	買い物をすませてしまったら電話をします。
Would you like to come shopping with me?	買い物に一緒に来てくれる？
Might I come in?	入っても良いでしょうか。
May I come in?	入ってもよろしいですか。
You may not come in.	入ってはいけません。
I'll come and see you at 3:00 p.m. on Sunday.	日曜日の３時にうかがいます。
I'll call on you on Sunday.	日曜日にお伺いします。
Look at the car made in Japan.	日本製の車を見て下さい。
What do you think of Japanese?	日本語をどう思いますか。
What do you think of Japan?	日本をどう思いますか。
I'd like to make a call to Japan.	日本へ国際電話をかけたいのですが。
That is not the case in Japan.	日本はそうではない。
What do you think of Japan?	日本についてどう思いますか。
Cars made in Japan are used all over the world.	日本で造られた車は世界中で使われている。
In Japan a new school year starts in April.	日本では新学期は４月に始まる。
In Japan, school starts in April.	日本では学校は４月から始まる。
Where did you go to in Japan?	日本ではどこへ行きましたか。
That isn't the case in Japan.	日本ではそうではない。
In Japan, school starts in April.	日本では、授業は４月に始まる。
I come from Japan.	日本から来ました。
Two men came up to me.	二人の男が私に近づいてきた。
I like reading books.	読書が好きです。
Take any books that you want to read.	読みたい本は何でも持って行きなさい。
Make way, please.	道を空けてください。
I'll show you the way.	道を教えます。
Will you please show me the way?	道を教えてくださいませんか。
Only one way to live.	道はただひとつ。
She can't have been in her twenties at that time.	当時、彼女が２０代であったはずがない。
Art was then at its best.	当時、芸術は全盛でした。
How would you like to live in Tokyo?	東京に住んでみたらどうでしょう。
I live in Tokyo.	東京に住んでいます。
Having lived in Tokyo, I know the city well.	東京に住んでいた事があるので、私は東京の街をよく知っている。
Do you live in Tokyo?	東京にお住まいですか。
I saw a kabuki play in Tokyo.	東京で歌舞伎を見た。
Have you got used to living in Tokyo?	東京での生活に慣れましたか。
Do you have any plans for Saturday?	土曜日に何か計画がありますか。
Look in the phone book.	電話帳をみて。
May I use the phone?	電話を拝借できますか。
May I use your phone?	電話を貸してもらえませんか。
I have to make a phone call.	電話を掛けなければなりません。
He had just come home when I called.	電話をしたとき、ちょうど帰宅したところでした。
You need not have called me.	電話をくれる必要はなかったのに。
I'll make a phone call.	電話をかけよう。
I want to make a phone call, but I don't have any change now.	電話をかけたいのですが、いまこまかいお金がありません。
I want to make a phone call.	電話をかけたい。
Might I use your phone?	電話をお借りできますか。
Might I use your phone?	電話をお借りしてもよいでしょうか。
Are you through with the phone?	電話もうおすみですか。
The phones aren't working.	電話は不通なの。
Phone me the news.	電話でそのニュースを知らせてね。
You are wanted on the phone.	電話です。
The phone is out of order.	電話が故障しています。
The call has come through.	電話がつながったよ。
You are wanted on the phone.	電話がかかってるよ。
Ms. Tanaka can type, can't she?	田中さんはタイプが打てるんでしょう。
Mr Tanaka, you are wanted on the phone.	田中さん、電話ですよ。
Naoko came back to Japan.	直子さんは日本に戻ってきた。
Live and learn.	長生きして学べ。
It wants looking into.	調べてもらう必要がある。
It's just what I wanted.	丁度欲しかった物です。
I think it's by the Chuo Line.	中央線ですね。
Mr Ikeda wants to buy a new car.	池田さんは新しい車を買いたがっています。
A map helps us to know where we are.	地図は私たちが今どこにいるのか知るのに役立ちます。
If only I had a map, I could show you the way.	地図さえあれば、君に道を教えてあげられるのに。
It is up to us to be men.	男になるのは自分次第だ。
No one is coming.	誰も乗ってこないだろう。
No one thinks so.	誰もそう思わない。
We could all see it coming, couldn't we?	誰もが予想できたことじゃない？
Who made you come here?	誰が君をここにこさせたのか。
Who do you think will come first?	誰が一番先に来ると思いますか。
Do you know who took the call?	誰がその電話に出たか知っていますか。
Who bought a book at the shop?	誰がその店で本を買いましたか。
Who do you think goes there?	誰がそこに行くと思いますか。
Who thinks so?	誰がそう思うのか。
Who wrote this book?	誰がこの本を書いたのか。
Two of my books have been taken.	誰かが私の本を２冊持っていってしまった。
I will look the other way.	大目に見ておいてやろう。
It was a great help!	大変助かりました。
He lives in Osaka.	大阪に住んでいます。
No other man could do my work.	他人には私の仕事はできないでしょうに。
No other man could do my work.	他人には私のやっている仕事はできないだろう。
Where are all the others?	他の人はどこにいるのですか。
No other man could do my work.	他の人には私のやっている仕事はできないだろうに。
No other way.	他に道はない。
All in all, I thought it was a good book.	全体的に見てそれはよい本だと思った。
All of us got into the car.	全員その車に乗った。
She came to see me the other day.	先日、彼女が遊びにきた。
The other day, I got a call from her.	先日、彼女から電話があった。
We'll go to Hong Kong first, and then we'll go to Singapore.	先ず香港に行ってそれからシンガポールに行きます。
No way.	絶対無理だね。
I'll call you back.	折り返し電話する。
Do you think we are better off than we used to be?	昔より暮らし向きは裕福になったと思いますか。
That's including taxes.	税込みですよ。
Live and learn.	生きていれば学べる。
That's what I thought.	正にそれが私の考えです。
Where there's a will, there's a way.	成せば成る。
He is a good man as the world goes.	世間並みに言えば、彼は善良な人です。
When did the world come into being?	世界はいつ誕生したのだろうか。
When will the world come to an end?	世界はいつ終わるのだろうか。
Just like you want it to.	世の中を動かしてみたいんだ。
Man has been writing for about 6000 years.	人間は６、０００年もの間、書く能力を持ち続けている。
We'd better send for help.	人をやって助けを求めたほうがいい。
For he knew what was in a man.	人について誰の証言も必要とされなかったからである。
I'm going to buy a new car.	新車を買うつもりだ。
The new plan worked well.	新企画は図にあたった。
I am working on my new book.	新しい本に取り組んでいる。
Do you think it will work?	上手くいくと思いますか。
Come at least at six.	少なくとも６時にいらっしゃい。
Can I play some music?	少し音楽をかけていいかい？
With a little planning, I think we can take our company to the top.	少しプランをねれば我が社はトップになれると思いますよ。
Have it your way.	勝手にしたら、どうぞお好きなように。
Please send for help.	助けを呼びにやってください。
Is there any help available?	助けてもらえますか。
Are you going to learn English?	諸君は英語を学ぶところですか。
When did you first come over to Japan?	初めて日本に来たのはいつか。
I'm all set to start.	出発の準備はできあがっています。
Where are you from?	出身はどちらですか。
Where is the way out?	出口はどちらですか。
I was about to go out when he came to see me.	出かけようとしている所へ彼が訪ねてきた。
I was about to go out when he called on me.	出かけようとしたとき彼が訪ねてきた。
Don't you want to go out?	出かけないか。
All is well that ends well.	終わり良ければ全て良し。
All's well that ends well.	終わりよければすべてよし。
School starts at 8:40.	授業は８時４０分から始まる。
Do you think I should write?	手紙を書いた方がいいと思いますか。
Please contact me by mail.	手紙で連絡ください。
They are in the way.	邪魔になっています。
It is in the way.	邪魔なのです。
You get in my way?	邪魔するのか。
I can't get the car to start.	車のエンジンがなかなかかからない。
Don't you have a phone in your car?	車に電話はないのかしら？
Look out for the car.	車に注意しなさい。
Get into the car.	車に乗って。
Do you want a car?	車がほしいですか。
There's a car coming.	車がきてるぞ。
We can go there with the help of a car.	車があればそこへ行ける。
If you have a car, you can come and go at will.	車があれば、自由に行ったり来たりできるよ。
You are free to use this car.	自由にこの車を使ってください。
Who do you think you are, to look at me like this?	自分を何様だと思っているのだ、人をそんな風に見て。
Show your own business.	自分の事をしろ。
Do your own work.	自分の仕事をしなさい。
Did you come here of your own free will?	自分の意志でここに来たの？
Do your own work.	自分ですればいいだろ。
Who do you think you are?	自分が何さまだと思ってるんだ？
Come on, Jiro.	次郎ここに来なさい。
Where would you like to go next?	次はどこへ行きたいですか。
Shall I come next Sunday?	次の日曜日に参りましょうか。
