I think 2000 is good.	２０００でいい気がします
I sent the e-mail.	私がメールをしました
X is thought to be good.	Xがいいなと考えた
What were you looking at then?	君はあの時何を見ていたの
There is no end.	きりが無い
He uses two computers.	彼は２台のパソコンを使っています
X do/does not come into the view at all.	Xが視界に全く入りません
I'll give 5 cases.	５つの事例を紹介する
I will show you the article of the day.	以下に当日の記事を紹介します
So, what should I write?	さて何を書きましょう
I wrote it.	私が書いた
He played the music with me/them.	彼が一緒に音を出す
I live in the city.	私は都市で日々の生活を送っている
It was first time for me to take the Hachiko line.	私は八高線には初めて乗った
He will mail order it.	彼はそれを通販で買う
Mr./Ms. Yamada bought a car for the first time.	山田んが初めて車を買った
The e-mail was sent to me.	メールが私のところに来ました
Power off the computer.	一度パソコンの電源を切ります
Each one has a name.	それぞれにちゃんと名前がついてました
Who started X?	Xを誰が始めたのか
My thinking did a 180.	１８０度自分の考え方が変わりました
He will buy it by mail order.	彼がそれを通販で購入する
All of them changed my way of thinking.	それらすべてが私の物の見方を変えました
He searched for the image information.	彼が画像の情報を検索しました
The time has come.	いよいよ時間がやってきた
He is calling on Mr. Yamada in Kyoto.	彼が京都の山田先生の門を叩く
He provides mail-order information.	彼が通販の情報を発信します
The DVD will go on sale.	ＤＶＤが発売される
Users download the file from the site.	ユーザーがサイトからそのファイルをダウンロードする
I wanted X.	Xが欲しかった
I wanted X.	Xを私が希望した
We live in the world with time. 	わたし達が時間の世界に生きる
He books the hotel.	彼がホテルを予約する
I can't help but think so.	そう思わずにはいられない
Its name comes from X.	それはXにその名が由来する
The owner lives in the city.	所有者が市内に居住する
"What are you thinking about?" "Nothin'..."	「何を考えてるの？」「別に・・・」
The car wouldn't start.	その車は動こうとしなかった。
I'm Japanese, but I don't live in Japan.	私は日本人ですが、日本に住んでいません。
I'd like to help, but I think I'd just get in your way.	手伝いたいけど、多分足手まといになるよね。
I don't live in Maigo now.	現在は舞子に住んでいません。
Well, shall we call it a day?	そろそろお開きにしよかー。
She plays Bach.	彼女はバッハ弾きです。
I want an MP3 player!	ＭＰ３プレーヤーがほしい！
I read about how to make tempura in a book.	天ぷらの作りかたを本で読みました。
I-Is that OK? Calling you by your first name...	だ、ダメかな？下の名前で呼んじゃ。
I've ordered a book from Amazon.com.	アマゾン・ドット・コムで本を注文しました。
Add "Men" and the goods take off.	「おとこ」と付けると商品はブレイクする。
I think I have tendonitis.	腱鞘炎ではないかと思うのです。
When you contact me, please do so by phone.	連絡するなら電話でお願いします。
You are doing very well.	良くやっているよ。
I will come and see you when I get well.	良くなったら伺います。
I'm thinking of going to Canada next year.	来年はカナダに行こうかと思ってます。
He will have lived in Paris for ten years next year.	来年で彼は１０年パリに住んでいることになる。
I think he won't come.	彼は来ないと思います。
I thought you wouldn't come.	来ないかと思ったよ。
Come and help us.	来て手伝って下さい。
I just want you to come.	来て下さるだけでいいのです。
Please come.	来て下さい。
You may come with us if you want to.	来たいのなら私達と一緒にきても良いです。
I can't find what I want.	欲しいものが見つからないんだ。
All I want is you.	欲しいのは君だけなんだ。
Where can Yoko have gone?	洋子は一体どこへ行ってしまったのだろう。
Come and see me.	遊びに来なさい。
Can I go out and play?	遊びに行ってもいい？
Come and see me.	遊びにこいよ。
Yuka types better than Alice.	由香はアリスよりじょうずにタイプを打ちます。
When will Yuko come to Denver?	優子さんはいつデンバーに来るのかなあ。
Hideyo Noguchi was a great man.	野口英世は偉大な人だった。
What you see is what you want.	目に付くものが欲しいものだ。
A Mr Kimura is calling you.	木村さんという人からあなたにお電話です。
When you have written your name, write the date.	名前を書き終わったら日付も書いておきなさい。
When you have written your name, please write the date.	名前が書き終わったら日付も書いておきなさい。
I know it very well.	万万承知の上です。
Do you know how to play mahjong?	麻雀のやり方を知ってる？
I do think so.	本当にそう思います。
Did you take back the books?	本を返却しましたか。
I am reading a book.	本を読んでいるんです。
I'd like a book.	本を下さい。
Can I take books out?	本は持ち出しできますか。
The price of books is getting higher these days.	本の値段が最近上がってきている。
I bought this book the other day.	僕は先日この本を買った。
I've come here to help you.	僕は手伝うためにきた。
I have two cars.	僕は車を２台持っている。
I call your name.	僕は君の名を呼ぶ。
Oh, I didn't like the ending.	僕はエンディングが気に入らなかったな。
Look at my new car.	僕の新車を見ろよ。
You may use my car at any time.	僕の車いつでも使っていいよ。
My car's in the shop.	僕のは今修理中なんだよ。
She is all in all to me.	僕にとって彼女は最も重要な人だ。
I wrote this book.	僕がこの本を書いたんだ。
Have you sent in your report?	報告書を提出しましたか。
I have got into Hyogo University.	兵庫大学に入りました。
I go to Hyogo University.	兵庫大学に通っています。
Want to know?	聞きたいわ？
Send her in, and I will see her now.	彼女を通しなさい、すぐ会うから。
I'll have her come here.	彼女をここに来させよう。
I called her Cathy.	彼女をキャシーと呼んだ。
She and hers are all very well.	彼女も彼女の家族もみなとてもげんきだ。
She was about to start.	彼女まさに出発しようとしていた。
She is used to traveling.	彼女は旅行することに慣れています。
She likes traveling best of all.	彼女は旅行がとりわけ好きである。
She is going to be six next year.	彼女は来年六歳になる。
Will she go to America next year?	彼女は来年アメリカに行くのでしょうか。
She will be seventeen next year.	彼女は来年１７歳になる。
I think that she will come.	彼女は来ると思う。
I think she will come.	彼女は来るだろうと思っている。
Will she come?	彼女は来るだろうか。
She didn't show up.	彼女は来なかった。
I don't think that she will come.	彼女は来ないと思う。
She may not come.	彼女は来ないかもしれない。
She didn't give me her name.	彼女は名前を教えてくれなかった。
She changed her name to Ann.	彼女は名前をアンに変えた。
She did come here.	彼女は本当にここへ来たんだ。
She likes to read books.	彼女は本を読むのが好きだ。
She calls me Kenji.	彼女は僕を健二と呼ぶ。
She's good to me you know.	彼女は僕にやさしい。
She is from Hokkaido, but is now living in Tokyo.	彼女は北海道出身だが、今は東京に住んでいる。
She came here all the way from Hokkaido.	彼女は北海道からはるばるここへ来た。
She uses her looks.	彼女は美貌を売りにしています。
She wanted to help them.	彼女は彼らを助けたかった。
She may have gone out to do some shopping.	彼女は買い物をしに外出したかもしれない。
She is all for going shopping.	彼女は買い物に行くことに大賛成だ。
She has gone shopping.	彼女は買い物に行ってしまいました。
She is a temp.	彼女は派遣社員です。
She is getting on.	彼女は年をとってきている。
She is getting better day by day.	彼女は日ごとに快方に向かっています。
She has two thousand books.	彼女は二千冊本を持っている。
She called me up from Tokyo.	彼女は東京から電話をしてきた。
She will do her best to be here on time.	彼女は定刻にここへ来るように全力を尽くすでしょう。
She didn't like living in the city.	彼女は町に住んでいるのが好きではありませんでした。
She likes no one and no one likes her.	彼女は誰も好かないし、また誰も彼女を好かない。
Who do you think she lives with?	彼女は誰といっしょに暮らしているとおもいますか。
Who is she?	彼女は誰ですか。
She called for help.	彼女は大声で助けを求めた。
She likes Hiroshima better than any other city.	彼女は他のどの都市よりも広島が好きだ。
She is looked up to.	彼女は尊敬されている。
She looked better than last time.	彼女は前より元気そうだった。
She is not what she used to be.	彼女は昔の彼女ではない。
She was off in her Sunday best.	彼女は晴れ着を着て出かけた。
She makes up in public.	彼女は人前で化粧する。
She is good-natured.	彼女は人がいい。
She gave me a look at her new car.	彼女は新車を見せてくれた。
She is getting up a new play.	彼女は新しい芝居を企画中だ。
She knows how to use her good looks to get what she wants out of men.	彼女は色仕掛けで男を誘惑する。
She looks at least sixty.	彼女は少なくとも６０歳には見える。
She is not less than thirty.	彼女は少なくとも３０歳だ。
She is in need of help.	彼女は助けを必要とする。
She comes to school in her car.	彼女は車で学校に来る。
She got out of the car.	彼女は車から降りた。
She took her book.	彼女は自分の本を手に取った。
She knows me.	彼女は私を知っている。
I think she'll help me.	彼女は私を助けてくれると思う。
She looked at me.	彼女は私を見た。
She took me for Mr Tamori.	彼女は私をタモリさんとまちがえた。
She's my type.	彼女は私のタイプだ。
She wanted me to come.	彼女は私に来てもらいたがっていた。
She came here to see me.	彼女は私に会うためにここにきた。
She came all the way from New York to see me.	彼女は私に会いにはるばるニューヨークからやってきた。
She came to see me.	彼女は私に会いにきた。
She is all in all to me.	彼女は私にとってもっとも大切な人だ。
She wants me to go with her.	彼女は私にいっしょにきてほしいと思っている。
She might know that we are here.	彼女は私たちがここにいることをしらないかもしれない。
She's at work, isn't she?	彼女は仕事に行っていますね。
She came last.	彼女は最後にきた。
She is well off now.	彼女は今裕福である。
Is she going to go to America this year?	彼女は今年アメリカに行くつもりですか。
She will be in Paris by now.	彼女は今頃もうパリに着いているだろう。
She is out now.	彼女は今外出中です。
She's not at home now.	彼女は今家にいません。
She may not be at home now.	彼女は今家にいないかもしれない。
She knows what to do now.	彼女は今何をすべきかよく知っている。
She is living in London.	彼女は今ロンドンに住んでいる。
She is in her hotel now.	彼女は今ホテルにいる。
She is seeing a Kabuki play now.	彼女は今、歌舞伎を観ているところだ。
She is a high-liver.	彼女は高望みするタイプです。
She has gone out.	彼女は行ってしまった。
She's looking the other way.	彼女は向こうを向いている。
She will be back at five.	彼女は五時に戻ってきます。
She was out of Japan last year.	彼女は去年日本を離れていた。
She could not find her way back.	彼女は帰り道がわからなかった。
Can she come in time?	彼女は間に合うでしょうか。
She looked back on her school days.	彼女は学生時代を思い出した。
She was on her way to school.	彼女は学校へ行く途中だった。
She goes to school.	彼女は学校に通っています。
She called out to us for help.	彼女は我々に大声で助けを求めた。
I do not think that she is at home.	彼女は家にいると思いません。
Is she at home?	彼女は家にいますか。
She is not home, but at school.	彼女は家にいなくて学校に行っています。
She has hundreds of books.	彼女は何百冊という本を持っている。
What is she about?	彼女は何をやっているのだ？
What do you think she is going to do?	彼女は何をしようとしているのだと思いますか。
She will have her own way.	彼女は何でも自分の思うとおりにしようよする。
She lives in Yokohama.	彼女は横浜に住んでいる。
She was at home in English.	彼女は英語に堪能であった。
She is at home in English.	彼女は英語が得意です。
She has known better days.	彼女は羽振りのよいときもあった。
She likes to be on her own.	彼女は一人っきりで居るのが好きです。
She did well by me.	彼女はわたしにとてもよくしてくれた。
She is living in London.	彼女はロンドンに住んでいる。
She came with good news.	彼女はよい知らせを持ってきた。
She was about to go out.	彼女はまさに外出しようとしていた。
She is Betty.	彼女はベティです。
She may be French.	彼女はフランス人かもしれない。
She has gone to Paris.	彼女はパリに行っていて、ここにはいない。
She has been to Paris.	彼女はパリに行ったことがある。
What is she like?	彼女はどんな人ですか。
What is she like?	彼女はどのような人ですか。
She was a great help to me.	彼女はとても私の助けになった。
She so wants to go.	彼女はとても行きたがっている。
Where has she gone?	彼女はどこへ行ってしまったの？
Where has she gone?	彼女はどこへ行っちゃったの。
Where has she gone?	彼女はどこに行ったの？
Where did she buy a book?	彼女はどこで本を買いましたか。
She calls on me from time to time.	彼女はときどき私を訪ねてくる。
She will have her own way.	彼女はどうしても自分の思い通りにしようとする。
She is just going shopping.	彼女はちょうど買い物に出かけるところです。
She has got there just in time.	彼女はちょうど間に合ってそこに着いた。
Who do you think she is?	彼女はだれだと思いますか。
She came home just now.	彼女はたった今帰ったところです。
She set out for Thailand.	彼女はタイ国に旅立った。
She types well.	彼女はタイプがうまい。
She set out for Thailand.	彼女はタイに旅立った。
She is going on 35.	彼女はそろそろ３５歳だ。
She did it in her own way.	彼女はそれを彼女独特の方法でやった。
She took it off.	彼女はそれを脱いだ。
She can't have known about it.	彼女はそれについて知っていたはずがいない。
She likes it least of all.	彼女はそれがもっともきらいだ。
She did not read the book.	彼女はその本を読まなかった。
She ordered the book from England.	彼女はその本をイギリスに注文した。
What did she buy at the shop?	彼女はその店で何を買いましたか。
She need not have done the work.	彼女はその仕事をする必要はなかったのに。
She did not go there.	彼女はそこへ行かなかった。
She lived there about five years.	彼女はそこに約５年間住んだ。
She lived there for years.	彼女はそこに何年間も住んでいた。
She will be here in no time.	彼女はすぐに来るでしょう。
She sent this book to me.	彼女はこの本を私に送った。
She needs our help.	彼女はこちらから助けてやる必要がある。
She gave me a book for Christmas.	彼女はクリスマスプレゼントに本をくれた。
She comes from California.	彼女はカリフォルニアの出身です。
She came from Canada to see me.	彼女はカナダから私に会いに来た。
She used to work for our company.	彼女はかつて私達の会社で働いていた。
She goes by the name of Amy.	彼女はエイミーの名で通っている。
She has gone to Italy.	彼女はイタリアへ行ってしまった。
She makes a good living.	彼女はいい暮らしをしている。
She thought of a good plan.	彼女はいい計画を思いついた。
She is American, but she lives in England.	彼女はアメリカ人だが、イギリスに住んでいる。
She has gone to America.	彼女はアメリカに行ってしまった。
She is not very well off.	彼女はあまり暮らし向きがよくない。
She is making use of you.	彼女はあなたを利用しているのです。
She works from nine.	彼女は９時から働く。
She lived to be ninety.	彼女は９０歳まで生きた。
She got home at seven.	彼女は７時に家に着いた。
I should think she is over sixty.	彼女は６０歳を過ぎていると思いますが。
She came home for the first time in five years.	彼女は５年ぶりに帰国した。
Will she come home at five?	彼女は５時に帰ってくるでしょうか。
She could read when she was four.	彼女は４歳の時に読むことができた。
She is thirty-one.	彼女は３１歳だ。
She can't be over thirty.	彼女は３０歳を超えているはずはない。
She came up to Tokyo at eighteen.	彼女は１８歳のときに上京した。
She's going to Ooita.	彼女は大分に行く予定です。
She will be there by now.	彼女は、今ごろは、そちらに着いているでしょう。
She ordered the book from London.	彼女は、その本をロンドンに注文した。
Her name was Agnes then.	彼女の名前は当時アグネスだった。
I bought her a new car.	彼女に新車を買ってやった。
She has seen better days.	彼女にも全盛時代があった。
She has two uncles; one lives in Kyoto and the other in Osaka.	彼女にはおじが二人いる。一人は京都に、もう一人は大阪に住んでいる。
Where did you see her?	彼女にどこで会ったのか。
She and I get on well.	彼女と私は仲がよい。
She is first in line.	彼女が列の先頭です。
She didn't need to come.	彼女が来る必要はなかった。
I will go provided that she comes.	彼女が来るのなら私も行きます。
I have no information she is coming.	彼女が来るという知らせは受けてない。
I don't know if she will come.	彼女が来るかどうかわからない。
I'll have her call you when she gets back.	彼女が戻ったら君に電話をかけさせるよ。
I don't know if she wants to go with me.	彼女が私といっしょに行きたがっているかどうか私は知りません。
I will be gone by the time she comes back.	彼女が帰ってくるまでには、私はここを去ります。
She took part in our project.	彼女が我々の計画に参加した。
I found out where she was.	彼女が何処にいるかが解った。
I want to get the book back from her.	彼女からその本をとりもどしたい。
I don't know if she will go there with me.	彼女が僕といっしょにそこへ行くかどうかわからない。
Do you know where she lives?	彼女がどこに住んでいるか知っていますか。
Do you know where she is?	彼女がどこにいるのか知っていますか。
Do you know where she is?	彼女がどこにいるか知っていますか。
I know where she is.	彼女がどこにいるか私は知っている。
Do you know who she is?	彼女がだれか知っていますか。
She bought a book at the shop.	彼女がその店で本を買った。
She reported the news.	彼女がそのニュースを報じた。
Can you make it so she can get on that TV program?	彼女がそのテレビ番組に出られるようにしていただけませんか。
She came out of there.	彼女がそこからが出てきた。
Do you know when she will come?	彼女がいつ来るか知っていますか。
Who do you think she is?	彼女、誰だと思う？
Who do you think he is?	彼を誰と思いますか。
Are they coming as well?	彼らもやってくるのですか。
They have very little to live on.	彼らは暮らしに余裕がない。
Did they live here?	彼らは当地に住んでいたのか。
They are willing to learn English.	彼らは進んで英語を学ぶ気がある。
They started a new business.	彼らは新規事業を始めた。
They got through the marsh.	彼らは沼地を通り抜けた。
They start for Europe on business.	彼らは商用でヨーロッパに出発する。
They are about to start.	彼らは出発しようとしている。
They got out of the car.	彼らは車からおりた。
They call me Bob.	彼らは私をボブと呼びます。
They looked at each other.	彼らは互いに顔を見合わせた。
They can come on Monday or Tuesday, but not on Wednesday or Thursday.	彼らは月曜日か火曜日に来てもよいが、水曜日と木曜日はだめだ。
They are on their way home.	彼らは帰宅の途中だ。
They were all great men.	彼らは皆偉大な人たちです。
Do they learn English?	彼らは英語を学びますか。
They have lived in London for ten years.	彼らはロンドンに住んで１０年になります。
They call Robert "Bob".	彼らはロバートをボブと呼ぶ。
Each of them has to write a report about what he saw.	彼らはめいめい、自分の見たもののついてレポートを書かねばならない。
They all have come.	彼らはみんな来た。
They are living it up in Honolulu.	彼らはホノルルで楽しんでいるよ。
They came all the way from Brazil.	彼らははるばるブラジルからやってきた。
Now some Pharisees who had been sent.	彼らはパリサイ人の中から遣わされたのであった。
They couldn't think where to go.	彼らはどこへ行ったらよいかわからなかった。
Where did they come from?	彼らはどこから来たの。
They came home from school just now.	彼らはちょうど今学校から帰ってきた。
They didn't come here, did they?	彼らはここへ来ませんでしたね。
They looked at each other.	彼らはお互いをながめた。
They helped each other.	彼らはお互いに助け合いました。
They looked at each other.	彼らはおたがいに顔を見あわせた。
They wanted change now.	彼らは、「今すぐに」変化が起こることを望んだ。
I do not think their plan will work out.	彼らの計画はうまくいかないと思う。
They were through with work.	彼らが作業を終えた。
What man has done, man can do.	彼も人なり我も人なり。
He is of a good line.	彼は良家の出である。
He comes back from Singapore next January.	彼は来年の１月にシンガポールから戻ってきます。
He can come.	彼は来る事が出来る。
I thought he wouldn't come.	彼は来るまいとわたしは思った。
I think he'll come.	彼は来ると思う。
We think that he will come.	彼は来るだろうと思う。
He will come.	彼は来るだろう。
He may come, or he may not.	彼は来るかもしれないし、来ないかもしれない。
I don't think that he will come.	彼は来ないと思う。
He won't come, will he?	彼は来ないのでしょう？
He is at play.	彼は遊びの最中です。
He will come back.	彼は戻ってくる。
He is reading a book.	彼は本を読んでいる。
Is he reading a book?	彼は本を読んでいますか。
He likes to read books.	彼は本を読むのが好きだ。
He has a book.	彼は本を持っている。
He came all the way from Nikko to see me off.	彼は僕を見送りにはるばる日光から来てくれた。
He called me Ichiro.	彼は僕を一郎と呼んだ。
He wrote the report.	彼は報告書を作文した。
He is not very good company.	彼は付き合っていて面白くない。
He is very learned.	彼は非常に学がある。
He gave her a book.	彼は彼女に本をあげました。
He wants to go out with her.	彼は彼女とデートしたいと思っている。
He came to like her.	彼は彼女が好きになった。
He could not live out the year.	彼は年を越すことができなかった。
He used to come to see me on Sunday.	彼は日曜日には遊びに来るのが常であった。
He has a Japanese car.	彼は日本製の車を持っています。
He is thinking it over.	彼は二の足を踏んでいる。
He wants a book to read.	彼は読むための本がほしい。
He can read and write.	彼は読み書きができる。
He lives in Tokyo.	彼は東京に住んでいます。
He likes to live in Tokyo.	彼は東京に住むのが好きです。
