No way.	絶対無理だね。
I want to think about it.	考えさせて下さい。
Where do you come from?	御出身はどちらですか。
You can use this car.	君はこの車を使ってもいい。
You have done very well.	君はうまくやったよ。
When will you come home?	何時に帰ってくるの。
What do you want me to do?	何か御用ですか。
Mayuko called me back.	マユコは私を呼び戻した。
Tony lives in Kobe.	トニー君は神戸に住んでいます。
Where do you come from?	どちらのご出身ですか？
Where are you going?	どことどこへ行く予定ですか。
Please get into the car.	どうぞお乗り下さい。
Come over and help out.	ちょっと来て手伝って。
You can type, can't you?	タイプは打てますね。
That is the other way about.	それは逆だ。
What did you do then?	それから君はどうしたのか。
That is just her way.	それがまさに彼女の癖です。
That day shall come.	その日はやってくるであろう。
The new car is hers.	その新しい車は彼女の物です。
I can not but think so.	そう考えざるを得ない。
John called me names.	ジョンは私に悪態をついた。
I'll call on you, John.	ジョン、君にあてよう。
I want to go to Seattle.	シアトルに行きたい。
Do come if you can!	ご都合がつけばぜひ来て下さい。
This is what I want.	これこそ私の欲しいものです。
You can read this book.	この本を読んでもいい。
Is this book Takeo's?	この本は健夫のものですか。
This play has ended.	この公演はもう終わりました。
Ken came up to me.	ケンが、私のところにやってきた。
Do you know each other?	お知り合いなんですか？
When do you want to go?	いつ行きたいのですか。
Don't go into that area.	あの地域には入るな。
You came home at 5:00.	あなたは５時に帰宅した。
I'll give you a book.	あなたに本をあげましょう。
Call her up at three.	３時に彼女に電話しなさい。
I live in the city.	私は都市で日々の生活を送っている
Its name comes from X.	それはXにその名が由来する
She is in need of help.	彼女は助けを必要とする。
She is in her hotel now.	彼女は今ホテルにいる。
She lived to be ninety.	彼女は９０歳まで生きた。
She came out of there.	彼女がそこからが出てきた。
He likes to read books.	彼は本を読むのが好きだ。
He is thinking it over.	彼は二の足を踏んでいる。
He called out for help.	彼は大声で助けを求めた。
He lived to be ninety.	彼は生きて９０歳になった。
He has bought a new car.	彼は新しい車を買った。
He was about to start.	彼は出発しようとしていた。
What line is he in?	彼はどんな職業に就いていますか。
He did come at last.	彼はとうとう本当にやってきた。
When did he come here?	彼はいつここに来ましたか。
May I use your phone?	電話を貸してもらえませんか。
Might I use your phone?	電話をお借りできますか。
It's just what I wanted.	丁度欲しかった物です。
Can I play some music?	少し音楽をかけていいかい？
Have it your way.	勝手にしたら、どうぞお好きなように。
Please send for help.	助けを呼びにやってください。
I'm thinking about you.	私は君の事を考えている。
I want to read the book.	私はその本が読みたい。
I know it very well.	私はそのことをよく知っている。
I have a computer.	私はコンピューターを持っています。
I was in Canada then.	私は、その時、カナダにいた。
Have you seen my new car?	私の新しい車、見た？
We gave up the plan.	私たちはその計画をあきらめた。
All I have is books.	私が持っているのは本だけです。
The plan has worked well.	計画はうまくいった。
You'd better start now.	君は今でかけた方がよい。
Where is your school?	君の学校はどこにありますか。
You are wanted on the phone.	君に電話です。
You have three cars.	貴方は、三台車を持っています。
Come with me, will you?	一緒に来てくれませんか。
I wanted to go there.	わたしはそこへ行きたかった。
Oh, come off it.	まぁ、そんなに格好つけるのやめとけよ。
Which way should I go?	どちらへ行けばよいですか。
Where would I find CDs?	どこでＣＤが買えますか。
Please come this way.	どうぞこちらへおいで下さい。
How come you are here?	どうして君がここにいるの？
Who wrote this book?	だれがこの本を書いたのですか。
Who made this plan?	だれがこの計画を立てたのですか。
It's about time to start.	そろそろ出発時間だ。
It is all I want to do.	それだけがわたしの望み。
Did you order the book?	その本を注文しましたか。
You may take the book.	その本を持っていってよい。
Please give me this book.	この本を私に下さい。
This book is very new.	この本はとても新しいです。
This car is out of date.	この車は時代遅れです。
You shall have my car.	お前には私の車をあげよう。
When are you coming back?	いつ戻ってきますか。
That book is a new book.	あの本は新しい本です。
You have two books.	あなたは二冊の本を持っています。
What do you want to be?	あなたは何になりたいの？
Do you need the book?	あなたはその本が必要ですか。
I want to go with you.	あなたと一緒に行きたいな。
I will come with you.	あなたといっしょに参ります。
What do you want?	あなたがたは何を求めているのですか。
Oh! I know the man.	あぁ、私はその男を知っています。
I'll have her come here.	彼女をここに来させよう。
I think that she will come.	彼女は来ると思う。
She's good to me you know.	彼女は僕にやさしい。
She set out for Thailand.	彼女はタイに旅立った。
I bought her a new car.	彼女に新車を買ってやった。
She reported the news.	彼女がそのニュースを報じた。
Where did they come from?	彼らはどこから来たの。
He's writing a book now.	彼は今本を書いています。
He read the book through.	彼はその本を通読した。
Two men came up to me.	二人の男が私に近づいてきた。
I want to make a phone call.	電話をかけたい。
The call has come through.	電話がつながったよ。
The new plan worked well.	新企画は図にあたった。
Come at least at six.	少なくとも６時にいらっしゃい。
School starts at 8:40.	授業は８時４０分から始まる。
Please contact me by mail.	手紙で連絡ください。
Please come next Friday.	次の金曜に来てください。
I am reading a book now.	私は今本を読んでいます。
I want to learn French.	私はフランス語を学びたい。
I use the computer.	私はそのコンピューターを使います。
I want to read this book.	私はこの本が読みたい。
I come from Australia.	私はオーストラリア出身です。
I want to live in Italy.	私はイタリアに住みたい。
I want to go to America.	私はアメリカへ行きたい。
I have no home to live in.	私には住む家がない。
Get that book for me.	私にその本を取ってきて下さい。
Won't you come with me?	私といっしょに来ませんか。
I am through with my work.	仕事は終わりました。
You needn't have come.	君は来なくてもよかったのに。
You are to come with me.	君は僕と一緒に来るのだ。
You have some books.	君はいくつかの本をもっています。
Where do you go to school?	学校はどちらですか。
School starts in April.	学校が始まるのは４月です。
May I go out to play?	外に遊びに行ってもいいですか。
Who do you think you are?	何様だと思ってるんだ。
I'm living in the city.	俺は今、都会に住んでいる。
Show me the way, will you?	案内してくれますか。
I'm through with you.	もうお前なんか相手にしないぞ。
Play the part of Hamlet.	ハムレットの役を演じろ。
Which book is yours?	どちらの本があなたのものですか。
Which way will you take?	どちらの道を行きますか。
Where would I find books?	どこで本が買えますか。
Where did you come from?	どこから来られましたか。
I was about to start.	ちょうど出発しようとしていた。
Where did you get this?	それを何処で手に入れたの。
That is what I want to know.	それが知りたい。
The computer is new.	そのコンピューターは新しいです。
John started the car.	ジョンは車のエンジンをかけた。
Is John available now?	ジョンとお話したいのですが。
This is a new type of car.	これが新型の車です。
This is what I thought.	これが私の考えたことです。
This article is for sale.	この品物は売り物です。
This car is made in Japan.	この車は日本製です。
Kim is living with Ken.	キムはケンと同居している。
Give that book back to me.	あの本を返してくれ。
Can I call you Bob?	あなたをボブと呼んでもいいですか。
What do you want to do?	あなたは何をしたいですか。
I'm all for your plan.	あなたの計画には大賛成です。
I will go if you come.	あなたが来れば私は行きます。
We're all booked up at 6:00.	６時は満席です。
Power off the computer.	一度パソコンの電源を切ります
The car wouldn't start.	その車は動こうとしなかった。
I go to Hyogo University.	兵庫大学に通っています。
I think she will come.	彼女は来るだろうと思っている。
She likes to read books.	彼女は本を読むのが好きだ。
She wanted to help them.	彼女は彼らを助けたかった。
She is at home in English.	彼女は英語が得意です。
She did well by me.	彼女はわたしにとてもよくしてくれた。
She has been to Paris.	彼女はパリに行ったことがある。
Who do you think she is?	彼女はだれだと思いますか。
She set out for Thailand.	彼女はタイ国に旅立った。
She didn't need to come.	彼女が来る必要はなかった。
I know where she is.	彼女がどこにいるか私は知っている。
Do you know who she is?	彼女がだれか知っていますか。
Are they coming as well?	彼らもやってくるのですか。
They are on their way home.	彼らは帰宅の途中だ。
They were all great men.	彼らは皆偉大な人たちです。
They call Robert "Bob".	彼らはロバートをボブと呼ぶ。
He has a Japanese car.	彼は日本製の車を持っています。
He wants a book to read.	彼は読むための本がほしい。
He is reading a book.	彼は今本を読んでいるところです。
He can't write any kanji.	彼は漢字が全く書けない。
He wanted to come with us.	彼は一緒に来たがった。
He has just come back.	彼はちょうど帰ったところです。
He has come home just now.	彼はたった今到着した。
He is learned in Russian.	彼にはロシア語が通じる。
Art was then at its best.	当時、芸術は全盛でした。
The phone is out of order.	電話が故障しています。
I think it's by the Chuo Line.	中央線ですね。
It is up to us to be men.	男になるのは自分次第だ。
Who made you come here?	誰が君をここにこさせたのか。
All of us got into the car.	全員その車に乗った。
I'm going to buy a new car.	新車を買うつもりだ。
I'm all set to start.	出発の準備はできあがっています。
We live in New York.	私達はニューヨークに住んでいます。
I'll be reading a book.	私は本を読んでいるでしょう。
I will have my own way.	私は自分のやり方を通します。
I should read the book.	私はその本を読むべきだった。
Where do you live now?	現在はどちらにお住まいですか。
You are not coming, are you?	君は来ないんだね。
What are you thinking about?	何を考えているの？
I'm through with Mary.	メアリーとはもう終わったんだ。
I'll give it some thought.	ま、考えときましょう。
How do you want them?	どのように両替いたしましょうか。
Where did you get it?	どこでそれを手に入れたのですか。
Do come in, please.	どうか、ぜひお入りになってください。
They live there.	だって２人ともそこに住んでいるんですもの。
The plan will work out.	その計画はうまくいくだろう。
I've been thinking about it.	ずっと考えてたの。
Come on! I will best you.	さあこい！負かしてやる。
These books are my books.	これらの本は私の本です。
This is a very new book.	これはとても新しい本です。
Please buy me this book.	この本を私に買って下さい。
May I have this book?	この本をいただいてもいいですか。
This car is as good as new.	この車は新品同様だ。
How did you come here?	ここへどうやって来たのですか。
Uh.....yes, I think so.	ええっと、そうだと思います。
That book is of no use.	あの本は何の役にも立たない。
Where do you come from?	あなたは何処から来ましたか。
Where do you come from?	あなたはどちらの出身ですか。
Please come in three days.	３日後に来てください。
We think that he will come.	彼は来ると思います。
He uses two computers.	彼は２台のパソコンを使っています
Each one has a name.	それぞれにちゃんと名前がついてました
I can't help but think so.	そう思わずにはいられない
I thought you wouldn't come.	来ないかと思ったよ。
I just want you to come.	来て下さるだけでいいのです。
Did you take back the books?	本を返却しましたか。
I've come here to help you.	僕は手伝うためにきた。
I think she'll help me.	彼女は私を助けてくれると思う。
She will be back at five.	彼女は五時に戻ってきます。
She is living in London.	彼女はロンドンに住んでいる。
She sent this book to me.	彼女はこの本を私に送った。
She needs our help.	彼女はこちらから助けてやる必要がある。
She has gone to Italy.	彼女はイタリアへ行ってしまった。
She makes a good living.	彼女はいい暮らしをしている。
She has seen better days.	彼女にも全盛時代があった。
They are about to start.	彼らは出発しようとしている。
They looked at each other.	彼らはお互いをながめた。
They helped each other.	彼らはお互いに助け合いました。
They were through with work.	彼らが作業を終えた。
We think that he will come.	彼は来るだろうと思う。
He came here to help me.	彼は私を手伝いに来てくれた。
He lived here for a time.	彼は一時ここに住んでいた。
He was about to start.	彼はまさに出かけるところだった。
He has come from Boston.	彼はボストンからやってきた。
How did he come here?	彼はどうやってここへ来たのですか。
He has just come home.	彼はちょうど今帰宅したところだ。
He came home just now.	彼はたった今帰宅したところです。
I think he can't do that.	彼はそれができないと思う。
He came back from Canada.	彼はカナダから帰ってきた。
He is playing over there.	彼はあそこで遊んでいます。
He has written two books.	彼は２冊の本を著している。
What do you think he did?	彼が何をしたと思いますか。
I'll call on you on Sunday.	日曜日にお伺いします。
What do you think of Japan?	日本をどう思いますか。
You are wanted on the phone.	電話がかかってるよ。
I will look the other way.	大目に見ておいてやろう。
Do you think it will work?	上手くいくと思いますか。
Is there any help available?	助けてもらえますか。
Is there any mail for me?	私宛に手紙が来ていますか。
You can call me Bob.	私をボブと呼んでくださって結構です。
I know her very well.	私は彼女をとても良く知っています。
I thought he would come.	私は彼が来るだろうと思った。
I came to Japan last year.	私は去年日本に来ました。
My plan is to buy a car.	私の計画は車を買うことです。
I have no time to read books.	本を読む暇がない。
We called Robert "Bob".	私たちはロバートをボブと呼ぶ。
Is there any mail for me?	私あてに手紙は来てますか。
You'll come to like her.	君は彼女が好きになるだろう。
Can you find your way home?	帰り道は分かりますか。
What time shall I come?	何時にお伺いいたしましょうか。
Learn a little at a time.	一度に少しずつ学びなさい。
I'd better be on my way.	もう帰らなくてはなりません。
Mary is such a worrywart.	メアリーは本当に心配症ね。
Bob came here, didn't he?	ボブはここに来たんですね。
How did it come about?	どのようにしてそれは起こったの。
Where is Tony playing?	トニー君はどこで遊んでいますか。
How did he come here?	どうやって彼はここに来たのですか。
How did you come here?	どうやってここへ来られましたか。
Will you send it by mail?	それを郵送してくれますか。
How did it come about?	それはどうして起こったのですか。
The new product is on sale.	その新製品は発売中だ。
Steve did not come home.	スティーブは帰宅しなかった。
What line of work are you in?	ご商売は何ですか。
Will I make it through?	こんな自分から抜け出せるのか。
This is what I wanted.	これは私が欲しいと思った物です。
I would like this book.	この本がいただきたいのですが。
This used car is for sale.	この中古車は売り物です。
Come here and help me.	ここへ来てそして私を手伝ってよ。
You needn't have come.	あなたは来る必要はなかったのに。
Who do you think he is?	あなたは彼が誰だと思いますか。
Where were you going?	あなたはどこに行くところでしたか。
You may read this book.	あなたはこの本を読んでもいい。
May I use your phone?	あなたの電話を使ってもいいですか。
I'll call for you at six.	６時にお迎えに上がります。
3 to the third power is 27.	３の３乗は２７である。
My thinking did a 180.	１８０度自分の考え方が変わりました
The owner lives in the city.	所有者が市内に居住する
She was about to start.	彼女まさに出発しようとしていた。
She has gone shopping.	彼女は買い物に行ってしまいました。
She wanted me to come.	彼女は私に来てもらいたがっていた。
She's at work, isn't she?	彼女は仕事に行っていますね。
She is living in London.	彼女は今ロンドンに住んでいる。
She came with good news.	彼女はよい知らせを持ってきた。
She came home just now.	彼女はたった今帰ったところです。
They got through the marsh.	彼らは沼地を通り抜けた。
He wrote a book on China.	彼は中国について本を書いた。
He knows us very well.	彼は私たちをとてもよく知っている。
He will come back at four.	彼は四時にもどるでしょう。
How well he played!	彼はなんとうまくプレーしたことでしょう。
He wanted to buy the book.	彼はその本を買いたかった。
We will start when he comes.	彼が来たら出発します。
I saw a kabuki play in Tokyo.	東京で歌舞伎を見た。
Naoko came back to Japan.	直子さんは日本に戻ってきた。
Where are all the others?	他の人はどこにいるのですか。
Just like you want it to.	世の中を動かしてみたいんだ。
All is well that ends well.	終わり良ければ全て良し。
All's well that ends well.	終わりよければすべてよし。
Shall I come next Sunday?	次の日曜日に参りましょうか。
I've worked out a good plan.	私は名案を考えついた。
I go to Tokyo University.	私は東京大学に行っています。
I came to Japan from China.	私は中国から日本にきた。
I was on my way to school.	私は学校へ行く途中でした。
I'll send the book by mail.	私はその本を郵送します。
I have no time to read books.	本を読む時間がない。
Please show me this book.	私にこの本を見せてください。
We used to live in Kobe.	私たちは以前神戸に住んでいた。
We will make it public.	私たちはそれを公にしようと思う。
Are you through with your work?	仕事は終わった?
She will be there by now.	今頃彼女はそこにいるだろう。
In the end, he did not come.	結局、彼は来なかった。
You may use my new car.	君は私の新しい車を使ってもよい。
What is it that you want?	君が欲しいのはいったい何だ。
School starts next Monday.	学校は今度の月曜に始まる。
We learn to read and write.	我々は読み書きをならう。
What do you think you're doing?	何を考えてんだ？
It's about time to start.	もうそろそろ出発の時間です。
Tom came home just now.	トムはたった今帰宅したところだ。
How did you come here?	どのようにしてここに来たのですか。
Where would you like to go?	どちらへ行きたいですか。
At last, he got the car.	ついに彼はその車を手にいれた。
I think it's the best way.	それは最高の方法だと思う。
How did it come about?	それはどのようにして起こったのか。
That is the way of the world.	それが世の習いです。
I think it's the best way.	それが最善の方法だと思う。
I'm thinking of the plan.	私はその計画を考えています。
Are these books Kenji's?	これらの本は健二のものですか。
Is this your book, Mike?	これ、あなたの本なの、マイク？
May I use your phone?	お電話をお借りしてもよろしいですか。
What time did you come home?	いつ帰宅したのですか。
When did you come to Paris?	いつパリに来たのですか。
Come on any day you like.	いつでも好きな日に来なさい。
Do you have two books?	あなたは二冊の本を持っていますか。
Do you live in the city?	あなたは都市に住んでいますか。
Do you live in Sasayama?	あなたは篠山に住んでいますか。
You're so set in your ways!	あなたって本当に頑固ね。
Where is your school?	あなたがたの学校はどこにありますか。
She lives in New York.	彼女はニューヨークで暮らしている。
The e-mail was sent to me.	メールが私のところに来ました
I don't live in Maigo now.	現在は舞子に住んでいません。
I can't find what I want.	欲しいものが見つからないんだ。
She is all in all to me.	僕にとって彼女は最も重要な人だ。
She came here to see me.	彼女は私に会うためにここにきた。
She was at home in English.	彼女は英語に堪能であった。
Where did she buy a book?	彼女はどこで本を買いましたか。
She did not read the book.	彼女はその本を読まなかった。
She has gone to America.	彼女はアメリカに行ってしまった。
Her name was Agnes then.	彼女の名前は当時アグネスだった。
I found out where she was.	彼女が何処にいるかが解った。
They started a new business.	彼らは新規事業を始めた。
They looked at each other.	彼らは互いに顔を見合わせた。
He likes to live in Tokyo.	彼は東京に住むのが好きです。
He had come back from China.	彼は中国から帰ってきた。
He is known to the public.	彼は世間に顔を知られている。
He was given a book by me.	彼は私から本をもらいました。
He came home just now.	彼はちょうど今、帰ってきたところだ。
He came back last August.	彼はこの前の８月に戻ってきた。
He came back from America.	彼はアメリカから帰ってきた。
Will he come home at six?	彼は６時に帰宅するでしょうか。
That is not the case in Japan.	日本はそうではない。
That isn't the case in Japan.	日本ではそうではない。
Might I use your phone?	電話をお借りしてもよいでしょうか。
Who do you think you are?	自分が何さまだと思ってるんだ？
I know where he lives.	彼がどこに住んでいるのか知ってるよ。
I think he has done it.	私は彼がそれをしてしまったと思う。
I want to be a Picasso.	私はピカソのようなヒトになりたい。
I booked through to Paris.	私はパリまでの切符を買った。
I've only just come back.	私はたった今帰ったばかりです。
Is there any mail for me?	私に何か郵便は来ていませんか。
We learn English at school.	私たちは学校で英語を学ぶ。
We go to school to learn.	私たちは学ぶために学校に行く。
We looked at each other.	私たちはお互いに顔を見合わせた。
Where have you been up to now?	今までどこにいたの。
I wanted to show it to you.	君に見せてあげたかったよ。
Korea is now up and coming.	韓国は今や活気づいている。
We work for our living.	我々は生活のかてを得るために働く。
What made you come here?	何があなたをここに来させたのか。
Have you got any plans?	もう何か予定がはいっているのかい。
Tom wants to go to Japan.	トムは日本に行きたがっている。
Which way shall we go now?	どっちの方に行くとよいかな。
