No way.	絶対無理だね。
I do want to go to Italy.	どうしてもイタリアへ行きたい。
How did it all come about?	それは一体どうして起きたの。
Didn't you read the book?	その本を読まなかったのですか。
Where can I get the map?	その地図はどこで手に入りますか。
The car looked good as new.	その車は新品同然にみえた。
What was he up to then?	その時彼は何をたくらんでいたのか。
How will the plan work out?	その計画はどうなるだろう？
Read through the article.	その記事を最後まで読みなさい。
John lives in New York.	ジョンはニューヨークに住んでいる。
This book is of great use.	この本はたいへん有益である。
Please do it this way.	このようにして、それをやって下さい。
I am pleased at your coming.	お出で下さってうれしい。
You're looking very well.	あなたはとても元気そうですね。
Come and write your name.	あなたの名前を書きに来なさい。
It looks very good on you.	あなたにとてもよく合います。
I'd like two prints of each.	２枚ずつやいてください。
Do you have any books to read?	読む本がありますか。
He will buy it by mail order.	彼がそれを通販で購入する
I think I have tendonitis.	腱鞘炎ではないかと思うのです。
Have you sent in your report?	報告書を提出しましたか。
She changed her name to Ann.	彼女は名前をアンに変えた。
She has two thousand books.	彼女は二千冊本を持っている。
She is not less than thirty.	彼女は少なくとも３０歳だ。
She's looking the other way.	彼女は向こうを向いている。
She was about to go out.	彼女はまさに外出しようとしていた。
She likes it least of all.	彼女はそれがもっともきらいだ。
She will be here in no time.	彼女はすぐに来るでしょう。
She thought of a good plan.	彼女はいい計画を思いついた。
What man has done, man can do.	彼も人なり我も人なり。
I don't think that he will come.	彼は来ないと思う。
In the end, he did not come.	彼は結局姿を現さなかった。
What do you think he is?	彼は何をしている人だと思いますか。
He won't be a good player.	彼はいい選手にならないだろう。
He wants to go to Africa.	彼はアフリカに行きたがっている。
Is he the owner of that car?	彼があの車の持ち主ですか。
What do you think of Japan?	日本についてどう思いますか。
I am working on my new book.	新しい本に取り組んでいる。
We will start when he comes.	私達は彼が来たら出発する。
We have very good business.	私達は、商売が繁盛している。
I also had a very good time.	私もとても楽しかったです。
I'm going through changes.	私は変化の中を通りぬけている。
I am going to buy a new car.	私は新車を買うつもりです。
I don't think I want to go.	私は行きたいとは思いません。
I was reading a book then.	私はその時本を読んでいました。
I do want to go with you.	私はぜひあなたと一緒に行きたい。
What did you do with my book?	私の本はどうしましたか。
What do you want me to do?	私に何をしてほしいって言うの？
We thought out a new way.	私たちは新しい方法を考え出した。
We are in on the project.	私たちはその計画に関係している。
He came when I was out.	私が外出していたとき彼がやってきた。
Are you through with your work?	仕事を終えましたか。
What are you going to play?	今度は何を弾いてくれるんだ。
You can call me any time.	好きなときに電話してきていいよ。
I had to give up my plan.	計画をやめなければならなかった。
You're coming with us now.	君は今私たちと一緒に来るのだ。
You have only to come here.	君はここへ来さえすればよい。
When did you come to Japan?	君はいつ日本に来たのですか。
You may come if you like.	よろしかったら来てもいいですよ。
I'll call you some other time.	またいつか電話します。
How did you come to school?	どうやって学校に来ましたか。
Please come in one by one.	どうぞ一人ずつお入りください。
What did you come here for?	どうしてここへ来たのですか。
What made you think so?	どうしてあなたはそう考えたのですか。
No one man could do it.	だれでも一人でそれはできないだろう。
It came about in this way.	それはこのようにして起こった。
What'll they think of next?	それって、すごいじゃないの。
I'll send the book by mail.	その本を郵便でお送りします。
But now I live in Tokyo.	しかし、今住んでいるのは東京です。
That's just what I wanted.	これこそ求めていたものですよ。
I will give you this book.	この本をあなたにあげましょう。
This book is not for sale.	この本は売り物ではありません。
Are all these books yours?	この本はみなあなたの物ですか。
The car is at your service.	この車を自由にお使い下さい。
This car was made in Japan.	この車は日本で作られました。
Did you use to live here?	ここにかつて住んでいたのですか。
There may be two cases here.	ここで２つのケースがある。
I will make a man of you.	おまえを一人前の男にしてやろう。
I'd like to change my image.	イメージチェンジをしたい。
Please call me at any time.	いつでも電話をしてください。
Come at any time you like.	いつでも好きなときに来なさい。
When shall I come for you?	いつお迎えにまいりましょうか。
I don't know who that man is.	あの人が誰か分からない。
I don't know who the man is.	あの人が誰か私は知らない。
How did you come here?	あなたはどうやってここへ来たのですか。
What line of work are you in?	あなたの職業は何ですか。
I want to be in your plan.	あなたの計画に一枚加わりたい。
What do you think about it?	それについてどう思いますか。
What were you looking at then?	君はあの時何を見ていたの
He played the music with me/them.	彼が一緒に音を出す
Well, shall we call it a day?	そろそろお開きにしよかー。
She is used to traveling.	彼女は旅行することに慣れています。
She looks at least sixty.	彼女は少なくとも６０歳には見える。
She comes to school in her car.	彼女は車で学校に来る。
She is all in all to me.	彼女は私にとってもっとも大切な人だ。
She has known better days.	彼女は羽振りのよいときもあった。
She has gone to Paris.	彼女はパリに行っていて、ここにはいない。