He was open to a different way of thinking.	彼は異なった考え方を拒まなかった。
He was playing with a lighter.	その子はライターで火遊びをしていた。
He was present at the party.	パーティーに出席した。
He was run over by a car.	彼は車に轢かれた。
He was running and calling for help.	彼は走りながら助けを求めた。
He was seen going out of the house.	彼は家から出かけるところをみられました。
He was seen to come out of the house.	彼はその家から出てくるところを見られた。
He was seen to come out of the house.	彼は家からでてくるのを見られた。
He was very old.	彼はたいへん年をとっていました。
He was very old.	彼はとても年老いていた。
He was, is, and will be, my best friend.	彼は、昔も今も、またこれからも私の親友だ。
He wasn't at home when I called on him.	僕が訪ねて行った時彼は不在だった。
He will ask local people to work for me.	彼が現地の人に私の仕事を頼む
He will be back a week from today, that is, on December 10.	彼は今日から１週間後、つまり１２月１０日に帰ってくる。
He will be back before long.	彼はまもなく帰るでしょう。
He will be back in a second.	彼は今すぐ帰ってきます。
He will be calling on me next month.	彼は来週私を訪ねてくることになるでしょう。
He will be coming to the party.	彼はパーティーに来るでしょう。
He will be here all evening.	彼は今晩ずっとここにいるだろう。
He will be in New York for two weeks.	彼はニューヨークに２週間いるでしょう。
He will be off from work for a while.	彼がしばらく仕事を休みます
He will be studying when you get up.	君が起きるころには彼は勉強しているよ。
He will be up and about in a week.	彼は１週間もすれば起きて歩けるようになるでしょう。
He will check the stock and price.	彼が在庫や価格を確認する
He will come all right.	彼はきっときますよ。
He will come back in another two weeks.	彼はもう２週間すると帰ってくる。
He will come if you call him.	あなたが呼べば、彼は来るでしょう。
He will create two images.	彼が２枚の画像を作成します
He will get better in two weeks.	２週間ほどで彼は回復するでしょう。
He will go down in history.	彼が歴史に不朽の名を残す
He will go in your place.	彼があなたの代わりに行くだろう。
He will go to New York next month.	彼は来月ニューヨークへ行きます。
He will have lived here for ten years by the end of next month.	彼は来月の末でここに１０年間住むことになる。
He will include a photo taken within six months with the application form.	彼が申請書に６ヶ月以内の写真を添付します
He will not come today.	彼は今日は来ないでしょう。
He will not come today.	彼は今日来ないでしょう。
He will open a location in Kyoto.	彼が京都市に店舗を構える
He will play the game 100 times.	彼がゲームを１００回プレーします
He will return if only a little.	彼は少したったら帰ってくるだろう。
He will return to Japan some day.	彼はいつか日本に戻ってくるだろう。
He will save the world.	彼が地球を救う
He will study French.	彼はフランス語を勉強するつもりです。
He will tell her about it when she comes back.	彼女が帰ってきたときに、彼はそれについて話すでしょう。
He will try X.	彼がXに挑戦する
He will uncheck the check box.	彼がチェックボックスのチェックを外す
He will use it for real.	彼がそれを実際に使用する
He won't tell us about X.	彼がXを私たちに語りません
He working all right.	彼は申し分なくよくはたらいている。
He works best at this job.	彼はこの仕事では一番よく働く。
He works every day but Sunday.	彼は日曜を除いて毎日働く。
He works every day save Sundays.	彼は日曜日を除いて毎日働いている。
He works for the good of the country.	彼は国のために働いている。
He works in the planning section.	彼は企画課で働いている。
He works under me.	彼は私の部下だ。
He works with me at the office.	彼は会社の仲間です。
He would not say so if he didn't know about that.	もし彼がそのことについてしらなければそうは言わないだろう。
He would not take the money.	彼はどうしてもその金を受け取ろうとしなかった。
He wrote a paper on the subject.	彼はその問題について論文を書いた。
He wrote a story just now.	彼はちょっと前に物語を書いた。
He wrote this book at the age of twenty.	彼は二十歳のときにこの本を書いた。
He wrote three books by the age of 75.	彼が７５歳までに本を３冊書きました
He wrote three books in as many years.	彼は３年間に３冊本を書いた。
He'd love to live in the city.	彼は都会の生活にあこがれた。
He's at home in all the sciences.	彼はあらゆる科学について知っている。
He's been working all day long.	彼は１日中働いている。
He's coming back from America a week from today.	彼は今日から１週間目にアメリカから帰ってきます。
He's different from before.	彼は以前の彼とは違う。
He's good at cards.	彼はトランプがうまい。
He's in the money.	うなるほど金を持っている。
He's looking for a place to live.	彼は住むところを探しています。
He's only two years older than Jane.	彼はジェーンより２歳だけ年上だ。
He's running for Congress.	彼は代議士に立候補しています。
He's saving up to go to college.	彼は大学に行けるように貯金している。
He's still fibrillating.	まだ痙攣している。
He's studying history at university.	彼は大学で歴史を勉強しています。
He's the Bach of today.	彼は現代のバッハだ。
He's the man that was here last week.	あの人は先週ここにいた人です。
He's two years older than Mary is.	彼はメアリーより二歳年上です。
Helen is seventeen years old.	ヘレンは１７歳です。
Her actions are to the point.	彼女の行動は的を射ている。
Her actions are to the point.	彼女の行動は的を得ている。
Her business called for her to travel around the world.	彼女の仕事は彼女に世界中を旅することを要求した。
Her car is two years old.	彼女の車は買ってから二年たっている。
Her family is very large.	彼女の家族は大人数だ。
Her friends call him Ned.	彼女の友達は彼をネッドと呼ぶ。
Her job is to type.	彼女の仕事はタイプを打つ事だ。
Her life is free from care.	彼女の人生は、何の心配もない。
Her look says that she loves you.	彼女が君を好きなことは彼女の目つきでわかる。
Her look says that she loves you.	彼女が君を好きなのは彼女の目を見れば分かる。
Her look says that she loves you.	彼女が好きなことは彼女の目をみてわかる。
Here are two dogs; one is white and the other is black.	ここに２匹の犬がいます。１匹は白で、もう１匹は黒い。
Here is note from him. He must have come here.	ここに彼の書き置きがある。これはここに来たに違いない。
Here it is, all in black and white.	これです。全部書類にして持ってきたのは。
Here's a big map of Germany.	ここにドイツの大きな地図があります。
Here's my card.	これが私の名刺です。
Here's some water.	ここに水が少しある。
Here's the address.	これが住所です。
Here's your party.	相手の方がお出になりました。
Hiromi goes to school five days a week.	広美は週に５日学校に行く。
Hmmm, how shall I say this?	何て言ったらいいのかなあ。
Hokkaido is to the north of Honshu.	北海道は本州の北にある。
Hokkaido is to the north of Sendai.	北海道は仙台の北方にある。
How about February 28th around 3:00 pm?	２月２８日の午後３時頃はどう。
How about Thai food?	タイ料理なんか、いかがですか。
How about a second helping?	もう１杯いかがですか。
How about getting the special of the day?	日替わり定食にしませんか。
How about going for a drive?	ドライブするのはどうですか。
How about going for a drive?	ドライブはいかがですか。
How about going to see the game?	その試合を見に行きませんか。
How about running?	走りませんか。
How about some Spanish food?	スペイン料理なんかどうですか。
How about the last part of the story?	物語の結末はどうでしたか。
How about two weeks from Thursday?	再来週の木曜日はどう。
How about your family?	ご家族のみなさんはいかがですか。
How about your family?	ご家族はいかがですか。
How about your place?	あなたの家でいいですか、場所は？
How are you finding the Quality Control department?	畑違いの品質管理課は如何ですか？
How are your studies going?	あなたのご研究は、いかがですか。
How big he is!	彼はなんて大きいのだろう。
How big is he?	彼の大きさはどのくらいですか。
How big is this park?	この公園はどのくらい広いのですか。
How big?	どのくらい広い？
How can you make your way in life without a good education?	良い教育を受けないでどうして成功できるのか。
How can you say that?	君にそんなことを言う資格があるのか。
How can you tell an Englishman from an American?	どのようにしてイギリス人とアメリカ人を区別できますか。
How come you didn't come to the party?	どうして、あなたはパーティーに来なかったのですか。
How come you're still working?	あなたはなぜ働いているの。
How did he come by this money?	彼はこのお金をどうやって手に入れたのか。
How did he work out the big problem?	彼はどのようにしてその大問題を解決したのか。
How did she tell them?	彼女はそれをどのようにして知らせたのですか。
How did the game come out?	そのゲームはどうなったか。
How did the game come out?	試合はどうなりましたか。
How did the game come out?	試合はどんな結果になったか。
How did the party go?	パーティの進み具合は。
How did the party go?	パーティーのすすみ具合はどうでしたか。
How did you come by such a job?	そんな仕事をどうやった手に入れたの。
How did you come by that much money?	その大金をどうして手に入れたのですか。
How did you come by the money?	あなたはどうやってそのお金を手に入れたのですか。
How did you come by this money?	どうやってこの金を手に入れたのか。
How did you come by this money?	君はこのお金をどうやって手に入れたのか。
How did you come to know one another?	君達はどうやってお互いを知り合ったのですか。
How did you come to love her?	どんなふうにして彼女を好きになったのですか。
How did you find my house?	どうやって私の家を見つけたのですか。
How did you find my house?	私の家はいかがでしたか。
How did you get to know him?	どうして彼を知るようになったのですか。
How did you get to know that person?	その人とどうして知り合いになったのですか。
How did you like the party?	パーティーはいかがでしたか。
How did you pay for this computer?	あなたはどうやってこのコンピューターの代金を払ったのですか。
How did you reply?	何て答えたの？
How do I get to your office from Hioka Park?	日岡公園から貴社へはどうやって行ったらよいでしょうか。
How do you account for that?	あなたはそれをどう説明しますか。
How do you go to school every day?	毎日どのようにして学校にいくのですか。
How do you go to school every day?	毎日どのようにして学校へ行くのですか。
How do you like your new class?	新しいクラスはいかがですか。
How do you like your new job?	新しい仕事はいかがですか。
How do you make a box?	どうやって箱を作るのか。
How do you make your money?	どのようにすればお金が手に入りますか。
How does he go to school?	彼はどうやって学校に通っていますか。
How does the first article run?	最初の条項には何と書いてあるか。
How is it going with your family?	お宅の皆さんはいかがですか。
How is it going with your family?	御家族はいかがお過ごしですか。
How is it in a private school?	私立の学校はどういう感じですか。
How is it in the market?	市場の景気はどうですか。
How is it she does not come?	どうして彼女は来ないのか。
How is your family?	ご家族の皆さんはご機嫌いかがですか。
How is your family?	ご家族はお元気ですか。
How is your family?	家族の皆さんはお元気？
How is your life?	暮らしはどうですか。
How large is your family?	あなたは何人家族ですか。
How long can I keep this book?	この本どのくらいお借りしていいですか。
How long can I keep this book?	この本どのくらいお借りしていてよろしいですか。
How long can I keep this book?	この本はどのくらい借りれますか。
How long did it take you to drive from here to Tokyo?	君はここから東京まで車で行くのにどのくらい時間がかかりましたか。
How long did they live in England?	彼らはイギリスにどれくらい住んでいましたか。
How long do you study English every day?	あなたは毎日どのくらい英語を勉強しますか。
How long do you think it takes to go from here to Tokyo?	ここから東京までどれぐらい時間がかかると思いますか。
How long do you want it for?	期間はどのくらい？
How long does Tony run every day?	トニー君は毎日どれぐらい走りますか。
How long does it take by car?	車でどれくらいかかりますか。
How long does it take for you to read this book?	この本をあなたはどれぐらいで読めますか。
How long does it take from here to your house?	ここからあなたの家までどれくらいかかりますか。
How long does it take to get there from here?	ここからそこまで行くのにどれくらいかかりますか。
How long does it take to get to Chicago from here?	ここからシカゴへ行くのにどのくらいかかりますか。
How long does it take to go from here to the Hilton Hotel?	ここからヒルトンホテルまでどのくらい時間がかかりますか。
How long does it take to go to the office from your home?	家から会社までどれくらい時間がかかりますか。
How long does it take you to go home from my house?	私の家からあなたの家に帰るのにどのくらい時間がかかりますか。
How long does it take?	どれ位かかりますか。
How long does it take?	時間はどのくらいかかりますか。
How long has Ken lived in Kobe?	ケンはどれくらい神戸に住んでいるの。
How long has he lived in London?	彼はどのくらいロンドンに住んでいるのですか。
How long has he lived there?	どのくらいそこに住んでいるの。
How long have they been here?	いつ来たんだ？
How long have you been dating?	君達はいつからつきあっているのですか。
How long have you been here?	あなたはどれぐらいの時間ここにいるのですか。
How long have you been here?	ここに来て、どれくらいになるの？
How long have you been here?	ここに来てどのくらい？
How long have you been here?	当地に来てからどのくらいになりますか。
How long have you been in Japan?	あなたはどのくらい日本においでですか。
How long have you been in Japan?	どのくらい日本にいらっしゃいますか。
How long have you been in Japan?	どのくらい日本にいるんですか。
How long have you been in Japan?	君はどれほど日本にいますか。
How long have you been in Kobe?	神戸にはもうどれくらいいらっしゃいますか。
How long have you been in Kushiro?	あなたはどのくらい長く釧路にいましたか。
How long have you been learning English?	どのくらいの期間英語を勉強しているのですか。
How long have you been living in Kobe, then?	君はいつから神戸に住んでいるの。
How long have you been living in Tokyo?	もうどのくらい東京にいるのですか。
How long have you been looking for it?	いつからそれをお探しですか。
How long have you been looking for it?	いつからそれを探しているのですか。
How long have you been studying English?	いつから英語を習っているのか。
How long have you been studying English?	どのくらい英語を勉強していますか。
How long have you been studying English?	何年くらい英語を勉強していますか。
How long have you been working here?	ここで働いてどれくらいですか。
How long have you had this problem?	この症状が出たのはいつですか。
How long have you known Jack?	ジャックと知り合ってどのくらいになりますか。
How long have you known Jim Robinson?	ジム・ロビンソンとはいつからの知り合いですか。
How long have you known Judy?	あなたはジュディさんと知り合ってどれぐらいになりますか。
How long have you known her?	彼女と知り合ってからどれくらいになりますか。
How long have you known him?	彼と知り合ってどのくらいになりますか。
How long have you lived here?	ここにどれくらいお住まいですか。
How long have you lived here?	ここに住んでどのくらいになりますか。
How long have you lived in Japan?	日本に住むようになってどのくらいになりますか。
How long have you lived in Kobe?	あなたはどのくらいの間、神戸に住んでいますか。
How long have you lived in Sanda?	あなたはいつから三田に住んでいますか。
How long have you lived in Sasayama?	あなたはどれくらい篠山に住んでいるのですか。
How long have you studied?	あなたはいつから勉強していますか。
How long is it since you bought this car?	あなたがこの車を買ってからどのくらいたちますか。
How long is it since you came to Japan?	日本に来てどれくらいになりますか？
How long is that story?	その物語はそのくらいの長さですか。
How long is this?	この長さはどれくらいですか。
How long it is!	それはなんて長いんだろう。
How long may I keep this?	これ、いつまで借りていられますか。
How long will it be?	待つ時間はどのくらいですか。
How long will it take to get there?	そこへ着くのにどれぐらいかかりますか。
How long will it take to get well?	どのくらいで治りますか。
How long will it take to get well?	治るのにどのくらいの期間がかかりますか。
How long will it take?	何日ぐらいかかりますか。
How long will it take?	日にちはどのくらいかかりますか。
How long will you be gone?	何日ぐらい行くの。
How long will you be here?	どのくらい滞在しますか。
How long will you have been working here by the end of next year?	来年末までで、ここで働き始めてどれくらいの期間になりますか。
How many CDs do you have?	ＣＤをどれくらい持っているの。
How many Christmas cards did you write last year?	あなたは去年、クリスマスカードを何枚書きましたか。
How many English words do you know?	英語の単語をどれくらい知っていますか。
How many English words do you know?	英語の単語を何語知っていますか。
How many are there in your class?	君のクラスの生徒は何人ですか。
How many books are there on the table?	テーブルの上に何冊の本がありますか。
How many books can I take out at one time?	一度に何冊借りられますか。
How many books do you have?	あなたは何冊の本を持っていますか。
How many books do you have?	君は何冊の本をお持ちですか。
How many books do you read a month?	あなたは１ヶ月に何冊の本を読みますか。
How many books does he have?	彼は何冊本を持っていますか。
How many cars do you have?	車を何台お持ちですか。
How many cars does Alex have?	アレックスは何台クルマを持っているの？
How many cars does the Tsubasa have?	つばさの客車は何両ですか。
How many cars has that company bought?	その会社は車を何台買ったか。
How many classes do you have on Monday?	月曜日には何時間授業がありますか。
How many classes do you have on Mondays?	あなたは月曜日にいくつ授業がありますか。
How many classes do you have on Saturdays?	土曜日には何時間授業がありますか。
How many credits can I get for this course?	この教科は何単位ですか。
How many credits is this course?	この科目は何単位ですか。
How many days a week do you go to school?	一週間のうちで何日学校に通いますか。
How many days are there before Christmas?	クリスマスまであと何日ありますか。
How many days are there in a week?	一週間は何日ありますか。
How many days will it take if I send this as registered mail?	これを書留で送ると何日くらいかかりますか。
How many does he want?	彼はいくつ欲しいのですか。
How many of you are there?	あなた達の中のどれくらいの人がそこにいるのか。
How many papers do you take?	新聞はいくつとっていますか。
How many people are in this room?	何人の人々がこの部屋にいますか。
How many people are in your party?	人数は何人ですか。
How many people are on board?	乗客は何人ですか。
How many people are there in your family?	何人家族ですか。
How many people in your party?	何人様ですか。
How many people?	何人ですか。
How many rooms are there in your house?	君の家には部屋がいくつありますか。
How many rooms do you have?	あなたはいくつ部屋を持っていますか。
How many schools are there in your city?	君の町にいくつ学校がありますか。
How many siblings do you have?	あなたは何人兄弟がいますか。
How many times a month do you write home?	君は月に何回家に手紙をかきますか。
How many times do I have to tell you?	何回言ったらわかるの？
How much do you ask for this?	これ、いくらで売りたい？
How much is the car you are planning to buy?	君が買う予定をしている車はいくらですか。
How much money do you have with you?	いくらお金をもっていますか。
How much money do you have with you?	いくら持ち合わせがありますか。
How much money do you have with you?	お金はいくら持っていますか。
How much money do you have with you?	所持金はいくらありますか。
How much money do you have?	お金はどのくらい持っていますか。
How much money do you want?	君はいくらお金がほしいのですか。
How much money does he have?	彼はお金をどのくらい持っていますか。
How much money does he make a month?	彼は毎月お金をいくら稼ぎますか。
How much more work do you have?	仕事はあとどれだけ残っていますか。
How much should I pay today?	今日はおいくらですか。
How much time does it take to get from A to B?	Ａ市からＢ市までどれくらいの時間がかかりますか。
How much will it cost?	どのくらいの料金がかかりますか。
How old are you?	あなたの年齢は何歳ですか。
How old are you?	何歳ですか。
How old do you think I am?	私は何歳だと思いますか。
How old do you think she is?	彼女は何歳だと思いますか。
How old he is!	彼はなんと年をとったことか。
How old is Tony?	トニー君は何歳ですか。
How old is he then?	じゃあ何歳なの？
How old is he?	彼はいくつなの？
How old is he?	彼は何才なんですか？
How old this book is!	この本は何と古いのだろう。
How old will you be next year?	君たちは来年何歳になりますか。
How old will you be next year?	来年で何歳になりますか。
How old will you be next year?	来年君は何歳になりますか。
How small this book is!	この本は何と小さいのだろう。
How was today's game?	きょうの試合はどうでしたか。
How was today's game?	今日の試合はどうだった。
How was your test?	テストはどうだった？
How will you travel to Osaka?	大阪にはどうやって行くんですか。
How would you like these items?	内訳はどのようにしましょう？
How would you like to pay for it?	お支払いはどのようにしますか。
How would you like to pay?	お支払いはどのようになさいますか。
How would you take these words?	このことばを君はどう考えますか。
How's it going with your family?	ご家族のみなさんはうまくいっていますか。
How's your family?	ご家族の皆様おかわりありませんか。
How's your job?	仕事どうなの？
How's your new job?	新しい職場はいかがですか。
