I like May the best of all the months.	私はすべての月のうちで５月がもっとも好きだ。
I like both of them very much.	私はその両方とも大好きだ。
I like both.	私はどちらも好きです。
I like her all the better because she has childishness.	私は、彼女には子供っぽさがあるから、かえってそれだけ彼女が好きだ。
I like him all the better for it.	それだからいっそう彼が好きだ。
I like him very much.	私は彼がとても好きだ。
I like him.	彼が好きです。
I like history.	私は歴史が好きだ。
I like it black.	私はブラックが好きだ。
I like it very much.	とても好きです。
I like it very much.	とても気に入ってます。
I like it very much.	私はとても気に入りました。
I like love stories.	私はラブストーリーが好きです。
I like music very much.	私は音楽がとても好きだ。
I like studying English.	私は英語を勉強することが好きです。
I like studying history.	私は歴史を勉強することが好きです。
I like this house as it is.	この家はこのままにしておきたい。
I like to give gifts to my family and friends.	私は家族や友人に贈り物をするのが好きです。
I like to read story books.	私は物語の本を読むのが好きだ。
I like to run.	私は走るのが好きだ。
I like to shop at that department store.	私はあのデパートで買い物するのが好きだ。
I like to study English.	私は英語を勉強するのが好きです。
I like you very much.	私は君のことがとても好きです。
I live in a big city.	私は大都会に住んでいる。
I live in a rooming house.	私は下宿しています。
I live in a two story house.	私は２階建ての家に住んでいる。
I live in the country.	田舎に住んでいます。
I lived for more than a month in Nagoya.	１か月あまり名古屋に居たことがある。
I lived three years in Paris during which time I learned French.	三年間パリに住みその間にフランス語を覚えた。
I long for company.	私は相手が欲しい。
I look on her as my best friend.	私は彼女を一番の親友と考えている。
I look on him as my best friend.	私は彼を親友と見なしている。
I look on you as my best friend.	私はあなたを親友だと思っています。
I look to him for help.	私は彼の助けをあてにしています。
I look up to him in many ways.	多くの面で彼を尊敬しています。
I look very different.	以前とは別人のようになりました。
I looked around me.	僕は周りを見回した。
I looked into the box.	箱の中を覗き込んだ。
I looked into the next room.	私は隣の部屋の中を見た。
I love Hitomi.	私は瞳が好きだ。
I love her and she loves me.	僕は彼女を愛してるし、彼女も僕を愛してます。
I love her.	私は彼女に恋をしている。
I love him for what he is, not what he has.	彼の財産でなく、彼の人柄のために私は彼が好きだ。
I love reading books.	私は読書が好きです。
I love what you are.	今のあなたを愛している。
I love you as much as him.	私は彼と同じようにあなたを愛する。
I love you better than he.	私は彼があなたを愛している以上にあなたを愛しています。
I love you more than her.	私は彼女よりあなたのほうを愛している。
I love you more than you love me.	君が私を愛しているよりもおおく私は君を愛している。
I love you more than you love me.	君が私を愛している以上に私は君を愛している。
I love you.	あなたが好きです。
I love you.	あなたを愛してる。
I love you.	だって好きなんだもの。
I love you.	君が好きだ。
I love you.	君のことが好きなんだ。
I love you.	大好きだよ！
I love you.	愛してる。
I love you.	私は、貴方が好きです。
I love you.	私はあなたを愛している。
I loved my life and my money.	私は自分の人生とお金を愛していた。
I made friends with her.	私は彼女と友達になった。
I made friends with him.	私は彼と友達になった。
I made friends with him.	私は彼と親しくなった。
I made friends with many Americans at the party.	私はそのパーティーで多くのアメリカ人と親しくなった。
I made him do so.	私は彼にそうさせました。
I made him go.	私は彼を無理にも行かせた。
I made more friends before I knew it.	知らぬ間にどんどん仲間が増える
I made my first contact with him there.	そこで私は初めて彼と知り合った。
I made the best of my small room.	狭い部屋をせいぜい広く使った。
I make 100 euros per day.	私は一日に100ユーロ稼ぎます。
I make a point of getting up before six.	私は６時に起床することにしている。
I make little of the problem.	その事は問題にしていません。
I may have told you this story before.	私は君にこの話を以前にしたかもしれません。
I might well tell you this.	これは申し上げた方がよいでしょう。
I must be going now.	私はもう行かなくてはなりません。
I must buy one.	１台買わなければならない。
I must get the book back from him.	その本を彼から戻してもらわなければならない。
I must go about my work.	私は仕事に取りかからねばならない。
I must go and see him.	私は彼に会いに行かなければならない。
I must go out.	私は外出しなければならない。
I must go some day or other.	私はいつかいかなければならない。
I must go some day or other.	私は何時の日か行かねばならない。
I must go there.	私はそこへ行かなければならない。
I must hand in the report today.	今日レポートを提出しなければならない。
I must help her at any cost.	どんな犠牲を払っても、彼女を助けなければならない。
I must help him.	彼をてつだってあげなければ。
I must help these people.	私はこれらの人々を助けなければならない。
I must return home within a week.	私は一週間以内に故郷に帰らなければなりません。
I must save her at all costs.	何としても彼女を救わねばならない。
I must say no to you.	私はあなたにノーと言わなければならない。
I must take back the money at all costs.	どんなことがあってもそのお金を取り返さねばならない。
I must think about what to do.	何をすべきか、考えなければならない。
I need a box of this size.	これくらいの大きさの箱がいる。
I need more time.	もっと時間が必要だ。
I need more time.	もっと時間が欲しい。
I need some paper.	紙がほしい。
I need some writing paper.	便箋をください。
I offered him some money, but he would not take it.	私は彼にお金を差し出したが、彼はどうしてもそれを受け取ろうとはしなかった。
I only did as I was told.	私は言われたとおりにしただけです。
I only know him by name.	名前だけでしか彼を知らない。
I ordered those books from Germany.	私はそれらの本をドイツに注文した。
I own 1,000 shares of NTT stock.	私はＮＴＴの株を１０００株持っている。
I paid $200 in taxes.	私は税金に二百ドル払った。
I paid him the money last week.	私は先週彼にお金を払った。
I paid him the money.	私は彼にその金を払った。
I parted with my old car.	愛車を手放した。
I play video games.	私はテレビゲームをします。
I play with him.	私は彼と一緒に遊ぶ。
I pointed at him.	私は彼を指さした。
I provided him with food.	彼に食物をあてがった。
I ran for my life.	私は命からがら逃げた。
I ran for my life.	私は必死になって逃げた。
I ran in order to be on time.	間に合うように走ってきたのです。
I ran into Mary at a party last week.	先週パーティーでメアリーに偶然会った。
I ran into an old friend.	ばったり昔の友達に会った。
I ran into an old friend.	旧友に出くわした。
I ran out of the room without knowing what I was doing.	私は無我夢中で部屋を飛び出した。
I read at least one book every month.	私は少なくとも毎月１冊は本を読みます。
I read it to my family.	私それを家族に読んで聞かせた。
I read it to my family.	私はそれを家族に読んで聞かせた。
I read the book from cover to cover.	私はその本をすみからすみまで読んだ。
I read the book from cover to cover.	私はその本全編残らず読んだ。
I read the book in my second year of high school.	その本は高校２年の時に読んだ。
I returned to Japan.	私は日本に戻った。
I run every day.	私は毎日走ります。
I run.	私は走ります。
I said Paul was out, but that Mary was at home.	私は「ポールは外出中ですが、メアリーは家にいます」と言った。
I said he might go.	私は彼がいってもよいといった。
I said so with a view to pleasing him.	私は彼を喜ばせるつもりでそう言ったのだ。
I said so.	私はそう言いました。
I said that I didn't go shopping with her.	私は彼女とは買い物に行かないと言った。
I save what money I got.	私は手に入るわずかばかりの金をすべて蓄えた。
I saw her at the party.	私はパーティーで彼女を見かけました。
I saw her last week.	私は先週彼女に会った。
I saw him at one time or another.	以前彼に会ったことがある。
I saw him come this way.	彼がこっちに来るのが見えました。
I saw him come this way.	彼がこっちへ来るのが見えました。
I saw him go out of the room just now.	私は、彼がたった今部屋から出るのを見た。
I saw him go out.	私は彼が出て行くのを見た。
I saw him in the park.	公園で彼に会いましたよ。
I saw him just now.	私はついさっき彼に会ったばかりです。
I saw him last week.	先週彼に会いました。
I saw him looking at me.	彼が私を見つめているのが分かった。
I saw him looking at me.	彼が私を見つめているのが目に映った。
I saw him no more.	もうそれ以来彼に会うこともなかった。
I saw him playing cards with all of them.	彼がみんなとトランプをしているところをみました。
I saw him running.	彼が走っているのを見た。
I saw him.	私は彼に会った。
I saw some people there leading a low life.	そこの人々が下層社会の生活を送っているのを見た。
I saw that he was right.	私は彼が正しいことが分かった。
I saw the old man two or three times a week.	私はその老人を、週に２．３回見かけた。
I saw you driving your new car.	あなたが新車を運転しているのを見た。
I say it all the time.	いつも言ってるじゃないか。
I say this from my own experience.	この事は私自身の体験から言っているのです。
I searched high and low for my lighter but couldn't find it.	ライターをあちらこちら探したが見つからなかった。
I see him in the library now and then.	私はときどき図書館で彼に会う。
I see much of Takaoka.	私は高生加によく会う。
I see why you don't want to go there.	あなたがどうしてそこへ行きたくないのかが分かります。
I see you every now and then.	私はあなたを時々見掛ける。
I see your point.	あなたの主旨はわかる。
I see your point.	お話の要点は分かりました。
I shall see him in less than a week.	一週間たたないうちに彼に会うだろう。
I shared a room with him.	僕は彼と部屋を共有した。
I shopped around for my computer and ended up paying $200 less than David.	コンピューターを物色して歩いたあげく、デイヴィドより２００ドル安い値段で手に入れた。
I should ask him if I were you.	私がもし君だったら彼に尋ねるでしょうに。
I should have known better than to call him.	彼に電話なんかしなければよかった。
I should have taken the money.	金を選ぶべきだった。
I should like to call on you this evening.	もしご迷惑でなければ今晩お伺いしたいのですが。
I should not have said that.	言わずもがなのことを言ってしまった。
I should say he won't come.	たぶん、彼は来ないでしょう。
I should sell it while it still runs.	まだ動くうちに売ってしまわなきゃ。
I should think she is under thirty.	彼女は３０歳未満だと思いますが。
I should think we will need some more money.	もう少しお金が必要になると思うのですが。
I should think you are right.	君は正しいと思いますが。
I shouldn't have told you nothin'.	おまえなんかに話すんじゃなかったよ。
I showed her my room.	私は彼女に自分の部屋を見せた。
I showed him into the room.	私は彼を部屋に案内した。
I sold a book.	私は本を売った。
I sold off all my records.	レコードは全部売り払ってしまったんだ。
I still have some feelings for her.	彼女にはまだ未練がある。
I still have some money in hand.	私はまだ少し手持ちの金がある。
I still haven't found what I'm looking for.	まだ捜している何かをみつけていないから。
I still haven't learned to drive a car.	私は相変わらず車の運転を習っていない。
I still think about her from time to time.	今でも私はときどき彼女のことを思い出す。
I studied English when I was there.	私は、そこにいた時に英語を学びました。
I studied my part in the play.	僕は芝居の自分の役の台詞を覚えた。
I study English at home.	私は家で英語の勉強をします。
I study English at home.	私は家で英語を勉強します。
I study English at school.	私達は学校で英語を勉強します。
I study English every day.	私は毎日英語の勉強をする。
I study English on Monday and Friday.	私は月曜と金曜に英語を勉強する。
I study English.	私は英語を勉強します。
I study Japanese history.	私は日本史を勉強している。
I study at school.	私は学校で勉強する。
I study from eight to eleven.	私は八時から十一時まで勉強します。
I study from eight to eleven.	私は８時から１１時まで勉強します。
I study very little.	私はたまにしか勉強しない。
I take back my words.	私の発言を取り消します。
I take back what I said.	今言ったことは取り消します。
I tell you this.	あなたに言っておきます。
I think Ann loves Jack.	アンはジャックを愛しているのだと私は思う。
I think I'll look around a little more.	もう少し見て回ろうと思います。
I think I'll take the test this time.	私は今度、テストを受けようと思います。
I think I'm right.	僕が正しいと思う。
I think a part-time job is a good experience.	アルバイトはいい経験になるの。
I think he is right.	彼は正しいと私は思います。
I think he is right.	私は彼が正しいと思います。
I think he will become a Beethoven.	彼はベートーベンのような大作曲家になると思う。
I think he will come to our party.	彼は私たちのパーティーに来るとおもいます。
I think him in good health.	私は彼が健康だと思う。
I think it better not to try.	やってみないほうがよいと思う。
I think it's around here.	この辺だと思います。
I think most people are better off now than they used to be.	たいていの人が以前よりも暮らし向きがよいと思う。
I think most people are better off now than they used to be.	たいていの人は以前よりも暮らし向きがよいと思う。
I think of him as one of my good friends.	私は彼を親友の一人と考えています。
I think she made up that story.	それは彼女の創作だろう。
I think she's over 40 years old.	彼女は少なくとも４０才は越えていると思う。
I think that he is right.	彼の言うとおりだと思う。
I think that he is right.	彼は正しいと思う。
I think that there are many places to see there.	そこにはたくさん見るところがあると思います。
I think this is a case in point.	これは適切な例だと思います。
I think we can be friends.	きっと友達になれると思います。
I think we could be good friends.	いい友達になれそうですね。
I think we should do some more.	もう少しやった方がいいと思うわ。
I think we're out of your size.	お客様のサイズは切らしてしまっているようですが。
I think what you're doing is right.	あなたのやっていることは正しいと思う。
I think you had better call on him.	君は彼を訪問した方がよいと思う。
I think you're right.	君の言うとおりだと思うよ。
I think your work is all right.	君の仕事は申し分ないと思う。
I thought I must do it.	それをしなければと思った。
I thought as much.	そんなことだと思ってたよ。
I thought as much.	そんな事だと思った。
I thought as much.	私はそのように考えた。
I thought he was my special friend.	彼は私の特別な友人だと思っていた。
I thought she was 30 at most.	彼女はせいぜい３０歳だと僕は思った。
I thought she was my special friend.	彼女は私の特別な友人だと思っていた。
I told Jane how to get to our school.	私はジェーンにどうやって通学すればよいかを教えました。
I told her not to go.	彼女に行かないようにと言った。
I told her to be home by nine.	私は彼女に９時までに帰宅するように言った。
I told her what to do.	私は彼女になにをすべきか言いました。
I told him about our school.	私は彼に私たちの学校のことを話した。
I told him that I had seen her a week before.	私は１週間前に彼女に会った、と彼に話しました。
I told him that I would do my best.	私は彼に最善を尽くすと言った。
I told him the big news.	私は彼にそのビッグニュースを知らせた。
I told him to come.	私は彼に来るように言った。
I told him what I had told you.	私は君に話したことを彼に話した。
I told him what to do.	私は彼に何をしたらよいのか教えてやった。
I told him what to see in Kyoto.	私は彼に京都で何を見たらいいか教えました。
I told the news to Tom, not to Mary.	私はメアリーではなくてトムにそのニュースを話した。
I told you before!	言っただろ！
I took a day off last week.	先週一日休みを取った。
I took a week off.	一週間休んでいました。
I took him for my close friend.	私は彼を親しい友人と間違えた。
I took my place at the end of the line.	私は列の一番後ろに立った。
I took no note of the time.	時間がたつのに気がつかなかった。
I took note of what he was saying.	彼の言っていることに注目した。
I took note of what he was saying.	私は彼の言っていることに注意した。
I took part in the party.	私はそのパーティーに参加した。
I took the job without giving it much thought.	深く考えないでその仕事を引き受けてしまった。
I took your word for it.	私は君の言葉をそのまま信じた。
I traveled about Europe.	ヨーロッパをあちらこちら旅行した。
I tried many times to use a personal computer.	私は何度もパソコンを試しに使ってみた。
I tried to change the subject.	私は話題を変えようとした。
I tried to get down every word he said.	彼の言うことすべてを書き取ろうとした。
I tried to get him to learn to drive.	私は彼に運転を習わそうとした。
I tried to give her some money, but she wouldn't take any.	彼女にお金をいくらか渡そうとしたが、どうしても受け取ろうとしなかった。
I tried to tell you.	だから言っただろう。
I try to make time.	私が何とか時間を作ります
I try.	頑張ってみる。
I use it every day.	私は毎日それを使っています。
I used a computer in order to save time.	時間を節約するためにコンピューターを使った。
I used to go to school with him.	彼と一緒に学校に行くのが常だった。
I used to go to school with him.	私は彼と学校に行くのが常でした。
I used to go to that library to study.	私はいつも勉強しにあの図書館へ行ったものだ。
I used to run at high school.	高校のころは走ったものです。
I visited American friends in Oakland.	私はオークランドに住むアメリカの友人を訪ねた。
I visited Kushiro for the first time.	私ははじめて釧路を訪問した。
I visited New York for the first time.	私は初めてニューヨークを訪れた。
I visited Paris in Europe.	ヨーロッパにいる間に僕はパリをたずねた。
I visited Rome for the first time in my life.	私は生まれて初めてローマを訪れた。
I visited cities such as New York, Chicago and Boston.	私はニューヨーク、シカゴ、ボストンといったいくつかの都市を訪れた。
I visited him this day last week.	先週の今日彼を訪ねました。
I visited many parts of England.	私はイギリス各地を見物した。
I visited your website for the first time.	初めてこちらのＨＰを拝見しました
I want a box three times as large as this.	私はこの三倍の大きさの箱が欲しい。
I want a car, but I have no money to buy one.	車が欲しいがそれを買う金がない。
I want a guide to Chicago.	私はシカゴの案内書が欲しい。
I want a little money.	私は少しお金がほしい。
I want a personal computer.	私はパソコンが欲しい。
I want game information.	ゲームの情報が欲しい
I want him to go there.	私は彼にそこへ行ってもらいたい。
I want him to read this.	彼にこれを読んでもらいたい。
I want many books to read.	私は読むための沢山の本がほしい。
I want money.	お金が欲しい。
I want some money.	ぼくはお金がほしいのだ。
I want some money.	私はいくらかのお金がほしい。
I want some water.	水が欲しい。
I want to ask them when their big day is.	彼らに結婚式の日取りを聞きたい。
I want to be with him all the way.	ずっと彼と一緒にいたい。
I want to buy another.	別なのを買いたい。
I want to close my account.	口座を閉じたいのですが。
I want to create the best ramen website in Japan .	ラーメンに関する日本一のサイトを目指します
I want to do some shopping around here.	私はこのあたりで少し買い物をしたい。
I want to drive.	私は車を運転したい。
I want to go to college.	私は大学に行きたい。
I want to go to college.	私は大学へ行きたい。
I want to have my own room.	私は自身の部屋がほしい。
I want to join Joe's group.	私はジョーのグループに加わりたいです。
I want to know about your country so much.	とてもあなたの国について知りたいのです。
I want to know about your country.	私はあなたの国について知りたい。
I want to know more about your country.	私はあなたの国についてもっと知りたいと思います。
I want to know more about your school life.	あなたの学校生活についてもっと色々知りたい。
I want to learn standard English.	私は標準英語を勉強したい。
I want to make a person-to person call to 212-836-1725.	２１２ー８３６ー１７２５に指名通話をかけたいんだけど。
I want to make friends with Nancy.	僕はナンシーと仲良くなりたい。
I want to make love with you.	あなたと愛をかわしたい。
I want to play cards.	私はカードゲームがしたい。
I want to see her very much.	私はとても彼女に会いたい。
I want to see him at all costs.	是非彼に会いたい。
I want to see him very much.	私はとてもかれにあいたい。
I want to see my friends in Canada.	私はカナダにいる友達に会いたい。
I want to see you before you go.	あなたが出かける前にお会いしたい。
I want to study English.	私は英語を勉強したい。
I want to study French.	私はフランス語を勉強したい。
I want to study history.	私は歴史を研究したいと思います。
I want to travel all over the world.	世界中を旅行をしたいんだ。
I want to travel around the world.	世界を一周したい。
I want to travel to Australia.	オーストラリア旅行に行きたいんだよ。
I want to travel with you.	わたしはあなたと、旅行に行きたい。
I want you to go to the post office.	君に郵便局へ行ってもらいたい。
I want you to keep up with me.	こちらの調子に合わせてください。
I want you to take back what you said just now.	たった今言ったことを取り消してもらいたい。
I wanted her to come here this evening.	私は彼女に今晩ここに来てもらいたかったのです。
I wanted him to go there.	私は彼にそこへ行ってほしかった。
I wanted it more than others.	憧れる気持が人一倍強かった
I wanted to take part in the party but I couldn't.	私はそのパーティーに参加したかったが、出来なかった。
