Give my love to your family.	ご家族の皆さんによろしく。
Give your papers in.	答案を提出して下さい。
Go and see him in person.	行って直接彼に会ってきなさい。
Go back to the list of 2005 news releases.	２００５年のプレスリリース一覧に戻る
Go in the field.	この道を行きなさい。
Go on board.	乗船する。
Go to the park.	公園に行きなさい。
Good day. How are you today?	こんにちは、今日のご機嫌はいかがですか。
Good evening. How many are in your party?	いらっしゃいませ、何名様ですか。
Good timing. I'll get you to test drive the new model.	ちょうどいいね。新型の試乗してってもらうね。
Good. Now go down with it.	じゃ下ろす。
Had I had a little more money, I would have bought it.	もうすこしお金を持っていたら、それを買っただろう。
Had I known about it, I would have told you.	もし私がそのことを知っていたら、君に話していただろうに。
Had I known it, I would have told you.	知っていれば教えてあげたんだけど。
Had I known it, I'd have told you about that.	もしそれを知っていたらなら、私はその事をあなたに話しただろう。
Had you run all the way, you'd have got there in time.	もし君がずっと走っていたら、そこへ間に合って着いただろうに。
Hanako and I replied.	花子ちゃんとあたしが返事をする
Hand in your papers.	答案を出して下さい。
Hand in your papers.	答案を提出せよ。
Hand it over. That's all you've got?	出せ。他にないのか。
Hand me that book, please.	その本を渡してください。
Hands off.	触るな！
Hands up!	両手をあげろ！
Haruki doesn't have much money with him.	春樹はあまりお金を持っていない。
Has John returned to America for good?	ジョンは永久にアメリカに戻ってしまったのですか。
Have him come.	彼に来てもらえ。
Have them send you an application form over the Internet.	インターネットで願書を取り寄せるといいよ。
Have you been here before?	初診の方ですか。
Have you been here since?	それ以来こちらに来られたことがありますか。
Have you been in Japan since last month?	あなたは先月から日本にいますか。
Have you been to London before?	ロンドンへ行ったことがありますか。
Have you done with the paper?	もう新聞を読み終わりましたか。
Have you got a lighter?	ライター持ってる？
Have you got through with the paper?	新聞はおすみになりましたか。
Have you known her since 1990?	あなたは１９９０年から彼女を知っているのですか？
Have you known him for a long time?	彼と知り合ってもう長いのですか。
Have you lived in Sasayama since last year?	あなたは去年から篠山に住んでいますか。
Have you read the leading article in today's paper?	今朝の新聞の社説を読みましたか。
Have you read today's paper?	あなたは今日の新聞を読みましたか。
Have you read today's paper?	今日の新聞は読みましたか。
Have you tried that store?	あの店は行ってみましたか。
Haven't I seen you before?	これまでにお会いしたことがありませんでしたか。
Haven't you got any money?	君はお金をいくらかお持ちではありませんか。
Having visited Rome many times, he knows about it well.	何度もローマを訪れたことがあるので、彼はローマをよく知っている。
He acted as my guide.	彼は私の案内をしてくれた。
He acted as our guide.	彼がわたしたちの案内役をつとめた。
He acted like he owned the place.	彼が大きな顔をしていた。
He acted well in Hamlet.	彼は「ハムレット」で好演した。
He added 13 pages to the Link page.	彼がＬｉｎｋページに１３のページを追加しました
He and I share a room.	彼と私は同じ部屋です。
He asked $5 for it.	彼はそれに五ドルを請求した。
He asked Nancy if she was free the next day.	彼はナンシーに明日ひまですかと尋ねた。
He asked for food.	彼は食物をくれと頼んだ。
He asked for money.	彼はお金が欲しいと言った。
He asked for money.	彼はお金を求めた。
He asked for more money.	彼はさらにお金を要求した。
He asked for some money.	彼は金をくれと頼んだ。
He asked for the money.	彼は金がほしいといった。
He asked her if she knew him.	彼は彼女に自分を知っているかと尋ねた。
He asked her if she was Jane.	彼は彼女にあなたはジェーンかと尋ねた。
He asked her where she lived.	彼は彼女にどこに住んでいるかを尋ねた。
He asked if I like Chinese food.	彼は中華料理がすきかたずねた。
He asked if I liked Chinese food.	彼は私に中華料理が好きかどうかたずねた。
He asked me about my new job.	彼は私の新しい仕事について尋ねた。
He asked me for help.	彼は私に助けを求めてきた。
He asked me for some money.	彼は私に金をいくらか要求した。
He asked me for some money.	彼は私に金をくれと言った。
He asked me if I had found it.	彼は私がそれを見つけたかどうか聞いた。
He asked me to help him.	彼は私に助けてと頼んだ。
He asked me what I had bought.	彼は私に、何を買ったのかと尋ねた。
He asked me what I needed.	彼は私に、私が何を必要としているかを尋ねた。
He asked me what had become of her.	彼女はどうなったのだい、と彼は私に尋ねた。
He asked me what my name was.	彼は私に何という名前ですかとたずねた。
He asked me when I was going to buy a new car.	私がいつ新車買うつもりかと彼はたずねた。
He asked me where she lived.	彼は私に、彼女はどこに住んでいるのかと尋ねた。
He asked me which way to go.	彼は私にどっちへ行けばいいのか尋ねた。
He asked me who I was.	彼は、私に、あなたは誰ですか、と尋ねました。
He asked me who that man was.	彼は私に、その男は誰かと尋ねた。
He asked the man to help him.	彼はその男に助けてくれるように頼んだ。
He asked us what we wanted.	彼は私たちになにが欲しいか尋ねた。
He asked ～ and me for help.	彼が〜と私に救済を頼んだ
He asks the state for X.	彼がXを国に求めます
He bought a small house in Kyoto.	彼は京都に小さな家を買った。
He bought as many books as he liked.	彼は好きなだけの本をすべて買った。
He called at my house.	彼は私の家に立ち寄った。
He called her every other day.	彼は彼女に一日おきに電話した。
He came back before eight.	彼は８時前に帰ってきた。
He came down in the world.	彼は落ちぶれた。
He came here before school was over.	彼は学校が終わる前にここに来た。
He came in person.	彼本人がやってきた。
He came in while we were at table.	食事中に彼が入ってきた。
He came into my room.	彼は私の部屋に入ってきた。
He came into my room.	彼は私の部屋へ入ってきた。
He came into the room.	彼が部屋に入ってきた。
He came into the room.	彼は部屋に入ってきた。
He came out of the room at last.	彼がついに部屋から出てきた。
He came out of the room.	彼は部屋から出てきた。
He came running into the room.	彼は走って部屋に入ってきた。
He came running into the room.	彼は走りながら部屋へ入ってきた。
He came running.	彼は走りながら来た。
He came to New York in order to look for a job.	彼は職を探しにニューヨークに来た。
He came to Tokyo at the age of three.	彼は三才のとき東京に来た。
He came to Tokyo at the age of three.	彼は３歳のときに東京に来た。
He came to see me in a different light.	彼は私を違った観点から見るようになった。
He came up to my room.	彼は私の部屋へ上がってきた。
He can do it well, and you can do it even better.	彼はそれをうまくやれる、君ならなおさらだ。
He can drive a car.	彼は車の運転ができる。
He can drive a car.	彼は運転をすることが出来ます。
He can have some good quality time here.	彼がここでは充実した時間を過ごすことができる
He can't be under thirty.	彼が３０才より若いはずがない。
He can't be under thirty.	彼は３０以下のはずはない。
He can't keep up with the times at all.	彼が全然時代の波に乗れません
He can't read English, much less German.	彼は英語が読めない。ましてやドイツ語はなおさら読めない。
He can't read French, much less write it.	彼はフランス語を読めない。まして書くことはできない。
He checked in at a good hotel.	彼はいいホテルにチェックインした。
He checked out a book from the library.	彼が図書館で１冊の本を借りた
He checked out of the hotel.	彼は精算をしてホテルを出た。
He checks the contents.	彼がその内容をチェックする
He comes back from Sydney today.	彼がシドニーから戻ってくるのは今日です。
He comes here every five days.	彼は五日に一度ここへ来ます。
He comes here every three days.	彼は３日ごとにここへ来る。
He comes of good stock.	彼は良い家柄の出だ。
He comes to visit us every now and then.	彼は時々私たちを訪ねてくる。
He compares product prices.	彼が商品の価格を比較する
He could not go to college.	彼は大学に行けなかった。
He couldn't get the job.	彼はその仕事をやらせてもらえなかった。
He did a check on the quality.	彼は主要点を点検した。
He did as I told him.	彼は私に言われたとおりにやった。
He did it as he had been told.	彼は言われたとおりにそれをやった。
He did it for the good of the community.	彼は社会によかれと思ってそれをした。
He did it the way I told him to.	彼は私が言うとおりにした。
He did more research into that way of doing it.	彼がそのあり方にさらに検討を加えた
He did not get any game.	彼には獲物が何もなかった。
He did not get any game.	獲物がとれなかった。
He did not know what to say.	彼はなんと言ってよいかわからなかった。
He did not know what to say.	彼は何と言ってよいかわからなかった。
He did not know what to say.	彼は何と言ってよいのやらわからなかった。
He did not say a word to us.	彼は私たちに一言も言わなかった。
He did not say so.	彼はそうは言わなかった。
He did not so much as say good-by to me.	彼は私にさよならさえ言わなかった。
He did right.	彼は正しく行動した。
He did run.	彼は走った。
He did say so.	彼は確かにそう言った。
He did what he had been told.	彼は言われたことをした。
He did what he was told.	彼は言われた通りにした。
He didn't ask their name.	彼はその人の名前を聞かなかった
He didn't even look over the papers.	彼は書類に目を通しておくことさせしなかった。
He didn't live to say another word.	彼から２度と言葉は聞かれなかった。
He didn't say a word about it.	彼はそれについては一言も言わなかった。
He didn't say a word.	一言も彼は口にしなかった。
He didn't say a word.	彼は一言も言わなかった。
He didn't see that many people.	彼があまり多くの人には会わなかった
He didn't show up at the party.	彼はパーティーに出席しなかった。
He didn't study at all.	彼は全然勉強しなかった。
He does not come here every day.	彼は毎日ここへくるとは限らない。
He does not have to do this.	彼はこのことをしなくてもよい。
He does not know English, much less French.	彼は英語を知らない。フランス語はなおさらのことだ。
He does not know how to drive a car.	彼は車の運転の仕方を知らない。
He does not live in Sendai.	彼は仙台に住んではいない。
He does not live there any more.	彼はもうそこには住んでいません。
He does run.	彼は走る。
He does the work of one week in a day.	彼が１日で１週間分の仕事をやります
He doesn't come here every day.	彼は毎日ここへ来るわけではない。
He doesn't go to the office on Saturday.	彼は土曜日には会社に行かない。
He doesn't have any friends.	彼には友達が一人もいない。
He doesn't have long to live.	あの人はあまり先が長くない。
He doesn't have the time to play cards.	彼はトランプをするときがない。
He doesn't have to go to school today.	彼は今日は学校に行かなくてもよい。
He doesn't have to go to school today.	彼は今日は学校へ行かなくてもいい。
He doesn't have to go to school.	彼は学校へ行かなくてもよい。
He doesn't have what it takes to make it around here.	彼はここでうまくやっていくには何が必要かわかっていません。
He doesn't know English at all.	彼は英語をまったく知らない。
He doesn't know French at all.	彼はフランス語はぜんぜん知らない。
He doesn't know any better.	彼はそれぐらいの知恵しかない。
He doesn't know both of us.	彼は私たちを二人とも知っているわけではない。
He doesn't know me.	彼は私を知りません。
He doesn't know much about Japan.	彼は日本について良く知りません。
He doesn't read many books.	彼はあまり本を読まない。
He doesn't work here now, but he used to work here.	彼は今ではここで働いていないが、以前は働いていた。
He drives a car, doesn't he?	彼は車を運転しますよね？
He drove down to the hotel.	彼はホテルのほうへ車で行った。
He drove to school.	彼は車で学校へ行った。
He finds X in the story.	彼がXを、物語のなかに見出だす
He found a job with a food company.	彼は食品会社に就職した。
He found me a good job.	彼は私によい仕事を見つけてくれた。
He found the box under the table.	彼はテーブルの下にその箱を見つけた。
He gave her what little money he had.	彼はなけなしの金を全部彼女にあげた。
He gave me a present.	彼は私にプレゼントをくれた。
He gave me a record.	彼は私にレコードをくれました。
He gave me food and money as well.	彼は食べ物と、その上にお金もくれた。
He gave me some money.	彼は私にいくらかのお金をくれた。
He gave me this in return.	彼はお返しにこれをくれた。
He gave me what little money he had about him.	彼は少ないながらも持ち合わせていた金を全部私にくれた。
He gave me what little money he had.	彼は持っている無け無しのお金を私にくれた。
He gave me what money he had with him.	彼は持ち合わせていた金を全部私にくれた。
He gave me what money he had.	彼は私に彼が持っているお金を全部くれた。
He gave not a word in reply.	彼は一言も答えなかった。
He gets the most out of the information.	彼がこれらの情報を活用する
He gives me a phone call every now and then.	彼は時々電話をくれます。
He goes there every day.	彼は毎日そこへ行く。
He goes to Karuizawa every year.	彼は毎年軽井沢へ行く。
He goes to school to study every day.	私は毎日勉強するために学校へ行く。
He goes to the library to read books.	彼は本を読むために図書館へ行きます。
He goes to the office by car.	彼は会社に車で行く。
He got a job at the Law Library.	法学部の図書館で仕事を見つけた。
He got a new job.	彼に新しい勤め口があった。
He got into the car and drove off.	彼はその車に乗って行ってしまった。
He got out from under the car.	彼は車の下から出てきた。
He got paid under the table.	彼は裏金をもらいました。
He had a bigger problem than that.	彼がそれ以前の問題に悩んだ
He had a good look at the papers.	彼は入念に書類を見た。
He had a large family to support.	彼には扶養家族が多かった。
He had a share in completing the job.	彼はその仕事を完成するのに貢献した。
He had access to the papers.	彼はその書類を見る地位にあった。
He had been there before.	彼は以前そこに行った事があった。
He had been there for ten years before he came to Kyoto.	彼は京都に来る前に１０年間そこにいました。
He had friends all over the world.	彼は世界中に友達がいる。
He had much to do with the project.	彼はその計画におおいに関係があった。
He had no friend to help him.	彼には助けてくれる友がいなかった。
He had no house to live in.	彼は住む家がなかった。
He had no money and so could not buy any food.	彼はお金がなかったので、食べ物を買うことができなかった。
He had no money with him then.	彼はそのとき、お金の持ちあわせがなかった。
He had no money.	彼はお金がなかった。
He had started going back to Mr. Yamada's class in 2002.	彼が０２年から再び山田先生の教室に通った
He had to go without food for days.	彼は何日も何も食べずに過ごさねばならなかった。
He had to work even on Sunday.	彼は日曜でさえ働かねばならなかった。
He had to, but didn't want to, do the job.	彼はその仕事をせざるを得なかったが、したくはなかった。
He had to, but didn't want to, do the job.	彼は仕事をせざるはえなかったが、したくはなかった。
He had, I thought, no right to do that.	彼はそんなことをする権利がないと私は思った。
He handed a note to me.	彼は私に書き物を手渡した。
He handed the salesclerk the money.	彼は店員に金を渡した。
He has a car which I gave to him.	彼は私があげた車を一台もっている。
He has a car which I gave to him.	彼は車を一台持っているが、それは私があげたものだ。
He has a family to provide for.	彼は家族を養わなければならない。
He has a family to support.	彼には養うべき家族がいる。
He has a gift for music.	彼には音楽の才能がある。
He has a good hand.	彼は手がよい。
He has a good school record.	彼の学校の成績はいい。
He has a large family to provide for.	彼には扶養すべき大家族がある。
He has a large family to provide for.	彼には養うべき大家族がある。
He has a large family to support.	彼には養わなければならない大家族がある。
He has a large family to support.	彼は多くの扶養家族がいる。
He has a large family to support.	彼は養うべき大家族を持っている。
He has a large family to support.	彼は養っていかなければならない大家族がある。
He has a large family to support.	養っていかねばならない大家族がいるのです。
He has a large family.	彼は大家族だ。
He has a large family.	彼は扶養家族が多い。
He has a large house and two cars.	彼は大きな家と２台の車をもっている。
He has a large store of food.	彼は食料の蓄えは十分にある。
He has a little money.	彼はお金を少し持っています。
He has a new car and an old car.	彼は新しい車と古い車を持っています。
He has access to the stored information.	彼はその蓄えられた情報に近づく資格がある。
He has acted on TV many times.	彼はテレビの劇に何度も出演してきた。
He has been doing research for fifteen years.	彼が１５年間の研究を重ねた
He has been in Hokkaido before.	彼は北海道にいたことがある。
He has been keeping company with Ann for three months.	彼はアンと三ヶ月付き合っている。
He has been keeping company with Mary for three years.	彼は三年間メアリーと交際している。
He has been loved by all.	彼はみんなにずっと愛されています。
He has been studying French for eight years.	彼は８年間フランス語を勉強している。
He has been to Europe many times.	彼は何度もヨーロッパに行ったことがある。
He has been to Switzerland before.	彼は前にスイスへ行ったことがある。
He has been to many places.	彼はあちこちに行ったことがある。
He has been well off since he started this job.	彼はこの仕事を始めてから暮らし向きがよい。
He has been working on a new book for two months.	彼は２ヶ月間、新しい本に取り組んでいる。
He has big hands.	彼は手が大きい。
He has changed my life.	彼は私の人生を変えてしまった。
He has come back from the office.	彼は事務所から帰ったばかりだ。
He has come down in the world.	彼はおちぶれてしまった。
He has completed a four-year course.	彼が四年間の課程を修了しました
He has designs on your property.	彼はひそかにあなたの財産を狙っていますよ。
He has experience as well as learning.	彼は学問ばかりでなく経験もある。
He has gone to Italy to study music.	彼は音楽の勉強のため、イタリアに行った。
He has little money with him.	彼は今ほとんどお金を持ち合わせていない。
He has lived here for one week.	彼は１週間前からずっとここに住んでいます。
He has lived here since he was five years old.	彼は５歳の時からここに住んでいる。
He has made me what I am today.	彼は私を現在の私にした。
He has made the company what it is today.	彼がその会社を今日の会社にした。
He has more books than I do.	彼は私よりもたくさん本を持っている。
He has more books than he can read.	彼は読み切れないほどたくさん本を持っている。
He has more experience on the job than I.	彼は仕事の上では私の先輩だ。
He has more money than he can use.	彼は金がうんとあって使えない。
He has more money than is needed.	彼は必要以上もお金を持っている。
He has more than 8 years experience in the field.	彼がその業務に８年以上の実務経験を有する
He has much more money than I have.	彼はぼくよりたくさんお金を持っている。
He has no family to support.	彼には養わなければならない家族はいない。
He has no friend to play with.	彼には一緒に遊ぶ友達がいない。
He has no house in which to live.	彼には住む家がない。
He has no house to live in.	彼には住む家もない。
He has no money.	彼はお金を持っていません。
He has no more than five English books.	彼は多くても５冊しか英語の本を持っていない。
He has no more than one hundred books.	彼はわずかに１００冊の本しか持っていない。
He has no room to study in.	彼には勉強する部屋がない。
He has not a little experience.	彼には少なからぬ経験がある。
He has not only learning but experience.	彼は学識ばかりでなく経験もある。
He has not seen much of the world.	彼はあまり世間を知らない。
He has not written to them for a long time.	彼は長い間彼らに手紙を書いていませんでした。
He has not written to them for a long time.	彼らには長い間彼から便りが無い。
He has not written to them for a long time.	彼らは彼から長い間便りがない。
He has not written to us since last February.	彼は去年の２月以来私達に便りをしてこない。
He has only to ask for help.	彼は助けを求めさえすればいいのだ。
He has read as many as 50 books in the last two weeks.	彼はこの２週間に本を５０冊も読んだ。
He has seen much of the world.	彼は人生経験が豊富である。
He has sold shares in Company A.	彼がＡ社の株式を売却しました
He has the least money of us all.	彼は私たちすべての中で一番お金を持っていない。
He has three times as many books as I have.	彼は私の三倍本を持っている。
He has to take two science classes.	彼は理科を２科目とらなければならない。
He has visited France three times.	彼はフランスを３回訪れたことがある。
He has visited most countries in Europe.	彼はヨーロッパのたいていの国々を訪ねた。
He hasn't been here long.	彼は今ここへ来たところだ。
He hasn't had much education.	彼はあまり教育を受けていない。
He hasn't told me when he will return.	いつ帰るか彼は私にいいませんでした。
He is a big man in the company.	彼は会社の重要人物だ。
He is a different person from the one we are looking for.	彼は私達が探している人とは別人だ。
He is a good man for the job.	彼は、その仕事に適した男だ。
He is a man of action.	彼は行動力がある。
He is a man of action.	彼は行動力のある人です。
He is a man of action.	彼は行動家だ。
He is a man of education.	彼は教育のある人だ。
He is a man of great credit in our city.	彼は我々の市では大変評判のいい人だ。
He is a man with no standards.	彼は基準を持たない男だよ。
He is a member of the board of the company.	彼は同社の取締役です。
He is about my age.	彼はほぼ私の年です。
He is about my size.	彼は私くらいの大きさだ。
He is about your age.	彼は大体あなたぐらいの年齢です。
