I try.	頑張ってみる。
What has happened to him?	彼はどうなっただろうか。
He came home very late.	彼はたいへん遅く帰ってきた。
He calls the boy Tom.	彼はその少年をトムと呼んでいる。
He lay without movement.	彼はじっと横になっていた。
Does he live near here?	彼はこの近くに住んでいるの？
He did an amount of work.	彼はかなりの仕事をした。
He appears to know Ann.	彼はアンを知っているようだ。
I felt drawn toward him.	彼の魅力に引きつけられた。
He did not get any game.	彼には獲物が何もなかった。
I'm on good terms with him.	彼とは親しい間柄だ。
Only he read the letter.	彼だけがその手紙を読んだ。
I remember what he said.	彼が言ったことを思い出す。
Try to act your age.	年齢相応に振る舞うようにしなさい。
I continued reading the book.	本を読み続けた。
The whole town lay sleeping.	町中が眠っていた。
I fear that we are late.	遅れるのではないかと思う。
Better late than never.	遅くともやらないよりはまし。
Someone is watching you.	誰か君をじっと見ているよ。
Someone is calling you.	誰かがあなたを呼んでいます。
There were lots of people.	大ぜいの人たちがいた。
Did you want anything else?	他に何かありますか。
I'd like to see my son.	息子の見舞いに来たのですが。
Don't leave the window open.	窓をあけておくな。
Fight with all your might.	全力をあげてたたかえ。
All of us got into the car.	全員その車に乗った。
War concerns us all.	戦争は我々すべてにかかわることだ。
The teacher is coming along.	先生がやって来る。
Do you get enough sleep?	睡眠は十分とっていますか。
It made my hair stand on end.	身の毛もよだつ。
Prices are lower in Kobe.	神戸は比較的物価が安い。
Truth needs not many words.	真理は多言を要せず。
It's too early to go to bed.	寝るには早すぎる。
You may as well go to bed now.	寝た方が良い。
Food is necessary for life.	食物は生命に必要だ。
You must not eat too much.	食べ過ぎてはいけない。
The boy came back to life.	少年は息を吹き返した。
A girl appeared before me.	少女が私の前に現れた。
I'd like to return a car.	車を返却したいのですが。
How many cars do you have?	車を何台お持ちですか。
This is how it happened.	事の起こりはこうなんです。
Draw a line on the paper.	紙に線を１本引きなさい。
I'm interested in history.	私は歴史に興味がある。
I'm interested in history.	私は歴史に関心がある。
I usually go to bed at ten.	私は普通十時に寝る。
I usually get up at seven.	私は普通七時に起きる。
I like dark red better.	私は濃い赤色のほうが好きだ。
I am in poor state of health.	私は体調が悪い。
I want to improve myself.	私は私自身を修正したい。
I am free from work today.	私は今日は仕事がない。
I gave an opening address.	私は開会の辞を言った。
I want something to drink.	私は何か飲物が欲しい。
I am quite all right now.	私はもう全く大丈夫です。
I'm quite better now.	私はもうすっかり病気がなおった。
I can't eat any more.	私はもうこれ以上は食べられない。
I would rather stay here.	私はむしろここにいたい。
I usually get up at six.	私はたいてい６時におきる。
I found the book easy.	私はその本が簡単だとわかった。
My brother is out of work.	私の兄は失業している。
Give me something to eat.	私に何か食べ物を下さい。
Give me something to drink.	私に飲み物を下さい。
I am on good terms with him.	私と彼は仲がいい。
We visited our old school.	私たちは母校を訪れた。
We have no school today.	私たちはきょう授業がない。
I'm trying to remember.	思い出そうとしているんだよ。
The boy fell off the bed.	子供がベッドから落ちた。
A fire broke out last night.	昨晩火事があった。
I remember the first time.	最初のころを思い出す。
I feel a little bad today.	今日は少し体調が悪い。
I feel much better today.	今日はずっと具合がいい。
He is not himself today.	今日はいつもの彼ではない。
Until the end of the week.	今週末までなんだけど。
Until the end of the week.	今週の終わりまでです。
He's out of town on business.	彼は出張中です。
Health means everything.	健康は何よりも重要である。
You ran a red light.	君は赤信号を無視して走りましたね。
You must not tell a lie.	君は嘘をついてはいけない。
You must go to bed now.	君はもう寝なければならない。
Choose the one you like.	君の好きなのを選びなさい。
Prices are high these days.	近ごろは物価が高い。
Let your hair down a little.	気を楽に持とうよ。
Easy come, easy go.	楽に得たものは、すぐに失ってしまう。
I'm looking forward to it.	楽しみにしております。
We stood face to face.	我々は向かい合って立っていた。
We will fight to the last.	我々はあくまでも闘う。
I'm just going to stay home.	家にいる予定です。
What time do you go to bed?	何時に寝るのですか。
What would you like to eat?	何が食べたいですか。
I don't want to go alone.	一人で行くのはいやです。
Did you come here alone?	一人でここに来たのですか。
You should stay in bed.	安静にして寝ていてください。
Bad money drives out good.	悪貨は良貨を駆逐する。
I was at a loss for an answer.	挨拶に困った。
"Now, boys." he said.	やあ、みんな。と彼は言いました。
May I start eating now?	もう食べ始めてもいいですか。
I can't walk another step.	もう一歩も歩けないよ。
I can't walk any farther.	もうこれ以上歩けないよ。
I can't walk any further.	もうこれ以上は歩けない。
Bob can drive a car, too.	ボブも車を運転できます。
Bob and Tom are brothers.	ボブとトムは兄弟である。
I will try it again.	ぼくはそれをもう一度やってみよう。
How long have you waited?	どのくらい待ちましたか。
They are all of a price.	それらはみんな同じ値段だ。
That is quite possible.	それは大いにありうることだ。
That's quite another thing.	それは全く別の事だ。
That's not my concern.	それは私の知ったことではない。
It begins at six-thirty.	それは６時半に始まります。
I know that much myself.	それくらい僕も知っている。
Let's wait around for her.	その辺で彼女を待とう。
It is long way to the town.	その町は遠いですよ。
The boy feared the dark.	その男の子は暗闇を恐れた。
It'll be too late then.	その時では遅すぎるでしょう。
I object to going there.	そこへ行くことには反対だ。
Who is standing there?	そこに立っているのは誰ですか。
John is my younger brother.	ジョンは私の弟です。
What do you want to eat?	じゃ、何が食べたいですか。
Will you sign it for me?	サインしてもらえるかしら。
Well begun is half done.	さいさき良ければ半ば成功。
Now let's begin the game.	さあ試合を始めましょう。
All is completed with this.	これで全てが完成だ。
I made this food myself.	この料理は私が作りました。
This question isn't easy.	この問題は簡単ではない。
This land is my property.	この土地は私の所有物だ。
This water is good to drink.	この水は飲めます。
This plant is good to eat.	この植物は食べられる。
Who is this letter from?	これは誰からの手紙ですか？
This car is as good as new.	この車は新品同様だ。
This car is my father's.	この車は私の父のものです。
Choose between these two.	この２つから選びなさい。
Here is a letter for you.	ここに君宛の手紙がある。
This place has everything.	ここには何でもあるよ。
Did you have a good sleep?	ぐっすり眠れましたか。
I like the way you walk.	かっこいい歩き方をするね。
I've heard a lot about you.	お噂は聞いています。
My son is just idling.	うちの息子は遊んでばかりいる。
That boy's hair is black.	あの少年の髪は黒いです。
Yours is not bad, either.	あなたも悪くありません。
Can you drive a car?	あなたは自動車の運転ができますか。
What long hair you've got!	あなたの髪は長いわね。
What's your blood group?	あなたの血液型は何ですか。
What does USSR stand for?	ＵＳＳＲは何の略ですか。
I'll stay here until ten.	１０時までここにいます。
More efforts are needed.	さらにいっそうの努力が必要だ
I am most concerned about X.	私はXに一番気を使う
X will come into view quickly.	Xがすぐ目に入る
He will never try that.	彼はそれに絶対に手を出しません
The value is shown in figure 1.	値を表１に示す
That is really bad for you.	それはホントに体に悪い
He will draw a line there.	彼がそこに一本の線を引く
Everything is included here.	この中にすべてを含む
X has a significant influence.	Xの影響が大きい
It records all information.	すべての情報を記録する
540 courses are offered.	５４０の講座を開講しています
Let's go to eat together.	一緒に食べに行きましょう。
I stayed up late last night.	夕べ遅かったんです。
I really feel bad about it.	本当にごめんなさいね。
I like walking at night.	僕は夜散歩するのが好きです。
She was run over by the car.	彼女は車にひかれた。
She appears well today.	彼女は今日は調子が良さそうだ。
She looks like a teacher.	彼女は教師のように見える。
She did the work alone.	彼女はその仕事を一人でやった。
She always stood by me.	彼女はいつも私を助けてくれた。
She had her only son die.	彼女は１人息子に死なれた。
Her time is drawing near.	彼女の死期は近づいている。
It is difficult to see her.	彼女に会うのは難しい。
She may be our teacher.	彼女が私達の先生かもしれない。
Their son's name is John.	彼らの息子の名はジョンだ。
They have a lot in common.	彼らには、共通点が多い。
He works even late at night.	彼は夜遅くでも働く。
He has a walk every morning.	彼は毎朝散歩をする。
He objected to our plan.	彼は僕たちの計画に反対した。
He holds a lot of land.	彼は土地をたくさん持っている。
He accepted our offer.	彼は私たちの申し出を受け入れた。
He had to stay in bed.	彼は寝ていなければならなかった。
He tried opening the door.	彼は試しにドアを開けた。
He took no notice of me.	彼は私を気にも留めなかった。
He offered to help me.	彼は私に手伝ってくれるといった。
He lives here all alone.	彼は一人でここに住んでいる。
He has taken on bad ways.	彼は悪に染まってしまった。
He has already gone to bed.	彼はもう寝てしまった。
He reads a lot of books.	彼はたくさんの本を読みます。
He has a lot of money.	彼はたくさんのお金を持っている。
He is not always late.	彼はいつも遅刻するわけではない。
He usually gets up at six.	彼はいつも６時に起きる。
He was more or less drunk.	彼はいくぶん酔っていた。
He crossed over to England.	彼はイギリスへ渡った。
She is everything to him.	彼にとって彼女は全てです。
He and I walked together.	彼と私はいっしょに歩いた。
Your age is beginning to tell.	年には勝てない。
Choose between the two.	二つの中から一つを選びなさい。
This is a difficult situation.	難しい状況です。
Reading improves the mind.	読書は知性を向上させる。
My head has begun to clear.	頭がはっきりしてきた。
My brother is still sleeping.	弟はまだ寝ている。
Get up early in the morning.	朝早く起きなさいよ。
No one took notice of him.	誰も彼に気づかなかった。
Are you looking for someone?	誰かをお探しですか。
You've really helped me a lot.	大助かりでした。
A face appeared at the window.	窓に顔が現れた。
Sooner begun, sooner done.	早く始めれば早く終わる。
The choice is all up to you.	選択は全く君次第だ。
I took a day off last week.	先週一日休みを取った。
Production is turning down.	生産が落ち始めている。
A few days later, he came.	数日後、彼はやってきた。
Plants die without water.	植物は水が無ければ枯れる。
You have done a very good job.	上出来でしたね。
All the boys looked down.	少年たちはみな見下ろした。
I can't read small letters.	小さい文字が読めない。
Is there any help available?	助けてもらえますか。
The letter runs as follows.	手紙の文面は次の通り。
How I wish I had a car.	車があればどんなによいだろう。
She knows herself well.	自分のことがよくわかっている。
Do a better job next time.	次回はもっとうまくやれ。
How did the game come out?	試合はどうなりましたか。
I take a walk every morning.	私は毎朝散歩します。
I usually go to bed at nine.	私は普通九時に寝る。
I usually get up at eight.	私は普通８時に起きます。
I gave in to her demands.	私は彼女の要求に屈服した。
I got a letter from her.	彼女から手紙をもらったんだ。
I stayed at home last night.	私は昨夜、家にいた。
I got up late this morning.	私は今朝、遅く起きた。
I'm looking forward to it.	私は楽しみにしています。
I want something to eat.	私は何か食べるものが欲しい。
I want something to drink.	私は何か飲む物がほしい。
I don't like to be alone.	私は一人でいるのが嫌いだ。
I am not concerned with it.	私はそれには関係ない。
I found the book easy.	私はその本がやさしいとわかった。
I am remembering the word.	私はその単語を暗記中だ。
I usually get up at six.	私はいつも６時に起床します。
In my beginning is my end.	私の始めに終わりがある。
Do you wish me to help?	私に手伝ってもらいたいですか。
He began to look for a job.	仕事を捜し始めました。
What happened last night?	昨夜、何があったんですか。
I couldn't sleep last night.	昨晩は眠れなかった。
Was it difficult to make?	作るのは難しかったですか。
Do you remember Mr Saito?	斎藤さんを覚えていますか。
Let's begin at the beginning.	最初から始めよう。
Let's eat in this evening.	今晩は家で食べましょう。
You can use my car today.	今日私の車を使っていいよ。
How are you feeling today?	今日は気分はいいですか。
Which day of the week is it?	今日は何曜日ですか。
I feel rather off today.	今日はあまり調子が良くない。
How are you feeling today?	今日の体調はどうですか。
Bring me today's paper.	今日の新聞を持ってきて欲しい。
How are you feeling today?	今日の気分はどうですか。
When will you next visit?	今度はいつ訪ねてくるのか。
What did you do this morning?	今朝は何をしたの？
I'm not available right now.	今は手が放せません。
Do you have an address?	行き先の住所はおわかりですか。
I'll call him back later.	後でまた彼に電話をします。
It's easier said than done.	言うは易く行うは難し。
Who are you waiting for?	君は誰を待っているのですか。
You have no claim on me.	君は私に要求する権利はない。
You lied to me, didn't you?	君は私に嘘をついたね。
Your son has come of age.	君の息子も青年になったね。
Your English is improving.	君の英語は上達している。
Do get up, it's very late.	起きなさい、もう遅いよ。
School begins on April 8.	学校は４月８日から始まる。
Don't be late for school.	学校に遅れてはいけません。
What would you like to eat?	何を召し上がりますか。
Give me something to drink.	何か飲むものを下さい。
May I offer you a drink?	飲み物を差し上げましょうか。
I feel like having a drink.	一杯やりたいきがする。
Come home before dark.	暗くならないうちに帰宅しなさい。
Keep away from bad company.	悪友仲間とつきあうな。
Do you think it a bad thing?	悪いことだと思うか。
We walked among the trees.	私たちは木の間を歩いた。
All right. It's a deal.	よし、これで取引はまとまった。
We have our backs to the wall.	もう後がないぞ。
Try doing it once more.	もう一度それをやってみなさい。
Mayuko reads a good deal.	マユコは本をたくさん読む。
I think I'll come back later.	また後ほど来ます。
Who else is gone today?	ほかにきょう、誰が欠席ですか。
Paul offered a new plan.	ポールは新しい案を提案した。
The party broke up late.	パーティーはおそく散会した。
Which shall I begin with?	どちらから始めましょうか。
What papers do you take?	どこの新聞をとっていますか。
I want someone to talk to.	だれか話し相手がほしい。
Actually, that's what I thought.	だと思った。
That's easy for you to say.	そんなこと言ったって。
Leave it off the list.	それをリストから外してください。
It is a difficult problem.	それは難しい問題である。
The beginning showed it.	それは最初から分かっていた。
We got a good price for that.	それは高く売れた。
Is it near your house?	それは君の家の近くにありますか。
It serves our purpose.	それは我々の目的にかなっている。
The room has two windows.	その部屋には窓が２つある。
The program is on the air.	その番組は今放送中です。
How does the paper feel?	その紙はどんな手触りですか。
Can you take on the job?	その仕事引き受けてくれるか。
That's why I was late.	そういうわけで遅くなったのです。
John is an American boy.	ジョンはアメリカの少年です。
When will the show begin?	ショーはいつ始まりますか。
Then I'll come again later.	じゃまた後から来ます。
Jim got down from the tree.	ジムは、木から降りた。
Are you being waited on?	ご用をお伺いしておりますか。
This time I'll try it.	こんどは私がそれをやってみよう。
This is an interesting story.	これは面白い話だ。
This is an interesting book.	これは面白い本だよ。
This is an important theory.	これは大切な理論だ。
This is an important letter.	これは大切な手紙だ。
Let's keep in touch.	これからも連絡を取り合いましょうね。
This problem is too simple.	この問題は単純すぎる。
This book is easy to read.	この本を読むのは容易だ。
This book looks interesting.	この本は面白そうだ。
This book is easy to read.	この本は読むのに簡単だ。
This car is easy to drive.	この車は運転しやすいな。
Stay here and wait for him.	ここで彼を待ちなさい。
You've taken everything.	お前はすべてを奪っていった。
Would you care for drinks?	お飲み物はいかがですか。
I wish I had much money.	うんとお金があればいいのに。
I always walk to school.	いつも歩いて登校しているよ。
Until when are you staying?	いつまでご滞在ですか。
Always tell the truth.	いつでも本当のことを言いなさい。
Do you accept AMEX?	アメリカン・エクスプレスは使えますか。
What do they deal in?	あの人達はなにを商売にしているの。
The woman served her purpose.	あの女は用済みだ。
Can you drive a car?	あなたは車を運転する事ができますか。
Do you walk to school?	あなたは学校に歩いていきますか。
How long did you wait?	あなたはどのくらい待ちましたか。
You are an American boy.	あなたはアメリカの少年です。
I'll accept your offer.	あなたの申し出を承知しました。
Here is a letter for you.	あなたに手紙が来ています。
Do you have any brothers?	あなたには兄弟がいますか。
What does SFX stand for?	ＳＦＸとは何を表すのですか。
What does PTA stand for?	ＰＴＡは何を表していますか。
Draw a line from A to B.	ＡからＢまで線をひきなさい。
I can do it in a week.	１週間でそれをすることはできる。
It will be half of the amount.	２分の１の額とする
He made that a key word.	彼がそれをＫｅｙＷｏｒｄにする
Two figures will appear above.	上に２つ数字が出る
X was held in various regions.	Xが各地で行われた
Quite a lot of people came.	結構、多くの人が来ました
X has continued for 68 times.	Xが六十八回も続いた
Someone calls me like this.	こう、誰かが私を呼びます
He stays at home all the time.	彼がずっと家に居る
X happens quite often to me.	Xが私には良くあります
He appeared on live TV.	彼がテレビの生番組に出演しました
Several problems will occur.	幾つかの問題が生じます
It met certain standards.	それが一定の基準をクリアした
I'll do it by myself too.	自分でもそれをやってみます。
Rest one's theory on facts.	理論を事実に基づかせる。
I've made lots of friends.	友達もたくさんできました。
Everything is in good order.	万事順調にいっている。
You really did a good job.	本当によくやってくれたね。
Where is your mother, boy?	坊やおかあさんは何処だい。
Don't look down on the poor.	貧しい人を軽蔑するな。
He makes necessary changes.	彼は必要な変更を加える。
She stopped our fighting.	彼女は僕等の喧嘩を制止した。
She left the window open.	彼女は窓を開けっ放しにした。
She fell into a deep sleep.	彼女は深い眠りについた。
She made a man of a boy.	彼女は少年を立派な人間にした。
She had to go herself.	彼女は自分で行かねばならなかった。
She took me for my brother.	彼女は私を兄と間違えた。
Is she any better today?	彼女は今日いくらかいいですか。
She will make a good wife.	彼女はよい妻になるだろう。
She has a lot of money.	彼女はたくさんお金を持っている。
She lives quite close by.	彼女はすぐそばに住んでいる。
She can even tell lies!	彼女はうそをつくことさえできる。
What will happen to her?	彼女の身に何が起こるのだろう。
I know she is sleeping.	彼女が眠っている事を知っている。
They are paid by the week.	彼らは週給をもらっている。
They drove the car by turns.	彼らは交代で運転した。
Learning runs in their blood.	彼らは学者の血筋だ。
They are as poor as can be.	彼らはこの上なく貧乏だ。
Their team's name is NWO.	彼らのチーム名はＮＷＯです。
He has a kind expression.	彼は優しい顔付きをしている。
He drew on others for help.	彼は他人の援助に頼った。
He looks as poor as ever.	彼は相変わらず貧乏のようだ。
He started to go to bed early.	彼は早く寝始めた。
He has gone out for a walk.	彼は散歩に出かけました。
He is being very kind today.	彼は今日やけに親切だ。
He is being kind today.	彼は今日は親切に振る舞っている。
He is taking a day off today.	彼は今日お休みです。
He got up early this morning.	彼は今朝早く起きた。
He is now staying in Paris.	彼は今パリに滞在中です。
He goes to the office by car.	彼は会社に車で行く。
He deals with my company.	彼はわが社と取引をしている。
He is seeking a good job.	彼はよい仕事をさがしている。
He is such a difficult boy.	彼はとても気難しい子だ。
He tried to open the door.	彼はドアを開けようとした。
He was alone in the room.	彼はその部屋でひとりだった。
He was then a boy of ten.	彼はその時十歳の少年だった。
He walked past the house.	彼はその家を通り過ぎました。
He soon left the new job.	彼はすぐに新しい職を辞めた。
He stayed here for a while.	彼はしばらくここにいた。
He may wait no longer.	彼はこれ以上待てないかもしれない。
He's always late for class.	彼はいつも授業に遅れる。
He kept walking all the day.	彼は一日中歩き続けた。
He has a good school record.	彼の学校の成績はいい。
Try to keep up with him.	彼に遅れずについていきなさい。
Don't let him do it alone.	彼にそれを独りでさせるな。
I am on good terms with him.	彼とは仲のよい間柄だ。
I can't figure him out.	彼がどんな人物かよくわからない。
He can't have told a lie.	彼がうそをついたはずがない。
Come home before dark.	日が暮れないうちに帰ってきなさい。
Where does the answer lie?	答えはどこにあるんだろう。
I met my teacher on the way.	途中で先生に出会った。
I waited for her a long time.	長い間彼女をまった。
Better late than never.	遅くなっても何もないよりはまし。
Seek, and you will find.	探せ、さらば見いだすであろう。
Someone is at the front door.	誰かが玄関にいるよ。
My son shall do the work.	息子にその仕事をやらせよう。
