I want to have a talk with him about my future.	私は自分の将来について彼と話したい。
I want to have a talk with him.	彼と話がしたい。
I want to hear all your news.	最近君はどうしているか詳しい便りをください。
I want to let this room to a student.	私はこの部屋を学生に貸したい。
I want to look at the reference books.	参考書をみたいのですが。
I want to make you work harder.	私は君をもっと一生懸命働かせたいと思います。
I want to put this on house charge.	つけでお願いします。
I want to read as many English books as possible this year.	今年はできるだけたくさん英語の本を読みたいと思っている。
I want to see her by any means.	私は何とかして彼女に会いたい。
I want to see the director of the company.	私は社長に会いたいのです。
I want to see the movie again.	その映画をもう一度見たいな。
I want to see the movie.	私はその映画を見たい。
I want to see the streets.	街を見に行こう。
I want to see them again.	もう一度あの人たちに会いたいの。
I want to see you again.	君にまたお会いしたい。
I want to talk to her.	私は彼女と話したい。
I want to talk to him about it.	そのことで彼と話し合いたい。
I want to talk to you about something.	話したいことがあるのだけど。
I want to talk to you.	私はあなたと話がしたいなぁ。
I want you to come back early.	私はあなたに早く帰って来てもらいたい。
I want you to live more like a human being.	あなたのもっと人間らしく生きてほしい。
I want you to work harder.	君にもっとしっかり仕事をしてもらいたい。
I wanted to get a lot of money.	私はたくさんのお金を手に入れたかった。
I was a baby in those days.	当時私は赤ん坊だった。
I was a first year student last year.	わたしは去年一年生でした。
I was a high school student at that time.	当時私は高校生でした。
I was always good at English.	私はいつも英語が得意でした。
I was always told to study when I was a child.	子供のころしょっちゅう勉強しろと言われた。
I was asked a question in my turn.	今度は私が質問された。
I was asked a question in my turn.	今度は私の方が質問された。
I was banking on him to help me.	私は彼が私を助けてくれるものだと当てこんでいた。
I was banking on him to help me.	私は彼が私を助けてくれるものと当てにしていた。
I was born and brought up in Matsuyama.	私は松山に生まれて育った。
I was born and brought up in Tokyo.	私は東京で生まれ育った。
I was born and brought up in Tokyo.	私は東京生まれの東京育ちです。
I was born in 1960.	私は１９６０年生まれだ。
I was born in 1979.	私は１９７９年に生まれた。
I was born in America.	私はアメリカで生まれた。
I was born in Hiroshima in 1945.	私は１９４５年に広島で生まれました。
I was born in Kyoto in 1980.	私は１９８０年に京都で生まれた。
I was born in Kyoto.	私は京都で生まれた。
I was born in Osaka in 1977.	私は１９７７年に大阪で生まれた。
I was born in Osaka on March 5, 1977.	私は１９７７年３月５日に大阪で生まれた。
I was born in Osaka, but brought up in Tokyo.	私は大坂生まれですが、東京で育ちました。
I was born in Osaka, but was brought up in Tokyo.	私は大阪生まれですが、東京で育ちました。
I was born in Osaka.	私は大阪の生まれです。
I was born in Osaka.	私は大阪生まれです。
I was born in Tokyo in 1968.	私は１９６８年東京で生まれた。
I was born in Tokyo on the eighth of January in 1950.	私は１９５０年１月８日に東京で生まれました。
I was born in Yokohama.	私は横浜で生まれました。
I was born on April 3, 1950.	私は１９５０年４月３日に生まれた。
I was born on February 14, 1960.	生年月日は１９６０年２月１４日です。
I was born on January 2 in 1968.	私は１９６８年の１月２日に生まれた。
I was born on June 4, 1974.	私は１９７４年６月４日に生まれた。
I was born on March 22, 1962.	私は１９６２年３月２２日生まれです。
I was born on October 10, 1972.	私は１９７２年１０月１０日に生まれました。
I was born on the 22 of November 1948.	私は１９４８年１１月２２日に生まれました。
I was born on the 31st of May in 1940.	私は１９４０年５月３１日に生まれた。
I was born on the twenty-second of June in 1974.	私は１９７４年の６月２２日に生まれました。
I was born to love you.	あなたを愛する為に私は生まれた。
I was brought up in the country.	私は田舎で育てられた。
I was called into the office first, my name being at the head of the list.	私の名前がリストの一番上にあったため私が最初にオフィスに入るように呼ばれた。
I was chosen as a member of the team.	私はチームの一員に撰ばれた。
I was forced to go.	私はやむなく行った。
I was forced to sign my name.	私は無理矢理署名させられた。
I was forced to work on Sunday.	私は日曜日に働かされた。
I was in New York for a few days.	私は２、３日ニューヨークにいた。
I was in an IAA meeting.	私はＩＡＡのミーティングに行った。
I was in fact thirty-one at the time.	実のところ、当時は私は３１歳であった。
I was in fact thirty-one at the time.	実のところ、当時私は３１歳であった。
I was interested in seeing the city.	その町を見て回るのに興味をもった。
I was looking at old pictures.	古い写真を見てたんだよ。
I was meeting Bob at six.	私は６時にボブに会う予定だった。
I was moved by her love for other people.	私は彼女の他の人々に対する愛に感動した。
I was moved by the music.	私はその音楽に感動しました。
I was moved by this movie.	私はこの映画に感動した。
I was moved.	とても感動したわ。
I was not interested in it at all.	それに全く興味が無かった
I was not present at that meeting.	私は会議には出席しなかった。
I was not really in love with her.	自分はべつに彼女に恋愛感情をいだいていなかった
I was not yet born when a war between Japan and the U.S. broke out in December 1941.	１９４１年の１２月に日本とアメリカの間で戦争が勃発した時、私は生まれていなかった。
I was on the go all day today looking for a loan.	今日は借金の工面で東奔西走した。
I was only a little child then.	そのころ私はほんの子供でした。
I was the shorter of us two.	私たち２人では私のほうが背が低かった。
I was used to studying when I was a student.	学生の時は勉強することになれていた。
I was watching TV at night.	私は夜にテレビを見ていた。
I was watching TV then.	私はその時、テレビを見ていました。
I was watching TV when Yumi came.	由美が来たとき私はテレビを見ていた。
I was young, and I wanted to live.	私は若かった、そして私は生きたかった。
I watch TV off and on.	私は時々テレビを見る。
I watched TV at six last night.	私は昨日の夜の６時にテレビを見ました。
I watched TV during my breaks.	試合の間にテレビを見た。
I watched TV last night.	昨夜はテレビを見てました。
I watched X-files the movie.	私はＸ―ファイルザムービーを見ました。
I watched a movie on video.	ビデオで映画を見ました。
I watched an old movie I hadn't seen in a long time.	久しぶりに昔の映画を見ました
I watched an old movie on TV.	テレビで古い映画を見た。
I will address the two issues.	私は二つの課題に取り組みます
I will answer for the result.	私はその結果に責任を負うつもりだ。
I will answer within three days.	３日以内に返事します。
I will apply for help to him.	私はかれに助けを求めよう。
I will be only too pleased to help you.	大いに喜んで手伝いましょう。
I will be seeing her again next Friday.	次の金曜日にもう一度彼女に会うでしょう。
I will be seeing her again one of these days.	近日中に彼女にまた会うことになっている。
I will bring back a lot of food.	私はたくさんの食物を持って帰ろう。
I will buy a watch at the store.	あたしはその店で時計を買うつもりです。
I will call on you again.	いずれ改めてお伺いいたします。
I will come by all means.	必ずうかがいましょう。
I will come earlier next time.	この次はもっと早く来よう。
I will continue with my current work.	そのまま、今の仕事を続ける
I will do it by all means.	ぜひそれをやりましょう。
I will follow the law.	私は法律にたずさわろう。
I will give you two examples below.	以下に例を２つあげます
I will go for a medical.	健康診断を受けに行きます。
I will have a child.	自分に子供が出来る
I will have been to Nagasaki three times if I go there again.	長崎へもう一度いくと３回行ったことになる。
I will have been to Paris five times when I go there again.	私が今度パリへ行ったら、５回行ったことになる。
I will have been to the States three times if I go there again.	もう１度行けば、アメリカに３回いったことになる。
I will have read Hamlet three times if I read it again.	ハムレットをもう１回読めば、私は３回読んだことになります。
I will have to study harder.	私はもっと勉強しなければならないだろう。
I will help you if possible.	もしできたら手助けしてあげよう。
I will love you always.	永遠にあなたを愛します。
I will meet him some other time.	彼に会うのはこの次にしましょう。
I will never do it again.	私は二度とそれをしないつもりです。
I will never fall in love again.	二度と恋なんかするものか。
I will never go out of my way.	ぼくは自分のやり方はけっして変えません。
I will never see him.	私はもう彼に会わないだろう。
I will never tell!	この口が裂けても言えません！
I will not do it again.	二度としません。
I will not let the story go out.	ぼくはその話は人にもらさない。
I will put it down to your account.	それはあなたの勘定につけておきましょう。
I will put this business through in a week.	ぼくはこの仕事を１週間以内にかたづけたい。
I will say something about it.	それについて言いたいことがある。
I will see to it that you meet her at the party.	君がパーティーで彼女に会うように取り計らう。
I will see to it that you meet her at the party.	私があなたがパーティーで彼女に会えるように取り計らいます。
I will see to it that you meet her at the party.	私はあなたがパーティーで彼女に会えるように取り計らいます。
I will see to it that you meet her at the party.	私はパーティーで彼女に会えるように取り計らいます。
I will see you, each in your turn.	皆さんに１人ずつお会いしましょう。
I will see you, each in your turn.	皆に順番に会いましょう。
I will show a part of the e-mail below.	以下にメールの内容の一部を紹介する
I will show two X below.	Xを２つ、以下に紹介します
I will show you some pictures.	あなたに何枚かの写真を見せましょう。
I will show you the picture.	私はあなたに絵を見せましょう。
I will study English hard from now on.	私はこれからは英語を一生懸命勉強します。
I will study something in the university.	自分が大学で何かを学ぶ
I will talk about the food for January.	１月の料理を紹介します
I will tell her what to say at the meeting.	会合で何を言ったらよいか彼女に教えてあげよう。
I will try as hard as I can.	私はできるだけ一生懸命やっているつもりだ。
I will try it again.	ぼくはそれをもう一度やってみよう。
I will write about going to look at cars in my journal for the 13th.	車を見に行った話を１３日の日記に書きます
I won't see her again.	もう彼女には会わないよ。
I work for a bank.	私は銀行で働いています。
I work for a shipping company.	海運会社に勤めています。
I work for a trading company.	私は商社で働いています。
I work for a travel agency.	私は、旅行会社に勤めています。
I work for a travel agency.	私は旅行代理店で働いています。
I work hard and play hard.	私は仕事も遊びも一生懸命やる人です。
I work hard in the garden.	私は庭で熱心に働く。
I work hard on X in my own way.	私はXを自分なりに精一杯やる
I work in a special unit.	私は特殊部隊に勤務する。
I worked all night.	徹夜で勉強した。
I worked as hard as possible.	私はできるかぎり熱心に働いた。
I worked for a bank.	私は銀行で働いていました。
I worked hard in order to support my family.	私は家族を養うために懸命に働いた。
I worked hard last month.	私は先月一生懸命働きました。
I would like to address two questions.	質問は２つしたいと思います。
I would like to address two questions.	質問を二つしたいと思います。
I would like to get a camera like this.	私はこのようなカメラを買いたいと思います。
I would like to have this camera.	僕はこのカメラが欲しい。
I would like to meet him.	彼に会いたいものだ。
I would like to place an order for the following.	以下の通り注文いたします。
I would like to see you again some day.	いつかまたあなたにお会いしたいものです。
I would like to talk to him face to face.	私は彼と面と向かって話したい。
I would like to talk with you again.	もう一度君と話がしたい。
I would like to tell you something.	あなたにお話があるのですが。
I would like you to look over these documents.	こちらの書類に目を通していただきたいのですが。
I would like you to look over these documents.	この書類にざっと目を通してもらいたい。
I would like your picture.	君の写真が欲しいのですが。
I would not part with that picture for all the world.	私はどんなことがあってもその絵を手放すことはしません。
I'd like a quote on the following.	下記に対して価格を提示してください。
I'd like a room facing the garden.	庭に面した部屋に替えてください。
I'd like a single from the 24th for two nights.	シングルの部屋を２４日から２泊お願いしたいのですが。
I'd like something light.	何か軽いものがいいですか。
I'd like that a lot.	是非そうしたいですね。
I'd like the bill, please.	勘定書をお願いします。
I'd like the same style as this one.	これと同じ髪型にしてください。
I'd like to ask a question.	１つ質問してみたい。
I'd like to call a meeting.	ミーティングを開きたいのだが。
I'd like to check out. Do you have my bill?	チェックアウトしたいので、会計をおねがいします。
I'd like to fax this to Japan.	この手紙を日本までファックスしてください。
I'd like to get a bank loan; how do I go about that?	銀行融資を受けたいのだけど手続きはどうしたらいいの？
I'd like to get medical insurance.	医療保険に入りたいのです。
I'd like to go to the movies.	映画を見に行きたいな。
I'd like to have a good talk with her.	一度彼女とゆっくり話をしてみたいものです。
I'd like to have this film processed.	このフィルムを現像・焼付けしてください。
I'd like to mail this package to Canada.	この小包をカナダへ送りたいのですが。
I'd like to move to the country.	田舎に引っ越したい。
I'd like to see you again next week.	来週また会いたい。
I'd like to see you if possible.	できるなら、あなたにお目にかかりたい。
I'd like to send this package to Japan.	この荷物を船便で日本に送りたいのですが。
I'd like to talk with Tony.	トニー君と話をしたいのですが。
I'd like to talk with you in private.	君にちょっと話がある。
I'd like to watch TV.	私はテレビを見たい。
I'd like two copies of each of these documents.	この書類をそれぞれ２部ずつコピーしてほしいんだが。
I'd like you to put me back on the list.	また、リストに名前を戻して欲しいのですが。
I'd love to see the movie.	ぜひその映画を見たい。
I'll apply for the job today.	今日その仕事を申し込もう。
I'll ask you these questions.	次のようなことをあなたに質問したい。
I'll be only too pleased to help you.	休暇は全くあっという間に終わってしまった。
I'll be only too pleased to help you.	喜んでお手伝いいたしましょう。
I'll be only too pleased to help you.	大いに喜んでお手伝いいたしましょう。
I'll be seeing him again.	彼にはまた会うだろう。
I'll be visiting Japan again in a few years.	私は数年したら再び日本を訪れることになるでしょう。
I'll be watching you.	僕は片時も君から目を離さない。
I'll come again when you are free.	君が暇なときにまた来るよ。
I'll do it by all means.	必ずやります。
I'll follow.	私は後からついていきます。
I'll give you an answer in a day or two.	一両日中にお返事します。
I'll give you this camera.	君にこのカメラをあげよう。
I'll go and see what the children are doing.	子供達が何をやっているか見てこよう。
I'll have to let you know.	考えておきます。
I'll hear all of you in turn.	君達全部のいう事を順番に聞こう。
I'll help you if possible.	できるならお手伝いします。
I'll keep this for future use.	これを将来使えるように取っておこう。
I'll let it go this time.	今回は大目に見よう。
I'll let you know in a day or so.	一両日中にお知らせします。
I'll make a little money, and Mr White will never know.	ちょっとした稼ぎになるし、ホワイト氏も気づきはしないだろう。
I'll make this a special case, but try to keep it short.	特別扱いしますが、なるべく短めにしてくださいね。
I'll meet them at six.	私は６時に彼らに会うつもりだ。
I'll meet to you at eight.	８時にお会いしましょう。
I'll never do this again.	以後こんなことはいたしません。
I'll never let you down.	私は決してあなたを失望させません。
I'll never let you down.	私は決してあなた失望させません。
I'll never see him again as long as I live.	私は生きている間は決して再び彼とは会わない。
I'll pay the bill.	僕がおごるよ。
I'll put you up for the night.	一晩泊めてあげよう。
I'll see him again.	もう一度彼に会うつもりだ。
I'll see to it that you meet her at the party.	パーティーで彼女に会えるように取り計らおう。
I'll study harder in the future.	これからはもっと勉強します。
I'll study harder in the future.	これからもっと勉強します。
I'll take care of the bill.	僕が払っとこう。
I'll talk it over with Marty and see what he thinks.	この件はマーティとよく相談して彼の意見を聞くことにする。
I'll try as hard as I can.	できるだけ頑張ってやってみます。
I'll water the garden.	庭に水をまこう。
I'm a high school student.	私は高校生です。
I'm about to tell you something important.	大切な話があるんです。
I'm about to tell you the answer.	あなたに返事をしようとしているところです。
I'm about to tell you the answer.	私はあなたに答えを教えてあげようとしているところです。
I'm against people driving big cars.	私は人が大きな車を乗り回すのに反対だ。
I'm against the bill.	その法案に反対です。
I'm always at your service.	いつでも私にお申しつけ下さい。
I'm always looking at you.	僕はいつも君ばかり見ているんだよ。
I'm always meeting him there.	彼とはそこでばったり会う。
I'm always moved by X.	私はXにいつも感動を覚えます
I'm always on call at home.	いつでも家で待機しています。
I'm applying for a job.	仕事に応募する。
I'm broke.	文無しなんだ。
I'm broke.	金欠なんだ。
I'm easy.	私はどうでも構わない。
I'm for the bill.	その法案に賛成です。
I'm getting a directory access error.	ディレクトリアクセスエラーが出る
I'm getting a new house built.	家を新築中です。
I'm going to Hawaii by ship.	私はハワイへ船で行きます。
I'm going to Paris in the fall.	私は秋にパリへ行く予定です。
I'm going to Paris this fall.	今年の秋はパリへ行くつもりだ。
I'm going to go to Tokyo again in July.	７月に再び東京へ行きます
I'm going to go to the movies.	映画に行くつもりです。
I'm going to have a baby.	私に赤ちゃんができるんですよ。
I'm going to talk to Tom when he returns home.	トムが帰宅したら、話してみましょうか。
I'm going to the bank.	私は銀行に行きます。
I'm heading to Kyoto Park.	京都公園に向かう
I'm in charge of the book department.	私は書籍売り場を担当している。
I'm interested in creating my own web pages.	私は自分のホームページを作ることが趣味です。
I'm interested in history.	私は歴史に興味がある。
I'm interested in history.	私は歴史に関心がある。
I'm interested in history.	私は歴史に関心を持っています。
I'm just going to run down to the bank.	ちょっと銀行によってくる。
I'm just watching TV.	テレビを見ている所だ。
I'm looking for my camera.	私は私のカメラを探しています。
I'm looking for my key.	鍵を探しています。
I'm majoring in American history at university.	私は大学でアメリカの歴史を専攻しています。
I'm much younger than you.	私は君よりもずっと若い。
I'm never at home on Sundays.	私は日曜日にはいつも家にいない。
I'm no match for you.	お前にはかなわないよ。
I'm not a student.	私は生徒ではありません。
I'm not always at home on Sundays.	私は日曜日にいつも家にいるとは限らない。
I'm not always free on Sundays.	私は日曜日は必ずしも暇というわけではない。
I'm not always home on Sundays.	日曜日はいつも家にいるとは限らない。
I'm not as young as I was.	昔のような元気はない。
I'm not good at meeting people.	人に会うのは苦手だ。
I'm not in a position to answer.	お答えできる立場にありません。
I'm not used to getting up early.	早起きには慣れてないんだ。
I'm not used to getting up early.	私は早起きすることになれていない。
I'm not very interested in X.	Xにはあまり興味が無い
I'm old and not too well.	私は歳を取って体の具合が良くない。
I'm on your side.	あなたを支持します。
I'm on your side.	私はあなたの味方です。
I'm pleased to meet you.	お目にかかれて嬉しい。
I'm really not up on recent TV shows.	最近のテレビ番組のことは知らないんだ。
I'm short of money.	私はお金を使い果たした。
I'm short of money.	私はお金不足だ。
I'm still can't figure out men.	自分がまだ、男の人に慣れない
I'm still single.	なにしろ、独り者で。
I'm talking on the phone.	電話中です。
I'm talking on the phone.	電話中なんですよ。
I'm the youngest in the family.	私は末っ子です。
I'm three years younger than you.	私はあなたより３歳若い。
I'm through with my work. Let's go out.	その仕事は終わったよ。出かけよう。
I'm trying hard, but can't think of her name.	一生懸命がんばっても彼女の名前が思い出せない。
I'm used to getting up early.	早起きするのに慣れているから。
I'm used to getting up early.	早起きになれているから。
I'm used to getting up early.	早起きには慣れているんだ。
I'm used to getting up early.	私は早起きするのになれている。
I'm used to getting up early.	私は早起きになれている。
I'm used to working all night.	私は徹夜で働くのに慣れている。
I'm very interested in social studies.	私は社会科にはたいへん興味をもっています。
I'm very pleased to meet you.	お目にかかってたいへんうれしい。
I'm very short of money.	とてもお金に困っているんだ。
I'm young.	僕は若い。
I'm younger than he is.	私は彼より若いんですよ。
I've always end up going for X.	Xについつい手が伸びた
I've always loved you.	ずっとあなたが好きだ
I've always wanted to go to Australia with my family.	家族とオーストラリアに行きたいと思っています。
I've always wanted to meet you.	以前からお目にかかりたいと思っていました。
