Don't turn off the light.	明かりを消さないで下さい。
Don't turn off the light.	電気を消すな。
Don't use all the hot water.	お湯を全部使わないで。
Don't watch TV.	テレビを見てはいけません。
Don't work too hard!	無理するなよ！
Don't work too hard.	働き過ぎないように。
Don't you feel like going to the movies?	映画を見に行きたくないですか。
Don't you move from here.	君ここを動くんじゃないぞ。
Don't you think most Japanese students work hard?	たいていの日本の学生はよく勉強すると思いませんか。
Each and every member of the club was present.	クラブ会員は１人残らずみな出席していた。
Each building has a name.	おのおのの建物には名前がある。
Each child has an individual way of thinking.	めいめいの子供は独自の考え方を持っている。
Each child was given a present.	それぞれの子供がプレゼントをもらった。
Each individual is different.	個人はそれぞれ異なっている。
Each of us is supporting today's society.	一人ひとりが今の社会を支えています
Each of us read the book in turn.	私たちは順番にその本を読んだ。
Each time I see Mary, I learn something new and important from her.	私はメアリーに会うたびに、彼女から何か新しくて重要なことを学ぶ。
Each time an author re-writes a book, it is a new edition.	著者が本を書き直す度に新版となる。
Easier said than done.	口では大阪の城も建つ。
Easier said than done.	口で言うのは実行するのよりやさしい。
Easier said than done.	実行するより口で言うほうが容易だ。
Easier said than done.	言うのはた易いが、行うのは難しい。
Easy come, easy go.	得やすいものは失いやすい。
Easy come, easy go.	楽に得たものは、すぐに失ってしまう。
Education means something more than going to school.	教育とはただ学校に行くだけではなくそれ以上のことを意味する。
Elmore James got nothin' on this, baby.	エルモア・ジェイムズのコピーじゃないぜ。
English has become an international language.	英語は国際語になった。
English is a very important language in today's world.	英語は今日の世界ではとても重要な言語だ。
English is an international language.	英語は国際言語である。
English is easy to learn.	英語は学びやすい。
English is just one of over 2,700 languages in the world today.	英語は今日、世界にある２７００以上の言語の一つにすぎません。
English is not easy for him to learn.	彼は英語がなかなか覚えられない。
English is not easy for me.	英語は私にはやさしくない。
English is not easy for us.	英語は私達にはやさしくない。
English is not easy, but it is interesting.	英語は簡単でない、しかし面白い。
English is not easy, but it is interesting.	英語は簡単ではない、でもそれは面白い。
English is studied in China, too.	英語は中国でも勉強されています。
English is the world's language.	英語は世界の言語である。
English, as you know, is very much a living language.	英語は、ご存知の通り、今も確実に生きている言語である。
Even a child can answer it.	子供でもそれぐらい答えられる。
Even a child can answer the question.	子供でさえその質問に答えられる。
Even a child can do it.	子供でもそれをすることができる。
Even a child can do it.	子供にでもそれはできる。
Even a child can read this.	子供でさえこれを読むことが出来る。
Even a child can understand it.	子供でもそんな事はわかる。
Even a child can understand that.	子供でさえもそれはわかる。
Even a child knows what it is like to be without friends.	友達がいないと言うことがどんなことかは、子供でさえ知っている。
Even a little child knows its name.	小さな子どもでもその名前を知っている。
Even children can read this book.	この本は子供でも読めます。
Even children can understand it.	子供にだってそんな事は分かるよ。
Even if you do not like it, you must take charge of it.	たとえそれが嫌いでも、あなたはその世話を引き受けなければならない。
Even so, you are a human.	それでも、おまえは人間だ。
Every house had a garden.	どの家にも庭がありました。
Every man can't be an artist.	誰でも芸術家になれるとは限らない。
Every means has not been tried.	全ての手段が試みられたわけではない。
Every member of the club was present.	クラブの全員が出席していた。
Every now and then she called home during the party last night.	昨日のパーティーの間、彼女は時折家に電話していた。
Every one of us is more or less interested in art.	我々は誰でも芸術には多かれ少なかれ興味を抱いている。
Every one of us is more or less interested in art.	私たちは誰でも、多かれ少なかれ芸術に興味を持っている。
Every student has access to the library.	学生は誰でも図書館を利用できる。
Every student has free access to the library.	学生はだれでも自由に図書館を利用できる。
Every student in the class knows the fact.	そのクラスのどの生徒もその事実を知っている。
Every time I go there, I meet her.	そこに行くたびに彼女に会う。
Every time I read this book, I find something new.	この本を読むたびに、何か新しい発見をします。
Experience talks in these cases.	こういう場合には経験が物を言う。
Fall is when we can study best.	秋は私たちがいちばんよく勉強できる時です。
Fall is when we can study best.	秋は私たちが一番勉強できるときです。
Feel free to ask any questions.	どんな質問でも遠慮なくしなさい。
Feel free to comment on any point made here.	これについて、自由に批評して下さい。
Few Indians live in Japan.	日本にはほとんどインド人は住んでいない。
Few Japanese can use English well.	日本人で英語をうまく使える人はほとんどいません。
Few children were in the room.	部屋にはほとんど子供がいなかった。
Few of my friends have two cars.	私の友達で車を２台持っているものはほとんどいない。
Few people are free from cares.	心配ごとのない人はほとんどいない。
Few people are free of care.	何の心配もない人は少ない。
Few people have two cars.	車を２台もつ人はほとんどいない。
Few people know about the plan.	ほとんどの人はその計画について知らない。
Few people know each other well.	ほとんどの人々がお互いをよく知らない。
Few people know how to do it.	そのやり方を知っている人はほとんど少ない。
Few people know how to do it.	その仕事を知っている人はほとんどいない。
Few people know that Mr. Itsumi is from Kansai.	ほとんどの人は逸見氏が関西出身だとは知らない。
Few people live on the island.	その島のほとんどに人が住んでいない。
Few people live to be 100 years old.	百歳まで生きる人はほとんどいません。
Few people live to be more than a hundred.	百歳以上生きる人はほとんどいない。
Few people live to be ninety years old.	９０歳まで生きる人は少ない。
Few people live to be one hundred years old.	１００歳の長寿をまっとうする人は少ない。
Few people think so.	そう思っている人が少ない。
Few people visit me these days.	近頃は私を訪ねるひともほとんどいない。
Few students can read Latin.	ラテン語を読める学生はほとんどいない。
Few students could understand what he said.	彼が言うことを理解できた生徒はほとんどいなかった。
Financial support is given to them.	財政的援助が彼らに与えられている。
First of all, we have to put your design to the test.	まずぼくたちは君の計画を試してみなければならない。
First, I should hear both sides.	まず両方の言い分を聞きましょう。
First, I'll try to understand why he thinks so.	まず、なぜ彼がそのように考えるか理解してみよう。
First, he takes a step.	彼がまずは一歩を踏み出す
First, put the right hand out.	最初に右手を出しなさい。
First, set the following settings:	まず、以下の設定を行います
Follow me and I will show you the way.	私について来なさい、道を教えます。
Follow me.	私についてきて。
Follow that car.	あの車を追ってくれ。
Food has been in short supply.	食糧が不足している。
For a long time I wanted to meet him.	長い間彼に会いたいと思っていた。
For all I know, he was born in Italy.	多分彼はイタリア生まれだ。
For example, do you like English?	例えば、君は英語が好きですか。
For example, it is 7:00 a.m. in London now.	例えば、ロンドンは今は朝７時です。
For how many nights?	何泊されますか。
For my part, I don't like this picture.	私としては、この絵が嫌いです。
For the life of me I can't understand what you say.	私はどうしても君の言う事が理解できない。
For the time being, I am studying French at this language school.	当分、この語学学校でフランス語を勉強します。
For three nights starting January 3rd, please.	１月３日から３泊、お願いします。
Four-fifths of all the members were against the plan.	すべての会員のうち、５分の４はその計画に反対だった。
France was at war with Russia.	フランスはロシアと戦争をしていた。
Fred and George took turns with the driving.	フレッドとジョージは、交代で運転した。
From Kate's point of view, he works too much.	ケイトから見ると、彼は働き過ぎである。
George Washington was born in 1732.	ジョージ・ワシントンは１７３２年に生まれた。
German is not an easy language.	ドイツ語はやさしい言語ではありません。
Get a move on!	なにちんたら歩いてんだ。
Get me the key.	キーを取って。
Get up as early as you can.	できるだけ早く起きなさいよ。
Get up early, and you'll be in time.	早起きすれば間に合いますよ。
Get up early.	早く起きろ。
Getting up early is very good.	早起きはたいへんよい。
Gimme something to write on.	書くものをくれ。
Give him a break!	彼にチャンスを与えてやれ！
Give me a break, please.	ちょっとかんべんしてよ。
Give me a break, will you?	ちょっと勘弁して下さい。
Give me a break.	勘弁してくれ。
Give me a copy of this book.	この本を１部ください。
Give me a few.	私に少しください。
Give me another example.	別の例をあげてください。
Give me something to do.	何か仕事を下さい。
Give me something to write on.	何か書くものを貸してくれ。
Give me the bill, please.	勘定を頼むよ。
Give the password.	合言葉を言う。
Go easy on him. He's still new around here.	彼は、まだ新人なんだから大目に見てやれよ。
Go for broke!	当たって砕けろ。
Go on with your story. That is so interesting!	あなたの話を続けなさい。それはとても面白い。
Go over it again.	そこをもう一度やってください。
Go where he will, he will be welcomed.	彼はどこへ行っても歓迎されるだろう。
Going home last night, I saw her again.	昨夜帰宅途中に、彼女に再び会った。
Good question!	よい質問だ。
Good students study hard.	よい学生は一生懸命勉強する。
Gordon is interested in the Japanese way of life.	ゴードンは日本の生活様式に興味を持っている。
Had you come a little earlier, you could have met her.	もう少し早く来ていたら、君は彼女に会えたのに。
Harajuku is one of the hottest places in Tokyo.	原宿は東京の中で最も活気のある場所の一つである。
Hard work has brought him where he is.	勤勉さが今の彼をつくりあげた。
Hard work has made Japan what it is today.	勤労によって日本は今日の日本になった。
Hard work has made him what he is.	彼の今日あるのは勉強のおかげである。
Has Mary started yet?	メアリーはもう出発しましたか。
Has Tony been watching TV?	トニー君はテレビをずっと見ていますか。
Has he any children?	彼には子供が何人かいますか。
Has he come yet?	彼はもう来たかい。
Has he come yet?	彼はもう来ましたか。
Has he returned yet?	彼はもう帰ってきましたか。
Has the movie started yet?	映画はもう始まりましたか。
Have I answered your question?	私は質問に答えたでしょうか。
Have a good look at this picture and find me in it.	この写真をよく見て私を見つけてごらん。
Have a good look at this picture.	この写真をよく見て。
Have a look at that picture.	あの絵をちょっと見てごらん。
Have students read such books as will make them think more.	学生にもっと考えさせるような本を読ませなさい。
Have we met before?	以前お会いしたことがありますか。
Have you a room to let in this house?	この家に貸間はありますか。
Have you been told where the meeting will be?	会議がどこであるか聞いた？
Have you called her yet?	もう彼女に電話しましたか。
Have you called her yet?	もう彼女に電話をしましたか。
Have you called her yet?	彼女に電話しましたか。
Have you chosen what to do next Sunday yet?	今度の日曜日に何をするかもう決めましたか。
Have you figured out the cost?	費用がいくらかかるか算出してみましたか。
Have you got a match?	マッチを持っていますか。
Have you had an answer?	手紙の返事はもらいましたか。
Have you heard about the result of the game?	試合の結果について聞きましたか。
Have you heard from Freddie?	フレディーから連絡がありましたか。
Have you heard from her?	彼女から便りはありましたか。
Have you heard from him?	彼から便りがありましたか。
Have you heard the news yet?	あなたはもうそのニュースを聞きましたか。
Have you met each other?	あなたたち、前に会ったことある？
Have you met her before?	以前彼女に会ったことがありますか。
Have you met him yet?	もう彼に会いましたか。
Have you named your new born baby?	赤ちゃん、もう命名した？
Have you practiced any today?	今日は少しでも練習しましたか。
Have you read the book yet?	もう本を読みましたか。
Have you read this book yet?	君はこの本をもう読みましたか。
Have you read today's paper yet?	もう今日の新聞は読んでしまいましたか。
Have you read today's paper yet?	もう今日の新聞を読みましたか。
Have you read today's paper yet?	今日の新聞はもう読みましたか。
Have you sent him a Christmas card yet?	彼にもうクリスマスカードを送りましたか。
Have you started reading the book yet?	もうあの本を読み始めましたか。
Have you turned in your report?	君はもうレポートを提出しましたか。
Have you worked out the answer yet?	もう答えは出ましたか。
Haven't we met before?	以前お会いしませんでしたかしら。
Having heard the story before, she didn't want to hear it again.	彼女はその話を以前に聞いたことがあったので、それをまた聞きたくなかった。
Having read the book, I could answer all the questions.	その本を読んでいたので、私はすべての質問に答えることが出来た。
He added that I should come to the party, too.	私もパーティーに来るべきだ、と彼はつけ加えた。
He added the following functions to the system.	彼がシステムに以下の機能を追加しました
He added up the figures.	彼はその数字を合計した。
He always goes through the material.	彼が資料には必ず目を通す
He always has a lot of people around him.	彼の周りにはいつも多くの人が集まります
He always plays well.	彼はいつもよいプレーをする。
He always reads a magazine.	彼はいつも雑誌を読む。
He always says one word too many.	彼はいつも一言多い。
He always studies hard.	彼はいつも一生懸命に勉強している。
He always takes notes.	彼はいつもメモをつけています。
He always takes sides with her.	彼はいつも彼女の味方をする。
He always takes sides with her.	彼はいつも彼女の見方をする。
He always tries to see the good in others.	彼はいつも他人の良いところを知ろうとする。
He always wanted to study Japanese.	彼は日本語を勉強したいとずっと思っていた。
He always works hard.	彼はいつも一生懸命働く。
He and I have been good friends since we were children.	彼との子供のころから仲良しだ。
He answered as follows.	彼は次のように答えた。
He answered not a word to me.	彼は私には一言も答えなかった。
He answered that he knew no French.	彼はフランス語は知らないと答えた。
He answered, No.	彼は答えた。「ちがいます」
He applied for a job with the Bank of Tokyo.	彼は東京銀行へ就職の願書を出した。
He applied for a job.	彼は仕事に応募した。
He applied for a position in the office.	彼はその会社に職を求めた。
He applied for a position in the office.	彼はその会社に職を申し込んだ。
He applied for the job and got it.	彼はその仕事に志願し採用された。
He applied for the position.	彼はその地位を志願した。
He asked a few questions of me.	彼は私に２、３の質問をした。
He asked a question about it.	彼はそれについて質問した。
He asked a very good question.	彼はとてもよい質問をした。
He asked her some questions.	彼は彼女にいくつか質問をしました。
He asked me a question.	彼は私に尋ねた。
He asked me a question.	彼は私に質問した。
He asked me two questions.	彼は私に二つ質問をした。
He asked the same question of many people.	彼は多くの人に同じ質問をした。
He becomes a university student this year.	彼は今年大学生になります。
He boarded the ship.	彼はボートに乗り込んだ。
He bought the lot with a view to building a house on it.	彼は家を建てるつもりでその土地を買った。
He broke into a house.	彼が家に押し入った。
He broke the law.	彼は法を犯した。
He broke the world record.	彼は世界記録を破った。
He brought her to our place.	彼は彼女を連れてうちをたずねてきた。
He brought it up first, but he didn't show up. What's going on?	結局、言い出しっぺの人が来てないのだけど、どういうことだ？
He brought up X.	彼がXをネタにする
He brought us a small gift each time he called on us.	彼は私たちを訪ねるたびにちょっとした土産を持ってきた。
He built a new house.	彼は新しい家を建てた。
He called on me at night.	彼は夜私を訪ねた。
He called on me at night.	彼は夜私を訪ねてきた。
He called the cell phone.	彼がその携帯に電話を掛けた
He calls her up every night.	彼は毎晩彼女に電話する。
He came a little earlier than he used to.	彼は以前より少し早く来た。
He came all the way to talk over a problem with me.	彼はわざわざ私が抱えている問題について話し合うためにやってきた。
He came back about nine last night.	彼は昨夜９時ごろ戻ってきた。
He came back again.	彼はまた戻ってきた。
He came crawling to me to ask for a loan.	彼は借金を頼みに頭をペコペコ下げてやって来た。
He came down the road.	彼はその道をやってきた。
He came early, as he had been asked to do.	彼は言われたとおりに早く来た。
He came here again.	彼はまたここに来た。
He came to Japan as a child.	彼が日本に来たのは子供のときでした。
He came to see me any time he felt like it.	彼は僕を訪ねたいと思うときはいつでも訪ねてきた。
He came to understand it at last.	彼はとうとうそれを理解するようになった。
He came up with an answer to our problem.	彼は私達の問題の答えをみつけた。
He came up with an answer to our problem.	彼は私達の問題への解決を見つけた。
He can come up with any amount of money.	彼はいくらでもお金を出せる。
He can run fast.	彼は速く走れる。
He can run faster than I.	彼は私より速く走れる。
He can run so fast!	彼は走るのがとても早い。
He can run the fastest in the class.	彼はクラスの中で一番速く走ることが出来ます。
He can't have heard you.	彼には君の声が聞こえたはずがない。
He can't run very fast.	彼はあまり速く走ることができない。
He changed a few words.	彼は２、３の単語を入れかえた。
He chose every word with care.	彼は言葉を一つ一つ注意深く選んだ。
He comes here every few days.	彼は数日おきにここに来る。
He comes to school earlier than any other student in the class.	彼はクラスの他のどの生徒よりも早く登校する。
He continued reading the book.	彼はその本を読みつづけた。
He copies the file to the directory 1.	彼がファイルを１のディレクトリにコピーします
He could not answer that question.	彼はその質問に答えられなかった。
He could run fast when he was young.	彼は若い頃速く走ることができた。
He couldn't move and had to call for help.	彼は動くことができず、助けを大声で求めねばなりませんでした。
He couldn't run very fast.	彼はあまり速く走れなかった。
He designed the new building.	彼がその新しいビルを設計した。
He did an amount of work.	彼はかなりの仕事をした。
He did me a good turn.	彼は私に親切にしてくれた。
He did not get up early.	彼は早く起きなかった。
He did not like children.	彼は子供が好きではなかったのです。
He did not show up at the party last night.	彼は夕べのパーティーに出席しなかった。
He did not work on Sunday night.	日曜日の夜、彼は勉強しなかった。
He did this before my face.	彼は、このことを僕の面前でやった。
He didn't answer my question.	彼は私の質問に答えなかった。
He didn't come to the last meeting.	彼はこの前の会には来なかった。
He didn't feel that way at all.	本人にそういう気がまったく無かった
He didn't meet the standards.	彼は水準を満たしていなかった。
He didn't notice the change, but I did.	彼はその変化に気がつかなかったが、私は気がついた。
He didn't show up at the party last night.	彼は夕べのパーティーには現れなかった。
He didn't try to answer her back.	彼は彼女に言い返そうとはしなかった。
He does an event three times a day.	彼がイベントを１日で３回もやった
He does know the fact.	彼は本当にそのことを知っている。
He does not get up early.	彼は早く起きない。
He does not run as fast as I.	彼は私ほど速くは走らない。
He does not study hard, but does very well at school.	彼はあまり勉強しない。しかし学校の成績はとてもよい。
He does not watch TV at all.	彼はまったくテレビを見ない。
He does not work so hard as he used to.	彼は昔ほど一生懸命働かない。
He doesn't know a lot about Japan.	彼は日本についてはよく知りません。
He doesn't know me yet.	彼はまだ、私の事を知らない
He doesn't know who built those houses.	彼はそれらの家をだれが建てたのか知らない。
He doesn't like traveling by air.	彼は飛行機で旅行するのが好きではない。
He doesn't mean it; he's just acting.	彼は本気でそう言ってるのでない、芝居をしているだけだ。
He doesn't really care about X.	彼がXをあまり気にしない
He doesn't study as hard as he used to.	彼は前ほど勉強しない。
He doesn't turn to that work.	彼はその仕事に向いていない。
He doesn't understand you.	彼はあなたのいう事をわかっていません。
He doesn't want me to go, but I mean to.	彼は私が行くことを望まないが、私は行くつもりだ。
He drives very fast.	彼はとても速く運転する。
He ended up choosing between them.	彼がいずれかの方法を選択することになりました
He entered my room.	彼は私の部屋に入った。
He entered the room.	彼は部屋に入った。
He entered university.	彼が大学に入った
He feels a lot better today.	彼は今日はとても気分がよい。
He fell in love with her.	彼は彼女と恋におちた。
He felt at home.	彼はくつろいだ。
He felt at home.	彼はくつろいだ気分になった。
He felt pleased with the new car.	彼はその新しい車が気に入ったと思った。
He forced me to go.	彼は私を無理矢理行かせた。
He found a broken camera.	彼は壊れたカメラを見つけた。
He found it hard to make friends.	彼は友達を作るのが難しいとわかった。
