I try.	頑張ってみる。
What happened to our food?	私たちの料理はどうなっているのですか。
It was easy for me to do so.	私がそうすることはやさしさでした。
I wish I could help you.	私があなたを助けることができればよいのに。
Can you put the children to bed?	子供を寝かせてくれますか。
I thought it easy at first.	始めはそれを簡単な事だと思いました。
What do you say to going for a walk?	散歩はどうですか。
You had better have your hair cut.	散髪してもらいなさい。
When did you go to bed last night?	昨夜はいつ寝ましたか。
I remember seeing you last year.	昨年会ったのを覚えている。
How about two weeks from Thursday?	再来週の木曜日はどう。
What are you going to do today?	今日は何をするつもりですか。
Why were you late this morning?	今朝なぜ遅刻をしたんですか。
I don't want to take a walk now.	今は散歩したくないんだよ。
I have a bad pain in my lower back.	腰痛がひどいのです。
Ken has never visited Kyoto.	健は一度も京都を訪れたことがない。
I'd like you to have a blood test.	血液検査をしましょう。
You had better not eat too much.	君は食べ過ぎない方がよい。
You had better not drive a car.	君は車を運転しない方がいい。
You can drive a car, can't you?	君は車の運転ができますよね。
You'd better not go out today.	君は今日外出しないほうがいい。
Why did you try to run away?	君はなぜ逃げ出そうとしたのですか。
How long will you stay here?	君はどれくらいここに滞在しますか。
How long will you stay here?	君はどのくらいここに滞在しますか。
All you have to do is to wait.	君はただ待ってさえいればいい。
Read chapter 4 for Friday.	金曜日の予習に第４章を読んでおくこと。
Look out! There's a car coming.	気を付けろ。車が来ているぞ。
School begins at eight-thirty.	学校は８時３０分に始まります。
You must not be late for school.	学校に遅刻してはいけない。
I'd rather stay home than go out.	外出するより家にいたい。
It is getting lighter outside.	外はだんだん明るくなっていく。
My best wishes to you and yours.	皆さまにもどうぞよろしく。
What time will the game start?	何時に試合は始まるでしょうか。
Try your best in everything.	何事にせよ全力を尽くしてみなさい。
Above all, don't tell a lie.	何よりもまず第一に、うそをつくな。
Have you begun studying English?	英語を勉強し始めましたか。
Try to improve your English.	英語が上達するように努力しなさい。
You can't stay in here all day.	一日中閉じこもってるつもり？
Come home before it gets dark.	暗くなる前に帰ってきなさいよ。
Reports are due next Monday.	レポートは来週の月曜日が〆切です。
Can't you stay a little longer?	もう少し長くいられませんか。
I am feeling much better now.	もう今では気分はずっといいです。
I've had enough of this program.	もうこの番組はたくさんだ。
Mayuko was alone in the room.	マユコはその部屋でひとりだった。
Soon we were clear of the town.	まもなく我々は町を出ていた。
There's very little paper left.	ほとんど紙が残っていません。
Pochi came running toward us.	ポチは私たちのほうへ走ってきた。
Can I bring you anything else?	ほかに何かお持ちしましょうか。
French is difficult to learn.	フランス語を学ぶのはむずかしい。
Tell me which one to choose.	どれを選べばいいか教えてください。
How long are you going to stay?	どれくらい滞在するのですか。
Tom gets up at six every morning.	トムは毎朝６時に起きる。
How soon will the meeting begin?	どの位したら会は始まるか。
How long will you be staying?	どのくらい滞在するつもりですか？
This is anything but easy.	とてもやさしいというしろものではない。
I don't like either of the boys.	どちらの少年も好きでない。
I think I'd better stay here.	どうも行かないほうがよさそうだ。
The door is opened every morning.	ドアは毎朝開けられます。
Well, it wasn't all that bad.	でも、そんなに悪くはなかったよ。
Debbie, is your school near here?	デビー、学校は近くなの。
It is getting darker and darker.	だんだん暗くなりつつある。
Not a single word did he say.	たったの一言も彼は言わなかった。
That won't make any difference.	そんなことやったって無駄だ。
I wish you had told me that.	それを言ってくれればよかったのに。
It is outside my area of study.	それは私の研究外のことです。
That is because I got up late.	それは私が遅く起きたからです。
The story was very interesting.	その話はとても興味深かった。
The boy has learned to read.	その男の子は字を読むことを覚えた。
The price of the car is too high.	その車の値段は高すぎる。
What time does the game start?	その試合は何時に始まりますか。
I'll do anything but that job.	その仕事以外ならなんでもやる。
I was very poor in those days.	その頃、私は非常に貧乏だった。
The meeting took place last week.	その会合は先週行われた。
The house is quite run down.	その家はかなりぼろ屋になっている。
The two teams fought very hard.	その２チームは激しく戦った。
I am not alone in thinking so.	そう考えるのはひとりではない。
John has a car made in Japan.	ジョンは日本製の車をもっている。
Jack has no object in life.	ジャックは人生に何の目的も持たない。
Are these all the sizes you have?	サイズはこれだけですか。
Come on! I can't wait any more.	さあ行こう、もう待てないよ。
Try this on. It's your size.	これを着てごらんよ君のサイズだよ。
Choose between this and that.	これとあれの中から選んで下さい。
This probably means war.	これではたぶん戦争ということになるだろう。
This is the boy who helped me.	これが私を助けてくれた少年だ。
This problem is a real challenge.	この問題はとても難しい。
I remember reading this book.	この本を読んだことを覚えている。
This book is interesting to read.	この本は読むのに面白い。
I fall behind him in this respect.	この点で私は彼に劣る。
Who is the author of this story?	この小説の作者は誰ですか。
This work is by no means easy.	この仕事は決してやさしくない。
Is the job too much for you?	この仕事は君の手に負えないですか。
How long will you stay here?	ここにはいつまで滞在していますか。
Get out of here, and quickly.	ここから出ていけ。いますぐにだ。
How did you feel about the game?	ゲームについてのご感想は？
Is this your interesting book?	これがあなたの面白い本ですか。
Can your brother drive a car?	お兄さんは車の運転が出来ますか。
It's too late. I'll see you home.	おそいから家まで送ろう。
It's good. You should try it.	おいしいよ。試してみるべきだよ。
How long have you had this pain?	いつから痛みだしましたか。
One day I visited an old friend.	ある日私は旧友を訪問した。
Have you read today's paper?	あなたは今日の新聞を読みましたか。
Did you take part in the game?	あなたは競技に参加しましたか。
What are you trying to do?	あなたは何をしようとしているのですか。
Where did you see the boy?	あなたはどこでその少年に会いましたか。
You need not have such fear.	あなたはそんなに怖がる必要はない。
You have changed quite a lot.	あなたはずいぶん変わりましたね。
Is your school in this town?	あなたの学校はこの町にありますか。
What happened to you last night?	あなた、昨晩何があったの？
I will be back in two week's time.	２週間で帰ってきます。
You should have visited Kyoto.	ぜひ京都へ行くべきだったのに。
The sign '&' stands for 'and'.	＆という記号は、ａｎｄを指す。
I was not interested in it at all.	それに全く興味が無かった
X actually happens in front of me.	Xが現実に目の前に起こる
I'm really looking forward to X.	Xを心から楽しみにしています
It's not that he's claiming X.	Xを彼が主張しているわけではない
The price of land rose quickly.	急激に土地の価格が上昇しました
The results of analysis suggest X.	Xを分析結果が示唆します
What day are you usually free?	いつも何曜日なら空いていますか？
Yoko will go to Kyoto next week.	洋子は来週京都へ行くだろう。
A fire broke out during the night.	夜の間に火事が起こった。
At night he goes out for a drink.	夜、彼は外に出て一杯やる。
There were few, if any, trees.	木はたとえあってもほとんどない。
I was watching TV half sleeping.	夢うつつでテレビを見ていた。
I must be true to myself.	本当の自分自身をもっと知りたいのに・・・。
I wanted my hair cut short.	僕は髪の毛を短く刈ってもらいたかった。
I want something to drink now.	僕は今、飲むための何かが欲しい。
I must remember to see her.	忘れないで彼女に逢わなければならない。
There is a Picasso on the wall.	壁にピカソの絵が掛かっている。
My father takes a walk every morning.	父は毎朝散歩する。
My father got home late last night.	父は昨夜遅く帰宅した。
Don't look down on poor people.	貧しい人を軽蔑してはならない。
She's giving herself up to love.	彼女は恋に身を焦がしている。
She is going to France next week.	彼女は来週フランスへ行く。
She will give a party next week.	彼女は来週パーティーを催す。
She makes herself up every morning.	彼女は毎朝化粧をする。
She has a book under her arm.	彼女は本を一冊小脇にかかえている。
She made a point of visiting me.	彼女は必ず私を訪ねてくれた。
She had her hair cut short.	彼女は髪の毛を短く切ってもらいました。
She used to give herself airs.	彼女は昔気取っていたものだった。
She was content with her life.	彼女は自分の生活に満足していた。
She answered my letter soon.	彼女は私の手紙にすぐ返事をよこした。
She told me an interesting story.	彼女は私に面白い話をした。
She may have told me a lie.	彼女は私にうそをついたのかもしれない。
She gave us something to eat.	彼女は私たちに食べるものをくれた。
She's a woman of strong character.	彼女は強い性格の女性だ。
She lives alone in the room.	彼女はひとりでその部屋にすんでいる。
She's a very interesting person.	彼女はとても興味深い人です。
She used to live hand to mouth.	彼女はその日暮らしの女だった。
She may not wait any longer.	彼女はこれ以上待てないかもしれない。
I remember seeing her before.	以前彼女に会ったことを覚えている。
She has no less than seven sons.	彼女には七人もの息子がいる。
She has no fewer than seven sons.	彼女には７人の息子がいる。
I am on visiting terms with her.	彼女とは行き来する間柄です。
They are not at all interested.	彼らは全然興味を持っていない。
They forced me to sign my name.	彼らは私に無理やり署名させた。
There's bad blood between them.	彼らは互いに敵意を抱いている。
They must be waiting for you.	彼らは君を待っているにちがいない。
They were given over to drinking.	彼らは飲酒にふけっていた。
They are still seeking evidence.	彼らはまだ証拠を探している。
They appear to know the fact.	彼らはその事実を知っているらしい。
Their efforts came to nothing.	彼らの努力は骨折り損に終わった。
Their boy was named Edward.	彼らの息子はエドワードと名づけられた。
Which of them is your brother?	彼らのうちどちらがあなたの弟か。
He kept standing against a tree.	彼は木にもたれて立っていた。
He walked up and down the room.	彼は部屋の中をあちこち歩いた。
He was respected as their teacher.	彼は彼らの師と仰がれた。
He set out at four in the morning.	彼は朝の４時に出発した。
He sleeps by day and works by night.	彼は昼眠って夜働く。
He will come sooner or later.	彼は遅かれ早かれやってくるだろう。
He is out of control when drunk.	彼は酔うと手がつけられない。
He is too drunk to drive home.	彼は酔いすぎていて車で帰れない。
He asked me about my new job.	彼は私の新しい仕事について尋ねた。
He's a difficult person to deal with.	彼は気難しい人だ。
He makes little of our efforts.	彼はわれわれの努力を軽視する。
He is left out of everything.	彼はみんなにつまはじきされている。
He remembers Mr Black's car.	彼はブラックさんの車をおぼえている。
He hopes he will visit Paris.	彼はパリを訪れたいと思っています。
He was at a loss for a word.	彼はなんて言ってよいか途方にくれた。
He has an interesting book.	彼はとてもおもしろい本を持っています。
He usually goes to McDonald's.	彼はたいていマクドナルドに行く。
He was an old hand at the game.	彼はそのゲームに熟練していた。
He had a lot of things to do.	彼はすることがたくさんありました。
He used all available means.	彼はすべての利用できる手段を使った。
He was lying down for a while.	彼はしばらくの間横になっていた。
I remember giving him the key.	彼に鍵を渡したことを覚えている。
We may as well begin without him.	彼なしで始めてもよかろう。
He is difficult to get along with.	彼と付き合うのは難しい。
Did you notice him coming in?	彼が入ってきたのに気づきましたか。
Respect is due to older people.	年上の人には敬意を払うべきだ。
Saturday is the last day of week.	土曜日は週の最後の日です。
Easy money is on Mulligan.	誰もがマリガンが勝つだろうと思っている。
Who is going to try this case?	誰がこの事件を裁くのでしょうか。
Someone is standing at the door.	誰かが入り口に立っています。
Everything comes to those who wait.	待てば海路の日和あり。
The loss amounted to $2,000,000.	損失は２００万円にのぼった。
Her sons have gone to Tokyo.	息子たちが東京へ行ってしまいました。
Sooner or later, she will appear.	早晩彼女は姿を現すだろう。
Get up early, or you'll be late.	早起きしないと、遅れますよ。
It looks like we have everything.	全部そろっているようです。
The teacher handed out the tests.	先生はテスト用紙を配った。
I visited him this day last week.	先週の今日彼を訪ねました。
Masako usually walks to school.	正子はふだん歩いて学校へ行く。
The political situation has changed.	政治情勢が変わった。
Water tries to find its own level.	水は水平になろうとする。
You may as well know the truth.	真相を知っておいたほうがいい。
We have still a lot of food left.	食料はまだいくらでもある。
You must not read while eating.	食べながら読んではいけません。
All the boys spoke each in turn.	少年たちは順々にしゃべった。
Would you mind waiting a moment?	少し待っていただけませんか。
Is this your first visit to Japan?	初めての日本訪問ですか。
Well begun is half done.	出だしがよければ半ばやり遂げたようなものだ。
No one else came to the meeting.	集会には他に誰も来なかった。
I've got no answer to my letter.	手紙の返事をもらっていない。
Could you open the car window?	車の窓を開けていただけませんか。
Do you know how to drive a car?	車の運転の仕方を知っているか。
I can't get the car to start.	車のエンジンがなかなかかからない。
Half the office took a day off.	社員の半分が休暇を１日取った。
In fact, you are quite right.	実はまったくあなたの言う通りです。
Remember me from time to time.	時々ぼくのことを思い出してくれ。
We have respect for our teacher.	私達は先生を尊敬しています。
Would you like to eat with us?	私達といっしょに食事しませんか。
I walked around in the field.	私は野原をあちこちと歩きまわった。
I want to learn standard English.	私は標準英語を勉強したい。
I have him eating out of my hand.	私は彼を手なづけています。
I remember seeing him once.	私は彼にかつて会ったことを覚えている。
I am on visiting terms with him.	私は彼と訪問しあう間柄です。
I was made to wait for a long time.	私は長い間待たされた。
I waited for her for a long time.	私は長い間、彼女を待った。
I respect my teacher very much.	私は先生をとても尊敬している。
I know that I am a good teacher.	私は自分がいい教師だと思う。
I don't want to live by myself.	一人ぼっちで暮らしたくはない。
I remember seeing you before.	私は以前君に会った事を覚えている。
I have visited Kyoto before.	私は以前京都を訪れたことがあります。
I'm old enough to support myself.	私はもう自立できる年です。
I want to eat something good.	私はなにかおいしいものが食べたい。
I don't know which to choose.	私はどちらを選ぶべきかわからない。
I was at a loss what to do.	私はどうしてよいのかわからず当惑した。
I am just going for a walk.	私はちょうど散歩に出かけるところです。
I happened to know her name.	私はたまたま彼女の名前は知っていた。
I often get a letter from him.	私はたびたび彼から手紙をもらう。
I have never been to that town.	私はその町へ行ったことがない。
I was at my best this morning.	私はけさ実に体の調子がよかった。
I visited many parts of England.	私はイギリス各地を見物した。
I want this letter opened now.	私は、この手紙を今開けてほしい。
Let me make my stand clearer.	私の立場をもっとハッキリさせよう。
My real address is as follows.	私の本当の住所は下記の通りです。
My father is a teacher of English.	私の父は英語の先生です。
My hair is as long as Jane's.	私の髪はジェーンの髪と同じ長さだ。
My son will take over the job.	私の息子が仕事を引き継ぐだろう。
I've got no answer to my letter.	私の手紙に返事は来なかった。
My town is not what it used to be.	私の街は昔の街ではない。
My knowledge of German is poor.	私のドイツ語の知識は貧弱です。
I saw a man coming toward me.	私に向かってやって来る人が見えた。
I would like you to stay with me.	私と一緒にいてもらいたい。
We left home early in the morning.	私たちは朝早く家を出た。
We have to meet the demand.	私たちは需要を満たさなければならない。
We have a lot of work to do.	私たちはするべき仕事がたくさんある。
What happened to our order?	私たちの注文はどうなっているのですか。
It is Paris that I want to visit.	私が訪れたいのはパリです。
Do you want me to open the window?	私が窓を開けましょうか？
I wish I were as young as you.	私が君と同じように若ければなあ。
Well begun is half done.	始まりがうまければ半ばうまくいったもおなじ。
I feel like going out for a walk.	散歩に出かけたい気がする。
I remember seeing you last year.	昨日会ったことを覚えている。
Do you feel any better today?	今日の方が少しは気分がいいですか。
I would rather not go out today.	今日はむしろ外出したくない。
I have a lot of things to do today.	今日はすることが多い。
I'll look around the city today.	今日、町を見物するつもりだ。
How are you feeling this morning?	今朝は気分はいかがですか。
How are you feeling this morning?	今朝のご気分はどうですか。
Have you ever visited Kyoto?	今まで京都に行ったことがありますか。
I am not content with what I am.	今の自分には満足していない。
Now I am too old to walk.	今、私は年をとりすぎて歩くことができない。
You can stay as long as you like.	好きなだけ滞在して下さい。
You can stay as long as you like.	好きなだけいていいですよ。
Do you have something with keys?	鍵がついてるのはありますか。
Do you like to be kept waiting?	君は待たされるのが好きですか。
You'd better not go out today.	君は今日は外出しないほうがよい。
You may as well go to bed at once.	君はすぐ寝たほうがよい。
You had far better stay here.	君はここにとどまる方がずっとよい。
Your efforts will soon pay off.	君の努力はもうじき実るだろう。
Your English has improved a lot.	君の英語はとてもよくなった。
It is no use your waiting for him.	君が彼を待っても無駄だ。
She is probably over forty.	恐らく彼女は４０を超えているでしょう。
Now, the situation is out of hand.	既に手に負えない状態だ。
I was almost run over by a car.	危うく車にひかれそうになった。
We soon believe what we desire.	願っていることはすぐに信じる。
We were driven to the wall.	我々は絶体絶命のピンチに追い込まれた。
The cause of the fire was known.	火事の原因が明らかになった。
All the family got out of the car.	家族は全員車から降りた。
I'm at a loss for what to say.	何を言うべきか分からないんです。
I was at a loss what to say.	何といえばいいのか私は途方にくれた。
Would you like something to drink?	何かお飲みになりますか？
I would like to order drinks now.	飲み物を注文したいのです。
How many days are there in a week?	一週間は何日ありますか。
The party crossed over to America.	一行はアメリカへ渡った。
Come home before it gets dark.	暗くなる前に家に帰ってきなさい。
It is getting dark. Let's go home.	暗くなってきた。帰ろう。
We respected him all the more.	われわれは彼をますます尊敬した。
We have yet to learn the truth.	われわれはまだ真相を知らない。
I visited Paris in Europe.	ヨーロッパにいる間に僕はパリをたずねた。
There were five fires last night.	ゆうべは火事が５件あった。
Can you give me a better price?	もっと安い価格になりませんか。
Let me help you, if necessary.	もし必要ならば手伝わせて下さい。
Will you let me try once more?	もう一度私にやらせてくれますか。
Mary showed the letter to me.	メアリーは手紙を私に見せてくれた。
Mike walked up to the boy.	マイクはその少年のところまで歩み寄った。
Perry visited Uraga in 1853.	ペリーは浦賀に１８５３年に来航した。
I wish Beth were here with me now.	ベスが今ここにいたらな。
I was at a loss what to say.	なんと言えばよいか私は途方に暮れた。
Why was I turned down for the job?	なぜ就職を断られたのか。
Why do you have to work late?	なぜ残業しないといけないのですか。
Any bed is better than no bed.	どんなベッドでもないよりはよい。
Choose any one book you like.	どれでも好きな本を１冊選びなさい。
Tom saw something red there.	トムはそこで何か赤いものを見ました。
I am on speaking terms with Tom.	トムとは口をきき合う間柄だ。
Stand up and read the book, Tom.	トム、立って本を読みなさい。
How long will you stay in Japan?	どのくらい日本に滞在するか。
Tony was a good, strong boy.	トニーは良い子でじょうぶな子でした。
It is too dark for me to read.	とても暗いので私は本が読めない。
You know where everything is.	どこに何があるか知っているでしょ？
It appeared to be a true story.	それは本当の話だと思いました。
It is by no means an easy job.	それは決して容易な仕事ではない。
There is one big difference.	それは１つの大きな違いがあるからだ。
Then he lay on the same bed.	それから彼は同じベッドに横になった。
You should consider the problem.	その問題を良く考えるべきだ。
The question doesn't concern me.	その問題は私には関係がない。
The town has a European air.	その町はヨーロッパ風のところがある。
The people are on the team.	その人たちは同じチームに所属している。
The boy has a good school record.	その少年は学業成績がいい。
You needn't answer the letter.	その手紙に返事を出す必要はない。
The car is easy for me to drive.	その車は私には運転しやすい。
A good idea occurred to me then.	その時、いい考えが浮かんだ。
Are you quite certain about it?	その事は本当に確かなのですか。
How about going to see the game?	その試合を見に行きませんか。
