"Did you watch TV last week?" "No, I didn't."	「あなたは先週テレビを見ましたか」「いいえ」
"How about going to the movies on Saturday?" "I'd like to go."	「土曜日に映画を見に行くのはどうですか」「行きたいですね」
"How can a man be born when he is old?" Nicodemus asked.	ニコデモは言った。「人は老年になっていて、どのようにして生れる事が出来るのですか」
"How many keys?" asked Pepperberg.	「鍵はいくつある？」とペパーバーグが聞く。
"I feel like playing cards." "So do I."	「トランプしたいなあ。」「私も。」
"I feel like playing cards." "So do I."	「トランプしたいなあ」「私も」
"I understand how you feel, Hiroshi," says Mike.	「博、君の気持ちは分かるよ」とマイクが言います。
"I'm back." "Welcome home."	「ただいまー」「お帰りなさい」
"I'm going to Hawaii next week." "Really?"	「私は来週ハワイへ行くつもりよ」「ほんと？」
"May I go with you?" "By all means."	「一緒に行ってもいいですか」「どうぞ」
"May I use the phone?" "Please feel free."	「お電話をお借りしてもいいですか」「どうぞ、どうぞ」
"Seen my cell phone?" "On the table!"	「俺の携帯見なかったか？」「テーブルの上よ」
"What are these?" "They are your pictures."	「これらは何ですか」「あなたの写真です」
"What brand is your car?" "It's a Ford."	「君の車はどこの製品ですか」「フォード社のです」
"When did you buy it?" "Let's see. I bought it last week."	「いつそれを買ったの」「ええと、先週でした」
"You talk too much," he said.	口数が多いぞと彼は言った。
1980 was the year when I was born.	１９８０年は私が生まれた年です。
80% of all English words come from other languages.	すべての英語の単語のうち、８０％は他の言語を起源としています。
A TV set of this size will take little space.	この型のテレビならあまり場所をとらないでしょう。
A baby was born to them.	彼らに赤ちゃんが生まれた。
A change of air will do you a lot of good.	転地療養は大いに君のためになるだろう。
A change of air will do you good.	転地があなたにとって効果があるでしょう。
A child needs love.	子供には愛情が必要だ。
A child today would not do that.	いまどきそんなことは子供だってしないだろう。
A child was born to them.	彼らに子供が産まれた。
A child was run over here last night.	昨夜ここで子供がひかれた。
A family is the smallest unit of society.	家族は社会の最小構成単位である。
A few people have two cars.	車を２台もつ人が２、３人いる。
A good many people have told me to take a holiday.	たくさんの人たちが私に休暇を取るように言った。
A group of children were playing in the park.	子供たちの一団が公園で遊んでいた。
A group of children were playing.	子供たちが集団で遊んでいた。
A little language goes a long way.	ちょっと言葉を知っていればずいぶん役にたつよ。
A lot of jobs are done by computers.	多くの仕事がコンピューターによってなされている。
A lot of people applied for the job.	大勢の人がその職を申し込んだ。
A lot of people helped out.	いろんな人が努力をしました
A lot of people look up to you. Don't let them down.	多くの人があなたを尊敬しています。彼らをがっかりさせないで下さい。
A lot of people really supported me.	私は本当に多くの人たちに支えられました
A lot of students are present at the meeting.	多くの学生がその会合に出席しています。
A lot of students around the world are studying English.	世界中の多くの学生が英語を学んでいる。
A lot of students do part-time jobs.	たくさんの学生がアルバイトをする。
A lot of time is still needed before it can be used.	利用できるまでに、まだ多くの時間が必要だ
A man called on you last night.	昨晩ある人があなたを訪ねてきました。
A man came up to me and asked for a match.	一人の男がつかつかと近づいてきて、マッチを貸して下さいと言った。
A man is as old as he feels.	男の年齢は気持ち次第だ。
A new hotel will be built here next year.	来年ここに新しいホテルが建てられるだろう。
A new student came into the class.	新入生が教室へ入ってきた。
A new team had a match.	新チームが試合をしました
A person named Itoh wants to meet you.	伊藤さんという方がお会いしたいそうです。
A person named West called while you were out.	留守中にウェストという人から電話があったよ。
A student wants to see you.	学生がお会いしたいと言っています。
A support network needs to be built.	支援のネットワークづくりが求められる
A university job would give you a lot more free time.	大学の仕事のほうが、今よりもはるかに自由な時間を持てるでしょう。
A war broke out between the two countries.	その二国間で戦争が起こった。
A watch was given to me by her.	彼女は私に時計をくれた。
A white ship came into view.	白い船が見えてきた。
A young man broke into my house last night.	昨夜若い男が家に押し入った。
A young man came for the new product.	若者が新製品を引き取りにきた。
A young person wants to see you.	お若いかたがあなたにお会いしたいそうです。
About face!	回れ右！
Above all, I take care of my health.	私はとりわけ健康に注意している。
Above all, I want to see him again.	何よりも、彼にもう一度会いたい。
Above all, children need love.	とりわけ子供たちは愛情を必要とする。
Above all, you must help each other.	何よりもまず、君たちはお互いに助け合わなければいけない。
Above all, you must work now.	なによりもまず、今君は働かなければならない。
Add a few more names to the list.	そのリストにもう２、３の名前を加えなさい。
Add up these figures.	この数字を合計しなさい。
Adults only.	未成年者お断り。
Again, there is another side to the story.	さらにまた、その話にはもうひとつの側面がある。
Again? Not again!	また？もう勘弁してよ。
Aged people like to keep the world the way it is. On the other hand young people love to change the world.	年をとった人は世の中を現在あるがままにしておきたがる。他方、若者は世の中を変えたがる。
Ages 68 and below.	年齢が６８歳以下の者とする
Air the futon.	蒲団を干して下さい。
Alex will answer, "Color!"	アレックスは「色」と答えるのである。
Alice wasn't present at the meeting, was she?	アリスは会議に出席していませんでしたね。
All are interested in Japan.	みんなが日本に興味をもっている。
All are welcome.	だれでも歓迎します。
All families with children get special rates.	子供のいる家族はみな特別料金です。
All of the students were present.	学生全員が出席した。
All of us talk in English.	私たちは皆英語で話す。
All of us want to live as long as possible.	私たちは皆できるだけ長く生きたいと思います。
All possible means have been tried.	あらゆる可能な手段をつくしてみた。
All right, I will do it again.	よしもう一度やろう。
All roads lead to Rome.	すべての道はローマに通ず。
All sorts of people live in Tokyo.	東京には色々な人が住んでいる。
All students have access to the library.	全学生はみんな図書館に入ることができる。
All the members were present at the meeting.	会員はみんなその会に出席していました。
All the people must purchase health insurance.	国民全員が必ず医療保険に入ります
All the roads leading into the city are full of cars.	その都市に入る道はすべて車で一杯である。
All the schools are closed on that holiday.	その休日にはすべての学校が休みになる。
All the stories are interesting.	どの話も面白い。
All the students are present.	全ての生徒が出席している。
All the students are studying English.	すべての学生が英語を勉強している。
All the students come from the US.	学生はすべてアメリカ出身だ。
All the students go home early on Saturday.	土曜日には生徒はみんな早く帰宅する。
All the students have gone home.	生徒達はみんな家に帰りました。
All the students like holidays.	生徒たちはみんな休日が好きだ。
All the students look up to him.	生徒たちは皆彼を尊敬している。
All the students of the university have access to the university library.	その大学の学生は皆、大学の図書館を自由に利用できる。
All the students study English.	その学生たちは全員英語を勉強しています。
All we need now is action, not discussion.	我々に今必要なのは行動することであって話し合うことではない。
All you have to do is follow me.	あなたは私についてきさえすればよい。
All you have to do is study hard to get into a good college.	良い大学に入るためには、あなたは一生懸命勉強するだけでよいのです。
All you have to do is study harder.	あなたはもっと一生懸命勉強しさえすればいいのです。
All you have to do is to make a comment.	あなたは意見を述べさえすればよい。
All you have to do is to meet her there.	君はそこで彼女に会えさえすればよい。
All you have to do is to meet her.	あなたは彼女に会いさえすれば良い。
All you have to do is to work harder.	君はもっと熱心に勉強しさえすればよい。
Always do what is right.	常に正しい事をせよ。
Am I on the right road?	この道でいいの？
America is a country on the move.	アメリカは動いてる国である。
America is a large country and its people are mobile.	アメリカは国土が広く、人々はよく移動する。
An error was made.	間違いがありました。
An important post was given Tom.	重要な地位がトムに与えられました。
And just think, you're on the other side of the world.	それに、考えてもごらんなさいよ。あなたは地球の裏側にいるのにね。
And they knew something which the Europeans did not.	そして彼らはヨーロッパ人が知らなかったことを知っていた。
Andy must have practiced very hard.	アンディは、猛練習したにちがいない。
Animal bodies are made up of cells.	動物の体は細胞でできている。
Answer 24 questions.	２４の質問に答える
Answer in English.	英語で答えなさい。
Answer me this.	これから言うことに答えなさい。
Answer me this. Did you see her there?	これから言うことに答えなさい。あなたはそこで彼女に会ったのですか。
Answer me.	私の質問に答えなさい。
Answer the phone, please.	電話に出てください。
Answer the phone.	電話にでなさい。
Answer the question.	質問に答えなさい。
Answer to your name when it is called.	名前が呼ばれたら返事をしてください。
Answer to your name when it is called.	名前が呼ばれたら返事をしろ。
Any amount of information will do.	どれだけの情報でもうれしい。
Any amount of money will be welcome.	どれだけのお金でもありがたい。
Any amount of money will do.	いかほどの金額でも結構です。
Any book will do as long as it is interesting.	面白ければどんな本でも結構です。
Any book will do, so long as it is interesting.	おもしろいならどんな本でもよい。
Any child can answer that.	どんな子供だってそのくらい答えられる。
Any child can do that.	どの子供でもそんなことはできる。
Any child can do that.	どんな子供でもそれをすることができます。
Any child could do that.	どんな子供でもそれはできよう。
Any child knows it.	どんな子供でもそれは知っている。
Any goods can be supplied at a day's notice.	一日前に予告してもらえばどんな品物でも供給できます。
Any magazine will do.	どんな雑誌でも結構です。
Any student can answer that question.	どんな生徒でもその質問に答えられる。
Any student in our college can use the computer.	私たちの大学のどの生徒もコンピューターを使える。
Any student with an I.D. card has access to the library.	身分証明書を持っている学生なら、誰でも図書館に入ることができる。
Apply in writing.	書面でお申し込み下さい。
Apply within.	応募の方はお入りください。
Arabic is a very important language.	アラビア語は非常に重要な言葉です。
Archie made a move on her.	アーチーは彼女に言い寄った。
Are the children playing in the park?	子供たちは公園で遊んでいますか。
Are there any English magazines in this library?	この図書館には英語の雑誌がありますか。
Are there any good films on this week?	今週はよい映画が上映されてますか。
Are there any tours of the city?	市内観光ツアーはありますか。
Are they displayed all through the year?	それらは１年を通してずっと飾られている。
Are those your pictures?	あれらはあなたの絵ですか。
Are we allowed to take pictures here?	ここで写真を撮ってもよろしいですか。
Are you a Japanese student?	君は日本の学生ですか。
Are you a Japanese student?	君は日本人の学生ですか。
Are you a college student?	大学生ですか。
Are you a high school student?	あなたは高校生ですか。
Are you a member of this society?	この会の会員ですか。
Are you a new student?	新入生の方ですか？
Are you a student of a private high school?	あなたは、私立高校の生徒ですか。
Are you a student?	あなたは学生ですか。
Are you against my plan?	私の計画に反対ですか。
Are you always at home in the evening?	あなたは晩にはいつもご在宅ですか。
Are you bringing your camera?	カメラは持っていくのですか。
Are you content with your position in the company?	あなたは会社での地位に満足していますか。
Are you done with that magazine?	あの雑誌はもうすみましたか。
Are you for or against my plan?	君は私の案に賛成ですか反対ですか。
Are you for or against my plan?	私の計画に賛成ですか、反対ですか。
Are you for or against the bill?	君はその法案に賛成なのか反対なのか。
Are you for or against the plan?	この計画に賛成ですか、反対ですか。
Are you for or against the plan?	その意見に賛成ですか、それとも反対ですか。
Are you for or against the plan?	君はその計画に賛成ですか、それとも反対ですか。
Are you for or against this?	あなたはこれに賛成ですか、反対ですか。
Are you for the war or against it?	君は戦争に賛成か反対か。
Are you going to do it over again?	またやり直しですか。
Are you going to pay a visit to China this fall?	あなたはこの秋中国を訪れるつもりですか。
Are you having your period?	現在生理中ですか。
Are you in agreement with the new law?	あなたはその新しい法律に賛成ですか。
Are you interested in Japanese music?	日本の音楽には興味がありますか。
Are you interested in music?	あなたは音楽に興味がありますか。
Are you on the committee?	君はあの委員会のメンバーですか。
Are you planning to take part in the meeting?	あなたはその会合に出席する予定ですか。
Are you planning to take part in the meeting?	君はその会合に出席するつもりですか。
Are you planning to take part in the meeting?	君はその会合に参加するつもりですか。
Are you reading an interesting book?	あなたは面白い本を読みますか。
Are you single?	独身ですか。
Are you students at this school?	君たちはこの学校の学生ですか。
Are you students?	あなたたちは学生ですか。
Are you talking to me?	俺に話してるのか。
Are you through yet?	もう終わったの？
Are you younger than him?	君は彼より若いのかい。
Art is long, life is short.	芸術は長く、人生は短い。
As a child, Bob lived in Boston.	子供のときボブはボストンに住んでいた。
As a result, more than 40 items were found.	結果４０点以上の商品が見付かりました
As for me, I have no question.	私に関して言えば、何の質問もありません。
As for the students of today, I don't know what they are thinking about.	近頃の学生といえば、何を考えているのか私にはわからない。
As is the case with him, he reported the event.	彼にはよくあることだが、軽はずみにその事件を報道した。
As it is very hot today, I don't feel like studying.	今日はとても暑いので勉強する気になれない。
As many men as came were welcomed.	来た人たちはみな歓迎された。
As of today, we haven't had an answer from him.	今日現在、彼から返事をもらっていない。
As yet we have not made any plans for the holidays.	今までのところ、私たちは休みの計画は立てていない。
As yet, I have not completed the work.	今までのところ、まだその仕事は出来上がっていない。
As yet, the project is in the air.	その計画は今のところ未決定である。
Ask me something easier.	もっと易しい事を聞いて下さい。
Ask me something easier.	何かもっとやさしいことを聞いてくれ。
Ask your question.	質問をどうぞ。
At all events we have done our best.	ともかく我々はベストを尽くしたのだ。
At any rate, we have no means of helping him.	いずれにしても、彼を助ける手段はない。
At best he'll get 1,000 votes.	彼の取れるのはよくて千票でしょう。
At first, I couldn't figure out what he was saying.	はじめ彼が何を言っているのかわからなかった。
At first, I couldn't understand what he said.	最初は私は彼が言っていることを理解できませんでした。
At last, I found out the answer to the question.	私はついにその問題の答えを出した。
At last, my turn came.	やっと順番がきた。
At last, they met face to face.	ついに彼らは面と向かい合った。
At last, we got through with the hard work.	ついに我々はその困難な仕事を仕上げた。
At night we can see more stars there than in Tokyo.	夜は、そこでは東京よりたくさんの星が見える。
At present, we have 1,600 students at our school.	現在本校には１６００名の生徒がおります。
At that time, she was a student at Yale.	その頃彼女はエール大学の学生であった。
At times I can't understand him.	彼のことがわからなくなることがときどきあります。
At your age, I would think so, too.	君の年齢だったら、私もそう考えるだろうね。
Babies are interesting to watch.	赤ちゃんは見ていて楽しい。
BarR is looking for part-time staff.	ＢａｒＲではただいまアルバイトスタッフを募集しています
Because I am a student of old language.	なぜなら私は古い言語を学んでいる学生だから。
Being young, he can work all day long.	若いから彼は一日中働ける。
Ben is not as young as he looks.	ベンは見かけほど若くない。
Betty drives fast.	ベティは車を運転するとスピードを出す。
Betty never said a word.	ベティは一言も言わなかった。
Bill brought me the book.	ビルは私にその本を持ってきてくれた。
Bill called me last night.	ビルがゆうべ私に電話してきた。
Bill came all the way from Florida.	ビルはフロリダからはるばるやってきました。
Bill can run faster than Bob.	ビルはボブより速く走れます。
Bill didn't turn up at the party.	ビルはそのパーティーへ姿を現さなかった。
Bill has a part-time job so that he can buy a car.	ビルは車を買うためにアルバイトをしている。
Bill has many friends.	ビルには多くの友達がいる。
Bill has stock in that company.	ビルはあの会社の株を持っている。
Bill is my best friend.	ビルは私の一番の親友です。
Bill is two years older than I.	ビルは私よりも２歳年上である。
Bill was in Japan.	ビルは日本にいました。
Bill was singled out for a special award.	ビルが特別賞に選ばれた。
Bill was too young to take the post.	ビルは若すぎてその役職につくことができなかった。
Bill will return next week.	ビルは来週帰って来ます。
Billy will come to Japan in the early evening.	ビリーさんが夕方頃に日本にやってくる
Bob can answer all the questions.	ボブはこの問題すべてに答えられる。
Bob can drive a car, too.	ボブも車を運転できます。
Bob has too many books to read.	ボブは読みきれないほどたくさんの本を持っている。
Bob saw him again.	ボブは再び彼にあった。
Bob was born in the same year as you.	ボブは君と同じ年に生まれた。
Books and friends should be few but good.	書物と友人は数が少なくよいものをもつべきだ。
Books and friends should be few but good.	本と友は数が少なく質が良くなければいけない。
Books for young people sell well these days.	若者を対象にした本が近頃良く売れる。
Books must follow sciences, and not sciences books.	書籍が学問に従うべく、学問が書籍に従うべからず。
Both he and I are high school students.	彼も私も高校生です。
Both he and I were members of that club.	私と同様に彼もクラブのメンバーだった。
Both of them were not present at the meeting.	彼らの両方がその会合に出席したわけではなかった。
Both of us want to see the movie.	私たちは２人ともその映画を見たい。
Both teams are well matched. The game will be an interesting one.	実力が伯仲したチーム同士の対戦なので面白い試合になりそうだ。
Both work and play are important.	勉強も遊びも大事だ。
Both you and I are students.	あなたも私も学生です。
Both you and I are students.	君も私も学生だ。
Break off with such a man as that.	ああいう男とは縁を切れ。
Brian looks blue.	ブライアンは憂鬱そうに見える。
Bring him in.	彼を中に入れなさい。
Bring it back to me.	それを私に戻して下さい。
Bring it back when you are through.	済んだら戻してください。
Bring it here.	それをこっちへ持ってきなさい。
Bring it to me.	それを私のところに持って来なさい。
Bring me the Kleenex.	ティッシュを持ってきて。
Bring me the key.	キーを持ってきて。
Bring me the magazines.	雑誌を持ってきてください。
Bring me today's paper, please.	今日の新聞を持って来てください。
Bring me today's paper.	今日の新聞を持ってきて欲しい。
Bring the book to me, not to Tom.	その本をトムのところではなく、僕のところへ持ってきて下さい。
Bring your books down.	本を持って降りなさい。
Bring your children with you.	お子さんを連れて行きなさい。
Bring your friends with you.	お友達を連れていらっしゃい。
Bring your work to my room.	仕事を私の部屋に持ってきなさい。
Bringing up a baby is hard work.	赤ちゃんを育てるのは重労働です。
Build up your body while young.	若いうちに体を鍛えなさい。
Business results of the company were much better than other companies in the industry.	同業他社に比べて業績がずっと良かった。
But I can't understand them very well.	でも私はあまりよくそれらを理解できない。
But I understand what he says.	でも、私は彼の言うことが分かります。
But for language, there would be no thought.	言葉がなければ、思想はないであろう。
But for my family, I would not have worked so hard.	もし私に家族がいなかったら、あんなに一生懸命働かなかったことでしょう。
But for my family, I would not work so hard.	もし私に家族がいなければ、、こんなに一生懸命に働かないでしょう。
But he doesn't know it yet.	しかし彼はそのことをまだ知らない。
But he likes the long school holidays.	でも彼は長い学校の休みが好きなんだよ。
But not really.	しかし、実際は違いました。
But then he fell in love with Jane Wilde, a student studying languages in London.	しかし、その時、彼はロンドンで語学を学んでいる学生のジェーン・ワイルドを恋するようになった。
But today, a lot of young people are following her example.	しかし今日、多くの若者達が彼女にならって活動している。
But we can't understand him.	しかし、私たちは彼の言うことが理解できない。
By 'Torii' you mean that red objet d'art at the top of the steps?	鳥居と言うと、階段を上がったところにあった赤いオブジェ？
