How much is the tour?	そのツアーはいくらですか。
How much is this camera?	このカメラはいくらですか。
How much is this radio?	このラジオはいくらか。
How much is this radio?	このラジオはいくらですか。
How much is this watch?	この腕時計はいくらですか。
How much money do you have in the bank?	銀行にどれだけお金がありますか。
How much more does it cost to return the rental car to another location?	レンタカーの乗り捨て料金はいくらだろう？
How much was the additional charge?	割り増し料金はいくらでしたか。
How much will it cost you to go by air?	飛行機で行くとどれくらいかかりますか。
How much would you want to pay for the tour?	予算はどのくらいでしょうか。
How old are your children?	お子さんたちはおいくつですか。
How old were you when the war broke out?	戦争が勃発したとき、あなたはいくつでしたか。
How shall I put it?	どう表現すればいいでしょうか。
How she talks!	彼女は何ておしゃべりなんだろう。
How short life is!	人生なんて短い。
How to live is an important question for young people.	いかに生きるべきかは、青年にとって重要な問題である。
How was your holiday?	お休みはどうでしたか。
How young she is!	彼女はなんて若いのでしょう。
How's Saturday night?	土曜の夜はどうかな？
However fast you run, you won't be in time.	どんなに速く走っても間に合わないだろう。
However hard I try, I can't do it any better than she can.	どんなに一生懸命やっても、私はそれを彼女よりうまくできない。
However hard he worked, he did not become any better off.	いくら一生懸命働いても、彼の暮らしは少しも良くならなかった。
However small it may be, I want a house of my own.	どんなに小さくてもよいから、自分の家がほしい。
However we go, we must get there by seven.	どういっても七時までにいかないと。
However you do it, the result will be the same.	どんな方法でやっても、結果は同じだろう。
However, I have no money.	しかし、わたしにはお金はありません。
I also gave him a little something as a Christmas present the other day.	私も先日クリスマスプレゼントにちょっとしたものをあげました。
I also heard a similar story.	私も似た話を聞いたことがある。
I always feel blue on Mondays.	月曜日はいつも憂鬱だ。
I always get up at six.	私はいつも六時に起きます。
I always get up at six.	私はいつも６時に起きる。
I always get up early.	私はいつも早く起きる。
I always have to give in to him.	私はいつも彼に服従しなければならない。
I always keep my word.	いつも約束を守っているだろ。
I always study hard.	いつも頑張って勉強してるよ。
I always wanted to see you.	いつもあなたに会いたいと思っていました。
I am a Hyogo University student.	私は兵庫大学の学生です。
I am a little out of sorts today.	今日は少し気分が悪い。
I am a new student.	私は新入生です。
I am a student at London University.	私はロンドン大学の学生です。
I am a student at Oxford University.	わたしはオックスフォード大学の学生です。
I am a student of this school.	私はこの学校の生徒です。
I am a student, but he isn't.	私は学生だが彼はちがう。
I am a student.	私は学校に通っています。
I am a student.	私は学生です。
I am a university student.	大学生です。
I am against the war, of course.	もちろん、戦争には反対だ。
I am against this project.	私はこの計画に反対です。
I am always at home on Sundays.	私は日曜日にいつも家にいる。
I am always helped by you.	わたしはいつでもあなたに助けられている。
I am an American student.	私はアメリカ人の学生です。
I am an only child.	私は一人っ子です。
I am content with my current position.	私は現在の地位に満足している。
I am contented with my lot.	私は運命に満足している。
I am going to let her do as she likes.	私は彼女に好きなようにさせるつもりだ。
I am going to major in French.	私はフランス語を専攻するつもりです。
I am going to watch TV this evening.	私は今晩テレビを見るつもりです。
I am good friends with Bill.	私はビルと仲良しです。
I am having a very hard time.	私はとても困っているのです。
I am human.	私は、人間です。
I am in agreement with most of what he says.	彼の言っていることの大方に私は同感である。
I am in charge of it.	わたくしが管理をします
I am in charge of the third-year class.	私は３年生を受け持っている。
I am in charge of this.	これは、私の担当だ。
I am in the music club.	私は音楽クラブに入っています。
I am interested in Asian history.	アジアの歴史に興味があります。
I am interested in English.	私は英語に興味があります。
I am interested in Japanese history.	私は日本の歴史に興味がある。
I am interested in Japanese history.	私は日本史に興味がある。
I am interested in computers.	コンピューターに興味があるんだよ。
I am interested in music.	私は音楽に興味があります。
I am interested in old cities in the world.	私は世界の古い都市に興味を持っています。
I am interested in taking pictures.	私は写真を撮る事に興味がある。
I am interested in this book.	私はこの本が面白い。
I am interested in this story.	私はこの話が面白い。
I am learning her name still, too.	私は今でも彼女の名前を覚えている。
I am looking at the pictures of Jane.	ジェーンの写真を見ているところだ。
I am looking for a part-time job so I can buy a new video camera.	新しいビデオカメラを買えるように、アルバイトの口を探しています。
I am meeting him next Friday.	彼と来週の金曜日あうつもりです。
I am moving next month.	来月には引っ越す予定です。
I am moving next month.	来月に引っ越す予定です。
I am never at home on Sundays.	私は日曜日に家にいることはありませんよ。
I am never free on Sundays.	私はどの日曜日も暇でない。
I am no longer a child.	私はもう子供ではありません。
I am no match for him.	私は彼にはかなわない。
I am no more an artist than you are.	あなたと同様私も芸術家ではないのです。
I am no younger than you are.	ぼくは君と同じく若くない。
I am not always at home on Sundays.	私は日曜日にいつも家にいるわけではない。
I am not always free on Sundays.	私は日曜日いつも暇であるとは限らない。
I am not in the least interested in the story.	私はその物語には全然興味がない。
I am not now in a position to help you.	私は今あなたを助けられる境遇ではない。
I am not used to hard work.	私はきつい仕事には慣れていない。
I am older than any other student in my class is.	私はクラスの中で最年長である。
I am on holiday this week.	私は、今週休みです。
I am on holiday this week.	私は今週お休みです。
I am on holiday this week.	私は今週はお休みです。
I am only too pleased to come with you.	喜んであなたと参ります。
I am pleased to see you again.	あなたに再会できてうれしい。
I am pleased with the result.	その結果に喜んでいる。
I am reading a book about animals.	私は動物に関する本を読んでいる。
I am reading a magazine.	私は雑誌を読んでいます。
I am really pleased with my new car.	私は新車がとても気に入っている。
I am running short of memory.	私は記憶が不足している。
I am running short of memory.	私は記憶力が不足している。
I am running short of money.	お金が足りなくなってきている。
I am running short of money.	私はお金が足りなくなってきた。
I am sending you a picture of my family.	あなたに私の家族の写真を送るつもりだ。
I am seventeen years old, too.	私も１７歳です。
I am short of money.	お金がなくなった。
I am short of money.	私はお金が不足している。
I am short of money.	私はお金に困っている。
I am short of money.	金に不足している。
I am shorter than he.	私は彼より背が低い。
I am shorter than you.	私はあなたよりも背が低い。
I am studying very hard.	私は一生懸命勉強している。
I am talking with Tom.	私はトムと話しています。
I am thinking about my children.	子供たちの事を考えている。
I am to meet him at six.	私は彼と６時に会うことになっている。
I am to meet him at ten.	彼と１０時に会うことになってるの。
I am to meet him there.	彼とそこで会うことになっている。
I am to meet him there.	私は彼とそこで会うことになっている。
I am two years younger than he.	私は彼より2歳若い。
I am very interested in French.	フランス語にはとても興味があります。
I am very interested in music.	私は音楽にたいへん興味をもっている。
I am very interested in these stories.	私はこれらの話に非常に興味があります。
I am very pleased to hear the news.	その知らせをお聞きして大変喜ばしく存じます。
I am very pleased to meet them.	あの方たちに大変うれしいです。
I answered for him.	私は彼に代わって応えた。
I applied for a position in the office.	私はその会社に職を求めた。
I ask you a question.	あなたに一つお尋ねします。
I asked Ann if she were a student.	私はアンに、君は学生ですかと尋ねた。
I asked Tony a question.	私はトニー君に質問した。
I asked a question of him.	私は彼に質問をした。
I asked him a question.	私は彼に質問を尋ねた。
I asked him if he wanted a watch.	時計が欲しいのですかと私は彼に言った。
I asked him if he would go too.	私は彼も来るかとたずねた。
I asked him not to drive so fast.	私は彼にそんなにスピードを出さないでくれと頼みました。
I asked him to come at eight, but he turned up at nine.	私は彼に８時に来てくれと言ったが、彼は９時に現れた。
I asked many persons about the store, but no one had heard of it.	私はその店のことを多くの人に尋ねたが、聞いたことがある人はだれもいなかった。
I asked the student what image he had of black people.	学生に黒人に対するイメージを聞いた。
I became a director.	私は役員になった。
I became a member of the club in 1980.	私は１９８０年にそのクラブの会員になった。
I bought a book about animals.	動物についての本を買ったよ。
I bought a camera free of tax.	私は無税でカメラを買った。
I bought a camera the other day.	先日カメラを買いました。
I bought a good camera.	いいカメラを買った。
I bought a watch the other day. It keeps good time.	先日時計を買ったがそれは時間が正確だ。
I bought a watch.	私は時計を買いました。
I bought an English book, but the book was hard to understand.	私は英語の本を買ったが、その本はわかりにくかった。
I bought him a magazine.	彼に雑誌を買ってあげた。
I bought many books today so I put them in order.	私は今日、たくさん本を買ったので、それらを整頓した。
I bought the book which the children need.	私は子供たちに必要な本を買った。
I bought the same camera as you have.	あなたが持っているのと同じカメラを買った。
I bought this watch at the store.	私はこの時計をあの店で買った。
I broke the personal computer.	パソコンを故障させてしまった。
I brought the point home to the student.	要点を学生に十分理解させた。
I brought you a little something.	きみにちょっとしたものをもってきたよ。
I brought you up under my personal care.	お前はわしが手塩にかけた人間だ。
I built a new house.	私は新しい家を建てた。
I called her office, but no one answered.	私は彼女の事務所へ電話してみましたが、誰もでませんでした。
I came to know many university students.	私は多くの大学生と知り合うようになった。
I can figure out what he is trying to say.	私のいわんとしていることは理解できる。
I can figure out what he is trying to say.	私は彼が言おうとしていることが分かる。
I can hear X.	Xがわたしの耳に聞こえる
I can hear something.	私は何か聞こえます。
I can hear you, but I can't see you.	君の声は聞こえるが、姿は見えないよ。
I can meet a lot of you.	多くの皆さんにお会いできる
I can never make you out.	あなたをさっぱり理解できない。
I can never see this movie without being moved.	私はこの映画を見ると必ず感動する。
I can not answer your question.	私はあなたの質問に答えることができない。
I can run as fast as Bill.	私はビルと同じくらい速く走れます。
I can run as fast.	僕も同じくらい速く走れる。
I can run faster than Ken.	私はケンよりも速く走ることが出来ます。
I can run the fastest of the three.	私は３人の中で一番速く走ることができます。
I can understand what you are saying.	わたしはあなたの言うことが理解できる。
I can't bear to work with him.	彼と一緒に働くなんて耐えられない。
I can't do the hard day's work I used to.	むかしのような激しい日雇い労働はできやしない。
I can't feel at home in a hotel.	ホテルではくつろげない。
I can't feel at home in a hotel.	私はホテルでくつろいだ気になれない。
I can't feel at home in a hotel.	私はホテルではくつろげない。
I can't figure him out.	彼がどんな人物かよくわからない。
I can't figure out what he is saying.	私は彼の言っている言葉がよく分からない。
I can't figure out what he means.	どうも彼の考えがよくわからない。
I can't figure out what he really wants.	彼が本当は何が欲しいのかわからない。
I can't figure out what she really wants.	彼女が本当は何が欲しいのか、私にはわからない。
I can't figure out why he did it.	彼がなぜそれをしたのか理解できない。
I can't figure out why he said so.	彼がなぜそう言ったのか理解することができない。
I can't figure out why she didn't come.	どうして彼女がこなかったのかわからない。
I can't find my key.	鍵が見つからない。
I can't find my watch.	腕時計が見つからないんです。
I can't follow you.	あなたの話には付いていて行けません。
I can't hear it.	聞こえないよ。
I can't hear very well.	よく聞こえないのです。
I can't hear you very well.	あなたのおっしゃることがよく聞こえません。
I can't hear you.	聞こえませんよ。
I can't help making a sound.	私が思わず声を出す
I can't help thinking of the future.	将来の事を考えずにはいられない。
I can't make out why he isn't here yet.	彼がなぜまだここに来ないのか僕にはよく分からない。
I can't move.	動けないのです。
I can't put it off any longer.	もうこれ以上延ばすわけにはいかない。
I can't put up with him any longer.	彼にはもう我慢ならない。
I can't put up with him.	彼には我慢できない。
I can't put up with it any longer.	そのことはもはや容赦できない。
I can't put up with it.	我慢できない。
I can't put up with this any longer.	私はもう我慢できない。
I can't really read her.	彼女にはついていけないよ。
I can't run as fast as you.	私はあなたほどに速くは走れません。
I can't see the movie.	映画の画面がよく見えません。
I can't see the other person's face at all.	全く相手の顔が見えません
I can't see what you mean.	君の言うことの意味が分からない。
I can't study with you watching me.	あなたが見つめていては、勉強できないよ。
I can't talk with people.	人と話ができません。
I can't understand X at all.	Xが私には全く理解できない
I can't understand the meaning of this word.	私はこの単語の意味がわからない。
I can't understand this at all.	私はこのことを少しも理解できません。
I can't understand this business.	僕にはこいつが理解できない。
I can't understand this sign's meaning.	この記号の意味が理解できない。
I can't understand what he is thinking about.	私は彼が考えていることが理解できない。
I can't understand what he wants me to do.	私は彼が私に何をするよう望んでいるのか理解できない。
I can't understand what she says.	彼女の言うことはわからない。
I can't understand what you're trying to get at.	何をおっしゃりたいのか、私にはわかりません。
I can't understand why John turned down a job as good as that.	ジョンがなぜあんなに良い仕事を断ったのか私には理解できない。
I charged them too much money for their room.	私は彼らがあの部屋に泊まるのに、お金を請求しすぎた。
I choose X.	Xを私が選ぶ
I compared this picture with that picture.	私はこの絵とあの絵を比較した。
I continued reading the book.	本を読み続けた。
I continued working.	私は仕事をし続けた。
I could answer all the questions.	私はすべての質問に答えられた。
I could hear my name called.	私は自分の名前が呼ばれるのが聞こえた。
I could not make out what he meant.	私は彼の言いたいことがわからなかった。
I could run much faster when I was young.	若いころは今よりずっと早く走ることができた。
I couldn't answer all the questions.	私はすべての質問に答えられたわけではない。
I couldn't answer any questions on the test.	テストで一問も答えられなかった。
I couldn't bear to look at her.	彼女を見るに耐えられなかった。
I couldn't figure out how to do it.	私はそのやり方がわからなかった。
I couldn't figure out what he meant.	私は彼が何を言っているのか理解出来なかった。
I couldn't figure out what he was talking about.	私は彼が何について話しているのか分からなかった。
I couldn't figure out what she was talking about.	私は彼女が何のことを話しているのかわからなかった。
I couldn't hear the sound well.	その音がよく聞こえなかった。
I couldn't help but fall in love with you.	君を好きにならずにはいられなかった。
I couldn't make him understand it.	私は彼にそれを理解させることができなかった。
I couldn't make him understand my English.	彼に私の英語は通じなかった。
I couldn't make out what he meant by 'megafeps'.	メガフェプスってなんのことだか私には理解できなかった。
I couldn't put up with him.	私は彼には我慢がなりませんでした。
I couldn't understand him at first.	私は最初に彼の言うことがわからなかった。
I couldn't understand what he was getting at.	私には彼が何をほのめかしているのかわからなかった。
I did a live show with him at a club.	彼と一緒にライブハウスでライブをやった
I did it against my will.	私は自分の意志に反してそれをした。
I did not study both of the languages.	私はその言語両方とも勉強したわけではなかった。
I did not understand him at all.	彼の言ったことの意味が全然分からなかったよ。
I did not watch TV but studied English last night.	昨夜はテレビを見ないで英語を勉強した。
I did say that, but I didn't mean it.	私は確かにそう言ったが、そのつもりではなかった。
I did the work against my will.	私はいやいやその仕事をした。
I didn't feel like buying a car.	私は車を買う気がしない。
I didn't feel right about X.	Xが私にはしっくり来なかった
I didn't have a good time last night.	昨夜は楽しくありませんでした。
I didn't hear what you said.	あなたが言ったことが聞こえなかったよ。
I didn't hear what you said.	何ていったんですか。
I didn't hear you.	よく聞こえませんでした。
I didn't know that she had a child.	彼女に子供がいるとは知らなかった。
I didn't mean it.	そんなつもりではなかったんだ。
I didn't mean that.	そのつもりで言ったのでは・・・。
I didn't mean to do that.	わたしはそうするつもりは無かった。
I didn't mean to put that on there.	それはもっていくつもりはなかったんだ。
I didn't meet any of my friends.	私は友達のだれにも会わなかった。
I didn't notice at all while I was doing that.	やっている時には全然気がつかなかった
I didn't notice her going out of the room.	私は彼女が部屋から出て行くのに気がつかなかった。
I didn't notice him go out.	私は彼が出て行く事に気がつきませんでした。
I didn't notice it.	それには気付かなかった。
I didn't notice the light turn red.	信号が赤になるのに気づかなかった。
I didn't think I'd meet you here.	ここでお目にかかれるとは思ってもいませんでした。
I didn't turn off the light.	私は明かりを消さなかった。
I didn't understand in the least what he said.	彼の言ったことが少しも理解できなかった。
I didn't understand the meaning at all.	私にはさっぱり意味が分かりませんでした
I didn't understand the meaning of the last line but one.	私には下から２行目の意味がわからなかった。
I didn't want to bring you in.	私は君をまき込みたくなかった。
I didn't want to get up early.	私は早くおきたくありませんでした。
I do not get up early.	私は起きるのが遅い。
I do not like the way he talks.	私は彼の口のききかたが嫌いだ。
I do not understand you.	私はあなたの言っていることがわからない。
I don't always get up early.	私はいつも早く起きるわけではない。
I don't always get up early.	私はいつも早起きするわけではない。
I don't care for moving pictures.	私は映画が好きでない。
I don't care for the way he talks.	彼の話し方が気にいらないのです。
I don't care too much for hot food.	私は辛い食物はあまり好きではない。
I don't feel at home in her company.	彼女と一緒にいるとくつろげない。
I don't feel like going out on such a day.	こんな日には外出したくない。
I don't feel like going out right now.	私は今は外へ出たくない。
I don't feel like going out these days.	このところあまり外出する気がしない。
I don't feel like going out.	外出をする気がしない。
I don't feel like it.	そんな気分じゃないんだ。
I don't feel like studying English today.	今日は英語を勉強する気がしない。
I don't feel like studying.	勉強する気がない。
I don't feel like working today.	今日は仕事をしたくない。
I don't feel like working today.	私は今日働く気がしない。
I don't feel much like talking right now.	今はあまり話したい気がしない。
I don't follow.	君の言うことがわからない。
I don't get what you mean.	君の言いたいことが分からない。
I don't have a very good memory.	記憶には全く自信が無い
I don't have any children.	私は子供がいません。
I don't have any good reference book at hand.	私は手もとによい参考書を持っていない。
I don't have any time to watch TV.	私はテレビを見る時間がありません。
I don't know all of the students.	私はその学生たち全員を知っているわけではない。
I don't know both of your children.	私はあなたの子供を２人とも知っているわけではない。
I don't know how to put it in Japanese.	それを日本語でどういうのがわかりません。
I don't know how to reply to that question.	何と答えていいかわかりません。
I don't know what is in store for me in the future.	私は将来自分に何が用意されているか知らない。
I don't know what that word means, but I'll try to find out.	私にはあの単語がどんな意味かわからないが、考えてみよう。
I don't know what the question means.	この問題の意味がわかりません。
I don't know what this word means.	私はこの言葉が何を意味するのか知りません。
I don't know what you're talking about.	何の話をしてるのか分からないよ。
I don't know when he entered the building.	彼がいつそのビルに入ったのかわからない。
I don't know when he'll come again.	今度彼がいつ来るのかわかりません。
I don't know where my watch is.	僕の時計どこにあるか知らない。
I don't know which to choose.	私はどちらを選ぶべきかわからない。
I don't know who to turn to.	誰に頼っていいかわからない。
