"Are you OK?" "I'm fine!"	「大丈夫か？」「大丈夫だよぉ！」
Hold up your head, and look at me.	頭を上げて、私を見なさい。
Hope to see you again next year.	又来年会えるといいですね。
Hope to see you next time I'm in N.Y.	私はあなたと今度ニューヨークに行ったときに会いたいと思っています。
Hope we can work together soon.	そのうち一緒に仕事ができるといいなと思っています。
Hope you'll get better soon.	すぐによくなるといいね。
Hope you'll have a great one.	いい誕生日を迎えられますように。
Hotels are cheaper in the off season.	シーズンオフはホテルは割安だ。
How I miss you.	君がいなくてどんなにさびしいか。
How I wish I could go, too!	ああ、僕も行けたらなあ。
How I wish I could live my life again.	人生をやり直せたらどんなにいいだろう。
How I wish I had a car.	車があればどんなによいだろう。
How I wished I could drive a car!	車の運転が出来たらどんなによいかと私は思った。
How I've missed you!	君に会いたかったよ。
How about me stopping by?	ちょっとよってみても良いですか。
How about my showing you around the town?	僕がこの町を案内しましょうか。
How about staying at my place this evening?	今晩、うちに泊まってはどうですか。
How about staying with us for a few days?	私達の所に数日泊ったらいかがですか。
How about studying together in the library?	図書館で一緒に勉強しようよ。
How are things for you up there?	そっちの生活はどうだい？
How are things with you?	景気はいかがですか。
How can I get to the nearest post office?	いちばん近い郵便局にはどうやって行ったらいいですか。
How can I get to the nearest post office?	最寄りの郵便局へはどう行けばいいですか。
How can I get to the station?	駅へはどういけばよいのですか。
How can I get to the station?	駅へはどのように行けばよいですか。
How can I start the engine?	どうしたらエンジンがかかりますか。
How can you believe that she made away with the papers?	どうして君は彼女が書類を持ち逃げしたなんて思えるの。
How can you tell good English from bad English?	良い英語と、悪い英語はどのようにして区別できますか。
How did she come to know so much about fish?	彼女はどうやって魚に関する豊富な知識を身につけたのだろう。
How did she ever pass the test?	彼女は一体どうやってその試験をパスしたのかしら。
How did such a thing come about?	どうしてそんなことが起こったの？
How did you come by that fine gold watch?	あの立派な金時計をどうやって手に入れたのか。
How did you come to believe that?	どうしてそれを信じるようになりましたか。
How do I get to your office from Tokyo Station?	東京駅から貴社へはどうやって行ったらよいでしょうか。
How do you like Texas so far?	いかがですか、テキサスは？
How do you like these photos? I had them developed today.	この写真をどう思う、今日現像したのだ。
How do you like this town?	この町は気に入りましたか。
How does that song go?	その歌はどんな歌詩ですか。
How does the song go?	その歌はどんな感じですか。
How does the song go?	その歌はどんな風ですか。
How else can he act?	彼は他に何ができるか。
How ever did you find it?	いったいどうしてそれが見つかったのですか。
How far are you going for a drive?	どこまでドライブに行くの？
How far are you going?	どこまで行くのですか。
How far is it from New York to London?	ニューヨークからロンドンまで、どのくらいありますか。
How far is it from Osaka to Kyoto?	大阪から京都までどれくらいありますか。
How far is it from here to Hakata?	ここから博多までどれくらいですか。
How far is it from here to Tokyo?	ここから東京までどのくらいの距離ですか。
How far is it from here to Tokyo?	ここから東京まではどれくらいの道のりですか。
How far is it from here to Ueno?	ここから上野までどれくらいありますか。
How far is it from here to that station?	ここからその駅までどれくらいの距離がありますか。
How far is it from here to the city?	どのくらいの距離ですか。
How far is it from here to the hotel?	ここからそのホテルまでどのくらいの距離ですか。
How far is it from here to the park?	ここから公園までどれくらいありますか。
How far is it from here to the station?	ここから駅からまでどのくらい距離がありますか。
How far is it from here to the station?	ここから駅までどのくらいあるか。
How far is it from here to the station?	ここから駅までどのくらいの距離ですか。
How far is it from here to the station?	ここから駅までどのくらい離れていますか。
How far is it from here to the station?	ここから駅までどれくらい距離がありますか。
How far is it from here to the station?	ここから駅までどれくらい離れていますか。
How far is it from here to your house?	ここからあなたの家までどれくらいの距離がありますか。
How far is it from here to your house?	ここから君の家までどのくらい距離がありますか。
How far is it from here to your school?	ここからあなたの学校までどれくらいありますか。
How far is it from here to your school?	ここから君の学校まではどれほど離れていますか。
How far is it from here to your school?	ここから学校までどのくらいの距離ですか。
How far is it from here?	ここからどのくらいの距離がありますか。
How far is it from here?	ここからどれくらいの距離ですか。
How far is it from your house to the park?	君の家から公園までどの位離れていますか。
How far is it to New York?	ニューヨークまでどのくらい遠いですか。
How far is it to the green?	グリーンまでどれくらい？
How far is it to the library from here?	ここから図書館までどれくらいありますか。
How far is it to the station?	駅までどのくらいありますか。
How far is it to the station?	駅までどのくらいの距離がありますか。
How far is it to the station?	駅まではどのくらいありますか。
How far?	どのくらい遠い？
How fast Miss Kanda runs!	神田さんは何と速く走るのだろう。
How fast that dog runs!	あの犬は何と速く走るのだろう。
How fine it is today.	今日はなんて天気が良いのでしょう。
How in the world did you do such a thing?	一体どうやってそんな事をしたのだ。
How is it going in the fish market?	魚市場の景気はどうですか。
How is the weather there?	そこでの天候はどうですか。
How is the weather there?	そちらの陽気はどうですか。
How is the weather today?	今日の天気はどうかね？
How is the weather today?	今日の天気はどうですか。
How is the weather today?	今日はどんな天気ですか。
How is the weather?	お天気はどういうぐあいですか。
How is the weather?	天気はどうですか。
How kind Kate is!	ケイトはなんて親切なのだろう。
How kind of you to help me!	私を手伝って下さってありがとうございます。
How kind of you!	どうもご親切に。
How kind of you!	なんとご親切に。
How kind she is.	彼女はなんて親切なのだろう。
How kind you are to come all the way to see me off!	遠路はるばる見送りに来てくださるとはなんとご親切なんでしょう。
How kind you are!	あなたはなんて親切なんでしょう。
How kind you are!	何とあなたは親切なのだろう。
How kind you are!	君はなんて親切なんだ。
How long ago did the author die?	その作家はどの位前になくなりましたか。
How long ago was that?	それはどのくらい前のことでしたか。
How long are you going to stay here?	ここにはどのくらい滞在する予定ですか。
How long are you going to stay here?	どのくらいの滞在予定ですか。
How long are you going to stay here?	何日ぐらい滞在しますか。
How long are you going to stay in Japan?	あなたはどれくらい日本に滞在するつもりですか。
How long are you going to stay in Japan?	いつまで日本にご滞在になりますか。
How long are you going to stay in Oxford?	オックスフォードにはどのくらい滞在する予定ですか。
How long are you going to stay?	どれくらい滞在するのですか。
How long are you going to stay?	何日滞在する予定ですか。
How long are you going to stay?	滞在期間はどのくらいですか。
How long are you staying in Japan?	いつまで日本に滞在のご予定ですか。
How long are you staying?	いつまでここにご滞在ですか。
How long did it take you to write the letter?	その手紙を書くのにどのくらい時間がかかりましたか。
How long did you stay in Canada?	あなたはどのくらいカナダにいたのですか。
How long do we stop here?	ここでどのくらい止まりますか。
How long do we stop here?	ここにはどのくらい止まっていますか。
How long do you plan to stay in this country?	この国はどのぐらいいるつもりですか。
How long do you plan to stay?	いつまでの滞在予定ですか。
How long do you plan to stay?	どのくらいの期間、滞在する予定ですか。
How long does it take from here to Tokyo Station by car?	ここから東京駅まで自動車でどのくらいかかりますか。
How long does it take from here to the station?	ここから駅まで時間はどのくらいですか。
How long does it take to get from here to the station?	ここから駅までどのくらいかかりますか。
How long does it take to get to the station?	駅に着くのにどのくらいかかりますか。
How long does it take to get to your office from the port?	港から貴社まではどれくらいかかりますか。
How long have you been in this town?	この町にどれくらいおられるのですか。
How long have you been staying in Osaka?	大阪にはもうどれくらいご滞在ですか。
How long have you known Miss Smith?	スミスさんとはいつからおしりあいですか。
How long is he going to stay in Japan?	あの人はどのくらい日本に滞在の予定ですか。
How long will it stop there?	どのくらいの時間、その町に停車していますか。
How long will you be staying here?	いつまで滞在なさいますか。
How long will you be staying?	どのくらい滞在するつもりですか？
How long will you stay here?	あなたはここにどのくらいの間滞在するのですか。
How long will you stay here?	あなたはここにどれくらい滞在するのですか。
How long will you stay here?	いつまでここに滞在しますか。
How long will you stay here?	ここにはいつまで滞在していますか。
How long will you stay here?	どれくらいここに滞在するつもりですか。
How long will you stay here?	君はどのくらいここに滞在しますか。
How long will you stay here?	君はどれくらいここに滞在しますか。
How long will you stay in Hakone?	あなたはどのくらい箱根にお泊りですか。
How long will you stay in Japan?	どのくらい日本に滞在するか。
How long will you stay in Kyoto?	あなたは京都にどれくらい滞在しますか。
How long will you stay in Tokyo?	いつまで東京にご滞在ですか。
How many books do you think you have read so far?	今まだにどれだけの本を読んだと思いますか。
How many books do you think you have read so far?	今までに何冊の本を読んだと思いますか。
How many books do you think you have read so far?	今まで何冊の本を読んだと思いますか。
How many boys are there in the room?	部屋には何人の少年がいますか。
How many boys are there in this class?	このクラスには何人の男の子がいますか。
How many boys are there in your class?	あなたのクラスに男の子は何人いますか。
How many days does it usually take to get there?	何日ぐらいで着きますか。
How many days will you remain in London?	君はロンドンに何日残るつもりですか。
How many people live in your town?	あなたの街には何人住んでいますか。
How many samples, for example?	たとえば、標本はいくつですか。
How many samples?	標本はいくつですか。
How many seasons are there in a year?	１年には季節がいくつありますか。
How many stops from here?	いくつめの駅ですか。
How many stops from here?	ここから何番目の駅ですか。
How many times a month do you write letters?	あなたは月に何回手紙を書きますか。
How much do you believe him?	どの程度まで彼を信用していますか。
How much is the commission?	手数料はいくらですか。
How much is the express?	急行の料金は幾らですか。
How much of a discount can you give?	どのくらいなら値引きできますか。
How often a month do you go to the movies?	月に何回映画を見に行きますか。
How often did you visit Kyoto?	あなたは何回京都を訪れましたか。
How often do you go to the movies every month?	毎月何回ぐらい君は映画へ行くか。
How often do you see Tanaka?	あなたはどのくらい田中さんと会っているの。
How often do you see him?	彼に何回ぐらい会いますか。
How often do you study English at school?	学校で何回英語を勉強しますか。
How often have you been here?	これまで何回行きましたか。
How often have you been there?	これまでに何回そこへ行きましたか。
How often have you been there?	そこには何度か行った事があるのですか。
How often have you been there?	そこへは何回行ったことがありますか。
How often have you been to Europe?	何回ヨーロッパにいったことがあるのですか。
How old is that church?	あの教会はどのくらい古いですか。
How old is that dog?	あの犬はいくつですか。
How old is this church?	この教会はどれくらい古いんですか。
How old that dog is!	あの犬はなんて年をとっているのだろう。
How old were you when this town had the big fire?	この町に大火があったのは、あなたがいくつの時でしたか。
How shall we deal with the problem?	この問題をどう扱いましょうか。
How shall we deal with this problem?	この問題をどうやって扱いましょうか。
How shall we deal with this problem?	この問題をどのように扱えばよいのでしょうか。
How shall we deal with this problem?	どのようにすればこの問題を解決できますか。
How soon are you going shopping?	いつ買い物に出かけるの？
How soon can I get to Tokyo?	どのくらいで東京に到着できますか。
How soon do you need it?	いつまでに必要ですか。
How soon does the show begin?	ショーは後どれくらいで始まりますか。
How soon will the meeting begin?	どの位したら会は始まるか。
How to live is the most important thing in life.	いかに生きるべきかは人生における最も重要な問題だ。
How was your stay?	滞在はいかがでしたか。
How wide is it?	幅はどれくらいですか。
How wide is this river?	この川の幅はどのぐらいですか。
How will he make good the loss?	彼はどうやって損失を償うのだろうか。
How will you manage without a job?	仕事なしでどうやって生活していくのか。
How would you deal with the problem?	あなただったらその問題をどう処理するか。
How's the weather in New York?	ニューヨークのお天気はどうですか。
How's the weather there?	そちらの天気はいいですか。
How's the weather there?	そちらの天気はいかがですか。
How's the weather there?	そっちの天気は？
How's the weather?	どんな天気ですか。
How's things at the office?	仕事はうまくいってるのかい。
However fine the words of the management, those working for them see what is to be seen.	上司がいくら立派なことを言っても、部下は、見るところはちゃんと見ている。
However hard you may try, you will not be able to do it.	どんなに一生懸命にしてもそれはできないだろう。
However often I phone I can't get through.	いくら電話をかけても通じません。
However, Lucy is about to leave her home.	しかしルーシーは家を出ようとしているところです。
However, if you're going to read people's blogs in order to write an interesting blog, you can do that right away.	ただ、面白いブログを書くために、人のブログを読むのなら今日から出来る。
However, please put this book away first.	しかしこの本をしまっておきなさい。
However, this has not always been true.	しかしこれは昔から常にそうであったわけではない。
Humans can't live on Mars.	人間は火星では生存できない。
I 'm determined to try again.	私が再チャレンジを心に誓っています
I acted upon what I believed.	信ずるところに従って行動した。
I added Question 201 to the list of past questions.	私が過去の質問にＱ２０１を追加しました
I already told you.	すでにお話ししました。
I always had my eye on you.	私は君に目をつけていた。
I always keep X in mind.	私がXをいつも念頭においています
I always make sure that my name is on my paper.	私はいつも答案に名前が書いてあるかどうか確かめる。
I always pass the time by watching TV.	私はいつもテレビを見て時間を過ごす。
I always place a high value on knowledge.	私は常に知識には高い価値を置いている。
I always thought that Shirley and Alan would get together.	シャーレイとアランは恋仲になるだろうと私はずっと思っていた。
I am a Japanese high school girl.	私は日本の女子高生です。
I am a boy.	私は少年です。
I am a boy.	私は男の子です。
I am able to drive a car.	私は車を運転できる。
I am able to read English.	私は英語が読める。
I am about to leave here.	ここを離れるところです。
I am at a loss for what I have to say.	何と言ってよいか困っています。
I am at a loss for words.	言葉が出てこないで困っています。
I am at a loss how to answer the question.	質問にどう答えればよいのかわからない。
I am at a loss what to do.	どうしたらいいのか途方に暮れている。
I am at a loss what to do.	どうすればいいのか分からない。
I am at a loss what to do.	私はどうしたらよいのか困っている。
I am beginning to like Ken little by little.	私は、ケンのことが少しずつ好きになってきている。
I am beginning to remember it.	私はだんだんそれを思い出し始めてきた。
I am beginning to understand.	わかり始めています。
I am for your opinion.	あなたの意見に賛成です。
I am getting off at the next station.	次の駅で降ります。
I am getting off at the next station.	私は次の駅で降ります。
I am going to get off at the next stop.	次の停留所で降ります。
I am going to leave my present job.	私は、今の職をやめようと思っています。
I am going to put my heart into the work.	ぼくは一生懸命その仕事をやろうと思う。
I am going to put this machine to the test today.	僕は今日この機械を試験するつもりです。
I am going to stop her ever doing that again.	私は彼女に２度とそんなことをさせないようにするつもりだ。
I am going to write a letter.	私は手紙を書くつもりです。
I am hoping to get two copies of this book.	この本を二冊ほしいと思っています。
I am leaving at four.	４時に帰らせてもらいます。
I am leaving next week.	私は来週出発します。
I am leaving town for a few days.	数日留守にします。
I am near the station.	私は駅の近くにいます。
I am no match for her in knowledge.	知識の点では私は彼女の足元にもおよばない。
I am not at all pleased with the condition.	その条件には全く不満足です。
I am not in the least interested in such a thing.	私はそんなことには少しも興味がありません。
I am not in the least interested in such a thing.	私はそんなことに少しも興味がありません。
I am not liked by this dog.	私はこの犬に好かれていない。
I am not so simple as to believe that.	私はそれを信じるほど愚かではない。
I am not sure but she may come.	彼女は来るかもしれない。
I am not sure of winning the game this time.	今回はその試合に勝てるかどうか分からない。
I am not sure when he will be back.	彼がいつ戻るか確かではない。
I am not sure when he will come.	彼がいつ来るかよくわからない。
I am not sure yet if I will go to a university or get a job.	大学へ行くか就職するか、まだ決めていません。
I am not what I was ten years ago.	私は１０年前の私ではない。
I am not writing a letter.	私は手紙を書いているところではない。
I am of the opinion that he is right.	彼が正しいというのは私の意見です。
I am of the opinion that he will never come back.	彼は決して戻ってこないと思います。
I am of the opinion that she is right.	彼女が正しいというのが私の意見です。
I am of the opinion that she is right.	彼女は正しいというのが私の意見です。
I am of two minds about which to choose.	どちらを選ぼうか私は迷っている。
I am on good terms with him.	彼とは仲のよい間柄だ。
I am on good terms with him.	私と彼は仲がいい。
I am on good terms with him.	私はよく彼に頼っています。
I am on visiting terms with her.	彼女とは行き来する間柄です。
I am on visiting terms with her.	私は彼女と訪問し合う仲だ。
I am on visiting terms with him.	私は彼とは訪問し合う仲だ。
I am on visiting terms with him.	私は彼と訪問しあう間柄です。
I am on visiting terms with him.	私は彼と訪問し合う間がらです。
I am remembering the word.	私はその単語を暗記中だ。
I am right for once.	今度こそは私が正しい。
I am sending a copy of my letter to you.	ついては、私の手紙のコピーを添付いたします。
I am staying at a hotel in New York.	私はニューヨークのホテルに滞在しています。
I am staying at the hotel for the time being.	私は当分の間ホテル住まいだ。
I am staying for another few weeks.	私はもう数週間滞在しています。
I am staying with a friend.	私は友人の家に滞在している。
I am sure I saw her two years ago.	彼女に２年前会ったと確信しています。
I am sure everything will turn out all right in the end.	結局は万事うまくいくものと確信しています。
I am sure he will make good in that job.	彼はきっと仕事で成功するでしょう。
I am sure he will make good in that job.	彼はその仕事できっと成功するでしょう。
I am sure he would be the last person to do it.	彼は決してそんなことをする人ではないと思います。
I am sure he'll tell you as soon as he comes.	きっと彼が来たらすぐにあなたに話すだろう。
I am sure that Jim made up that story.	きっとジムがその話をでっちあげたんだ。
I am sure that Jim made up that story.	ぼくはきっとジムがその話をでっち上げたのだと思う。
I am sure this book will be of great use to you.	この本は君たちに非常に役立つと信じています。
I am sure.	確かだよ。
I am taking a holiday at the beach.	海辺で休暇を過ごしている。
I am the last to believe such a thing.	私は絶対にそんなものは信じない。
I am to meet her at five at the station.	私は駅で５時に彼女と会うことになっている。
I am to meet him at five at the station.	５時に駅で会うことになっている。
I am very interested in fishing.	私は釣りに大変興味があります。
I am well able to manage on my own.	私はどうにか一人でやっていける。
I am writing a letter now.	私は今手紙を書いています。
I am writing a letter.	私は今手紙を書いているところです。
I am writing a letter.	私は手紙を書いているところです。
I asked Nancy to stay at home.	私はナンシーさんに家にいてもらえるように頼んだ。
I asked Tom to open the window.	私はトムにその窓を開けるように頼みました。
I asked each boy three questions.	私はそれぞれの少年に三つずつ質問した。
I asked her to make four copies of the letter.	私はその手紙の写しを４部作るように彼女に頼んだ。
I asked him if he had got my letter.	私は彼に、私の手紙を受けとりましたか、と尋ねた。
I asked him if he had got my letter.	私は彼に手紙を受け取りましたか、と尋ねた。
