"Are you OK?" "I'm fine!"	「大丈夫か？」「大丈夫だよぉ！」
He claimed that he had returned the book to the library.	彼は、その本はすでに図書館に返したと主張した。
He claims to be a friend, but it not such.	彼は自分では友達だと言っているが、そんな者ではない。
He comes and sees me once in a while.	彼は時々私のうちに遊びにくる。
He comes here once a month.	彼はひと月に一回ここに来る。
He comes into contact with all kinds of people.	彼はあらゆる種類の人と接触する。
He comes to Tokyo once a year.	彼は１年に１度上京する。
He comes to see me once in a while.	彼は時々会いに来る。
He comes to see me once in a while.	彼は時々私に会いに来てくれる。
He compared the copy with the original.	彼の写しを元のものと比較してみた。
He compared the copy with the original.	彼は写しを元のものと比較してみた。
He could manage a week's holiday.	彼はなんとか１週間の休暇を手に入れた。
He couldn't remember my address.	彼は私の住所が思い出せなかった。
He couldn't tell green from blue.	彼には緑と青の区別がつかなかった。
He creates several pages using CGI.	彼がＣＧＩで複数のページを作成する
He credits me with doing things I never thought of.	彼は私が考えもつかなかったことをやれると信じている。
He crossed me up.	彼は私を裏切った。
He crossed over to England.	彼はイギリスへ渡った。
He crossed the street.	彼は道路を渡った。
He cut a fine figure in company.	彼は人なかで立派にみえた。
He deals in used cars.	彼は中古車を扱っている。
He deals with my company.	彼はわが社と取引をしている。
He deals with these problems.	彼がこれらの問題に対応する
He did it for fun.	彼は面白半分にそれをした。
He did it just for fun.	彼はただおもしろがってそれをしただけだ。
He did it just for fun.	彼はただの冗談でそれをやったのだ。
He did it just for fun.	彼は冗談にそうしただけだ。
He did not try to go to bed at once.	彼はすぐに寝ようとはしませんでした。
He didn't answer the phone, so I left him an email.	電話には出なかったからメールしておきました。
He didn't answer the question on purpose.	彼はわざとその質問に答えなかった。
He didn't believe Ben's words.	彼はベンの言葉を信じなかった。
He didn't believe it at first.	彼ははじめそのことを信じなかった。
He didn't do it on purpose.	彼はわざとそうしたのではなかった。
He didn't reply to my letter.	彼は私の手紙に返事をしなかった。
He didn't stop talking.	彼は話すのをやめなかった。
He didn't stop the car.	その車を止めなかった。
He didn't stop the car.	彼はその車をとめなかった。
He died aged 54 years.	５４歳で死んだ。
He died at the age of 70.	彼は７０歳で亡くなった。
He died at the age of 76.	彼は７６歳の生涯を閉じました
He died at the age of 84.	彼が８４歳でこの世を去った
He died at the age of seventy.	彼は７０才の時に死んだ。
He died last year of old age.	彼は、去年老齢の為、なくなった。
He died of old age two years ago.	彼は老衰で二年前に亡くなった。
He died one year ago.	彼は一年前に死んだ。
He died some years since.	彼は数年前に死んだ。
He died the next day.	その次の日に彼は死んだ。
He died without having made a will.	彼は遺言状も作らずに死んだ。
He died, so we might live.	我々を生かそうとして彼は死んだ。
He does a kind act once a day.	彼は一日に一回は親切な行動をする。
He does an engine test every day.	彼は毎日エンジンのテストをする。
He does far better than you do at school.	彼は学校では君よりはるかに成績がよい。
He does little else than read books.	彼は本を読むほかはほとんど何もしない。
He doesn't believe me at all.	彼の言うことなんて、頭から信じてないの。
He doesn't have that level of knowledge.	彼はそれほどの知識を持っていません
He doesn't know everything about the plan.	彼はその計画についてすべて知っているわけではない。
He doesn't know how to play golf.	彼はゴルフのやり方を知りません。
He doesn't know how to write a letter in English.	彼は英文の手紙の書き方をしりません。
He doesn't like fish.	彼は魚が好きじゃない。
He doesn't like fish.	彼は魚が好きでない。
He doesn't need such treatment.	彼にはそんな扱いは必要ない。
He drove the dog away.	彼はその犬を追い払った。
He entered Tokyo University this spring.	彼はこの春東京大学に入学した。
He entered the college to study electronics.	彼は電子工学を研究するために大学へ入った。
He fell head-long into the river.	彼はまっさかさまに川に転落した。
He fell into bad company.	彼は不良仲間とぐるになっていた。
He fell into the river.	彼は川に落ちた。
He fired but missed.	彼は発砲したが当たらなかった。
He focuses on the power of water.	彼が水の機能性を重視する
He found a place he liked soon.	彼がすぐにお気に入りの場所を見付けました
He framed the picture he had bought on the street.	彼は街頭で買った絵を額縁に入れた。
He gave me an account of the machine.	彼は私にその機械の説明をした。
He gave the boy what little money he had.	彼はその少年になけなしの金をやった。
He gave up hope.	彼は望みを捨てた。
He gave up the plan for economic reasons.	彼は経済上の理由で計画を断念した。
He gets one thing at a time done at work.	彼が仕事を一つずつ順番に片付ける
He gives her everything she asks for.	彼は、彼女がくれというものは何でもやる。
He gives me a bad time, as he always does.	彼はいつも私をいじめる。まぁ、いつもの事だが。
He goes to London once a month.	彼は月に一度ロンドンにいく。
He goes to the movies as often as three times a week.	彼は１週間に３回も映画を見に行く。
He got away with her watch.	彼は彼女の時計を持ち逃げした。
He got down on all fours and started searching for the ring.	彼は四つん這いになって、指輪を探し始めた。
He got off at the next station.	彼は次の駅で降りた。
He got off at the next stop.	彼は次のバス停で降車した。
He got out a book and began to read it.	彼は本を取り出して、それを読みはじめた。
He guided the man through the streets to the station.	彼はその人を街路を通って駅まで行きました。
He had a lot of things to do.	彼はすることがたくさんありました。
He had already gone.	彼はもう行ってしまった。
He had been writing a letter.	彼は手紙を書き続けていた。
He had every reason for doing so.	彼がそうしたのも無理はない。
He had every reason for doing so.	彼がそうするのももっともだった。
He had learned English before he left for England.	彼は英国へ出発する前に英語を習っていました。
He had left Spain for South America with 200 men.	彼は２００人の男を連れて南アメリカを目指してスペインを出発した。
He had never seen such a bad boy.	彼はそんな悪い子を見たことがなかった。
He had no other resource but to run away.	彼は逃げる以外手だてがなかった。
He had often visited Europe before that time.	彼はその時より前に、しばしばヨーロッパを訪れていた。
He had really come to get gold.	彼は本当金を手に入れるためにやって来たのであった。
He had the face to tell me to clear off.	厚かましくも私に出て行けと言った。
He had to leave for Tokyo on short notice.	彼は急に東京に向かわなければならなかった。
He had to stay in bed.	彼は寝ていなければならなかった。
He had various experiences.	彼はさまざまな経験をした。
He has a bad heart.	彼は心臓が悪い。
He has a bad style.	彼のは悪文だ。
He has a black heart.	彼は腹黒い。
He has a dog.	彼は犬を飼っている。
He has a few friends in this town.	彼はこの町に少し友達がいます。
He has a fine library of books on art.	彼は美術に関するすばらしい蔵書を持っている。
He has a good eye for art.	彼は芸術に関しては目が肥えている。
He has a good knowledge of French.	彼はフランス語をよく知っている。
He has a good reading knowledge of French.	彼はフランス語がすらすら読める。
He has a great deal of experience.	彼はたくさんの経験がある。
He has a kind heart.	彼は優しい心の持ち主だ。
He has a knowledge of English.	彼は少々英語を知っている。
He has a lot of things to do.	彼にはする事がたくさんある。
He has a small frame.	彼は小柄な男です。
He has a well of knowledge.	彼は知識の宝庫だ。
He has all kinds of books.	彼はあらゆる種類の本をもっている。
He has already appeared in five movies. 	彼が現在すでに５本の映画に出演している
He has already gone home.	彼はもう帰宅しました。
He has already gone out.	彼はすでに出かけた。
He has already gone to bed.	彼はもう寝てしまった。
He has an eye for art.	彼は、芸術に対する鑑賞力がある。
He has an eye for art.	彼は絵を見る目がある。
He has an eye for people.	彼は人を見る目がある。
He has appeared as the man of the day in today's paper.	彼は時の人として今日の新聞に登場した。
He has band experience.	彼はバンドで活動していた経歴を持っている
He has been barred from the club.	彼はクラブから締め出しを食っている。
He has been to the station to see her off.	彼は彼女を見送りに駅まで行って来たところです。
He has been to the station to see her off.	彼は駅まで彼女を見送りにいってきたところだ。
He has been writing a letter.	彼は手紙を書き続ける。
He has begun on a new book.	彼は新しい本に取り掛かった。
He has both experience and knowledge.	彼は経験もあるし知識もある。
He has built two houses so far.	彼は今までのところ２軒の家を建てた。
He has character as well as knowledge.	彼は知識はもちろん人格も備えている。
He has designs on that girl.	彼はあの女性に下心を抱いている。
He has experience as well as knowledge.	彼は知識だけでなく経験も豊かである。
He has experience as well as knowledge.	彼は知識ばかりでなく経験もある。
He has five dogs at home.	彼が家で犬を５匹飼っています
He has good reason to be against the plan.	彼がその計画に反対するのももっともだ。
He has had a clean record for the past ten years.	彼のこの十年間の経歴には問題はない。
He has joined in on this production.	彼が一緒に今回の商品づくりに取り組みました
He has just left home.	彼は家を出て行ったばかりです。
He has knowledge and experience as well.	彼には、知識とその上経験もある。
He has knowledge and experience as well.	彼には知識があり、また経験もある。
He has knowledge and experience as well.	彼は知識も経験も持っている。
He has knowledge, and experience as well.	あの人には知識も経験もある。
He has left already.	彼はもう出たよ。
He has left for Kyushu.	彼は九州へ旅立った。
He has more books than he can ever read.	彼は読みきれないほどたくさんの本を持っている。
He has much economic knowledge.	彼は経済の知識をたくさん持っている。
He has natural gifts.	彼には天賦の才がある。
He has never played golf.	彼は一度もゴルフをした事がありません。
He has no claim to the property.	彼はその財産を受け継ぐ資格はない。
He has no response to this.	彼はそれに全く反応を示さない
He has several men to work for him.	彼には、自分のために働いてくれる部下が数名いる。
He has several times as many books as I.	彼は私の数倍多くの本を持っている。
He has some knowledge of editing.	彼は多少編集の知識がある。
He has stayed at the hotel for five days.	彼はそのホテルに５日前から泊まっています。
He has taken on bad ways.	彼は悪に染まってしまった。
He has the lead in the race.	そのレースでは彼がリードしている。
He has turned 180 degrees around.	彼の態度は１８０度変わった。
He has two dogs.	彼は犬を２匹飼っています。
He has two things that she likes.	彼は彼女が好きなものを二つ持っている
He has various knowledge.	彼はいろんな知識を持っている。
He has very little, if any, knowledge about art.	彼は芸術に関しては、あるとしてもほんの少しの知識しかない。
He has visited Europe several times.	彼はヨーロッパを数回訪れたことがある。
He has wide views.	彼は広い視野をもっている。
He has written a letter.	彼は手紙を書いてしまった。
He has written five books so far.	彼は今までのところ本を五冊書いている。
He hasn't answered my letter yet.	彼はまだ返事をくれないんだ。
He hasn't answered my letter yet.	彼は私の手紙にまだ返事をしてくれない。
He hasn't appeared yet.	彼はまだ姿を見せない。
He hasn't been heard from since he left the country.	彼が国を離れていらい、彼からの便りはない。
He hasn't come already, has he?	まさかもう彼が来たのではないでしょうね。
He hasn't come home since he left last week.	彼は一週間前に家を出たなり帰ってこない。
He hasn't left any message.	彼は何も伝言を頼んでいなかった。
He hasn't written the letter yet.	彼はまだ手紙を書いていない。
He hit big in NBC's 'Saturday Night Live'.	彼はＮＢＣのサタデー・ナイト・ライブで大当たりを取りましたね。
He hit me back.	彼は私を殴り返した。
He hit me in the eye.	彼は私の目のあたりを殴った。
He hit me on the head.	彼は僕の頭を殴った。
He hit me on the head.	彼は私の頭をたたいた。
He hit me on the head.	彼は私の頭をぶった。
He hit me on the head.	彼は私の頭を殴った。
He hit me, not her.	彼がなぐったのは私であって彼女ではない。
He hit the mark.	彼は的に当てた。
He hit three home runs, scoring eight runs.	彼はホームラン３本を打ち、８点を稼いだ。
He holds a high position at the company.	彼は会社で高い地位にあります。
He holds a lot of land.	彼は土地をたくさん持っている。
He holds property on their land.	彼はあそこの土地の所有権がある。
He holds stocks in this company.	彼はこの会社の株を持っている。
He holds the key to this problem.	彼はこの問題の鍵を握っている。
He holds those kinds of views.	彼がそういう見方をしています
He hopes he will visit Paris.	彼はパリを訪れたいと思っています。
He hopes he'll win and I hope so too.	彼は勝てると思っており、私もそう願っている。
He hopes to run a company in the future.	彼は将来、会社を経営したいと思っている。
He is a Japanese boy.	彼は日本の少年です。
He is a bad boy.	彼はいけない子だ。
He is a cut above the average college student.	彼は並みの大学生より一段上だ。
He is a fish dealer.	彼は魚屋です。
He is a good man at heart.	彼は心底は善人だ。
He is a hard man to approach.	彼は取っつきにくい人だ。
He is a hard man to deal with.	彼は交わるにはむずかしい人だ。
He is a hard man to deal with.	彼は扱いにくい男だ。
He is a kind boy.	彼は親切な少年だ。
He is a kind man at heart.	彼は、根は、親切な男です。
He is a kind man at heart.	彼は根が優しい。
He is a man of character.	彼は人格者だ。
He is a man of character.	彼は人間としてよくできた人です。
He is a man of letters.	彼は文学者である。
He is a man of reason.	彼は理性的な人だ。
He is a man of wide experience.	彼は幅広い経験を積んでいる人だ。
He is a quick-witted man.	彼はとんちのきく男だ。
He is a self-made man.	彼は立志伝中の人物だ。
He is a self-made man.	立志伝中の人。
He is able in business.	彼は商才にたけている。
He is able man, but on the other hand he asks too much of us.	彼は有能な人だが、他方では、私たちに要求が多すぎる。
He is able to do it better than I am.	彼なら私よりそれをうまくやれる。
He is able to run faster than I am.	彼はわたしより速く走ることができる。
He is about to leave for London.	彼はまさにロンドンへ出発しようとしている。
He is above doing such a thing.	彼は決してそのようなことをするような人ではない。
He is all too quick.	彼はあまりにも素早すぎる。
He is already being forced to change the plan.	彼が早くも計画の変更を余儀無くされる
He is already here.	彼はもうここに来ている。
He is already thinking about Sunday.	彼が早くも日曜日に思いを馳せます
He is always kind to animals.	彼はいつも動物にはやさしくする。
He is always natural with other people.	彼はいつも人に打ち解けた態度をとる人だ。
He is always saying bad things about others.	彼は絶えず他人の悪口ばかり言っている。
He is an abler man than I thought.	彼は思ったよりも有能な人だ。
He is as cross as a bear today.	彼はとても機嫌が悪い。
He is as great a man as ever lived.	彼はかつて生存した誰にも劣らぬ偉人である。
He is as great a man as ever lived.	彼ほどの偉人は古来いない。
He is as kind as ever.	彼は相変わらず親切だ。
He is away from home.	家にはいない。
He is away on holiday.	彼は休暇をとって休んでいる。
He is bad at driving.	彼は車の運転が下手だ。
He is being kind today.	彼は今日は親切に振る舞っている。
He is being very kind today.	今日、彼は実に親切だ。
He is being very kind today.	今日は彼はやけに親切だ。
He is being very kind today.	彼は今日やけに親切だ。
He is better off now than he was five years ago.	彼は五年前よりも暮らし向きがよい。
He is better off now than he was five years ago.	彼は５年前よりも暮らし向きが良い。
He is better off now than he was three years ago.	彼は今、３年前よりも暮らし向きがよい。
He is better off than ever before.	彼はかつてなかったほど裕福である。
He is better off than he was ten years ago.	彼は１０年前より暮らし向きがよい。
He is by far the best boy in the class.	彼はクラスでずば抜けて優秀だ。
He is by far the best player on the team.	彼はチームでダントツの好選手だ。
He is by far the best student.	彼はだれよりもはるかによくできる学生だ。
He is by far the best student.	彼はとてもできる生徒だ。
He is by far the best student.	彼は誰よりもはるかに良く出来る学生だ。
He is by far the best student.	彼は誰よりも良く出きる生徒だ。
He is by no means kind.	彼は決して親切ではない。
He is close to the president.	彼は大統領に近い存在だ。
He is content with the simple life.	彼は粗衣をまとっていた。
He is crossing the street now.	彼は今道を横切っているところだ。
He is determined to go to England.	彼はイギリスに行こうと決心している。
He is determined to go to England.	彼はイギリスへ行こうと決心している。
He is determined.	彼が意を決する
He is doing fine in school.	彼は学校の成績がいい。
He is due to start for Paris.	彼はパリへ出発の予定です。
He is either in London or in Paris.	彼はロンドンかパリにいる。
He is enamored of her beauty.	彼は彼女の美しさに心を奪われている。
He is far better off now than he was five years ago.	彼は五年前よりもいい暮らしをしています。
He is far better off now than he was five years ago.	彼は５年前とは見違えるようだ。
He is far better off now than he was five years ago.	彼は５年前よりもずっと裕福である。
He is far better off now than he was five years ago.	彼は５年前よりも暮らし向きがよくなっている。
He is far better off than he was five years ago.	彼は五年前よりずっと暮し向きがよい。
He is far better off than he was ten years ago.	彼は１０年前よりはずっと暮らしむきが良い。
He is far better off than he was three years ago.	彼は３年前よりずっと暮らし向きがよい。
He is framed for hard work.	彼は重労働に向いている。
He is from some small town in Nagano.	彼は長野県のある小さな町の出身です。
He is from this town.	彼はこの町の出身です。
He is getting better by degrees.	彼の病気はだんだん良くなってきている。
He is getting better by degrees.	彼はだんだんと快方にむかっている。
He is going to stay at a friend's house.	友達の家に泊まりに行く。
He is gone on that girl.	彼はあの子にほれこんでいる。
He is good at dealing with children.	彼は子供の扱いが上手だ。
He is good at golf.	彼はゴルフがうまい。
He is hard to deal with.	あの人は付き合いにくい。
He is hard to deal with.	彼は一筋縄ではいかない。
He is hard to deal with.	彼は付き合いにくい。
He is hard to deal with.	彼は扱いにくい。
He is here to stay.	これからは彼の時代だ。
He is holding up her work.	彼は彼女の仕事を妨げている。
He is home on leave.	彼は休暇で帰省中です。
He is improving in health.	彼の健康は回復してきている。
He is kind at heart.	彼は心の底はやさしい。
He is kind of person no one would turn to for help.	彼は人が助けを求めて頼るような人ではない。
He is kind to her.	彼は彼女に親切だ。
He is kind to those around him.	彼はまわりの人に親切だ。
He is kind.	優しい人です。
He is known to all the people in the town.	彼は町中の人に知られている。
He is leaving Narita for Hawaii this evening.	彼は今夜成田からハワイへ発ちます。
He is leaving for New York next week.	彼は来週ニューヨークへ出発することになっています。
He is leaving home now.	彼は今出かけるところだ。
He is leaving in three days.	彼は三日したら出発する。
He is left out of everything.	彼はみんなにつまはじきされている。
He is making fun of others.	彼が人を馬鹿にしている
He is no longer a boy.	彼はもう少年ではない。
He is no more able to read Chinese than I am.	彼は私同様、中国語は読めない。
He is not a man to deal with a lot of problems.	彼は多くの問題を処理できる人ではない。
He is not an English boy.	彼はイギリスの少年ではありません。
He is not coming, either.	彼もまた来ない。
He is not kind to her.	彼は彼女に親切でない。
He is not the boy that he was ten years ago.	彼は１０年前にそうであったような少年ではない。
He is not the kind of person who is open to discussion.	彼は議論を聞き入れるような人間ではない。
He is not what he used to be ten years ago.	彼は、１０年前の彼ではありません。
He is not what he was ten years ago.	今の彼は十年前の彼ではない。
He is not what he was ten years ago.	今の彼は１０年前の彼でない。
He is not what he was ten years ago.	彼はもう十年前の彼ではない。
He is now either in Rome or in Paris.	彼は今ローマかパリのどちらかにいる。
He is now staying in Paris.	彼は今パリに滞在中です。
He is often taken for a student because he looks so young.	彼は、とても若く見えるので学生と間違えられる。
He is often taken for a student because he looks so young.	彼はとても若く見えるのでよく学生と間違えられる。
He is often taken for a student because he looks so young.	彼はとても若く見えるのでよく学生と間違われる。
He is often taken for a student.	彼はよく学生と間違えられる。
He is older than the boy who is over there.	彼はあそこにいる男の子より年上です。
He is on leave.	彼は休暇中である。
He is on the point of death.	彼は死にかかっている。
He is on the point of leaving for Canada.	彼はカナダに向かってまさに出発しようとしている。
He is on the town.	彼は、町で遊びまわっている。
He is one of the most popular students in the class.	彼はクラスの人気者だ。
He is only a baby in my eyes.	私の目から見ると彼なんかまだ赤ん坊だ。
He is over the hill, you know.	彼はもう下り坂だね。
He is past forty.	彼は４０歳を越している。
He is planning to go home on leave.	彼は休暇に帰省することにしている。
