"Are you OK?" "I'm fine!"	「大丈夫か？」「大丈夫だよぉ！」
I hope you will call again.	また来てください。
I hope you will come up with a better plan.	あなたはもっとよい案を提案してほしい。
I hope you will have a good time in Europe.	ヨーロッパで楽しんでいらっしゃいよ。
I hope you will hear me out.	私を支持して下さい。
I hope you will return it by Monday.	月曜日に返してくれたらいいよ。
I hope you'll be well soon.	すぐによくなってください。
I hope you'll get well soon.	あなたの病気がよくなることを願っています。
I hope you'll get well soon.	早くよくなられるように祈っています。
I hope you'll get well soon.	早くよく成れ。
I hope you'll get well soon.	早く元気になって下さいね。
I hope you'll get well soon.	早く病気がよくなります様に。
I hope you'll have a great year.	素晴らしい一年を。
I hope you'll like it.	気に入ってくれるといいな。
I hope you'll soon get well.	あなたにはすぐによくなるだろうと思います。
I hope you'll soon get well.	あなたはすぐに良くなるだろうと思います。
I hope you'll soon get well.	すぐ良くなって欲しい。
I hope you'll think better of it.	あなたがそれを考え直して止めてもらえればと思います。
I hope you're having fun.	楽しくやっているのでしょう。
I hope your plan will work out.	あなたの計画がうまくいくといいですね。
I hope your wish will come true.	あなたの望みが実現するといいですね。
I hoped to have joined the party.	私はそのパーティーに加わりたかったのだが。
I hoped to have met him at the party.	私はパーティーで彼に会いたいと思っていたのだが。
I joined him at the station.	私は駅で彼と落ち合った。
I joined the golf club three years ago.	私は３年前にそのゴルフクラブに入会した。
I just can't make up my mind.	どうしても決心がつかないんだ。
I just hope it makes it in time.	間に合うように着けば本当にいいのですが。
I just love her to death.	彼女が好きでたまらない。
I just miss him.	寂しいわ。
I keep a dog.	私は犬を一匹飼ってます。
I keep your interests at heart all the time.	ぼくはいつも君のためを思っている。
I know better than to do a thing like that.	僕はそんなことをするような馬鹿ではない。
I know better than to do such a thing.	私はそんなことをするほどばかではない。
I know both of the girls.	私はその少女の両方とも知っている。
I know how to write a letter in English.	私は英語の手紙の書き方を知っています。
I know some of the boys.	私は少年達の何人かを知っている。
I know some of these boys.	私はこれらの少年のうち何人かを知っている。
I know that money isn't everything.	私はお金が全てではない事を知っている。
I know that running boy.	私はあの走っている少年を知っています。
I know that there was a big church here.	ここに大きな教会があったことを知っている。
I know the boy standing over there.	私はむこうにたっている少年をしっています。
I know the boy.	私はその少年を知っている。
I know the girl.	私はその少女を知っています。
I know the president of that company by name.	私はあの会社の社長の名前だけは知っている。
I know which of the two girls you like better.	その２人の女の子の中で君がどちらを好きか知っています。
I leave here at ten-thirty next Sunday.	今度の日曜日に１０時半にここを出ます。
I leave here at ten-thirty next Sunday.	今度の日曜日の１０時半にここを出ます。
I leave it in your hands what course of action to take.	どういう処置を取るかはあなたに任せます。
I leave it in your hands what course of action to take.	私がどういった行動の方針をとるべきなのか、君に任せます。
I leave to go home.	家に帰るよ。
I left Japan for the first time in ten years.	１０年ぶりに日本を離れた。
I left home at seven.	私は七時に家を出た。
I left home early so I'd be on time for the meeting.	私は会議に間に合うよう早めに家を出た。
I left home when I was young.	私は若いころに故郷を出た。
I left my address book in my room.	アドレス帳を部屋に忘れちゃった。
I left my card at home.	家にクレジットカードを忘れてきた。
I left my key in my room.	部屋に鍵を忘れました。
I left something in the room.	部屋に忘れ物をしてしまいました。
I left the money with him.	私は彼にお金を貸した。
I left the window open all through the night.	私はひと晩窓を開けたままにしておいた。
I like Dave because he is very kind.	デイブはとても親切だから私は彼が好きです。
I like Dave because he is very kind.	私はダイブがとても親切だから好きです。
I like dogs very much.	僕は犬が大好きです。
I like dogs very much.	犬がとても好きです。
I like dogs.	私は犬が好きです。
I like fish.	私は魚が好きだ。
I like playing golf.	私はゴルフが好きです。
I like spring better than fall.	私は秋より春のほうが好きです。
I like spring the best of the seasons.	私は季節の中で春が好きだ。
I like spring the best.	私は春が一番好きだ。
I like the dog.	その犬が好きです。
I like this love song.	私はこのラブソングが好きです。
I like to fish in the river.	私は川で釣りをするのが好きだ。
I like to play golf.	ゴルフをするのが好き。
I live in a small town.	私は小さな町に住んでいる。
I lived in Japan three years ago.	私は三年前に日本に住んでいた。
I lived in Osaka until I was six.	私は６歳まで大阪に住んでいた。
I lived in Sasayama two years ago.	私は２年前篠山に住んでいました。
I lived in Tokyo a few years ago, but now I live in Kyoto.	数年前には東京に住んでいたが、今は京都に住んでいる。
I looked all over the house for that letter.	その手紙を家中探した。
I looked around the store but couldn't find what I had in mind.	私は店の中を見まわしたが考えていたものは見つからなかった。
I looked at my watch and noted that it was past five.	時計を見て５時過ぎだと気がついた。
I looked him in the eyes.	私は彼の目をまともに見た。
I looked it over once more.	私はもう一度それを調べた。
I looked out the window.	私は窓から外を見た。
I love him more than any of the other boys.	私は他のどの少年よりも彼が好きだ。
I love rock.	私はロックが好きです。
I love that commercial.	私はあのＣＭが大好きです。
I love you with all my heart.	あなたを心から愛しています。
I made believe it was true.	私はそれが本当であるようなふりをした。
I made believe that I supported him.	彼を支持するふりをした。
I made friends with her during my stay in London.	私はロンドンに滞在中彼女と友達になった。
I made him go there at once.	私は彼をすぐにそこに行かせた。
I made sure that no one was watching.	私は誰も見ていないことを確かめた。
I made sure to not let her do such a thing again.	私は彼女に２度とそんなことをさせないようにした。
I made up my mind to do the work however hard it may be.	それがどんなに辛くてもその仕事をすることに決めた。
I made up my mind to go there.	そこに行くことに決めた。
I made up my mind to study harder.	私はもっと熱心に勉強しようと決めました。
I make a point of writing an answer as soon as I get a letter.	私は手紙をもらうと決まってすぐ返事を書くことにしている。
I make up my mind to do the work however hard it might be.	私はどんなにその仕事が困難であろうとも、それをする決心をした。
I make you a deal.	あなたと取り引きします。
I manage to support my family.	私はどうにか家族を養っている。
I managed to bring him around to my way of thinking.	彼を何とか説得して私の考え方に従わせた。
I managed to find a parking place right in front of the building.	そのビルのすぐ前に、何とか駐車できる場所を見つけた。
I managed to get there in time.	ぼくはどうにかそこに間に合った。
I managed to get there in time.	わたしはどうにかそこに着くのに間に合った。
I managed to get there in time.	僕はどうにかそこに着くのに間に合った。
I managed to get there in time.	僕はなんとか時間までにそこに着いた。
I managed to get to the station on time.	なんとか時間どおりに駅に着いた。
I managed to make him understand it.	彼にどうにかこうにかそれを分からせた。
I may as well die as do it.	私はそれをするくらいなら死んだほうがましだ。
I may as well go out than stay at home.	家にいるよりは、出かけたほうがいい。
I may as well start at once.	すぐに出かけるほうがよさそうだ。
I may have told you such a thing, but I don't remember it at all.	私は君にそのようなことを言ったかもしれないが、全然覚えていない。
I may write a letter for you.	私は君の代わりに手紙を書いてもいいですよ。
I meet her once a week.	私は週に一回彼女と会う。
I meet him once every six months.	私は６か月に一度彼に会います。
I meet with him once every six months.	私は彼に六ヶ月に一度会います。
I met Naomi on my way home and we had a chat.	帰宅途中、直美に会って私たちはおしゃべりをした。
I met Tom in front of the store.	私は店の前でトムに会いました。
I met a dog on my way home.	家に帰る途中で犬に会った。
I met again the girl who I had met in the park the other day.	先日公園で会った少女にまた会った。
I met an American girl.	私はアメリカ人の少女に会った。
I met an old man near the station.	私は駅の近くで１人の老人に会った。
I met her at Tokyo Station.	私は彼女を東京駅で出迎えた。
I met her at the church.	私は教会で彼女に会った。
I met her during my stay in Mexico.	私はメキシコ滞在中に彼女にあった。
I met her three days ago.	彼女には３日前に会ったよ。
I met him at Tokyo Station.	私は彼を東京駅で出迎えた。
I met him at the station.	僕は駅で彼に会った。
I met him at the station.	私は彼に駅で会った。
I met him once when I was a student.	その人とは学生の頃に一度会った事がある。
I met him once.	いつか彼に会っている。
I met him several times.	私は数回彼に会った。
I met him while I was staying in Paris.	パリに滞在中、私は彼にあった。
I met so many people that I do not even remember their faces.	大変多くの人に会ったので私はその人達の顔さえ覚えていない。
I met the girl in the park the other day, and I saw her again.	先日公園で少女に会ったが、その少女にまた会った。
I met too many people to remember all their names.	私はあまりにもたくさんの人に会ったので、名前を全部覚えきれなかった。
I might as well die as do such a thing.	そんなことをするくらいなら死んだほうがましだ。
I might as well die as lead such a life.	そんな暮らしをするくらいなら死んだほうがましだ。
I might as well leave today.	今日出発したほうがいいかもしれません。
I might have left it on the table.	テーブルの上に置き忘れたのではないかと思います。
I miss X.	Xが懐かしい
I miss her so much.	彼女がいなくてとても寂しい。
I miss him as much as ever.	私は、彼がいなくてこの上なく寂しい。
I miss you so much.	あなたがとても恋しい。
I miss you very much.	君がいなくてとても寂しい。
I miss you.	あなたがいなくて淋しいです。
I miss you.	会えなくて淋しい。
I miss you.	君がいなくて寂しいよ。
I missed a period.	生理が一度抜けました。
I missed school for six days.	６日間学校に行けませんでした。
I missed seeing the film.	私はその映画を見逃してしまった。
I missed seeing the film. Did you see it?	その映画を見そこなった。君は見たかい。
I mortgaged my house.	家を抵当に入れました。
I moved nearer in order to hear better.	私はもっとよく聞こえるように近くへ移動した。
I must answer her letter.	私は彼女の手紙に返事を出さなければならない。
I must be leaving now.	もう行かなくちゃ。
I must get off at the next station.	私は次の駅で降りなければならない。
I must go right away.	すぐに行かなければなりません。
I must go to the station at once.	私はすぐに駅に出かけなければなりません。
I must leave here today.	私はきょうここを去らなければならない。
I must make sure whether he is at home or not.	彼が在宅しているかどうか確かめなくてはならない。
I must make up for the loss.	私はその損害の埋め合わせをしなくてはならない。
I must open the window.	その窓、開けないといけないんだ。
I must read many books to add to my knowledge.	知識を増やすためにたくさん本を読まなければならない。
I must remember to mail the letter.	忘れずに手紙を出さなければならない。
I must remember to post the letter.	私は忘れずに手紙を投函しなければならない。
I must remember to see her.	彼女に会うことを覚えていなければならない。
I must remember to see her.	忘れずに彼女に会わなければならない。
I must remember to see her.	忘れないで彼女に逢わなければならない。
I must work hard to pass the test.	試験に合格するために一生懸命勉強しなければならない。
I need to get there soon by any means.	どうにかしてそこへすぐ行かなければならない。
I never exchanged a word with him.	私は彼と言葉を交わしたことはない。
I never hear that song without remembering my high school days.	あの歌を聴くと必ず高校時代を思い出す。
I never heard of such a machine before.	私はこれまでそんな機械のことを聞いたことがない。
I never say what is not true.	私は決してうそは申しません。
I never see this album without remembering my school days.	私はこのアルバムを見れば必ず学生時代を思い出す。
I never see this album without thinking of my high school days.	このアルバムを見るといつも高校時代を思い出す。
I object to going there.	そこへ行くことには反対だ。
I objected to paying the bill.	私は、その請求書を払う事に反対した。
I often call on him.	私はたびたび彼を訪ねます。
I often feel like just going over there.	ついそちらに足が向いてしまう。
I often fell, but I never gave up.	私はよくころんだけれども、決してあきらめなかった。
I often get a letter from him.	私はたびたび彼から手紙をもらう。
I often get the blues.	憂うつな気分によくなります。
I often go fishing in that river.	あの川へはよく釣りに行きます。
I often go fishing with them.	あの人たちは釣り仲間です。
I often go to London.	私はしばしばロンドンに行く。
I often go to the movies.	よく映画を見に行きます。
I often go to the movies.	私はよく映画を見に行く。
I often look back at my younger years.	私はしばしば若い時を振り返る。
I often make use of the library to study.	私は勉強するのによく図書館を利用します。
I often see him.	よく彼に会う。
I often stay up all night.	私はよく徹夜する。
I often think about the place where I met you.	君とであった場所のことをよく考えるんだ。
I often watch night games on TV.	私はよくテレビでナイターを見る。
I often watch night games on TV.	私は良くテレビでナイターを見るんです。
I often wrote to her when I was a student.	学生のころ私はよく彼女に手紙を書いた。
I once lived in Rome.	私はかつてローマに住んだことがある。
I once met him when I was a student.	その人には学生の頃一度会った事があります。
I only figured on staying with this company a little while when I started, but before I knew it I'd become an old timer here.	腰掛けのつもりだったのに、気がついたら私もこの会社で古株になってしまった。
I ordered several books from England.	私はイギリスへ本を何冊か注文した。
I ordered them to leave the room.	私は彼らに部屋を出るように命じた。
I paid fifty percent down for the car.	車の代金を現金で半額支払った。
I paid him the money due to him.	私は彼に支払うべき金を払った。
I parted from her long ago.	私はずっと前に彼女と別れた。
I passed a boy in the street.	通りで少年とすれ違った。
I passed a test in Japanese.	私は国語のテストに受かった。
I passed by the store several times.	私が何回か店の前を通過した
I passed by your house about 10 last night.	夕べ１０時頃君の家のそばを通ったよ。
I passed on the job to him.	その仕事を彼にゆずった。
I passed the information on to him.	私はその情報を彼に伝えた。
I plan to check to see if what he said was true or not.	私は彼の言ったことが本当かどうか確かめるつもりだ。
I plan to stay here for three days.	私は３日間、ここに滞在する予定です。
I plan to stay here until my money gives out.	私はお金が尽きるまでここにいるつもりです。
I plan to stay in the city.	市内に滞在する予定です。
I plan to stay there a week.	１週間滞在の予定です。
I play golf every so often.	時々ゴルフをします。
I play in a band.	俺はバンドで演奏してるんだ。
I point out the following several problems.	私が以下、いくつかの問題点を指摘する
I presented him with a gold watch.	私は彼に金の腕時計を贈った。
I put great value on your knowledge about it.	それについての君の知識をぼくは大きく評価する。
I put more focus on X.	私はXを視野にしっかり入れています
I put my family before my career.	私は仕事より家庭のほうが大事だ。
I put off answering the letter for a week.	私はその手紙に返事を出すのを１週間延期した。
I put on a little weight last year.	去年少し体重が増えました。
I question whether he'll come in time.	彼が時間どおりに来るかどうかは私は怪しいと思う。
I ran a race with him.	私は彼と競走した。
I ran all the way to the station.	私は駅までずっと走った。
I ran into Mr Yoshiyuki at Shibuya station.	渋谷駅で偶然吉行さんに会ってね。
I ran into an old friend at Tokyo Station.	東京駅で旧友に偶然出会った。
I ran into an old friend three days ago.	三日前、旧友にひょっこり会った。
I ran off some of the oil.	私が石油をいくらか流出させてしまった。
I ran out of money during my stay in India.	インド滞在中にお金が底をついた。
I read fifty pages further.	私は更に５０ページ読んだ。
I read it in the magazine three days ago.	私は三日前にそれを雑誌で読んだ。
I read the book from beginning to end.	私はその本を初めから終わりまで読んだ。
I read the letter again and again.	私はその手紙を何度も何度も読んだ。
I read the letter to him.	彼にその手紙を読んで聞かせた。
I read your letter to my family.	私は家族にあなたの手紙を読んであげた。
I really don't have an opinion about it.	その件に関してはとくに意見はありません。
I really feel bad about it.	本当にごめんなさいね。
I really miss the old days.	昔は本当に良かったわね。
I received a letter from her.	彼女から手紙をもらった。
I received a letter from her.	彼女から手紙を受け取った。
I received a letter from my friend.	友人から手紙をもらった。
I received a letter which was written by her.	私は彼女が書いた手紙を受け取った。
I received a letter written in English.	私は英語で書かれた手紙をうけとった。
I received a letter written one week ago.	私は、一週間前に書かれた手紙を、受け取った。
I received her letter the other day.	先日彼女から手紙がきた。
I received your Model 345 in good condition.	３４５型は良い状態で受け取りました。
I received your letter of July 10.	７月１０日付のお手紙いただきました。
I received your letter.	あなたの手紙を受け取りました。
I received your letter.	お手紙を受け取りました。
I remember X very well.	Xをはっきりと覚えています
I remember asking an old man the way.	私は老人に道を尋ねたのを覚えている。
I remember giving him the key.	彼に鍵を渡したことを覚えている。
I remember having seen this movie before.	この映画は以前見た覚えがある。
I remember hearing a very similar story to that.	それによく似た話を聞いた覚えがある。
I remember hearing the story once.	その物語を一度聞いた覚えがあります。
I remember him saying something about that.	そのことで彼がなにかいったのを覚えている。
I remember him well.	私は彼をよく覚えている。
I remember mailing the letter.	私はその手紙を投函したことを覚えている。
I remember mailing the letter.	私は手紙を出したことを覚えている。
I remember meeting him in Paris.	パリで彼に会ったことを覚えている。
I remember meeting that man at Cambridge before.	あの人には前にケンブリッジであった覚えがあります。
I remember meeting that man before.	私は彼に前にあったことを覚えている。
I remember my school days very well.	私は学校時代をよく覚えている。
I remember playing with Yoshiko in that garden when we were young.	私は幼い頃その庭でよし子と一緒に遊んだことを覚えている。
I remember posting this letter.	私はこのてがみを投函したことを覚えている。
I remember reading the book three times when I was young.	私は青年時代にその本を３回読んだ覚えがある。
I remember reading the book.	その本を読んだ事を覚えている。
I remember reading this book.	この本を読んだことを覚えている。
I remember returning the book to the library.	その本は図書館に返したのを覚えています。
I remember returning the book to the library.	その本を図書館に返したのを覚えています。
I remember seeing her before.	以前彼女に会ったことを覚えている。
I remember seeing her once on the street.	一度彼女に路上で会ったことを覚えている。
I remember seeing her.	彼女に会ったことを覚えている。
I remember seeing her.	私は彼女に会ったことを覚えています。
I remember seeing him before.	前に彼にあったのを覚えている。
I remember seeing him once.	私は彼にかつて会ったことを覚えている。
I remember seeing him once.	私は彼に一度会ったおぼえがあります。
I remember seeing him.	彼に会ったことを覚えている。
I remember seeing the movie before.	その映画は前にみた覚えがある。
I remember seeing the movie.	その映画を見たのを覚えている。
I remember seeing you before.	私は以前君に会った事を覚えている。
I remember seeing you last year.	昨年会ったのを覚えている。
I remember seeing you last year.	昨日会ったことを覚えている。
I remember the day when we first met.	私たちが最初に会った日の事を私は覚えています。
I remember the first time.	最初のころを思い出す。
I remember the time when he returned.	彼が帰ってきたときを覚えている。
I remember the word.	私はその単語をおぼえている。
I remember the year when he got a job.	私は彼が仕事についた年をおぼえています。
I remember well the time I first met him.	彼に初めて会った時の事をよく覚えています。
I remember what he said.	彼が言ったことを思い出す。
I remember writing to her.	私は彼女に手紙を書いたことを覚えている。
I remember you. We met three years ago.	あなたを覚えています、３年前にお会いしました。
I remembered that boys will be boys.	男の子は結局男の子であることを思いだした。
I required that John leave at once.	私はジョンがすぐに立ち去るように要求した。
I returned to my home this spring.	私はこの春、故郷に戻ってきた。
I saw Mary looking into a show window.	私はメアリーが店のウインドーをのぞいているのを見ました。
I saw X with my own eyes.	Xを私が目の当たりにする
I saw a boy crossing the street.	少年が通りを横切っているのが見えた。
