Metal contracts when cooled.	金属は冷やされると縮小する。
Take part in the activity not for money but for learning through experience.	金銭のためではなく、経験をとおして学ぶという気持ちでその活動に参加しなさい。
Some people identify success with having much money.	金持ちになる事が成功であると考える人がいる。
The papers that were in the safe are gone.	金庫の中の書類が消えてなくなっている。
I put money in a safe.	金庫に金を入れる。
Money does not grow on trees.	金は木に生えない。
Was the money actually paid?	金は実際に支払われたのですか。
Ready money will away.	金は持っていると無くなる。
Keep money in a safe place.	金は安全な場所にしまっておきなさい。
I have no money, but I have dreams.	金はないけど夢はある。
As soon as there is any talk of paying, he cools down.	金の支払いの話がでると、とたんに彼は冷静になる。
It is certain that the price of gold will go up.	金の価格が上昇するのは確かである。
Money doesn't grow on trees, you know.	金のなる木はないんだよ。
It seems like there's no money left.	金が残っていないようだ。
Money enables you to buy anything.	金があればなんでも買える。
Modern travel enables us to go around the world in a few days.	近年の旅行では私達は二、三日で世界一周が出来る。
Modern methods improved industry.	近代的方法で産業は向上した。
Modern technology gives us many things.	近代技術は多くの物を与えてくれる。
Why didn't modern technology develop in China?	近代科学技術はなぜ中国で発展しなかったのだろうか。
Have you met the new family on the block?	近所に引っ越してきた家族にはもう会った？
I have seen little of him of late.	近頃彼にほとんど会わない。
How are you getting along these days?	近頃は、どのようにお過ごしですか。
How are you getting along these days?	近頃はいかがお過ごしでしょうか。
What kinds of sports do you go in for these days?	近頃どんなスポーツをやっていますか。
I'm looking forward to seeing you again before long.	近々またお会いできるのを楽しみに待ってます。
I have not heard from her recently.	近ごろ彼女から便りがない。
We have had bad weather recently.	近ごろ天気が悪い。
How are you getting along these days?	近ごろはいかがお暮らしですか。
I'm looking forward to hearing from you soon.	近い内にお便りいただけることを楽しみにしています。
I'm looking forward to seeing you before long.	近い内にお会いするのを楽しみにしています。
In the near future, we will be able to put an end to AIDS.	近い将来、私たちはエイズを撲滅することができるだろう。
I hope to see his picture soon.	近いうちに彼の絵を見たいと思う。
I look forward to meeting you again soon.	近いうちにもう一度お目にかかるのを楽しみにしています。
I'm looking forward to seeing you again soon.	近いうちにまたお目にかかるのを楽しみに待っています。
I am looking forward to hearing from you soon.	近いうちにご連絡下さるのをお待ちしています。
I'm looking forward to hearing from you soon.	近いうちにご連絡くださるのをお待ちしております。
I am looking forward to hearing from you soon.	近いうちにお便りいただけるのをたのしみにしています。
I'm looking forward to seeing you one of these days.	近いうちにあなたにお会いするのを楽しみにしています。
Hard work is the price of success.	勤勉は成功の代価だ。
I could not speak a word, for my heart was full.	胸がいっぱいで言葉が出なかった。
Mr Hashimoto is known to everyone.	橋本さんは皆に知られています。
The church is just across the street.	教会はちょうど通りの向こう側にある。
Education should be carried further than it is now.	教育の年限を今より延ばすべきだ。
Thank you for the information.	教えていただいてありがとう。
Would you be kind enough to explain it to me?	恐れ入りますがそのことを私に説明していただけませんでしょうか。
She is probably over forty.	恐らく彼女は４０を超えているでしょう。
The strong wind died away at night.	強風は夜になってしだいにやんだ。
They say we're going to get high winds.	強風になるらしいよ。
A strong wind began to set in.	強風が陸の方へ吹き始めた。
There was a strong wind.	強風が吹いていた。
No one but a strong man is fit for the post.	強い人以外はその職には向かない。
The supply can not keep up with the demand.	供給が需要についていけない。
Kyoto was an old capital of Japan.	京都はかつて日本の首都でした。
Summers are very hot in Kyoto.	京都の夏はとても暑い。
I would often visit the museum when I lived in Kyoto.	京都に住んでいる頃、よくその美術館に行った。
Eating fish is good for your health.	魚を食べることは体にいい。
Fish live in the sea.	魚は海に住んでいる。
There are as good fish in the sea as ever came out of it.	魚は海にはいくらでもいる。
Fish and red wine don't go together.	魚と赤ワインは合わない。
Mr Brown took charge of this class last year.	去年ブラウン先生がこのクラスを受け持った。
Last summer, I worked part time on the farm.	去年の夏、私は農場でアルバイトをした。
Last summer I traveled to Italy.	去年の夏私はイタリアへ旅行した。
Last summer I traveled to Italy.	去年の夏はイタリアへ旅行した。
My old friend dropped in at my house.	旧友が私の家を訪ねてくれた。
My old friend dropped in at my house.	級友は私の家を訪ねてくれた。
The ball rolled into the stream.	球は小川の中に転がり込んだ。
Come on! We're going to be late.	急げ、さもないと遅れるぞ。
Let's get something quick to drink.	急いで何か飲みましょう。
You just need a good rest.	休養が必要なんですよ。
We are looking forward to the holidays.	休日を私達は楽しみに待っています。
Enjoy your holidays.	休日を楽しみなさい。
Did you enjoy your holiday?	休日は楽しかった？
She agreed with him about the holiday plan.	休日の計画についての彼女の考えは彼と同じだった。
Take a rest.	休息しろ。
He stayed there during the vacation.	休憩中そこに滞在した。
If you work too long without a rest, it begins to tell on you.	休憩もしないで長時間働けば、体にこたえてくるよ。
You have only a short rest, so make the best of it.	休憩は短いから十分に活用しなさい。
Shall we take a rest?	休憩しましょうか。
What did you do on your vacation?	休暇中は何をしましたか。
Please cut your vacation short and return.	休暇を切りあげて帰ってきてください。
Enjoy your vacation.	休暇を楽しんでね。
Make the most of your vacation.	休暇をできるだけ上手く利用しなさい。
The vacation is close to an end.	休暇も終わりに近付いた。
The holidays seem to be doing her health good.	休暇は彼女の健康に効果があるようだ。
We must make the most of our vacation, as it is so short.	休暇は短いので、最大限に活用しなければなりません。
How was your vacation?	休暇はどうでしたか。
Where are you going on vacation?	休暇はどこに行くの？
How did you enjoy your vacation?	休暇はいかがでしたか。
The vacation came to an end all too soon.	休暇はあっけなく終わってしまった。
May I take a rest?	休んでもいいですか。
Where are you going to go on your vacation?	休み中にどこへいくつもりですか。
I did nothing during the holidays.	休みはただ怠けていました。
Do you feel like resting?	休みたいですか。
It's been so long since we've met, let's have a drink or two and talk about the good old days.	久しぶりに会ったんだから、酒でも飲みながら、昔話にでも花を咲かせるとするか。
Our school on the hill commands a full view of Mt. Fuji.	丘の上の私達の学校から富士山がよく見渡せます。
The old church on the hill dates back to the twelfth century.	丘の上のあの古い教会は１２世紀に造られた。
Standing as it does on a hill, the hotel commands a fine view of the bay.	丘の上に立っているので、そのホテルは湾の見晴らしがすばらしい。
A beautiful church stands on the hill.	丘の上に美しい教会がある。
Lots of low trees grow on the hill.	丘には低い木がたくさん茂っている。
We can get a beautiful view of the sea from the hill.	丘から海の美しい景色が眺められる。
The customer did not come.	客はやってこなかった。
Customers stopped coming to our shop.	客の足が遠のいた。
The guests are all gone.	客はみな帰った。
The customer is always right.	客の言うことはいつも正しい。
Let's carry on the discussion.	議論を続けましょう。
The discussion was heated.	議論は白熱していた。
Women will have the last word.	議論では女には勝てぬ。
Do get up, it's very late.	起きなさい、もう遅いよ。
You are beautiful.	あなたたちは美しい。
You are doctors.	貴方達は、医者です。
Didn't you hear her speaking French?	貴方は彼女がフランス語を話しているのを聞きませんでしたか。
Do you speak English?	英語を話しますか。
You have a telephone.	貴方は、電話を持つ。
You are a doctor.	貴方は、医者です。
We'll leave as soon as you are ready.	貴方の用意ができ次第出発しましょう。
Please indicate what action you will take.	貴社の活動方針についてご説明ください。
In reply to your request, we offer you an extra discount of 5% on this order.	貴社のご提案に対し、私どもはこのご注文について５％の特別値引きをさせていただくことにします。
The press is interested in his private life.	記者たちは彼の私生活に関心を持っている。
I read about All Ball.	私はオールボールについて読みました。
All of the rules must be in line with company policy.	規則は全て会社の方針と一致していなければならない。
The rules must be few, and what is more important, simple.	規則は少なくなければならない。さらに重要なことには、簡単なものでなければならない。
Don't go against the rules.	規則に逆らうな。
The rules require us all to be present.	規則で私達は全員出席しなくてはならない。
Noriko really is a nice person, isn't she?	紀子さんて、ほんとにいい人ね。
By the year 2020, the population of our city will have doubled.	紀元２０２０年までには、この市の人口は倍増しているだろう。
Let's take a walk for a change.	気分転換に散歩しよう。
Let's eat out for a change.	気分転換に外食しましょう。
When he feels fine, he goes for a walk.	気分の良いときには、彼は散歩をします。
When he feels fine, he goes for a walk.	気分のよい時には、彼は散歩に行きます。
When I feel fine, I go for a walk.	気分のよいときには、私は散歩に行きます。
I don't feel well. Could you give me some medicine?	気分が悪いので薬をください。
Speak your mind.	気持ちを隠さず話しなさい。
I had enough sense to get out of there.	気を利かせて外へ出た。
Let your hair down a little.	気を楽に持とうよ。
Please think nothing of it.	気になさらないでください。
On his way home, Tom met a man who he thought was an American.	帰宅の途中トムはアメリカ人と思われる人に出会った。
You are home late.	帰るのが遅かったね。
You're back late. What have you been up to?	帰るのが遅かったね、何をしていたんだい？
Would you mind picking up something on the way back?	帰りに買い物してきてくれる？
Please drop in at my house on your way home.	帰りに私の家に立ち寄ってください。
Please drop in on your way home.	帰りに寄って下さいよ。
He asked me to wait there until he came back.	帰ってくるまでここで待っていてください、と彼は私に言った。
So nice that you are back.	帰ってきてホントに良かった。
How many pieces of carry-on are you going to take?	機内持ち込みの荷物はいくつありますか。
Press this button to start the machine.	機械を始動するには、このボタンを押しなさい。
One should always make the most of one's opportunities.	機会は常に最大限に活用すべきだ。
I'll speak to him at the first opportunity.	機会のあり次第彼にお話ししよう。
You should see this film if you get the opportunity.	機会が有ればこの映画を見るべきです。
I will see him at the first opportunity.	機会があり次第、彼に会うつもりだ。
I will do it at the first opportunity.	機会があり次第、そうしよう。
How is your term paper coming along?	期末レポートははかどってますか。
Now, the situation is out of hand.	既に手に負えない状態だ。
I agree with you to a degree.	幾分は君に賛成です。
I know you're happy about it. Why don't you just show it?	嬉しいくせに。素直に喜びなよ。
That game is easy, once you learn the basic rules.	基本ルールを学んでしまえば、そのゲームは簡単です。
I'll be happy to answer your question.	喜んで質問に答えます。
I am ready to go with you.	喜んでおともします。
I was almost run over by a car.	危うく車にひかれそうになった。
I hope my dream will come true.	願いが現実になるとよいのだが。
A small stream ran down among the rocks.	岩の間を小さな小川が流れている。
What languages do they speak in Korea?	韓国では何語を話しますか。
It's as deep as it is wide.	間口も広いが奥行きも同様に深い。
He was saved by a hair.	間一髪のところで彼は助かった。
I'm looking forward to seeing you soon.	間もなくお会いできるのを楽しみにしています。
We are looking forward to seeing you soon.	間もなくお会いするのを楽しみにしています。
We will soon be ready for the party.	間もなく、私たちのパーティーの準備ができるでしょう。
Walk fast so as to be in time.	間に合うように速く歩きなさい。
It is not what you read but how you read it that counts.	肝心なのは何を読むかではなくて、どう読むかだ。
In the film, the director makes Hamlet an active person.	監督はその映画でハムレットを活動的な人物に描いている。
He left his team as he could not get along with the manager.	監督と仲良くやれなかったので彼はチームをやめた。
Environmental problems call for quick action.	環境問題は早急な行動を必要としている。
The environment was the focus of student council activities.	環境問題が私たちの学生評議会活動の中心だった。
Almost no students get full marks in Chinese classics.	漢文の試験で満点を取る生徒はほとんどいません。
I can't thank you enough.	感謝のしようもありません。
I can't think of the right words with which to express my thanks.	感謝の気持ちを表す適当な言葉が思い浮かびません。
I don't know how to express my thanks.	感謝の気持ちをどう表したらいいかわからない。
I can't thank you enough.	感謝のしようもございません。
Perfect!	完璧だ！
I'm looking for batteries.	乾電池を探しているのですが。
Kamakura is a place noted in connection with the Genji family.	鎌倉は源氏ゆかりの地です。
The stock market has dropped today.	株式市場は今日、下落した。
The stock market is very active.	株式市場は活況を呈している。
Stock prices dropped.	株価が下がった。
Will you open the bag?	鞄を開けてくれませんか。
You may leave your bag here.	鞄はここに置いていってもいいですよ。
Well begun is half done.	滑り出しが好調なら事は半ば成就したのに等しい。
Don't step on the broken glass.	割れたガラスを踏むな。
Have a nice time.	楽しんで来て。
Have a nice time.	楽しんできてください。
Are you enjoying it?	楽しんでいますか。
I'm looking forward to it.	楽しみにしております。
Enjoy your trip.	楽しい旅行を。
I hope you had a nice trip.	楽しい旅行だったでしょう。
Enjoy your trip.	楽しい旅を。
Have a nice flight.	楽しい飛行機の旅を！
Have a nice flight.	楽しい空の旅を、いってらっしゃい。
Have a nice vacation.	楽しい休暇をね。
Have a nice summer vacation.	楽しい夏休みをね。
Wishing you a Halloween filled with fun.	楽しいハローウィンを。
It's been nice talking to you, but I really must go now.	楽しいところ残念ですが、もう行かなくては。
Have a nice trip!	楽しいご旅行を。
The president addressed his students as follows.	学長は生徒たちに次の通りに講演した。
Students should try not to be late.	学生は遅刻しないように努めるべきだ。
Students should try not to be late.	学生は遅刻しないようにすべきだ。
Students have a holiday on Foundation Day.	学生は創立記念日で休みだ。
Students are longing for the vacation.	学生は休暇を待ち焦がれている。
The student left without saying anything.	学生は何も言わずに行ってしまった。
Students often study with music playing in the background, and people working around the house will usually turn on the television or radio to keep them company.	学生は音楽をかけながら勉強をすることが多いし、家の中で仕事をしている人は孤独にならぬようにテレビやラジオをつけるのが普通である。
None of the students were late for school.	学生は一人も遅刻しなかった。
Each student has expressed his opinion.	学生はめいめい自分の意見を述べた。
Almost all the students like English.	学生のほとんど全員英語が好きだ。
The students discussed the plan for many hours.	学生たちは何時間もその計画について話し合った。
The students were all looking forward to the summer vacation.	学生たちはみんな夏休みを楽しみに待っていた。
The students performed Hamlet.	学生たちは「ハムレット」を演じた。
A man of learning is not always a man of sense.	学者が必ずしも良識のある人とはいえない。
Learning is one thing, and common sense another.	学識と常識は別物だ。
My time in school will be one of my happiest memories.	学校生活は楽しい思い出のひとつになるだろう。
He was very happy in his school days.	学校時代、彼はたいへん幸福でした。
I graduated from the school.	学校を卒業した。
I like summer holidays better than school.	学校より夏休みのほうがいいです。
Will you walk down to the school with me?	学校まで一緒に歩いてくれませんか。
I can walk to school in half an hour.	学校までは歩いて３０分で行けます。
It takes us half an hour to walk to school.	学校へは徒歩で３０分かかる。
The school is within walking distance of my house.	学校は私の家から歩いていける距離だ。
School will break for the summer.	学校は夏休みになる。
School will soon break up for the summer vacation.	学校はもうすぐ夏休みになる。
The school is across from our house.	学校はうちの向かいにあります。
You see some trees in front of the school.	学校の前に何本か木が見えます。
My school grades were average.	学校の成績は普通でしたよ。
You must follow school rules.	学校の決まりは守らないといけない。
Living near the school, I usually walk there.	学校の近くに住んでいるので、普段は歩いて通学する。
Don't be late for school.	学校に遅刻するな。
You must not be late for school.	学校に遅刻してはいけない。
Don't be late for school.	学校に遅れるな。
I'll be late for school!	学校に遅れちゃう！
Don't be late for school.	学校に遅れてはいけません。
Some of the students were late for school.	学校に遅れた学生もいた。
John met Mary on his way to school.	学校に行く途中でジョンはメアリーに会った。
I live within walking distance of school.	学校には歩いて行ける所に住んでいます。
At school he was always at the top of his class.	学校では彼はいつもトップだった。
Success in school calls for much hard study.	学校でいい成績をとるには、一生懸命勉強しなければならない。
I wanted to have finished it by the time school was over.	学校が終わるまでにそれを終えてしまいたかったのだが。
When she returned home from school, she began to help her mother in the kitchen.	学校から帰るとすぐに、彼女は台所で母親の手伝いを始めました。
Success in school calls for hard study.	学業成績を上げるには、一生懸命勉強する必要がある。
It is never too late to learn.	学ぶのに遅すぎることはない。
Be sure to drop in at my house.	確実に私の家におちるだろう。
She is not beautiful, to be sure, but she is good-natured.	確かに彼女は美人ではないが、気だてがよい。
It's a good idea, to be sure, but it's hard to put it into practice.	確かにそれは良い考えだが、実行するのは難しい。
There is one thing that is certain.	確かなことが一つある。
Each person has his own way of doing things.	各人各様の物事のやり方がある。
Each country has its own customs.	各国にはそれぞれの習慣がある。
I walked about aimlessly on the street.	街を当てもなく歩いた。
Living in the town is quite different from living in the country.	街に住むのと田舎に住むのとは大違い。
On the whole, my company is doing well now.	概してうちの会社はいま、景気がいい。
On the whole, I think your plan is a very good one.	概してあなたの企画はとてもよいものだと思う。
As a rule, Japanese people are not good at foreign languages.	概して、日本の人々は外国語が不得意だ。
As a rule, Japanese people are not good at foreign languages.	概して、日本の人々は外国語が苦手だ。
In general, Susie is a nice student.	概して、スージーはよくできる学生です。
Outside advice may be necessary.	外部からの助言が必要かもしれません。
I would rather stay at home than go out.	外出するより家にいるほうがいい。
I'd rather stay home than go out.	外出するより家にいたい。
I would rather stay home than go out.	外出するよりはむしろ家に居たい。
Foreign students demanded help from us.	外国人留学生は私たちに援助を求めた。
Being spoken to by a foreigner, I did not know what to do.	外国人に話しかけられたとき、どうしていいのか分からなかった。
It is interesting to make friends with a foreigner.	外国人と友達になることは面白いです。
Speaking foreign languages is not easy.	外国語を話す事は容易ではない。
The best way to learn a foreign language is to go to the country where it is spoken.	外国語を身につけるいちばんよい方法は、それが話されている国へ行くことである。
To speak a foreign language well takes time.	外国語を上手に話すには時間がかかる。
The best way to master a foreign language is to go to the country where it is spoken.	外国語を習得する一番よい方法は、それが話されている国へ行くことである。
It is not easy to learn a foreign language.	外国語を習得するのはやさしくない。
It takes a great deal of practice to master a foreign language.	外国語を習得するには多量の練習が必要である。
It is by no means easy to master a foreign language.	外国語を習得することは決して容易なことではない。
What is the best way to learn a foreign language?	外国語を学ぶ最もよい方法は何ですか。
It is often said that the best way to learn a foreign language is to go to the country where it is spoken.	外国語を学ぶ一番よい方法は、その言葉が使われている国へいくことだ、とよく言われる。
Learning a foreign language is fun.	外国語を学ぶことは楽しい。
It takes years to master a foreign language.	外国語をマスターするには何年もかかる。
If you want to master a foreign language, you must study as much as possible.	外国語をマスターしたければできるだけ勉強しなければならない。
You can't master a foreign language in a short time; you have to study it step by step.	外国語は短期間には習得できない。少しずつ勉強しなければならない。
I will show you a new approach to foreign language learning.	外国語の新しい学習法を教えましょう。
Are you interested in foreign languages?	外国語の学習に興味がありますか。
