I plan to reply to his letter right away.	私はさっさと彼の手紙に返事を書いてしまうつもりだ。
I have to get my computer repaired.	私はコンピューターを修理してもらわなければならない。
This is the most beautiful river I have ever seen.	私はこんなにきれいな川を見たことがない。
I can't eat any more.	私はこれ以上食べられない。
I can't get along with that man any more.	私はこれ以上あの男とうまくやっていけない。
I have been to more than ten foreign countries so far.	私はこれまでのところ１０以上の国を訪れている。
I've never seen that kind of tree before.	私はこれまでにその種の木は見たことが無い。
I've enjoyed good health all my life.	私はこれまでずっと健康に恵まれてきた。
I have never been spoken to by a foreigner before.	私はこれまで、外国人に話し掛けられたことはない。
I know nothing but this.	私はこれだけしか知りません。
I'm a big fan of golf.	私はゴルフが大好きです。
I have enough money to buy this book.	私はこの本を買うのに十分なお金を持っている。
I got this book for nothing.	私はこの本をただで手に入れた。
I will not give an inch on this point.	私はこの点については一歩も譲れません。
I agree with you on this point.	私はこの点で君に同意する。
I can't agree with your opinion in this respect.	私はこの点であなたの意見に賛成できない。
I can't agree with you in this respect.	私はこの点であなたに賛成できない。
I don't agree with you on this point.	私はこの点であなたと意見が合わない。
I was the happiest man on earth.	私はこの世で一番幸せ者でした。
I was the happiest man on earth.	私はこの世で一番の幸せ者でした。
I grew up in this small town.	私はこの小さな町で育った。
I do not much care for this kind of drink.	私はこの種の飲み物はあまり好まない。
I can't make any sense of this letter.	私はこの手紙の意味が全くわからない。
I never look at this picture without thinking of those happy days.	私はこの写真を見ると必ずあの幸せな日々を思い出す。
I bore this trial.	私はこの試練に耐えた。
I don't know this system, but the man in charge will explain.	私はこの仕組みを知りませんが担当者が説明するでしょう。
Must I finish this work?	私はこの仕事をしてしまわないといけませんか。
I want this work finished by five.	私はこの仕事を５時までに終えてもらいたい。
I don't get enough challenge in this job.	私はこの仕事にやりがいを感じない。
I want to know about this mountain.	私はこの山について知りたい。
I agree with you on this issue.	私はこの件に関しては、あなたに賛成です。
I'm going to carry out this plan.	私はこの計画を実施するつもりです。
I'm going to carry out this plan.	私はこの計画を実行するつもりです。
I am determined to carry out this plan.	私はこの計画を実行しようと決心している。
I agree to this plan.	私はこの計画に賛成です。
I will make use of this opportunity.	私はこの機会を利用するつもりだ。
I know the artist who painted this picture.	私はこの絵を描いた画家を知っています。
I couple this song with his name.	私はこの歌を聞くと彼の名を連想する。
I got my license this summer.	私はこの夏に免許を取った。
I paid $200 for this bag.	私はこのバッグに２００ドル支払った。
I'm the leader of this team.	私はこのチームのリーダーである。
Even though I have studied English at school for the past six years, I'm still not good at speaking it.	私はこの６年間学校で英語を勉強してきたのに、英語を話す事が得意ではない。
I have not eaten anything for the last three days.	私はこの３日間なにも食べていない。
I have been in the hospital for the last month.	私はこの１ヶ月入院していました。
You can reach me at the address written here.	私はここにいますので。
I was asked to wait here.	私はここで待っているように頼まれました。
I have been waiting here for two hours.	私はここで２時間待っている。
I wanted to buy a huge stuffed bear at Ken's but it was not for sale.	私はケンの店で大きなぬいぐるみのクマを買いたかったが、それは売り物ではなかった。
I am looking forward to Christmas.	私はクリスマスを楽しみに待っています。
I have waited a full three hours.	私はきっちり３時間待った。
I had my only son die of cancer.	私はガンで一人息子に死なれた。
I was forced to drink against my will.	私はかならずもお酒を飲まされた。
I told my son in Canada to write me more letters.	私はカナダにいる息子に、もっと手紙をよこせといった。
Once I had a very bad disease.	私はかつて大病にかかったことがあった。
I used to listen to English programs.	私はかつて英語の番組を聞いたものだ。
I sent him a book along with a card.	私はカードと一緒に本を送った。
I wanted to get up earlier than Mother.	私はお母さんより早く起きたかった。
I don't carry much cash with me.	私はお金をあまり持ち歩かない。
I can't keep track of our family budget.	私はうちの家計がどうなっているか分からない。
I was on a trip to India.	私はインドへ旅行中だった。
I was an outsider, so to speak.	私はいわば部外者だった。
I made use of every opportunity to improve my English.	私はいろいろな機会を利用して英語の上達をはかった。
I have nothing to do now.	私はいまはなにもすることができません。
I always make a point of painting things as they are.	私はいつも物事をあるがままに書くことにしている。
I always make it a point to paint things as they are.	私はいつも事物をあるがままに描くことにしている。
I respect those who always do their best.	私はいつも最善を尽くす人々を尊敬する。
I always eat out.	私はいつも外食なんです。
I go to the country every summer.	私はいつも夏はいなかへ行きます。
I still bear his name in mind.	私はいつまでも彼の名を覚えている。
I make it a rule to keep early hours.	私はいつでも早寝早起きすることにしている。
I'm ready to leave now.	私はいつでも出かける準備はできています。
I am always ready to help you.	私はいつでも喜んでお手伝いします。
I am ready to help you.	私はいつでもあなたのお手伝いをします。
I didn't know when to switch the machine off.	私はいつその機械のスイッチを切ったらよいかわからなかった。
I received a Christmas card from my brother in Italy.	私はイタリアにいる兄からクリスマスカードを受け取った。
I thought of a good idea.	いい考えを思い付いたんだよ。
I have a nice camera.	私はいいカメラを持っています。
A boy spoke to me.	私はある少年に話し掛けられた。
I hit on an idea.	私はある考えを思いついた。
I'm Alan Tate, Terry Tate's son.	私はアランテイトです。テリーテイトの息子です。
I am learning English with the idea of going to America.	私はアメリカへ行くつもりで英語を勉強しているんです。
I don't drink much wine.	私はあまりワインを飲まない。
I see a girl standing under that tree.	私はあの木の下に立っているひとりの女の子が見えます。
I bought a cat at that shop.	私はあの店で猫を買った。
I didn't buy anything at that store.	私はあの店で何も買いませんでした。
I quite agree with you.	私はあなたとまったく同意見です。
Every time I see you, I think of your mother.	私はあなた会えばあなたのお母さんを思い出す。
I will wait for you in front of the school.	学校の前で待ってるよ。
I took you for Mrs. Brown.	私はあなたをブラウン夫人と間違えた。
I think it is necessary for you to eat more.	私はあなたはもっとたくさん食べる必要があると思う。
I enjoyed reading about your dreams.	私はあなたの夢について読んで楽しかった。
I am quite in agreement with your analysis.	私はあなたの分析に全く賛成です。
I will act on your advice.	私はあなたの助言に従って行動するつもりです。
I have no idea what you mean.	私はあなたの言うことがさっぱりわかりません。
I will go along with your plan.	私はあなたの計画に同調します。
I will go along with your plan.	私はあなたの計画に賛成です。
I take part in your enterprise.	私はあなたの企画に参加する。
I will do anything for you.	私はあなたの為に何でもしますよ。
I agree with your opinion.	私はあなたの意見に賛成だ。
I want to see your mother.	私はあなたのお母さんに会いたい。
I am looking forward to hearing from you.	私はあなたのお便りを楽しみにお待ちしています。
I'm older than your brother.	私はあなたのお兄さんより年上です。
I will keep your advice in mind.	私はあなたのアドバイスを心に留めておきたい。
I'm not in a position to give you advice.	私はあなたに助言出来る立場にいない。
I can ensure a job for you.	私はあなたに仕事を確保できる。
I agree with you.	私はあなたに賛成だ。
I am looking forward to seeing you soon.	私はあなたに間もなくお会いするのを楽しみにしています。
I thank you.	私はあなたに感謝する。
I am looking forward to seeing you.	私はあなたに会えることを楽しみにしている。
I am looking forward to seeing you.	私はあなたに会うのを楽しみにしています。
Every time I see you, I think of your mother.	私はあなたに会うと必ずあなたのお母さんを思い出す。
I'm looking forward to seeing you.	私はあなたに会うことを楽しみに待っています。
I am looking forward to seeing you soon.	私はあなたにまもなく会えることを楽しみにしている。
I'll enjoy showing you around the city.	私はあなたにこの街を案内してあげるのが楽しみだ。
I never dreamed of seeing you here.	私はあなたにここでお目にかかれるとは夢にも思いませんでした。
I can't thank you enough.	私はあなたにお礼の申しようがない。
I am looking forward to seeing you.	私はあなたにお会いするのを楽しみにしています。
I have enjoyed seeing you and talking about old times.	私はあなたにお会いし、昔の話をして楽しみました。
I don't have anything to give to you.	私はあなたにあげるものが何もない。
I'd like to dance with you.	私はあなたと踊りたい。
I agree with you.	私はあなたと同意見です。
I do not quite agree with you.	私はあなたと全く同じ意見というわけではない。
I quite agree with you.	私はあなたと全く同じ意見です。
I agree with you.	私はあなたと意見が一致しています。
I quite agree with you.	私はあなたとまったくの同意見です。
I have enjoyed talking to you.	私はあなたとお話ししてよかった。
I don't like your coming late every day.	私はあなたが毎日遅れてくるのが気に入らない。
I'm looking forward to your coming to Japan.	私はあなたが日本に来るのを楽しみにしています。
I am looking forward to hearing from you soon.	私はあなたからすぐに便りをもらうのを楽しみにしています。
I'm looking forward to your visit.	おいでになるのを楽しみにしています。
I'm a female office worker.	私はＯＬです。
I make it a rule to get up at six.	私は６時に起きることにしている。
I reached the station at six.	私は6時に駅に着いた。
I have been living in Canada for almost five years.	私は５年近くカナダに住んでいます。
I don't know any of the five ladies.	私は５人の婦人の誰も知りません。
I'll pick him up at 5.	私は５時に彼を迎えに行くつもりです。
I made five applications for jobs but got nothing.	私は５つの職に申し込みをしたが、全部だめだった。
I have no less than four brothers.	私は４人も兄弟がいる。
I must draw up three papers in three days.	私は３日に３枚のレポートを作成しなければならない。
I received a letter three months later.	私は３か月後に１通の手紙を受けとった。
I have been studying for two hours.	私は２時間勉強しています。
I enjoyed watching TV for two hours.	私は２時間テレビを見て楽しんだ。
I counted up to 200.	私は２００まで数えた。
I am taking a couple of days off.	私は２、３日仕事を休む。
I'm going to stay here for a couple of months.	私は２、３ヶ月ここに滞在するつもりです。
I saw a black cat run into the house.	私は１匹の黒猫がその家へ走り込むのを見た。
I waited for him all day long.	私は１日中彼を待った。
I watch television all day long.	私は１日中テレビを見ます。
I go for a walk every other day.	私は１日おきに散歩に出かける。
I'll finish the work in a week, that is, on May fifth.	私は１週間たてば、すなわち５月５日にその仕事を終えます。
I will finish reading the book in a week.	私は１週間すればその本を読み終えるつもりだ。
I waited for him at the station for an hour, but he didn't show up.	私は１時間彼を待ったが、彼はやって来なかった。
I have been waiting for an hour and a half.	私は１時間半も待っている。
I had been reading for an hour.	私は１時間読書をしていた。
I waited for an hour, but he didn't appear.	私は１時間待ったが、彼は現れなかった。
I started this job an hour ago.	私は１時間前に仕事を始めた。
I ate one and then I ate the other.	私は１つ食べて、それから残り１つを食べた。
I will get a driver's license when I reach eighteen.	私は１８歳になったら運転免許を取ろう。
I got 80 marks out of a maximum of 100.	私は１００点満点で８０点取った。
I like animals, for example, cats and dogs.	私は、例えば、猫や犬のような動物が好きです。
I wrote a letter to my mother.	私は、母に手紙を書いた。
I must carry on my studies.	私は、勉強をし続けなければいけない。
I usually eat out.	私は、普通外食しています。
I have been to the place which she spoke of in her talk.	私は、彼女が話の中で述べていた場所を訪れたことがある。
I'm waiting for his telephone call.	私は、彼の電話を待ってます。
I think what he said is true in a sense.	私は、彼の言ったことはある意味では正しいと思う。
I asked him to go to my room for my glasses.	私は、彼に、私の眼鏡を取りに私の部屋へ行くように頼んだ。
I want to know how he manages to make such good use of his time.	私は、彼がどうして時間をうまく利用してるのか知りたい。
I objected to his paying the bill.	私は、彼がそのその請求書を払う事に反対した。
I am not going, because, among other reasons, I don't have money.	私は、他にもいろいろ理由があるが、とりわけ金がないから行かない。
I ordered new furniture.	私は新しい家具を注文した。
I have always identified hard work with success in life.	私は、常に勤勉と人生における成功とを同一視してきた。
I am responsible for my own conduct.	私は、自分の行動に責任がある。
I had my work finished.	私は、仕事を終えてしまった。
I am thinking of going to the mountains.	私は、山へ行こうと思っています。
I don't need anything now.	今は何も要りません。
I never agree with him.	私は、決して彼には同意しません。
I don't like your coming late every time.	私は、君が毎回遅れてくることが嫌いだ。
I don't like summer.	私は夏が嫌いです。
I saw an old woman cross the street.	私は、一人の老婦人が通りを横切るのを見た。
I stopped listening to the radio.	私は、ラジオを聞くのをやめた。
I have nothing particular to do.	私は、やることは特にありません。
I'm looking forward to seeing you soon.	私は、まもなくあなたに会う事を心待ちにしています。
I quite agree with you.	私は、まったく君と同意見です。
I feel like nothing on earth.	私は、ひどく、面食らっている。
I can't eat or drink very hot things.	私はとても猫舌なんです。
I will carry through the work.	私は、その仕事をやり遂げるでしょう。
I want to know more about your way of speaking.	私は、あなたの話し方についてもっと知りたい。
Listen to what I have to say.	私の話を聞いて下さい。
The man who lives next door to me is a doctor.	私の隣に住んでいる人は医者です。
I'll help you to the best of my ability.	私の力が及ぶ限り援助します。
My parents also have a farm.	私の両親もまた農場を持っている。
Both of my parents were brought up in the country.	私の両親は二人とも田舎で育った。
Both my parents are at home now.	私の両親は二人とも今、実家にいます。
Both my parents are at home now.	私の両親は二人とも今、家にいます。
My parents leave for New Zealand next Saturday.	私の両親は今度の土曜日ニュージーランドへ出発する。
My parents aren't old yet.	私の両親はまだ年寄りではない。
Both of my parents love each other.	私の両親はお互いに愛し合っている。
My parents live in the country.	私の両親はいなかに住んでいます。
Both my parents are quite well.	私の両親は二人ともとても元気です。
Did anyone call me while I was out?	私の留守中に誰かから電話がありませんでしたか。
What's the balance of my account?	私の預金残高はどうなっていますか。
Please forward my mail to this address.	私の郵便物をこの住所へ送って下さい。
My friend died from a wound.	私の友達は怪我が元で死んだ。
None of my friends play golf.	私の友達でゴルフをする者はいない。
My friend saved the girl at the risk of his own life.	私の友人は、自分の命をかけてその少女を救った。
Some of my friends can speak English well.	私の友人の中には英語が上手に話せる人もいます。
My friend George is coming to Japan this summer.	私の友人のジョージがこの夏に日本に来ます。
My dream has come true.	私の夢は本当になった。
My dream is to be the First Lady.	私の夢は大統領夫人になることです。
My dream is still just a dream.	私の夢は今でもまだただの夢だ。
My dream is to become an artist.	私の夢は芸術家になることです。
My dream has come true at last by working hard.	私の夢は一生懸命働くことによってついに実現した。
My dream is to be a doctor.	私の夢は医者になることだ。
My dream comes true.	私の夢はかないます。
I wish my dream would come true.	私の夢が実現したらなぁ。
It's time my dream came true.	私の夢がもう実現するところだ。
If you come across my book, will you send it to me?	私の本を見つけたら、送ってくれませんか。
It seems that my methods are more up to date.	私の方法のほうが最新式のようだね。
I have nothing to add on my part.	私の方には意見はない。
My mother is said to have been beautiful when she was a girl.	私の母は娘のころ美人だったと言われている。
My mother said to me, "Study."	私の母は僕に勉強するように言った。
My mother looks young for her age.	私の母は年の割に若く見える。
My mother gets up earlier than I.	私の母は私より早く起きる。
My mother made me a bag.	私の母は私にかばんを作ってくれました。
My mother doesn't like my watching TV.	私の母は私がテレビを見るのを好まない。
My mother loves music.	私の母は音楽が大好きです。
My mother does not speak English.	私の母は英語を話しません。
My mother is really of the old school.	私の母はとても古風なんです。
My mother doesn't like watching TV.	私の母はテレビを見るのが嫌いです。
It appears that my mother knows the fact.	私の母はその事実を知っているらしい。
My mother can play golf very well.	私の母はゴルフがとても上手です。
My mother was in the hospital during the summer.	私の母は、この夏入院していました。
My mother cleans the room.	私の母が部屋を掃除します。
My hours of study are from 8 to 11 p.m.	私の勉強時間は午後８時から１１時までです。
I have a telephone in my room.	私の部屋には電話がある。
There is little furniture in my room.	私の部屋にはほとんど家具がない。
There is a television in my room.	私の部屋にはテレビがある。
There isn't much furniture in my room.	私の部屋にはあまり家具がおいてありません。
There isn't much furniture in my room.	私の部屋にはあまり家具がありません。
He said nothing in answer to my charges.	私の非難に対して彼は何も言わなかった。
You've cut my hair too short.	私の髪を短く切りすぎた。
My hair is longer than Jane's is.	私の髪はジェーンの髪より長い。
My hair is as long as Jane's.	私の髪はジェーンの髪と同じ長さだ。
My hair is as long as Jane's.	私の髪はジェーンのと同じ長さだ。
My hair is as long as Jane's.	私の髪はジェーンと同じ長さだ。
My hair is the longest in my class.	私の髪はクラスで一番長い。
My cat came out of the basket.	私の猫は籠から出てきた。
My cat has come out from under the table.	私の猫がテーブルの下から出てきた。
My telephone is out of order.	私の電話は故障している。
My brother has much in common with me.	私の弟は私はたくさん共通した所がある。
My brother can run as fast as I.	私の弟は私と同じくらい速く走れる。
My brother studies as hard as I do.	私の弟は私と同じぐらいよく勉強する。
My brother is a high school student.	私の弟は高校生です。
My brother has a good memory.	私の弟は記憶力がよい。
My brother speaks very fast.	私の弟はとても速く話します。
My brother is a first-year student.	私の弟は１年生です。
My brother has much in common with me.	私の弟と私はたくさん共通した所がある。
My brother takes care of our dog.	私の弟が私たちの犬の世話をする。
My town has a population of about 30,000 people.	私の町の人口は約３万人です。
If you take my advice, you'll see a doctor.	私の忠告を聞くなら、君は医者に行くことだよ。
You will do well to take my advice.	私の忠告を聞いた方がいい。
She sent me a present in return for my advice.	私の忠告のお礼として彼女は贈り物を送ってきた。
Take my advice!	私の忠告に従いなさい。
The lake is deepest here in so far as I know.	私の知る限りにおいては、湖はここが一番深い。
As far as I know, this is the latest edition.	私の知る限りでは、これが最新版です。
To the best of my knowledge, he is as good as his word.	私の知る限り、彼は約束を守る人だ。
My favorite music is pop music.	私の大好きな音楽はポップミュージックだ。
My son tried to become a rakugoka.	私の息子は落語家になろうとした。
My son is going to leave for France next week.	息子は来週フランスへ出発します。
My son can count up to a hundred now.	私の息子は百まで数えられる。
My son thinks women are stronger than men.	私の息子は女の方が、男より力が強いと思っている。
My son wants to be a Lincoln.	私の息子はリンカーンのような人になりたいと思っている。
My son still believes in Santa Claus.	私の息子はいまだにサンタクロースがいると信じている。
My son entered high school.	私の息子は、高校に入学した。
Thank you for the present you gave my son.	私の息子に下さったプレゼントに感謝します。
My son will take over the job.	私の息子が仕事を引き継ぐだろう。
There were three people waiting before me.	私の前に３人の人がまっていた。
On my own responsibility, I will go on with this plan.	私の責任においてこの計画を進めます。
My seat is this window seat.	私の席は窓側ですね。
My seat is on flight 102 on Monday at 8 a.m.	私の席は月曜日の午前８時１０２便です。
Where is my seat?	私の席はどこですか。
My seat is near the door.	私の席はドアの近くだ。
Please take me to my seat.	私の席に案内してください。
My grade is above the average.	私の成績は平均以上だ。
My success was due to your help.	私の成功は君の助けのおかげだ。
