Tony speaks English better than I do.	トニー君は私よりも上手に英語を話す。
Tony speaks English the best in our class.	トニー君は私たちのクラスの中で一番上手に英語を話す。
Though Tony is American, he can't speak English.	トニー君はアメリカ人ですが、英語を話すことが出来ない。
Tony speaks English as well as you.	トニー君はあなたと同じくらい上手に英語を話す。
Tony's voice is nice.	トニー君の声は良い。
Tony was a good, strong boy.	トニーは良い子でじょうぶな子でした。
Tom liked his job very much.	トムは自分の仕事がたいへん好きでした。
Tony was happy.	トニーは幸せでした。
Tony stood at the door.	トニーはドアのところに立っていました。
Who do you want to speak to?	どなたとお話しになりたいのですか。
Totoro makes friends with everyone.	トトロはみんなと友達になる。
I had no choice but to stay.	とどまるより他に仕方なかった。
It's a beautiful country.	とても美しい国です。
There wasn't anything like enough light to read by.	とても読書できる明るさではなかった。
It was such a nice day.	とても天気のよい日だった。
It was such a nice day that the street was full of people.	とても天気のよい日だったので、通りは人でいっぱいだった。
I'm fine, thanks. Oh, Laura, this is my friend, Ayako.	とても元気よ！ねえ、ローラ、こちら友達の綾子。
You're not fit to be seen.	とても見られたかっこうじゃないよ。
This is anything but easy.	とてもやさしいというしろものではない。
It is such a beautiful day that I'd like to go fishing in the river.	とてもすばらしい日なので川に魚釣りに行きたい。
It was very beautiful.	とてもキレイでした。
Can you tell me which button to press?	どっちのボタンをおしたらいいか教えて下さい。
Which one will be our final resting place?	どっちが最終的な安息の地となるんだろう。
We have not yet discussed which method is better.	どちらの方法がよいのかまだ話し合ってない。
You can reach the park by either road.	どちらの道を行ってもその公園へ行けます。
You can reach the park by either road.	どちらの道を行ってもその公園に行けます。
We were quite at a loss which way to go.	どちらの道を行けばいいか全く分からなかった。
We were quite at a loss which way to go.	どちらの道をいけば良いのか全く分からなかった。
Which road goes to city hall?	どちらの道が市役所に行けますか。
It is hard to say which car is nicer.	どちらの車がよいか言うのはむずかしい。
You may take either of the glasses.	どちらのグラスをとってもよい。
Which bag is yours?	どちらのかばんがあなたの物ですか。
I would rather go out.	どちらかと言えば出かけたい。
I would rather stay at home.	どちらかと言えば私は家にいたい。
If anything, she isn't any better today.	どちらかと言えば、彼女は今日も具合がよくない。
If anything, my new job is harder than my old one.	どちらかと言えば、今度の仕事の方が前の仕事より厳しい。
I would rather not go.	どちらかと言うと行きたくない。
Toshio can speak English very well.	俊夫くんはとても上手に英語を話すことが出来る。
Well, what sports do you like?	ところであなたはどんなスポーツが好きですか。
By the way, would you like to come and see my mother?	ところで、家に来て私の母に会いますか。
As it is, I can do nothing.	ところが実はどうすることもできないのです。
Where can I cash this personal check?	どこへ行けば、パーソナルチェックを現金に換えてもらえますか。
What seats do you want?	どこの席がいいですか？
Information is given in English at every airport.	どこの空港でもお知らせは英語でされます。
There's a long line at every cash register.	どこのレジも列ができちゃってる。
I have no idea where I left my keys.	どこにカギを置き忘れたのか分からない。
Where did you get your hair cut?	どこで髪の毛を切ったの。
Where should I transfer?	どこで乗り換えればいいでしょうか。
Where do I pay for the gas?	どこで支払えばよいのですか。
Where shall I drop you off?	どこで君を降ろそうか。
Where do I claim my bags?	どこで荷物を受け取るのでしょう？
Where did you get the idea?	どこでそんなこと覚えてきたんだ。
Where did you get your camera repaired?	どこでカメラを修理してもらったんですか。
Where shall I wait for you?	どこであなたを待ちましょうか。
Where would I find T-shirts?	どこでＴシャツが買えますか。
Would you like to go have a drink?	どこかへ飲みに行きましょうか。
Once in a while, she is late for school.	ときどき彼女は学校に遅刻する。
Do you hear from your son from time to time?	ときどき息子さんから便りがありますか。
Drop in now and again.	ときどきお立ちよりください。
From time to time she stopped and looked round.	ときおり彼女は立ち止まりあたりを見回した。
What's the difference?	どう違うのだ。
He seems to know all about her past.	どうやら彼は彼女の過去のことを、何もかも知っているようであった。
I almost think you're right.	どうやらおっしゃるとおりだと思います。
How are you going to carry it out?	どうやって実行するつもりですか。
How can we kill time?	どうやって時間をつぶそう？
I don't feel like anything.	どうも体の調子がよくない。
Oh, I don't know if I agree with you.	どうも賛成しかねます。
There seems to be no need to go.	どうも行く必要はないようです。
I'm just looking, thank you.	どうも、ちょっと見るだけ。
I managed to finish the book.	どうにかその本を読み終えた。
At last, she hit on a good idea.	とうとう彼女は良い考えを思い付いた。
At last he could finish the work.	とうとう彼はその仕事を終えることが出来た。
At length, we reached the top of the mountain.	とうとう私達は山の頂上に到着した。
At last, we reached California.	とうとう我々はカリフォルニアに着いた。
Summer seems to have come at last.	とうとう夏がやってきたようだ。
Please call him to the telephone.	どうぞ彼を電話口に呼び出してください。
Please step inside.	どうぞ中へお入り下さい。
I want to speak to Mr Sato please.	どうぞ佐藤さんをおよび下さい。
Have a nice flight.	どうぞ楽しい空の旅を。
Nice to meet you.	どうぞよろしく。
Have a nice trip!	どうぞよい旅行をしてきてください。
Have a nice trip!	どうぞよいご旅行を。
Open the door, please.	どうぞドアを開けて下さい。
Close the door, please.	どうぞドアをしめてください。
Please turn on the television.	どうぞテレビをつけてください。
Please see that the job is finished.	どうぞその仕事が終わるように取り計らってください。
Be my guest.	どうぞご自由に、お使いください。
Take this seat, please.	どうぞこの席にお座り下さい。
Please drop in on us.	どうぞお立ち寄りください。
Please tell me about your trip.	どうぞあなたの旅行について話して下さい。
Please do as it seems best to you.	どうぞあなたのいいと思うようになさい。
Please go up to the third floor.	どうぞ３階へ上がってください。
Please remain seated.	どうぞ、そのままお座りになっていてください。
Please take a seat.	どうぞ、おすわりください。
As he's just up on his high horse again.	どうせまたふんぞり返って威張っているだけなのだから。
You're only foolin' round.	どうせお前は。
How can I make a long-distance call?	どうすれば長距離電話がかけられますか。
How can I reach you?	どうすれば君と連絡がとれる。
How come you say nothing?	どうして君は何も話さないのか。
Why did you come home so late?	どうして帰りがこんなに遅くなったの。
How come you didn't say anything?	どうして何も言わなかったのですか。
Not knowing what to do, I telephoned the police.	どうしてよいかわからなかったので、私は警察に電話した。
I could not remember his name for the life of me.	どうしても彼の名前が思い出せなかった。
For the life of me, I couldn't remember his name.	どうしても私は彼の名が思い出せなかった。
Why did you give up the idea of learning French?	どうしてフランス語を勉強するのを断念したの。
Why didn't you say anything?	どうしてなにも言わなかったのですか。
Why are you so late?	どうしてそんなに遅くなったの。
What put such an idea into your head?	どうしてそのような考えを思いついたんだい。
What put such an idea into your head?	どうしてそのような考えを思いついたの。
How come you call on us so late at night?	どうしてこんなに夜遅く訪ねてくるのか。
How is it that you can speak this language?	どうしてこの言語を話すことができるのですか。
Why will you not listen to reason?	どうしてお前は道理に従おうとしないのか。
I had no idea what to do.	どうしていいのか分からない。
Not knowing what to do, we telephoned the police.	どうしていいかわからず、私たちは警察に電話した。
Why didn't you follow my advice?	どうしてあなたは私の忠告に従わなかったのですか。
Please let me know the result by telephone.	どうか電話でその結果をお知らせ下さい。
I hope you will be quite well again before long.	どうか早く元のようにすっかりお元気になってください。
Bring me a glass of water, please.	どうか水を一杯持ってきてください。
Bring me a sheet of paper, please.	どうか紙を１枚持ってきてください。
Please give me a glass of water.	どうか私に水を一杯ください。
I hope you enjoy your flight.	どうか楽しい旅行を。
Would you be so kind as to open the door for me?	どうかドアを開けていただけませんでしょうか。
Please turn the television on.	どうかテレビを点けて下さい。
Please remember me to your parents.	どうかご両親様によろしくお伝え下さい。
Why does everything happen to me?	どういう風の吹き回しでこうなったのだろう。
Please explain how to get there.	どういうふうにしてそこは行くか説明して下さい。
What's happening?	どう、調子は？
We have few opportunities to speak German.	ドイツ語を話す機会はほとんどない。
I can't remember how to say "Thank you" in German.	ドイツ語の「ありがとう」の言い方を思い出せない。
The Germans took to flight.	ドイツ軍は敗走した。
The division of Germany was considered a given until 1989.	ドイツの分割は１９９０年まで既成事実と考えられていた。
Therefore, a center for the development of human resources should be built in Japan.	というわけで、人材を啓発するためのセンターが日本に作られるべきであろう。
Shall I close the door?	ドアを閉めましょうか。
Please close the door.	ドアを閉めて下さい。
Don't close the door.	ドアを閉めてはいけません。
Would you mind closing the door?	ドアを閉めてくれませんか。
Keep the door closed.	ドアを閉めておきなさいよ。
Please paint the door white.	ドアを白く塗ってください。
He painted the door blue.	彼はドアを青く塗った。
Don't leave the door open.	ドアを開け放しにしておくな。
I opened the door and saw two boys standing side by side.	ドアを開けると２人の少年が並んで立っているのが見えた。
Open the door.	ドアを開けなさい。
Open the door and let me in, please.	ドアを開けて中に入れて下さい。
Would you mind my opening the door?	ドアを開けてもよろしいですか。
You must not open the door.	ドアを開けてはならない。
Don't open the door.	ドアを開けてはいけません。
Will you open the door?	ドアを開けてくれませんか。
Please open the door.	ドアを開けてください。
Keep the door open.	ドアを開けておきなさい。
Don't leave the door open.	ドアを開けておかないで。
Would you please open the door?	ドアを開けていただけませんか。
Open the door.	ドアを開けて。
Don't leave the door open.	ドアを開けっ放しにしてはいけません。
Don't leave the door open.	ドアを開けっ放しにしておくな。
Don't leave the door open.	ドアを開けっぱなしにするな。
Don't leave the door open.	ドアを開けたままにしておくな。
Will you leave the door open?	ドアを開けたままにしておいてくれませんか。
We left the door open.	ドアを開けたままにしておいた。
Who left the door open?	ドアを開けたままにしたのは誰だ。
The door must not be left open.	ドアをそのままにしておいてはいけません。
The door was broken open.	ドアをこじ開けた。
Would you please not leave the door open?	ドアを開けたままにしないでいただけますか。
Will you open the door?	ドアをあけてくださいませんか。
Do you mind opening the door?	ドアをあけていただけませんか。
Keep the door closed.	ドアは閉めておきなさい。
The door remained closed.	ドアは閉じられたままだった。
The door remained closed before her.	ドアは彼女の前で閉じられたままだった。
Doors ain't as bad as you think.	ドアは思ったほど悪くはないぞ。
The door could not be opened.	ドアは開けられなかった。
The door remained closed all day.	ドアは一日中閉まりっぱなしだった。
The door would not open.	ドアはどうしても開かなかった。
The door won't close.	ドアはどうしてもしまらない。
The door is opened by Jim.	ドアはジムによって開けられます。
There's a dog by the door.	ドアの側に犬がいます。
The girl at the door is Lucy.	ドアの所にいる女の子はルーシーです。
There is a boy near the door.	ドアの近くに少年がいます。
Who is the girl standing at the door?	ドアのところに立っている少女は誰ですか。
There is a man at the door.	ドアのところに人が立っている。
Who's that boy standing at the door?	ドアのところに立っているあの男の子はだれですか。
The boy standing by the door is my brother.	ドアのそばの立っている少年は私の弟です。
There was a big gold star on the door.	ドアに大きな金色の星がついていました。
Could you move forward so we can close the door?	ドアを閉められるように、もう少し前に進んでもらえますか。
I heard the door close.	ドアが閉めるのが聞こえた。
The door is closing.	ドアが閉まろうとしている。
I heard the door close.	ドアが閉まる音を聞いた。
I heard the door close.	ドアが閉まるの聞こえた。
I heard the door close.	ドアが閉まるのが聞こえた。
As soon as the door opened, they ran away.	ドアが開くとすぐに、彼らは逃げ出しました。
The door opened and a man came in.	ドアが開いて１人の男が入ってきた。
The door opened and a man came out.	ドアが開いて、１人の男が出てきた。
The door opened.	ドアが開いた。
The door won't open.	ドアがどうしても開かない。
It's no use on earth.	てんで役にたたない。
Where can I get a telephone card?	テレフォンカードはどこで手に入れることができますか。
The TV telephone will come into popular use soon.	テレビ電話はまもなく一般的に用いられるようになるだろう。
May I turn on the television?	テレビを点けてもいいですか。
Please turn off the television.	テレビを消して下さい。
It's time you stopped watching television.	テレビを見るのを止めてもいい頃でしょう。
I watch television.	私はテレビを見る。
I was watching TV when the telephone rang.	テレビを見ていると電話が鳴った。
Will you turn on the television?	テレビをつけてくれますか。
Please turn on the television.	テレビをつけて。
You must make room for the television.	テレビをおくための場所がなければいけないよ。
You should watch television at a distance.	テレビは少し離れて見るべきだ。
Enough TV, already!	テレビはもういいかげんにしなさい。
Turn down the television.	テレビの音を小さくしなさい。
Could you please turn your television down?	テレビの音を小さくしてもらえませんか。
Television enables us to know what is happening today.	テレビのおかげで今日何が起こっているかを知ることができる。
We can do without a television, can't we?	テレビなんかなくてすむ。
Many companies advertise their products on TV.	テレビで製品を宣伝する会社が多い。
The television doesn't work.	テレビが故障しています。
My television was broken down, so I had to get it repaired.	テレビが壊れていて、修理しないといけなかった。
If it were not for television, the world would feel even larger.	テレビがなければ、世界はもっと広く感じられるだろうに。
But I enjoyed farm work.	でも農場の仕事は楽しかったわ。
But it's very strong actually.	でも実際にはすごく強い。
I think you should get more rest.	でも休みはとったほうがいいわよ。
But we don't have anything in common at all.	でもね、わたしたち全然共通点がないんですもの。
But, I have to take my mother.	でもさ、母を連れて行かなくてはいけないんだ。
But it's almost half past eleven.	でも１１時半近くですよ。
"But you just come here in the summer!" said Tony.	「でも、君達がここに来るのは夏だけではないか」とトニーが言いました。
The Thames is a river that flows through London.	テムズ川はロンドンを貫流する川である。
David worked his way through college.	デビッドは働いて自分の金で大学を出た。
David is very active.	デビッドはとても活動的だ。
See you later!	では又会いましょう。
See you later!	ではまた会いましょう。
You can get all kinds of things to eat if you go to the free samples area in a department store.	デパートの試食コーナーへ行くと、いろいろな物がただで食べられるよ。
We start here in two hours, then.	では２時間後にここを出発しよう。
Who will take care of your cat then?	では、猫の世話は誰がするの。
Well, see you later.	では、後で会いましょう。
I'd like to pay in cash.	では、現金で支払います。
Actually it might be a good idea to start right now.	できればすぐに出発してもらいたいのですが。
I'll wait here until my medicine is ready.	できるまでここで待っています。
Walk as fast as possible.	できるだけ速く歩きなさい。
We are looking forward to receiving your quote as soon as possible.	できるだけ早くお見積書をいただけますようにお願いします。
I look forward to receiving your reply as soon as possible.	できるだけ早い返事をお待ちしています。
I'll meet him at the earliest opportunity possible.	できるだけ早い機会に彼に会いましょう。
I feel like I've done all I can. Now all there is to do is wait and see what comes of it.	できることはすべてやったよ。後は、果報は寝て待て、の心境だね。
Enjoy life while you may.	できるうちに人生を楽しめ。
Enjoy your life while you are able to.	できるあいだに人生を楽しみなさい。
I want a map of Texas on a scale of 1 to 250000.	テキサス州の縮尺、２５万分の１の地図がほしいのですよ。
Carry the table out, please.	テーブルを運びだしてください。
Is there a cat on the table?	テーブルの上に猫がいますか。
On the table there was a cat.	テーブルの上には猫がいた。
There is a glass on the table.	テーブルの上にコップがある。
There is a glass on the table.	テーブルの上にガラスのコップがある。
Is there a cat under the table?	テーブルの下に猫がいる？
Under the table was a black cat.	テーブルの下には黒猫がいた。
There were four chairs by the table.	テーブルのそばには椅子が４脚あった。
Were there any glasses on the table?	テーブルにコップがいくつかありましたか。
Dick drew up to her.	ディックは彼女に近づいた。
Dick forced me to agree with his plan.	ディックは私を彼の計画に同意させた。
She lives just outside Wripple, which is near Deal.	ディールに近いリプルを出てすぐのところに住んでいます。
In short, he is a man of great ability.	つまり彼は大変な才能の持ち主なのだ。
Eat what you are served, no buts about it.	つべこべ言わずに、出されたものを食べなさい。
I didn't know about that until quite recently.	つい最近までそのことを知らなかった。
During the recent trip to America, I made friends with Jack.	つい最近のアメリカ旅行中に、私はジャックと親しくなった。
It was only recently that she changed her mind.	つい最近になって初めて彼女は考えを変えた。
At last, she has brought the plan into effect.	ついに彼女はその計画を実行した。
At last, her dream to be a doctor came true.	ついに彼女の医者になるという夢は実現した。
At last, they reached the top of the mountain.	ついに彼らはその山の頂上に到達した。
He reached his goal at last.	ついに彼は目的を達成した。
At last, we reached England.	ついに私たちは英国に着いた。
If you follow me, I'll show you the way to the hospital.	ついていらっしゃるなら、病院への道をご案内いたします。
Paul telephoned just now.	ついさっきポールが電話をしてきました。
Let your food cool off a bit; don't eat it while it's hot.	ちょっと冷まして、熱いうちは食べないように。
I just dropped in.	ちょっと立ち寄ってみたんだ。
I'm just going to drop by the post office.	ちょっと郵便局へいってくる。
Why don't we drop over to see her?	ちょっと彼女のところに寄ってみようじゃないか。
Oh, he broke wind.	ちょっと彼お鳴らしたわよ。
May I use your telephone?	ちょっと電話を貸してください。
May I use the telephone for a while?	ちょっと電話を貸していただけますか。
Can I use your telephone?	ちょっと電話を借りていいですか。
I wanted to do some telephoning.	ちょっと電話をかけたいと思った。
Could you give me some advice?	ちょっと知恵を拝借ねがえませんか。
Look, someone is calling you.	ちょっと誰か君を呼んでいるよ。
Wait a second. Do you just think that all's well that ends well? That's not the way it is.	ちょっと待ってよ、そんなに単純に、終わりよければ総て良し、ってわけにはいかないよ。
Keep an eye on my bag for a while.	ちょっと私のかばんを見ていてね。
What do you say to going out for a short walk?	ちょっと散歩に出かけませんか。
I'll just go for a walk to clear my head.	ちょっと散歩して、あたまをスッキリさせて来るよ。
I feel like taking a rest.	ちょっと休憩したい気分だ。
I feel like a rest.	ちょっと休憩したい。
Let's take a rest for a while.	ちょっと休みましょう。
I feel like taking a rest.	ちょっと休みたい。
Let's drop in for a drink.	ちょっと寄って飲んでいこう。
Give me a drink, please.	ちょっと一杯飲ませてくれ。
Let's take a rest.	ちょっと一休みしよう。
Hold your horses, young man.	ちょっと待って、君。
Not quite what I want.	ちょっとねえ。
Let's stop and take a rest.	ちょっととまって一休みしよう。
Let's drop the subject.	ちょっとそれはやめよう。
How about dropping in at the shop?	ちょっとその店によって行きませんか。
May I go out for a short walk?	ちょっとそこまで行ってきていいですか。
Let's have a talk over a couple of drinks.	ちょっといっぱいやりながら話そう。
Let me give you some advice.	ちょっとアドバイスさせてください。
Wait for a while. I'll make you some.	ちょっと、待ってください。すぐ作りますから。
Let's drop the subject.	ちょっと、それをやめよう。
Just as he was speaking, a fire broke out.	ちょうど彼が話しているときに、火事が起こった。
Even as he was speaking, a shot rang out.	ちょうど彼が演説していた時に、銃声がひびき渡った。
I've just finished writing a letter.	ちょうど手紙を書き終えたところです。
It is just half past seven.	ちょうど七時半です。
