This method has no application to the case.	この方法はこの場合には当てはまらない。
This method is sure to work.	この方法はきっとうまくいく。
This method is sure to work.	この方法でうまくいく。
This report is not perfect.	この報告書は不十分だ。
Does this flight make any stop-overs?	この便は途中で降りられるのですか。
Is the flight on schedule?	この便は時間通りか。
Is there a gas station around here?	この辺にガソリンスタンドはありますか。
Let's wind up our work.	この辺で仕事を切り上げよう。
I don't know anything with respect to this area.	この分野について私は何も知らない。
This is a story about a cat.	この物語はいっぴきの猫についてです。
This custom dates back to the 12th century.	この風習の起源は１２世紀にさかのぼる。
This room is used as a kitchen.	この部屋は台所として使われている。
This room is large enough.	この部屋は十分大きい。
The room is anything but small.	この部屋は決して狭くない。
This room is just about big enough.	この部屋はほぼ十分な広さだ。
This room will soon heat up.	この部屋はすぐに暖まる。
There is too much furniture in this room.	この部屋には家具が多すぎる。
There is much furniture in this room.	この部屋には家具がたくさんある。
There is no chair in this room.	この部屋には椅子がない。
There is a television in this room.	この部屋にはテレビがある。
This room is too small to contain 50 men.	この部屋に５０人は入り切れない。
This room commands a fine view of the city.	この部屋から街が大変よく眺められます。
This room commands a fine view of the city.	この部屋からは町の見晴らしがよい。
This room has fine view of the mountain.	この部屋からの山の眺めは最高だ。
We know very little about the cause of this disease.	この病気の原因については、ほとんどわかっていない。
This hospital is run by the city.	この病院は市立です。
This hospital has a lot of new equipment.	この病院には新しい設備がいろいろ備わっている。
You may choose what to eat from this list.	この表から食べたいものを選べます。
This edition is limited to seven thousand copies.	この版は７、０００部に限定されている。
This style of hairdressing first appeared in the early 19th century.	この髪型は１９世紀始めに初めて見られるようになった。
I would like my hair in this style.	この髪型にしてください。
This box is light enough for him to carry.	この箱は彼に運べるほど軽い。
This box is light enough to carry.	この箱は持ち運べるほど軽い。
This box will serve as a chair.	この箱は椅子として使えそうだ。
There's nothing in this box.	この箱の中には何もありません。
This box must be large enough for all these books.	この箱ならきっとその本が全部入りますよ。
This cat is as big as that one.	この猫はあの猫と同じくらい大きい。
This cat is, so to speak, a member of our family.	この猫は、いわば、我が家の一員なのです。
There is not much difference between the two.	この二つは大同小異だ。
This road connects the two cities.	この道路は二つの市を結んでいる。
This road is closed to traffic for construction work.	この道路は工事中のため通行止めだ。
There is a great deal of traffic on this road.	この道路は交通量が多い。
What's the speed limit on this road?	この道路の制限速度は何キロですか。
This tool is of great use.	この道具は実に役に立つ。
This tool is good for nothing.	この道具はなんの役にもたたない。
You can't go along this road. It is under repair.	この道を行ってもダメですよ。工事中ですから。
This road will take you to the museum.	この道を行けば美術館に出ます。
This road will lead you to the airport.	この道を行けばあなたは空港に着けます。
Go down this road until you get to a traffic light and then turn left.	この道を交通信号まで行き、左に曲がりなさい。
This road will take you to the museum.	この道をでたら博物館にでます。
You can't go along this road.	この道は通れませんよ。
This road leads to the public hall.	この道は公会堂に続いている。
This road leads to the airport.	この道は空港に通じている。
There is not much traffic on this road.	この道はあまり車が通らない。
The population of this city is on the increase.	この都市の人口は増加中です。
There's a telephone book for you to see.	この電話帳を使ってください。
May I use this telephone?	この電話を使ってもいいですか。
This telephone is out of order.	この電話は故障中だよ。
This telephone is out of order.	この電話は故障している。
This telephone is connected to the fax machine.	この電話はファックスにつながっている。
This telephone is out of order.	この電話はこわれています。
Can I make an outside call on this phone?	この電話で外線がかけられますか。
This battery is charged.	この電池は充電されている。
How long will this battery last?	この電池はどれくらいもちますか。
We can not agree with you on this point.	この点においてはあなたには同意できません。
She can not go along with you on this point.	この点で彼女はあなたに賛成できない。
I agree with you on this point.	この点で私はあなたと同意見です。
We agree on this point.	この点ではあなたと同意見です。
I agree with you on this point.	この点ではあなたと意見が合う。
This store doesn't stay open as late as I'd like.	この店は僕が望んでいるほど遅くまで開いていない。
I suggest you should do away with this shop.	この店は閉店したほうがいいと思います。
There is a large choice of bags in this shop.	この店はたくさんのかばんをそろえている。
How long will this nice weather last?	この天気はどのくらい持つのだろう。
This garden is at its best in summer.	この庭園は夏が一番いい。
Go two blocks and turn left.	この通りを二つ目の角で左へ曲がりなさい。
Go along this street and you'll come to the post office on the left.	この通りをいくと郵便局は左側にあります。
Go down this street three blocks.	この通りを３ブロック行きなさい。
Go two blocks along this street and turn left.	この通りを２ブロック行って、左に曲がりなさい。
This street is clear of traffic at night.	この通りは夜は車や人がとおらない。
Go along this street and turn right at the bank.	この通りに沿って行き銀行のところで右に曲がりなさい。
This town is quite different from what it was ten years ago.	この町は１０年前とはすっかり様子が違う。
This town is increasing in population.	この町の人口は増加している。
The population of this city is on the increase.	この町の人口は増えている。
One out of three persons in this city has his own car.	この町の３人に１人が自分の車を持っている。
Is there a museum in this town?	この町に博物館はありますか。
Is there a museum in this town?	この町には博物館がありますか。
The author has a beautiful style.	この著者は美しい文体を持っている。
Are any of these within walking distance?	この中に、歩いて行けるところがありますか。
The young women of this district are well known for their beauty.	この地方の若い女性は美しいことで有名だ。
You'll find this map very useful.	この地図がとても役に立つことが分かるでしょう。
Let's see what's happening in this big country.	この大きな国で何が起こっているか見てみましょう。
Along with this increase, there has been a change in the world's economic organization.	この増加に加えて、世界の経済構造の変化があった。
She is responsible for this broken window.	この窓が壊れたのは彼女のせいだ。
The last volume is missing from this set.	この全集は最終巻がかけている。
The fifth volume of this set is missing.	この全集の５巻目が見当たらない。
It happened that I was free last Sunday.	この前の日曜日はたまたま暇だった。
This river is beautiful.	この川は美しい。
This river flows south into the sea.	この川は南へ流れて海に注ぎこむ。
This river is deepest here.	この川はここが最も深いんだ。
None of us knows what is in store for us.	この先何が起こるか誰もわからない。
The red kills the whole pattern.	この赤色で柄全体がだいなしだ。
Will you keep this seat for me?	この席を取っておいてくれませんか。
Will you hold this seat for me?	この席を取っておいてくださいませんか。
Can you save this seat for me?	この席を見ていてくれませんか。
Could you take me to this seat?	この席まで案内してくれますか。
Is this seat taken?	この席はふさがってますか。
Where's this seat?	この席はどのあたりでしょう？
Is this seat taken?	この席はどなたかいらっしゃいますか。
I can't see the stage well from this seat.	この席からはステージが良く見えない。
Is this seat taken?	この席は空いていますか？
Each of these students has his or her own opinion.	この生徒たちはそれぞれの自分の意見をもっている。
There is nothing new under the sun.	この世の中には新しいことは何もない。
There is nothing new under the sun.	この世に全く新しきものなし。
There is nothing new under the sun.	この世に新しいものはない。
There is nothing on earth that is not affected by the sun.	この世で太陽の影響を受けないものは何一つ無い。
There is nothing on earth that is not affected by the sun.	この世で太陽の影響を受けないものはない。
There is nothing in the world from which we can't learn something.	この世で私たちが何かを学べないものは何も無い。
It is good to drink this water.	この水を飲むのはよい。
This water is good to drink.	この水は飲料に適している。
This water is safe to drink.	この水は飲んでも大丈夫だ。
This water is safe to drink.	この水は飲んでも安心です。
This water is good to drink.	この水は飲めます。
This water is good to drink.	この水は飲むのに適している。
This water is good to drink.	この水は、飲用に適している。
This library has over 50,000 volumes.	この図書館には５万冊以上の書物がある。
This is my brother.	この人は私の兄です。
This is John and that is his brother.	この人がジョンで、あの人は兄さんだ。
Is this the girl you spoke well of the other day?	この人が、あなたが先日ほめていらっしゃった少女ですか。
Fill in this application form and send it at once.	この申込用紙に必要事項を記入してすぐ送って下さい。
Please fill in this application form.	この申込書に記入してください。
This new medicine has a lasting effect.	この新薬は効果が永続的である。
It is hoped that this new policy will create jobs on a large scale.	この新しい政策によって大規模に職業が生まれることが期待される。
A feature of this new car is that if a drunk person is driving, the engine won't start.	この新しい車の特徴は、もし酔っ払った人が運転しようとしてもエンジンは動かないことである。
This food does not agree with me.	この食べ物は私の体に合わない。
This food does not agree with me.	この食べ物は、私には合わない。
This plant is good to eat.	この植物は食べられる。
I'm far from happy about this situation.	この状況はとても喜んでなんかいられない。
Can we apply this rule in this case?	この場合、この規則を適用できますか？
The new rule holds good in this case.	この場合にはその新しい規則があてはまる。
You can't apply this theory to this case.	この場合、この理論をあてはめることはできません。
This evidence was against him.	この証拠は彼にとって不利だった。
The evidence leaves no room for doubt; this can't be an original Picasso.	この証拠には、疑いの余地がない。これが、ピカソの本物の作品であるはずがない。
These boys are not good at speaking to girls.	この少年たちは少女たちと話をするのがうまくない。
Please cash this check.	この小切手を現金に換えてください。
Can you cash this check for me?	この小切手を現金にしてくれますか。
These goods are in great demand.	この商品の需要は多い。
She completed the trip in less than 20 hours.	この女性は、その往復を２０時間以内で終えた。
This lady is Indian.	この女性はインド人です。
The girl is not old enough to be responsible.	この女の子はまだ小さくてもののよしあしがわからない。
Please fill out this form.	この書類に必要事項を書き込んで下さい。
Please fill out this form.	この書類に書き込んで下さい。
Fill out this form, please.	この書式に記入してください。
I also use this study for receiving guests.	この書斎は客間兼用だ。
I don't like studying in this heat.	この暑さでは勉強する気がしない。
I would rather stay at home than go out in this hot weather.	この暑い中を外出するくらいなら家にいた方がよい。
Why do you have to stay in London in this heat?	この暑い最中になぜ、あなたはロンドンにいなければならないのですか。
Fill out this registration card, please.	この宿泊カードに記入して下さい。
This custom began in the Edo Period.	この習慣は江戸時代に始まった。
This custom dates from the Edo period.	この習慣は江戸時代からのものだ。
This custom is unique to America.	この習慣はアメリカ独特のものである。
I think this kind of custom is unique to Asian countries.	この種の慣習はアジアの国々に独特のものだと思います。
Would you be kind enough to write?	この手紙を私の代わりに書いてくださいませんか。
This letter is personal, and I don't want anyone else to read it.	この手紙は個人的なものであり、他の誰にも読まれたくない。
May this letter find you well and happy.	この手紙があなたの健康と幸せを見つけますように。
Could you put this bag in another place?	この手荷物を別の場所に置いてもらえませんか。
I would like to have this car repaired as soon as possible.	この車をできるだけ早く修理してもらいたいのですが。
This car was cheap enough for him to buy.	この車は彼が買えるほど安価だった。
This car runs on natural gas.	この車は天然ガスで動く。
I paid cash for the car.	この車は即金で買った。
This car needs repairing.	この車は修理する必要がある。
This car needs repairing.	この車は修理してもらう必要がある。
This car needs repairing.	この車は修理が必要だ。
This car is going 60km an hour.	この車は時速６０キロで走っている。
This car is the latest model.	この車は最新型です。
We need to look for a gas station because this car will soon run out of gas.	この車はもうすぐガソリンを使い果たすのでガソリンスタンドを探す必要がある。
This car is not so nice as that one.	この車はあれほど良くない。
Please repair the car.	この車の修理をお願いします。
The status of a doctor is very high in this community.	この社会では医者の地位はかなり高い。
If you see the cat in this picture, please call us.	この写真の猫を見かけたら、お電話ください。
Singapore looks very nice in this picture.	この写真ではシンガポールはとても素敵なようだ。
Where is this play being performed?	この芝居はどこで上演していますか。
With respect to this question, there are three opinions.	この質問にたいして、３つの意見があります。
You can have this watch for nothing.	この時計をただで上げよう。
I guarantee this watch to keep perfect time.	この時計は絶対に狂わないこと請け合いだ。
There's a lot of traffic on the roads around this time of the day.	この時間帯は道路が混雑する。
This fact shows that the earth goes round the sun.	この事実から、地球が太陽の周りを回っていることが分かる。
This job eats money.	この事業は金を食う。
Little did I dream of my success in this business.	この事業で私は成功するなんて思っていませんでした。
I'll never tell this to anyone.	この事は絶対に口外しません。
In addition to this, there are other reasons.	この事に加えて、ほかにもまだ理由がある。
This will be his first match in the public eye.	この試合が彼にとっては、最初の大きな試合になる。
Would you mind writing it down on this piece of paper?	この紙に書いていただけますか。
Please help me fill out this form.	この紙に記入するのを手伝ってください。
I bought this ring at a certain place.	この指輪をある場所で買った。
How large is the population of this city?	この市の人口はどのくらいですか。
Give these children three pieces each.	この子供たちにそれぞれ３個ずつあげなさい。
I'll be with you as soon as I finish this job.	この仕事を片付けたらね。
I will go out when I have finished this work.	この仕事を終えてしまったら外出しよう。
I will read a book when I have finished this task.	この仕事を終えたら本を読みます。
I hope we can start this task next month.	この仕事を何とか来月中に始めたいと考えています。
Let's finish this work as soon as possible.	この仕事をできるだけ早くすませましょう。
You will have to take on someone to do this work.	この仕事をする人を誰か雇わねばならないだろう。
It is just out of the question for me to finish the work in a day.	この仕事を１日でやることは僕にはとてもできない。
This task is too much for him.	この仕事は彼には手に負えない。
This work can be finished in half an hour.	この仕事は半時間で仕上げられます。
This work is simple enough for me to do.	この仕事は単純なので私にもできる。
This work is simple enough for a child to do.	この仕事は単純なので子供にもできる。
I do not want anyone for this job.	この仕事は誰でも良いというわけではない。
This task is too much for me.	この仕事は私の手におえない。
This work is enough to break my back.	この仕事は私には荷が重すぎる。
This task took three hours.	この仕事は三時間かかった。
This work has to be finished by Monday.	この仕事は月曜日までに終えねばならない。
This work is anything but easy.	この仕事は決してやさしくなんかない。
The work doesn't need much effort.	この仕事はたいして骨が折れない。
This job is not for every person in the battery.	この仕事はその砲兵中隊のみんなにできるものではない。
This job is not for any person in the battery.	この仕事はその砲兵中隊のだれにもできない。
Do you think this job is fit for the man?	この仕事はその人にあっていると思いますか。
This work must be finished within two years.	この仕事は２年内に終わらせなければならない。
This job carries me all over the world.	この仕事のために私は世界中に出かけます。
I don't get enough challenge in this job.	この仕事にはあまりやりがいを感じない。
Experience counts in this job.	この仕事では経験がものを言う。
I can take a good long rest when this work is finished.	この仕事がすんだらたっぷり休める。
This job is killing me.	この仕事、死ぬほどしんどい。
This mountain is among the highest in the world.	この山は世界でも有数の高い山です。
This magazine helps me to keep up with what's happening in the world.	この雑誌のおかげで私は世界情勢に遅れずにいられる。
I am gardening these days just to kill time.	この頃私は退屈しのぎに庭造りをしています。
Everyone seems to be short of money these days.	この頃は、誰もがお金に困っているようです。
This is the most beautiful country I have ever visited.	この国は私がこれまで訪問した中で一番美しい。
This country is safe from attack.	この国は攻撃を受ける心配がない。
It was the most popular sport in this country.	それはこの国でもっとも盛んなスポーツだった。
Cultures of the East and the West are mixed in this country.	この国では東西の文化が交じり合っている。
I assume that this idea will work well.	この考えは旨く行くだろう。
This park is really beautiful and clean.	この公園は実に美しくきれいだ。
This park is more beautiful than that.	この公園はあれよりも美しい。
This word has a double meaning.	この語には２重の意味がある。
This lake is the deepest in Japan.	この湖は日本で一番深い。
The lake is the deepest in Japan.	この湖は日本でいちばん深い湖である。
This lake is deep.	この湖は深い。
How deep this lake is!	この湖は何と深いのだろう。
This lake is among the deepest in the country.	この湖はその国でもっとも深いものの一つだ。
This lake is deepest at this point.	この湖はこの地点が一番深い。
This lake is the deepest in this country.	この湖はこの国で最も深い。
The lake is deepest at this point.	この湖はこの箇所が一番深い。
This lake is deepest at this point.	この湖はここが最も深い。
How deep is this lake?	この湖の深さはどれくらいですか。
The door will not open.	この戸がどうしても開かないんだ。
Everyone knows that there is something new in this old capital.	この古都に何か新しいものがあることは、だれでも知っている。
This old book is quite out of date.	この古い本はまったく時代遅れです。
We should do away with these old rules.	この古い規則は廃止すべきだ。
This old house is made of wood.	この古い家は木材でできている。
This dog is, so to speak, a member of our family.	この犬は言わばうちの家族の一員だ。
This dog eats almost anything.	この犬は何でもほとんど食べます。
This right must be protected at all costs.	この権利はどんな犠牲を払っても守らなければならない。
This building is off limits now.	この建物は、現在立ち入り禁止だ。
If you want to discuss the situation, please let us know.	この件について話し合いをご希望でしたらご連絡ください。
This plan is being discussed right now.	この計画は今話されている。
Don't you agree to this plan?	この計画には賛成ではないのか。
This experience counts for much in his life.	この経験は彼の人生において重要である。
I hope to visit this airport again.	この空港にまた来たいと思う。
The money will carry us for about a month.	この金で何とか１ヶ月はしのげる。
The money will be enough to carry me to Hong Kong.	この金でホンコンまでは十分いけるだろう。
Is there a hospital near here?	この近くに病院はありますか。
There is a military base near here.	この近くに軍の基地がある。
This church was built in the 12th century.	この教会は12世紀に建てられた。
This church dates from the 12th century.	この教会は１２世紀からのものです。
This fish is not fit to eat.	この魚は食用にならない。
This hill commands a fine view of the bay.	この丘から入り江がよく見える。
You can see the whole city from this hill.	この丘から町全体が見わたせる。
This hill commands a very fine view.	この丘からの眺めはすばらしい。
There are some cases where the rule does not hold good.	この規定が当てはまらない場合もある。
The rule reads in two ways.	この規則は二通りに読めます。
This rule applies to all cases.	この規則は全ての場合に当てはまる。
This rule does not apply.	この規則は当てはまらない。
This rule applies to any case.	この規則はどんな場合にでも当てはまる。
This rule holds good at all times.	この規則はどんなときにでも当てはまる。
This rule applies to all cases.	この規則はどの場合にも当てはまる。
This rule applies to all cases.	この規則はどの場合でも当てはまる。
This rule can be applied to any case.	この規則はどのような場合にも適用できる。
This rule does not apply to the case.	この規則はその場合には当てはまらない。
