Who are they for?	誰に送るの？
Who are they?	彼らは誰ですか。
Who are you?	あなたは誰ですか。
Who can do this work?	誰がこの仕事をやれますか。
Who did it?	誰がしたの？
Who do you get that from?	誰に似たのか
Who do you like better, Akiko or Sachiko?	あなたは亜紀子さんと佐知子さんとどちらが好きですか。
Who do you like better, Sachiko or Akiko?	あなたは佐知子さんとアキ子さんとではどちらが好きですか。
Who do you work for?	お勤めはどちらですか。
Who do you work for?	どちらにお勤めですか。
Who has made you what you are now?	あなたが今あるのはだれのおかげなのですか。
Who is he like?	彼は誰みたいな感じ？
Who is he?	彼はだれですか。
Who is he?	彼は誰ですか。
Who is he?	彼は誰？
Who likes Sachiko?	誰が幸子さんを好きですか。
Who likes Tony?	誰がトニー君を好きですか。
Who will do that?	誰がやるのか
Who will help me?	誰が私を助けてくれるの。
Who will you go with?	誰と行くの。
Who's Emily?	エミリーってだれ？
Who's in it?	誰が出演していますか。
Who's there?	そこにいるのは誰だ。
Will he get well?	彼はよくなるのだろうか。
Will you go with Tom?	トムといっしょに行きませんか。
Will you go with us?	あなたは私達と行きますか。
Will you help me with this?	私のその仕事を手伝ってくれませんか。
Will you help me?	助けてくれませんか。
Will you help me?	手伝ってくれませんか。
Will you help me?	手伝ってもらえますか。
Will you help me?	手伝って下さいますか。
Will you help me?	私を助けてくれませんか。
Will you help me?	私を手伝ってくれますか。
Will you make it to take out?	持ち帰りにしてもらえますか。
Will you make up with me?	私と仲直りしてくれませんか。
Will you take me there?	そこへ連れていってくれませんか。
Won't you go?	行かないのですか。
Work is all in all to me.	わたしには仕事が一番です。
Would that he were here to help us.	彼がここに居て私たちを助けてくれればよいのに。
Would you like me to do that work?	その仕事を私がやりましょうか。
Would you like me to do that work?	私にその仕事をやってもらいたいのですか。
Would you like me to help you?	私がお手伝いいたしましょうか。
Would you like me to help you?	私が手伝いましょうか。
Would you like me to see you home?	じゃあ、送っていこうか。
Would you like to go?	あなたは行きますか。
X is first.	Xが最初だ
X is needed.	Xが必要だ
X is the best.	Xがベストだ
X was seen for 3.6%. 	Xが３．６％に認められた
You are free to go home.	君は自由に帰っていいよ。
You are free to go out.	君は勝手に出かけていいよ。
You are the only one.	貴方達は、一つです。
You can go home if you like.	帰宅したいなら帰宅してもいいですよ。
You can go home now.	あなたはもう家に帰ってもいいですよ。
You can go home now.	もう帰ってもいいですよ。
You can go home now.	もう帰宅してもよろしい。
You can take your time.	急がなくてもいいよ。
You can take your time.	自分のペースでやってください。
You can't go out.	外へ出てはいけない。
You do not have to do it now.	今それをする必要はないんだよ。
You don't have to go there.	あなたはそこへ行く必要はない。
You don't have to help me.	手伝う必要はありません。
You don't have to work on Sundays.	日曜日に仕事をする必要はない。
You don't like sashimi, do you?	刺し身は好きではないのでしょう。
You don't need to go.	あなたは行く必要ないよ。
You go first.	君から始めなさい。
You go first.	君がまずさきに行ってくれ。
You got me!	君には参るよ。
You had best go with me.	私と行けば一番いいんだろう。
You had better go now.	あなたはもう行ったほうがいい。
You had better go.	君は行ったほうがよい。
You had better not go there.	そこへは行かないほうがよい。
You had better not go.	いかない方がよい。
You have no business doing it.	君にそんなことをする権利はない。
You have no business doing it.	君にはそんなことをする権利は無い。
You have only to go there.	あなたはそこへ行きさえすればよいのだ。
You have only to go with me.	いっしょに付いて来てくれさえすればいい。
You have to go.	おまえは行かなければならない。
You have to go.	君は行かねばならない。
You have to go.	行かなければならない。
You have to make do with what you've got.	自分で引き受けたことは自分で処理しなければならない。
You like English, don't you?	あなたは英語が好きですね。
You like English, don't you?	英語は好きなのでしょう。
You like Kawaguchi.	貴方は、川口が好きです。
You like it, don't you?	君はそれが好きですね？
You may as well get used to it.	でも慣れた方がいい。
You may as well go home now.	あなたは、今のうちに家に帰ることですね。
You may as well go home now.	もう帰ったらどうですか。
You may be free to do what you like.	ここでは自由に振る舞っていいですよ。
You may go home now.	君はもう家へ帰ってよろしい。
You may go home.	あなたは家に帰ってもよろしい。
You may go there.	君はそこに行ってもよい。
You may go.	あなたは行ってもよい。
You may use it any time.	いつでもそれを使ってください。
You need not do so.	きみはそうする必要はない。
You need not go there.	あなたはそこに行く必要がない。
You see?	分かったでしょう。
You should go about your business.	君は仕事に精を出すべきだ。
You should have done so.	君はそうすべきだった。
You should have seen it.	君にそれを見せたかった。
You should have seen it.	君も見るべきだったのに。
You should make better use of your free time.	あなたは暇な時間をもっとうまく利用すべきだ。
You should not go there.	そこへ行ってはいけません。
You shouldn't go to work.	職場には出ないでください。
You shouldn't have done it.	君はそれをするべきではなかったのに。
You shouldn't have gone there.	君は、そこに行かなかったほうが良かった。
You won't get there on time.	時間通りには着けないよ。
You'd better go home now.	もう家に帰りなさい。
You'd better go home.	あなたは家に帰った方がよい。
You'd better go.	あなたは行ったほうがいい。
You'd better not do it.	それはしない方がいい。
You'd better not go out.	あなたは出かけないほうがよい。
You'd better not go there.	君はそこへいかないほうがよい。
You'd better not go.	君は行かないほうがよい。
You'll see.	今にわかる。
You've made me what I am.	今日私があるのはあなたのおかげです。