It can't be helped.	どうしょうも無いのね。
It can't be helped.	仕方がない、それはいかんともしがたい。
It has my name on it.	それには私の名前があります。
It has my name on it.	それには私の名前が書いてあります。
It is about time I was going.	そろそろおいとましなければならない時間です。
It is better for you to do it now.	君は、今それをやる方が良い。
It is he.	それは彼だ。
It is no business of yours.	よけいなお世話だ。
It is no use going there.	そこへ行っても仕方がない。
It is not my day.	今日はついてないな。
It is on me.	それは僕のおごりだ。
It is seven in London now.	ロンドンは今７時です。
It is seven now.	今７時です。
It is time I was going.	もうおいとまする時間です。
It is time you should get up.	あなたはもう起きるべき時間だ。
It is up to you how you take it.	それをどうとるかは君しだいだ。
It was like this.	それはこんな次第だった。
It was only 11.7%.	それが１１・７％に止まった
It was used only from time to time.	それはときどき使用されるだけだった。
It's April first.	四月一日です。
It's OK with me if it's OK with you.	あなたさえよければ、私はかまいませんよ。
It's OK with me.	私はいいですよ。
It's about time I was going home.	そろそろ家へ帰る時間だ。
It's about time you got here!	君はとっくにここにいなきゃいけないはずだ。
It's all Greek to me.	私にはさっぱり。
It's all one to me.	それは私にとってはどうでもよいことです。
It's all up with me.	僕はもう万策尽きた。
It's all up with my business.	商売は上がったりだ。
It's better as it is.	現在のままのほうがいい。
It's business.	それが仕事です。
It's getting there.	もう一息というところです。
It's me.	それは私だ。
It's news to me.	そのニュースは全く寝耳に水だ。
It's not us who did it.	それをしたのは私たちではない。
It's on me.	僕のおごりですよ。
It's on me.	私のおごりだ。
It's time for us to go home.	もう私たちが帰る時間だ。
It's time to be going.	お暇する時間です。
It's time to go.	出かける時間よ。
Jack isn't here.	ジャックがきていません。
Jane may not be at home now.	ジェーンは今家にいないかもしれない。
Jim has gone to London.	ジムはロンドンへ行ってしまった。
Jim is not what he was.	ジムは、昔の彼ではない。
Kaoru has gone to America.	薫さんはアメリカに行っています。
Like it?	気に入ってる？
Like will to like.	似たものは似たものによっていく。
Make the best of your time.	余暇をできるだけ利用しなさい。
Mary. That's my name.	メアリーですよ、私の名前は。
May I go home now?	もう家に帰ってもよいですか。
May I go home now?	今、家に帰っていい？
May I go home?	私は帰宅してもよいですか。
May I go with you?	付いて行ってもいいですか。
May I have this for two or three days?	これを二、三日貸していただけますか。
May I have your name?	お名前は？
May I help you ma'am?	何をさしあげましょうか、奥様。
May I help you?	ご用件は？
May I help you?	ご用件をうけたまわりましょうか。
May I help you?	はい、何かご用でしょうか。
May I help you?	何かお探しですか。
May I help you?	何かご用はありますか。
May I help you?	何をさし上げましょうか。
May has been in Japan for a year.	メイは一年間ずっと日本にいます。
Mike has been out of work for a year.	マイクはここ一年間失業中である。
Miyazaki is not what it used to be.	宮崎は昔の姿とは違う。
Mr Tanabe is out now.	田辺先生はただいま外出しております。
Mt Fuji can be seen from here.	ここから富士山が見えるよ。
Muiriel is 20 now.	ムーリエルは２０歳になりました。
My name is Andrea.	アンドレアと申します。
My name is Hashimoto.	私は橋本といいます。
My name is Hisashi.	私は「ひさし」という名前だ。
My name is Hopkins.	我が名はホプキンス。
My name is Ichiro Tanaka.	名前は田中一郎です。
My name is Yamada.	私の名前は山田です。
My name is Yatarou.	僕の名は弥太郎です。
Nancy and Jane had to go home at five-thirty.	ナンシーとジェーンは５時半に帰宅しなければならなかった。
No one can go in there.	誰もそこにはいれないよ。
No one can help me.	だれも私を助けることができない。
No one helped me.	誰も私の手伝いをしてくれなかった。
No, I didn't go out.	はい、外出しませんでした。
No, I didn't help.	いいえ、手伝いませんでした。
No, I don't have it with me.	いや、今は持ってない。
No, I don't. What's he like?	いいや、どんな人。
No, he will not.	いいえ、教えないでしょう。
No, no, it's on me.	いいえ、それは私のおごりです。
No, we have to go now.	いや駄目だ、今すぐに行かなくちゃ行けない。
No, you need not.	いいえ、必要ありません。
Not only he but also I am to go.	彼だけでなく私も行くことになっている。
Now I'm done for.	参ったなあ。
Oh! It's my day.	おっ！今日はついてるぞ。
Oh, OK. Well, can you get me one?	そうですか、じゃ、取り寄せてもらえますか。
Oh, what is this?	まあ、これは何なんでしょう？
One of us will have to go.	どちらか一方が出て行くしかないな。
One should do one's best.	人は最善を尽くすべきだ。
Peter is not in now.	ピーターは今不在です。
Prices are going up.	物価が上がっている。
Prices are going up.	物価が上がりつつある。
Sam, what are you doing?	サム、何をやってんだ？
Saturday is the day when he is free.	土曜日は彼が暇な日です。
Search as we would, we could not find it.	いくら探しても見つからなかった。
Search me.	さあね。
See you about 7.	７時頃にね。
See you at 7.	７時にね。
Seven days of Saturday is all that I need.	毎日が土曜日だったらいいのに。
Shall I get some for you?	あなたのためにいくらか手に入れてあげましょうか。
Shall I help you?	お手伝いいたしましょうか。
Shall I help you?	お手伝いしようか。
Shall we go?	行きましょうか。
So do I.	私も。
So do I.	私もだわ。
So this is New York.	なるほどこれがニューヨークか。
So what?	だから何なの？
Take me with you.	一緒に連れて行って下さい。
Take three at a time.	一度に三個づつ取りなさい。
Take your time, Yoshida.	吉田、ゆっくりやれよ。
Take your time.	ゆっくりどうぞ。
Take your time.	ゆっくりやってくれ。
Take your time.	ゆっくり時間を掛けなさい。
Ten years have gone by.	１０年が過ぎた。
That couldn't be helped.	仕方なかったんだ。
That is no business of yours.	それは君には関係ないことだ。
That is no business of yours.	君の関する事柄ではない。
That name is Ken.	その名前はケンです。
That was all Chinese to me.	私にはちんぷんかんぷんでした。
That will do me well.	それでは私は結構です。
That won't help you.	それは君の役には立つまい。
That won't work!	それは行かんわい！
That won't work.	それは、無茶だ。
That's better.	良くなりました。
That's news to me.	それは初耳ですね。
The only one we have is this one here.	今のところこちらだけになります。
The price is up to you.	値段はあなたしだいで決めてください。
The work is done.	その仕事は終わった。
Their names are Tom and Ken.	彼らの名前はトムとケンです。
There are fifty states in America.	アメリカには５０の州がある。
There are seven of us.	我々は全部で、７人です。
There is Tokyo.	そこは東京です。
There is X.	Xが御座います
There is no one here who can help you with the work.	その仕事のお手伝いが出来る人はここには誰一人いません。
There used to be a hotel about here.	昔この辺りにホテルがあった。
There was no one about.	辺りには誰もいなかった。
There was no one about.	辺りには誰一人いなかった。
There you are.	そこにありますのでどうぞ。
There's no but about it!	でももヘチマもないわ。
There's no one but me here.	ここには私のほかに誰もいない。
There's no one by that name here.	こちらには、そういう名前の者はおりません。
There's no time for X.	Xに全然時間が足りない
These are the ABCs.	これは基本です。
They are Christians.	彼らはキリスト教徒です。
They are all of a price.	それらはみんな同じ値段だ。
They are at work.	彼らは仕事中です。
They are five in all.	彼らは全部で５人です。
They are out of work now.	彼らは今失業中だ。
They are willing to do it for you.	彼らはあなたのために快くそれをするでしょう。
They are willing to help us out.	彼らは進んで私たちの手助けをしてくれる。
They don't like me.	彼らは、私が嫌いだ。
They got to business.	彼らは仕事に取りかかった。
They have gone to Europe.	彼らはヨーロッパに行ってしまった。
They have seen better days.	彼らにだってよい時代もあった。
They like English.	彼らは英語が好きだ。
They like Tsuneoki Ikeda.	彼らは、池田恒興が好き。
They made me go there.	彼らは私をそこに行かせた。
They made me go there.	彼らは私をそこへ行かせた。
They made us work all day.	彼らは私達に１日中その仕事をやらせた。
They were from Liverpool.	彼らはリバプールの出身だった。
They'll be here at three.	彼らは３時にここへ来るでしょう。
This has gone out of use here.	これはここではもう使われません。
This hotel is the best, as hotels go.	このホテルはホテルとしてはいちばんよい。
This hotel will not do.	このホテルではだめだ。
This information is not as up-to-date as it should be.	この情報は当然最新であるべきなのに、実際はそうでない。
This is Japan as Americans see it.	これがアメリカ人から見た日本観です。
This is Mike. Is Hiroshi there?	マイクですが、博君はいますか。
This is all he has to do.	これだけのことを彼はやらなければならない。
This is all on me.	支払いは全部私にまかせて下さい。
This is all you have to do now.	君が今しなければならないのはこれだけだ。
This is how I did it.	このようにして私はそれをした。
This is how I go about it.	これが僕のやり方だ。
This is how I made it.	こんなふうにして私はそれを作った。
This is how we do it.	これが私たちのやり方です。
This is my best work to date.	これが現在までの私の最高傑作です。
This is the first time that I have been here.	当地へ来たのは今度が初めてです。
This is the first time.	こんなこと初めてだ。
This is the time you should get up.	もう起きる時間ですよ。
This is the year 1990.	今年は１９９０年です。
This is what I can do for you.	僕が君にできることはこれだけだ。
This is what I need.	これが私が必要とするものです。
This news is new to me.	このニュースは初耳です。
This will do for now.	今のところそれで間に合うでしょう。
This work is new to me.	私はその仕事に慣れていません。
Tom is getting better.	トムは段々よくなっている。
Tom is now in the fifth year.	トムは今５年生だ。
Tom likes Mary and Mary likes Tom.	トムはメアリーが好きだし、メアリーもトムが好きだ。
Tom was also there.	トムもそこにいました。
We can but do our best.	ベストを尽くさざるをえない。
We can make a day of it.	一日、そこで過ごせるわね。
We do not all go.	私達がみんな行くとは限らない。
We have found the Messiah.	私たちは、メシアにあった。
We have to be at work by nine.	私たちは９時までに仕事に出ていなければならない。
We have to do the work in a day.	私たちは一日でその仕事をしなければならない。
We have to make the best of what we have.	私達は今あるもので我慢していかなければならない。
We have to make the best of what we have.	私達は今あるもので我慢しなければならない。
We made it out of there.	何とかそこから脱出した。
We should do our best.	我々は最善を尽くすべきだ。
We take the Asahi and Yomiuri.	うちは朝日新聞と読売新聞を購読しています。
We will do our best so that we can have a meetup.	オフ会ができるように皆で頑張る
We will do our best.	私たちは全力を尽くすつもりです。
We will go but you won't.	おれたちは行くのにおまえたちは行かぬ。
We work by the day.	我々は日ぎめで働く。
We work from nine to five.	私達は９時から５時まで働く。
We worked on Saturdays, but now we don't.	私たちは土曜日に働きましたが、今はちがいます。
We'd better go home now.	そろそろ家へ帰るほうがよい。
We'd better make some time.	急いでいかなくちゃ。
Well, I have to be going.	もうそろそろ失礼しなくては。
Well, I have to go now.	ああ、もうお暇しなくては。
Well, do you like it?	お口に合いますか。
Well, here we are!	やれやれ、やっと着いたぞ。
Well, it'll do for the time being.	まあ当分はそれで間に合うだろう。
Well, you can't.	まあ無理ですな。
What a business it is!	面倒だな。
What about Jack?	ジャックはどうしましたか。
What am I to do now?	私は今何をすべきですか。
What am I to do?	私は何をしなければならないのですか。
What am I to do?	私は何をすればいいの。
What am I to do?	私は何をなすべきでしょうか。
What are nabemono like?	なべ物とはどんなものですか。
What are some other nabemono?	なべ物にはほかにどんなものがありますか。
What are these for?	これは何に使うものですか。
What are they at?	彼らは何をしているのか。
What are they doing?	彼らは何をしていますか。
What are they for?	それらは何のためですか。
What are they made of?	それらは何でできていますか。
What are you about now?	君は今何をしているの。
What are you about?	何をしているのですか。
What are you about?	何をやっているのですか。
What are you doing here?	あなたはここで何をしているのですか。
What are you doing here?	ここで何をしてるの？
What are you doing here?	こんなところで何してるの？
What are you doing here?	何をしているこんな所で？
What are you doing now?	今何をしているの？
What are you doing that for?	どうして君はそんな事をしているの。
What are you doing?	何しているのですか。
What are you doing?	何してるの？
What are you doing?	何をしているの。
What are you doing?	君はどうするの。
What are you getting at?	何がおっしゃりたいのですか。
What are you getting at?	何が言いたいの？
What are you getting at?	何をおっしゃりたいのですか。
What are you getting at?	何を言いたいの。
What are you getting at?	何を言おうとしているの。
What are you getting at?	君のねらいは何なのだ？
What are you getting at?	君の狙いはなんなのだ。
What are you getting at?	君は何を言おうとしているの。
What are you going to Tokyo for?	東京へなにしに行くの。
What are you going to be?	あなたは何になるつもりですか。
What are you going to be?	君は何になるつもりですか。
What are you going to do about it?	どうするつもりなんだ？
What are you going to do with it?	それをどうするつもりですか。
What are you going to do?	あなたは何をするつもりですか。
What are you going to do?	何するつもり。
What are you going to have?	あなたは何にするの。
What are you going to have?	君は何にしますか。
What are you going to see?	何を見るつもりですか。
What are you two doing?	二人は何をしているところですか。
What are you up to?	あなたは、今度は何にとりかかっているの。
What are you working for?	何のために働いているのですか。
What are you?	あなたは何者ですか。
What did Kumi make?	クミは何を作りましたか。
What did you do that for?	なぜそうしたんですか。
What did you do there?	そこで何をしたの？
What did you get for Christmas?	クリスマスに何をもらいましたか。
What did you go there for?	なぜそこへ行ったの？
What did you go there for?	何のためにそこへいったのか。
What did you go there for?	何故そこへ行ったのですか。
What did you go to Kyoto for?	なぜ京都へ行ったのですか。
What did you make?	あなたは何を作りましたか。
What did you make?	何を作ったの？
What do I have?	何の病気ですか。
What do you do in Japan?	日本ではどんな仕事をしていますか。
What do you do in your free time?	暇なときは何をしていますか。
What do you do on Sunday?	あなたは日曜日に何をしますか。
What do you do on Sundays?	日曜日に何をしますか。
What do you do?	あなたの仕事は何ですか。
What do you do?	お仕事は何ですか。
What do you do?	ご職業は何ですか。
What do you do?	君の仕事は何ですか。
What do you have to add to 17 to get 60?	６０にするためには１７に何を足せばよいの。
What do you have?	あなたは何を持っていますか。
What do you like to do on Sundays?	日曜日は何をしますか。
What do you like?	何がお好きですか。
What do you like?	君は何が好きですか。
What do you make of it?	どう理解しますか。
What do you make of this?	これをどう解釈しますか。
What do you need?	何が必要ですか。
What do you take me for?	あなたは私を何だと思っているのですか。
What do you take me for?	僕を何だと思っているのか。
What do you take me for?	僕を何だと思っているんだよ。
What do you take me for?	僕を誰だとおもっているの。
What don't you have?	あなたは何を持っていないのですか。
What for?	何に使うの？
What had I better do?	私は何をしたらよいでしょう。
What has that to do with me?	それが私にどう関係があるのか。
What have you been doing?	ずっと何をしていたんだい。
What have you been doing?	今まで何をしていたのですか。
What is John doing now?	ジョンは今何をしていますか。
What is Tony doing?	トニー君は何をしていますか。
What is a UFO?	ユーフォーって何？
What is butter made of?	バターは何から作られてるの？
What is going on there now?	あそこで今何が起こっているんだ？
What is going on?	いったい何が起こっているのか。
What is he doing now?	彼は今何をしていますか。
What is he doing?	彼は何をしでかそうとしているのだろう。
What is he like?	彼ってどんな人？
What is he like?	彼はどんな人ですか。
What is he up to now?	彼は今何の仕事をしているのですか。
What is he up to?	彼は何を企んでいるんだ。
What is it that "isn't only you"?	何があなただけではないって？
What is it you got?	手に入れたものは何だ？
What is it?	それは何ですか。
What is it?	何ですか。
What is sukiyaki made of?	すき焼きはどんな材料を使うのですか。
What is that?	あれは何ですか。
What is the English for "kaisha"?	「会社」を表す英語は何ですか。
What is the news?	何か珍しいことがありますか。
What is the price for this?	これの値段はいくらですか。
What is the price?	価格はいくらですか。
What is the price?	値段はいくらですか。
What is your name?	あなたの氏名は何ですか。
What shall I do for you?	何かお手伝いしましょうか。
What shall I do for you?	御用は何でしょうか。
What shall I do with it?	それをどう始末するの。
What shall I go in?	何を着て行こうか。
What should I see?	どこを見物すればいいでしょうか。
What time can I be there?	何時にそこに行けばいい。
What time do we get to San Francisco?	サンフランシスコには何時に着きますか。
What time do you get up?	あなたは何時に起きますか。
What time do you get up?	何時に君は起きるの。
What time do you go home?	あなたは、何時に帰宅しますか。
What time do you have?	何時ですか。
What time is it in London now?	ロンドンは今何時ですか。
What time is it in Tokyo?	東京は今何時ですか。
What time is it now in San Francisco?	サンフランシスコは今何時ですか？
What time is it now?	現在の時刻は？
What time is it?	今、何時ですか。
What time is it?	何時でしょうか。
What time shall we make it?	何時にしましょうか。
What time?	何時にきましょうか。
What was he up to?	彼は何をやろうとしていたのか。
What was it that you did there?	そこでいったい何をやったんだ。
What was your name?	お名前は何とおっしゃいましたか。
What were you doing at that time?	あなたはそのとき何をしていましたか。
What will you be having?	お客様は？
What will you do on Friday?	あなたは金曜日に何をするつもりですか。
What will you have?	君は何にする？
What would you have me do?	あなたは私に何をしてもらいたいのですか。
What would you like to do?	あなたは何をしたいのですか。
What's Ken doing now?	ケン君は今何をしていますか。
What's going on here?	ここで何が起こっているのですか。
What's going on?	何が起こっているのか。
What's it made from?	何でできているの？
What's its name?	名前は何ですか。
What's new?	何か変わったことある？
What's new?	何か変わったことない？
What's new?	何か変わったことは？
What's new?	何か変わりはない？
What's new?	変わりはないかい。
What's that?	あれ何？
What's this?	これは何ですか。
What's this?	これ何？
What's up, Mike?	どうしたんだい、マイク。
What's up, kiddo?	ぼく、どうしたの？
What's up?	何が起こったんだ？
What's your business in the States?	アメリカでは、どんな仕事をするのですか。
What's your name?	あなたのお名前は？
What've you been up to?	あなたは今まで何をしていたの。
What?	なんて言った？
When am I to contact you?	私はいつあなたに連絡を取るべきですか。
When are you going to Europe?	いつヨーロッパへ行くのですか。
When can I see you?	いつお目にかかれますか。
When did he get to Kyoto?	彼はいつ京都についたのですか。
When did he go to Europe?	彼はいつヨーロッパに行ったのですか。
When did they go home?	いつ彼らは帰宅しましたか。
When did you get home?	あなたはいつ家へ帰りましたか。
When did you get to Kyoto?	いつ京都に着きましたか。
When did you get to London?	ロンドンにはいつ着きましたか。
When did you get up?	何時に起きましたか。
When did you go there?	いつそこへ行きましたか。
When did you go to Rome?	いつローマに行ったんですか。
When do I get there?	何時に着きますか。
When do you work?	いつ働いてるの？
When in Rome, do as the Romans do.	ローマではローマ人がするようにしなさい。
When in Rome, do as the Romans do.	ローマではローマ人のする通りにせよ。
When in Rome, do as the Romans do.	ローマにいるときは、ローマ人と同じように行動せよ。
When in Rome, do as the Romans do.	ローマにいるときはローマ人がするとおりにせよ。
When shall we go?	いつ行こうか。
When will he go home?	彼はいつ家に帰れるのですか。
When will we get there?	私たちはいつそこのたどり着くことになるだろうか。
When will we get to Sydney?	いつシドニーに着いたのだろう。
When will you be free?	いつお暇ですか。
When will you be free?	君はいつ暇になりますか。
When will you go out?	いつお出かけになりますか。
Which do you like better, Denver or Montreal?	デンヴァーとモントリオールとどっちが好きですか。
Which do you like better, L.A. or New York?	Ｌ．Ａとニューヨークどちらが好きですか。
Which do you like better, this or that?	あなたはこれとあれとどちらが好きですか。
Which is better, this or that?	これとあれではどちらが良いですか。
Which of you will go?	君達のどちらがいくのですか。
Which one do you take?	君はどちらを取りますか。
Which will you take, this one or that one?	あなたはこれとあれとどちらを選びますか。
Which would you like?	今日のスープは何ですか。
Who am I?	私は誰なのだろうか。
