What in the world are you doing?	いったいぜんたいあなたは何をしているのか。
When did you buy it?	いつそれを買ったの。
When is a good time for you?	いつが都合がいいですか。
When did you buy this video?	いつ、このビデオを買ったのですか。
When are you going back to Italy?	イタリアへはいつ戻るのですか。
What price will you give for this?	いくらで買うか。
Please take some of them.	いくつかお取り下さい。
We have good news.	いい知らせがあります。
Don't give me that!	いいかげんな話はやめろ。
No, I don't know.	いいえ、知りません。
No, but they might have them at our other store.	いいえ、でも、内の別の店にあるかもしれません。
That is our school.	あれは私達の学校です。
How would you know an American from an Englishman?	アメリカ人と英国人はどのように見分けますか。
That store gives good service.	あの店はサービスが良い。
Do you know who they are?	あの人たち誰だか知ってる？
They are just going to the store over there.	あの人たちはちょうど向こうのお店まで行くところです。
How do you like that TV news program?	あのテレビニュースはいかがです？
You will have to go to England next year.	あなたは来年はイギリスへ行かなければならないでしょう。
Will you go to America next year?	あなたは来年アメリカへ行くつもりですか。
Do you know them?	あなたは彼らを知っていますか。
You know who he is.	あなたは彼がだれだか知っている。
You will just have to do with what you've got.	あなたは自分の持っているもので満足しなければならないだろう。
You should make good use of your time.	あなたは時間をうまく利用すべきです。
Do you know me?	あなたは私を知っていますか。
Do you know us?	あなたは私たちをご存知ですか。
What are you looking for?	あなたは今何を探しているのですか。
You go to school.	あなたは学校へ行きます。
You go to school, don't you?	あなたは学校に行きますね。
You won't be in time for school.	あなたは学校に間に合わないでしょう。
What are you looking for?	あなたは何を捜しているのですか。
Which do you like better, music or English?	あなたは音楽と英語のどちらが好きですか。
You don't like music.	あなたは音楽が好きではありません。
Do you like music?	あなたは音楽が好きですか。
Which do you like better, English or music?	あなたは英語と音楽とではどちらが好きですか。
Do you know her at all?	あなたは一体彼女を知っているのですか。
How do you go to school?	あなたはどうやって通学するのですか。
Do you know what it is?	あなたはそれが何か知っていますか。
Did you see her there?	あなたはそこで彼女に会ったのですか。
Do you know what this is?	あなたはこれが何か知っていますか。
When do you go back to Japan?	あなたはいつ日本へ戻られますか。
When will you go back to Japan?	あなたはいつ日本へ帰られますか。
When will you be back?	あなたはいつ帰宅しますか。
Do you know her at all?	あなたはいったい彼女の何を知っているのですか。
You should know better now you are eighteen.	あなたは１８になったのだから、もっと分別があっても良い。
May I have your name, please?	あなたの名前は何ですか。
I am willing to take your offer.	あなたの申し出はお受けします。
Yours is over there.	あなたのは向こうにあります。
I didn't get your last name.	あなたに姓が聞き取れなかった。
I have good news for you.	あなたによい知らせがあります。
You're the only one who can help me.	あなたしか僕を助けられる人はいないんだ。
Will you show me what you bought?	あなたが買ったものを見せてくれませんか。
Do to others as you would have them do to you.	あなたが、他人にしてもらいたいと思うように他人にもしない。
We can see Mt. Fuji over there.	あちらに富士山が見えます。
It is Eve that sets Adam on.	アダムをそそのかしたのはイブだ。
I don't know what to do now.	あたしは今何をしてよいかわからない。
You may as well give up.	あきらめた方が良いのではないでしょうか。
Well, here we are at last.	ああやっと着いた。
SOS, please help!	ＳＯＳ助けてくれ。
I will be back by nine.	９時までには戻る。
Please read page ninety-four.	９４ページを読んで下さい。
$8.50, please.	８ドル５０セントいただきます。
I have to be back home by seven.	７時までに家に帰らなくてはならない。
That's $7.65, please.	７ドル６５セント、お願いします。
Give me five days.	五日待ってくれ。
5 is less than 8.	５は８より少ない。
From the 5th to the 15th of January, please.	１月５日から１月１５日までおねがいします。
Give me $1.00 back, please.	１ドルお釣りをくださいな。
I found them all but one.	１つを除いて全部見つかった。
I'll be back at ten.	１０時に帰ります。
Please don't get up.	どうぞおたちにならないで下さい。
I didn't order this.	これは注文していません。
He can't get on in the world.	うだつが上がらない。
I don't know.	分かりません。
I don't know.	知らない。
Who'd know that?	誰がそれを知ろうか。
I don't know if I'll have time.	時間があるかどうか分からない。
Your o's look like a's.	君が書くｏはａに見えるね。
Her name is known all over the world.	彼女は世界的に有名です。
That is my school.	あれが私の学校です。
I don't know if there is time.	時間があるか分かりません。
Tom didn't know what Mary's last name was.	トムはメアリーの苗字を知らなかった。
Do I look OK?	変じゃない？
Do I look OK?	おかしくない？
I know all about you.	あなたのことは全てわかっています。
I knew you'd like it.	気に入ってくれると思ってた。