I've come this far, so I'll keep going.	乗りかかった船ということでやっていく所存です。
She speaks French, much more English.	彼女はフランス語を話す。まして英語は当たり前である。
He speaks Japanese as if he were Japanese.	彼は、日本語をまるで日本人かのように話す。
The same can be said of many other persons.	同じ事がほかの多くの人についても言える。
Ikeda is my last name, and Kazuko is my first name.	池田が姓で和子が名です。
If it were not for water, we couldn't live.	水が無ければ私たちは生きられないだろう。
I think that Shintaro speaks English well.	私は慎太郎君は英語を上手に話すと思います。
I want to know more about your country.	私はあなたの国についてもっと知りたいと思います。
We love her, and she loves us, too.	私たちは彼女が好きですが、彼女のほうも私たちが好きです。
We can not do without water even for a day.	私たちは水無しでは一日もやっていけない。
English is used in every part of the world.	英語は世界中いたるところで使われている。
A person named Jones has come to see you.	ジョーンズさんという方がお見えになりました。
Is this the book you spoke of the other day?	これが先日あなたが話していた本ですか。
Don't let me down as you did the other day.	この前みたいに私をがっかりさせないでね。
There are so many people here in Tokyo.	ここ東京にはずいぶんたくさんの人がいるんですね。
There must be a better person for both of us.	お互いもっと適した相手がいるはずだ。
You are the very person I have been looking for.	あなたこそ私が探していた人だ。
Billy will come to Japan in the early evening.	ビリーさんが夕方頃に日本にやってくる
She speaks English and also speaks Swahili.	彼女は英語を話し、その上スワヒリ語も話す。
She is American, but she lives in England.	彼女はアメリカ人だが、イギリスに住んでいる。
Some people like him and other people don't.	彼を好きな人もいればそうでない人もいる。
He doesn't want me to go, but I mean to.	彼は私が行くことを望まないが、私は行くつもりだ。
He is at home, but no one can see him.	彼は在宅していますが、どなたにもお目にかかりません。
He speaks French, not to speak of English.	彼は英語は無論のこと、フランス語も話します。
He can speak English, and French as well.	彼は英語が話せるし、その上フランス語も話せる。
He speaks English as if he were an American.	彼はまるでアメリカ人のように英語を話す。
He can speak French, and even more English.	彼はフランス語が話せる。英語はなおさらだ。
He can speak French, still more English.	彼は、フランス語を話せる、ましてや英語も話せる。
When I understood him I thought better of him.	彼という人間がわかって彼を見直した。
It will do you good to live in the country.	田舎に住むのはあなたにとってよいでしょう。
It was a long time before she understood me.	長いこと彼女は私を理解してくれなかった。
I can't understand what he is thinking about.	私は彼が考えていることが理解できない。
Our world is getting smaller and smaller.	私たちの世界は、だんだん小さくなってきている。
English is spoken in many parts of the world.	英語は世界の多くの地域で話されている。
The Rhine runs between France and Germany.	ライン川はフランスとドイツの間を流れている。
Something must be done about it in no time.	そのことですぐに何か手を打たねばなるまい。
This is the very book I have been looking for.	これこそまさに私が探していた本です。
This is the person I spoke about the other day.	こちらは先日私がお話しした人です。
How far is it from here to your house?	ここからあなたの家までどれくらいの距離がありますか。
She speaks not only English but also French.	彼女は英語だけでなくフランス語も話します。
She can speak French, much more English.	彼女はフランス語が話せます、まして英語は話せます。
He speaks Japanese as if he were Japanese.	彼は日本語をまるで日本人であるかのように話す。
You can make book on it that he won't help you.	彼は金輪際君を助けてくれないだろう。
He can't speak English, much less French.	彼は英語を話せない。ましてやフランス語は論外だ。
He can speak not only English but also German.	彼は英語ばかりでなくドイツ語も話せる。
Many a person has had the same experience.	同じような経験をした人は行く人も行く人もいる。
Mr. Obama wants to move to Tokyo from Osaka.	オバマさんが大阪から東京に転入したいです。
There are about 6 billion people in the world.	世界には約６０億の人々が暮らしている。
Living without water is out of the question.	水なしで生きることはまったく不可能である。
We must make the best of the small room.	私達はその狭い部屋を最大限利用しなければならない。
I'll never see him again as long as I live.	私は生きている間は決して再び彼とは会わない。
As long as we love each other, we'll be all right.	愛さえあれば僕らは大丈夫だよ。
Which is your book, this one or that one?	どちらがあなたの本ですか、この本それともあの本。
Which of the two books did you like better?	その２冊の本の中でどちらの方が好きでしたか。
And then, it took them far from home.	そしてそれらを家から遠く離れたところへ連れていきました。
I don't like this one; show me another.	これは気に入らない、もう一つほかのを見せてください。
This is a good book, but that one is better.	これはよい本ですが、あの本の方が良いです。
This is an old book with a new face.	この本は見かけこそ新しそうだが内容は以前と変っていません。
Which book is older, this one or that one?	この本とあの本ではどちらの本の方が古いですか。
There were as many as five hundred people present.	５００人もの出席者がいました。
"Where is your house?" "It is over there."	「あなたの家はどこですか」「それは向こうです」
I didn't understand in the least what he said.	彼の言ったことが少しも理解できなかった。
There are many Americans who can speak Japanese.	日本語を話せるアメリカ人が大勢いる。
China is about twenty-five times as large as Japan.	中国は日本の約２５倍の広さだ。
We had to make the best of our small house.	私たちは小さな家で我慢しなければならなかった。
If I were you, I wouldn't live with him.	私があなただったら、あの人といっしょに暮らしません。
Lisa speaks not only English but also French.	リサは英語だけでなくフランス語も話します。
If it were not for water, we could not live.	もし水がなければ、我々は生きられないだろう。
Don't you have another one that's a little larger?	もう少し大きいのはありませんか。
From that time on, they came to love each other.	それ以来彼らは愛し合うようになった。
The house is too small for five people to live in.	その家は５人が住むには狭すぎる。
This is the very book I have been looking for.	これこそまさしく私がさがしていた本です。
Both French and English are spoken in Canada.	カナダではフランス語と英語が話されている。
"Are those your books?" "No, they aren't."	「あれらはあなたの本ですか」「いいえ、違います」
She wants to move out and find a place of her own.	彼女を家を出て独立したがっている。
Their living room is as large again as my house.	彼らの居間は我が家の２倍の広さがある。
I love him for what he is, not what he has.	彼の財産でなく、彼の人柄のために私は彼が好きだ。
If he had known, he might have come earlier.	知っていたら、彼はもっと早く来たかもしれない。
I am from Hiroshima, but now I live in Tokyo.	広島の出身ですが、今住んでいるのは東京です。
If it were not for water, we could not live.	もし水がなければ、私達は生きていけないだろう。
It was the best experience in all my life.	それは私のこれまでの生涯の中で、最高の経験だった。
The people in the room all know one another.	その部屋の人々は、みんな互いに知り合いだった。
Such being the case, I could not be present.	そういうわけだから私は出席できなかったのです。
If it were not for this book, I couldn't study.	この本がなかったら、勉強できないだろう。
The last time I saw Kent, he was very well.	この前ケントに会ったとき、彼はとても元気でした。
Do you have something to do with this group?	あなたはこのグループと何か関係があるんですか。
As many as ten people live in this small house.	１０人もの人がこの小さな家に住んでいる。
She spoke English to me just to show off.	彼女は見せびらかすだけのために英語でぼくに話しかけた。
He can speak both English and French very well.	彼は英語もフランス語も大変上手に話せます。
He's always looking at you. He must love you.	彼はいつも君を見ている。きっと君が好きなんだ。
There are many Americans who can speak Japanese.	日本語を話せるアメリカ人がたくさんいる。
I can't understand what he wants me to do.	私は彼が私に何をするよう望んでいるのか理解できない。
I have to make the best of that small room.	私はその狭い部屋をせいぜい活用しなければならない。
The time will come when you will understand this.	君がこのことを理解する時がくるだろう。
All you have to do is to hand this book to him.	きみはこの本を彼に渡してくれるだけでいい。
There were many people who helped me get there.	そこに至るまでには多くの方々の協力を得ました
She can speak Spanish, much more English.	彼女はスペイン語を話せる。ましてや英語は言うまでもない。
She speaks French, not to speak of English.	彼女は、英語は言うまでもなく、フランス語も話します。
You shouldn't let people use you like that.	自分をそんなふうに人々に利用させておくべきではない。
I want to know more about your way of speaking.	私は、あなたの話し方についてもっと知りたい。
Few people can speak English better than Sachiko.	幸子ほどに英語を上手に話せる人は少ない。
You should set a high value on every man's life.	すべての人の生涯を高く評価するべきである。
How long does it take from here to your house?	ここからあなたの家までどれくらいかかりますか。
India is the seventh largest country in the world.	インドは世界で７番目に大きい国である。
In case you go out before 5, just let me know.	５時前に出かけの時は、ちょっと知らせて下さい。
Many people are better off than they used to be.	暮らし向きが以前よりよくなっている人が多い。
You are not to speak to him while he is studying.	勉強している間は彼に話しかけてはいけない。
She had never spoken to him before that time.	彼女はそれ以前彼に話し掛けた事がまったくなかった。
He can speak not only English but also French.	彼は英語のみならずフランス語も話すことができる。
He came home just now. Didn't you know that?	彼はちょうど今、帰ってきたところだ。知らなかったの？
I think we should get away from here for a few days.	数日間ここを離れるべきだと思います。
I couldn't understand what he was getting at.	私には彼が何をほのめかしているのかわからなかった。
She loved me in the same way that I loved her.	私が彼女を愛したように、彼女も私を愛してくれた。
If you should need any help, just let me know.	もし万一手伝いが必要なら、ぜひお知らせください。
Few people know that Mr. Itsumi is from Kansai.	ほとんどの人は逸見氏が関西出身だとは知らない。
That is the house where I have lived for a long time.	あれが私が長い間住んでいる家です。
Who can speak English better, Yoko or Yumi?	洋子さんと由美さんとではどちらが英語を上手に話せますか。
You are not to speak to him while he is studying.	勉強をしている間は彼に話しかけてはいけない。
She is from Hokkaido, but is now living in Tokyo.	彼女は北海道出身だが、今は東京に住んでいる。
Not only does she speak English, but also German.	彼女は英語はゆうまでもなく、ドイツ語を話す。
He is at work now, but will be coming home at seven.	彼は仕事中ですが、７時には帰宅します。
He can speak some Spanish, much more English.	彼はスペイン語が話せる、ましてや英語はお手のものだ。
He ran away from home three times before he was ten.	彼は１０歳になるまで３回も家出をした。
I ran out of the room without knowing what I was doing.	私は無我夢中で部屋を飛び出した。
For the life of me I can't understand what you say.	私はどうしても君の言う事が理解できない。
At first, I couldn't understand what he said.	最初は私は彼が言っていることを理解できませんでした。
Tom speaks Spanish, and Betty speaks Spanish, too.	トムはスペイン語を話すし、ベティもそうだ。
This is Tom speaking. I'd like to speak to Ann.	こちらはトムです。アンを電話口までお願いします。
He did not so much as speak to me all the evening.	彼はその夜一晩中私に話しかけさえしなかった。
In case you go out before 5, just let me know.	五時前にお出かけのときは、ちょっと知らせてください。
English is spoken in many countries around the world.	英語は世界中の多くの国で話されている。
Now, are you going back to your room or not?	さあ、とっとと自分の部屋に帰るのか帰らんのか、どっちだ？
You know, there are more and more old people.	ご存知の通り、お年寄りがますます多くなってきています。
Do you know if Lucy can speak Japanese?	あなたはルーシーが日本語を話すことができるかどうか知っていますか。
She can't speak English, much less French.	彼女は英語を話せない、ましてやフランス語なんてもってのほかだ。
It always takes time to get used to a new place.	新しい土地に慣れるには、時間がかかるものですよね。
One speaks English, and the other speaks Japanese.	ひとりは英語を話し、もうひとりは日本語を話す。
Nancy and Jane had to go home at five-thirty.	ナンシーとジェーンは５時半に帰宅しなければならなかった。
Australia is about twenty times as large as Japan.	オーストラリアは日本のほぼ２０倍の大きさです。
He is a different person from the one we are looking for.	彼は私達が探している人とは別人だ。
I don't love her, not even if she loves me.	私は彼女を愛してはいない、彼女のほうで愛してくれてもごめんだ。
We know that we are all people of one world.	私たちは、私たち皆が一つの世界の国民であることを知っている。
Speaking of Mary, I have not seen her for a long time.	メアリーと言えば、しばらく会ってないな。
Tom loved Mary, who didn't love him at all.	トムはメアリーを愛していたが、彼女は彼を全く愛していなかった。
You had better go over the house before you take it.	その家を買う前に、よく調べた方がいいですよ。
With time on our hands now, let's do some good.	いまは時間が手中にあるのだから、何かいいことをしよう。
The question is not so much what it is as how it looks.	問題は、その本質よりもむしろ外観である。
They can't have gone out because the light's on.	明かりがついているのだから、彼らが外出したはずがない。
She can speak not only English but also French.	彼女は英語だけでなくフランス語もしゃべることができます。
She always has to be the one giving orders.	彼女はいつだって自分が命令する立場にいないと気がすまないのです。
It will take some time before he understands it.	彼がそのことを理解するにはしばらく時間がかかるだろう。
I work every other day: Monday, Wednesday, and Friday.	私は、月・水・金と一日おきに仕事をします。
I work every other day: Monday, Wednesday and Friday.	月曜、水曜、金曜と私は１日おきに働いている。
I couldn't make out what he meant by 'megafeps'.	メガフェプスってなんのことだか私には理解できなかった。
Jane gave me the same present as Wendy did.	ジェーンは私にウェンディがくれたのと同じプレゼントをくれました。
This experience will do you good in the long run.	この経験は長い目で見れば、あなたのためになりますよ。
In him was life, and that life was the light of man.	このかたに命があった。この命は人の光であった。
The day came at last when he had to part from her.	彼が彼女と別れなければならない日がついにやってきた。
What has become of my old house where I used to live?	私が以前住んでいた古い家はどうなったのだろう。
I've always wanted to go to Australia with my family.	家族とオーストラリアに行きたいと思っています。
For example, he speaks German, French and English.	たとえば、彼はドイツ語、フランス語、英語を話します。
Now there was a man of the Pharisees named Nicodemus.	さて、パリサイ人の中にニコデモという人がいた。
A person named Jones came while you were out.	あなたの留守の間にジョーンズさんとおっしゃる方が来られました。
Oh, by the way, do you know where she lives now?	ああ、ところで彼女が今どこに住んでいるか知ってるかしら。
She can speak French, and is even better at English.	彼女はフランス語を話せる。まして英語はなおさらだ。
They found that their families didn't like each other.	彼らはお互いの家族が憎み合っているとわかった。
I said Paul was out, but that Mary was at home.	私は「ポールは外出中ですが、メアリーは家にいます」と言った。
He speaks Japanese well, but I can't speak German.	彼は上手に日本語を話しますが、私はドイツ語を話せません。
Is he speaking English, French, or German?	彼が話しているのは英語ですか、フランス語ですか、それともドイツ語ですか。
Many old people these days can't keep up with the times.	最近では、多くの老人が時勢についていけない。
One lives in Fukuoka, and the others live in Niigata.	１人は福岡に住んでいて、残りは新潟に住んでいます。
Not only can she speak French, she can also speak English.	彼女は英語だけでなく、フランス語も話せる。
I want to better understand what the meaning of life is.	私は人生の意味とは何かをもっとよく理解したい。
The old man was always looking back on the good old days.	その老人はいつも古き良き時代を回想していた。
Of all these books, this is by far the best on China.	これらの本の中で中国に関してはこれが断然優れている。
And they knew something which the Europeans did not.	そして彼らはヨーロッパ人が知らなかったことを知っていた。
Alan Tate and I looked at one another for a while.	アラン・テイートさんと私はしばらくの間お互いに見つめ合った。
How long does it take you to go home from my house?	私の家からあなたの家に帰るのにどのくらい時間がかかりますか。
I can no more speak French than you can speak English.	君が英語を話せないのと同様に私はフランス語が話せない。
If he says "I love you" all the time he doesn't mean it.	「愛してる」といつも言えば、何の意味もなさなくなる。
The time will come when you will understand what I mean.	私の言おうとすることがお前にもわかるときが来るだろう。
Had you run all the way, you'd have got there in time.	もし君がずっと走っていたら、そこへ間に合って着いただろうに。
I think most people are better off now than they used to be.	たいていの人は以前よりも暮らし向きがよいと思う。
I think most people are better off now than they used to be.	たいていの人が以前よりも暮らし向きがよいと思う。
I couldn't think who she was when she spoke to me.	彼女が私に話し掛けてきたとき彼女が誰であるか想像することができなかった。
She loves him for what he is, not for what he has.	彼女は彼の人柄に惹かれているのであって、彼の財産に惹かれているのではない。
Love is like the measles; we all have to go through it.	恋愛は、はしかのようなものだ。みんな一度はかからなければならない。
The people he is living with in London are coming to see me.	ロンドンで彼が一緒に住んでいる人が近く私に会いに来ます。
French is spoken in parts of Italy as well as in France.	フランス語はフランスだけでなく、イタリアの一部でも話されている。
You shall not use this form while speaking American English.	アメリカ英語を使っているあいだは、このかたちは使わない。
The more people you know, the less time you have to see them.	知人が増えれば増えるほど、それだけ会う時間が少なくなる。
They say this is one of the best books, if not the best.	これは最良の本ではないにしても、そうした本の一冊だということです。
She can speak French and German, not to speak of English.	彼女は英語は言うまでもなく、フランス語やドイツ語も話すことができる。
Of all the houses we've looked at, this one is by far the best.	私たちが見たすべての家の中で、これが群を抜いて一番よい。
The results were as follows: Japan 1st; Spain 2nd; Italy 3rd.	結果は次の通りでした。１位日本、２位スペイン、３位イタリア。
I can't even speak English very well, much less Spanish.	私は英会話もろくにできない、ましてやスペイン語など話せるはずはありません。
There's no room to study here. If only I had a room of my own!	ここには、勉強する空間がない。自分の部屋があるといいのになあ。
If so then I want you to do something for me. That will make us even.	だったら、私のお願いを聞いて欲しいの。それでチャラ。
She has two uncles; one lives in Kyoto and the other in Osaka.	彼女にはおじが二人いる。一人は京都に、もう一人は大阪に住んでいる。
He can speak French, and it goes without saying he can speak English too.	彼はフランス語を話せる。言うまでもなく英語も話せる。
I understand her, but on the other hand I don't think she's right.	私には彼女の気持ちもわかるが、また一面では彼女が正しいとも思わない。
I also gave him a little something as a Christmas present the other day.	私も先日クリスマスプレゼントにちょっとしたものをあげました。
He says "want" when he wants something, and "no" when he does not.	何か欲しいときは、「欲しい」と言い、欲しくないときは「いらない」という。
George has two cousins; one lives in Germany and the other in Switzerland.	ジョージにはいとこが２人います。１人はドイツに、もう１人はスイスに住んでいます。
Don't let what he said get to you. He was just getting back at you for what you said.	彼のせりふは割り引いて聞いてよ。単に売り言葉に買い言葉というだけなんだから。