He is always up and doing.	彼はいつもばたばたと活動している。
Let me go in place of him.	彼のかわりにぼくに行かせて下さい。
He has no house in which to live.	彼には住む家がない。
He'll always come through.	彼ならいつでも力になってくれるよ。
Don't get too close with him.	彼とはあまり親しくするなよ。
Don't love two people at a time.	同時に２人を愛するな。
Come and see us by all means.	是非とも訪ねてきてください。
You can't live without water.	水なしでは、生きて行けない。
Many hands make light work.	人手が多ければ仕事がらくになる。
There were forty people present.	出席者は４０人だった。
I love you as much as him.	私は彼と同じようにあなたを愛する。
I have no small change on me.	私は小銭の持ち合わせがない。
I am good at speaking English.	私は英語を話すのが上手だ。
I have some English books.	私は英語の本を何冊か持っています。
I have few English books.	私は英語の本をほとんど持っていない。
I've lived in Kobe before.	私は以前神戸に住んでいた事がある。
I do not love him any longer.	私はもう彼を愛してはいない。
I was always good at English.	私はいつも英語が得意でした。
Let me give you an example.	私はあなたに一例を示しましょう。
I know where you live.	あなたがどこに住んでいるのか知っています。
We always looked down on him.	私たちはいつも彼を軽蔑した。
Can you speak English at all?	君は本当に英語が話せるのか。
You have a light hand, don't you?	君は手先が器用だね。
English is not spoken here.	英語はここでは話されていません。
Can you speak English at all?	一体君は英語が話せるのかね。
It is time for her to go home.	もう彼女が帰る時間ですよ。
It's still too early to get up.	まだ起きるには早すぎる。
Let's do this first of all.	とりあえずこれをやってしまおう。
How long has he lived there?	どのくらいそこに住んでいるの。
Isn't that an English book?	それは英語の本ではありませんか。
Are you through with the book?	その本は読み終えましたか。
Have you done with the book?	その本はもう読み終えたのかい。
You can't have both books.	その２冊の本の両方ともはだめです。
You have all these books!	こんなにたくさん本を持っているのか。
Could you keep this for me?	これを預かっていただけませんか。
What good books these are.	これらは、なんと良い本なのだろう。
These books are used by him.	これらの本は彼が使っています。
This isn't what I ordered.	これは注文したものと違っています。
This isn't what I ordered.	これは私が注文したものと違います。
This is a book about England.	これは英国についての本です。
I like this house as it is.	この家はこのままにしておきたい。
This house has eleven rooms.	この家には１１部屋があります。
Ken was running at that time.	ケンはその時走っていました。
Could you give me your name?	お名前を教えていただけますか。
No. He doesn't like water!	いいや。あいつは水がキライなんだ。
He doesn't have long to live.	あの人はあまり先が長くない。
You had better go in person.	あなた自身が行った方がいいよ。
You have to get up early.	あなたは早く起きなければなりません。
I didn't get your last name.	あなたに姓が聞き取れなかった。
I have something to give you.	あなたにあげる物があります。
I'd like to live in New York.	私はニューヨークに住みたい。
Take Jennifer for example.	例えば、ジェニファーを見てごらんよ。
They have no house to live in.	彼等には住む家がありません。
She didn't give me her name.	彼女は名前を教えてくれなかった。
She has gone over to the other side.	彼女は転向した。
She can speak Spanish well.	彼女は上手にスペイン語を話せます。
She came around to my house.	彼女は急いで私の家にやって来た。
She studies English every day.	彼女は英語を毎日勉強します。
She goes by the name of Amy.	彼女はエイミーの名で通っている。
She always gets her own way.	彼女はいつも自分勝手にふるまう。
Will she come home at five?	彼女は５時に帰ってくるでしょうか。
She loves Tom, not me.	彼女が愛しているのはトムであって、私でない。
He came running into the room.	彼は走って部屋に入ってきた。
He is used to getting up early.	彼は早起きには馴れている。
He is off work for a few days.	彼は数日間休暇を取っている。
He comes here every five days.	彼は五日に一度ここへ来ます。
He is well known in our country.	彼はわが国では有名です。
He had little social life.	彼はほとんど人付き合いをしなかった。
He would let me help him.	彼はどうしても私に手伝わせようとした。
He saw a light far away.	彼はずっとはなれたところにあかりを見た。
He is always up to no good.	彼はいつもよからぬ事を企んでいる。
He comes here every three days.	彼は３日ごとにここへ来る。
Let me go in place of him.	彼の代わりにぼくに行かせてください。
Don't always take sides with him.	彼の肩ばかり持つなよ。
I don't know where he lives.	彼がどこに住んでいるか知らない。
A man came up and spoke to me.	男が近づいて私に話しかけた。
I'm used to getting up early.	早起きするのに慣れているから。
You should always do your best.	常にベストを尽くしなさい。
I love you more than her.	私は彼女よりあなたのほうを愛している。
I could not speak to him.	私は彼に話しかけることができなかった。
I'm used to getting up early.	私は早起きするのになれている。
I am loved by all my family.	私は家族のみなに愛されています。
I want some of these books.	私はこれらの本のうち何冊か欲しい。
I do not understand you.	私はあなたの言っていることがわからない。
My family are all very well.	私の家族はみんなとても元気です。
My house is a long way from here.	私の家はここから遠い。
Will you make room for me?	私のために場所をかけてくれませんか。
I had a good time last evening.	昨日の晩は楽しかったです。
Mr Sato speaks English well.	佐藤さんは英語をじょうずに話す。
Kyoto is not as large as Osaka.	京都は大阪ほど大きくない。
We looked for it high and low.	我々はあちこちそれを探した。
Thousands of people were there.	何千もの人々がそこにいた。
I should have done something.	何か手を打っておくべきだった。
Is English spoken in Canada?	英語はカナダで話されていますか。
English is spoken in America.	英語はアメリカで話されている。
You'd better go back home now.	もう家に帰ったほうがいいよ。
They speak Spanish in Mexico.	メキシコではスペイン語を話す。
French is spoken in France.	フランス語はフランスで話されます。
How did you find my house?	どうやって私の家を見つけたのですか。
I would like to go home now.	できればもう帰宅したいのですが。
Could you move over a little?	ちょっとつめてもらえませんか。
Have you any further questions?	それ以上質問がありますか。
I've been there a few times.	そこへは何回か行ったことがある。
I'd like to speak to Judy.	ジュディさんとお話ししたいのですが。
This isn't what I ordered.	これは私が注文した物ではありません。
This will do us for the present.	これで今我々に十分です。
This is the house where I live.	これが私の住んでいる家だ。
This book is of great use to us.	この本は我々に役にたつ。
Are you through with this book?	この本はもうお済みですか。
There are no houses around here.	この辺りには人家がない。
Ken must be home by now.	ケンは、今ごろ家に着いているに違いない。
Old people get up very early.	お年寄りはとてもはやく起きる。
Would you like me to order it?	お取り寄せいたしましょうか。
I think Ann loves Jack.	アンはジャックを愛しているのだと私は思う。
They speak English in America.	アメリカでは英語を話します。
Do you know who that person is?	あの人誰だかわかりますか。
You live in Tokyo, don't you?	あなたは東京に住んでいますね。
How many books do you have?	あなたは何冊の本を持っていますか。
You have to speak English.	あなたは英語を話さなければならない。
You should come home before six.	６時前に帰って来なさい。
We'll be home at about 11:00.	１１時ごろには家に着くと思う。
He'll see what the group is like.	彼がグループの様子を探る
He lives every day as best he can.	彼が毎日を精一杯生きる
I don't always get up early.	私はいつも早起きするわけではない。
Yumi speaks English very well.	由美は英語をとても上手に話す。
What time do you get up every day?	毎日何時に起きますか。
There was no one in the room.	部屋の中には誰もいませんでした。
There is more water than is needed.	必要以上の水がある。
By all means, you must come.	必ずあなたは来なくてはいけません。
She is used to getting up early.	彼女は早起きに慣れている。
She has as many books as I.	彼女は私と同じくらい本を持っている。
They worked to help people.	彼らは人々を助けるために働きました。
He made me go against my will.	彼は無理に私を行かせたのです。
He didn't speak to me at all.	彼は全然私にものを言わなかった。
He can't speak English, can he?	彼は英語が話せないんですね。
Where do you think he lives?	彼はどこに住んでいると思いますか。
He speaks English very well.	彼はたいへん上手に英語を話します。
He always takes sides with her.	彼はいつも彼女の味方をする。
He always takes sides with her.	彼はいつも彼女の見方をする。
He doesn't understand you.	彼はあなたのいう事をわかっていません。
Will he come home by seven?	彼は７時までに帰ってくるでしょうか。
He has not a little experience.	彼には少なからぬ経験がある。
Don't speak to him like that.	彼にああいう口の効き方をするな。
China is much larger than Japan.	中国は日本よりずっと広い。
Don't get in people's way.	他人の足を引っ張るようなことはするな。
Do you have any other questions?	他に何か質問がありますか。
I'm never at home on Sundays.	私は日曜日にはいつも家にいない。
I am always at home on Sundays.	私は日曜日にいつも家にいる。
I'm getting better every day.	私は日に日に快方に向かっている。
I can speak English a little.	私は少し英語を話すことができる。
I can't speak French at all.	私はフランス語を少しも話せません。
I must help these people.	私はこれらの人々を助けなければならない。
I did the work against my will.	私はいやいやその仕事をした。
I don't always get up early.	私はいつも早く起きるわけではない。
I will give you this book.	私はあなたにこの本をさしあげましょう。
My family is not very large.	私の家族はそれほど大家族ではない。
Let me help you with your work.	私に仕事を手伝わせて下さい。
We could understand each other.	私たちはお互い理解し合えた。
Now is the time I got to speak out.	今自分を見つめ直し。
I am not the person I used to be.	今の私は昔の私ではない。
You should think before you speak.	考えてから言いなさい。
Do you have any further questions?	更に質問がありますか。
There is no time like the present.	現在にまさる時はない。
You can't speak English, can you?	君は英語が話せませんね？
I ran in order to be on time.	間に合うように走ってきたのです。
We must always do our best.	我々は常に最善を尽くさねばならない。
It's great to have a family.	家族がいるって素晴らしいことです。
Can you help me when I move?	引っ越すとき手伝ってもらえますか。
There was no water in the well.	井戸には少しの水も無かった。
French is spoken by many.	フランス語は多くの人々によって話される。
If only I could speak French.	フランス語が話せさえすればなあ。
Who do you want to speak to?	どなたとお話しになりたいのですか。
How are you going to get home?	どうやって家に帰るつもりなの？
It's about time I was going home.	そろそろ家へ帰る時間だ。
There is no person to do it.	それをしようとする人は誰もいない。
I couldn't speak well that day.	その日はうまく話せなかった。
English is spoken in Singapore.	シンガポールでは英語を話す。
Mr Johnson's was a large room.	ジョンソンさんのは広い部屋だ。
There are ten people in this room.	この部屋に１０人いる。
This house must be done up.	この家は手入れをしなければならない。
Who is the owner of this house?	この家の持ち主はだれですか。
How long have you lived here?	ここにどれくらいお住まいですか。
What did you do with those books?	あの本はどうしましたか。
How many rooms do you have?	あなたはいくつ部屋を持っていますか。
We live in the world with time. 	わたし達が時間の世界に生きる
Look at me with your books closed.	本を閉じて私を見なさい。
Could you make it another time?	別の機会にお願いできませんか。
Could you change my room for me?	部屋を替えていただけますか。
She speaks English very well.	彼女は英語をとても上手に話します。
She has always lived in Otaru.	彼女はずっと小樽で暮らしている。
Her family moved to Brazil.	彼女の一家はブラジルへ移住して行った。
Not all of them are present.	彼ら全員が出席しているわけではない。
They have very little to live on.	彼らは暮らしに余裕がない。
All of them are not present.	彼らは全員出席しているわけではない。
Does he study English every day?	彼は毎日英語を勉強しますか。
He's always at home on Sundays.	彼は日曜日にはいつも家にいる。
He came running into the room.	彼は走りながら部屋へ入ってきた。
He has more books than I do.	彼は私よりもたくさん本を持っている。
He never looks down upon others.	彼は決して他人を軽蔑しない。
He has something to do with it.	彼はそれといくらか関係がある。
He will come home in a few days.	彼は２、３日以内に帰宅する。
He need not get up so early.	彼は、そんなに早く起きる必要はない。
He came out of the room at last.	彼がついに部屋から出てきた。
Japan is not as large as Canada.	日本はカナダほど大きくない。
Few Indians live in Japan.	日本にはほとんどインド人は住んでいない。
I don't know where he lives.	私は彼がどこに住んでいるか知らない。
I'm not used to getting up early.	早起きには慣れてないんだ。
I want to see her by any means.	私は何とかして彼女に会いたい。
I didn't go out last Sunday.	私はこの前の日曜日は出かけなかった。
I want to make my home in America.	私はアメリカに住みたい。
I have at least ten books.	私は、少なくとも１０冊の本を持っている。
I have no less than ten books.	私は、１０冊もの本を持っている。
We want to have a large family.	私たちは子供がたくさんほしい。
You can go home if you like.	帰宅したいなら帰宅してもいいですよ。
Let me show you around our house.	家の中をお見せしましょう。
I'll let you know in a day or so.	一両日中にお知らせします。
I saw him at one time or another.	以前彼に会ったことがある。
I am always helped by you.	わたしはいつでもあなたに助けられている。
We should have set off earlier.	もっと早く出発するべきだった。
You may go home if you want to.	もし帰宅したければ帰ってよい。
Fred's house has five rooms.	フレッドの家には部屋が５つあります。
Tony did not know their names.	トニーは名前を知りませんでした。
Can I bother you for something?	ちょっとお願いがあるんですが。
Would you do something for me?	ちょっとおたのみがあるんですが。
I will say something about it.	それについて言いたいことがある。
Give the book back to the owner.	その本を持ち主に返しなさい。
The man has no house to live in.	その男には住むべき家がない。
The group was made up by Dick.	そのグループはディックが作った。
Would you like me to see you home?	じゃあ、送っていこうか。
Jane may not be at home now.	ジェーンは今家にいないかもしれない。
Do you have any further questions?	さらに質問はありますか。
How long can I keep this book?	この本はどのくらい借りれますか。
It is I who am head of this family.	この家のあるじは私だ。
I want you to keep up with me.	こちらの調子に合わせてください。
The Netherlands is a small country.	オランダは狭い国です。
There is always something to do.	いつでも何かしら仕事がある。
That is the house where he lives.	あれは彼が住んでいる家だ。
English is spoken in America.	アメリカでは、英語が話されている。
Are you the owner of this house?	あなたはこの家の主人ですか。
Can you see that small house?	あなたはあの小さな家が見えますか。
There are many people in Asia.	アジアにはたくさんの民族がいる。
I'd like to get home by five.	５時までには家に帰りたいのですが。
Some people used it in that way.	ある人が、そういう使い方をした
Yoko speaks English, doesn't she?	洋子さんは英語を話しますね。
The book was given to him by me.	本は私から彼に与えられました。
She worked side by side with men.	彼女は男たちに伍して働いた。
She looked better than last time.	彼女は前より元気そうだった。
I can't understand what she says.	彼女の言うことはわからない。
They move from place to place.	彼らはあちこちへと移動してきます。
He is a man of mean understanding.	彼は理解の良くない人です。
He doesn't come here every day.	彼は毎日ここへ来るわけではない。
He speaks Japanese very well.	彼は日本語をたいへん上手に話します。
He has a family to provide for.	彼は家族を養わなければならない。
He can speak English and French.	彼は英語とフランス語が話せる。
He kept on working all the while.	彼はその間ずっと働き続けた。
He's always been living in Tokyo.	彼はずっと東京に住んでいる。
He set up a new home in Jamaica.	彼はジャマイカに新居を構えた。
He is always at home on Mondays.	彼はいつも月曜日には家にいる。
We must keep up with the time.	私達は時間を守らなければならない。
I don't like to be spoken to.	私は話しかけられるのが好きではない。
I ordered some books from London.	私は本をロンドンに注文した。
I live on the outskirts of Tokyo.	私は東京の郊外に住んでいる。
I don't like living in the country.	私は田舎に住むのは嫌だ。
I didn't want to get up early.	私は早くおきたくありませんでした。
I can't help loving my country.	私は自国を愛さずにはいられない。
I mean to be there this evening.	私は今晩そこへ行くつもりです。
I saw her for the last time.	私はそれを最後に彼女と会わなくなった。
I know that you live here.	あなたがここに住んでいるのを知っています。
I have no more than ten books.	私は、１０冊しか本を持っていない。
There are four people in my family.	私の家族は４人家族です。
I have no family to provide for.	私に養うべき家族がありません。
Do you have a room of your own?	君は自分の部屋を持っていますか。
You should have come earlier.	君はもっとはやくくるべきだったのに。
Is Spanish spoken in Mexico?	メキシコではスペイン語が話されますか。
Mary is studying in her room.	メアリーは自分の部屋で勉強している。
Mayuko always wants the best.	マユコはいつも最上のものを欲しがる。
I don't speak French very much.	フランス語ではあまり話しません。
How do you like living on your own?	ひとり暮しはどうですか。
By the way, where do you live?	ところで、君はどこに住んでいるの。
By the way, where do you live?	ところで、お住まいはどちらですか。
There are many books, aren't there?	たくさん本がありますね。
There were not many present.	その場に居合わせた人は多くはなかった。
The family love one another.	その家族の者はお互いに愛し合っている。
This room is too small for us.	この部屋は私たちにとって狭すぎる。
How long have you lived here?	ここに住んでどのくらいになりますか。
Ken has more books than you.	ケンは君よりたくさんの本を持っている。
How is it going with your family?	お宅の皆さんはいかがですか。
I always wanted to see you.	いつもあなたに会いたいと思っていました。
America is a country on the move.	アメリカは動いてる国である。
Two families live in that house.	あの家には２家族が住んでいる。
You don't have to get up early.	あなたは朝早く起きる必要がない。
You must think of your family.	あなたは家族の事を考えるべきです。
Are you for or against this?	あなたはこれに賛成ですか、反対ですか。
When is your book coming out?	あなたの本はいつ発売されるのですか。
At four we could go home.	４時になれば家に帰ることができるからでした。
She said 'I love you' to me.	彼女は僕に「あなたが好きだ」と言った。
I don't understand German at all.	ドイツ語は全くわかりません。
The man said something to the person.	男がその人に声をかけた
He didn't see that many people.	彼があまり多くの人には会わなかった
But I understand what he says.	でも、私は彼の言うことが分かります。
For example, do you like English?	例えば、君は英語が好きですか。
I'll keep Thursday open for you.	木曜日、君のためにあけとくから。
The light doesn't come on in my room.	部屋の電気がつかない。
She means more than my life to me.	彼女は私の命より大事である。
She is good at speaking English.	彼女は英語を話すのが得意である。
She doesn't live there any more.	彼女はもうそこに住んでいません。
She can speak English very well.	彼女はとても上手に英語を話せる。
Do you know where she lives?	彼女がどこに住んでいるか知っていますか。
They moved in just the other day.	彼らはつい先日引っ越してきた。
They give presents to one another.	彼らはお互いに贈り物をする。
They had no house in which to live.	彼らには住む家がなかった。
He does not come here every day.	彼は毎日ここへくるとは限らない。
He was made to go out of the room.	彼は部屋から出て行かされた。
He said it was out of the question.	彼は全く不可能だと言った。
He's looking for a place to live.	彼は住むところを探しています。
He is the last man I want to see.	彼は私の一番会いたくない人だ。
He is the last man I want to see.	彼は私が一番会いたくない人だ。
He speaks both English and French.	彼は英語もフランス語も話す。
He does not live there any more.	彼はもうそこには住んでいません。
He has done better than last time.	彼はこの前よりもよくやった。
He lives in that house over there.	彼はあそこの家に住んでいる。
You shouldn't go out for a few days.	数日は外出しないように。
People must love one another.	人々は互いに愛し合わなければならない。
You should live within your means.	収入の範囲内で暮らすべきだ。
I don't like the way she speaks.	私は彼女の話し方は好きではない。
I don't like the way he speaks.	私は彼のしゃべり方が気に入らない。
I ordered the book from Britain.	私はその本をイギリスに注文した。
I have no family to provide for.	私には養うべき家族がありません。
We should help people in need.	私たちは困っている人を助けるべきだ。
How is it going with your family?	御家族はいかがお過ごしですか。
We need no more men at present.	現在はこれ以上の人手はいりません。
Do you have a room of your own?	君は自分用の部屋を持っていますか。
