The same may be said of other people.	同じことが他の人々についても言えるだろう。
You may go as long as you come home early.	早く帰ってくるなら行ってもいい。
I couldn't think of the name of the place.	私はその地名を思い出せなかった。
He loves you as much as I do.	私はあなたを愛しているが彼も同じくらいあなたを愛している。
I saw him go out of the room just now.	私は、彼がたった今部屋から出るのを見た。
My room is three times as large as yours.	私の部屋は君の部屋の３倍の広さだ。
We must have something to live for.	私たちは何か生きていく目標をもたねばならない。
It was in London that I last saw her.	私がこの前彼女に会ったのはロンドンだった。
Keep up the good work, Mr. Sakamoto.	坂本さんこれからもいい仕事を続けてください。
I love you more than you love me.	君が私を愛しているよりもおおく私は君を愛している。
But I can't understand them very well.	でも私はあまりよくそれらを理解できない。
The man's name was Francisco Pizzaro.	その男の名前はフランシスコ・ピサロだった。
There lived an old man in the old house.	その古い家に一人の老人が住んでいた。
There were few, if any, cases.	そのようなケースは、たとえあるにせよ、まれなことだった。
This is the room where the body was found.	これが死体の発見された部屋です。
You must have known what she meant.	あなたは彼女の気持ちがわかっていたに違いない。
How long have you lived in Sasayama?	あなたはどれくらい篠山に住んでいるのですか。
Few people live to be more than a hundred.	百歳以上生きる人はほとんどいない。
Who that knows her doesn't love her?	彼女を知っている誰が、彼女を愛さないだろうか。
She has come to know something like love.	彼女はほのかな恋心を知るようになる。
She thought that John had loved her.	彼女はジョンが以前に愛してくれていたと思った。
He came to see me in a different light.	彼は私を違った観点から見るようになった。
He may have gone home by another way.	彼はちがう道を通って家に帰ったかもしれない。
What do you think he meant by that?	彼はそれをどんなつもりで言ったのだと思いますか。
He will provide you with what you need.	彼はあなたが必要なものをくれるでしょう。
It being Sunday, I didn't get up early.	日曜日だったので、私は早く起きなかった。
Only a few people showed up on time.	時間どおりに現れたのは２、３人しかいなかった。
I don't like the house in which he lives.	私は彼が住んでいる家は好きではない。
I can see some Japanese people here.	私はここで何人かの日本人に会うことができます。
We must keep up with the times.	私たちは時勢に遅れないようについていかなければならない。
It's a house just like that I have seen.	私が見たのはそれにそっくりの家だった。
He loves you as much as I do.	私があなたの事を愛しているのと同じ位彼もあなたを愛している。
How did you come to know one another?	君達はどうやってお互いを知り合ったのですか。
You can't have understood what he said.	君に彼の言ったことがわかったはずがない。
It is good to keep studying all your life.	一生懸命し続けることはいいことだ。
There were two hundred people in the room.	その部屋には２００人の人々がいた。
There were no Japanese in this country.	この国には日本人は一人もいませんでした。
California is about as large as Japan.	カリフォルニアは日本と同じくらいの広さだ。
I'm Japanese, but I don't live in Japan.	私は日本人ですが、日本に住んでいません。
For example, it is 7:00 a.m. in London now.	例えば、ロンドンは今は朝７時です。
We are not always at home on Sundays.	僕たちは日曜日にいつも家にいるとは限りません。
She has gone, but I still love her.	彼女は行ってしまったが、私はまだ彼女を愛している。
She always keeps her room in good order.	彼女はいつも部屋をきれいに整頓している。
He shall not come into this house again.	彼をこの家へ２度と入れさせないつもりだ。
He was open to a different way of thinking.	彼は異なった考え方を拒まなかった。
Japan will get it from many countries.	日本は多くの国からしっぺ返しをくらうだろう。
The more people have, the more they want.	人は持てば持つほどますます欲しくなる。
I am going to my room, where I can study.	私は勉強できるように自分の部屋に行く。
I don't understand what you are saying.	私はあなたのおっしゃることが分かりません。
We are thinking of moving back home.	私たちは生まれ故郷に引っ越そうかと考えています。
It will not be long before we know the result.	結果はまもなく分かるだろう。
You need not have come here so early.	君はそんなに早くここに来る必要はなかったのに。
You should not think little of this result.	君はこの結果を軽視すべきじゃない。
How long have you been living in Kobe, then?	君はいつから神戸に住んでいるの。
What makes you think that I'm against that?	どうして私が反対だと思うのですか。
The old man was not as mean as he looked.	その老人は見かけほど意地悪くなかった。
The people which were here have all gone.	ここにいた人々はみんな行ってしまった。
I was getting used to living in America.	アメリカの生活にだんだん慣れてきました。
Tom didn't know what Mary's last name was.	トムはメアリーの苗字を知らなかった。
The question is who will go there for him.	問題は誰が彼のかわりにそこへ行くかだ。
Dr. Makino is looked up to by many people.	牧野博士は多くの人々に尊敬されている。
He is longing to see my family in Tokyo.	彼は東京にいる私の家族に会いたがっている。
I was moved by her love for other people.	私は彼女の他の人々に対する愛に感動した。
I did say that, but I didn't mean it.	私は確かにそう言ったが、そのつもりではなかった。
As far as I know, she is a very good person.	私が知るかぎり彼女は大変よい人だ。
One question was what I was going to be.	疑問の一つは、私がどんな人になるかでした。
What will you live on while you are there?	そこにいる間、生活の糧はどうするのだ。
This will be the house we are looking for.	これが私たちがさがしている家でしょう。
How far is it from here to your house?	ここから君の家までどのくらい距離がありますか。
Go and see if Mr Wilson is at home.	ウィルソンさんが家に居るかどうか、行って見ておいで。
That country is five times as large as Japan.	あの国は日本の５倍の大きさです。
How long do you study English every day?	あなたは毎日どのくらい英語を勉強しますか。
You and I must give him our present.	あなたと私は彼にプレゼントをあげなければならない。
When I was fifteen, I got a room of my own.	１５歳の時、私は自分の部屋を持った。
When she was thirteen, she ran away from home.	１３歳のときに彼女は家出した。
He must be at home as the light in on.	明かりがついているから彼は家にいるにちがいない。
He loves her, but she doesn't like him.	彼は彼女を愛しているが、彼女は彼が好きでない。
When he said "water," she gave him water.	彼が「水」と言えば、彼女は彼に水を与えた。
Life doesn't always go the way we want it to.	人生は思うようにはいかないものだ。
People are living in all parts of the world.	人間は世界のあらゆる所に住んでいる。
No less than one hundred people were present.	少なくとも１００人は出席していた。
There were at least a hundred people present.	少なくとも１００人の人が出席した。
I wanted to live in Hokkaido, but I couldn't.	私は北海道で暮らしたかったのだが。
I come home from work about seven every day.	私はたいてい７時ころうちに帰ります。
The living room in my new house is very large.	私の新しい家の居間はとても広い。
Not even a day can we live without water.	一日たりとも我々は水なしにはいきられない。
I want to know about your country so much.	とてもあなたの国について知りたいのです。
This is too small a house for us to live in.	これは私達が住むにはせますぎる家だ。
I don't like this one; show me another.	これは気に入らないから別なのを見せてください。
This is a small house, but it will do for us.	この家は小さいが我々には十分です。
This is the house in which she used to live.	ここは彼女がかつて住んでいた家です。
How did you make a living in Tokyo?	あなたは東京でどのようにして生計を立てていたのですか。
I want you to live more like a human being.	あなたのもっと人間らしく生きてほしい。
Not a few people live to be over eighty.	８０歳以上に長生きする人は少なくありません。
"Where do you live?" "I live in Tokyo."	「あなたはどこに住んでるのですか」「東京です」
I've come this far, so I'll keep going.	乗りかかった船ということでやっていく所存です。
The same can be said of many other persons.	同じ事がほかの多くの人についても言える。
Ikeda is my last name, and Kazuko is my first name.	池田が姓で和子が名です。
If it were not for water, we couldn't live.	水が無ければ私たちは生きられないだろう。
I want to know more about your country.	私はあなたの国についてもっと知りたいと思います。
We love her, and she loves us, too.	私たちは彼女が好きですが、彼女のほうも私たちが好きです。
We can not do without water even for a day.	私たちは水無しでは一日もやっていけない。
English is used in every part of the world.	英語は世界中いたるところで使われている。
I still haven't found what I'm looking for.	まだ捜している何かをみつけていないから。
A person named Jones has come to see you.	ジョーンズさんという方がお見えになりました。
Don't let me down as you did the other day.	この前みたいに私をがっかりさせないでね。
There are so many people here in Tokyo.	ここ東京にはずいぶんたくさんの人がいるんですね。
There must be a better person for both of us.	お互いもっと適した相手がいるはずだ。
You are the very person I have been looking for.	あなたこそ私が探していた人だ。
Billy will come to Japan in the early evening.	ビリーさんが夕方頃に日本にやってくる
She is American, but she lives in England.	彼女はアメリカ人だが、イギリスに住んでいる。
Some people like him and other people don't.	彼を好きな人もいればそうでない人もいる。
He doesn't want me to go, but I mean to.	彼は私が行くことを望まないが、私は行くつもりだ。
He is at home, but no one can see him.	彼は在宅していますが、どなたにもお目にかかりません。
When I understood him I thought better of him.	彼という人間がわかって彼を見直した。
It will do you good to live in the country.	田舎に住むのはあなたにとってよいでしょう。
It was a long time before she understood me.	長いこと彼女は私を理解してくれなかった。
In the first place we must find a way out of this.	打開策を見つけるのが先決だ。
I can't understand what he is thinking about.	私は彼が考えていることが理解できない。
Our world is getting smaller and smaller.	私たちの世界は、だんだん小さくなってきている。
The Rhine runs between France and Germany.	ライン川はフランスとドイツの間を流れている。
Something must be done about it in no time.	そのことですぐに何か手を打たねばなるまい。
How far is it from here to your house?	ここからあなたの家までどれくらいの距離がありますか。
Many a person has had the same experience.	同じような経験をした人は行く人も行く人もいる。
Mr. Obama wants to move to Tokyo from Osaka.	オバマさんが大阪から東京に転入したいです。
There are about 6 billion people in the world.	世界には約６０億の人々が暮らしている。
Living without water is out of the question.	水なしで生きることはまったく不可能である。
We must make the best of the small room.	私達はその狭い部屋を最大限利用しなければならない。
I'll never see him again as long as I live.	私は生きている間は決して再び彼とは会わない。
As long as we love each other, we'll be all right.	愛さえあれば僕らは大丈夫だよ。
And then, it took them far from home.	そしてそれらを家から遠く離れたところへ連れていきました。
I don't like this one; show me another.	これは気に入らない、もう一つほかのを見せてください。
There were as many as five hundred people present.	５００人もの出席者がいました。
"Where is your house?" "It is over there."	「あなたの家はどこですか」「それは向こうです」
I didn't understand in the least what he said.	彼の言ったことが少しも理解できなかった。
We had to make the best of our small house.	私たちは小さな家で我慢しなければならなかった。
If I were you, I wouldn't live with him.	私があなただったら、あの人といっしょに暮らしません。
If it were not for water, we could not live.	もし水がなければ、我々は生きられないだろう。
Don't you have another one that's a little larger?	もう少し大きいのはありませんか。
From that time on, they came to love each other.	それ以来彼らは愛し合うようになった。
The house is too small for five people to live in.	その家は５人が住むには狭すぎる。
She wants to move out and find a place of her own.	彼女を家を出て独立したがっている。
Their living room is as large again as my house.	彼らの居間は我が家の２倍の広さがある。
I love him for what he is, not what he has.	彼の財産でなく、彼の人柄のために私は彼が好きだ。
If he had known, he might have come earlier.	知っていたら、彼はもっと早く来たかもしれない。
I am from Hiroshima, but now I live in Tokyo.	広島の出身ですが、今住んでいるのは東京です。
If it were not for water, we could not live.	もし水がなければ、私達は生きていけないだろう。
It was the best experience in all my life.	それは私のこれまでの生涯の中で、最高の経験だった。
The people in the room all know one another.	その部屋の人々は、みんな互いに知り合いだった。
Such being the case, I could not be present.	そういうわけだから私は出席できなかったのです。
The last time I saw Kent, he was very well.	この前ケントに会ったとき、彼はとても元気でした。
Do you have something to do with this group?	あなたはこのグループと何か関係があるんですか。
As many as ten people live in this small house.	１０人もの人がこの小さな家に住んでいる。
He's always looking at you. He must love you.	彼はいつも君を見ている。きっと君が好きなんだ。
I can't understand what he wants me to do.	私は彼が私に何をするよう望んでいるのか理解できない。
I have to make the best of that small room.	私はその狭い部屋をせいぜい活用しなければならない。
The time will come when you will understand this.	君がこのことを理解する時がくるだろう。
There were many people who helped me get there.	そこに至るまでには多くの方々の協力を得ました
You shouldn't let people use you like that.	自分をそんなふうに人々に利用させておくべきではない。
You should set a high value on every man's life.	すべての人の生涯を高く評価するべきである。
How long does it take from here to your house?	ここからあなたの家までどれくらいかかりますか。
India is the seventh largest country in the world.	インドは世界で７番目に大きい国である。
In case you go out before 5, just let me know.	５時前に出かけの時は、ちょっと知らせて下さい。
Many people are better off than they used to be.	暮らし向きが以前よりよくなっている人が多い。
He came home just now. Didn't you know that?	彼はちょうど今、帰ってきたところだ。知らなかったの？
I think we should get away from here for a few days.	数日間ここを離れるべきだと思います。
I couldn't understand what he was getting at.	私には彼が何をほのめかしているのかわからなかった。
She loved me in the same way that I loved her.	私が彼女を愛したように、彼女も私を愛してくれた。
If you should need any help, just let me know.	もし万一手伝いが必要なら、ぜひお知らせください。
Few people know that Mr. Itsumi is from Kansai.	ほとんどの人は逸見氏が関西出身だとは知らない。
That is the house where I have lived for a long time.	あれが私が長い間住んでいる家です。
She is from Hokkaido, but is now living in Tokyo.	彼女は北海道出身だが、今は東京に住んでいる。
He is at work now, but will be coming home at seven.	彼は仕事中ですが、７時には帰宅します。
He ran away from home three times before he was ten.	彼は１０歳になるまで３回も家出をした。
I ran out of the room without knowing what I was doing.	私は無我夢中で部屋を飛び出した。
For the life of me I can't understand what you say.	私はどうしても君の言う事が理解できない。
At first, I couldn't understand what he said.	最初は私は彼が言っていることを理解できませんでした。
In case you go out before 5, just let me know.	五時前にお出かけのときは、ちょっと知らせてください。
Now, are you going back to your room or not?	さあ、とっとと自分の部屋に帰るのか帰らんのか、どっちだ？
You know, there are more and more old people.	ご存知の通り、お年寄りがますます多くなってきています。
It always takes time to get used to a new place.	新しい土地に慣れるには、時間がかかるものですよね。
Nancy and Jane had to go home at five-thirty.	ナンシーとジェーンは５時半に帰宅しなければならなかった。
Australia is about twenty times as large as Japan.	オーストラリアは日本のほぼ２０倍の大きさです。
He is a different person from the one we are looking for.	彼は私達が探している人とは別人だ。
I don't love her, not even if she loves me.	私は彼女を愛してはいない、彼女のほうで愛してくれてもごめんだ。
We know that we are all people of one world.	私たちは、私たち皆が一つの世界の国民であることを知っている。
Tom loved Mary, who didn't love him at all.	トムはメアリーを愛していたが、彼女は彼を全く愛していなかった。
You had better go over the house before you take it.	その家を買う前に、よく調べた方がいいですよ。
It'll be opening time, time I get down there.	そこにたどりついたときはもう開始の時刻になっているだろう。
With time on our hands now, let's do some good.	いまは時間が手中にあるのだから、何かいいことをしよう。
The question is not so much what it is as how it looks.	問題は、その本質よりもむしろ外観である。
They can't have gone out because the light's on.	明かりがついているのだから、彼らが外出したはずがない。
She always has to be the one giving orders.	彼女はいつだって自分が命令する立場にいないと気がすまないのです。
It will take some time before he understands it.	彼がそのことを理解するにはしばらく時間がかかるだろう。
I work every other day: Monday, Wednesday, and Friday.	私は、月・水・金と一日おきに仕事をします。
I work every other day: Monday, Wednesday and Friday.	月曜、水曜、金曜と私は１日おきに働いている。
I couldn't make out what he meant by 'megafeps'.	メガフェプスってなんのことだか私には理解できなかった。
Jane gave me the same present as Wendy did.	ジェーンは私にウェンディがくれたのと同じプレゼントをくれました。
This experience will do you good in the long run.	この経験は長い目で見れば、あなたのためになりますよ。
In him was life, and that life was the light of man.	このかたに命があった。この命は人の光であった。
The day came at last when he had to part from her.	彼が彼女と別れなければならない日がついにやってきた。
What has become of my old house where I used to live?	私が以前住んでいた古い家はどうなったのだろう。
I've always wanted to go to Australia with my family.	家族とオーストラリアに行きたいと思っています。
Now there was a man of the Pharisees named Nicodemus.	さて、パリサイ人の中にニコデモという人がいた。
A person named Jones came while you were out.	あなたの留守の間にジョーンズさんとおっしゃる方が来られました。
They found that their families didn't like each other.	彼らはお互いの家族が憎み合っているとわかった。
I said Paul was out, but that Mary was at home.	私は「ポールは外出中ですが、メアリーは家にいます」と言った。
Many old people these days can't keep up with the times.	最近では、多くの老人が時勢についていけない。
One lives in Fukuoka, and the others live in Niigata.	１人は福岡に住んでいて、残りは新潟に住んでいます。
I want to better understand what the meaning of life is.	私は人生の意味とは何かをもっとよく理解したい。
The old man was always looking back on the good old days.	その老人はいつも古き良き時代を回想していた。
And they knew something which the Europeans did not.	そして彼らはヨーロッパ人が知らなかったことを知っていた。
Alan Tate and I looked at one another for a while.	アラン・テイートさんと私はしばらくの間お互いに見つめ合った。
How long does it take you to go home from my house?	私の家からあなたの家に帰るのにどのくらい時間がかかりますか。
If he says "I love you" all the time he doesn't mean it.	「愛してる」といつも言えば、何の意味もなさなくなる。
The time will come when you will understand what I mean.	私の言おうとすることがお前にもわかるときが来るだろう。
Had you run all the way, you'd have got there in time.	もし君がずっと走っていたら、そこへ間に合って着いただろうに。
I think most people are better off now than they used to be.	たいていの人は以前よりも暮らし向きがよいと思う。
I think most people are better off now than they used to be.	たいていの人が以前よりも暮らし向きがよいと思う。
She loves him for what he is, not for what he has.	彼女は彼の人柄に惹かれているのであって、彼の財産に惹かれているのではない。
Love is like the measles; we all have to go through it.	恋愛は、はしかのようなものだ。みんな一度はかからなければならない。
The people he is living with in London are coming to see me.	ロンドンで彼が一緒に住んでいる人が近く私に会いに来ます。
The more people you know, the less time you have to see them.	知人が増えれば増えるほど、それだけ会う時間が少なくなる。
Of all the houses we've looked at, this one is by far the best.	私たちが見たすべての家の中で、これが群を抜いて一番よい。
The results were as follows: Japan 1st; Spain 2nd; Italy 3rd.	結果は次の通りでした。１位日本、２位スペイン、３位イタリア。
There's no room to study here. If only I had a room of my own!	ここには、勉強する空間がない。自分の部屋があるといいのになあ。
If so then I want you to do something for me. That will make us even.	だったら、私のお願いを聞いて欲しいの。それでチャラ。
She has two uncles; one lives in Kyoto and the other in Osaka.	彼女にはおじが二人いる。一人は京都に、もう一人は大阪に住んでいる。
I understand her, but on the other hand I don't think she's right.	私には彼女の気持ちもわかるが、また一面では彼女が正しいとも思わない。
