You should have come home before.	君はもっと早く帰るべきだった。
I made the best of my small room.	狭い部屋をせいぜい広く使った。
What's my book doing here?	何だって私の本がこんなところにあるんだろう。
Before long he came into the room.	やがて彼が部屋に入ってきた。
Do you have one a little smaller?	もう少し小さいのはありますか。
Spanish is spoken in Mexico.	メキシコではスペイン語が話されています。
By the way, where does he live?	ところで彼は何処に住んでいますか。
I don't understand German at all.	ドイツ語がさっぱり分からない。
Let's see if I've got that right.	では、確認させていただきます。
What do you think about the book?	その本についてどう思いますか。
Not all books are good books.	すべての本が良い本というわけではない。
John can't speak French well.	ジョンはフランス語が上手に話せません。
May I present Mr Johnson to you?	ジョンソン氏をご紹介いたします。
Mr Johnson's was a large room.	ジョンソン氏の部屋は広い部屋だった。
Jack may speak Spanish, too.	ジャックはスペイン語も話すかもしれない。
You can't take away these books.	この本は持ち出してはいけません。
This book is older than that one.	この本の方があの本よりも古い。
Do they speak French in Canada?	カナダではフランス語を話しますか。
What in the world does he mean?	いったい彼はどういうつもりなのだ。
You may as well go home now.	あなたは、今のうちに家に帰ることですね。
He will be back in a few days.	２、３日すれば彼は帰ってくるだろう。
One should always do one's best.	人はいつも全力を尽くすべきです。
The question is who will do it.	問題は誰がそれをするかという事です。
He knows most who speaks least.	物言えば唇寒し・馬鹿ほど言いたがる。
You should set your room in order.	部屋の整理をしたほうがいいよ。
She looked about in her room.	彼女は自分の部屋の中をぐるりと見回した。
She doesn't like the way I speak.	彼女は私の話し方が気に入らない。
I do not think that she is at home.	彼女は家にいると思いません。
She knew that John loved her.	彼女はジョンが愛しているのを知っていた。
I will go provided that she comes.	彼女が来るのなら私も行きます。
You'd better not make light of him.	彼を軽く見ないほうがいいよ。
He was always on the people's side.	彼は常に民衆の味方であった。
He speaks English better than I do.	彼は私より上手に英語を話す。
I'm not always home on Sundays.	日曜日はいつも家にいるとは限らない。
We are against working on Sundays.	我々は日曜日に働くのは反対だ。
Which is larger, Tokyo or Kobe?	東京と神戸ではどちらが大きいですか。
Do you like to live in the country?	田舎に住むことは好きですか。
Do you have small change with you?	小銭の持ち合わせはありますか。
I have lived here for a long time.	私は長い間ここに住んでいます。
I have loved her for a long time.	私は長いあいだ彼女を愛してきた。
I can't understand this at all.	私はこのことを少しも理解できません。
I want you to come back early.	私はあなたに早く帰って来てもらいたい。
I will be at your house at eight.	私は８時にきみの家にいるだろう。
I was in New York for a few days.	私は２、３日ニューヨークにいた。
I'll help you as long as I live.	私が生きている間は援助しましょう。
You can't speak French, can you?	君はフランス語が話せないのですね？
We came upon them in New York.	我々はニューヨークで彼らに出くわした。
There were hundreds of people there.	何百人もの人がそこにいた。
How many people are there in your family?	何人家族ですか。
How many people are in this room?	何人の人々がこの部屋にいますか。
What time does it open and close?	何時に開いて何時に閉まりますか。
English is spoken around the world.	英語は世界中で話されている。
Could you help me when I move?	引っ越しのとき手伝っていただけますか。
Romeo is the man Juliet loves.	ロメオはジュリエットが愛している男だ。
You are doing very well. Keep it up.	よくやっているよ。続けて。
In time, Tom came to love her.	やがてトムは彼女を愛するようになった。
There is no more room for a TV set.	もうテレビを置く場所がない。
You've run through all the butter?	バターを全部使ってしまったの？
This is the very book you wanted.	ちょうど君が欲しがっていた本だ。
You should've said so earlier.	それならそうと言ってくれればいいのに。
Few people know how to do it.	その仕事を知っている人はほとんどいない。
Not a few people had that thought.	その考えをする人は少なくない。
Mr Jones said something then.	そのときジョーンズさんが何かいいだした。
Jim, don't run about in the room.	ジム、部屋の中を走り回らないで。
This is the house in which he lives.	これは彼が住んでいる家だ。
This is the house that he lives in.	これが彼が住んでいる家です。
This book is smaller than that one.	この本はあの本よりも小さい。
How long can I keep this book?	この本どのくらいお借りしていいですか。
There are few houses around here.	このあたりは人家がほとんどない。
You have to speak English here.	ここでは英語を話さなければならない。
How long has Ken lived in Kobe?	ケンはどれくらい神戸に住んでいるの。
At one time they lived in Nagoya.	かつて彼らは名古屋にすんでいた。
When can you let me know the result?	いつ頃連絡をもらえますか。
They move from place to place.	あれらはあちこちへと移動していきます。
What time do you get up every day?	あなたは毎日何時に起きますか。
Do you study English every day?	あなたは毎日英語を勉強していますか。
Do you have a room of your own?	あなたは自分の部屋をもっていますか。
Do you know where I live?	あなたは私がどこに住んでいるのか知っていますか。
Let me help you to do the work.	あなたの仕事の手助けをさせて下さい。
Her name is known all over the world.	彼女は世界的に有名です。
I love her and she loves me.	僕は彼女を愛してるし、彼女も僕を愛してます。
She has as many books again as he.	彼女は彼の二倍も本を持っている。
She speaks English as well as I.	彼女は私と同じくらいよく英語を話す。
She speaks both English and French.	彼女は英語もフランス語も話す。
They are living it up in Honolulu.	彼らはホノルルで楽しんでいるよ。
He knew little about the people.	彼は人々についてあまり知らなかった。
He speaks English better than I do.	彼は私よりも英語を上手に話す。
He works for the good of the country.	彼は国のために働いている。
He ran away lest he should be seen.	彼は見みられないように逃げた。
He is still on the right side of forty.	彼はまだ４０歳以下だ。
He goes by the name of Kenchan.	彼はケンチャンという名前で通っている。
He uses the same books as you use.	彼はあなたと同じ本を使っている。
Will you let me know when he comes?	彼が来たら教えてくれませんか。
The days are getting longer every day.	日が長くなってきました。
But he knew it couldn't last.	長続きしないってこともちゃんと分かってた。
Get up early, and you'll be in time.	早起きすれば間に合いますよ。
You ran into him earlier, didn't you?	前、偶然彼に会いましたね？
But for water, no man could live.	水がなければ、人間は生きられない。
I am never at home on Sundays.	私は日曜日に家にいることはありませんよ。
I have a large family to provide for.	私は大家族を養っています。
I'm not used to getting up early.	私は早起きすることになれていない。
I want to know about your country.	私はあなたの国について知りたい。
I'll help you as long as I live.	私の生きている限り、君を援助しよう。
My country is far away from Japan.	私の国は日本から遠く離れている。
As for me, I have no question.	私に関して言えば、何の質問もありません。
Let me have a look at it, will you?	私にちょっとみせてくださいよ。
We found out where he lives.	私達は、彼がどこに住んでいるのかが分かった。
You can't keep a good man down.	才能ある者を抑えておくことはできない。
What time will you be home this evening?	今日は何時に帰るの？
Where did you go last Sunday?	君はこの前の日曜日にはどこへ行きましたか。
Not all of us can speak English.	我々全員が英語を話せるわけではない。
There was little water in the well.	井戸にはほとんど水がなかった。
Do not bother to come to my home.	わざわざ家に来なくてもいいですよ。
Can you think of something better?	もっといいこと思いつきませんか。
You need not have come so early.	そんなに早く来る必要はなかったのに。
You did not need to come so early.	そんなに早く来る必要はなかった。
That is not what I meant to say.	それは私が言おうとしたことではない。
I don't understand much about it.	それについて私は詳しく知りません。
I'm just living from day to day.	その日その日を生き抜くのがやっとだ。
The experience will do you good.	その経験はあなたのためになるだろう。
Few people know how to do it.	そのやり方を知っている人はほとんど少ない。
There are no means of getting there.	そこにたどりつく方法はない。
We would love to work with you.	ぜひ取引させていただきたいと思います。
But we can't understand him.	しかし、私たちは彼の言うことが理解できない。
This is the same book as I have.	これは私が持っているのと同じ本です。
This is the house in which he lived.	これが彼の住んでいた家です。
Have you a room to let in this house?	この家に貸間はありますか。
These persons run this country.	こういう人たちが我が国を動かしている。
English is spoken in Australia.	オーストラリアでは英語が話されている。
What do they live on in Egypt?	エジプトでは何を食べて生活していますか。
Let me see. There were fifteen people.	ええっと、１５人でした。
Do you know where he lives?	あなたは彼がどこに住んでいるか知っていますか。
I have to be back home by seven.	７時までに家に帰らなくてはならない。
She wouldn't let him in.	彼女はどうしても彼を部屋の中に入れようとしなかった。
She ordered the book from England.	彼女はその本をイギリスに注文した。
She ordered the book from London.	彼女は、その本をロンドンに注文した。
It's you that she loves, not me.	彼女が愛しているのは僕じゃない、君だ。
He keeps a toyshop in a small way.	彼は細々とおもちゃやをやっている。
He could not speak French well.	彼はフランス語をうまく話せませんでした。
He is well spoken of by those people.	彼はその人たちに評判が良い。
He is always willing to help others.	彼はいつも喜んで他人を手伝う。
He will come back in a few days.	彼は２、３日したら帰ってくるでしょう。
I don't like the house in which he lives.	彼のいる家は嫌いだ。
He has a large family to provide for.	彼には養うべき大家族がある。
He has a good case against her.	彼には彼女に反論する立派な言い分がある。
He and I can not speak Spanish.	彼と私はスペイン語を話すことができない。
Have you got used to living in Tokyo?	東京での生活に慣れましたか。
We shouldn't look down on other people.	他人を軽蔑すべきでない。
You must always do what is right.	常に正しいことをしなければならない。
I don't know every one of you.	私は諸君のすべてを知っているわけではない。
I am studying English in my room.	私は自分の部屋で英語を勉強している。
I was given this present by Ann.	私はこのプレゼントをアンからもらった。
I ordered the book from England.	私はイングランドからその本を注文した。
I always have to give in to him.	私はいつも彼に服従しなければならない。
She was never to see her home again.	再び故郷に帰れない運命だった。
You must study English every day.	英語は毎日勉強しなければなりません。
Don't bother to come to my house.	わざわざおいでにならなくて結構です。
Few people know each other well.	ほとんどの人々がお互いをよく知らない。
How did you come to love her?	どんなふうにして彼女を好きになったのですか。
How long does Tony run every day?	トニー君は毎日どれぐらい走りますか。
Does that mean you won't come?	それでは、あなたは来ないということですか。
This book is as small as that one.	この本はあの本と同じくらい小さい。
Ken has no more than ten books.	ケンはわずか１０冊しか本を持っていない。
I will come to your country some day.	いつかあなたの国へ行きます。
One evening a man came to my house.	ある夕方、一人の男がやってきた。
That house is much better than this.	あの家はこれよりもずっと良い。
What do you mean to say to me?	あなたは私に何を言おうとしているのですか。
There are very few examples in the world.	世界にはあまり例が無い
They have no house to live in at all.	彼らにはまったく住む家がない。
He is well spoken of by many people.	彼は多くの人によく言われている。
He has something to do with the case.	彼は事件といくらか関係がある。
He is the only person that can do it.	彼はそれができる唯一の人です。
He has a large family to provide for.	彼には扶養すべき大家族がある。
How would you like to live in Tokyo?	東京に住んでみたらどうでしょう。
Two of my books have been taken.	誰かが私の本を２冊持っていってしまった。
I didn't have a good time last Sunday.	前の日曜日は楽しくなかった。
As many as a thousand people were there.	千人もの人がそこにいた。
We made the best of our small room.	私達は狭い部屋を最大限に利用した。
I work from nine to five every day.	私は毎日９時から５時まで働きます。
I come here every Fourth of July.	私は独立記念日にはいつもここに来るの。
I ordered those books from Germany.	私はそれらの本をドイツに注文した。
I have not more than ten books.	私は、せいぜい１０冊しか本を持っていない。
There are many books in my room.	私の部屋には、たくさんの本があるんです。
We must keep up with the times.	私たちは時流とともに進まなければならない。
As I love her, so she loved me.	私が彼女を愛したように、彼女も私を愛した。
Does he know that you love him?	君が彼を愛している事を彼は知っていますか。
English is used by many people.	英語はたくさんの人々によって使われている。
I want a person who can speak French.	フランス語を話せる人が欲しい。
Tom has a house which has two rooms.	トムは２部屋ある家をもっている。
There are few, if any, such men.	たとえそんな人はいるとしてもごく少ない。
Let it be done by six this evening.	それを夕方６時までにやって下さい。
That is not the point in question.	それは今問題になっている点とは違う。
That is something you should not have said.	それは君の失言だ。
Only a few people didn't go there.	そこへ行かなかった人はわずかだった。
John came running into the room.	ジョンは走りながら部屋の中へ入ってきた。
This will do us for the present.	さしあたり、我々にはこれで間に合います。
How's it going with your family?	ご家族のみなさんはうまくいっていますか。
Do you want any of these books?	これらの本のうちで欲しいものはありますか。
This is the book I've been looking for.	これは私が探していた本だ。
I don't know what the question means.	この問題の意味がわかりません。
Place this book back where it was.	この本をもとあった場所に戻しなさい。
Here is the book you are looking for.	ここに君の探している本がある。
There are no more than six persons here.	ここには６人しかいない。
What in the world does he mean?	いったいぜんたい彼はどういうつもりなのか。
Do you know how to speak English?	あなたは英語の話し方を知っていますか。
You have to speak only English.	あなたは英語だけを話さなければなりません。
How long have you lived in Sanda?	あなたはいつから三田に住んでいますか。
Two families live in the same house.	２つの家族が同じ家に住んでいる。
One billion people speak English.	１０億人の人たちが英語を話しています。
She was in the house before I knew it.	彼女がいつの間にか家の中に居る
People who like RPGs will like this.	ＲＰＧが好きな人にはぜひオススメだ
He can't keep up with the times at all.	彼が全然時代の波に乗れません
Old people need something to live for.	お年寄りには生きがいが必要だ。
She loves Tom more than she does me.	彼女は私よりトムの方を愛している。
She doesn't speak Japanese at home.	彼女は家では日本語をしゃべりません。
Before long, she came into my room.	彼女はまもなく私の部屋に入ってきた。
She knows that John loved her.	彼女はジョンが愛してくれているのを知っている。
She gave me a book for Christmas.	彼女はクリスマスプレゼントに本をくれた。
Her look says that she loves you.	彼女が好きなことは彼女の目をみてわかる。
I want to get the book back from her.	彼女からその本をとりもどしたい。
They have lived here for a long time.	彼らは長い時間ここに住んでいる。
They are looking for a house to live in.	彼らは住む家を探している。
They make good use of their rooms.	彼らは自分の部屋をうまく利用している。
He lives far away from my house.	彼は私の家から遠く離れた所に住んでいます。
He's the last man that I want to see.	彼は私が最も会いたくない人物だ。
He was seen to come out of the house.	彼は家からでてくるのを見られた。
He came to understand it at last.	彼はとうとうそれを理解するようになった。
At last, he found out how to make it.	彼はついにその作り方を見つけた。
He set out for London early in July.	彼は７月初めにロンドンへ向かった。
Let me know the time when he will come.	彼が来る時を知らせて下さい。
Let me know in no time when he comes.	彼が来たらすぐに知らせて下さい。
I will go provided that the others go.	他の人が行くなら私も行きます。
I can't speak English as well as he.	私は彼ほど上手に英語を話せません。
I love you better than he.	私は彼があなたを愛している以上にあなたを愛しています。
I'll help you as long as I live.	私が生きている限りは君を援助してあげよう。
What did you come here so early for?	君は何でこんなに早くここへきたの。
You must get up a little earlier.	君はもう少し早く起きなければなりません。
I can't live any longer without him.	もう、彼がいないと生きていけない！
The French are said to love art.	フランス人は芸術を愛好すると言われている。
Just then she came into my room.	ちょうどその時彼女が私の部屋に入ってきた。
You need not have got up so early.	そんなに早く起きる必要はなかったのに。
Well, let's make it some other time.	それでは、またの機会ということに。
The old man spoke to me in French.	その老人は私にフランス語で話し掛けた。
How did you come by these books?	これらの本をどうやって手にいれたのですか。
This book is less large than that one.	この本はあの本ほど大きくない。
How long can I keep this book?	この本どのくらいお借りしていてよろしいですか。
"Were you at home?" "No, I wasn't."	あなたは昨日家にいましたか。いいえ。
You don't have to get up so early.	あなたはそんなに早く起きる必要はない。
No fewer than thirty people were present.	３０人もの人が出席した。
I shouldn't have gotten up so early.	あんなに早く起きなければよかった。
He/She will never become a good person.	まともな人間には決してならない
He kept away from that for a while.	彼はそれとしばらく距離を置いていました
We should know the result by Thursday.	木曜までには結果が分かるはずだ。
She is said to be in love with him.	彼女は彼に恋をしていると言われている。
She can speak English very well.	彼女は英語をとても上手に話すことができます。
She speaks English, and French as well.	彼女は英語とフランス語も話す。
She goes under the name of Yotchan.	彼女はヨッチャンという名を使っている。
She thinks that she's always right.	彼女はいつも自分が正しいと思っている。
He would not speak to her again.	彼は彼女に２度と話しかけようとはしなかった。
He is the last person I want to see now.	彼は今一番会いたくない人だ。
He speaks French as well as English.	彼は英語だけでなくフランス語も話す。
He came a little earlier than he used to.	彼は以前より少し早く来た。
How long has he lived in London?	彼はどのくらいロンドンに住んでいるのですか。
I did not understand him at all.	彼の言ったことの意味が全然分からなかったよ。
My family was well off in those days.	当時我が家は暮らし向きがよかった。
China is the largest country in Asia.	中国はアジアで最も広大な国である。
As long as we live, we should work.	生きてる限りは、働かなければならない。
He ran so he would get there on time.	時間どおりに着くために彼は走った。
I could not make out what he meant.	私は彼の言いたいことがわからなかった。
I have three times as many books as he.	私は彼の３倍の本を持っている。
I'm not always at home on Sundays.	私は日曜日にいつも家にいるとは限らない。
I know who lives in this house.	私は誰がこの家に住んでいるのかを知っています。
I will go and take a look at the house.	私はその家を見に行こうと思う。
We must work as long as we live.	私たちは生きている限り働かなければならない。
We must keep up with the times.	私たちは時勢に遅れずについていかねばならない。
I'm very low on change right now.	今、小銭の持ち合わせがほとんどないのです。
It goes without saying that I love you.	君を好きなのは言うまでもない。
You must not look upon him as great.	君は彼を偉大だとおもってはならない。
You can speak English well, can you not?	君は英語がうまく話せますね？
You should have come a little earlier.	君はもう少し早く来るべきだった。
What did you come here so early for?	君はなんでこんなに早くここに来たの。
English is spoken in many countries.	英語はたくさんの国々で話されている。
Within every man are thousands.	一人の個人の中に幾千ものことなった人間がいる。
You are doing very well. Keep it up.	よくやっているよ。その調子で続けて。
They speak English in New Zealand.	ニュージーランドでは英語が話されている。
At last, he found out how to make it.	ついに彼はその作り方を考え出した。
John and Mary loved each other.	ジョンとメアリーはお互いに愛し合っていました。
What heading does this book come under?	この本は何の項目に入りますか。
She looked well when I last saw her.	この前会った時彼女は健康そうだった。
There's no one by that name here.	こちらには、そういう名前の者はおりません。
Cathy can speak French and German.	キャシーはフランス語とドイツ語が話せる。
Take it to the men in Room 318.	３１８号室のお客さんに持って行ってあげなさい。
There are 7 ways to use it on your body.	全身に７通りの使い方が出来ます
I can't see the other person's face at all.	全く相手の顔が見えません
People were still living in that house.	その家にはまだ人が住んでいました
She was never to see her home again.	彼女は再び故郷には帰らぬ運命にあった。
