There is no more room for a TV set.	もうテレビを置く場所がない。
You've run through all the butter?	バターを全部使ってしまったの？
You should've said so earlier.	それならそうと言ってくれればいいのに。
Few people know how to do it.	その仕事を知っている人はほとんどいない。
Not a few people had that thought.	その考えをする人は少なくない。
Mr Jones said something then.	そのときジョーンズさんが何かいいだした。
Jim, don't run about in the room.	ジム、部屋の中を走り回らないで。
This is the house in which he lives.	これは彼が住んでいる家だ。
This is the house that he lives in.	これが彼が住んでいる家です。
There are few houses around here.	このあたりは人家がほとんどない。
How long has Ken lived in Kobe?	ケンはどれくらい神戸に住んでいるの。
At one time they lived in Nagoya.	かつて彼らは名古屋にすんでいた。
When can you let me know the result?	いつ頃連絡をもらえますか。
They move from place to place.	あれらはあちこちへと移動していきます。
What time do you get up every day?	あなたは毎日何時に起きますか。
Do you study English every day?	あなたは毎日英語を勉強していますか。
Do you have a room of your own?	あなたは自分の部屋をもっていますか。
Do you know where I live?	あなたは私がどこに住んでいるのか知っていますか。
Let me help you to do the work.	あなたの仕事の手助けをさせて下さい。
Her name is known all over the world.	彼女は世界的に有名です。
I love her and she loves me.	僕は彼女を愛してるし、彼女も僕を愛してます。
They are living it up in Honolulu.	彼らはホノルルで楽しんでいるよ。
He knew little about the people.	彼は人々についてあまり知らなかった。
He works for the good of the country.	彼は国のために働いている。
He ran away lest he should be seen.	彼は見みられないように逃げた。
He is still on the right side of forty.	彼はまだ４０歳以下だ。
He goes by the name of Kenchan.	彼はケンチャンという名前で通っている。
Will you let me know when he comes?	彼が来たら教えてくれませんか。
The days are getting longer every day.	日が長くなってきました。
But he knew it couldn't last.	長続きしないってこともちゃんと分かってた。
Get up early, and you'll be in time.	早起きすれば間に合いますよ。
You ran into him earlier, didn't you?	前、偶然彼に会いましたね？
But for water, no man could live.	水がなければ、人間は生きられない。
I am never at home on Sundays.	私は日曜日に家にいることはありませんよ。
I have a large family to provide for.	私は大家族を養っています。
I'm not used to getting up early.	私は早起きすることになれていない。
I want to know about your country.	私はあなたの国について知りたい。
I'll help you as long as I live.	私の生きている限り、君を援助しよう。
My country is far away from Japan.	私の国は日本から遠く離れている。
As for me, I have no question.	私に関して言えば、何の質問もありません。
Let me have a look at it, will you?	私にちょっとみせてくださいよ。
We found out where he lives.	私達は、彼がどこに住んでいるのかが分かった。
You can't keep a good man down.	才能ある者を抑えておくことはできない。
What time will you be home this evening?	今日は何時に帰るの？
Where did you go last Sunday?	君はこの前の日曜日にはどこへ行きましたか。
There was little water in the well.	井戸にはほとんど水がなかった。
Do not bother to come to my home.	わざわざ家に来なくてもいいですよ。
Can you think of something better?	もっといいこと思いつきませんか。
You need not have come so early.	そんなに早く来る必要はなかったのに。
You did not need to come so early.	そんなに早く来る必要はなかった。
That is not what I meant to say.	それは私が言おうとしたことではない。
I don't understand much about it.	それについて私は詳しく知りません。
I'm just living from day to day.	その日その日を生き抜くのがやっとだ。
The experience will do you good.	その経験はあなたのためになるだろう。
Few people know how to do it.	そのやり方を知っている人はほとんど少ない。
There are no means of getting there.	そこにたどりつく方法はない。
We would love to work with you.	ぜひ取引させていただきたいと思います。
But we can't understand him.	しかし、私たちは彼の言うことが理解できない。
This is the house in which he lived.	これが彼の住んでいた家です。
Have you a room to let in this house?	この家に貸間はありますか。
These persons run this country.	こういう人たちが我が国を動かしている。
What do they live on in Egypt?	エジプトでは何を食べて生活していますか。
Let me see. There were fifteen people.	ええっと、１５人でした。
Do you know where he lives?	あなたは彼がどこに住んでいるか知っていますか。
I have to be back home by seven.	７時までに家に帰らなくてはならない。
She wouldn't let him in.	彼女はどうしても彼を部屋の中に入れようとしなかった。
It's you that she loves, not me.	彼女が愛しているのは僕じゃない、君だ。
He keeps a toyshop in a small way.	彼は細々とおもちゃやをやっている。
He is always willing to help others.	彼はいつも喜んで他人を手伝う。
He will come back in a few days.	彼は２、３日したら帰ってくるでしょう。
I don't like the house in which he lives.	彼のいる家は嫌いだ。
He has a large family to provide for.	彼には養うべき大家族がある。
He has a good case against her.	彼には彼女に反論する立派な言い分がある。
Have you got used to living in Tokyo?	東京での生活に慣れましたか。
We shouldn't look down on other people.	他人を軽蔑すべきでない。
You must always do what is right.	常に正しいことをしなければならない。
I don't know every one of you.	私は諸君のすべてを知っているわけではない。
I am studying English in my room.	私は自分の部屋で英語を勉強している。
I was given this present by Ann.	私はこのプレゼントをアンからもらった。
I always have to give in to him.	私はいつも彼に服従しなければならない。
She was never to see her home again.	再び故郷に帰れない運命だった。
You must study English every day.	英語は毎日勉強しなければなりません。
Don't bother to come to my house.	わざわざおいでにならなくて結構です。
Few people know each other well.	ほとんどの人々がお互いをよく知らない。
How did you come to love her?	どんなふうにして彼女を好きになったのですか。
How long does Tony run every day?	トニー君は毎日どれぐらい走りますか。
Does that mean you won't come?	それでは、あなたは来ないということですか。
I will come to your country some day.	いつかあなたの国へ行きます。
One evening a man came to my house.	ある夕方、一人の男がやってきた。
That house is much better than this.	あの家はこれよりもずっと良い。
What do you mean to say to me?	あなたは私に何を言おうとしているのですか。
There are very few examples in the world.	世界にはあまり例が無い
They have no house to live in at all.	彼らにはまったく住む家がない。
He has something to do with the case.	彼は事件といくらか関係がある。
He is the only person that can do it.	彼はそれができる唯一の人です。
He has a large family to provide for.	彼には扶養すべき大家族がある。
How would you like to live in Tokyo?	東京に住んでみたらどうでしょう。
I didn't have a good time last Sunday.	前の日曜日は楽しくなかった。
As many as a thousand people were there.	千人もの人がそこにいた。
We made the best of our small room.	私達は狭い部屋を最大限に利用した。
I work from nine to five every day.	私は毎日９時から５時まで働きます。
I come here every Fourth of July.	私は独立記念日にはいつもここに来るの。
We must keep up with the times.	私たちは時流とともに進まなければならない。
As I love her, so she loved me.	私が彼女を愛したように、彼女も私を愛した。
Does he know that you love him?	君が彼を愛している事を彼は知っていますか。
English is used by many people.	英語はたくさんの人々によって使われている。
Tom has a house which has two rooms.	トムは２部屋ある家をもっている。
There are few, if any, such men.	たとえそんな人はいるとしてもごく少ない。
Let it be done by six this evening.	それを夕方６時までにやって下さい。
That is not the point in question.	それは今問題になっている点とは違う。
That is something you should not have said.	それは君の失言だ。
Only a few people didn't go there.	そこへ行かなかった人はわずかだった。
John came running into the room.	ジョンは走りながら部屋の中へ入ってきた。
This will do us for the present.	さしあたり、我々にはこれで間に合います。
How's it going with your family?	ご家族のみなさんはうまくいっていますか。
I don't know what the question means.	この問題の意味がわかりません。
There are no more than six persons here.	ここには６人しかいない。
What in the world does he mean?	いったいぜんたい彼はどういうつもりなのか。
How long have you lived in Sanda?	あなたはいつから三田に住んでいますか。
Two families live in the same house.	２つの家族が同じ家に住んでいる。
She was in the house before I knew it.	彼女がいつの間にか家の中に居る
People who like RPGs will like this.	ＲＰＧが好きな人にはぜひオススメだ
He can't keep up with the times at all.	彼が全然時代の波に乗れません
Old people need something to live for.	お年寄りには生きがいが必要だ。
She loves Tom more than she does me.	彼女は私よりトムの方を愛している。
Before long, she came into my room.	彼女はまもなく私の部屋に入ってきた。
She knows that John loved her.	彼女はジョンが愛してくれているのを知っている。
Her look says that she loves you.	彼女が好きなことは彼女の目をみてわかる。
They have lived here for a long time.	彼らは長い時間ここに住んでいる。
They are looking for a house to live in.	彼らは住む家を探している。
They make good use of their rooms.	彼らは自分の部屋をうまく利用している。
He lives far away from my house.	彼は私の家から遠く離れた所に住んでいます。
He's the last man that I want to see.	彼は私が最も会いたくない人物だ。
He was seen to come out of the house.	彼は家からでてくるのを見られた。
He came to understand it at last.	彼はとうとうそれを理解するようになった。
At last, he found out how to make it.	彼はついにその作り方を見つけた。
He set out for London early in July.	彼は７月初めにロンドンへ向かった。
Let me know the time when he will come.	彼が来る時を知らせて下さい。
Let me know in no time when he comes.	彼が来たらすぐに知らせて下さい。
I will go provided that the others go.	他の人が行くなら私も行きます。
I love you better than he.	私は彼があなたを愛している以上にあなたを愛しています。
I'll help you as long as I live.	私が生きている限りは君を援助してあげよう。
What did you come here so early for?	君は何でこんなに早くここへきたの。
You must get up a little earlier.	君はもう少し早く起きなければなりません。
I can't live any longer without him.	もう、彼がいないと生きていけない！
The French are said to love art.	フランス人は芸術を愛好すると言われている。
Just then she came into my room.	ちょうどその時彼女が私の部屋に入ってきた。
You need not have got up so early.	そんなに早く起きる必要はなかったのに。
Well, let's make it some other time.	それでは、またの機会ということに。
"Were you at home?" "No, I wasn't."	あなたは昨日家にいましたか。いいえ。
You don't have to get up so early.	あなたはそんなに早く起きる必要はない。
No fewer than thirty people were present.	３０人もの人が出席した。
I shouldn't have gotten up so early.	あんなに早く起きなければよかった。
He/She will never become a good person.	まともな人間には決してならない
He kept away from that for a while.	彼はそれとしばらく距離を置いていました
We should know the result by Thursday.	木曜までには結果が分かるはずだ。
She is said to be in love with him.	彼女は彼に恋をしていると言われている。
She goes under the name of Yotchan.	彼女はヨッチャンという名を使っている。
She thinks that she's always right.	彼女はいつも自分が正しいと思っている。
He is the last person I want to see now.	彼は今一番会いたくない人だ。
He came a little earlier than he used to.	彼は以前より少し早く来た。
How long has he lived in London?	彼はどのくらいロンドンに住んでいるのですか。
I did not understand him at all.	彼の言ったことの意味が全然分からなかったよ。
My family was well off in those days.	当時我が家は暮らし向きがよかった。
As long as we live, we should work.	生きてる限りは、働かなければならない。
He ran so he would get there on time.	時間どおりに着くために彼は走った。
I could not make out what he meant.	私は彼の言いたいことがわからなかった。
I'm not always at home on Sundays.	私は日曜日にいつも家にいるとは限らない。
I know who lives in this house.	私は誰がこの家に住んでいるのかを知っています。
I will go and take a look at the house.	私はその家を見に行こうと思う。
We must work as long as we live.	私たちは生きている限り働かなければならない。
We must keep up with the times.	私たちは時勢に遅れずについていかねばならない。
I'm very low on change right now.	今、小銭の持ち合わせがほとんどないのです。
It goes without saying that I love you.	君を好きなのは言うまでもない。
You must not look upon him as great.	君は彼を偉大だとおもってはならない。
You should have come a little earlier.	君はもう少し早く来るべきだった。
What did you come here so early for?	君はなんでこんなに早くここに来たの。
Within every man are thousands.	一人の個人の中に幾千ものことなった人間がいる。
You are doing very well. Keep it up.	よくやっているよ。その調子で続けて。
At last, he found out how to make it.	ついに彼はその作り方を考え出した。
John and Mary loved each other.	ジョンとメアリーはお互いに愛し合っていました。
She looked well when I last saw her.	この前会った時彼女は健康そうだった。
There's no one by that name here.	こちらには、そういう名前の者はおりません。
Take it to the men in Room 318.	３１８号室のお客さんに持って行ってあげなさい。
There are 7 ways to use it on your body.	全身に７通りの使い方が出来ます
I can't see the other person's face at all.	全く相手の顔が見えません
People were still living in that house.	その家にはまだ人が住んでいました
She was never to see her home again.	彼女は再び故郷には帰らぬ運命にあった。
Her look says that she loves you.	彼女が君を好きなのは彼女の目を見れば分かる。
Her look says that she loves you.	彼女が君を好きなことは彼女の目つきでわかる。
He loves her. She loves him, too.	彼は彼女を愛している。彼女も彼を愛している。
He was seen going out of the house.	彼は家から出かけるところをみられました。
He wants to live as long as he can.	彼はできるだけ長く生きたいと思っている。
He has been living in Kobe for two days.	彼は２日間神戸に住んでいます。
Japanese is not used in this country.	日本語はこの国では使われていません。
Which is larger, Japan or Britain?	日本とイギリスではどちらが大きいのですか。
No one can keep me from going there.	私はそこに行く。誰も私を止められない。
I do not know every one of them.	私は彼らの全部を知っているというわけではない。
I am not always at home on Sundays.	私は日曜日にいつも家にいるわけではない。
I couldn't understand him at first.	私は最初に彼の言うことがわからなかった。
I take it that we are to come early.	私たちは早く来なければならないと思う。
We must keep up with the times.	私たちは時勢に遅れないようにしなければならない。
We must keep up with the times.	私たちは時勢に遅れずついていかなければならない。
I love you more than you love me.	君が私を愛している以上に私は君を愛している。
Reporter: Can you give me an example?	記者：例を１つあげてくださいますか。
We had better do what other people do.	我々も世間なみのことをしなくちゃ。
We must keep up with the times.	我々は時勢に遅れずに付いて行かなければならない。
We must work as long as we live.	われわれは生きているかぎりは働かねばならない。
What made you come here so early?	どうして君はこんなに早くここへ来たのですか。
There are few men who don't know that.	それを知らない人はほとんどいない。
Could you find out how to get there?	そこへいく方法を調べてもらえませんか。
This is to make up for the last time.	これはこの前のときの埋め合わせです。
I say this from my own experience.	この事は私自身の体験から言っているのです。
Are you always at home in the evening?	あなたは晩にはいつもご在宅ですか。
How long have you lived in Kobe?	あなたはどのくらいの間、神戸に住んでいますか。
"May I go with you?" "By all means."	「一緒に行ってもいいですか」「どうぞ」
What! You going to take her side again!?	何よ！またその子の肩を持つ気！？
Who do you think she lives with?	彼女は誰といっしょに暮らしているとおもいますか。
She gets up the earliest in my family.	彼女は私の家族の中で一番早く起きる。
She did not come even as far as my house.	彼女は私の家にさえ来なかった。
She thought that John had loved her.	彼女はジョンが愛してくれていたと思った。
She had lived in five different countries.	彼女は５カ国で暮らしていた。
How long did they live in England?	彼らはイギリスにどれくらい住んでいましたか。
He's not always at home on Sundays.	彼は日曜日にはいつも家にいるわけではない。
He always wanted to study Japanese.	彼は日本語を勉強したいとずっと思っていた。
At times I can't understand him.	彼のことがわからなくなることがときどきあります。
I couldn't make him understand my English.	彼に私の英語は通じなかった。
How long have you lived in Japan?	日本に住むようになってどのくらいになりますか。
Did you find what you were looking for?	探しているものが見つかりましたか。
People came from the farthest country.	人々は、一番遠い国からもやってきた。
I couldn't make him understand it.	私は彼にそれを理解させることができなかった。
We must keep up with the times.	私たちは時勢に遅れずに付いていかなければならない。
When I came home, Tom was studying.	私が帰宅したとき、トムは勉強していました。
Do you have to go there every day?	君は毎日そこへいかなくてはならないのですか。
You don't have to come here every day.	君は毎日ここに来る必要はありません。
How many rooms are there in your house?	君の家には部屋がいくつありますか。
A well is a place where you can get water.	井戸は水を得られる所である。
I can understand what you are saying.	わたしはあなたの言うことが理解できる。
If he comes, show him into my room.	もし彼がきたら、私の部屋に通してください。
How long have you been living in Tokyo?	もうどのくらい東京にいるのですか。
Only a few people understood me.	ほんの少しの人しかわたしを理解してくれなかった。
Tom is going to do something about it.	トムは事態をなんとかしようとします。
You needn't go too early, need you?	そんなに早くに行くには及ばないでしょうね。
I don't know what to open it with.	それをどうやって開けたらいいのか分からない。
I'm through with my work. Let's go out.	その仕事は終わったよ。出かけよう。
You should not make little of the result.	その結果を軽く見てはいけない。
You should not make little of the result.	その結果を軽く見ちゃいけない。
Jane understands your way of thinking.	ジェーンは君の考え方が分かっている。
I don't like this. Show me another.	これは気に入らない。別のものを見せてくれ。
This present was given to me by Ann.	このプレゼントはアンから私に与えられた。
This is where my family used to live.	ここは昔、私の家族が住んでいた所です。
One man says this, another that.	ある人はこうだと言い、またある人はああだと言う。
You must not look down on old people.	あなたたちは老人を軽蔑してはいけない。
Let me know the days when you can come.	あなたが来られる日を教えて下さい。
Asia is much larger than Australia.	アジアはオーストラリアよりはるかに大きい。
There are other people who know about it.	他に御存じの方がいらっしゃいます
She has something to do with the group.	彼女はそのグループと何か関係がある。
She is more human in thinking than you.	彼女はあなたよりも考え方が人間的だ。
He was seen to come out of the house.	彼はその家から出てくるところを見られた。
Those who are present are all Japanese.	出席をしている人々は全部日本人です。
I am going to let her do as she likes.	私は彼女に好きなようにさせるつもりだ。
I have something that I want to say to him.	私は彼に言いたいことがある。
We must have something to live for.	私たちは何か生きがいを持たなければならない。
It is up to us to help those people.	それらの人々を助けるのが我々の義務である。
It is used by a great many people.	それは非常にたくさんの人々によって使われます。
It was a very good experience for him.	それは彼にとってとてもいい経験だった。
It's not something I'm very good at.	それは私が大変得意としているものではない。
How did you get to know that person?	その人とどうして知り合いになったのですか。
This is a Christmas present from him.	これは彼からのクリスマスプレゼントです。
I don't like this. Show me another.	これは好きではない、別のものをみせて下さい。
This is the means by which I can find him.	これが、彼を探し出せる方法だ。
This house is as large again as that one.	この家はあの家よりも２倍大きい。
There used to be a house here at one time.	かつて、ここに家がありました。
You are just the same as you always were.	あなたは昔と全然変わっていない。
I would like you to go home with me.	あなたに私といっしょに帰宅してもらいたい。
Do you love each other very much?	あなたがたはお互いに大変愛し合っているのですか。
Come to my room between three and four.	３時と４時の間に私の部屋に来なさい。
Do you have a tatami room for ten people?	１０人用の畳の部屋はありますか。
I didn't understand the meaning at all.	私にはさっぱり意味が分かりませんでした
They will take down the house in a day.	彼らはその家を１日で取り壊すでしょう。
He is different from the people around him.	彼は多くの点で周りの人と違う。
He is the very person I have wanted to see.	彼こそ私の会いたかった人です。
Only a few understood what he said.	彼が言ったことを理解したのはほんの少数だった。
Few Japanese can use English well.	日本人で英語をうまく使える人はほとんどいません。
