I speak French as well as she does.	彼女と同じくらい私もフランス語が話せる。
Her look says that she loves you.	彼女が君を好きなのは彼女の目を見れば分かる。
Her look says that she loves you.	彼女が君を好きなことは彼女の目つきでわかる。
He loves her. She loves him, too.	彼は彼女を愛している。彼女も彼を愛している。
He was seen going out of the house.	彼は家から出かけるところをみられました。
He can speak both English and German.	彼は英語もドイツ語も両方とも話せる。
He wants to live as long as he can.	彼はできるだけ長く生きたいと思っている。
He has no less than five hundred books.	彼は５００冊もの本を持っている。
He has been living in Kobe for two days.	彼は２日間神戸に住んでいます。
He has no less than three hundred books.	彼には３００冊もの蔵書がある。
Japanese is not used in this country.	日本語はこの国では使われていません。
Which is larger, Japan or Britain?	日本とイギリスではどちらが大きいのですか。
China is twenty times as large as Japan.	中国は日本の２０倍の大きさだ。
No one can keep me from going there.	私はそこに行く。誰も私を止められない。
I do not know every one of them.	私は彼らの全部を知っているというわけではない。
I am not always at home on Sundays.	私は日曜日にいつも家にいるわけではない。
I couldn't understand him at first.	私は最初に彼の言うことがわからなかった。
I take it that we are to come early.	私たちは早く来なければならないと思う。
We must keep up with the times.	私たちは時勢に遅れないようにしなければならない。
We must keep up with the times.	私たちは時勢に遅れずついていかなければならない。
I love you more than you love me.	君が私を愛している以上に私は君を愛している。
Reporter: Can you give me an example?	記者：例を１つあげてくださいますか。
We had better do what other people do.	我々も世間なみのことをしなくちゃ。
We must keep up with the times.	我々は時勢に遅れずに付いて行かなければならない。
How many books can I take out at one time?	一度に何冊借りられますか。
We must work as long as we live.	われわれは生きているかぎりは働かねばならない。
Tony speaks English better than I do.	トニー君は私よりも上手に英語を話す。
What made you come here so early?	どうして君はこんなに早くここへ来たのですか。
There are few men who don't know that.	それを知らない人はほとんどいない。
I'd like to speak to John Warner.	ジョン・ワーナーさんとお話ししたいのですが。
This is to make up for the last time.	これはこの前のときの埋め合わせです。
This will be the book he is looking for.	これが彼の探している本だろう。
This book will be of great use to us.	この本は私たちにとても役立つだろう。
I say this from my own experience.	この事は私自身の体験から言っているのです。
This is the man for you to speak to.	こちらはあなたがお話しになるお方です。
Are you always at home in the evening?	あなたは晩にはいつもご在宅ですか。
How long have you lived in Kobe?	あなたはどのくらいの間、神戸に住んでいますか。
"May I go with you?" "By all means."	「一緒に行ってもいいですか」「どうぞ」
What! You going to take her side again!?	何よ！またその子の肩を持つ気！？
Who do you think she lives with?	彼女は誰といっしょに暮らしているとおもいますか。
She gets up the earliest in my family.	彼女は私の家族の中で一番早く起きる。
She did not come even as far as my house.	彼女は私の家にさえ来なかった。
She thought that John had loved her.	彼女はジョンが愛してくれていたと思った。
She had lived in five different countries.	彼女は５カ国で暮らしていた。
How long did they live in England?	彼らはイギリスにどれくらい住んでいましたか。
He's not always at home on Sundays.	彼は日曜日にはいつも家にいるわけではない。
He always wanted to study Japanese.	彼は日本語を勉強したいとずっと思っていた。
He speaks English, and French as well.	彼は英語と、さらにフランス語も話す。
He can speak both English and French.	彼は英語かフランス語かどちらか話せる。
He speaks French and that very well.	彼はフランス語を話すしかもとても上手だ。
He can speak Thai as well as English.	彼は、英語だけでなくタイ語も話せます。
At times I can't understand him.	彼のことがわからなくなることがときどきあります。
I couldn't make him understand my English.	彼に私の英語は通じなかった。
I speak Japanese, English, and French.	日本語、英語、フランス語を話します。
How long have you lived in Japan?	日本に住むようになってどのくらいになりますか。
People came from the farthest country.	人々は、一番遠い国からもやってきた。
You should always think before you speak.	常に考えてから物を言いなさい。
I couldn't make him understand it.	私は彼にそれを理解させることができなかった。
We must keep up with the times.	私たちは時勢に遅れずに付いていかなければならない。
When I came home, Tom was studying.	私が帰宅したとき、トムは勉強していました。
Do you have to go there every day?	君は毎日そこへいかなくてはならないのですか。
You don't have to come here every day.	君は毎日ここに来る必要はありません。
How many rooms are there in your house?	君の家には部屋がいくつありますか。
I ordered some new books from America.	何冊かの新刊書をアメリカに注文した。
A well is a place where you can get water.	井戸は水を得られる所である。
I can understand what you are saying.	わたしはあなたの言うことが理解できる。
If he comes, show him into my room.	もし彼がきたら、私の部屋に通してください。
How long have you been living in Tokyo?	もうどのくらい東京にいるのですか。
Only a few people understood me.	ほんの少しの人しかわたしを理解してくれなかった。
Tom is going to do something about it.	トムは事態をなんとかしようとします。
You needn't go too early, need you?	そんなに早くに行くには及ばないでしょうね。
I must get the book back from him.	その本を彼から戻してもらわなければならない。
I'm through with my work. Let's go out.	その仕事は終わったよ。出かけよう。
You should not make little of the result.	その結果を軽く見てはいけない。
You should not make little of the result.	その結果を軽く見ちゃいけない。
Jane understands your way of thinking.	ジェーンは君の考え方が分かっている。
I don't like this. Show me another.	これは気に入らない。別のものを見せてくれ。
This book will be of great use to you.	この本はあなたに大いに役立つだろう。
This present was given to me by Ann.	このプレゼントはアンから私に与えられた。
This is where my family used to live.	ここは昔、私の家族が住んでいた所です。
Oh, I didn't know it was that close.	あれ、そんなに近いとは知りませんでした。
One man says this, another that.	ある人はこうだと言い、またある人はああだと言う。
You must not look down on old people.	あなたたちは老人を軽蔑してはいけない。
Let me know the days when you can come.	あなたが来られる日を教えて下さい。
Asia is much larger than Australia.	アジアはオーストラリアよりはるかに大きい。
There are other people who know about it.	他に御存じの方がいらっしゃいます
I've ordered a book from Amazon.com.	アマゾン・ドット・コムで本を注文しました。
She speaks English, and French as well.	彼女は英語も話すがフランス語も話す。
She can speak both English and German.	彼女は英語とドイツ語の両方が話せます。
She speaks English, and French as well.	彼女は英語とさらにフランス語も話す。
I don't think she can speak French.	彼女はフランス語を話すことができないと思う。
She has something to do with the group.	彼女はそのグループと何か関係がある。
She is more human in thinking than you.	彼女はあなたよりも考え方が人間的だ。
He has at least one thousand books.	彼は少なくとも１、０００冊の本をもっている。
He has three times as many books as I have.	彼は私の三倍本を持っている。
He speaks as if he were an American.	彼はまるでアメリカ人であるかのように話す。
He speaks Spanish as well as French.	彼はフランス語だけでなくスペイン語も話す。
He was seen to come out of the house.	彼はその家から出てくるところを見られた。
Those who are present are all Japanese.	出席をしている人々は全部日本人です。
I am going to let her do as she likes.	私は彼女に好きなようにさせるつもりだ。
I have something that I want to say to him.	私は彼に言いたいことがある。
We must have something to live for.	私たちは何か生きがいを持たなければならない。
Tom can speak German as well as English.	トムは英語の他にドイツ語も話せる。
It is up to us to help those people.	それらの人々を助けるのが我々の義務である。
It is used by a great many people.	それは非常にたくさんの人々によって使われます。
It was a very good experience for him.	それは彼にとってとてもいい経験だった。
It's not something I'm very good at.	それは私が大変得意としているものではない。
How did you get to know that person?	その人とどうして知り合いになったのですか。
Jack made me go there against my will.	ジャックはむりやり私をそこへ行かせた。
This is a Christmas present from him.	これは彼からのクリスマスプレゼントです。
I don't like this. Show me another.	これは好きではない、別のものをみせて下さい。
This is the book which you are looking for.	これが君の探している本です。
This is the means by which I can find him.	これが、彼を探し出せる方法だ。
Which is older, this book or that one?	この本とあの本ではどちらが古いですか。
This house is as large again as that one.	この家はあの家よりも２倍大きい。
There used to be a house here at one time.	かつて、ここに家がありました。
You are just the same as you always were.	あなたは昔と全然変わっていない。
I would like you to go home with me.	あなたに私といっしょに帰宅してもらいたい。
Do you love each other very much?	あなたがたはお互いに大変愛し合っているのですか。
Come to my room between three and four.	３時と４時の間に私の部屋に来なさい。
Do you have a tatami room for ten people?	１０人用の畳の部屋はありますか。
I didn't understand the meaning at all.	私にはさっぱり意味が分かりませんでした
They will take down the house in a day.	彼らはその家を１日で取り壊すでしょう。
He is different from the people around him.	彼は多くの点で周りの人と違う。
He is the very person I have wanted to see.	彼こそ私の会いたかった人です。
Only a few understood what he said.	彼が言ったことを理解したのはほんの少数だった。
Few Japanese can use English well.	日本人で英語をうまく使える人はほとんどいません。
The same may be said of other people.	同じことが他の人々についても言えるだろう。
You may go as long as you come home early.	早く帰ってくるなら行ってもいい。
I speak Japanese, English, and French.	私は日本語、英語、フランス語を話します。
I couldn't think of the name of the place.	私はその地名を思い出せなかった。
He loves you as much as I do.	私はあなたを愛しているが彼も同じくらいあなたを愛している。
I saw him go out of the room just now.	私は、彼がたった今部屋から出るのを見た。
My room is three times as large as yours.	私の部屋は君の部屋の３倍の広さだ。
I don't like the way he speaks to me.	私に対する彼の口のきき方が気に入りません。
We must have something to live for.	私たちは何か生きていく目標をもたねばならない。
It was in London that I last saw her.	私がこの前彼女に会ったのはロンドンだった。
Keep up the good work, Mr. Sakamoto.	坂本さんこれからもいい仕事を続けてください。
I love you more than you love me.	君が私を愛しているよりもおおく私は君を愛している。
Tony speaks English as well as you.	トニー君はあなたと同じくらい上手に英語を話す。
Toshio can speak English very well.	俊夫くんはとても上手に英語を話すことが出来る。
But I can't understand them very well.	でも私はあまりよくそれらを理解できない。
I've never been spoken to like that.	そんなふうに話しかけられたのは初めてだった。
The man's name was Francisco Pizzaro.	その男の名前はフランシスコ・ピサロだった。
There lived an old man in the old house.	その古い家に一人の老人が住んでいた。
There were few, if any, cases.	そのようなケースは、たとえあるにせよ、まれなことだった。
This is the room where the body was found.	これが死体の発見された部屋です。
Which is older, this book or that one?	この本とあの本とではどちらが古いですか。
French is spoken in a part of Canada.	カナダの一部ではフランス語が話されている。
You must have known what she meant.	あなたは彼女の気持ちがわかっていたに違いない。
How long have you lived in Sasayama?	あなたはどれくらい篠山に住んでいるのですか。
He and that person first spoke in Kyoto.	彼が京都でその人と初めて言葉を交わした
Few people live to be more than a hundred.	百歳以上生きる人はほとんどいない。
Who that knows her doesn't love her?	彼女を知っている誰が、彼女を愛さないだろうか。
She has come to know something like love.	彼女はほのかな恋心を知るようになる。
She thought that John had loved her.	彼女はジョンが以前に愛してくれていたと思った。
He came to see me in a different light.	彼は私を違った観点から見るようになった。
He has no more than one hundred books.	彼はわずかに１００冊の本しか持っていない。
He may have gone home by another way.	彼はちがう道を通って家に帰ったかもしれない。
What do you think he meant by that?	彼はそれをどんなつもりで言ったのだと思いますか。
He will provide you with what you need.	彼はあなたが必要なものをくれるでしょう。
It would be better for you to speak to him.	彼に話し掛けるほうがよいだろう。
It being Sunday, I didn't get up early.	日曜日だったので、私は早く起きなかった。
China is twenty times as large as Japan.	中国は日本の２０倍の大きさがあります。
All in all, I thought it was a good book.	全体的に見てそれはよい本だと思った。
Only a few people showed up on time.	時間どおりに現れたのは２、３人しかいなかった。
I don't like the house in which he lives.	私は彼が住んでいる家は好きではない。
I can see some Japanese people here.	私はここで何人かの日本人に会うことができます。
We must keep up with the times.	私たちは時勢に遅れないようについていかなければならない。
It's a house just like that I have seen.	私が見たのはそれにそっくりの家だった。
He loves you as much as I do.	私があなたの事を愛しているのと同じ位彼もあなたを愛している。
How did you come to know one another?	君達はどうやってお互いを知り合ったのですか。
You can't have understood what he said.	君に彼の言ったことがわかったはずがない。
We ordered some new books from England.	我々は何冊かの新しい本を英国に注文した。
It is good to keep studying all your life.	一生懸命し続けることはいいことだ。
I know a man who can speak Russian well.	ロシア語をうまく話せる人を知っている。
Nicole can speak Japanese very well.	ニコルは日本語をとても上手に話すことが出来る。
There were two hundred people in the room.	その部屋には２００人の人々がいた。
There were no Japanese in this country.	この国には日本人は一人もいませんでした。
Such books as this are of no use to us.	こういう本は私達には少しも役に立たない。
California is about as large as Japan.	カリフォルニアは日本と同じくらいの広さだ。
They speak English and French in Canada.	カナダでは英語とフランス語を話します。
I'm Japanese, but I don't live in Japan.	私は日本人ですが、日本に住んでいません。
For example, it is 7:00 a.m. in London now.	例えば、ロンドンは今は朝７時です。
We are not always at home on Sundays.	僕たちは日曜日にいつも家にいるとは限りません。
She has gone, but I still love her.	彼女は行ってしまったが、私はまだ彼女を愛している。
She always keeps her room in good order.	彼女はいつも部屋をきれいに整頓している。
Those who know him speak well of him.	彼を知っている人々は、彼のことを良く言います。
He shall not come into this house again.	彼をこの家へ２度と入れさせないつもりだ。
They speak English or French or both.	彼らは英語かフランス語かまたはその両方を話す。
He has no less than five English books.	彼は少なくても５冊の英語の本を持っている。
He can speak both English and French.	彼は英語とフランス語をしゃべることができます。
Japan will get it from many countries.	日本は多くの国からしっぺ返しをくらうだろう。
The more people have, the more they want.	人は持てば持つほどますます欲しくなる。
I am going to my room, where I can study.	私は勉強できるように自分の部屋に行く。
I have three times as many books as she has.	私は彼女の３倍の本を持っている。
I don't understand what you are saying.	私はあなたのおっしゃることが分かりません。
We are thinking of moving back home.	私たちは生まれ故郷に引っ越そうかと考えています。
You had better go and speak to him in person.	行って自分で彼に話す方がよい。
It will not be long before we know the result.	結果はまもなく分かるだろう。
You need not have come here so early.	君はそんなに早くここに来る必要はなかったのに。
You should not think little of this result.	君はこの結果を軽視すべきじゃない。
How long have you been living in Kobe, then?	君はいつから神戸に住んでいるの。
What makes you think that I'm against that?	どうして私が反対だと思うのですか。
The old man was not as mean as he looked.	その老人は見かけほど意地悪くなかった。
This is the very book I have been looking for.	これこそ私が探していた本だ。
My life has been changed by this book.	この本によって私の人生は変えられてしまった。
The people which were here have all gone.	ここにいた人々はみんな行ってしまった。
"Do you speak German?" "No, I don't."	「ドイツ語を話しますか」「いいえ、話しません」
I was getting used to living in America.	アメリカの生活にだんだん慣れてきました。
Let me have a look at that book of Tom's.	あのトムの本をちょっと見せてください。
"May I speak to Mr Nakagawa?" "Speaking."	「中川さんをお願いします」「私ですが」
Tom didn't know what Mary's last name was.	トムはメアリーの苗字を知らなかった。
The question is who will go there for him.	問題は誰が彼のかわりにそこへ行くかだ。
Dr. Makino is looked up to by many people.	牧野博士は多くの人々に尊敬されている。
She can speak Spanish as well as English.	彼女は英語だけでなくスペイン語も話せる。
He is longing to see my family in Tokyo.	彼は東京にいる私の家族に会いたがっている。
He has no more than five English books.	彼は多くても５冊しか英語の本を持っていない。
I was moved by her love for other people.	私は彼女の他の人々に対する愛に感動した。
I didn't know that he could speak English.	私は彼が英語を話せるのを知らなかった。
I have no more than ten English books.	私は多くとも１０冊しか英語の本を持っていない。
I did say that, but I didn't mean it.	私は確かにそう言ったが、そのつもりではなかった。
I have ten times as many books as you have.	私はあなたの１０倍の本を持っている。
As far as I know, she is a very good person.	私が知るかぎり彼女は大変よい人だ。
At first, he could not speak English at all.	最初、彼は全然英語が話せなかった。
One question was what I was going to be.	疑問の一つは、私がどんな人になるかでした。
What will you live on while you are there?	そこにいる間、生活の糧はどうするのだ。
This is the very book I have been looking for.	これこそが私が捜していた本だ。
Is this the book you spoke of the other day?	これが先日お話しになった本ですか。
This will be the house we are looking for.	これが私たちがさがしている家でしょう。
This will be the book you are looking for.	これがあなたのさがしている本でしょう。
This book is the smallest of all the books.	この本はすべての本の中で一番小さい。
How far is it from here to your house?	ここから君の家までどのくらい距離がありますか。
Go and see if Mr Wilson is at home.	ウィルソンさんが家に居るかどうか、行って見ておいで。
That country is five times as large as Japan.	あの国は日本の５倍の大きさです。
How long do you study English every day?	あなたは毎日どのくらい英語を勉強しますか。
You and I must give him our present.	あなたと私は彼にプレゼントをあげなければならない。
When I was fifteen, I got a room of my own.	１５歳の時、私は自分の部屋を持った。
When she was thirteen, she ran away from home.	１３歳のときに彼女は家出した。
He must be at home as the light in on.	明かりがついているから彼は家にいるにちがいない。
He loves her, but she doesn't like him.	彼は彼女を愛しているが、彼女は彼が好きでない。
When he said "water," she gave him water.	彼が「水」と言えば、彼女は彼に水を与えた。
I found the book I had long been looking for.	長い間さがしていた本が見つかった。
Life doesn't always go the way we want it to.	人生は思うようにはいかないものだ。
People are living in all parts of the world.	人間は世界のあらゆる所に住んでいる。
No less than one hundred people were present.	少なくとも１００人は出席していた。
There were at least a hundred people present.	少なくとも１００人の人が出席した。
I wanted to live in Hokkaido, but I couldn't.	私は北海道で暮らしたかったのだが。
I can't speak English, much less German.	私は英語が話せない、ましてドイツ語はだめだ。
I come home from work about seven every day.	私はたいてい７時ころうちに帰ります。
The living room in my new house is very large.	私の新しい家の居間はとても広い。
Not even a day can we live without water.	一日たりとも我々は水なしにはいきられない。
I want to know about your country so much.	とてもあなたの国について知りたいのです。
This is too small a house for us to live in.	これは私達が住むにはせますぎる家だ。
I don't like this one; show me another.	これは気に入らないから別なのを見せてください。
This is a small house, but it will do for us.	この家は小さいが我々には十分です。
This is the house in which she used to live.	ここは彼女がかつて住んでいた家です。
How did you make a living in Tokyo?	あなたは東京でどのようにして生計を立てていたのですか。
I want you to live more like a human being.	あなたのもっと人間らしく生きてほしい。
Not a few people live to be over eighty.	８０歳以上に長生きする人は少なくありません。
"Where do you live?" "I live in Tokyo."	「あなたはどこに住んでるのですか」「東京です」
