What subjects are you taking at school?	君は学校で何の科目を取っていますか。
How many books do you have?	君は何冊の本をお持ちですか。
Do you love music?	君は音楽が好きですか。
You study English.	君は英語を勉強する。
Do you study English?	君は英語を勉強しますか。
What are you driving at?	君は一体何を言おうとしているのか。
You don't like love stories.	君はラブストーリーが好きじゃないんだね。
It would be better for you to read more books.	君はもっと本を読んだ方がよい。
You must study more.	君はもっと勉強しなければならない。
You should have come home before.	君はもっと早く帰るべきだった。
Now that you have come of age, you should know better.	君はもう成人に達したのだから、もっと分別をもたなければならない。
You have to go to the party.	君はパーティーに出なくてはならないよ。
Why can't you come?	君はなぜ来られないのですか。
Why did you not go to the office?	君はなぜ事務所へ行かなかったのですか。
Why do you want to buy this book?	君はなぜこの本を買いたいのですか。
What do you need the money for?	君はなぜこの金が必要なんだ。
Why did you use up all the money?	君はなぜお金を使い果たしたのか。
Why did you use up all the money?	君はなぜお金をすべて使い果たしたのか。
How long have you been in Japan?	君はどれほど日本にいますか。
You're Tom's friend, aren't you?	君はトムの友人だね。
Why don't you try to get your money back?	君はどうして自分の金を取り戻そうとしないのか。
All you have to do is to join us.	君はただ私たちと一緒に来ればよいのだ。
You have many books.	君はたくさんの本を持っている。
Did you buy it on the black market?	君はそれをヤミで買ったのか。
What did you open it with?	君はそれをなにで開けましたか。
You must return the book to him.	君はその本を彼に返さねばならない。
You may keep the book.	君はその本を持っていていいよ。
Will you take on the job?	君はその仕事を引き受けますか。
You must go through with your plan.	君はその計画をやり通さなければならない。
You may as well say so.	君はそう言うほうがよい。
You've got it in one. That's right.	君はすぐに分かったんだね。そのとおりだよ。
You must read this book.	君はこの本を読まねばならない。
Do you know what this box is made of?	君はこの箱が何で作られているかを知っています。
All you have to do is sign this paper.	君はこの書類に署名をしさえすればよい。
How did you come by this money?	君はこのお金をどうやって手に入れたのか。
You have only to sign your name here.	君はここに署名しさえすればよい。
All you have to do is sign your name here.	君はここに署名しさえすればいい。
You can study here.	君はここで勉強できる。
How long did it take you to drive from here to Tokyo?	君はここから東京まで車で行くのにどのくらい時間がかかりましたか。
You haven't any money.	君はお金を持っていません。
Haven't you got any money?	君はお金をいくらかお持ちではありませんか。
How long have you been living in Kobe, then?	君はいつから神戸に住んでいるの。
How much money do you want?	君はいくらお金がほしいのですか。
You are right in a way.	君はある意味では正しい。
Are you doing what you think is right?	君は、自分で正しいと思うことをやっているのか。
You are the only man in the world that I can call my friend.	君は、私が私の友人と呼べる世界でただ一人の人です。
You may as well tell me all about it.	君は、それについてすべてを私に話したほうがいい。
Please go on with your story.	君の話を続けて下さい。
Your room is out of order.	君の部屋は乱雑だね。
You should know better at your age.	君の年齢ならもっと思慮分別があってしかるべきだ。
You should know better at your age.	君の年齢なら、もっと分別があるべきだ。
How many schools are there in your city?	君の町にいくつ学校がありますか。
Your loving friend.	君の親友より。
Write your address here.	君の住所をここにお書きなさい。
Compared with yours, my car is small.	君の車と比べれば、ぼくの車は小さい。
I think your work is all right.	君の仕事は申し分ないと思う。
I think you're right.	君の言うとおりだと思うよ。
I can not make out at all what you say.	君の言うことは全く理解することができない。
I can not make out at all what you say.	君の言うことは全く分からない。
You may be right.	君の言うことは正しいかもしれない。
What you say is right.	君の言うことは正しい。
You are off the point.	君の言うことはピントがはずれている。
Tell me about your plan.	君の計画について話しなさい。
Do you know what you're asking?	君の求めてるものがどんなものかしってるか。
How many rooms are there in your house?	君の家には部屋がいくつありますか。
I'll study your report.	君のレポートを読んでおきましょう。
I don't know what to make of your actions.	君のやることには判断に苦しむよ。
I think what you're doing is right.	あなたのやっていることは正しいと思う。
What's new with you? How is your new job working out?	君のほうは変わりはないですか。新しい仕事はどんな具合ですか。
I'll give you a call before I visit you.	君のところへ行く前に電話をかけます。
I'll come to your place.	君のところに行くよ。
I love you.	君のことが好きなんだ。
How many are there in your class?	君のクラスの生徒は何人ですか。
I want you to go to the post office.	君に郵便局へ行ってもらいたい。
You have many caring friends.	君には心配してくれる友達がたくさんいる。
You have a gift for music.	君には音楽の才能がある。
You have a good friend in me.	君にはぼくというよい友達が居る。
You have no right to say so.	君にはそういう権利が無い。
I can't keep up with you.	君についていけない。
How can you say that?	君にそんなことを言う資格があるのか。
Didn't I tell you so?	君にそう言わなかったかい？
I'll give you this money.	君にこのお金を上げよう。
I can't think of life without you.	君なしの生活なんて考えられない。
You and I are good friends.	君と僕は仲よしだ。
You and I are the same age.	君と僕とは同じ年だ。
You and I are the same age.	君と僕とは同い年だ。
You and I are very good friends.	君と私はとても仲がいい。
I don't like both of you going to such a place.	君たち二人がそんな場所へ行くことを私は好まない。
How old will you be next year?	君たちは来年何歳になりますか。
You're the best man for the job.	君こそその仕事に最適任だよ。
You're the best man for the job.	君こそその仕事に最も適任だよ。
Well may you ask why!	君が理由を聞くのも当然だ。
What would you do if you were in my place?	君が僕の立場に立たされたらどうするかね。
What would you do if you were in my place?	君が僕の立場にあったら、どうするかね。
What would you do if you were in my place?	君が僕の立場だったら、どうするかね。
I would like you to think about what you would have done in my place.	君が僕の立場だったら、どうしたか考えてほしい。
What would you do in my place?	君が僕の場合だったらどうするつもりだい。
It is not good that you did not ask her name.	君が彼女の名前を尋ねなかったのはよくない。
Does he know that you love him?	君が彼を愛している事を彼は知っていますか。
How much is the car you are planning to buy?	君が買う予定をしている車はいくらですか。
Do what you think is right.	君が正しいと思うことをしなさい。
Tell me when you will call me.	君が訪ねる時間を教えて下さい。
I don't like you any more than you like me.	君が私を好きでないのと同様私も君を好きでない。
I love you more than you love me.	君が私を愛している以上に私は君を愛している。
I love you more than you love me.	君が私を愛しているよりもおおく私は君を愛している。
I don't have as much money as you think.	君が思っているほど大してお金を持っていない。
I'll help you so long as you do your best.	君が最善を尽くすかぎりは君を援助してあげよう。
You must go.	君が行くのだ。
I love you.	君が好きだ。
He will be studying when you get up.	君が起きるころには彼は勉強しているよ。
I would do it in a different way than you did.	君がやったのと違うやり方で僕ならするだろう。
Tell me when you will call me.	君がたずねて来る時間を教えてください。
It is right that you should write it.	君がそれを書くのは正しい。
Since you say so.	君がそう言うんだから。
I can't allow you to do that.	君がそうすることを許すわけには行かない。
I just came up with the word.	偶然その単語にであったわけです。
Open your book to page nine.	九ページを開きなさい。
Is there a table available for two on Friday?	金曜日、２人分予約できますか。
Give me your money.	金出せよ。
I should have taken the money.	金を選ぶべきだった。
Some people look down on others because they have less money.	金をそれほど持っていないという理由で他人を軽べつする人もいる。
Don't ask for money.	金をくれというな。
Money comes and goes.	金は天下の回りもの。
I have a little money.	金は少しある。
I have little money.	金は少ししかない。
I have little money.	金はいくらも持ってない。
I have some money with me.	金はいくらかあります。
The end of money is the end of love.	金の切れ目が縁の切れ目。
I have no money on me.	金の持ち合わせがない。
I'm not pressed for money.	金には困っていないよ。
Why don't you come to my house one of these days?	近いうちに私のところへ来ませんか。
We'll visit you one of these days.	近いうちにお宅にうかがいます。
I'm thinking of visiting you one of these days.	近いうちにあなたを訪ねようかと思っています。
I gave him what little money I had.	僅かながらの私の持っていたお金を全部彼に与えた。
I made the best of my small room.	狭い部屋をせいぜい広く使った。
Open your texts to page 50.	教科書の５０ページを開きなさい。
My education has made me what I am.	教育のおかげで私は今日のようになった。
You should visit Kyoto.	京都を訪問するべきだよ。
Kyoto is not as large as Osaka.	京都は大阪ほど大きくない。
Kyoto is visited by many people every year.	京都は、毎年多くの人々に訪れられます。
There are many places to visit in Kyoto.	京都には訪問すべき都市が多い。
There are many places to visit in Kyoto.	京都には訪れる場所がたくさんあります。
Kyoto has many universities.	京都には多くの大学がある。
Kyoto has many places to see.	京都には見るべき場所がたくさんある。
There are many places to see in Kyoto.	京都には見るべきところが多くある。
I ran into an old friend.	旧友に出くわした。
Old friends called on me.	旧友が訪ねてきた。
The printer needs paper.	給紙トレーに紙が入ってないよ。
Ask, and it shall be given you.	求めよ、さらば与えられん。
I haven't seen him for a long time.	久しく彼に会わない。
I haven't seen you for a long time.	久しく会っていませんね。
Mr Yoshida is at home in French history.	吉田君はフランスの歴史が詳しいです。
Experience without learning is better than learning without experience.	亀の甲より年の功。
Do you know how to use a personal computer?	貴方はパソコンの使い方を知っていますか。
Mr Smith studied Chinese history.	スミスさんは、中国史を勉強していました。
You are my best friend.	貴方は、大親友です。
You study English.	貴方は、英語を勉強します。
What's your home address?	貴方のお宅の住所はどこですか。
How did she tell them?	彼女はそれをどのようにして知らせたのですか。
Take care.	気を付けてね。
I didn't know you cared!	気を使ってくれてどうも。
It's all right.	気にしなくていいんですよ。
Why don't you look in on Mr Anderson on your way back?	帰る途中にアンダーソン氏をちょっと訪ねたらどうですか。
I'll call by at the post office on the way home.	帰りがけに郵便局に寄るよ。
How long do you want it for?	期間はどのくらい？
I'll give you as many as you like.	幾つでも好きなだけ上げましょう。
I'm willing to help him.	喜んで彼の助けになります。
I try.	頑張ってみる。
Give me any books you have on the subject.	関係のある本はどんなものでもください。
That was a close call.	間一髪！危ないところでした。
It was not long before the news came.	間もなくその知らせが来た。
I ran in order to be on time.	間に合うように走ってきたのです。
Send me the account.	鑑定書を送ってください。
Check, please.	勘定書を持ってきてくれ。
May I have the check, please?	勘定をお願いします。
The Kamo runs through Kyoto.	鴨川は京都市を貫流している。
Kasai was credited with 30 saves.	葛西は３０セーブをあげた。
School will open on Monday.	学校は月曜日に始まります。
Does school start at eight-thirty?	学校は８時半に始まりますか。
I called at Nancy's house on my way home from school.	学校の帰り道、ナンシーの家に立ち寄りました。
Why are you here when you should be in school?	学校にいるはずのおまえがなぜこんな所にいるのか。
What subjects do you study at school?	学校ではどんな科目を勉強しますか。
The more you learn, the more you want to.	学べば学ぶほどますます学びたくなる。
I will get even with you some day.	覚えていろよ。
I did write to him.	確かに書きましたよ。
I did see him.	確かに会いました。
He did not get any game.	獲物がとれなかった。
I like Chinese food in general.	概して私は中華料理が好きだ。
Open up.	開けてくれ。
You are making history.	皆さんは歴史をつくっています。
You have to pay the price.	回ってきたんだよ。
The company was in want of money.	会社はお金を必要としていた。
Could I have the check?	会計をお願いします。
All the members were present.	会員は全員出席した。
When did they register the names of the members?	会員の名前をいつ登録したのか。
We Japanese come of age at twenty.	我々日本人は二十歳で大人の年齢になる。
We had better do what other people do.	我々も世間なみのことをしなくちゃ。
We must provide for old age.	我々は老後に備えなければならない。
We must think about the community.	我々は地域社会について考えないといけない。
We haven't known each other long.	我々は知り合ってからまだ日が浅い。
We had to learn to read the word.	我々は単語の読み方を覚えなければならなかった。
We set to work with all our might and main.	我々は全力をつくして仕事に取り掛かった。
We must keep up with the times.	我々は時勢に遅れずに付いて行かなければならない。
We returned to Honolulu on April 2.	我々は四月二日にホノルルへ戻った。
We must do our job as best as we can.	我々は最善を尽くしてその仕事をしなければならない。
We'll go for a drive next Sunday.	我々は今度の日曜日にドライブに出かけるつもりです。
We traveled around the country by car.	我々は国中を車で旅行した。
We need action, not words.	我々は言葉ではなく行動が必要なのだ。
We learn by experience.	我々は経験によって学ぶ。
We learn much from experience.	我々は経験から多くを学ぶ。
We live in the age of technology.	我々は科学技術の時代に住んでいる。
We must know about it.	我々はどうしてもそれを知らなければならない。
We made him go there.	我々はそこに彼を行かせた。
We have come a long way.	我々はずっと努力してきた。
We've been living here since July.	我々はここに７月以来住んでいる。
We looked for it high and low.	我々はあちこちそれを探した。
We must make do with what we have got.	我々は、手持ちのもので間に合わせなければならない。
All we have to do is to try our best.	我々は、最善を尽くしさえすればよいのだ。
Our city has one third as many people as Tokyo.	我々の市は東京の３分の１の人口です。
Our school is very close to the park.	我々の学校は公園のすぐ近くにある。
Our company makes use of the Internet.	我々の会社ではインターネットを利用している。
Our class has increased in size.	我々のクラスは規模が大きくなった。
I'm the witchfinder general.	我こそ魔女がりの大将。
Our company has a long, long history.	我が社はとても長い歴史をもっています。
There's no place like home.	我が家ほどいいものはない。
We haven't had a price increase in the last five years.	過去５年間価格を上げてません。
Give me a light, would you?	火を貸してくれませんか。
Kabuki is an old Japanese art.	歌舞伎は古くからの日本の芸術だ。
If you are free, come around to see me.	暇なら遊びにおいでよ。
I do not like science.	科学は好きではありません。
There is no place like home.	家程良いところはない。
All my family is very well.	家族一同元気です。
All the family got out of the car.	家族は全員車から降りた。
My family are all well.	家族は全員元気です。
We are a family of four.	家族は４人です。
How is your family?	家族の皆さんはお元気？
I'd like to call my family.	家族に連絡したいのですが。
May I ask about your family?	家族について聞いてもいいですか。
It's great to have a family.	家族がいるって素晴らしいことです。
If it were not for my family, I would give up this job.	家族がいなければ、私はこの仕事を辞めるだろう。
There are a great many people trying buy houses.	家を買おうとしている人が非常に多くいる。
Could you please drive me home?	家まで送ってくださいませんか。
I'll drive you home.	家まで車で送りましょう。
Shall I drive you home?	家まで車でお送りしましょうか。
We have two cats; one is white, and the other is black.	家はねこが２匹います。１匹は白で、もう１匹は黒です。
There was much food in the house.	家には食物がたくさんあった。
There are 5 computers in the house, but 2 of them aren't any use.	家にはパソコンが５台あるが、内２台は役立っていない。
How long does it take to go to the office from your home?	家から会社までどれくらい時間がかかりますか。
The price does not include the case.	価格には箱代は含まれていません。
There were hundreds of people there.	何百人もの人がそこにいた。
I haven't seen him for years.	何年も彼に会ってません。
How long have you been studying English?	何年くらい英語を勉強していますか。
How long will you be gone?	何日ぐらい行くの。
About how many days will it take to get there?	何日くらいで着きますか。
How long will it take?	何日ぐらいかかりますか。
Having visited Rome many times, he knows about it well.	何度もローマを訪れたことがあるので、彼はローマをよく知っている。
I've seen one many times.	何度もそれを見ました。
Thousands of people were there.	何千もの人々がそこにいた。
Thousands of people visited the city.	何千もの人がその町を訪れた。
How many people in your party?	何人様ですか。
How many people are there in your family?	何人家族ですか。
How many people are in this room?	何人の人々がこの部屋にいますか。
How many people?	何人ですか。
What time does it close?	何時閉店ですか。
What time does it open?	何時開店ですか。
What time did she check out of the hotel?	何時に彼女はホテルを出ましたか。
What time does it start?	何時に出発しますか。
What time will the game start?	何時に試合は始まるでしょうか。
What time does it start?	何時に始まるの？
What time does it open and close?	何時に開いて何時に閉まりますか。
What time should I check in?	何時にチェックインすればいいですか。
When should we check out?	何時にチェックアウトしなければならないの？
Do you know what time the shop is closed?	何時にその店が閉められるか知っていますか。
What time will be right for you?	何時がご都合よいでしょうか。
What time do you start check-in?	何時からチェックインできますか。
How old are you?	何歳ですか。
Why didn't you tell her?	何故彼女にいわなかったんだ？
Why do you think so?	何故そう思うの？
Why didn't you come?	何故来なかったの？
How many times do I have to tell you?	何回言ったらわかるの？
What're you saying?	何を言ってるの！
I don't know what to say.	何を言ったら良いかわからない。
I don't know what to say.	何を言えばよいのか分からない。
What are you driving at?	何をなさるつもりですか。
I must think about what to do.	何をすべきか、考えなければならない。
Tell me what to do.	何をしたらいいか言って下さい。
What's taking you so long?	何をぐずぐずしてるの？
Who are you to tell me to get out?	何の権限で私に出て行けと言うのだ。
Just tell me what you'd like me to do.	何なりと言って下さい。
I didn't know what to say.	何と言っていいかわからなかった。
I can't say.	何とも言えない。
I just don't know what to say.	何とも言いようがないなあ。
I must save her at all costs.	何としても彼女を救わねばならない。
A Mr. So and So came today.	何とかさんという人が今日来ました。
Hmmm, how shall I say this?	何て言ったらいいのかなあ。
Why me?	何でわたしなの？
What did you say?	何だって。
I've been going out with her for months.	何ヶ月か彼女と交際している。
Tell me what you want.	何が欲しいか言ってごらん。
There must be another way.	何か別の方法があるに決まってる。
I'll give you a present.	何かプレゼントをあげるね。
Why do you think so?	何があなたにそう考えさせるのですか。
No music, no life.	音楽がない人生は無い。
Don't make light of me.	俺をなめるな。
I'm playing a TV game.	俺はテレビゲームをしている。
Be my right-hand man.	俺の片腕となって手助けしてくれ。
Is Okayama a big city?	岡山は大きな都市ですか。
Mr. Oh came to Japan to study Japanese.	王さんは日本語を勉強するために日本へ来ました。
Yokohama is the second largest city in Japan.	横浜は日本で二番目に大きい都市である。
Yokohama is one of the largest cities in Japan.	横浜は日本で最大の都市の一つだ。
Yokohama is a city where more than three million people live.	横浜は３００人以上の人が住む都市だ。
Will you give me a light?	煙草の火を貸してくれませんか。
Action!	演技はじめ！
You had to study English.	英語を勉強しなければならなかった。
I'm studying English.	英語を勉強しています。
I've studied English for five years.	英語を５年習いました。
You must study English every day.	英語は毎日勉強しなければなりません。
English is studied in Japan.	英語は日本で勉強されています。
English is studied all over the world.	英語は世界中で学ばれている。
English is used in every part of the world.	英語は世界中いたるところで使われている。
English is studied all over the world.	英語は世界のいたるところで勉強されています。
English is studied all over the world.	英語は世界のいたるところで学習されている。
English is used by many people.	英語はたくさんの人々によって使われている。
I'll get up your drive for English study.	英語の勉強のやる気をおこさせる。
How many English words do you know?	英語の単語を何語知っていますか。
How many English words do you know?	英語の単語をどれくらい知っていますか。
I was called on in English class.	英語の時間に当てられた。
If only we didn't have to take a test in English.	英語の試験さえなければいいのに。
