Helen is seventeen years old.	ヘレンは１７歳です。
Perry visited Uraga in 1853.	ペリーは浦賀に１８５３年に来航した。
Peter loves Jane.	ペーターはジェーンを愛している。
Fred's house has five rooms.	フレッドの家には部屋が５つあります。
This is a present for you.	プレゼントをどうぞ。
Come and join us.	ふるってご参加ください。
The French are said to love art.	フランス人は芸術を愛好すると言われている。
Why don't you study French?	フランス語を勉強してみてはどうですか。
She acted as if she knew French well.	フランス語をよく知っているかのように振る舞った。
I'd like to know how to send money to France.	フランスへの送金の仕方を教えて欲しいんですが。
France is to the south of England.	フランスは英国の南にある。
Mr Ford is all right now.	フォード氏はもう大丈夫です。
I'd like to travel first-class.	ファーストクラスでお願いします。
"Come and see", said Philip.	ピリポは「来て、そして、見なさい」と言った。
In a word, he is a flatterer.	ひとことで言えば、彼はおべっか使いだ。
It doesn't pay to play video games.	ビデオゲームは割に合わない。
Shall I ask Peter for help?	ピーターに手伝ってもらいましょうか。
He says he has been to Hawaii before.	ハワイに行ったことがあると彼は言う。
When you come to Hawaii, I'll show you around.	ハワイにいらしたらご案内します。
He says he has been to Hawaii before.	ハワイにいった事があると彼が言う。
Tell me what you did in Hawaii.	ハワイで何をしたか教えてください。
Paris is one of the largest cities in the world.	パリは世界最大の都市の一つである。
Who acts Hamlet?	ハムレットの役は誰がやるのですか。
Can you quote a line of Hamlet?	ハムレットから１行引用できますか。
I ran into an old friend.	ばったり昔の友達に会った。
Get to the point!	はっきり言えよ。
You've run through all the butter?	バターを全部使ってしまったの？
I'd like some more butter.	バターをもう少しください。
Personal computers are of great use.	パソコンはとても役に立つ。
Do you know how to use a personal computer?	パソコンの使い方を知っていますか。
At first, I didn't like him.	はじめは彼が好きでなかった。
I'm looking for a part-time job.	バイト探してるんだ。
Bert doesn't go to high school, does he?	バートは高校に通っていませんよね。
How did the party go?	パーティの進み具合は。
I had to call off the party.	パーティーを中止しなければならなかった。
Why don't you have a party?	パーティーを開いたらどうですか。
The party is over.	パーティーは終わった。
A party is a good place to make friends with other people.	パーティーはほかの人と友達になるのにいい場所だ。
When shall we have the party?	パーティーはいつにしましょうか。
How did you like the party?	パーティーはいかがでしたか。
The party was over at nine.	パーティーは９時に終わった。
How did the party go?	パーティーのすすみ具合はどうでしたか。
Are you coming to the party?	パーティーに来ますか。
Come to the party, will you?	パーティーに来なさいね。
He was present at the party.	パーティーに出席した。
Don't you want to go to the party?	パーティーに行きたくないのですか。
I would like to come to your party.	パーティーには是非伺いたく存じます。
Which present shall I take to the party?	パーティーにはどんなプレゼントを持っていきましょうか。
Only six people were present at the party.	パーティーには６人しか出席しなかった。
Over 100 people were present at the party.	パーティーには１００人以上が参加していた。
Can you come to the party?	パーティーにいらっしゃいませんか。
We'll run into her at the party.	パーティーで彼女に会うかもしれない。
Love to party!	パーティーが大好き。
Is there a Percy in your class?	パーシーという人が君の組にいますか。
I'll look you up when I visit New York.	ニューヨークへ行ったら訪ねるよ。
I'll look you up when I visit New York.	ニューヨークへ行ったら君を訪ねるよ。
New York is a big city.	ニューヨークは大きな都市だ。
New York is the biggest city in the world.	ニューヨークは世界で一番大きな都市だ。
If you visit New York, you've just got to come and see our house.	ニューヨークに来たら、ぜひ私たちの家に遊びに来てください。
I'll look you up when I visit New York.	ニューヨークにいったら君をたずねるよ。
The New York Times reviews her gallery all the time.	ニューヨークタイムズは彼女のギャラリーにいつも取材にくるんだから。
What should I say?	なんと言ったらいいのか・・・。
You must try and come to the party.	なんとかしてパーティーに来ないといけませんよ。
What a friend you are!	なんて友人だ。
Why do I have to do that?	なんで僕がやらなくちゃいけないの。
What a small world!	なんて世界は狭いのでしょう。
I don't know what to say.	なんて謝ったらいいかなあ。
What did you say?	なんて言ったの？
Nancy was to show up at the place, but she didn't make it.	ナンシーはその場所に来ることになっていましたが、来ませんでした。
Well, you may be right.	なるほど、君の言うとおりかもしれない。
What are you driving at?	なにが言いたいのですか。
No, it's second hand.	なに、中古だよ。
Nathanael asked Jesus, "How do you know me?"	ナタナエルはイエスに言った。「どうして私をご存じなのですか」
Why didn't you note down the points?	なぜ要点を書き留めなかったのか。
Why should she have sent for him?	なぜ彼女は彼を呼びにやる必要があったのか。
Why did she ask for our help?	なぜ彼女は我々の助けを求めたのだろう。
Why did he come with her?	なぜ彼は彼女といっしょに来たのですか。
Why do you think he said so?	なぜ彼はそう言ったと思いますか。
Why is he here?	なぜ彼はここにいるのですか。
Can you make out why he won't go with us?	なぜ彼が我々と同行しないのかわかりますか。
Why did you come to Japan?	なぜ日本に来たのですか。
Why do I even care?	なぜ頭から離れない。
Why do many people like John Lennon so much?	なぜ多くの人々がジョン・レノンをそんなに好きなのですか。
Why did I do that?	なぜ私はあんなことをしたのか。
Why do you think I told her about it?	なぜ私がそのことを彼女に話したと思いますか。
I don't know why you don't like him.	なぜ君が彼を嫌いなのか僕にはわからない。
What do you study English for?	なぜ英語を学ぶのですか。
Why did you open the box?	なぜはこをあけたの。
Why do you need to read such a book?	なぜそんな本を読む必要があるのですか。
Why do you say that?	なぜそんな事を言うの。
Why do so many people visit Kyoto?	なぜそんなに大勢の人々が京都を訪れるのですか。
Why did you do that?	なぜそんなことをしたの。
Why do you think that way?	なぜそのように思うのですか。
Tell me why you want to go there.	なぜそこへ行きたいのか、私に教えて下さい。
Tell me why you want to go there.	なぜそこに行きたいのか、私に教えてください。
Why do you say that?	なぜそうおっしゃるのですか。
Why do you work here?	なぜここで働いているのか。
Why not?	なぜいけないか。
Why do you study every day?	なぜあなたは毎日勉強するのですか。
Why do you study English every day?	なぜあなたは毎日英語を勉強するのですか。
Why do you study?	なぜあなたは勉強するのですか。
Why did you go to Tokyo?	なぜあなたは東京に行ったのですか。
I gave him what little money I had.	なけなしの金を彼にあげた。
Well, I loved it.	なかなか良かったよ。
You have a point there.	なかなか味のあることを言うね。
Naoki is as old as Kaori.	ナオキはカオリと同じ年です。
Do you know which book sells well now?	どんな本が今よく売れているか知っていますか。
I wouldn't sell that at any price.	どんな値段であっても私はそれを売りたくない。
Where can you get a part-time job?	どんな所でアルバイトできるの。
Why do you need change?	どんな事で小銭が必要ですか。
Any paper will do.	どんな紙でも結構です。
I must help her at any cost.	どんな犠牲を払っても、彼女を助けなければならない。
How did you come to love her?	どんなふうにして彼女を好きになったのですか。
Even the longest day will have an end.	どんなに長い日にも必ず終わりがある。
The longest day must have an end.	どんなに長い日でも終わりがあるはずだ。
I will not do that for the life of me.	どんなことになっても決してそれはしない。
Why do you need it?	どんなことでそれが必要ですか。
You must not take it on any account.	どんなことがあってもそれを受け取ってはいけない。
I must take back the money at all costs.	どんなことがあってもそのお金を取り返さねばならない。
What's your job?	どんなお仕事ですか。
Study on and on!	どんどん勉強しなさい。
Dorothy isn't in the office.	ドローシーは職場にいない。
How long does it take?	どれ位かかりますか。
Tell her which one to take.	どれに乗ったらよいか彼女に教えなさい。
Take any two cards you like.	どれでも好きなカードを２枚取りなさい。
What do you say to playing cards?	トランプをするのはどうですか。
How about going for a drive?	ドライブはいかがですか。
What do you say to going for a drive?	ドライブに行くのはどう。
What do you say to going for a drive?	ドライブに行きませんか。
How about going for a drive?	ドライブするのはどうですか。
I go to a driving school.	ドライビングスクールに行っています。
It's a problem any way you look at it.	ともかく困ったことだ。
No one but Tom handed in the report.	トムを除いてはだれもレポートを提出しなかった。
Tom drove the car.	トムは車を運転した。
Tom is older than I.	トムは私より年上です。
Tom showed me around the park.	トムは私に公園を案内してくれた。
Tom need not go to school today.	トムは今日学校にいかなくてよい。
Tom is in the house.	トムは家の中に居る。
Tom has no friends to play with.	トムには一緒に遊ぶ友達がいません。
Tom loved Mary, who didn't love him at all.	トムはメアリーを愛していたが、彼女は彼を全く愛していなかった。
Tom says that he can read a French book.	トムはフランス語の本が読めると言っている。
Tom is not as old as you.	トムはあなたほど年をとっていません。
Tom has bought a house which has six rooms.	トムは６部屋ある家を買った。
Tom has a house which has two rooms.	トムは２部屋ある家をもっている。
All but Tom were present.	トムの他はみな出席した。
Tom and I are friends.	トムと僕は友達だ。
Tom and I are good friends.	トムと私はよい友達です。
Tom and John are good friends.	トムとジョンは仲良しです。
It was at Oxford University that Tom studied history.	トムが歴史を研究したのはオックスフォード大学でだった。
I'm thinking about which college might be best for me.	どの大学が私にもっとも適しているかよく考えているところです。
Any paper you read will tell the same story.	どの新聞を読んでも話は同じだろう。
Every country has its own history.	どの国にも歴史がある。
What subject are you good at?	どの教科が得意ですか。
Which subject do you like best?	どの教科が一番好きですか。
Which subject do you like best?	どの学科が一番好きですか。
I like English best of all subjects.	どの科目よりも英語が一番好きです。
Which subject do you like best?	どの科目が一番好きですか。
Which house did you live in?	どの家に住んでいたのですか。
How do you make your money?	どのようにすればお金が手に入りますか。
Can you tell me how to get to Hyde Park?	どのようにしてハイドパークへ行ったらいいか教えてくれませんか。
How can you tell an Englishman from an American?	どのようにしてイギリス人とアメリカ人を区別できますか。
Which credit cards can I use?	どのクレジットカードが使えますか。
How long have you been in Japan?	どのくらい日本にいるんですか。
How long have you been in Japan?	どのくらい日本にいらっしゃいますか。
How long will you be here?	どのくらい滞在しますか。
How big?	どのくらい広い？
How long have you been studying English?	どのくらい英語を勉強していますか。
How much will it cost?	どのくらいの料金がかかりますか。
How long have you been learning English?	どのくらいの期間英語を勉強しているのですか。
How long will it take to get well?	どのくらいで治りますか。
How long has he lived there?	どのくらいそこに住んでいるの。
In any case, you must come here by ten.	とにかくあなたは１０時までにここに来なければなりません。
Does Tony run every day?	トニー君は毎日走りますか。
Tony runs every day.	トニー君は毎日走ります。
How long does Tony run every day?	トニー君は毎日どれぐらい走りますか。
Who does Tony like?	トニー君は誰を好きですか。
Tony has lived in Kumamoto since last year.	トニー君は去年から熊本に住んでいます。
How old is Tony?	トニー君は何歳ですか。
When does Tony study?	トニー君はいつ勉強しますか。
What does Tony do?	トニー君の職業はなんですか。
They are very big.	とても大きいね。
I like it very much.	とても好きです。
I like it very much.	とても気に入ってます。
I want to know about your country so much.	とてもあなたの国について知りたいのです。
Just the same!	どっちでも同じことだ。
Please tell me which to take.	どちらをとったら言いか私に教えてください。
You had better ask him which way to take.	どちらの道を行ったらいいか彼にたずねたほうがいいよ。
Could you tell me which way I should go?	どちらにいったらいいのか教えてくださいませんか。
Say which one you would like.	どちらが欲しいか言ってご覧なさい。
Tell me which you want.	どちらがほしいのか言いなさい。
Who does Toshio like?	としお君は誰が好きですか。
Does Toshio like Sachiko?	としお君は佐知子さんが好きですか。
Where will you visit?	どこを訪れる予定ですか。
What place did you see?	どこを観光しましたか。
By the way, where does he live?	ところで彼は何処に住んでいますか。
Say, Mike. Tell me how to get to your house.	ところでマイク、あなたの家への行き方をおしえてください。
By the way, what is your address?	ところで、君の住所はどこですか。
By the way, how old are you?	ところで、何歳ですか。
Well, I think it's time the real story was told.	ところで、もう本当の話がされてもいい時期だと思うよ。
Where can I park?	どこへ駐車すればいいですか。
Tell him where he should go.	どこへ行ったらよいか電話して。
Please tell me where to go.	どこへ行ったらいいか私に知らせてください。
What papers do you take?	どこの新聞をとっていますか。
Where can I park?	どこに駐車できますか。
Please tell me where to park my car.	どこに駐車したらいいか教えてください。
I asked him where he lived.	どこに住んでいるのですか、と私は彼にたずねた。
Please tell me where you will live.	どこに住むつもりなのか教えてください。
Tell him where he should go.	どこに行ったらよいか彼に聞きなさい。
I'm just another man.	僕はどこにでもいるような男です。
Where can I try this on?	どこで試着できますか。
From time to time, he goes to the library to get new information about books.	ときおり彼は図書館に行き本の新しい情報を得る。
On what account?	どう言うわけで？
It looks as if you're right.	どうやら君の言うことが正しいようだ。
How do you make a box?	どうやって箱を作るのか。
How did you find my house?	どうやって私の家を見つけたのですか。
How did you come by this money?	どうやってこの金を手に入れたのか。
Please make way for him.	どうぞ彼のために道をあけて下さい。
Would you please tell me the way?	どうぞ道を教えてくださいませんか。
May you live long!	どうぞ長生きなさいますように。
Please tell me the way to the XYZ store.	どうぞわたしにＸＹＺストアへ行く道を教えて下さい。
Please have a try.	どうぞやってみて。
Please tell me your address.	どうぞご住所を教えてください。
Please don't bother.	どうぞお構いなく。
Please have a second helping.	どうぞおかわりをして下さい。
Please don't bother.	どうぞおかまいなく。
Please, tell me.	どうぞ、私に話して下さい。
Please write down your name here.	どうぞ、ここにあなたの名前を書いてください。
If you do it at all, try to do it well.	どうせやるからには上手にやるようにしなさい。
What are you driving at?	どうするつもりなのか。
Not knowing what to do, I asked him for help.	どうして良いか分からなかったので、私は彼に助けを求めた。
How is it she does not come?	どうして彼女は来ないのか。
Will you tell me why you like her?	どうして彼女が好きなのか話してくれませんか。
How did you get to know him?	どうして彼を知るようになったのですか。
Why should he think that he knows better than I do?	どうして彼は自分のほうが僕より分別が有ると思うんだろう。
What had kept him from coming to the party?	どうして彼はパーティーに来なかったのですか。
Why don't you come in?	どうして入って来ないのか。
And why do you think that is?	どうして届かないのか分かってる？
Why me?	どうして私なの？
I don't see why I should not do that.	どうして私がそれをしてはいけないのかわからない。
Why were you there?	どうして君はそこにいたのか。
Why did you part with your house?	どうして家を手放したの。
Not knowing what to do, I asked for help.	どうしてよいか分からなかったので私は助けを求めた。
Not knowing what to do, I asked him for help.	どうしてよいかわからなかったので、私は彼に助力を求めた。
At all costs, I want to live in America.	どうしても私はアメリカに住みたい。
Why not?	どうしてダメなの？
What do you want such an old car for?	どうしてそんなに古い車がほしいのですか。
Not knowing what to do, he asked me for help.	どうしていいのかわからなくて、彼は私に助けを求めた。
How come you didn't come to the party?	どうして、あなたはパーティーに来なかったのですか。
Not knowing what to do, I asked him for help.	どうしたらよいかわからなかったので、私は彼に助力を求めた。
Not knowing what to do, I asked for help.	どうしたらいいのかわからなかったので助けを求めた。
Can you tell me the time, please?	どうか私に時間を教えてくれませんか。
Please don't bother about me.	どうか私に気を使わないで下さい。
Please tell me about your problem.	どうかあなたの問題について私に話して下さい。
Please write about your real experience.	どうかあなたの実体験のことを書いて下さい。
As I had seen him before.	というのも、以前彼に会ったことがあったからだ。
Don't keep the TV on!	テレビをつけっぱなしにするな！
The TV news program help us keep up with the world.	テレビのニュース番組は我々が世界に遅れないでついていく助けになる。
The TV doesn't work.	テレビがつかないよ。
Please show me the TV Guide.	テレビガイドを見せて下さい。
But we call him Tony at home.	でも家ではトニーと呼んでいるのですよ。
But what will you do if he doesn't come?	でも、来なかったらどうするの。
But they are all people.	でも、みんな人間です。
I just got by on the test.	テストはなんとかなった。
How was your test?	テストはどうだった？
Looks like you didn't study much for the test.	テストの勉強、あんまりしなかったようだね。
You can do better on your tests.	テストでもっといい成績がとれる。
I will help as much as I can.	できる限り手伝います。
You should read as many books as you can.	できるだけ多くの本を読むべきである。
Read as many books as you can.	できるだけ多くの本を読みなさい。
I will help as much as I can.	できるだけお助けします。
I'll support you as much as I can.	できるだけあなたを支持します。
Don't park your books on the table.	テーブルの上に本を置くな。
There is a book on the table.	テーブルの上に本があります。
How many books are there on the table?	テーブルの上に何冊の本がありますか。
It's under the table.	テーブルの下よ。
Just tell Mr Tate that Helen Cartwright is here to see him.	テイトさんにヘレンが会いにきているとだけ伝えて下さい。
Keep the change!	つりは要らんよ。
That is to say, on May 10th.	つまり、５月１０日のことだ。
How many cars does the Tsubasa have?	つばさの客車は何両ですか。
Don't buy on credit.	つけで買ってはいけません。
At last, I completed my work.	ついに私は仕事を完成した。
Many a little makes a mickle.	ちりも積もれば山となる。
Just run down to the post office, won't you?	ちょっと郵便局までひとっ走りしてくれませんか。
I'm going out for a while.	ちょっと出かけてきます。
Give me a hand, will you?	ちょっと手を貸してくれませんか。
Please give me a hand.	ちょっと手を貸して。
I'm just looking around.	ちょっと見ているだけです。
Can you take over driving for a while?	ちょっと運転を代わってくれないか。
Can I have a word with you?	ちょっとお話ししてもいいですか。
I was just thinking of a new job.	ちょうど新しい仕事のことを考えていたんだ。
I've got my friend on the line right now.	ちょうど今電話で話し中なんだ。
I'm just about to check in.	ちょうどチェックインするところです。
Just then she came into my room.	ちょうどその時彼女が私の部屋に入ってきた。
I don't care.	ちっとも構いませんよ。
Check in, please.	チェックインをお願いします。
Can I check in now?	チェックインできますか。
I'd like to check in, please.	チェックインしたいのですが。
I'd like to check out.	チェックアウトしたいのですが。
What time do we have to check out?	チェックアウト・タイムは何時ですか。
The team is up for the game.	チームは試合に向けて気合いが入っている。
Dan likes to make model cars.	ダンは模型自動車を作ることが好きだ。
The days are getting longer and longer.	だんだん日が長くなっています。
Every one wants to live free from care.	だれでも苦労の無い生活を望んでいる。
Who cares?	だれが気にするもんか。
Who cared?	だれが気にかけたでしょう。
Just take my word for it.	だまされたと思ってやってみなさい。
He may well be right.	たぶん彼の言うことはただしいだろう。
I should say he won't come.	たぶん、彼は来ないでしょう。
Even if she comes to see me, tell her I am not at home.	たとえ彼女が会いに来ても、私は留守だと言ってくれ。
Even if I have to sell my house, I'll keep my business going.	たとえ家を出る事になっても事業は続ける。
Try as you may, you can't do it in a day.	たとえどんなにやってみても、一日では出来ない。
You must do it even if you don't want to.	たとえしたくなくても君はそれをしなくてはならない。
You must do the work, even if you do not like it.	たとえいやでもその仕事はしなければいけないよ。
Tatsuya has some friends who live in New York.	タツヤにはニューヨークにすんでいる友人が数人います。
I love you.	だって好きなんだもの。
I want you to take back what you said just now.	たった今言ったことを取り消してもらいたい。
