Don't look into my room.	私の部屋を覗かないでよ。
May I see the room, please?	私の部屋を見せていただけませんか。
I'll show you my room.	私の部屋へご案内しましょう。
My room is three times as large as yours.	私の部屋は君の部屋の３倍の広さだ。
My room is very small.	私の部屋はとても狭い。
Don't come into my room.	私の部屋の中へ入ってこないで。
Come into my room.	私の部屋に入りなさい。
There is no TV in my room.	私の部屋にはテレビがない。
There are many books in my room.	私の部屋には、たくさんの本があるんです。
I take back my words.	私の発言を取り消します。
Can you tell my age?	私の年がわかりますか。
Write to him for me, Jan.	私の代わりに彼に手紙を書いて下さい、ジャン。
Will you go in place of me?	私の代わりにいってくれませんか。
I'll help you as long as I live.	私の生きている限り、君を援助しよう。
My life is coming to an end.	私の人生も終わろうとしています。
I'll tell you my story.	私の身の上話をしましょう。
The living room in my new house is very large.	私の新しい家の居間はとても広い。
Please write down my address.	私の住所を書き留めておいて。
My hand came into contact with her hand.	私の手が彼女の手に触れた。
My car is not running.	私の車は故障している。
My time is running out.	私の時間は切れかかっている。
Please don't go out of your way on my account.	私の事はお構いなく。
From my point of view, Australia is one of the best countries in the world.	私の視点から言えば、オーストラリアは世界で最高の国の１つです。
Please give me a hand with my job.	私の仕事を手伝って下さい。
The food in my country is not very different from that of Spain.	私の国の食べ物はスペインのとあまり変わらない。
Do it the way I told you to.	私の言ったとおりにやりなさい。
That's just what I was going to say.	私の言わんとするところもそこです。
You are to do as I tell you.	私の言った通りにしなさい。
I'm right, aren't I?	私の言う通りだろう？
This is all I have to say.	私の言い分はこれだけだ。
What I want to say is this.	私の言いたいことはこのことだ。
My plan is different from yours.	私の計画は君のとは違う。
My plan is to study in Australia.	私の計画はオーストラリアで勉強することです。
My plan is different from yours.	私の計画はあなたのと違う。
I am paid by the week.	私の給料は週給です。
She called while I was out.	私の外出中に彼女は来た。
Any phone calls for me while I was out?	私の外出中に電話はあった？
My family goes to Italy every year.	私の家族は毎年イタリアに行きます。
My family is a large one.	私の家族は大勢です。
I have a large family.	私の家族は大人数だ。
My family is a large one.	私の家族は大家族である。
My family are all well.	私の家族は皆元気です。
My family are all in good health.	私の家族はみんな健康です。
My family are all very well.	私の家族はみんなとても元気です。
My family is not very large.	私の家族はそれほど大家族ではない。
My family have lived here for twenty years.	私の家族はここに２０年間住んでいます。
There are four people in my family.	私の家族は４人家族です。
There are four members in my family.	私の家族は４人います。
Please see my people.	私の家族に会ってください。
Come to my house.	私の家へ来なさい。
My family is a large one.	私の家は大家族だ。
My house is big.	私の家は大きい。
My house is close to the park.	私の家は公園のすぐ近くにある。
My family is an old one.	私の家は旧家です。
My house is a long way from here.	私の家はここから遠い。
My home is in the country.	私の家はいなかにあります。
How did you find my house?	私の家はいかがでしたか。
My house is like yours.	私の家は、君の家と似ている。
When you can come to my house, please call me first.	私の家に来れる時は、まず電話をして下さい。
Please come to my house.	私の家に来て下さい。
My house is covered by insurance.	私の家には火災保険がかけてある。
How long does it take you to go home from my house?	私の家からあなたの家に帰るのにどのくらい時間がかかりますか。
This is my email address.	私のメールアドレスです。
I, for my part, don't care.	私のほうはかまわない。
Would you like to come to my party?	私のパーティーに来ませんか。
Will you make room for me?	私のために場所をかけてくれませんか。
Please note my words.	私のことばを注意して聞いてください。
Didn't I give you some money?	私のお金を少しあげたじゃありませんか。
My family is small.	私のうちは小人数です。
My family are all well.	私のうちはみな元気です。
We call him Goro-san.	私のうちでは、「五郎さん」って呼ぶんです。
My house looks to the south.	私の家は南向きです。
My e-mail address has been changed.	私のｅ―ｍａｉｌアドレスが変わりました。
Will you tell me?	私に話してくれませんか。
I have no family to provide for.	私に養うべき家族がありません。
Give me some water, please.	私に水を少しください。
Please give me some water.	私に水をくれませんか。
My job will only last two years at most.	私に仕事はせいぜい２年しかもたないよ。
You might have told me.	私に言ってくれてもよかったのに。
It was her that told me.	私に言ってくれたのは彼女だった。
Please tell me your name.	私に君の名前を教えてください。
It is no use asking me for money.	私に金をせがんでもむだだ。
My family is a large one.	私に家族は大勢です。
Give me the same, please.	私にも同じものをください。
If I had the money, I would travel around the world.	私にもしそのお金があれば、世界一周旅行をするだろう。
I have no family to provide for.	私には養うべき家族がありません。
I don't have any family to support.	私には扶養家族はいません。
I didn't know what to say to him.	私には彼に何といったら良いか分からなかった。
I didn't know what to say to him.	私には彼になんて言ったら良いか分からなかった。
I can't make out what he says.	私には彼が何を言っているのか解らない。
He must be the one for me.	私には彼が一番なの。
I can't do as he told me to.	私には彼がしろと言ったようにはできない。
I am free from care.	私には心配がない。
I have some friends to help.	私には助けなければならない友達がいる。
I have a friend who lives in Sapporo.	私には札幌に住んでいる友達がいます。
I have no other friend than you.	私には君よりほかに友達がいない。
I have no money with me.	私には金の持ち合わせがない。
I have more money than I had last year.	私には去年より多くのお金があります。
I have a family.	私には家族がいます。
I have some American friends.	私には何人かのアメリカ人の友達がいます。
I have a friend living in London.	私にはロンドンに住んでいる友人がいる。
You are free to use this car, because I have another one.	私にはもう一台車があるので、君はこの車を自由に使えます。
I've got no more to do.	私にはもうこれ以上することがない。
What size do you think I take?	私にはどのサイズが合うでしょうか。
I have an American friend named Tony.	私にはトニーという名のアメリカ人の友人がいます。
I'm game for it.	私にはその気がある。
I have a friend who lives in England.	私にはイギリスに住む友人がいる。
I have a friend who lives in America.	私にはアメリカに住んでいる友人がいる。
I have a friend who works for NASA.	私にはＮＡＳＡで働いている友達がいます。
I don't see what he says.	私には、彼のいうことがわからない。
For me, time is not money.	私には、時間はお金ではありません。
Please tell me what you know about it.	私にそれを知らせて下さい。
Don't tell me what to do or not to do.	私にしろとか、するなとか命じないで下さい。
Don't ask me for money.	私にお金をせびらないでくれ。
Will you sell your car to me?	私にあなたの車を売ってくれませんか。
Will you tell me how to get to your house?	私にあなたの家への行き方を教えてくれませんか。
Why don't you come with me?	私と一緒に来ない？
We are doing business with many countries.	私どもは多くの国と商売をしています。
I'm sending you $12 on my order No. 2345 by check.	私どもの注文書２３４５の代金として１２ドルを小切手にてお送りします。
I would see Mr White.	私だったらホワイト氏にあってみるね。
The guide who took us there was only ten years old.	私たちをそこに案内してくれたのは、ほんの１０歳の子だった。
We must provide for our old age.	私たちは老後に備えなければならない。
We are good friends.	私たちは良い友達です。
We will be living here next month.	私たちは来月ここに住んでいることでしょう。
We visited Nikko the next day.	私たちは翌日日光を訪れた。
We're old friends.	私たちは幼なじみです。
We will have to call on our friends to help us.	私たちは友人に援助を求めなければならないだろう。
We study English at school every day.	私たちは毎日学校で英語を勉強する。
We study English every day.	私たちは毎日英語を学ぶ。
We kept our books closed.	私たちは本を閉じていた。
We must keep the law.	私たちは法の定めに従わなければならない。
We must keep law and order.	私たちは法と秩序を維持しなければならない。
We visited our old school.	私たちは母校を訪れた。
We go to school to study.	私たちは勉強するために学校へ行く。
We go to school because we want to learn.	私たちは勉強したいので学校へ行きます。
We could not find out her address.	私たちは彼女の住所を見つけ出せなかった。
We look up to him.	私たちは彼を尊敬している。
We made him our guide.	私たちは彼を私たちの案内人にした。
We made him go.	私たちは彼を行かせた。
We made friends with them.	私たちは彼らと親しくなりました。
We offered him the house for $300,000.	私たちは彼にその家を３０万ドルで売ると申し出た。
We are getting older day by day.	私たちは日毎に年をとっていく。
We are in the same class.	私たちは同級生です。
We're the same age.	私たちは同じ年齢です。
We go to the same school.	私たちは同じ学校に通っている。
We study English in the same class.	私たちは同じ学級で英語を勉強します。
We were in the same class then.	私たちは当時は同級生だった。
We have been to Tokyo many times.	私たちは東京へ何度も行ったことがある。
We've been close friends for many years.	私たちは長年親しくしている。
We have been good friends for a long time.	私たちは長い間の友人です。
We have wanted to visit the city for a long time.	私たちは長い間その街を訪れなかった。
We live in a big city.	私たちは大都市に住んでいる。
We're friends from way back.	私たちは昔からの友人です。
We must work as long as we live.	私たちは生きている限り働かなければならない。
We can not do without water even for a day.	私たちは水無しでは一日もやっていけない。
We're close friends.	私たちは親しい友人です。
We should read one book a month at least.	私たちは少なくとも月に一冊本を読むべきだ。
We made friends with at least ten Americans.	私たちは少なくとも１０人のアメリカ人と友達になった。
We had to make the best of our small house.	私たちは小さな家で我慢しなければならなかった。
We must keep up with the times.	私たちは時流とともに進まなければならない。
We must keep up with the times.	私たちは時勢に遅れないようについていかなければならない。
We must keep up with the times.	私たちは時勢に遅れないようにしなければならない。
We must keep up with the times.	私たちは時勢に遅れずに付いていかなければならない。
We must keep up with the times.	私たちは時勢に遅れずについていかねばならない。
We must keep up with the times.	私たちは時勢に遅れずついていかなければならない。
We had better save our time and money.	私たちは時間とお金を節約したほうがよい。
We want to have a large family.	私たちは子供がたくさんほしい。
We should help people in need.	私たちは困っている人を助けるべきだ。
We have a party this evening.	私たちは今晩パーティーを開きます。
We are at home today.	私たちは今日家にいます。
We will have been studying English for five years next February.	私たちは今度の２月で五年間英語を勉強していることになります。
We are to pay back the money within the week.	私たちは今週のうちにそのお金を返さなくてはならない。
We have to act now.	私たちは今、行動を起こさなければいけない。
We study many subjects in high school.	私たちは高校で多くの科目を勉強する。
We ran around the park.	私たちは公園の回りを走った。
We helped one another.	私たちは互いに助け合った。
We have the same problems as you.	私たちは君たちと同じような問題を抱えています。
We have not seen each other since our school days.	私たちは学生時代以来ずっとお互いに会っていない。
We must go to school.	私たちは学校へ行かなければなりません。
We study English at school.	私たちは学校で英語の勉強をします。
All of us know him well.	私たちは皆彼をよく知っています。
We must study English.	私たちは英語を学ばなければならない。
We lived in Paris before.	私たちは以前パリにすんでいた。
We used to play in the park.	私たちはよく公園で遊んだものだ。
We need to study more.	私たちはもっと勉強する必要があります。
We have been studying English for three years now.	私たちはもう３年間英語を勉強しています。
We were all present at the party.	私たちはみなパーティーに出席していた。
All of us like you very much.	私たちはみな、あなたが大好きなの。
We checked in at the hotel at 5 p.m.	私たちはホテルに午後５時にチェックインした。
We will travel to Los Angeles by way of Hawaii.	私たちはハワイ経由でロサンゼルスに旅する予定だ。
Not only did we go to Paris, but we also visited Rome.	私たちはパリに行っただけでなく、ローマも訪れた。
We are using a new process to make butter.	私たちはバターを作るのに新しい工程を用いています。
We had a good time playing cards.	私たちはトランプをしながら楽しい時間を過ごした。
We have made friends with Tom.	私たちはトムと親しくなった。
We had to do without a TV set.	私たちはテレビなしですまさなければならなかった。
We call it the Evening Star.	私たちはそれを宵の明星と呼ぶ。
We should look into the problem.	私たちはその問題を調査するべきだ。
We bought the man's house.	私たちはその男の家を買った。
We checked out of the hotel at ten.	私たちはそのホテルを１０時に出た。
We like English the best of all our subjects.	私たちはすべての教科の中で英語が一番好きです。
We haven't seen each other for such a long time.	私たちはずいぶん長い間お互いに会っていません。
We made friends with Jane.	私たちはジェーンと友達になった。
We acted the story of Columbus.	私たちはコロンブスの話を演じた。
We knew that Columbus visited America in 1492.	私たちはコロンブスが１４９２年にアメリカを訪れたことを知っていた。
At Christmas we send Christmas cards to our friends.	私たちはクリスマスには友人にクリスマスカードを送ります。
We have no school today.	私たちはきょう授業がない。
We must help each other.	私たちはお互いに助け合わなくてはならない。
We love each other.	私たちはお互いに愛し合っています。
We work to get money.	私たちはお金を得するために働く。
We need some money.	私たちはお金が少し必要だ。
We'll take your feelings into account.	私たちはあなたの気持ちを考慮に入れるつもりです。
We have come to pay you a visit.	私たちはあなたにお目にかかるために伺いました。
We will be studying at the University of San Francisco in September.	私たちは９月にはサンフランシスコ大学で学ぶことになるでしょう。
We returned to Osaka on April 2.	私たちは４月２日に大阪から帰ってきた。
We are both in the same class.	私たちは２人とも同じクラスです。
Both of us are from Tampa.	私たちは２人ともタンパの出身です。
We have been good friends for ten years.	私たちは１０年前から仲の良い友達です。
We try.	私たちは、試す。
We know that we are all people of one world.	私たちは、私たち皆が一つの世界の国民であることを知っている。
We visited Yokohama on business.	私たちは、仕事で横浜を訪れた。
We study music.	私たちは、音楽を勉強します。
There is a library in our city.	私たちの町には図書館があります。
Why don't you join our party?	私たちの仲間に入りなさい。
There is not one of us who does not want to help you.	私たちの中で１人としてあなたを助けたいと思わない者はありません。
Our world is getting smaller and smaller.	私たちの世界は、だんだん小さくなってきている。
Our car is three years older than yours.	私たちの車はあなたのより３年古い。
Our city is getting bigger and bigger.	私たちの市はますます大きくなっている。
Our school is fifty years old.	私たちの学校は創立して５０年だ。
Our school is 80 years old.	私たちの学校は創立８０周年です。
Our school was not the same size as yours.	私たちの学校はあなたの学校と大きさが違っていた。
Our school library is small, but new.	私たちの学校の図書館は小さいが新しい。
Our school library has many books.	私たちの学校の図書館には本がたくさんある。
Our school has nine classes.	私たちの学校にはクラスが９つある。
Our school has ten classes.	私たちの学校には１０の学級がある。
Our school has twenty-four classes in all.	私たちの学校には、全部で２４クラスある。
Would you like to join our team?	私たちのチームに入りませんか。
Our class is a small one.	私たちのクラスは少人数のクラスである。
We still have masses of work.	私たちにまだたくさんの仕事がある。
We had little water.	私たちには水が少ししかありませんでした。
We have the right to live where we please.	私たちには好きなところに住む権利がある。
We still have masses of work.	私たちにはまだたくさんの仕事がある。
Will you tell us a story?	私たちにお話をしてくれませんか。
Why don't you go to school with us?	私たちといっしょに学校に行かない。
What will we be doing this time next week?	私たち、来週の今ごろは何をしているかしら。
I read it to my family.	私それを家族に読んで聞かせた。
All I want is money.	私が欲しいのは金だけだ。
It is Paris that I want to visit.	私が訪れたいのはパリです。
Every time I call on you, you're out.	私が訪ねるたびあなたは留守だ。
Every time I call on you, you are out.	私が訪ねるといつもあなたは留守だ。
The man that I visited was Mr. Doi.	私が訪ねた人は土井さんでした。
We parted the best of friends.	私が別れたときは最も仲良しであった。
I'll pay.	私が払います。
Rie Kawada will do my job while I'm gone.	私が不在の間は河田理恵が私の仕事をすることになります。
Miho was in the living room when I visited her.	私が美穂を訪ねたとき、彼女は居間にいた。
As I love her, so she loved me.	私が彼女を愛したように、彼女も私を愛した。
She loved me in the same way that I loved her.	私が彼女を愛したように、彼女も私を愛してくれた。
It has been ten years since I saw her last.	私が彼女に最後に会ってから１０年になります。
It has been ten years since I saw her last.	私が彼女に最後にであってから１０年になります。
It has been ten years since I saw her last.	私が彼女に会ってから１０年になります。
This is all that I know about him.	私が彼について知っているのはこれだけです。
Is there any room for me?	私が入る場所がありますか。
That was my first visit to Japan.	私が日本に行ったのはそれが初めてのことだ。
It is five years to a day since I came here.	私が当地へ来てからちょうど５年です。
It is ten years since I came to Tokyo.	私が東京に来てから十年になります。
If only she had known I was in Tokyo, she would have come to visit me.	私が東京にいることを彼女が知っていさえいたら、彼女は私を訪問してくれただろ。
Don't think I'm made of money.	私が大金持ちだと思ってくれては困る。
I'll get there before you will.	私が先にそこへ着くよ。
I'll help you as long as I live.	私が生きている限りは君を援助してあげよう。
I'll help you as long as I live.	私が生きている間は援助しましょう。
You will see that I am right.	私が正しいとわかるでしょう。
I'll offer him what help I can.	私が出来る限りの援助を彼に差しのべるつもりです。
The place I live in is very good for your health.	私が住んでいる所は健康に良い。
Don't phone me while I'm at the office.	私が事務所にいる間は電話をかけてよこさないでくれ。
I was called into the office first.	私が最初にオフィスに入るように呼ばれた。
This is all the money that I have now.	私が今もっているお金はこれだけです。
Do as I tell you.	私が言うようにしなさい。
It's a house just like that I have seen.	私が見たのはそれにそっくりの家だった。
When I visited Ken, he was studying.	私が健を訪問した時、彼は勉強していました。
I'll come to your place.	私が君のところへ行くよ。
He told me that if he were I, he would not do so.	私が君だったらそんな事はしないだろうよと彼は私に言った。
When I came home, Tom was studying.	私が帰宅したとき、トムは勉強していました。
I'll show you that I am right.	私が間違っていない事を証明しよう。
It will be a long time before I can buy a house.	私が家を買えるのはずっと先のことだろう。
What has become of my old house where I used to live?	私が以前住んでいた古い家はどうなったのだろう。
Please tell John that I called.	私から電話があったとジョンに伝えて下さい。
Will you take your hand off me?	私から手を離してくださらない？
I should ask him if I were you.	私がもし君だったら彼に尋ねるでしょうに。
It is not money but time that I want.	私がほしいのは金ではなく時間だ。
Note how I do it.	私がどんな風にそれをやるかよく見ていなさい。
At such times, I think of my family, not my friends.	私がそんなときに思うのは、家族のことであり、友達のことではない。
I'll take care of it.	私がご馳走します。
Note down what I'm going to say.	私がこれから言うことを書き留めなさい。
It is more than five years since I last saw him.	私がこの前彼に遭ってから５年以上になる。
It has been twenty years since I saw you last.	私がこの前あなたにお会いしてから２０年になります。
It is two years since I came here.	私がここへ来てから二年になる。
It has been ten years since I came here.	私がここに来てから１０年になります。
It's because I was asked to come that I'm here.	私がここに来ているのは来るように言われたからです。
He asked me when I was going to buy a new car.	私がいつ新車買うつもりかと彼はたずねた。
I will go there in place of you.	私があなたの代わりにそこに行きましょう。
He loves you as much as I do.	私があなたの事を愛しているのと同じ位彼もあなたを愛している。
