I haven't seen him since last Sunday.	この前の日曜日以降、私は彼に会っていません。
Did you go to the last class?	この前の授業に出たかい？
The last time I called him, he was out.	この前に電話したときは彼は留守でした。
Their food was great last time.	この前に食べたときはとてもおいしかったよ。
I don't have a care in the world.	この世に思い煩らうことはない。
There are a great many books in this library.	この図書館には非常にたくさんの本があります。
There are a great many books in this library.	この図書館にはたくさんの本があります。
Is this new model available on the market?	この新しい型は市場で手に入りますか。
I'd like to try out this new model before I buy it.	この新しい機種を買う前に一度試してみたい。
This information checks out all right.	この情報は調べたところ間違いない。
Is this information right?	この情報は正しいか。
Just right here?	この場所に？
Experience will tell in this case.	この場合は経験がものを言う。
How long have you had this problem?	この症状が出たのはいつですか。
Who is the author of this story?	この小説の作者は誰ですか。
This article comes with a free gift.	この商品にはおまけが付く。
There isn't much money in this business.	この商売は儲かりません。
Please get these papers out of the way.	この書類を片付けてください。
Will you type this paper for me?	この書類をタイプで打ってくれませんか。
Will you look over these papers?	この書類に目を通しておいてくれますか。
Will you sign your name on this paper?	この書類に署名していただけますか。
Please take me to this address.	この住所まで、行ってください。
We request this address.	この住所へお願いします。
This car must go.	この車を処分しなければならない。
This car sells well.	この車はよく売れる。
This car is better as compared with that one.	この車はあれに比べればよい。
This car is bigger than that one.	この車はあの車より大きい。
This car is as big as that car.	この車はあの車と同じくらい大きい。
This car was selected the "car of the year".	この車は「年間最優秀車」に選ばれた。
I had a Nissan before this one.	この車の前は、ニッサン車に乗っていました。
I will see you on next Tuesday, that is to say, the 10th of September.	この次の火曜日、すなわち９月１０日に君に会いたい。
I will tell him about it when he comes next time.	この次に彼がきた時に、そのことについて彼に話しましょう。
Who will try this case?	この事件は誰が審理するのですか。
Give me a hand with this case.	この事件に手を貸してください。
I say this from my own experience.	この事は私自身の体験から言っているのです。
Will you guide me around the city?	この市を案内していただけませんか。
This work doesn't pay.	この仕事は儲からない。
This work is made for him.	この仕事は彼に向いている。
This job doesn't pay.	この仕事は割に合わない。
This work can be done within a week.	この仕事は１週間以内にできる。
This work took me 5 days, but it will take you as many weeks.	この仕事は、私には５日かかったが、あなたなら５週間かかるでしょう。
Little money will come from this business.	この仕事ではほとんど金がもうからないだろう。
This material has no give.	この材質は弾力性に欠ける。
Please show me some of the travel guides for this country.	この国の旅行ガイドを見せてくれませんか。
What are the main products of this country?	この国の主要な産物は何ですか。
There were no Japanese in this country.	この国には日本人は一人もいませんでした。
There are many cities in this country.	この国には多くの市がある。
Every fifth person has a car in this country.	この国では、５人に１人が車を持っている。
How big is this park?	この公園はどのくらい広いのですか。
This word is not in current use.	この語は現在用いられていない。
This word is still in use.	この語はまだ使われている。
This old table is still in use.	この古いテーブルは今でも使われている。
This word comes from Greek.	この言葉はギリシャ語に由来している。
From this point of view, you are right.	この見地からすると、君の言うことは正しい。
This play has three acts.	この劇は三幕からなる。
The title of this play is "Othello".	この劇の題は「オセロ」です。
What do you say to this plan?	この計画はどうでしょう。
I know about this project for the most part.	この計画について大部分は知っている。
This experience will do you good in the long run.	この経験は長い目で見れば、あなたのためになりますよ。
What does this sign say?	この掲示はなんと書いてあるのですか。
Keep this money for me.	この金を預かってください。
This money goes for food.	この金は食費になる。
How many credits can I get for this course?	この教科は何単位ですか。
I don't like this model but I'll have to make do with it.	この機種は気に入らないが、これで間に合わせなければならない。
This project may not pay off.	この企画は採算が取れないかもしれない。
From this point of view we should say he was right.	この観点からすれば、彼は正しかったと言えよう。
How many credits is this course?	この科目は何単位ですか。
This house is not for sale.	この家は売りもんではない。
Who owns this house?	この家は誰のものですか。
This is a small house, but it will do for us.	この家は小さいが我々には十分です。
This house must be done up.	この家は手入れをしなければならない。
This house is registered in my name.	この家は私の名前で登記してある。
This house is very good.	この家はとても良い。
Who owns this house?	この家はだれの所有ですか。
This house is not very large.	この家はそう大きくはない。
I like this house as it is.	この家はこのままにしておきたい。
This house is about the same size as Peter's.	この家は、ピーターの家とだいたい同じくらい大きい。
Who is the owner of this house?	この家の持ち主はだれですか。
This house has six rooms.	この家には部屋が６つあります。
This house has eleven rooms.	この家には１１部屋があります。
Could you send it to this address?	この宛先に送ってもらえますか？
Please check all the items on this list.	このリストの項目を全部チェックして下さい。
Could you give me a card with this hotel's address?	このホテルの住所を書いたカードをください。
Is there a hotel around here?	この辺にホテルはありますか。
This present was given to me by Ann.	このプレゼントはアンから私に与えられた。
This video recorder doesn't work right.	このビデオは正しく機能しない。
This department store is closed today.	このデパートは今日は閉まっている。
This department store is closed at seven.	このデパートは７時に閉店する。
This department store is closed at seven.	このデパートは７時に閉められる。
I didn't ask for a table here.	このテーブルを頼んだのではない。
Can you give me a hand with this table?	このテーブルを運ぶのを手伝ってくれませんか。
These days people visit here.	このごろ人がここを訪れる。
These days many people use computers.	このごろ、多くの人がコンピューターを使用している。
You should keep it close.	このことは伏せておいたほうがいい。
How would you take these words?	このことばを君はどう考えますか。
These words came out of the book you have.	このことばは、君の持っている本から引用したのだ。
In him was life, and that life was the light of man.	このかたに命があった。この命は人の光であった。
Please keep this money for me.	このお金を預かっておいてください。
Give me all this money.	このお金を私に全部ください。
What are you going to do with this money?	このお金をどうしようとなさるのですか。
You shall have this money.	このお金をあげよう。
This money will allow me to buy a car.	このお金のおかげで車が買えます。
Please take me to this address.	このアドレスのところに行ってください。
May I show you around?	このあたりを案内いたしましょう。
Is there a post office around here?	このあたりに郵便局はありますか。
Is there a public phone around here?	このあたりに公衆電話はありませんか。
This food called BLT; what's in it?	このＢＬＴという料理は、どんな材料なのですか。
These two are very different from each other.	この２つはお互いに非常に異なっている。
In the last fifteen or twenty years, there have been great changes in family life in Britain.	この１５年から２０年の間に英国の家族生活には大きな変化があった。
Come over here and join us.	こっちに来て仲間に入りなさい。
This is room No. 1025. Room service, please.	こちらは１０２５号室ですが、ルームサービスをお願いします。
This costs more than that.	こちらの方がこちらより値段が高い。
I want you to keep up with me.	こちらの調子に合わせてください。
Could you sign here, please?	こちらにサインをいただけるか。
Do you have many friends here in Japan?	ここ日本には友達はたくさんいますか。
There are so many people here in Tokyo.	ここ東京にはずいぶんたくさんの人がいるんですね。
The quality of their products has gone down over the years.	ここ数年にわたって彼らの製品の質は落ちてきた。
Prices have gone up these three months.	ここ三ヶ月物価が上昇しました。
What do you think were the year's ten biggest items of news?	ここ一年の１０大ニュースにはどんなものがあったと思いますか。
Come over here and join us.	ここへきて仲間に入りなさい。
This is the house in which she used to live.	ここは彼女がかつて住んでいた家です。
This is a business section of Tokyo.	ここは東京のビジネス街だ。
They allow parking here.	ここは駐車してもよい。
This place used to be a field.	ここは昔、畑だった。
This is where my family used to live.	ここは昔、私の家族が住んでいた所です。
The food is good, and service is good here.	ここは食べ物もおいしいし、サービスもよい。
I'll pay for it.	ここは私が払います。
Tell me where I am, and what's going on, oh please.	ここは何処なんだ、何がどうしたんだ。
How long have you been here?	ここに来てどのくらい？
How long have you been here?	ここに来て、どれくらいになるの？
Here is note from him. He must have come here.	ここに彼の書き置きがある。これはここに来たに違いない。
You can park here.	ここに駐車できますよ。
Could I park my car here?	ここに駐車してもよろしいですか。
You may park here.	ここに駐車してもいいですよ。
Here's some water.	ここに水が少しある。
Write it down here, please.	ここに書いて下さい。
Write your address here.	ここに住所を書いてください。
How long have you lived here?	ここに住んでどのくらいになりますか。
It has been three years since I came to live here.	ここに住むようになってから３年になります。
Can I park my car here?	ここに車を止めてもいいですか。
Could I park my car here?	ここに車をとめてもよろしいですか。
All you have to do is to write your name and address here.	ここに君の名前と住所を書けばよいのです。
There are no more than six persons here.	ここには６人しかいない。
Twenty families live here.	ここには２０家族が住んでいる。
There's no room to study here. If only I had a room of my own!	ここには、勉強する空間がない。自分の部屋があるといいのになあ。
How long have you lived here?	ここにどれくらいお住まいですか。
Here's a big map of Germany.	ここにドイツの大きな地図があります。
Would you sign here?	ここにサインをお願いできますか。
Could you sign here?	ここにサインしてください。
Just sign here.	ここにサインをお願いします。
The people which were here have all gone.	ここにいた人々はみんな行ってしまった。
Write down your name here.	ここにあなたの名前を書きなさい。
Here are two dogs; one is white and the other is black.	ここに２匹の犬がいます。１匹は白で、もう１匹は黒い。
It is ten years since I came to live here.	ここで暮らすようになってから１０年になる。
Can I study here?	ここで勉強してもいいですか。
How long have you been working here?	ここで働いてどれくらいですか。
You mustn't park here.	ここで駐車してはいけません。
Don't run here.	ここでは走るな。
Keep to the right.	ここでは右側通行です。
This is just between you and me.	ここだけの話なんだけど。
This is just between you and me.	ここだけの話だよ。
This is the very place that I have long wanted to visit.	こここそまさに私が長い間訪れたいと思っていたところです。
Please tell me how to get to the post office from here.	ここから郵便局への道を教えて下さい。
How long do you think it takes to go from here to Tokyo?	ここから東京までどれぐらい時間がかかると思いますか。
It's a long way from here to school.	ここから学校は遠いんだ。
How long does it take to go from here to the Hilton Hotel?	ここからヒルトンホテルまでどのくらい時間がかかりますか。
How long does it take to get there from here?	ここからそこまで行くのにどれくらいかかりますか。
How long does it take to get to Chicago from here?	ここからシカゴへ行くのにどのくらいかかりますか。
How long does it take from here to your house?	ここからあなたの家までどれくらいかかりますか。
Prices have gone up these three months.	ここ３か月、物価が上昇しました。
Some say this, and others say that.	こう言う人もいれば、ああ言う人もいる。
Can these stars be seen in Australia?	こういった星はオーストラリアでは見えるのですか。
These persons run this country.	こういう人たちが我が国を動かしている。
You'd better check these points.	こういうチェックポイントを注意すると、いいですね。
Both Ken and Meg are my friends.	ケンもメグも私の友達です。
Ken calls me every day.	ケンは毎日私に電話をかけてくる。
Ken wasn't running.	ケンは走っていませんでした。
Ken has more books than you.	ケンは君よりたくさんの本を持っている。
Ken likes music very much.	ケンは音楽がとても好きです。
Ken has no more than ten books.	ケンはわずか１０冊しか本を持っていない。
How long has Ken lived in Kobe?	ケンはどれくらい神戸に住んでいるの。
Ken was running at that time.	ケンはその時走っていました。
Ken is older than Seiko.	ケンは、聖子より年上です。
Ken must be home by now.	ケンは、今ごろ家に着いているに違いない。
Are you on the level, Ken?	ケンさん、君は本気かい。
Kate is running in the field now.	ケイトは今運動場で走っている。
Kate has three times as many records as Jane has.	ケイトはジェーンの３倍のレコードを持っている。
Gary will have been in Japan for six years next month.	ゲアリーは来月で日本に６年いたことになる。
Can I pay on credit?	クレジットで払えますか。
Your credit card, please.	クレジットカードをみせていただけるか。
Can I use a credit card?	クレジットカードは使えますか。
Where are your credit cards?	クレジットカードはどこだ。
Do you have a credit card?	クレジットカードはお持ちですか。
I'd like to pay by credit card.	クレジットカードで支払いたいのですが。
How many days are there before Christmas?	クリスマスまであと何日ありますか。
Christmas is only two weeks off.	クリスマスはほんの２週間先です。
Chris didn't have a car to drive.	クリスは運転する車がなかった。
The class are all here.	クラスの人たちぜんいんがここにいる。
Kumi made a box.	クミは箱を作りました。
Kumi did not make a box.	クミは箱を作りませんでした。
Would you like some of those cookies?	クッキーを少しいかがですか。
The cookies are all in the form of stars.	クッキーはどれも星の形をしている。
Don't be long about it!	ぐずぐずせずに早くしろ！
Today is Sunday.	きょうは日曜日です。
On no account must you go out today.	今日は絶対に外へ出てはいけない。
How was today's game?	きょうの試合はどうでしたか。
Kathy got a part-time job so that she could study at college.	キャッシーは大学で勉強できるようにアルバイトを見つけた。
Kim is older than I am by four years.	キムは私よりも４歳年上だ。
Kim and I are the same age.	キムと私は同じ年齢だ。
You must be just to them.	きみは彼らに公正であらねばならない。
You should go to see him.	きみは彼に会いに行くべきだ。
What a big house you have!	きみは何と大きい家を持っているんだろう。
You will get well in a week or so.	きみは一週間かそこらでよくなるでしょう。
You had to join that project.	きみはその計画に参加しなければならなかった。
You will have to join the project.	きみはその計画に参加しなければならないだろう。
All you have to do is to hand this book to him.	きみはこの本を彼に渡してくれるだけでいい。
I think we can be friends.	きっと友達になれると思います。
He must love you.	彼はきっと君が好きなんだ。
If you care to, you may come with us.	きたければ我々と一緒にきてもよろしい。
They came into the house.	かれらが家にはいって来た。
California is about as large as Japan.	カリフォルニアは日本と同じくらいの広さだ。
A good many people were there.	かなりの人がそこにいた。
Canada is larger than Japan.	カナダは日本より大きい。
There used to be a house here at one time.	かつて、ここに家がありました。
Kazu told her that he would go to Brazil in May.	かずは彼女に５月にブラジルへ行くと言った。
The guide led us to the hotel.	ガイドが私たちをホテルまで案内してくれた。
Can I pay with a credit card?	カードは使えますか。
Can I pay by credit card?	カードで支払えますか。
I see your point.	お話の要点は分かりました。
May I ask your name?	お名前を聞いてもいいですか。
May I ask your name?	お名前をお聞きしたいのですが。
Might I ask your name?	お名前をお伺いしてもよろしいですか。
Might I ask your name?	お名前をお伺いしてもよろしいでしょうか。
May I ask your name?	お名前は何とおっしゃいますか。
Might I ask your name and address?	お名前と住所をお聞きしてもよろしいでしょうか。
Might I ask your name and address?	お名前と住所お聞きしてもよろしいでしょうか。
Just give me your name and address.	お名前とご住所をどうぞ。
Write your name and address, please.	お名前とご住所をお書きください。
I will show you around in return.	お返しに案内してあげましょう。
Come right in.	お入りください。
Might I ask your age?	お年をお聞きしてよろしいでしょうか。
Please tell her to call me back.	お電話して下さいと、お伝えいただけますか。
Keep the change.	お釣りは取っておいて。
How is it going with your family?	お宅の皆さんはいかがですか。
Take care.	お体を大切に。
You did it all right.	お前は、やるべき事はちゃんとやったよ。
I know you don't care.	お前にとってはどうでもいいこと。
Can I have some water, please?	お水をください。
Could I get some water, please?	お水をいただけますか。
Just water, please.	お水だけでけっこうです。
I asked you if you wanted some help.	お手伝いしましょうかっていったんです。
How would you like to pay?	お支払いはどのようになさいますか。
How would you like to pay for it?	お支払いはどのようにしますか。
Take as much as you like.	お好きなだけお取りなさい。
There must be a better person for both of us.	お互いもっと適した相手がいるはずだ。
What's the name of the party you're calling?	お呼びする相手方のお名前は？
He wants the money.	お金を欲しがっています。
I'm trying to save money.	お金を貯めようとしている。
I have got some money.	お金を少し持っている。
Give me a little money.	お金を少しください。
You must make good use of money.	お金は上手に使わなければならない。
How much money do you have?	お金はどのくらい持っていますか。
How much money do you have with you?	お金はいくら持っていますか。
I do not want any money.	お金はいりません。
Do you have much money with you?	お金の持ち合わせは多いですか。
I have no money on me.	お金の持ち合わせがない。
Do you have any money with you?	お金の持ちあわせがありますか。
I'll try Jane for some money.	お金のことはジェーンにあたってみるよ。
I want money.	お金が欲しい。
Do you need much money?	お金が沢山必要ですか。
I can't do it for want of money.	お金が足りなくて、それが出来ない。
Our money ran out.	お金がなくなってきた。
Please write down your home address.	お客様の住所を書いて下さい。
Take care.	お気をつけて。
May I have the check, please?	お勘定をお願いします。
Check, please.	お勘定して下さい。
No problem!	お安い御用です。
Am I not right?	おれの言うとおりではないか。
Olivier acted the part of Hamlet.	オリビアがハムレットの役を務めた。
The Netherlands is a small country.	オランダは狭い国です。
In about two weeks.	およそ２週間で。
You can't say no.	おまえは何も否定できないまま。
You should know better at your age.	おまえの年ではもっと分別があるべきだ。
I shouldn't have told you nothin'.	おまえなんかに話すんじゃなかったよ。
Keep the change.	おつりは取っておいてください。
I don't see your point.	おっしゃることの意味がよく分かりません。
It saved me.	おかげで助かったよ。
Australia is about twenty times as large as Japan.	オーストラリアは日本のほぼ２０倍の大きさです。
Australia is smaller than South America.	オーストラリアは南アメリカより小さい。
Oedipus thought for a long while.	オイデイプスは長い間考えた。
It's good. You should try it.	おいしいよ。試してみるべきだよ。
Emi will study English.	エミは英語を勉強するでしょう。
I'd like to try out the aerobics class for a day.	エアロビクス教室に一日入学したいのですが。
I'd like to try aerobics.	エアロビクスをやってみたいな。
He's in the money.	うなるほど金を持っている。
We are a family of five.	うちは５人家族です。
Won't you come over to my place?	うちに来ないか。
India is the seventh largest country in the world.	インドは世界で７番目に大きい国である。
Have them send you an application form over the Internet.	インターネットで願書を取り寄せるといいよ。
This is the first time I have visited England.	イングランドを訪れるのはこれが初めてです。
I've visited many countries, but I like Japan best of all.	いろいろな国へ行ったがやっぱり日本が一番いい。
Please take with you as much as you need.	いるだけ持っていらっしゃい。
Good evening. How many are in your party?	いらっしゃいませ、何名様ですか。
You must do the work even if you don't like it.	いやでもその仕事をしなければならない。
If you do your study at all, do your best.	いやしくも勉強をするなら、一生懸命やりなさい。
No, I did it on my own account.	いや、自分からやったんです。
Not words but action is needed now.	いま必要なのは言葉ではなく行動だ。
I'll be with you right now.	いますぐそちらに参ります。
How long have they been here?	いつ来たんだ？
Tell me when to start.	いつ出発するのか教えて下さい。
