They are more or less the same size.	それらはだいたい同じくらいの大きさだ。
It is a very difficult job for us.	それは私達にとってはとても難しい問題です。
I found the book very interesting.	その本は読んでみたらとてもおもしろかった。
The two boys never get along.	その二人の少年は１度もうまくやっていけたことがない。
The efforts brought about no effect.	その努力は何の結果ももたらさなかった。
The boy talks as if he were a girl.	その少年はまるで女の子のように話します。
I looked all over the house for that letter.	その手紙を家中探した。
The boy has few friends to play with.	その子には遊び友達がほとんどいない。
Do your best to complete the work.	その仕事を完成するよう全力を尽くしなさい。
You should have seen the program on TV.	そのテレビを見るべきだったのに。
He was always drinking in those days.	そのころ彼はいつも飲んでばかりいた。
One of these two boys knows that.	その２人の少年のどちらかがそれを知っている。
The two languages have a lot in common.	その２つの言語には共通点が多い。
That is why he was late for school.	そういうわけで彼は学校に遅刻したのです。
Did you sleep well last night, Steve?	スティーブ、昨晩はよく寝れましたか。
Let's start at once; it's already late.	すぐに出かけよう。もう遅いから。
Let's wait for a while and see how you do.	しばらく様子をみましょう。
Choose one from among these products.	これらの商品の中から１つ選びなさい。
This tree is about as high as that one.	この木はあの木とほぼ同じ高さだ。
This book is easy enough for me to read.	この本は私が読めるほど易しい。
Do you remember when I saw you last?	この前、僕が君にあったのはいつだっけ。
Will you sign your name on this paper?	この書類に署名していただけますか。
What's your purpose in visiting this country?	この国に来た目的は？
This design shows Chinese influence.	このデザインには中国の影響がみられる。
Put down your name and address here.	ここに御住所とお名前をお書きください。
How long are you going to stay here?	ここにはどのくらい滞在する予定ですか。
Is this to eat here, or to go?	ここで召し上がりますか、それともお持ち帰りですか。
Could you wait here for the moment?	ここでちょっと待っていてくださいますか。
Kelly's latest book appeared last week.	ケリーの一番新しい本が先週出た。
The class accepted the new teacher.	クラスのみんなは新任の先生を快く迎えた。
Never did I say bad things about you.	きみの悪口なんて決して言わなかった。
Would you help me look for my keys?	かぎを捜すのを手伝っていただけませんか。
I am looking forward to hearing from you.	お便りを楽しみにしています。
Would you like to come eat at our house?	うちに夕食を食べにきませんか。
You can stay here as long as you like.	いたいだけここに居てもいいですよ。
I learned a lot from what I heard.	いいこと聞いたわ。それって勉強になったわ。
You may ask a question of that teacher.	あの先生に質問してもいいですよ。
I have to put down your new address.	あなたの新しい住所を書き留めなくては。
It is difficult to believe what you say.	あなたの言うことは信じがたい。
Either you or I should visit her.	あなたか私のどちらかが彼女を訪問するべきだ。
That's the person I've been waiting for.	あちらが私の待っていた人です。
Don't take any notice of what he says.	あいつの言うことなんか気にするな。
What do the letters P.S. stand for?	Ｐ．Ｓ．という文字は何を表していますか。
The twenty-first century begins in 2001.	２１世紀は２００１年に始まる。
"How many keys?" asked Pepperberg.	「鍵はいくつある？」とペパーバーグが聞く。
Experience really does make the difference.	やはり経験がものを言います
He looked at the sleeping face of the child.	彼が子供の寝顔を見ました
It has a lot to do with our life.	それが私たちの生活に大きな関わりを持っています
There is always another me inside of me.	私の中にはいつも二人の私がいます
It took a lot of time to get there.	たどりつくまでに、かなり時間がかかりました
There were a lot of problems going around X.	Xがいろいろ問題にされた
The white light changed into various shapes.	白い光が様々に形を変えた
He ended up choosing between them.	彼がいずれかの方法を選択することになりました
Many characters appeared in the work.	作品には、多数のキャラクターが登場した
We will ask your personal information.	当社がお客様の個人情報をお伺いします
Morning, Haruki. You've got bed hair.	おはよう。春樹兄さん。寝癖ついてるよ。
He is a good boy, and he is very strong.	良い子でたいへん丈夫なのですよ。
A theory must be followed by practice.	理論には実践が伴わなければならない。
Play or study - the choice is yours.	遊びか勉強か、選択はあなたがすることだ。
Not until late at night did he come home.	夜遅くまで彼は帰宅しなかった。
I'll call him first thing in the morning.	明日の朝一番に彼に電話しよう。
Should that happen, what will you do?	万一それが起これば、君はどうしますか。
You look on top of the world every morning.	毎朝とても楽しそうだけど。
Open your heart and tell me everything.	本心を打ち明けて全てを話してくれ。
There were books lying about the room.	本が部屋のあちこちに散らばっていた。
Our team fought off all the others.	僕達のチームはほかのチームをすべて破った。
I don't want to respect a man like him.	僕は彼のような奴を尊敬したくない。
How about my showing you around the town?	僕がこの町を案内しましょうか。
Don't believe everything you hear.	聞いた事をなんでもかんでも信じてはいけない。
There were a lot of people in the room.	部屋にはたくさんの人々がいました。
Father told us a very interesting story.	父はとても面白い話をしてくれた。
My father usually comes home at seven.	父はだいたいいつも七時に帰ってくる。
She did come, but didn't stay long.	彼女は来ることは来たが、長くはいなかった。
She is concerned about her son's health.	彼女は息子の健康を心配している。
She was at a loss what to say next.	彼女は次に何を言ったらよいか途方に暮れた。
She called me up very late last night.	彼女は昨夜遅く私に電話をかけてきた。
She has changed a lot since high school.	彼女は高校時以来ずっと変わった。
She had a choice of going or remaining.	彼女は行くか残るかどちらかだった。
She brought up the three children alone.	彼女は一人で三人の子供を育てた。
She doesn't answer any kind of letter.	彼女はどんな手紙にも返事を出さない。
She is much concerned about the result.	彼女はその結果を大変気にしている。
She looked in at the show window.	彼女はショーウインドウをちょっとのぞいてみた。
She told me this story off the record.	彼女はオフレコでこの話をしてくれた。
He claims he knows nothing about her.	彼女の事は何も知らないと彼はいいはる。
Let's wait here until she comes back.	彼女が戻るまでここで待っていましょう。
I couldn't bring myself to call on him.	彼を訪ねてみる気にはなれなかった。
They will find out sooner or later.	彼らは遅かれ早かれそれを見つけだすだろう。
They like to get together and drink.	彼らは集まって、酒を飲むのが好きである。
They did not wish to go any farther.	彼らはもうそれ以上先へ進みたくなかった。
They visited the town every now and then.	彼らはときどきその町を訪れた。
They could not help being touched.	彼らはその光景に感動せずにはいられなかった。
He gets up as early as five every morning.	彼は毎朝早くも５時に起きる。
He said that he takes a walk every morning.	彼は毎朝散歩すると言った。
He kept walking up and down the room.	彼は部屋の中を行ったり来たりしていた。
He doesn't know what it is to be poor.	彼は貧乏がどういうものかを知らない。
He is known to all the people in the town.	彼は町中の人に知られている。
He has character as well as knowledge.	彼は知識はもちろん人格も備えている。
He has a lot of books for the young.	彼は青少年向きの本をたくさん持っている。
He will stay in Tokyo for several weeks.	彼は数週間東京に滞在するだろう。
I hear he is in bad health these days.	彼は近ごろ健康状態がよくないらしい。
What time did he ask for your response?	彼は何時に君の返事を要求したのか。
He talks as though he knew everything.	彼は何でも知っているかのように話す。
He talks as if he knew everything.	彼は何でも知っているかのような話し方をする。
He was able to do everything at will.	彼は何でも意のままに行うことが出来た。
He is improving in speaking English.	彼は英語をしゃべるのがうまくなってきた。
He came near being run over by a car.	彼はもう少しで車にひかれそうになった。
He is not old enough to live alone.	彼はまだ一人暮らしできるほどの年ではない。
He will be in New York for two weeks.	彼はニューヨークに２週間いるでしょう。
He thinks of everything in terms of money.	彼はなんでも金本位に考える。
He was then living from hand to mouth.	彼はその当時その日暮らしをしていた。
He demanded that John should go there.	彼はジョンがそこへ行くよう要求した。
More often than not, he is late for school.	彼はしばし学校に遅刻する。
He took great pains to do a good job.	彼はいい仕事をしようと大いに努力した。
He has a brother who lives in Tokyo.	彼には弟がいる、そして東京に住んでいる。
Everything was in order until he came.	彼が来るまでは、すべてが順調だった。
We will begin the party when he comes.	彼がきたらパーティーを始めましょう。
You shouldn't read in such poor light.	薄暗い明かりで本を読んではいけない。
I have pain toward the end of urination.	排尿の終わり頃に痛みがあります。
In Japan the school year begins in April.	日本では新学年は４月に始まる。
Two boys came running out of the room.	二人の少年が部屋から走って出てきた。
Tokyo has a population of over ten million.	東京の人口は一千万以上だ。
I got up too late and was late for school.	朝寝坊して遅刻してしまった。
To read a lot of books is a good thing.	沢山の本を読む事は良いことである。
I had not waited long before she turned up.	待つ間もなく彼女が現れた。
The meeting was put off until next week.	打ち合わせは来週に延期になった。
My son is not old enough for school.	息子はまだ学校へ行く年齢ではありません。
Any car will do, as long as it runs.	走りさえすれば、どんな車でもよいのです。
I look forward to hearing from you soon.	早めの返事をお待ちしております。
Step forward and make room for others.	前へ出て、他の人に場所をあけなさい。
The teacher asked me a difficult question.	先生は私に難しい質問をした。
The teacher told me to study harder.	先生は私にもっと勉強するようにと言った。
Our teacher told us what to read.	先生は私たちに何を読んだらよいか教えてくれた。
The teacher let me off for being late.	先生は私が遅刻した事を許してくれた。
I ran into Mary at a party last week.	先週パーティーでメアリーに偶然会った。
Many trees are cut down in the world.	世界でたくさんの木が切り倒されている。
Don't cut in while others are talking.	人が話しているときは、口をはさむな。
Well do I remember the night view of Kobe.	神戸の夜景はよく覚えている。
I think it important to tell the truth.	真実を話すことが重要だと思います。
If I knew the truth, I would tell you.	真実を知っていれば、君に話すだろう。
Her new hair-do made her look younger.	新しい髪型のせいで彼女は若く見えた。
We know how food affects growth.	食物がどれだけ成長に影響があるのか分かっている。
You should try to live within your means.	収入に応じた生活をするように。
Young people are usually full of energy.	若者はたいてい活気に満ちている。
How I wished I could drive a car!	車の運転が出来たらどんなによいかと私は思った。
Jiro doesn't have to go to school today.	次郎は今日学校へ行く必要がない。
We should respect the ideas of others.	私達は他人の考えを尊重するべきです。
We must keep in touch with the times.	私達は時勢に通じていなければならない。
I am going to start a new job next week.	私は来週、新しい仕事を始めます。
I will be waiting for you in my room.	私は部屋であなたを待っているでしょう。
I want her to do the difficult work.	私は彼女に難しい仕事をやってもらいたい。
I believe it right to tell the truth.	私は真実を語るのが正しいと信じている。
I like walking, especially in the morning.	私は散歩が好きだ。特に朝に。
I tried to get up at six this morning.	私は今朝六時におきようと思いました。
I have a lot of problems at the moment.	私は今たくさんの問題を抱えている。
I look to him for direction in everything.	私は何事にも彼の指導を仰ぐ。
I must return home within a week.	私は一週間以内に故郷に帰らなければなりません。
I know the boy standing over there.	私はむこうにたっている少年をしっています。
I will make every effort to get it.	私はそれを得るためにあらゆる努力をします。
I tried to get it, but to no purpose.	私はそれを得ようとしたが、無駄だった。
I usually got up at five in those days.	私はその当時たいてい５時に起きた。
I'm trying to work out this problem.	私はこの問題を解こうとしているところだ。
I can't make any sense of this letter.	私はこの手紙の意味が全くわからない。
I'm going to stay here for several days.	私はここに数日滞在する予定です。
I am looking forward to seeing you.	私はあなたに会えることを楽しみにしている。
I'm looking forward to seeing you.	私はあなたに会うことを楽しみに待っています。
I wish I had been there with you.	私はあなたと一緒にそこにいたらよかったのだが。
I don't like your going out alone.	私はあなたが一人で外出するのが好きではない。
I ate one and then I ate the other.	私は１つ食べて、それから残り１つを食べた。
My father is to visit Korea next week.	私の父は来週、韓国を訪問する予定だ。
My father objected to my traveling alone.	私の父は私の一人旅に反対した。
My son wants to be a Lincoln.	私の息子はリンカーンのような人になりたいと思っている。
My mother has made me what I am today.	私の今日があるのは母のおかげである。
Who is it that is sleeping on my bed?	私のベッドで寝ているのはいったい誰だ。
I am not going to take this lying down.	私には屈服するつもりはありません。
We should respect the ideas of others.	私たちは他人の考えを尊重すべきです。
We saw something white in the dark.	私たちは暗闇の中に何か白いものを見ました。
Would you mind if I open the window?	私が窓を開けてもかまいませんでしょうか。
It was quite dark when I got home.	私が家へ帰ったときはすっかり暗くなっていた。
Prices have been rising since last year.	昨年より物価の上昇が続いている。
The whole class is present once a week.	クラスの全員が週に一回出席します。
I don't feel like going out this morning.	今朝は出かけたくない気持ちだ。
You have only to follow the directions.	君は指示に従っていればいいのです。
You had better stay here a little longer.	もう少しここにいた方がいいよ。
It is necessary for you to start at once.	君はすぐに出発する必要がある。
Your efforts will pay off one day.	君の努力はいつの日か君のためになるでしょう。
It appears to me that you are right.	君の言っていることが正しいように思える。
You can go or stay, as you wish.	君の決定しだいで行ってもいいしとどまってもいい。
Your English leaves nothing to be desired.	君の英語は申し分ありません。
I think your English has improved a lot.	君の英語はとても上達したと思う。
I'm looking forward to hearing from you.	君から手紙が届くのが楽しみです。
I can't work with you standing there.	君がそこに立っていては仕事ができない。
Our school begins at eight in the morning.	学校は朝八時から始まります。
I would rather stay at home than go out.	外出するより家にいるほうがいい。
The meeting has been put off until next week.	会議は来週までのびた。
We made the best of that bad situation.	我々はあの悪い状況を極力生かした。
Don't risk your health by over drinking.	飲みすぎで健康を危険にさらすな。
Don't attempt two things at a time.	一度に二つのことをやろうとしてはいけない。
Left alone, he began to read a book.	一人になったとき、彼は本を読みはじめた。
I heard my name called in the dark.	暗闇の中で自分の名が呼ばれるのが聞こえた。
While in Europe, she visited Rome.	ヨーロッパにいる間に、彼女はローマを訪れた。
What if he should happen to come late?	もし万一彼が遅れて来たらどうしよう。
You should not take to drinking again.	もう二度と酒にふけってはいけません。
I should have paid a little more attention.	もう少し注意すべきだった。
You talk as if you knew everything.	まるでなんでも知っているような口ぶりだね。
It was not long before we knew the truth.	まもなく私たちは真相を知った。
It's been quite ages since we last met.	ほんとうに久しぶりに会いましたね。
Don't keep me waiting here like this.	ぼくをこうして待たせたままにしないで。
Are you going to visit any other countries?	ほかの国にも旅行しますか。
Helen is always at the top of her class.	ヘレンはいつもクラスでは首席だ。
Tom usually goes to bed at ten-forty.	トムは普通１０時４０分に床に就きます。
How long have you been waiting for me?	どのくらいの間私を待っていましたか。
I am of two minds about which to choose.	どちらを選ぼうか私は迷っている。
But you don't have to stay to the end.	でも最後までいる必要はありませんよ。
Oh, but he did come to Tokyo alone.	でもその子は本当に一人で東京に来たんだよ。
You should eat something before you go.	ちゃんと朝ご飯を食べて行きなさい。
It so happened that they were not there.	たまたま彼らはそこにいなかった。
There are a lot of people walking there.	たくさんの人がそこを歩いている。
That's why I told you not to go by car.	だから車で行くなといったんですよ。
Those books are always in great demand.	それらの本はいつも大変重要である。
It left at two, reaching Rome at four.	２時に出発し、４時にローマに着いた。
Why not talk it over with your teacher?	それについて先生と相談してみたら？
I found it easy to answer the question.	その問題は解いてみると簡単でした。
The difference is not so great for me.	その相違は私にはそれほど重要でない。
It won't take long to do the job.	その仕事をするのにそう長くはかからないだろう。
Shakespeare is the author of Hamlet.	シェイクスピアはハムレットの著者である。
I'll give up drinking once and for all.	これを最後にきっぱり酒をやめます。
These products are of the same quality.	こちらの製品は同じ品質になります。
This book is especially difficult to read.	この本は特に読むのが難しい。
There is not much difference between the two.	この二つは大同小異だ。
You will find this game very interesting.	このゲームは面白いと分かるよ。
Let's put up the Christmas tree here.	ここにクリスマスツリーを立てましょう。
Might I ask your name and address?	お名前と住所お聞きしてもよろしいでしょうか。
I brought you up under my personal care.	お前はわしが手塩にかけた人間だ。
Drinking too much is bad for the health.	お酒の飲み過ぎは健康に害がある。
Wendy, I'd like you to meet my brother Sam.	ウェンディ、弟のサムだよ。
When to set off is a difficult problem.	いつ出発するのかは難しい問題です。
No action is in itself good or bad.	いかなる行為もそれ自体は良くも悪くもない。
One day she and I visited an old friend.	ある日彼女と私は旧友を訪問した。
Today is my second day of my side job.	アルバイトを始めて今日で２日目です。
You may stay here as long as you like.	あなたは好きなだけここにいてもよい。
You see everything in terms of money.	あなたは、全てをお金の観点で見ている。
I am looking forward to your letter.	あなたの手紙を私は楽しみに待っています。
We are looking forward to seeing you.	あなたに会える日を楽しみにしています。
I am looking forward to seeing you.	あなたにお会いするのを楽しみにしています。
How would you deal with the problem?	あなただったらその問題をどう処理するか。
What you said was in the main right.	あなたが言ったことはおおむね正しかった。
WHO stands for World Health Organization.	ＷＨＯとは世界保健機構を表す。
CDs have taken the place of records.	ＣＤがレコードに取って代わってしまった。
"What happened?" "The car broke down."	「どうしたんだ」「車が故障したんだ」
He suggested to me that we should go.	「さあ行きましょう」と彼は私に言った。
Class doesn't begin until eight-thirty.	授業は８時３０分までは始まらない。
There are two reasons that can be considered.	２つの原因が考えられます
They try to understand each other better.	彼らがさらにお互いの理解を深める
The offer for office space has been closed.	貸し事務所募集を終了しました
It will bring out the potential of children.	それが子供の能力を引き出す
I want to run a Windows 95 game.	Windows95対応のゲームを動かしたいのです。
Line up and walk to the door in order.	列になってきちんと戸口まで歩きなさい。
The food was so good that I ate too much.	料理がおいしくてつい食べ過ぎた。
I am thinking of going to Kobe next week.	来週神戸へ行こうかと考えている。
Should I be late, don't wait for me.	万一私が遅れたら、私を待たないでください。
The prices are going up higher and higher.	物価はますます上昇しています。
My father is usually at home on Sundays.	父は、日曜日はたいてい家にいます。
Her voice began to rise as she spoke.	彼女は話しているうちに語気が強くなった。
She fell in love with her friend's brother.	彼女は友人の兄と恋に落ちた。
She asked me if I knew her address.	彼女は僕に彼女の住所を知っているかと尋ねた。
She was seen to walk out of the room.	彼女は歩いて部屋を出て行くのを見られた。
She was not interested in boys at all.	彼女は男の子達には全く関心がなかった。
She was not interested in boys at all.	彼女は男の子たちに全く関心がなかった。
She gives too much money to her son.	彼女は息子にあまりにも大量のお金を与えた。
She was at a loss what to do next.	彼女は次に何をしたら良いのか途方に暮れました。
She is a good teacher, as teachers go.	彼女は一般の先生と比べればよい先生だ。
She made herself known to the company.	彼女はそこにいる人たちに自己紹介した。
She brought up the three children alone.	彼女は１人で３人の子どもを育てた。
Her mother does aerobics once a week.	彼女の母親はエアロビクスを週に一回行う。
Her brother Kensaku is now in Brazil.	彼女の弟の健作君はいまブラジルにいます。
You'll find it difficult to meet her.	彼女に会うのはむずかしいとわかるだろう。
We must allow for her poor health.	彼女が体が弱い事を考慮に入れなければならない。
