He worked hard to support a large family.	彼は大家族を養うために懸命に働いた。
He works as hard as any other student.	彼は他のどの学生にも劣らず熱心に勉強する。
He will be a Newton in the future.	彼は将来、ニュートンのような大科学者になるだろう。
He told me that the book was interesting.	彼は私にその本はおもしろいと言った。
What do you think he meant by that?	彼はそれをどんなつもりで言ったのだと思いますか。
He studies hardest of all the students.	彼はすべての学生の中で一番よく勉強する。
He received a good education in England.	彼はイングランドで立派な教育をうけた。
Have you sent him a Christmas card yet?	彼にもうクリスマスカードを送りましたか。
My association with him did not last long.	彼とのつきあいは長く続かなかった。
It being Sunday, I didn't get up early.	日曜日だったので、私は早く起きなかった。
Do you have a similar saying in Japanese?	日本にも同様のことわざがありますか。
No students could answer the question.	生徒は誰もその質問に答えられませんでした。
There are some children playing in the park.	数人の子供が公園で遊んでいる。
People were moving faster and faster.	人々はもっともっと早く動くようになりました。
Would you please let me know the delivery time?	出荷時をご連絡ください。
You must not talk to each other in class.	授業中におしゃべりをしてはいけない。
Will you put your questions in written form?	質問は書いていただけませんか。
I will be seeing her again next Friday.	次の金曜日にもう一度彼女に会うでしょう。
The next meeting will be on the tenth of June.	次の会合は６月１０日です。
Only a few people showed up on time.	時間どおりに現れたのは２、３人しかいなかった。
Don't talk to others during the class.	事業中はほかの人に話し掛けてはいけません。
We played a lot of games at the party.	私達はパーティーでいろいろなゲームをした。
I saw a movie for the first time in two years.	私は二年ぶりに映画を見た。
I found the key for which I had been looking.	私は探していた鍵を見つけた。
I'm very interested in social studies.	私は社会科にはたいへん興味をもっています。
I never go out without buying something.	私は外出すると必ず何かを買ってしまう。
I have received no reply from you yet.	私はあなたからまだ返事をもらっていません。
I was born on the 22 of November 1948.	私は１９４８年１１月２２日に生まれました。
I became a member of the club in 1980.	私は１９８０年にそのクラブの会員になった。
Will you go to the meeting in my place?	私の代わりにその会に行ってくれませんか。
My house is on the south bank of the Thames.	私の家はテムズ川の南岸にある。
I have a lot of questions to answer.	私には答えなければならない質問がたくさんある。
Both he and I were members of that club.	私と同様に彼もクラブのメンバーだった。
We took care of our children by turns.	私たちは代わる代わる子供たちの面倒を見た。
We used to meet on our way to school.	私たちはいつも学校へ行く途中で待ち合わせた。
We have to pay taxes by March 15.	私たちは３月１５日までに税金を払わなければならない。
There is a garden at the back of our house.	私たちの家の後ろに庭があります。
It is five years since we moved here.	私たちが当地に引っ越してから５年になります。
It is five years since we moved here.	私たちがここに引っ越して来てから５年になる。
It's been three years since I moved here.	私がここに引っ越してきて３年になる。
Is this today's issue of the Asahi Shimbun?	これは今日発行の朝日新聞ですか。
Might I ask you a personal question?	個人的なことをお聞きしてもよろしいでしょうか。
You can't have understood what he said.	君に彼の言ったことがわかったはずがない。
Students have access to these computers.	学生はこのコンピューターを利用できる。
We hadn't so much as heard of her name.	我々は彼女の名をきいたことさえなかった。
It took them two years to build the house.	家を建てるのに彼らは２年かかった。
English is not easy, but it is interesting.	英語は簡単でない、しかし面白い。
I'd like to have a good talk with her.	一度彼女とゆっくり話をしてみたいものです。
It is important for us to choose good friends.	よい友を選ぶことは大切だ。
Were I you, I would apply for the job.	もしあなたなら、その仕事に申し込むだろう。
We tried it again, but couldn't do it.	もう一度それをやってみたが、できなかった。
We tried it again, but couldn't do it.	もう１度それをやってみたが、できなかった。
It was not long before we heard the news.	まもなく私たちはその知らせを聞いた。
Tommy couldn't answer the last question.	トミーは最後の問題に答えられなかった。
I can't figure out why she didn't come.	どうして彼女がこなかったのかわからない。
However we go, we must get there by seven.	どういっても七時までにいかないと。
I don't know how to put it in Japanese.	それを日本語でどういうのがわかりません。
This is the only possible time for doing that.	それがやれるのは今だけだ。
No animals are to be found on the island.	その島で動物はぜんぜん見当たらない。
At that time, she was a student at Yale.	その頃彼女はエール大学の学生であった。
The park was designed for small children.	その公園は小さな子ども用に造られた。
The school supplies the students with books.	その学校は生徒に本を支給する。
There are 2,000 students in the school.	その学校には二千人の学生が在学している。
That was why he entered the university.	そのようにして、彼はその大学に入学した。
The news has just come on the radio.	そのニュースはちょうどラジオで流れたところだ。
It all amounts to a lot of hard work.	そうなるとかなりきつい仕事ということになる。
That was why he entered the university.	そういうわけで、彼はその大学に入学した。
Mr Johnson ran fastest of the three.	ジョンソン氏は、３人の中でいちばん速く走った。
Mr George is liked by all the students.	ジョージ先生は生徒全員から好かれている。
It is no use talking with them any longer.	これ以上彼らと話し合っても無駄だ。
There's too much money in these accounts.	これらの口座に金が多く入り過ぎてる。
You'll find this book very interesting.	この本がとても面白い事がわかるでしょう。
This road will take you to the post-office.	この道を行くと郵便局があります。
Please put down your name in this book.	この帳面にあなたの名前を書いてください。
If only there were no wars in the world.	この世界に戦争なんてなければよいのに。
You can put this car to use as you like.	この車を好きなときに使っていいですよ。
Let me put this business in your hands.	この仕事は君の手にまかせようじゃないか。
I'd like to send this package to Japan.	この荷物を船便で日本に送りたいのですが。
I found this film very interesting.	この映画はとてもおもしろいということが分かった。
This movie is very interesting to me.	この映画は、わたしにはとても興味があります。
This was how he entered the university.	このようにして、彼はその大学に入学した。
The two of them were never to meet again.	この２人は二度と会えない運命だった。
This was why he entered the university.	こういうわけで、彼はその大学に入学した。
Did you buy her something for Christmas?	クリスマスに彼女に何か買ってあげたの？
I have something to live for in music.	おんがくにわたしは生きがいを持っています。
Elmore James got nothin' on this, baby.	エルモア・ジェイムズのコピーじゃないぜ。
I would like to see you again some day.	いつかまたあなたにお会いしたいものです。
I've called and called, but there's no answer.	いくら呼んでも返事がない。
He is not very fast at making friends.	あの人は友達をつくることがあまり速くない。
Are you a student of a private high school?	あなたは、私立高校の生徒ですか。
It's your turn. Please come this way.	あなたの番です。どうぞこちらへ来てください。
I am sending you a picture of my family.	あなたに私の家族の写真を送るつもりだ。
Please make three copies of each page.	１ページにつき、３枚ずつコピーして下さい。
She's asking how that's possible.	彼女は、どうしてそんなことが可能なのかと尋ねている。
"Seen my cell phone?" "On the table!"	「俺の携帯見なかったか？」「テーブルの上よ」
The results of the meeting have not come out yet.	まだ会議の結論が出ない
He presented these results at a conference.	彼がこの成果を，学会で発表しました
He shows children how hard he tries.	彼が最大限の努力をしている姿勢を子供たちに見せる
He always has a lot of people around him.	彼の周りにはいつも多くの人が集まります
They all had a lot of their own problems.	それらはそれぞれ多くの問題を抱えていた
There are always a lot of people around him.	彼がいつも大勢の人に囲まれている
He copies the file to the directory 1.	彼がファイルを１のディレクトリにコピーします
What's important is how much should be given.	どれくらい与えられるかが肝心だ
For example, it is 7:00 a.m. in London now.	例えば、ロンドンは今は朝７時です。
There is a conference going on in the next room.	隣の部屋では会議中です。
You will have to study harder next year.	来年はもっと勉強しなければいけませんよ。
We are not always at home on Sundays.	僕たちは日曜日にいつも家にいるとは限りません。
She had never seen New York before.	彼女は今までニューヨークを見物したことがなかった。
She was born and brought up on the backstreets.	彼女は下町で生まれ育った。
She always keeps her room in good order.	彼女はいつも部屋をきれいに整頓している。
He shall not come into this house again.	彼をこの家へ２度と入れさせないつもりだ。
They will fall in love with each other.	彼らはお互いに恋をするようになるでしょう。
They were never to see each other again.	彼らは２度と互いに会えない運命であった。
My association with them didn't last long.	彼らとのつきあいは長く続かなかった。
He has four children to provide for.	彼は養っていかなければならない四人の子供がいる。
He said that he had met her a week before.	彼は彼女に１週間前に会ったといった。
He is one of the greatest artists in Japan.	彼は日本の最高の芸術家の１人です。
He was a general in the Second World War.	彼は第二次世界大戦では陸軍大将だった。
He gave me a select brand of canned goods.	彼は私に缶詰の極上品を贈ってくれた。
He is the last man that I want to talk with.	彼は私が最も話をしたくない人だ。
He has much money but few friends.	彼は金はたくさん持っているが、友達はほとんどいない。
He doesn't know who built those houses.	彼はそれらの家をだれが建てたのか知らない。
He has a good understanding of the problems.	彼はその問題を良く理解している。
Do you think he is good for the position?	彼はその地位に適していると思いますか。
He was the very man for such a position.	彼はそういう職にうってつけの人であった。
This is the second time that I have met him.	彼に会ったのはこれで２度目です。
Japanese has something in common with Korean.	日本語は朝鮮語と共通点がある。
I like taking care of animals very much.	動物の世話をするのがとても楽しいんです。
A lot of jobs are done by computers.	多くの仕事がコンピューターによってなされている。
All students have access to the library.	全学生はみんな図書館に入ることができる。
We took up that problem at the last meeting.	前の会議でその問題を取り上げた。
The time may come when we will have no war.	戦争のない時代が来るかもしれない。
There are a lot of students in the library.	図書館にはたくさんの学生がいます。
The best time of life is when you are young.	人生で一番いい時は、若い時です。
Don't talk to others during the class.	授業中はほかのの人に話しかけてはいけません。
While you're young, you should read a lot.	若いうちにたくさんの本を読むべきだ。
In fact, he has never been to New York.	実は、彼はニューヨークには行った事がない。
It's not easy to keep up with the times.	時代の流れについていくのは容易ではない。
Have you heard about the result of the game?	試合の結果について聞きましたか。
I asked him not to drive so fast.	私は彼にそんなにスピードを出さないでくれと頼みました。
I came to know many university students.	私は多くの大学生と知り合うようになった。
I met one of my friends on my way home.	私は家に帰る途中で私の友人の一人に会った。
I can't understand the meaning of this word.	私はこの単語の意味がわからない。
I really have to do this work today.	私はこの仕事を今日どうしてもしなければならない。
I would like to get a camera like this.	私はこのようなカメラを買いたいと思います。
I don't know both of your children.	私はあなたの子供を２人とも知っているわけではない。
I don't understand what you are saying.	私はあなたのおっしゃることが分かりません。
I'm about to tell you the answer.	私はあなたに答えを教えてあげようとしているところです。
You are welcome to any book in my library.	私の書斎の本は自由に使ってください。
You're welcome to any book in my library.	私のところの図書は自由にお使い下さい。
The building was still there in my time.	私のいたころはまだその建物はありました。
We are thinking of moving back home.	私たちは生まれ故郷に引っ越そうかと考えています。
We're saving up to build a new house.	私たちは新しい家を建てるために貯金をしている。
We were to have met there at seven.	私たちは７時にそこで会うことになっていたのですが。
Let's try to make our world better.	私たちの世界をもっとよいものにするように努めよう。
Our business calls for a lot of people.	私たちの仕事は多数の人間を必要としている。
Our class is made up of 30 students.	私たちのクラスは３０人の生徒から成り立っている。
He never hears what I'm trying to say.	私がいたって彼がいうこと聞く訳ないじゃない。
Children should be seen and not heard.	子供たちは目の届く所にいて何も言わぬがよい。
The building built last year is very big.	昨年建てられたその建物はとても大きい。
What you do is more important than what you say.	行動は言葉より大切です。
Kenji is always the first to come to school.	健二はいつも真っ先に学校に来る。
It will not be long before we know the result.	結果はまもなく分かるだろう。
I couldn't help but fall in love with you.	君を好きにならずにはいられなかった。
You need not have come here so early.	君はそんなに早くここに来る必要はなかったのに。
You should not think little of this result.	君はこの結果を軽視すべきじゃない。
Tell me about your program for the future.	君の未来計画について話してください。
What you have said doesn't apply to you.	君の今言ったことは、君にあてはまらない。
It will do you good to have a holiday.	休日をとるのが、あなたの身体によいでしょう。
Some of the students come to school by car.	学生の中には車で通学する者もいる。
Mr Kato was too old to work any longer.	加藤さんは年をとりすぎてもう働けなかった。
You don't... you don't talk to me like that.	俺に・・・俺にそんな口をきくな。
You can't see too well with these LCD displays.	液晶画面は、見にくいなぁ。
What is the easiest way to learn English?	英語を学ぶ最もやさしい方法は何ですか。
People in general are against the new law.	一般に人々は新しい法律に反対である。
I think it is my business to study hard.	一生懸命に勉強するのが私の仕事だと思う。
Michael had a hard time making ends meet.	マイケルは収支を合わせるのに苦労した。
Cover your head when you are in the sun.	ひなたにいる時は何かかぶっていなさいよ。
Please feel free to ask me any question.	どんな質問でも私に気軽に尋ねてください。
In any case, you have to study hard.	とにかくあなたは一生懸命勉強しなければならない。
What makes you think that I'm against that?	どうして私が反対だと思うのですか。
How come you didn't call me last night?	どうして昨夜、私に電話しなかったのですか。
What about watching the night game on TV?	テレビでナイターを見るのはどうですか。
I couldn't answer any questions on the test.	テストで一問も答えられなかった。
It fell out that he could not come in time.	たまたま彼が間に合わなかったのだ。
Put it where children can't get at it.	それを子供たちの手の届かない所に置きなさい。
Are they displayed all through the year?	それらは１年を通してずっと飾られている。
It's in a small room at the end of garden.	それは庭の隅の小さな部屋にあります。
Does that mean you want to break up?	それは我々の関係を終わらせたいということですか。
The old man was not as mean as he looked.	その老人は見かけほど意地悪くなかった。
There were no radios in Japan in those days.	その当時日本にラジオはなかった。
There are many people and cars on that street.	その通りは車や人の量が多い。
There are stores on each side of the street.	その通りの両側に店が並んでいる。
It fell to me to take care of the baby.	その赤ん坊の面倒を私が見なければならない。
The information is very important to us.	その情報は私達にとっては非常に重要です。
You shouldn't make too much of the fact.	その事実をあまりに過大視すべきではない。
The movie was interesting to all of us.	その映画は私達みんなにとって興味深かった。
It must have something to do with money.	そのことはお金に関係があったに違いない。
Well, at least let me set up the table.	じゃ、せめてテーブルの準備でもしましょう。
Jeff thinks he will never fall in love.	ジェフは恋に落ちたりはしないと思っている。
Would you like some of those pictures?	これらの絵でどれか気にいるものがありますか。
This book is as interesting as that book.	この本はあの本と同じくらいおもしろい。
This room is too hot for us to work in.	この部屋は暑すぎて私たちは仕事ができない。
This association shall be called the E.S.S.	この会の名称はＥ．Ｓ．Ｓ．とする。
Will this amount of money meet your need?	このお金であなたの要求に見合いますか。
Is it possible to be here a little longer?	ここにもう少しいることができますか。
Could you tell me what to put here?	ここには何を記入したらよいか教えてくださいますか。
Let's try to understand one another.	お互いを理解し合うようにしようではありませんか。
The British government is against the plan.	イギリス政府はその計画に反対です。
We have received many orders from the U.S.	アメリカからたくさん注文がきている。
That company just put up a web page.	あの会社もついにホームページを立ち上げたらしい。
They say that the movie is an interesting one.	あの映画は面白いのだそうだ。
Let me have a look at that book of Tom's.	あのトムの本をちょっと見せてください。
I never see you without thinking of Ken.	あなたを見ると必ずケンのことを思い出す。
You must watch your step all the way.	あなたは途中ずっと足元を見なければいけません。
All you have to do is study harder.	あなたはもっと一生懸命勉強しさえすればいいのです。
You mustn't park the car in this street.	あなたはこの通りに駐車させてはいけない。
Who is the man that you were talking with?	あなたが話していた人はどなたですか。
If you care to come, you will be welcome.	あなたが来たいというのなら大歓迎です。
Your help will save us a lot of work.	あなたが手伝ってくれれば、大いに手間が省ける。
Bill was too young to take the post.	ビルは若すぎてその役職につくことができなかった。
There are many words that I don't understand.	分からない言葉がたくさんある。
Which is best, white thread or red thread?	赤い糸と白い糸、どっちがいいですか。
They were in that room with me all night.	彼らは一晩中その部屋で私と一緒だった。
I never felt this way before I met you.	こんな気持ちにさせてくれる人は初めてだよ。
It's said this period lasts for three months.	この期間が３ヶ月と言われています
In that case, there are three possible ways.	その場合は３つの方法が考えられます
There are two courses in this package.	このパックには、２つのコースをご用意しています
There are a lot of people like that around.	そのような人が周りにいっぱい居ました
As a result, more than 40 items were found.	結果４０点以上の商品が見付かりました
Something similar to the current system was built.	ほぼ現在の体制が整った
People are not that interested in him any more.	彼がそれほど興味を持たれない
Click the picture to go to the next page!	画像をクリックすると次ページへ移ります！
The present password is "eosdigital".	現在のパスワードは"eosdigital"です。
The question is who will go there for him.	問題は誰が彼のかわりにそこへ行くかだ。
I never meant to have you pay the bill.	僕は君に勘定を持ってもらうつもりは無かった。
It's not easy to figure out the cost.	費用がいくらかを算出するのは容易ではありません。
She did not answer all the questions.	彼女は必ずしもすべての質問に答えたわけではない。
She studied English as hard as she could.	彼女は出来るだけ一生懸命英語を勉強した。
She worked hard on account of her children.	彼女は子供達のために一生懸命働いた。
She told the children an interesting story.	彼女は子供たちにおもしろい話をした。
She said that she has never been there.	彼女はこれまでそこに行った事はないと言った。
When I called on him, he was hard at work.	彼を訪ねたとき、彼は忙しく働いていた。
It is important for them to do their best.	彼らは自分の最善を尽くすことが大切だ。
They set the time and place of the wedding.	彼らは結婚式の日取りと場所を決めた。
They are not interested in saving money.	彼らはお金を貯めることに関心がありません。
They were, for the most part, college students.	彼らの大部分は大学生だった。
He didn't show up at the party last night.	彼は夕べのパーティーには現れなかった。
He applied for a job with the Bank of Tokyo.	彼は東京銀行へ就職の願書を出した。
He put up a notice about the change in price.	彼は価格変更のビラをはり出した。
He opened a checking account with the bank.	彼はその銀行で当座預金口座を開いた。
He is said to know a lot about Spain.	彼はスペインについてはいろいろ知っているようだ。
It is easy for him to answer this question.	彼がこの質問に答えることは容易です。
It is fact that he wants to visit Egypt.	彼がエジプトに行きたがっているのは事実だ。
We worked hard so as to increase our sales.	売り上げを伸ばすために懸命に働いた。
How about going to the movies on Saturday?	土曜日に映画を見に行くのはどうですか。
All the students go home early on Saturday.	土曜日には生徒はみんな早く帰宅する。
A change of air will do you a lot of good.	転地療養は大いに君のためになるだろう。
