He is always saying bad things about others.	彼は絶えず他人の悪口ばかり言っている。
He was so kind as to show me around the town.	彼は親切にも私に町を案内してくれた。
It is likely that he kept me waiting on purpose.	彼は私をわざと待たせたようだ。
He had to leave for Tokyo on short notice.	彼は急に東京に向かわなければならなかった。
He remained at the top of the class at school.	彼は学校ではクラスの首席で通した。
He always tries to see the good in others.	彼はいつも他人の良いところを知ろうとする。
I had no choice but to do what he asked.	彼に頼まれたことをやるより他に仕方がなかった。
The place where he lives is far from town.	彼が住んでいる所は町から遠い所に在ります。
It never occurred to me that he loved me.	彼が私を愛しているなんて思っても見なかった。
Can you make out what he is trying to say?	彼が何を言おうとしているか理解できますか。
It will be dark by the time he gets there.	彼がそこに着く頃には暗くなっているだろう。
He left for England at the beginning of August.	八月のはじめに彼は英国へ立った。
The older you get, the less sleep you need.	年を取れば取るほど、眠る必要がなくなる。
Can I talk to someone who speaks Japanese?	日本語が話せる人と替わってもらえませんか。
In Japan, also, deindustrialization is happening.	日本も産業空洞化しています。
The population of Japan is about 120 million.	日本の人口は約1億2000万人です。
The Japanese national power is still developing.	日本の国力はまだ発展している。
You need not come to the office on Saturdays.	土曜日には出社する必要がありません。
The population of China is 8 times that of Japan.	中国の人口は日本の８倍です。
Who can deal with this difficult situation?	誰がこの難しい事態に対処できるだろうか。
To begin with, you must not be late for school.	第一に君は遅刻してはいけません。
On the other hand a lot of people die young.	他方、多くの人間が若くして死んでいる。
Looking out the window, I saw a car coming.	窓の外を見ると、車が１台来るのが見えた。
Teachers help to form the minds of children.	先生は子どもの心を形成するのを助ける。
You must pay attention to the teacher.	先生のおっしゃることを注意して聞かねばなりません。
You never can tell what'll happen in the future.	先の事など誰にも予想できない。
The government had to make up for the loss.	政府はその損害を補償しなければならない。
The time will come when you will know the truth.	真実を知るときが来るでしょう。
The new model will be priced at $12,000.	新型は１２０００ドルの価格が付けられるだろう。
Food prices will come down soon, won't they?	食料品の値段はすぐに下がるでしょうね。
Little children like to touch everything.	小さな子供は何にでも触ってみるのが好きです。
I wish I'd studied harder when I was young.	若いときにもっと勉強しておけばよかった。
The car broke down, so that we had to walk.	車が故障したので、歩かねばならなかった。
To tell the truth, I don't really like him.	実を言うと、私はあまり彼が好きではない。
To tell the truth, I have no money with me.	実を言うと、金の持ち合わせがないんです。
There are some children around the office.	事務所のまわりに何人かの子供たちがいます。
We called on our English teacher the other day.	私達は先日英語の先生をたずねた。
I know not only the father, but also the son.	私は父だけでなくむすこも知っている。
I am looking forward to hearing from him.	私は彼から便りが来るのを楽しみに待っている。
I am interested in old cities in the world.	私は世界の古い都市に興味を持っています。
Not until this morning did I learn the truth.	私は今朝になって初めて真実を知った。
I'm going to leave about ten in the morning.	私は午前１０時ごろ出発するつもりです。
Henry said that he couldn't wait any longer.	私はもう待てませんとヘンリーは言った。
I saw the old man two or three times a week.	私はその老人を、週に２．３回見かけた。
If I knew the truth, I would tell you.	私は、本当のことを知っていればあなたに話すのだが。
My son still believes in Santa Claus.	私の息子はいまだにサンタクロースがいると信じている。
I have no friend with whom to talk about it.	私にはそのことで相談する友人がいない。
We'll leave Tokyo for Osaka next week.	私たちは来週大阪に向かって東京を出発する予定です。
We'll never reach London before dark.	私たちは日暮れまでには絶対ロンドンに着かないだろう。
We tried it again, but couldn't do it.	私たちはもう一度それをやってみたが、できなかった。
What will we be doing this time next week?	私たち、来週の今ごろは何をしているかしら。
I lied to him and he lied to me in turn.	私が彼に嘘をつくと、今度は彼が私に嘘をついた。
Children don't like to go out in the dark.	子供は暗がりには出て行きたがらないものだ。
As yet, I have not completed the work.	今までのところ、まだその仕事は出来上がっていない。
The man walking over there is our teacher.	向こうを歩いている男の人は私達の先生です。
Some consider language as a form of knowledge.	言語を知識の形態と考える人もいる。
You'll learn how to do it sooner or later.	君は遅かれ早かれ、そのやり方を知るだろう。
You should return home before it gets dark.	君は暗くならないうちに家に帰るべきです。
Are you sure about the cost of that car?	君はその車の値段をはっきり知っているのですか。
You may choose either of the two books.	君は、その２冊の本のうち、どちらを選んでもよい。
It is very difficult for you to do this work.	君がこの仕事をするにはかなり難しい。
I ran into a friend while walking in Ginza.	銀座を歩いている時、偶然友達に出会った。
I wish I could think of something to say.	気の利いたことが言いたいけれどいえないなあ。
We are looking forward to seeing you soon.	間もなくお会いするのを楽しみにしています。
We set to work with all our might and main.	我々は全力をつくして仕事に取り掛かった。
We must always stand up for our rights.	我々はいつも自分の権利を擁護しなければならない。
Our problem is how to get in touch with him.	我々の問題は彼といかに連絡をとるかだ。
As I left the house, I remembered the key.	家を出たとき、私はかぎのことを思い出した。
There has to be a first time for everything.	ものには全て始めというのがあるはずだ。
You had better begin with easier questions.	もっともやさしい問題から始めた方がいい。
The town will change in another ten years.	もう１０年経てばその町は変っているだろう。
Mary is at a loss what to say to him.	メアリーは彼に何といったら良いのか途方に暮れている。
I am looking forward to seeing you again.	またお目にかかれるのを楽しみにしております。
I have a great mind to do that myself.	ぼくは自分でそれをやってみたいと大いに思っている。
Do you feel pain in any other part of your body?	ほかに痛いところはありますか。
While staying in Paris, I happened to meet him.	パリに滞在中に、偶然彼に会った。
You can't have your own way in everything.	なんでも自分の思い通りにいくとは限らない。
Tom came running with a letter from Judy.	トムはジュディからの手紙を持って走ってきた。
Tom's Japanese is improving little by little.	トムの日本語は少しずつ進歩している。
We were quite at a loss which way to go.	どちらの道をいけば良いのか全く分からなかった。
If anything, she isn't any better today.	どちらかと言えば、彼女は今日も具合がよくない。
Do you hear from your son from time to time?	ときどき息子さんから便りがありますか。
The boy standing by the door is my brother.	ドアのそばの立っている少年は私の弟です。
Let's keep going and see the next town.	ちょっと足をのばして、次の町まで行ってみようよ。
He is the lowest of the low to tell such a lie.	そんな嘘をつくなんて彼は最低だ。
That's a job of your own choosing, isn't it?	それはあなたが自分で選んだ仕事でしょ。
You shouldn't have come here to begin with.	そもそもここへ来ては行かなかったのです。
The old woman gave me two interesting books.	その老婦人は私に面白い本を２冊くれた。
It happened that there was a meeting on that day.	その日たまたま会合があった。
The two boys are much the same in English.	その二人の少年は英語の力がほとんど同じだ。
In those days, he lived in the house alone.	その当時、彼は一人でその家に住んでいた。
The little girl asked a question of her teacher.	その女の子は先生に質問をした。
The company is trying to improve its image.	その会社はイメージアップをはかっている。
I look forward to hearing from you soon.	すぐに連絡をいただけるのを楽しみにしています。
It is said that Mr Jones is a good teacher.	ジョーンズ氏はよい先生だといわれている。
Judy was born on the morning of September 5.	ジュディは９月５日の朝に生まれました。
Do you know any of the boys in this room?	この部屋にいる少年のうち誰か知っていますか。
This car has a better performance than that one.	この車はあの車より性能がよい。
This work is simple enough for a child to do.	この仕事は単純なので子供にもできる。
How long do you plan to stay in this country?	この国はどのぐらいいるつもりですか。
Today it's difficult to make ends meet.	このごろは収入の範囲内でやりくりするのが難しい。
We had better go home rather than wait here.	ここで待つより家に帰った方がよかろう。
Have you made up your mind to become a teacher?	お前は教員になる決心をしたのか。
Come nearer so that I can see your face.	お顔が見えるようにもっと近くにおいでください。
The Olympic Games are held every four years.	オリンピック大会は４年毎に開催される。
Any book will do, so long as it is interesting.	おもしろいならどんな本でもよい。
Try to make the most of every opportunity.	あらゆる機会を最大限に利用するようにせよ。
Everything is subject to the laws of nature.	あらゆるものは自然の法則を受けている。
Those children are waiting for their mother.	あの子供たちはお母さんを待っています。
Take the book which is lying on that table.	あのテーブルの上にある本を取って下さい。
I think it necessary for you to go in person.	あなた自身が行くことが必要だと思う。
You must come back before it gets dark.	あなたは暗くなる前に帰ってこなければなりません。
How long are you going to stay in Japan?	あなたはどれくらい日本に滞在するつもりですか。
Do you remember the town where he was born?	あなたは、彼が生まれた町をご存知ですか。
Be sure to put out the fire before you leave.	君が去る前には火を確実に消しなさい。
I think you will learn a lot more from me.	あなたは私からもっと多くの知識を得るでしょう
I didn't notice at all while I was doing that.	やっている時には全然気がつかなかった
I met him last week for the first time in ages.	私は先週しばらくぶりに彼に会った。
Do you hear someone moving in next room?	隣の部屋で誰かが動き回っているのが聞こえますか。
Not until the following morning did we see land.	翌朝になって初めて大陸が見えた。
The price of books is getting higher these days.	本の値段が最近上がってきている。
My father told me not to read books in bed.	父は私に寝床の中で本を読むなと言いました。
She is looking forward to seeing him again.	彼女は彼に再会するのを楽しみに待っている。
She was looking forward to seeing him again.	彼女は彼に再会するのを楽しみにしていた。
She told him to keep away from bad friends.	彼女は彼に悪友に近づかないようにと言った。
She told him to keep away from bad friends.	彼女は彼に悪友にちかづかないようと言った。
She left the country to get work in the town.	彼女は都会で仕事を得る為に田舎を出た。
She was kind enough to show me around the town.	彼女は親切にも町を案内してくれた。
She could not understand why they fought.	彼女はなぜ、彼らが戦ったのか理解できなかった。
Don't believe her because she always lies.	彼女はいつもうそをつくので、信じてはだめだ。
She is good at making up interesting stories.	彼女は、面白い話を作るのが得意である。
I can't figure out what she really wants.	彼女が本当は何が欲しいのか、私にはわからない。
The man with whom she is talking is Mr Allen.	彼女が話をしている人はアレンさんです。
It never occurred to me that she loved me.	彼女が僕のこと好きだなんて思いもしなかった。
They kept us waiting outside for a long time.	彼らは私たちを長い間外で待たせ続けた。
There are many problems for them to deal with.	彼らが対処すべき問題がたくさんある。
There are many problems for them to deal with.	彼らが解消すべき問題がたくさんある。
He made me sign the paper against my will.	彼は無理やり私にその書類に署名させたのです。
He said that everything would turn out well.	彼は万事がうまくゆくことになるといった。
He had great influence on those around him.	彼は彼の周りの人々に大きな影響を及ぼした。
He came to New York in order to look for a job.	彼は職を探しにニューヨークに来た。
He looks young, but actually he is over forty.	彼は若く見えるが、実際は４０すぎだ。
He often cuts classes on Monday and Saturday.	彼は月曜日と土曜日によく授業をさぼる。
He hasn't come home since he left last week.	彼は一週間前に家を出たなり帰ってこない。
He wished Mary had told him the story.	彼はメアリーがその話をしてくれていたらなあと思った。
The moment he was alone, he opened the letter.	彼はひとりになるとすぐ手紙を開いた。
He is better than any other player in the team.	彼はチームの誰より優秀な選手です。
He didn't notice the change, but I did.	彼はその変化に気がつかなかったが、私は気がついた。
He always stays in bed as late as he can.	彼はいつも出来る限り遅くまでベッドの中にいる。
He said, "My car is always breaking down."	彼は「僕の車は故障ばかりしている」といった。
He is the boy of whom we spoke the other day.	彼は、私たちが先日話題にした少年です。
Go easy on him. He's still new around here.	彼は、まだ新人なんだから大目に見てやれよ。
Though he tried hard, nothing changed.	彼の努力にもかかわらず、すべては以前と変りなかった。
I would rather you hadn't told him the truth.	彼に本当のことを言ってほしくなかった。
Those whom he lived with respected him.	彼と一緒に生活している人たちは、彼を尊敬していた。
It makes no difference whether he comes or not.	彼が来るか来ないかはどうでもいい。
We were talking about him when he appeared.	彼が現れた時、私達は彼のうわさをしていた。
Can you make out what he is trying to say?	彼が何を言おうとしているのか理解できますか。
It being Sunday, I got up late in the morning.	日曜日だったので、私は朝遅く起きた。
It got dark and I was at a loss what to do.	日が暮れて僕はどうしたらよいか困り果てた。
The two cars almost met head-on on the way.	二台の車は道路で正面衝突するところだった。
I happened to be out when the call came.	電話がかかってきたとき私はたまたま外出していた。
For ages, man has been fighting against disease.	長い間、人間は病気と戦ってきた。
No one knows what will happen in the 1990's.	誰も１９９０年代に何が起こるか知らない。
Mr Masuzoe always has lots of books with him.	舛添氏はいつも本をいっぱい抱えている。
You should try to make the most of your opportunities.	出来るだけ利用する。
To tell the truth, I did not make it myself.	実を言うと自分で作ったのではないのです。
The truth is, Ellen liked you a whole lot.	実は、エレンはあなたのことが大好きなんです。
The next thing to be considered was food.	次に考えられるべきことは、食べ物のことだった。
We didn't know which car we should get in.	私達はどの車に乗って良いのかわからなかった。
I haven't got in touch with him for a long time.	私は長い間彼と連絡を取ってない。
I don't like to be kept waiting for a long time.	私は長い間待たされるのは嫌いだ。
I found it difficult to be kind to others.	私は他人に親切にすることは難しいとわかった。
When I was a boy, I often read a book in bed.	私は少年の頃、よくベッドで本を読んだ。
I heard about it from another source last year.	私は去年、それを別の筋から聞いた。
I left the window open all through the night.	私はひと晩窓を開けたままにしておいた。
I am interested in studying German culture.	私はドイツ文化を研究することに興味がある。
I put off answering the letter for a week.	私はその手紙に返事を出すのを１週間延期した。
I am not in the least concerned about the result.	私はその結果に何の関心もない。
I don't like what they call a man of character.	私はいわゆる人格者は好きではない。
I see a girl standing under that tree.	私はあの木の下に立っているひとりの女の子が見えます。
I am looking forward to hearing from you.	私はあなたのお便りを楽しみにお待ちしています。
I'm looking forward to seeing you soon.	私は、まもなくあなたに会う事を心待ちにしています。
I object to you going to Europe alone.	私は、あなたが１人でヨーロッパに行くことに反対です。
What do you say to taking a short walk with me?	私と一緒にちょっと散歩しませんか。
We are all looking forward to seeing you.	私たちはみなあなたに会う事を楽しみにしている。
We live within easy access of Heathrow.	私たちはヒースロー空港にすぐ行ける所に住んでいる。
Let's keep our design dark for a short time.	私たちの計画はしばらく秘密にしておこう。
What do you think happened to our family?	私たちの家庭にどんなことが起きたと思いますか。
The money I have given him amounts to $10,000.	私が彼に与えた金合計１万ドルになる。
Kuniko had already eaten when I came in.	私が入ってきた時、クニ子はすでに食べ終えていた。
Little did they know that we were waiting.	私が待っているとは彼らは夢にも知らなかった。
It is quite a hard thing to bring up a child.	子供を育てることはかなり難しいことだ。
I will watch TV as soon as I get through my job.	仕事が終わったらテレビを見よう。
He said that I shouldn't even be coming in today.	今日は休めと言われたんだけど。
I have a lot of work to get through today.	今日はたくさんの仕事を終えなければならない。
When you come next time, bring your brother.	今度来る時には、弟さんを連れて来なさい。
Have you chosen what to do next Sunday yet?	今度の日曜日に何をするかもう決めましたか。
Some consider language as a form of knowledge.	言語を知識の一形態と考える人もいる。
Your own decision is important before everything.	君自身の決心が何より重要です。
You are no better at remembering things than I am.	君は僕と同様、物覚えが悪い。
Are you planning on staying long in Berlin?	君はベルリンに長期に滞在するつもりですか。
Why don't you try to get your money back?	君はどうして自分の金を取り戻そうとしないのか。
I wish you had told me the truth then.	君はあのとき本当のことを話してくれたらよかったのに。
He began to work for that company last year.	去年から彼はあの会社に勤めているのです。
What is the principle reason for going to school?	学校に行く主な理由は何ですか。
We eat to live, not live to eat.	我々は生きるために食べるのであり、食べるために生きるのではない。
It was not easy to put out the fire at once.	火事をすぐに消すことは容易ではなかった。
Prices are subject to change without notice.	価格は予告なく変更されることがあります。
Speaking English is very difficult for me.	英語を話す事は私にとってはとても難しいです。
You must not eat too much food at one time.	一度にたくさんの食物を食べてはいけません。
It is easy to love, but hard to be loved.	愛することはやさしいが、愛されることは難しい。
When we go to bed, we say "good night".	わたしたちは寝るとき「おやすみなさい」といいます。
Tom was late for class, as is often the case.	よくある事だが、トムは授業に遅刻した。
As is often the case, he was late for school.	よくあることだが、彼は学校に遅刻した。
One more effort, you will get on in life.	もう一頑張りすれば、あなたは出世するでしょう。
What would you do if another war occurred?	また戦争が起こったら、あなたはどうしますか。
I am looking forward to seeing you again.	またお目にかかれますことを楽しみにしています。
I'm looking forward to seeing you again.	またあなたとお会いできるのを楽しみにしています。
To begin with, you have no right to be here.	まず第一に、君にはここにいる権利がない。
I will put this business through in a week.	ぼくはこの仕事を１週間以内にかたづけたい。
Tom stopped to take a close look at the car.	トムはその車をよく見ようと立ち止まった。
I couldn't bring myself to tell her the truth.	どうしても彼女に真実を話せなかった。
Eat what you are served, no buts about it.	つべこべ言わずに、出されたものを食べなさい。
To understand someone is to love someone.	だれかを理解することは、その人を愛することだ。
Try as you may, you can't do it in a day.	たとえどんなにやってみても、一日では出来ない。
That is the principle problem next to education.	それは教育に次いで大きな問題だ。
It has an important influence upon our lives.	それは我々の生活に重大な影響を及ぼす。
In that case, I think you should come in today.	それでしたら今日いらしてください。
You'll find both of the books interesting.	その本は両方ともおもしろいとわかるでしょう。
The war was over at the price of many lives.	その戦争は多くの命を犠牲にして終わった。
The city has a population of about four million.	その市は約４００万の人口がある。
I'll see that it never happens again.	そのようなことが二度と起こらないように注意しましょう。
I remember him saying something about that.	そのことで彼がなにかいったのを覚えている。
And began my first letter to Terry Tate.	そしてテリーテイトに私の最初の手紙を書き始めた。
You had better not walk around in such a place.	こんな所を歩き回らないほうがいい。
Never have I read such an interesting story.	こんなにおもしろい話は読んだことがない。
This is the key which I have been looking for.	これが私がずっと捜していたカギです。
This book is too difficult to read in a week.	この本は難しすぎて１週間では読めない。
This book is easy enough for children to read.	この本は子供でも読めるほどやさしい。
This book is easy enough for children to read.	この本はやさしいので子供でも読める。
This book is easy enough for them to read.	この本はとてもやさしいので、彼らでも読める。
This book is way more interesting than that one.	この本はあの本よりずっと面白い。
This book is so difficult that I can't read it.	この本は難しすぎて僕には読めない。
Which is easier to read, this book or that one?	この本とあの本とどっちがやさしい？
