Turn to the right, and you'll find my office.	右折しなさい、そうすれば私の事務所が見つかります。
Any goods can be supplied at a day's notice.	一日前に予告してもらえばどんな品物でも供給できます。
If you should need any help, just let me know.	もし万一手伝いが必要なら、ぜひお知らせください。
If it were not for the sun, we could not live.	もし太陽がなかったら、我々は生きられないだろう。
What would you do if you were ten years younger?	もし１０歳若ければ、あなたはなにをしますか。
Few people know that Mr. Itsumi is from Kansai.	ほとんどの人は逸見氏が関西出身だとは知らない。
Could you tell me how to get to Park Street?	パーク通りにどうやって行くのか教えていただけますか。
You must put up with your new post for the present.	こんどの勤め口でしばらく辛抱しなさい。
This is the camera with which he took the picture.	これが、彼がその写真を撮ったカメラです。
I never see this picture without thinking of him.	この写真を見るといつも彼のことを思い出す。
Have a good look at this picture and find me in it.	この写真をよく見て私を見つけてごらん。
This job will mean moving to another city.	この仕事を引き受けると他の町へ引っ越すことになるだろう。
Is it all right to take pictures in this building?	この建物の中で写真を撮ってもいいですか。
There are no less than five hundred students here.	ここには少なくても５００人の学生がいる。
Love is as important to me as money is to her.	お金が彼女に大切なのと同じだけ私には愛が大切だ。
So, when are you going to break down and buy a house?	いつになったら家を買うつもりなの？
That amount of food will last them for a week.	あれだけの食料があれば、彼らは１週間持つだろう。
Are you content with your position in the company?	あなたは会社での地位に満足していますか。
May I ask you some questions about your name?	あなたの名前についていくつか質問してもいいですか。
Could you tell me something about your school?	あなたの学校について私に何か教えて頂けませんか。
Your English is too good to be in this class.	あなたの英語はよいのでこのクラスにいる必要はない。
We understand how important personal information is.	当社は個人情報の重要性を認識しています
We will send the following message to each user.	それぞれのユーザに以下のメッセージを送信します
It isn't as if a child learning to talk studies.	話すことを学んでいる子どもは学ぶわけではない。
What would become of us if war should break out?	万一戦争が起こったら、我々はどうなるのだろう。
They aren't children any more, but not adults yet.	彼らはもう子供ではないがまだ大人ではない。
He's very much interested in the Japanese language.	彼は日本語に非常に興味を持っていますよ。
He works few days a week, and gets little money.	彼は週に何日も働かないし、収入もほとんど無い。
I've been friends with him since we were children.	彼とはお互い子供のときからつきあっている。
The movie will have started before we get there.	到着する前に映画が始まってしまうんでしょうね。
He was living in London when the war broke out.	戦争が起こったとき、彼はロンドンで暮らしていた。
I charged them too much money for their room.	私は彼らがあの部屋に泊まるのに、お金を請求しすぎた。
I have to talk with him about the new plan.	私は彼とその新しい計画について話し合わなければならない。
For the life of me I can't understand what you say.	私はどうしても君の言う事が理解できない。
We are going to have a party on Saturday night.	私たちは土曜日の晩にパーティーを開くつもりです。
It cost me a lot of money to build a new house.	私が新しい家を建てるのにたくさん費用がかかった。
At first, I couldn't understand what he said.	最初は私は彼が言っていることを理解できませんでした。
Who was the last person to log on to the computer?	最後にコンピューターを使ったのは誰なのだ。
Harajuku is one of the hottest places in Tokyo.	原宿は東京の中で最も活気のある場所の一つである。
Now you've come of age, you have the right to vote.	君はもう成人したから投票する権利がある。
Not all the students were present at the class.	学生達が全員その授業に出席していたわけではない。
If it were not for the sun, we could not live.	もし太陽がなければ、われわれは生きられないだろう。
It's time to work now. Let's get down to business.	もう仕事の時間だ、仕事に本気で取り組もう。
Please don't let me hear any more of that story.	もうこれ以上その話を私に聞かせないでください。
First, I'll try to understand why he thinks so.	まず、なぜ彼がそのように考えるか理解してみよう。
Bill has a part-time job so that he can buy a car.	ビルは車を買うためにアルバイトをしている。
I understand now why he didn't go to a university.	なぜ彼が大学に行かなかったのか今わかった。
The shops in the street were for the most part closed.	その街の店は大部分閉められていた。
There were thirty people present at the meeting.	その会議に出席していたのは３０名の人であった。
Now let's return to the main problem of education.	さて例の教育に関しての本題に戻るとしよう。
Answer me this. Did you see her there?	これから言うことに答えなさい。あなたはそこで彼女に会ったのですか。
Gordon is interested in the Japanese way of life.	ゴードンは日本の生活様式に興味を持っている。
Watch the camera for me while I make a phone call.	カメラを見ていてね。電話をかけてくるから。
There are many interesting animals in Australia.	オーストラリアには多くのおもしろい動物がいる。
You used to do so when you were a university student.	あなたは大学生の頃はそうしてたもの。
Do you know who brought that team into being?	あなたはそのチームを誰が生み出したか知っていますか。
It was three weeks before she wrote an answer to Tom.	３週間して彼女はトムに返事を書いた。
He watched the news for the first time in a long while.	彼が久しぶりに最近のニュースを見た
He has never come all the way out here to ask about that.	彼がわざわざ訊きに来る筈が無い
A lot of time is still needed before it can be used.	利用できるまでに、まだ多くの時間が必要だ
Many requests will be coming from the committee members.	各委員から多くの要望が出されます
The following will be added to the level 1 functions:	レベル１の機能に下記の機能をプラスする
You can put into practice the plan you thought up.	自分達で考えた企画を実行することができます。
You never read a book without being the better for it.	良書を読めば、必ずそれだけ賢くなる。
She talked on and on about her family problems.	彼女は自分の家族問題についてどんどん話しつづけた。
He couldn't move and had to call for help.	彼は動くことができず、助けを大声で求めねばなりませんでした。
He is one of the up and coming young men of the party.	彼は党の活動的な若手のひとりである。
He works a few days a week, and gets a little money.	彼は週に２、３日働いて少しお金をもらう。
The world has seen a lot of changes in many fields.	多くの分野で世の中はずいぶん変わりました。
If you get up early, you can be in time for school.	早く起きれば、あなたは授業に間に合います。
I haven't seen Karen since we fell out last month.	前月仲たがいして以来カレンには会っていない。
I have to talk with her about the new plan.	私は彼女とその新しい計画について話し合わなければならない。
I couldn't figure out what he was talking about.	私は彼が何について話しているのか分からなかった。
We studied the road map of the country around Paris.	私たちはパリ周辺地方の道路地図を調べた。
Any student in our college can use the computer.	私たちの大学のどの生徒もコンピューターを使える。
When I called on him, he was talking on the phone.	私が彼をたずねた時、彼は電話ではなしていた。
It cost me a lot of money to build a new house.	私が新しい家を建てるのにたくさんのお金がかかった。
Written for children, this book is easy to read.	子供向けにかかれているので、この本は読みやすい。
Children should not have more money than is needed.	子供に必要以上のお金を持たせてはならない。
In case you go out before 5, just let me know.	五時前にお出かけのときは、ちょっと知らせてください。
You are working too hard. Take it easy for a while.	君は働きすぎだよ。しばらくのんびりしたら。
Students will take one of these English courses.	学生はこれらの英語コースの中から１つを受講する。
I asked the student what image he had of black people.	学生に黒人に対するイメージを聞いた。
All we need now is action, not discussion.	我々に今必要なのは行動することであって話し合うことではない。
It's time to work now. Let's get down to business.	もう就業時間です。仕事にとりかかりましょう。
I met Roy, who asked me to give you this one.	ぼくはロイに会ったら、これをきみに渡すように頼まれた。
Why didn't you let me know you were in New York?	なぜ君はニューヨークにいることを知らせてくれた。
It was something she did not want to put into words.	それは彼女が言葉にしたくないことだった。
It is five years since the book was made into a movie.	その本が映画化されてから５年になる。
Many young people are out of work in that country.	その国ではたくさんの若い人々が失業している。
The student who is talking with John is from Canada.	ジョンと話している学生はカナダ出身です。
It takes a lot of money to keep up such a big house.	こんな大きな家を維持するのは金がかかる。
This tour takes in each of the five main islands.	この旅行には主な五つの島がどれも含まれている。
Every time I read this book, I find something new.	この本を読むたびに、何か新しい発見をします。
I'd like two copies of each of these documents.	この書類をそれぞれ２部ずつコピーしてほしいんだが。
Would you take a picture of us with this camera?	このカメラで私たちの写真を撮っていただけますか。
Those officials don't understand finance at all.	あの役人たちは全然、財政のことはわかっていない。
You should turn in your paper by next Saturday.	あなたは、来週の土曜日までに論文を提出すべきです。
If he goes on like that, he will never amount to much.	ああいう風ではたいした者になれまい。
"I understand how you feel, Hiroshi," says Mike.	「博、君の気持ちは分かるよ」とマイクが言います。
Young men such as you are needed for this work.	例えばあなたのような若い人たちがこの仕事には必要だ。
At night we can see more stars there than in Tokyo.	夜は、そこでは東京よりたくさんの星が見える。
She studies as hard as any student in her class.	彼女はクラスのどの生徒にも劣らず一生懸命勉強する。
She always lets her children do what they want to.	彼女はいつも子供たちにやりたいことをやらせる。
I don't like her, because she always puts on airs.	彼女はいつも気どっているので、ぼくはきらいだ。
One of her three cars is blue and the others are red.	彼女の３台の車の１台は青で、残りは赤だ。
I really don't understand what's up with her.	彼女がいったいどうなってしまったのか、私にはわからない。
They study in order that they may enter the university.	彼らは大学へ入る目的で勉強している。
He has changed a lot, and he is not what he was.	彼は随分変わってしまって昔の彼ではなくなっている。
He moved to New York, where he looked for a job.	彼はニューヨークへ引っ越して、そこで仕事を探した。
He has given up trying to put the papers in order.	彼はその書類を整頓しようとするのをあきらめた。
We must take into account the fact that he is young.	彼が若いことを考慮に入れなければならない。
If you study hard, you will become a good student.	熱心に勉強すれば、君は立派な生徒になるだろう。
It always takes time to get used to a new place.	新しい土地に慣れるには、時間がかかるものですよね。
You'll find our house at the end of the next street.	次の通りのつきあたりに私達の家があります。
I've never seen him really get down to work.	私は彼が真面目に仕事に取り掛かるのを今までみたことがない。
I don't know what is in store for me in the future.	私は将来自分に何が用意されているか知らない。
I will see to it that you meet her at the party.	私はパーティーで彼女に会えるように取り計らいます。
We learned that English is an international language.	私たちは英語が国際語であることを知った。
We want the committee to work out this problem.	私たちは委員会がこの問題を解決するよう望んでいます。
We know the fact that she was born in Canada.	私たちは、彼女がカナダで生まれたという事実を知っている。
What have you done with the watch I bought for you?	私が買ってあげた時計をどうしてしまったのか。
As it is very hot today, I don't feel like studying.	今日はとても暑いので勉強する気になれない。
You must let me know when you come here next time.	今度こっちに来るときは絶対知らせてくださいね。
Right now your actions do not match your words.	今、皆さんの行動は言っていることと一致していません。
We were just talking about you when you called.	君が電話をくれた時私達はちょうど君の事を話していた。
I don't think any more students want to come.	学生達の中で来たいと思う者はもうこれ以上はいないと思う。
Students should make the most of their free time.	学生は自由な時間を出来るだけ有効に利用すべきだ。
Science has brought about many changes to our lives.	科学は私達の生活に多くの変化をもたらした。
Turn to the right, and you'll find the hotel.	右に曲がりなさい。そうすればそのホテルが見つかりますよ。
There is a short program of local news on the radio.	ラジオでその土地の短いニュース番組がある。
If I had more money, I could move to a bigger house.	もっとお金があれば大きな家に移れるのにな。
At first, I couldn't figure out what he was saying.	はじめ彼が何を言っているのかわからなかった。
However small it may be, I want a house of my own.	どんなに小さくてもよいから、自分の家がほしい。
A good many people have told me to take a holiday.	たくさんの人たちが私に休暇を取るように言った。
All the roads leading into the city are full of cars.	その都市に入る道はすべて車で一杯である。
The company has purchased a new computer system.	その会社は新しいコンピューターシステムを購入した。
The test result showed how much he had studied.	そのテストの結果は彼がどれぐらい勉強したかを示した。
I'd like a single from the 24th for two nights.	シングルの部屋を２４日から２泊お願いしたいのですが。
The table takes up a lot of space in this room.	この部屋ではそのテーブルがずいぶん場所をとっている。
I think this project is moving on the right track.	このプロジェクトはうまくいっていると思います。
Those who want to join the club should sign here.	クラブに入りたい人は、ここに名前を書いて下さい。
The Englishman likes doing better than talking.	あのイギリス人は語ることよりも実行することが好きだ。
Ten years is a short time when we look back at it.	１０年というのは、振り返ってみると短い年月だ。
He watched an old video that he hadn't seen in a long time. 	彼が久しぶりに昔の映像を見た
Of course, all services are available free of charge.	もちろん無料で全てのサービスが利用できます
We will be studying very hard this time next year.	来年の今ごろ、私達は必死に勉強しているでしょう。
If you should meet him, tell him to call me up.	万一彼に会ったら、私に電話をするように言ってください。
Not having got a reply, May wrote to Bill again.	返事がこなかったので、メイはビルに再び手紙を書いた。
Does the price of the room include the service charges?	部屋代にサービス料は含まれていますか。
Miyuki has a camera, but she doesn't like it.	美由紀はカメラを持っている、しかし彼女はそれが好きでない。
One of her three cars is blue and the others are white.	彼女の３台の車は１台が青で残りは白だ。
Not all of them are present at the meeting today.	彼らの全員が今日の会合に出席しているわけでもない。
He said he would give me a call, but he hasn't yet.	彼は電話をくれるといったのに、まだしてこない。
As is the case with him, he reported the event.	彼にはよくあることだが、軽はずみにその事件を報道した。
There are no easy answers to the land problem in Japan.	日本の土地問題には簡単な解決策はない。
It was in 1939 that the Second World War broke out.	第二次世界大戦が勃発したのは１９３９年でした。
Don't look back cause you know what you might see.	振り向くなよ、なにが見えるかは見当つくんだから。
You had better read a lot of books while you are young.	若い時に本をたくさん読んだほうがいい。
Try to read as many books as you can when young.	若い時にできるだけたくさんの本を読むようにしなさい。
I couldn't figure out what she was talking about.	私は彼女が何のことを話しているのかわからなかった。
I like to think I know what I'm talking about.	私は自分が何をしゃべっているのかわかっているつもりです。
The day will come when space travel becomes possible.	私たちが宇宙旅行を楽しめる日がくるだろう。
Children should not be given more money than is needed.	子供には必要以上の金を与えてはならぬ。
It is not too much to say that this is the age of cars.	今は車の時代だと言っても過言ではない。
How are you? What sort of day are you having today?	元気かい？今日はどんな一日を送っているのだい？
It goes without saying that health is most important.	健康が最も大切であることは言うまでもない。
English is a very important language in today's world.	英語は今日の世界ではとても重要な言語だ。
A man came up to me and asked for a match.	一人の男がつかつかと近づいてきて、マッチを貸して下さいと言った。
We had to start for America at short notice.	われわれは即刻アメリカにむかって出発しなければならなかった。
It will not be long before the world runs short of food.	まもなく世界は食糧不足になるだろう。
Tom has always done well in every job he has had.	トムはこれまで手をつけた仕事はことごとく成功した。
Don't you think most Japanese students work hard?	たいていの日本の学生はよく勉強すると思いませんか。
To understand it, you have only to read this book.	それを理解するには、この本を読みさえすればいい。
That's the same story as I heard when I was a child.	それは私が子供のころに聞いたのと同じ話です。
The cost of financing of the project was very high.	そのプロジェクトの資金コストはとても高かった。
This is the first time I have seen a Spielberg movie.	スピルバーグの映画を見たのはこれが最初だ。
This history book is written for high school students.	この歴史書は高校生を対象に書かれている。
When I see this picture, I always think of the old days.	この絵を見る度に、昔を思い出します。
This change will make your plan more interesting.	こう変えたら君のプランはもっと面白くなるでしょう。
You will be in charge of the babies in this room.	きみはこの部屋の赤ちゃんたちを担当してもらいます。
With time on our hands now, let's do some good.	いまは時間が手中にあるのだから、何かいいことをしよう。
America is a large country and its people are mobile.	アメリカは国土が広く、人々はよく移動する。
We will have lived in Kyoto for eight years next March.	来年の３月で京都に８年住んだことになる。
The question is not so much what it is as how it looks.	問題は、その本質よりもむしろ外観である。
She replied that she had never seen the man before.	彼女はその男の人に以前会ったことがないと答えた。
She always lets her children do what they want to.	彼女はいつも自分の子供たちのしたい様にさせている。
She always has to be the one giving orders.	彼女はいつだって自分が命令する立場にいないと気がすまないのです。
I don't want to be the one who breaks the news to her.	彼女にその知らせを伝える役だけはごめんだ。
They are saving their money for the purchase of a house.	彼らは家を購入するため貯金をしている。
Young as he is, he has a large family to provide for.	彼は若いが養わなければならない大家族がある。
It will take some time before he understands it.	彼がそのことを理解するにはしばらく時間がかかるだろう。
Mail order is the main form of direct marketing.	通信販売がダイレクト・マーケティングの主な形態である。
Each time an author re-writes a book, it is a new edition.	著者が本を書き直す度に新版となる。
If it were not for the sun, we could not live at all.	太陽がなければ、我々は生きてゆけないだろう。
A lot of students around the world are studying English.	世界中の多くの学生が英語を学んでいる。
The new computer is ten times as fast as the old one.	新しいコンピューターは旧型よりも１０倍速い。
Books must follow sciences, and not sciences books.	書籍が学問に従うべく、学問が書籍に従うべからず。
I must study hard in order to keep up with him.	私は彼に後れを取らないように一生懸命勉強せねばならない。
I bought many books today so I put them in order.	私は今日、たくさん本を買ったので、それらを整頓した。
It was brought home to me how important education is.	私は教育がいかに重要であるかを痛感しました。
I was born in Tokyo on the eighth of January in 1950.	私は１９５０年１月８日に東京で生まれました。
My name is Robert, so they call me Bob for short.	私の名前はロバートなので、皆は略してボブと呼びます。
The bank came through with the loan we had requested.	銀行は我々が要請したローンを用立ててくれた。
It was around eight last night when the meeting broke up.	会が散会したのは昨夜８時ごろだった。
Our trading companies do business all over the world.	我が国の商社は世界をまたにかけて商売をする。
Not having heard from him, I wrote to him again.	何も便りがなかったので、私はもう１度彼に手紙を書いた。
To study English is important for today's young people.	英語を学ぶ事は今日の若者にとって大切だ。
I couldn't make out what he meant by 'megafeps'.	メガフェプスってなんのことだか私には理解できなかった。
Mike is in the second year of high school and Ann is too.	マイクは高校二年生でアンも同学年だ。
Did you meet many interesting people at the party?	パーティーではたくさんおもしろい人に会いましたか。
It cost lots of money to put the plan into practice.	その計画を実行に移すのに多大な費用がかかった。
I haven't heard from Jane since she moved to Tokyo.	ジェインが東京に引っ越して以来、連絡がないんだ。
There points can be brought under the same heading.	これらの点は同じ項目にまとめて扱うことができる。
This is the house where I used to live when I was young.	これは私が若いころに住んでいた家です。
