I've heard a lot about you.	あなたのことはかねがね聞いておりました。
Your order has been submitted.	あなたのオーダーは提出されました。
May I have a talk with you?	あなたとお話ししたいことがあるのですが。
I didn't hear what you said.	あなたが言ったことが聞こえなかったよ。
I've done with him for the future.	あいつとは今後関係がない。
I got out of the car at 40th Street.	４０丁目で車を降りた。
Of all places to meet you!	よりによってこんなところで君に会うなんて。
This does not apply to students.	これは学生にはあてはまらない。
I don't understand German at all.	ドイツ語は全くわかりません。
Could you please take a picture?	写真を撮っていただけませんか？
He's going to talk about that night.	彼がその日の夜の話をする
He didn't feel that way at all.	本人にそういう気がまったく無かった
Two students use one computer.	二人の生徒が１台のコンピュータを使う
More and more air and water come.	空気や水がどんどん中に入ります
He put items into the shopping cart.	彼が商品をカートに入れる
I don't understand the word at all.	全く言葉の意味が分からない
The man said something to the person.	男がその人に声をかけた
He is moving to a Japanese-style room.	彼が和室に場所を移す
Well, let's get back to the subject.	さて、話を本題に戻します
He always goes through the material.	彼が資料には必ず目を通す
He has always had problems with X.	彼がXにはいつも苦労していた
Can I have a few words with you?	ちょっと顔を貸してくれませんか。
But I understand what he says.	でも、私は彼の言うことが分かります。
For example, do you like English?	例えば、君は英語が好きですか。
Next week a family will move in.	来週になると一家族が入ってくる。
As many men as came were welcomed.	来た人たちはみな歓迎された。
Yuki! It's great to see you again!	由紀！また会えてうれしいわ。
What do you really think of him?	本当に彼のことをどう思いますか。
Would you please take my picture?	僕の写真を撮ってくれませんか。
The least you could do is to answer me.	返事ぐらいしろよ。
She acted like a real baby.	彼女は本当に赤ん坊のようにふるまいました。
She may have known the answer.	彼女は答を知っていたのかもしれない。
She is looking for her car keys.	彼女は自分の車の鍵を捜している。
She means more than my life to me.	彼女は私の命より大事である。
She takes care of my children.	彼女は私の子供達の世話をしてくれる。
She has never fallen in love.	彼女は今までに一度も恋をした事が無い。
She continued her job in the bank.	彼女は銀行での仕事を続けた。
She forced me to go out with her.	彼女は強制的に私を連れ出した。
She talked about her school life.	彼女は学校生活について語った。
She must come at all events.	彼女はいずれにしても来なければならない。
Her car broke down on the way.	彼女の自動車は途中で動かなくなった。
We shall never see her match.	彼女に匹敵する人はもう現れないだろう。
They all tried to talk at one time.	彼らは一度に話そうとした。
They owned the lot between them.	彼らは自分たちで土地を所有した。
They moved in just the other day.	彼らはつい先日引っ越してきた。
Their plan sounds interesting to me.	彼らの計画は面白そうだ。
He likes to work in the garden.	彼は庭で仕事をすることが大好きだ。
He said it was out of the question.	彼は全く不可能だと言った。
He told us an interesting story.	彼は私たちにおもしろい話をした。
He had a new house built last year.	彼は昨年新しい家を建てた。
He was watching TV last night.	彼は昨日の夜はテレビを見ていました。
He was welcomed by the people there.	彼は現地人に歓迎された。
I have not yet done with the work.	私はまだ仕事を終えていない。
He took as much care as possible.	彼はできるだけ気をつけていた。
He needs to answer the question.	彼はその問題に答える必要がある。
He needs to answer the question.	彼はその質問に答える必要がある。
He took no account of the fact.	彼はその事実を考慮に入れなかった。
He heard the news on the radio.	彼はそのニュースをラジオで聴いた。
He is always asking for money.	彼はいつもお金が欲しいと言っている。
He got an easy English book.	彼は、やさしい英語の本を手にいれました。
I will meet him some other time.	彼に会うのはこの次にしましょう。
He must have entered this room.	彼がこの部屋に入ったにちがいない。
We always take it easy on Sundays.	日曜日はのんびりしています。
He did not work on Sunday night.	日曜日の夜、彼は勉強しなかった。
I found the book interesting.	読んでみると、その本はおもしろかった。
No one can move the big box.	誰もその大きな箱を動かすことができない。
Bringing up a baby is hard work.	赤ちゃんを育てるのは重労働です。
You shouldn't go out for a few days.	数日は外出しないように。
Few people are free from cares.	心配ごとのない人はほとんどいない。
Do you have this in any other colors?	色違いはありませんか。
What do you want to be in the future?	将来、何になりたいの？
It is important to help each other.	助け合うことは大切である。
You should live within your means.	収入の範囲内で暮らすべきだ。
The fact is I do not love her.	実は私は彼女を愛してはいないのです。
You can do it however you like.	自分の好きなようにやってよろしい。
We asked him to come again.	私達は彼にもう一度来てくれるように頼んだ。
We must provide for the future.	私達は将来に備えなければならない。
I didn't meet any of my friends.	私は友達のだれにも会わなかった。
I didn't notice him go out.	私は彼が出て行く事に気がつきませんでした。
I am interested in Japanese history.	私は日本史に興味がある。
I was not present at that meeting.	私は会議には出席しなかった。
I am very interested in music.	私は音楽にたいへん興味をもっている。
I feel like going to the movies.	私は映画を見に行きたい気がする。
I have seen the picture before.	私は以前にその絵を見たことがある。
I will have to study harder.	私はもっと勉強しなければならないだろう。
I have still to hear that story.	私はまだそのはなしは聞いてない。
I am going to major in French.	私はフランス語を専攻するつもりです。
I found the book interesting.	私はその本がおもしろいことにきづいた。
I have heard of it before.	私はそのことについて以前に聞いたことがある。
I could answer all the questions.	私はすべての質問に答えられた。
I bought this watch at the store.	私はこの時計をあの店で買った。
I have never been to England.	私はイギリスへ行ったことがありません。
Can I watch your next game?	私はあなたの次の試合を見る事が出来ますか。
I have some pictures to show you.	私はあなたに見せる写真がある。
My watch keeps very good time.	私の時計は時間がたいへん正確である。
We use a lot of water every day.	私たちは毎日多くの水を使用する。
Each of us read the book in turn.	私たちは順番にその本を読んだ。
We'll welcome you at any time.	私たちはいつでもあなたを歓迎します。
We were welcomed at every turn.	私たちはいたるところで歓迎された。
Even children can understand it.	子供にだってそんな事は分かるよ。
We've got six children, you know.	子供が６人いるものですからね。
She took care of the children.	子ども達は彼女に世話をしてもらった。
My house was broken into last night.	昨夜家に泥棒がはいった。
We are to meet at five this evening.	今夕５時に会う予定です。
Why don't you go home early today?	今日は早退したらどうですか。
I've not read today's paper yet.	今日の新聞は、まだ読んでいない。
I saw something white in the park.	公園に何か白いものが見えた。
Health is more important than money.	健康はお金よりも大切だ。
Ken is the youngest of the four.	ケンは4人のうちで一番年下です。
Are you for or against my plan?	君は私の案に賛成ですか反対ですか。
Have you turned in your report?	君はもうレポートを提出しましたか。
How do you account for the fact?	君はその事実をどう説明しますか。
You always talk back to me, don't you?	君はいつも言い返す。
I'd like to talk with you in private.	君にちょっと話がある。
I noticed you entering my room.	君が部屋に入ってくるのに気づいた。
I noticed you entering my room.	君が部屋に入って来るのがわかった。
The holidays came to an end at last.	休暇もとうとう終わった。
All the students come from the US.	学生はすべてアメリカ出身だ。
We students are now at our best.	我々学生は、今が一番いいときだ。
We must provide for the future.	我々は将来に備えなければならない。
We were forced to work hard.	我々は仕方なく働かなければならなかった。
We came to an agreement in the end.	我々はついに合意に達した。
What time and where could we meet?	何時にどこで待ち合わせする？
English is an international language.	英語は国際言語である。
The committee are all against it.	委員達は皆それに反対している。
I've never been to Europe.	ヨーロッパへは一度も行ったことがありません。
We had a very good time last night.	ゆうべはとても楽しかった。
There are a lot of ways of doing it.	やり方がいく通りもある。
You should have worked harder.	もっと一生懸命勉強すべきだったのに。
I would like to talk with you again.	もう一度君と話がしたい。
Could I ask you to do that again?	もう一度やっていただけますか。
I can't put it off any longer.	もうこれ以上延ばすわけにはいかない。
First, I should hear both sides.	まず両方の言い分を聞きましょう。
The party was put off for a week.	パーティーは一週間延期された。
Why do you study so hard?	なぜあなたはそんなに一生懸命勉強するのですか。
Any amount of information will do.	どれだけの情報でもうれしい。
Above all, children need love.	とりわけ子供たちは愛情を必要とする。
Tom and Nancy broke up last month.	トムとナンシーは先月別れた。
I think I've met you before.	どこかでお会いしたことがあると思います。
Why are you so hard on him?	どうして彼にそんなにつらくあたるのですか。
I don't understand German at all.	ドイツ語がさっぱり分からない。
TV has taken the place of radio.	テレビがラジオに取って代わった。
Let's see if I've got that right.	では、確認させていただきます。
She put the magazine on the table.	テーブルにその雑誌を置いた。
He has not been heard of since.	それ以来、彼の消息を聞いていない。
Put it back where you got it from.	それを元の場所へ返しなさい。
What an interesting story it is!	それはなんと面白い物語でしょう。
Put the book back where you found it.	その本をなおしなさい。
The two children were of an age.	その二人の子供は年が同じだった。
Few people live on the island.	その島のほとんどに人が住んでいない。
It was the war that changed Japan.	その戦争こそが日本を変えた。
That student runs fast, doesn't he?	その生徒は走るのが速いね。
The question is by no means easy.	その質問は決してやさしくない。
It is easy to answer the question.	その質問に答えるのは簡単だ。
Can I have a look at the magazine?	その雑誌を見せてくれますか。
The building was built in 1960.	その建物は１９６０年に建てられた。
I found the picture interesting.	その絵画を見たらおもしろかった。
The picture is good in its way.	その絵はそれなりによくできている。
When will the film be released?	その映画は何時封切りになりますか。
You will have heard the news.	そのお知らせはお聞きになったでしょう。
You will learn to love your baby.	そのうち赤ん坊が可愛くなるよ。
Every time I go there, I meet her.	そこに行くたびに彼女に会う。
John and Mary broke up last week.	ジョンとメアリーは先週別れた。
John Lennon was born in 1940.	ジョン・レノンは１９４０年に生まれた。
Sam is two years younger than Tom.	サムはトムより二歳年下です。
Let's go on to the next subject.	さて次の話題に移ることにしよう。
I'll keep this for future use.	これを将来使えるように取っておこう。
This applies to your case as well.	これは君の場合も当てはまる。
This is a direct road to London.	これはロンドンへ直行する道です。
What an interesting book this is!	これはなんと面白い本でしょう。
This is a very interesting book.	これはとってもおもしろい本です。
This is the house that Jack built.	これはジャックが建てた家だ。
This is the house where I was born.	これが私の生まれた家です。
This law does not apply in Japan.	この法律は日本では通用しない。
This room does not get much sun.	この部屋はあまり日が当たらない。
This shop is a rental video shop.	この店はレンタルビデオ店です。
How do you feel about the issue?	この件について、どう感じますか。
How do you feel about the issue?	この件について、どう思いますか。
What is the price of this radio?	このラジオの値段はいくらですか。
This camera was made in Germany.	このカメラはドイツでつくられた。
This is the house where I was born.	ここは私の生まれた家です。
This is the house where I was born.	ここは私が生まれた家です。
Experience talks in these cases.	こういう場合には経験が物を言う。
There are 50 members in the club.	クラブのメンバーは５０人です。
Our class has forty-five students.	クラスには４５人生徒がいる。
You should turn money to good use.	お金はよく考えて使いなさい。
Let's see. I bought it last week.	ええと、買ったのは先週でした。
What in the world does he mean?	いったい彼はどういうつもりなのだ。
I made a lot of money on the side.	アルバイトで金を儲けたんだ。
You only have to work hard.	あなたは熱心に勉強しさえすればよいのです。
What did you major in at college?	大学では何を専攻されましたか。
Have you heard the news yet?	あなたはもうそのニュースを聞きましたか。
You've never been to Paris?	あなたはパリに行ったことがないのでしょう。
You may choose any of them.	あなたはそれらのうちのどれを選んでもよい。
Your answer is not to the point.	あなたの答えは要領を得ていない。
Does your watch keep good time?	あなたの時計、時間は狂いませんか。
I can't hear you very well.	あなたのおっしゃることがよく聞こえません。
I will show you some pictures.	あなたに何枚かの写真を見せましょう。
I am interested in Asian history.	アジアの歴史に興味があります。
The ABC company is in the red again.	ＡＢＣ会社はまた赤字だ。
He will be back in a few days.	２、３日すれば彼は帰ってくるだろう。
Are you for or against my plan?	私の計画に賛成ですか、反対ですか。
One should always do one's best.	人はいつも全力を尽くすべきです。
Next Monday and Tuesday are holidays.	来週の月火と連休です。
He is open to discussion at any time.	彼が随時相談の受付を行う
There are a lot of shops that aren't open.	休みの店が多い
I never get around to updating it.	なかなか更新まで手が回りません
I really want to have my own child.	どうしても自分の子供が欲しい
The store is always full of energy.	店内がいつも活気に満ちている
Try us again next Monday.	来週の月曜日にもう一度お寄りになってみて下さい。
The point is they're too young.	要するに彼らは若すぎるということだ。
When night came on, we returned home.	夜になって、家へ帰った。
The question is who will do it.	問題は誰がそれをするかという事です。
Reading books is very interesting.	本を読むのはとてもおもしろい。
She is too young to go to school.	彼女は幼くて学校には行けません。
She takes care of my children.	彼女は私の子供たちの世話をしてくれる。
She entered this school last year.	彼女は昨年この学校に入学した。
She is not as young as she looks.	彼女は見掛けほど実際に若くない。
She continued studying all her life.	彼女は一生涯勉強を続けた。
She has never seen it before.	彼女は以前にそれを見たことがありません。
She's not yet heard the news.	彼女はまだそのニュースを聞いてはいない。
She was pleased to see the results.	彼女はその結果をみて喜んだ。
She takes care of my children.	彼女は、私の子どもの世話をしてくれる。
Don't let him know her address.	彼女の住所を彼に知らせてはいけない。
She has an important air about her.	彼女には威張った様子がある。
They all tried to talk at one time.	彼らは皆同時に話そうとした。
They haven't come back home yet.	彼らはまだ家に戻ってきていません。
They each received a present.	彼らはひとりひとりプレゼントをもらった。
Both he and I are high school students.	彼も私も高校生です。
He is the man you met the other day.	彼は先日君が会った人です。
He was always on the people's side.	彼は常に民衆の味方であった。
He had to address the meeting.	彼は集会で演説しなければならなかった。
He is younger than me by three years.	彼は私より三つ年下です。
He told me an interesting story.	彼は私におもしろい話をしてくれた。
He has the same camera as I have.	彼は私と同じカメラを持っている。
He came back about nine last night.	彼は昨夜９時ごろ戻ってきた。
He is not a high school student.	彼は高等学校の生徒ではありません。
He is the greatest living artist.	彼は現存する最高の芸術家である。
He had a lot of money in the bank.	彼は銀行に多額の預金があった。
I think he is planning something.	彼は何か企んでいるように思える。
He took many pictures in London.	彼はロンドンで多くの写真を撮った。
What a lot of books he has!	彼はなんてたくさんの本を持っているんだろう。
He put down the book on the table.	彼はテーブルの上に本を置いた。
He need not have run so fast.	彼はそんなに速く走る必要がなかったのに。
He will take charge of the class.	彼はそのクラスを担任するだろう。
He really has it out for people.	彼はいつも人にやつあたりをします。
He has two children, aged 4 and 1.	彼は４歳と１歳の２児の父親だ。
He has no less than twelve children.	彼には子供が１２人もいる。
He was seen to enter the building.	彼が建物にはいるのが見られた。
I'm not always home on Sundays.	日曜日はいつも家にいるとは限らない。
We are against working on Sundays.	我々は日曜日に働くのは反対だ。
Animal bodies are made up of cells.	動物の体は細胞でできている。
All sorts of people live in Tokyo.	東京には色々な人が住んでいる。
Who will take care of the baby?	誰がこの赤ちゃんを世話してくれるの。
World War I broke out in 1914.	第一次世界大戦は1914年に勃発した。
When did World War II break out?	第２時世界大戦は、いつ起こったか。
Every means has not been tried.	全ての手段が試みられたわけではない。
Some are red and others are white.	赤いものもあれば白いのもある。
I hear you'll set up a new company.	新しい会社を作るそうですね。
What do you want to be in the future?	将来何になりたいですか。
Masaru doesn't care for this color.	勝君はこの色が好きではない。
An important post was given Tom.	重要な地位がトムに与えられました。
Fall is when we can study best.	秋は私たちが一番勉強できるときです。
I traded in my car for a new one.	車を下取りに出して新車を買った。
I feel as if I were another person.	自分ではないような気がする。
What time is the next performance?	次の上演時間は何時からですか。
We had a good time in the open air.	私達は戸外で楽しく過ごした。
I want to have a part-time job, too.	私もアルバイトしたいなあ。
I followed her into the room.	私は彼女に付いて行き、その部屋に入った。
I still have a lot of work to do.	私は仕事をたいぶためてしまった。
I met him on my way from school.	私は学校から帰る途中で彼に会った。
I have never been to Kushiro.	私は一度も釧路に行ったことがありません。
I have never gone to Florida.	私はフロリダへは行ったことがありません。
I am very interested in French.	フランス語にはとても興味があります。
I will try as hard as I can.	私はできるだけ一生懸命やっているつもりだ。
I will bring back a lot of food.	私はたくさんの食物を持って帰ろう。
I read the book over and over again.	私はその本を何度も読んだ。
I met a Smith at the party.	私はそのパーティーで、スミス家の人に会った。
I can't understand this at all.	私はこのことを少しも理解できません。
I want you to come back early.	私はあなたに早く帰って来てもらいたい。
I was in New York for a few days.	私は２、３日ニューヨークにいた。
My children really like animals.	私の子どもたちは動物が大好きです。
My camera is different from yours.	私のカメラはあなたのとは違う。
We use a lot of water every day.	私たちは毎日たくさん水を使います。
We were all present at the meeting.	私たちは皆会に出席していた。
We are the students of this school.	私たちはこの学校の生徒です。
A man called on you last night.	昨晩ある人があなたを訪ねてきました。
Did you have a good night last night?	昨日はよく眠れましたか？
What's on the air this evening?	今晩はどんな放送番組があるのですか。
I've had a lot of calls today.	今日は電話がたくさんかかってきている。
Today is the hottest day this year.	今日は今年になって一番暑い。
Up to now, I have never met him.	今まで一度も彼に会ったことはない。
You should study still harder.	今まで以上にいっそう勉強に励みなさい。
I no longer have the energy to talk.	口をきく元気もなくなった。
Please show me the meaning of word.	言葉の意味を教えてください。
The plan has worked well as yet.	計画は今までのところ上手く行った。
We must ask the bank for the loan.	銀行に貸付を頼まねばならない。
Love of money is common to all men.	金銭欲は万人に共通している。
Students have access to the library.	学生は図書館は利用できる。
Twelve are present at the meeting.	会合には１２人が出席している。
We should face up to this issue.	我々はこの問題に立ち向かうべきだ。
Our new head office is in Tokyo.	我々の新しい本社は東京にあります。
I want something with which to write.	何か書くものが欲しいな。
English is studied in China, too.	英語は中国でも勉強されています。
Could you help me when I move?	引っ越しのとき手伝っていただけますか。
New Year's Day is the key to the year.	一年の計は元旦にあり。
It will pay you to study hard.	一生懸命勉強することは君のためになる。
Can I take your picture with us?	一緒に写真に入っていただけますか。
Mr Iuchi has no one to fall back on.	井内君にたよる人がいない。
The committee meets today at four.	委員会はきょう４時に開かれる。
I found it easy when I gave it a try.	やってみたら簡単でした。
May I ask you some more questions?	もう少し質問してもいいですか。
Mayuko came running to meet us.	マユコは私たちをむかえに走ってきた。
What is the common language in Peru?	ペルーの共通語は何ですか。
Why did you choose such a subject?	なぜこのような科目を選んだの？
Why did you get up so early?	なぜあなたは、こんなに早く起きたのですか。
I can't figure out what he means.	どうも彼の考えがよくわからない。
