They are talking about this and that.	彼らはあれこれと話をしています。
They were for the most part young people.	彼らの大多数は若者です。
Will he come to the meeting next week?	彼は来週会議にくるでしょうか。
He was too old to work any more.	彼は年を取りすぎていて、もう働けなかった。
He does not work so hard as he used to.	彼は昔ほど一生懸命働かない。
He was better off when he was young.	彼は若い頃は暮らし向きがよかった。
Last night, he studied all night long.	彼は昨日、一晩中勉強しました。
Last night, he studied all night long.	彼は昨日は一晩中勉強しました。
He has never been to Okinawa before.	彼は今まで沖縄へ行ったことがない。
He tried to buy into the club.	彼は金を使ってそのクラブの一員になろうとした。
He said that he had a lot of money.	彼は金をたんまり持っているといった。
English is not easy for him to learn.	彼は英語がなかなか覚えられない。
He must have studied English hard.	彼は一生懸命英語を勉強したに違いない。
He came to understand it at last.	彼はとうとうそれを理解するようになった。
It is possible for him to do the job.	彼はその仕事をすることが出来る。
He applied for a position in the office.	彼はその会社に職を求めた。
He is always at the top of the class.	彼はいつも成績がクラスで一番だ。
He is a man hard to get on with.	彼はいっしょにやっていくのが難しい男です。
He set out for London early in July.	彼は７月初めにロンドンへ向かった。
Try to bring out the best in him.	彼のいいところを引き出すようにしなさい。
He has no close friends to talk with.	彼には語り合う親しい友がいない。
Let me know the time when he will come.	彼が来る時を知らせて下さい。
Let me know in no time when he comes.	彼が来たらすぐに知らせて下さい。
Japan is the best country under the sun.	日本は天下第一の国である。
Japan does a lot of trade with Canada.	日本はカナダとの貿易が盛んだ。
Are you interested in Japanese music?	日本の音楽には興味がありますか。
Japan and Britain are island countries.	日本とイギリスは島国である。
The day is short and there's a lot of work.	日は短く仕事は多い。
A change of air will do you good.	転地があなたにとって効果があるでしょう。
I met a party of students on the street.	通りで学生の一行にあった。
For a long time I wanted to meet him.	長い間彼に会いたいと思っていた。
It is my practice to get up at 6 a.m.	朝６時に起きるのが私の習慣です。
I'm about to tell you something important.	大切な話があるんです。
I will be only too pleased to help you.	大いに喜んで手伝いましょう。
Please come to my house by all means.	是非とも私の家にお越しください。
What are you going to be in the future?	将来、何になるつもりですか。
The young should make room for the old.	若者は老人に席を譲るべきだ。
You should work hard while you are young.	若いうちは苦労すべきだ。
Do you know this man in the picture?	写真のこの男の人を知っていますか。
I have a lot of friends to help me.	私を助けてくれる友人はたくさんいる。
I put up with her as long as I could.	私は出来る限り、彼女に我慢した。
I was young, and I wanted to live.	私は若かった、そして私は生きたかった。
I am content with my current position.	私は現在の地位に満足している。
I want to make you work harder.	私は君をもっと一生懸命働かせたいと思います。
I found the question very easy.	私はその問がたいへんやさしいことを発見した。
I told him to come the following day.	私はかれに明日来なさいと言った。
I have something to ask of you.	私はあなたに頼みたいことがいくつかあります。
I am in charge of the third-year class.	私は３年生を受け持っている。
We were just about to enter the room.	私たちは部屋に入ろうとしていた。
Our plan didn't work in practice.	私たちの計画は実際には旨く行かなかった。
It was easy for us to find Jane.	私たちがジェーンを見つけるのは簡単でした。
Even a child can answer the question.	子供でさえその質問に答えられる。
Are the children playing in the park?	子供たちは公園で遊んでいますか。
This year is an important year for me.	今年は、私にとって重要な年だ。
Christmas falls on Sunday this year.	今年のクリスマスは日曜日にあたる。
Up to now they have worked very hard.	今まで彼らは一生懸命働いてきた。
There were a lot of people in the park.	公園には大勢の人が出ていた。
There were a lot of people in the park.	公園にはたくさんの人がいた。
You should turn off the mobile phone.	携帯電話の電源を切るべきである。
What did you come here so early for?	君は何でこんなに早くここへきたの。
You must get up a little earlier.	君はもう少し早く起きなければなりません。
You shouldn't talk back like that.	君はあんなふうに口答えすべきではない。
You are asking too much for this car.	君この車に高い値を付けすぎだよ。
Hard work has brought him where he is.	勤勉さが今の彼をつくりあげた。
We moved to New York last fall.	去年の秋、私たちはニューヨークに引っ越した。
We are very interested in the history.	我々は歴史にとても興味がある。
Don't put me in the same class with them.	俺を奴等と一緒にするな。
We have yet to learn all the facts.	われわれはまだ事実を十分に知らない。
We think that there should be no more wars.	もう戦争はごめんだ。
Have you started reading the book yet?	もうあの本を読み始めましたか。
I met Meg, who told me the news.	メグに会ったらそのニュースを教えてくれた。
The full story was yet to be told.	まだ全部の話がされたわけではなかった。
Mike has a few friends in Florida.	マイクにはフロリダに数人の友達がいる。
Bill didn't turn up at the party.	ビルはそのパーティーへ姿を現さなかった。
Bill was singled out for a special award.	ビルが特別賞に選ばれた。
Can I have a single to Birmingham?	バーミンガムまでの片道切符をください。
The longest night will have an end.	どんな長い夜にも終わりがあるものだ。
You're never too old to learn.	どんなに年を取っても学問ができないことはない。
Where? I'd like to take one, too.	どこで？わたしもそのコースを取りたいわ。
You are to start as early as possible.	できるだけ早くに出発すべきだ。
Dave never returned to school again.	デイブは二度と学校に戻らなかった。
A lot of students do part-time jobs.	たくさんの学生がアルバイトをする。
Could you bring me a Time magazine?	タイムマガジンを持ってきてください。
You need not have got up so early.	そんなに早く起きる必要はなかったのに。
I have never heard from him since.	それ以来彼からは何の便りもありません。
Well, let's make it some other time.	それでは、またの機会ということに。
I found it easy to answer the question.	その問いに答えるのは容易だ。
The law doesn't apply to this case.	その法律はこの件には当てはまらない。
The law does not apply to this case.	その法則はこの場合当てはまらない。
In those days, I was still a student.	その当時、私はまだ学生であった。
I was interested in seeing the city.	その町を見て回るのに興味をもった。
The place is very much built up now.	その場所は今は相当建て込んでいる。
The picture was taken from the air.	その写真は空から写されたものである。
The event has become known to the public.	その事件は明るみに出た。
That movie will be released by and by.	その映画はまもなく公開される。
Are you for or against the plan?	その意見に賛成ですか、それとも反対ですか。
One of these two answers is right.	その２つの答えのどちらか一方が正しい。
This is a house to let, not to be sold.	これは貸家だ、売家ではない。
Is this the key you are looking for?	これはあなたの探している鍵ですか。
Please put this book on the very top.	この本は一番上に置いてください。
This book is not as easy as that one.	この本はあの本ほどやさしくない。
This road will lead you to the park.	この道を行けば、公園に出られます。
Do you know the meaning of this word?	この単語の意味を知っていますか。
She turned down our offer of help.	この所は私たちの援助の申し出を断った。
This movie is very interesting to me.	この映画はとても興味があります。
What are the charges in this hotel?	このホテルの宿泊料金はいくらですか。
This table takes up too much space.	このテーブル、場所を取りすぎるんだ。
Could you change this bill, please?	このお札を両替してくださいませんか。
Put down your name and address here.	ここへ住所と名前をお書きください。
I told you never to move in a group.	かたまって行動するなと言ったんだ。
A young person wants to see you.	お若いかたがあなたにお会いしたいそうです。
When did you get to know the fact?	いつその事実を知るようになりましたか。
Arabic is a very important language.	アラビア語は非常に重要な言葉です。
It looks like they have made up again.	あの二人はよりを戻したらしい。
Do you have to go to market, too?	あなたも買い物に行かなければならないの。
You have only to practice every day.	あなたは毎日練習しさえすればよい。
You don't have to get up so early.	あなたはそんなに早く起きる必要はない。
Can I keep one of your pictures?	あなたの写真を１枚持っていてもいいですか。
That sounds very interesting.	あなたのお話では、それはたいへん面白そうですね。
I have something good to tell you.	あなたにお話しするよいことがあります。
It's your turn to answer the question.	あなたが質問に答える順番です。
Few people live to be ninety years old.	９０歳まで生きる人は少ない。
March comes between February and April.	３月は２月と４月の間にある。
No fewer than thirty people were present.	３０人もの人が出席した。
I have not heard from her for a year.	１年間彼女から便りがありません。
Andy must have practiced very hard.	アンディは、猛練習したにちがいない。
I shouldn't have gotten up so early.	あんなに早く起きなければよかった。
I have children of about the same age.	自分が同じ年代の子供を持っている
Many people ask me the same question.	私はその質問を多くの方から受けます
There were many animals in the park.	公園の中には、動物がいっぱいいました
He/She will never become a good person.	まともな人間には決してならない
A support network needs to be built.	支援のネットワークづくりが求められる
I brought the point home to the student.	要点を学生に十分理解させた。
Please help me welcome Mr. Nomura.	野村さんを歓迎するのを手伝ってください。
The question is where to buy the book.	問題はどこでその本を買うかです。
The question is which to choose.	問題は、どちらを選んだらよいかということだ。
We should know the result by Thursday.	木曜までには結果が分かるはずだ。
You, too, know Mr. Kimura, don't you?	木村さんはあなたもご存じでしょう。
The story got more and more interesting.	物語はますます面白くなった。
Few people live to be 100 years old.	百歳まで生きる人はほとんどいません。
She's writing something in her study.	彼女は書斎で何か書き物をしている。
She said to me "Let's go shopping."	彼女は私に「買い物に行こう」といった。
She made cookies for the children.	彼女は子供たちにクッキーを作ってあげた。
She thinks that she's always right.	彼女はいつも自分が正しいと思っている。
She always takes care of her children.	彼女はいつも子供の世話をします。
She always tries something new.	彼女はいつも何か新しいことにアタックしている。
Her job is to take care of babies.	彼女の仕事は赤ん坊の世話をすることです。
Her answer couldn't be understood.	彼女からの返事は納得できないものだった。
They were for the most part young people.	彼らは大部分が若者だった。
They submitted the case to the court.	彼らはその事件を法廷に持ち出した。
They had a talk about the future life.	彼らは、来世について話しあった。
He kept on writing stories about animals.	彼は動物の話を書き続けた。
Isn't he a young American student?	彼は若いアメリカの学生ではありませんか。
He looked at me and said, "Watch out."	彼は私を見て危ないといいました。
He came a little earlier than he used to.	彼は以前より少し早く来た。
We understand that he is for the plan.	彼はその計画に賛成と聞いている。
He can come up with any amount of money.	彼はいくらでもお金を出せる。
He was too young to go to school.	彼はあまりにも幼いので学校に行けなかった。
I did not understand him at all.	彼の言ったことの意味が全然分からなかったよ。
He has something of the artist in him.	彼にはかなり芸術的な素質がある。
Don't take any notice of what he said.	彼が言ったことなど気に留めるな。
Running hard is important for you.	熱心に走ることはあなたにとって重要です。
I had to choose between the two.	二つのうちどちらか選ばなければならなかった。
The garden is common to the two houses.	庭は二軒の家の共有のものです。
No one was to be seen in the street.	通りには、人の姿は全く見えなかった。
I have not heard from him for a long time.	長い間彼から便りが無い。
Who's in charge of the sales section?	誰が営業部を担当しているのですか。
We're getting fewer and fewer students.	生徒の数がだんだん減ってきた。
It is interesting to look at the stars.	星を見ることは興味深いことだ。
Man is the only animal that can talk.	人間は話す事の出来る唯一の動物だ。
Won't you take something off this price?	少し値引きしてくれませんか。
Even a little child knows its name.	小さな子どもでもその名前を知っている。
What would you like to be in the future?	将来君は何になりたいですか。
What would he like to be in the future?	将来、彼は何になりたいですか。
Please let me know when you receive them.	受け取ったらご連絡下さい。
You must study hard while young.	若いうちに、一生懸命勉強しなければならない。
If you have a question, please ask me.	質問があれば私に聞いてください。
What we should do next is the question.	次に何をしたらよいかが問題だ。
I could not make out what he meant.	私は彼の言いたいことがわからなかった。
I'm not always at home on Sundays.	私は日曜日にいつも家にいるとは限らない。
I meet him at the club from time to time.	私は時々クラブで彼に会う。
I met him on my way home from school.	私は学校からの帰り道で彼に会った。
I felt something moving on my back.	私は何かが背中で動いているのを感じた。
I meant to have called on you.	私はあなたを訪問するつもりだったができなかった。
I had to choose between A and B.	私はＡかＢのどちらかを選ばなくてはならない。
Please answer this question for me.	私の代わりにこの問題を解いてください。
For my part, I don't like this picture.	私としては、この絵が嫌いです。
We are making plans for the holidays.	私たちは休暇の計画を立てています。
We have a boxing club in our school.	私たちの学校にはボクシング部がある。
What I like is her way of talking.	私が気に入っているのは、彼女の話し方だ。
Don't let children have their own way.	子供を好きかってにさせておくな。
Children play in this park every day.	子供たちは毎日この公園で遊びます。
We will pay this amount by June 30.	残金は６月３０日までに御支払いします。
Where were you making for last night?	昨夜は、君はどこへ行こうとしたの。
May there never be another world war!	再び世界大戦が起こりませんように。
When are you going on holiday this year?	今年はいつ休暇を取りますか。
The law of a country must be followed.	国の法律に従わなければならない。
There are lots of animals in the park.	公園にはたくさんの動物がいます。
You shouldn't ask personal questions.	個人的な質問はしないほうがいいよ。
It all turned out for the best in the end.	結局すべてが旨く行った。
You should have come a little earlier.	君はもう少し早く来るべきだった。
What did you come here so early for?	君はなんでこんなに早くここに来たの。
You have to account for the result.	君はその結果を説明しなければならない。
You are asking too much for this car.	君はこの車に高い値段をつけすぎた。
You always talk back to me, don't you?	君はいつもああ言えばこう言うね。
You're never going to give in, are you?	君はあくまで意地を張るのだね。
I can hear you, but I can't see you.	君の声は聞こえるが、姿は見えないよ。
Please let me drive your new Toyota.	君の新しいトヨタ、僕にも運転させて。
Move over a little if you please.	恐れ入りますが席をちょっとお詰めください。
Tell me what you did on your holidays.	休暇に何をしたか教えてください。
I got to know him when I was a student.	学生時代に彼と知り合いました。
The meeting will take place next Sunday.	会合は次の日曜日に開かれる。
Could you add the cost to my room bill?	会計は部屋代につけてください。
There is a garden at the back of my house.	家の後ろに庭があります。
Please go around to the side of the house.	家の横に回ってください。
I felt something crawling on my back.	何かが背中をはっているのを感じた。
We shipped the following to you last week.	下記は先週出荷しました。
Can you see something red down below?	下の方に何か赤いものが見えますか。
Watching movies is very interesting.	映画を見ることは、とてもおもしろい。
Oh, I'm just going to take it easy.	うん、私はただのんびり過ごすつもりよ。
The members of the committee are all men.	委員会の委員は全員男性だ。
The history of Rome is very interesting.	ローマの歴史はとても面白い。
Will you please turn down the radio?	ラジオの音を小さくしてくれませんか。
Is there any space for one more person?	もう１人分の空きはありますか。
What was the result of Mary's test?	メアリーのテストの結果はどうでしたか。
Mayuko could not answer my question.	マユコは私の質問に答えられなかった。
It will not be long before he turns up.	まもなく彼は現われるでしょう。
I understand it's going to get hot again.	また暑さがぶり返すそうだ。
Paul made a lot of money last year.	ポールは昨年たくさんのお金をもうけた。
At all events we have done our best.	ともかく我々はベストを尽くしたのだ。
Tom is always playing video games.	トムはいつもテレビゲームばかりしている。
How can you break the news to her?	どうやって彼女に打ち明けろというんだい。
I didn't mean to put that on there.	それはもっていくつもりはなかったんだ。
It has some bearing on this problem.	それはこの問題といくぶん関係がある。
The question is before the committee.	その問題は委員会にかけられている。
Not a star was to be seen that night.	その晩は星ひとつもみられなかった。
Christmas fell on Saturday that year.	その年のクリスマスは土曜日だった。
The store was just off the street.	その店は通りから奥まったところにあった。
The collection is open to the public.	その収集品は一般に公開されている。
The fact is, I think, very important.	その事実はとても大切だと思います。
I think it will be easy to do the job.	その仕事をするのは簡単だと思う。
The passwords were easy to figure out.	その合い言葉は分かりやすかった。
I found it easy to find the building.	その建物を見つけるのは簡単だった。
The building will be completed in a year.	その建物は１年で出来ます。
The house is built in European style.	その家はヨーロッパ風に造ってある。
Add a few more names to the list.	そのリストにもう２、３の名前を加えなさい。
The show will be on the air at 7 p.m.	そのショーは午後７時に放送される。
The camera will cost at least $500.	そのカメラは少なくとも５００ドルする。
Not all the students were present.	すべての学生が出席したわけではなかった。
I am looking at the pictures of Jane.	ジェーンの写真を見ているところだ。
This is the book which I read last night.	これは私が昨日読んだ本だ。
This is the picture I took in my house.	これは私が家で撮った写真です。
This is the key I have been looking for.	これが私の探していた鍵です。
This book is written in easy English.	この本は易しい英語で書かれている。
What heading does this book come under?	この本は何の項目に入りますか。
Houses can't be built in this area.	この地域では家を建てることができない。
This job will call for a lot of money.	この仕事には大金が必要でしょう。
I can't understand this sign's meaning.	この記号の意味が理解できない。
I know a lot about this computer.	このコンピューターのことはよく知っている。
You didn't join that club, did you?	きみはそのクラブに入らなかったんだね。
Canada is on the north side of America.	カナダはアメリカの北側にある。
A child today would not do that.	いまどきそんなことは子供だってしないだろう。
We can always find time for reading.	いつだって読書の時間は見つけられる。
You have only to watch what I do.	あなたは私のすることを見てさえいればいい。
Where did you come by the watch?	あなたはその時計をどこで手に入れたのですか。
I'm about to tell you the answer.	あなたに返事をしようとしているところです。
I have something to talk over with you.	あなたに相談したいことがある。
Shall I give you something to read?	あなたに何か読むものをあげましょうか。
Who runs the fastest of the three?	３人のうちで誰がもっとも速く走りますか。
March 15 will be my last day of school.	３月１５日で学校は終わりです。
Could you please put me up for the night?	１晩とめていただけますか。
"I feel like playing cards." "So do I."	「トランプしたいなあ」「私も」
My most interesting friend is Jessie.	一番面白い私の友達はジェシーです。
There are 7 ways to use it on your body.	全身に７通りの使い方が出来ます
I can't see the other person's face at all.	全く相手の顔が見えません
The application gave an error message.	アプリケーションでエラーが発生した
We all do our best to practice every day.	みんなで日々の練習に励みます
He will post a comment on this article.	彼がこの記事にコメントを投稿する
A lot of people really supported me.	私は本当に多くの人たちに支えられました
The next year, World War I broke out.	翌年、第一次世界大戦が始まりました。
Can you direct me to the post office?	郵便局へ行く道を教えてくれませんか。
I had never seen so much money.	僕はその時まで、そんな大金を見たことがなかった。
There is a Tanaka in my class, too.	僕のクラスにも田中という名前の人がいる。
There were few children in the room.	部屋には子供たちはほとんどいなかった。
She was born and brought up in Osaka.	彼女は大阪で生まれ大阪で育てられた。
She put up her hand to ask a question.	彼女は質問をするために手を上げた。
She was never to see her home again.	彼女は再び故郷には帰らぬ運命にあった。
She directed the planning of the project.	彼女は計画の立案を指示した。
She directed the planning of the project.	彼女は計画の立案を指揮した。
She works as hard as her siblings.	彼女は兄弟たちと同じくらい一生懸命に働く。
