As is often the case with him, he was late for school.	彼にはよくあることだが、学校に遅刻した。
I don't know if he will visit us next Sunday.	彼が今度の日曜日に私達のところに来るかどうかは分からない。
Japan is one of the greatest economic powers in the world.	日本は世界有数の経済大国である。
There are no easy answers to the land problem in Japan.	日本の土地問題には簡単な解決策はない。
The population of Tokyo is larger than that of New York.	東京の人口はニューヨークよりも多い。
Someone is at the front door. Go and see who it is.	誰かが玄関に来ているよ。誰だか見に行ってきて。
New Year is the time for a lot of eating and drinking.	新年は盛大に食べたり飲んだりするのです。
You had better put out the fire before you go to bed.	寝る前にたき火の火を消した方がいいだろう。
You had better read a lot of books while you are young.	若い時に本をたくさん読んだほうがいい。
Try to read as many books as you can when young.	若い時にできるだけたくさんの本を読むようにしなさい。
What's the good of having a car if you don't drive?	車を持っていても運転しなければ何にもならない。
The fact is that he did not notice the difference.	事実は彼がその違いに気づかなかったということだ。
We'll have to try and make the best of it.	私達はそれを禍とせず最善を尽くして頑張っていかなくてはならない。
Do you remember the day when we first met Dick?	私達がはじめてディックにあった時のことを覚えてますか。
For myself, I would like to take part in the game.	私個人としてはその競技に参加したいとおもいます。
I would sooner die than get up early every morning.	私は毎朝早く起きるくらいなら死んだ方がましだ。
I couldn't figure out what she was talking about.	私は彼女が何のことを話しているのかわからなかった。
I like children. That's why I became a teacher.	私は子供が好きです。そういうわけで教師になったのです。
I have visited more than nine countries up until now.	私はこれまで１０ヶ国以上の国を訪れている。
I am looking forward to hearing from you soon.	私はあなたからすぐに便りをもらうのを楽しみにしています。
I made five applications for jobs but got nothing.	私は５つの職に申し込みをしたが、全部だめだった。
I myself didn't have to go and meet him there.	私の方から彼に会いにそこまで出かけていく必要がなかった。
My father used to say that money is not everything.	私の父は昔よく金がすべてではないと言っていた。
I have a lot of money and enough time to use it.	私にはお金がたくさんあるし、それを使う暇も十分ある。
All we should do is wait and see what he'll do.	私たちのすべきことは、彼のすることを見守るだけである。
We all try to get together at least once a year.	私たちは少なくとも一年に一回は集まるようにしている。
I feel like going out rather than staying at home today.	今日は家にいるより出かけたい気分だ。
It is not too much to say that this is the age of cars.	今は車の時代だと言っても過言ではない。
The girl coming in at the door now is always late.	今ドアから入って来る少女は、いつも遅刻してくる。
My brother is in the same line of business as you are.	兄はあなたと同じ方面の仕事をしています。
It makes no difference whether you go or not.	君が行こうと行くまいがそんなことは、たいしたことではない。
In terms of the pay you will get, is this a good job?	君がもらう給料の点からこれはいい仕事かね。
Money and I are strangers; in other words, I am poor.	金と私とは他人同士だ。つまり、貧しいのだ。
I'm looking forward to seeing you again before long.	近々またお会いできるのを楽しみに待ってます。
He asked me to wait there until he came back.	帰ってくるまでここで待っていてください、と彼は私に言った。
English is a very important language in today's world.	英語は今日の世界ではとても重要な言語だ。
I wish I could go with you, but as it is, I can't.	一緒に行けるといいのだけれど、実際はいけません。
We had to start for America at short notice.	われわれは即刻アメリカにむかって出発しなければならなかった。
I want a wife and children, and so I need a house.	わたしは妻と子供がほしいので、家が必要なんだよ。
Had he known the truth, he would have told me.	もし彼がその事実を知っていたら、私に話してくれただろう。
If she were here now, I could tell her the truth.	もし今彼女がここにいたら、彼女に真実を話せるのに。
You may as well wait for a while. It'll clear up soon.	もう少し待ったらどう。すぐにはれるから。
I'd like to stay one more night. Is that possible?	もう１日滞在を延ばしたいのですが、泊まれますか。
Mulligan says he'll sleep easy until the fight.	マリガンは、今度の試合については何の問題はないという。
Tom has always done well in every job he has had.	トムはこれまで手をつけた仕事はことごとく成功した。
I can't figure out why he didn't tell the truth.	どうして彼が本当のことを言わなかったのかわからない。
I hope you will be quite well again before long.	どうか早く元のようにすっかりお元気になってください。
Every child in the school took to the new teacher.	その学校の児童はみんなその新しい先生になついた。
See to it that such a thing does not happen again.	そのようなことが２度と起こらないようにしなさい。
If you sleep for a while, you will feel much better.	しばらく眠れば、ずっと気分がよくなりますよ。
Jane was quite at a loss when and where to go.	ジェーンはいつ、どこへ行ったらいいか全く分からなかった。
Now, go have a good time. The work can wait.	さあ、いって楽しんでいらっしゃい。仕事は後ですればいいから。
This is the most interesting book I've ever read.	これは私が今までに読んだ本の中で最も面白い本です。
Is this in fact going to affect their relationships?	これが実際に彼らの関係に影響するのだろうか。
With respect to this question, there are three problems.	この問題に関して、３つの問題がある。
This change will make your plan more interesting.	こう変えたら君のプランはもっと面白くなるでしょう。
We must always consider the feelings of others.	いつも自分以外の人の気持ちを思いやらなくてはならない。
I don't think I can cut in working in America.	アメリカの仕事は最後までやりなおすことはできないと思う。
I do hope you will come and visit us soon.	あなたがすぐに私たちのもとへやって来てくれることを切に願います。
He was already working at the current company on Monday.	彼が月曜日には今の会社で働いていました
The point is whether she will read the letter or not.	問題は彼女が手紙を読んでくれるかどうかです。
Had I known the truth, I would have told it to you.	本当のことを知ってたら、あなたにお話しましたよ。
There are many children whose mothers go out to work.	母親が働きに出ている子供達がたくさんいます。
The room was light enough for him to read the letter.	部屋は明るくして彼は手紙を読むことができた。
Don't look down on them just because they are poor.	貧乏だからというだけで彼らを軽蔑してはいけない。
She tried to take down every word the teacher said.	彼女は先生の言う言葉をすべて書き留めようとした。
She came to Tokyo with a view to getting a new job.	彼女は新しい職を見つけるために東京にやってきた。
She is playing an important role in our organization.	彼女は私たちの団体では重要な役を務めている。
She acted as if she didn't care what happened.	彼女は何が起きたかまるで気にしていないかのように行動した。
She made up her mind to stay with us for a while.	彼女はしばらく私たちのところに滞在することに決めた。
Her mother lives in the country all by herself.	彼女のお母さんは田舎でまったく一人ぼっちで暮らしている。
He put forward a plan for improving the rate of production.	彼は生産率を良くする案を出した。
He says he has never told a lie, which is a lie.	彼は嘘などついたことがないと言っているが、それは嘘だ。
He gave me everything but took nothing in return.	彼はみんな私にくれたが代わりに何も受け取らなかった。
He is the person who is difficult to come to terms with.	彼はなかなか折り合って行きにくい人だ。
He comes from England, but is very poor at English.	彼はイギリス生まれだが、英語がとても下手である。
He was born at seven on the morning of June 5 in 1970.	彼は１９７０年６月５日の朝７時に生まれた。
I found it difficult to understand what he was saying.	彼の言っている事を理解するのは困難だった。
It makes no difference to me whether he comes or not.	彼が来るか来ないかは私にとって重要ではない。
It makes no difference to me whether he comes or not.	彼が来るか来ないかは私にどうでもよいことだ。
It makes no difference to me whether he comes or not.	彼が来るかどうかは私にはどうでもいいことだ。
It makes no difference to me whether he comes or not.	彼がくるかこないかは私にはどうでも良い事だ。
The population of Tokyo is greater than that of London.	ロンドンの人口より東京の人口の方が多い。
Many TV programs have a bad influence on children.	多くのテレビ番組が子供たちに悪い影響を与えている。
The teacher didn't mind explaining the problem again.	先生は問題を説明し直すことを嫌がらなかった。
What he said about girls holds true of boys, too.	女の子について彼がいったことは男の子にも当てはまる。
Actually, I didn't know anything about those plans.	実は、私はその計画について何も知らなかったのだ。
Times may change, but human nature stay the same.	時代は変わるだろうが、人間の本性は変わらないものだ。
We have been on bad terms with each other for a long time.	私達は長い間お互いに仲が悪かった。
We remembered the old days when we had played together.	私達は一緒に遊んだ昔の日々を思い出した。
It is forty years since I began the study of Japanese.	私は日本語を学びはじめてから４０年になる。
It was brought home to me how important education is.	私は教育がいかに重要であるかを痛感しました。
I visited Hollywood while I stayed in Los Angeles.	私はロサンゼルスに滞在中にハリウッドを見にいった。
I'll have to make do with the old car for a while.	私はしばらくは古い車で間に合わせなければならない。
I found this book interesting from beginning to end.	私はこの本が始めから終わりまで面白いと思った。
I find it much easier to speak French than English.	私には英語よりフランス語を話す方がずっと簡単だ。
It makes no difference to me whether you come or not.	私にとってあなたがくるかどうかは問題でない。
If I were in your situation, I would do the same thing.	私が同じ立場でも、同じ事をするでしょう。
I'm not able to make clear how I am feeling.	私が感じているとおりをはっきり申し上げることができないのです。
Muriel is making a poor living from her part-time job.	ムリエルさんはバイトで細細と暮らしている。
The new teacher is more like a friend than a teacher.	今度来た先生は、先生というより友達みたいだ。
It goes without saying that experience is a good teacher.	言うまでもなく、経験はよい教師です。
You should eat more, or you won't get well soon.	君はもっと食べるべきだ。さもないと早く良くなれないぞ。
Our trading companies do business all over the world.	我が国の商社は世界をまたにかけて商売をする。
To study English is important for today's young people.	英語を学ぶ事は今日の若者にとって大切だ。
You have to look out for other cars when you drive.	運転する時は、他の車に注意しなければなりません。
Some people believe that Japan is No.1 in everything.	一部の人々は日本がすべて一番だと思っている。
The difference is this: he works harder than you.	違いはこうだ。つまり、彼のほうが君よりよく働くのだ。
London developed into the general market of Europe.	ロンドンは発展してヨーロッパの一般市場になった。
Did you meet many interesting people at the party?	パーティーではたくさんおもしろい人に会いましたか。
We'll have to take on someone to do Tom's work.	トムの代わりに仕事をする者を雇わなくてはならないだろう。
There are so many questions: Do I like myself?	とても多くの疑問があるのです。私は自分が好きなのだろうか。
Mr Taylor wishes he had not come to the party.	テーラーさんはパーティーに来なければよかったと思っている。
Even though you don't like this, you must eat it.	たとえこれが好きでなくても、食べないといけませんよ。
It cost lots of money to put the plan into practice.	その計画を実行に移すのに多大な費用がかかった。
Tell me everything that you can think about it.	そのことについて君が考えられることをすべて教えて下さい。
Is there any good way to memorise our lines quickly?	せりふを早く暗記する何か良い方法がありますか。
We are not likely to accept another offer any time soon.	すぐには別の提案を受けられそうにない。
It'll take a week or so to read through this book.	この本を読み終えるには１週間かそこらかかるだろう。
I know the situation is very difficult for us.	この状況が私たちにとって非常に困難であることは知っている。
Few books of this character have come to my attention.	この種の本はあまり私の注意を引かなかった。
What happened to Chris? We don't see her these days.	クリスはどうしたのか。近頃彼女を見かけないが。
Once you have begun to do something, never give up.	何でもいったんやり始めたら、絶対にあきらめるな。
Then I met your father and we moved to the town.	その時お父さんと会って、いっしょに町へ移って来たのだ。
Let go of my arm! I can't stand people touching me.	腕を離せ。人に触れられるのにはがまんがならんのだ。
The point is whether she will read my letter or not.	問題は彼女が私の手紙を読んでくれるかどうかです。
You had better turn off the light before you go to sleep.	眠る前に電気を消したほうがいいですよ。
Mother told me to come home early, but I was late.	母が早く帰ってくるように言ったが遅くなってしまった。
The room was so dark that we could see nothing at all.	部屋は真っ暗だったので全く何も見えなかった。
She looks better today than when I her saw last.	彼女は私がこの前会った時より今日の方が体調が良さそうだ。
She directed her efforts at learning to speak English.	彼女は英語を話せるようになろうと骨を折った。
She directed her efforts at learning to speak English.	彼女は英語が話せるようになろうと骨を折った。
She made up her mind to stay with us for a while.	彼女はしばらくの間私達のところに滞在することに決めた。
She wished she had been born twenty years earlier.	彼女は２０年早く生まれていたらよかったのにと思った。
She gave me a large room while I stayed at her house.	彼女の家に滞在中は、大きな部屋を貸してくれた。
He would sooner die than get up early every morning.	彼は毎朝早く起きるくらいなら死んだほうがましだ。
He had taken to drinking more than was good for him.	彼は体によくないほど酒にふけるようになっていた。
He tried to find out what he was up against.	彼は自分の前にどんな障害が立ちふさがっているのか知ろうと努めた。
Far from reading the letter, he did not even open it.	彼はその手紙を読むどころか、封も切らなかった。
It was difficult for me to make out what he was saying.	彼が話している事を理解するのは困難だった。
It makes no difference to me whether he comes or not.	彼が来るか来ないかは私にはどうでもいいことだ。
It makes no difference to me whether he comes or not.	彼が来ようが来まいが私にはどうでもいいことだ。
There are many natural objects that we can put to use.	天然物中に利用しえるものがたくさんあります。
When my son is doing nothing bad, he is sleeping.	息子が何か悪いことをしていないときは、必ず眠っている。
I wanted to meet and talk with the girl at the window.	窓のところにいる少女に会って話がしたかった。
Man eats to live, he does not live to eat.	人は生きるために食べるのであって、食べるために生きているのではない。
They got over to the other side while the light was red.	信号が赤いうちに彼らは向こう側へ渡った。
Make sure you turn everything off before you leave.	出かける前にすべてのものを必ず消すようにしなさい。
Respect of the young for the old is quite natural.	若い者が老人を尊敬するのはきわめて当然なことである。
It was difficult for me to make out what he was saying.	私は彼が何を言っているのかわからなかった。
I have at last learned the Gettysburg Address by heart.	私はやっとゲティスバーグの演説を暗記した。
I suggested that we should bring the meeting to an end.	私はもう会合を終わってはどうかと提案した。
It is true that we desire to live in a small town.	私たちが小さな町に住みたいと思っているのは本当です。
What we have is one thing and what we are is quite another.	財産と人格とはまったく別のものだ。
No, you mustn't because I am not on good terms with her now.	困るわ。いま仲たがいしているの。
I feel better today, but I am not well enough to work.	今日は気分がいいが、まだ働ける状態ではない。
It appears to me that she feels much better today.	今日は、彼女はずっと気分がよいように私には見えます。
Today's school does no poorer a job than it used to.	今日の学校は以前と同じく立派な仕事をやっている。
Some people are never content with what they have.	現在自分の持っているものに絶対満足をしない人もいる。
If you try for too much, you'll end up with nothing at all.	結局は虻蜂とらずになってしまった。
You must consider what kind of work you want to do.	君はどんな仕事をしたいのかをよく考えねばならない。
If I were in your situation, I would do the same thing.	君の立場だったら、私も同じ事をするだろう。
Every one of us is more or less interested in art.	我々は誰でも芸術には多かれ少なかれ興味を抱いている。
To speak English is not easy, but it is interesting.	英語を話すことは簡単ではない、でもそれは面白い。
One person more or less doesn't make much difference.	一人くらい増えても減ってもたいしたことはない。
What do you think would happen if it were not for books?	もし書物がなければどうなると思いますか。
It was in 1989 that the Berlin Wall was taken down.	ベルリンの壁が崩壊したのは１９８９年のことだった。
The population of New York is smaller than that of Tokyo.	ニューヨークの人口は東京よりも少ない。
Could you move forward so we can close the door?	ドアを閉められるように、もう少し前に進んでもらえますか。
So difficult was the question that no one could answer.	その質問は難しくてだれも答えられなかった。
But among you stands one you do not know.	しかし、あなたがたのなかに、あなたがたが知らない方が立っておられます。
It was too difficult for Jane to go to school alone.	ジェーンがひとりで学校に行くのは難しすぎました。
How old were you when this town had the big fire?	この町に大火があったのは、あなたがいくつの時でしたか。
That country's economic situation changes from day to day.	あの国の経済状態は日ごとに変化する。
Do you know the name of the boy standing over there?	あそこに立っている男の子の名前をしっていますか。
It's already eleven. It's high time you were in bed.	１１時になってるよ。おまえはもうねる時間でしょ。
"Would you mind opening the window?" "Of course not."	「窓を開けていただけませんか」「ええ、どうぞ」
I found it rather difficult to make myself understood.	理解してもらうのがずいぶん難しいと思いました。
Part of Hokkaido still remains in its natural state.	北海道の一部分はまだ自然のままの状態で残っている。
The U.S. Government made an attempt to open Japan's doors.	米国政府は日本を開国させようと試みた。
She talks as if she knew everything about it.	彼女はまるでそのことについて何でも知っているかのように話をする。
She made up her mind to stay with us for a while.	彼女はしばらくの間私たちのところに滞在することを決めた。
I found it difficult to make out what she was saying.	彼女が言っていたことを理解するのは困難であった。
They make themselves out to be poorer than they really are.	彼らは実際より貧しいふりをしている。
He wishes he had studied harder when he was young.	彼は若いころもっと勉強しておけばよかったと思っている。
He has not come yet. Something may have happened to him.	彼はまだ来ない。何かあったのかもしれない。
Try sounding him out and see if he'll come around.	彼に打診して、賛成してくれるかどうか確かめてみなさい。
It makes no difference to me whether he comes or not.	彼が来るかどうかは私にとってどうでもいいことだ。
When you drive in Japan, remember to keep to the left.	日本で車を運転するときには左側通行を忘れずに。
The population of Tokyo is larger than that of New York.	東京の人口は、ニューヨークの人口より多い。
I wish I'd kept up my Chinese. I need it for my job.	中国語を続けておけばよかった。今仕事で必要なんだ。
Someone said something, but I could not understand it.	誰かが何かを言ったが、それを理解できなかった。
People who go to bed early and get up early live a long time.	早寝早起きをする人は長生きする。
You may eat anything so long as you don't eat too much.	食べすぎないかぎり、何を食べてもかまわない。
The population of Shanghai is as large as that of Tokyo.	上海の人口は、東京の人口と同じくらいです。
I wish I had studied English harder while young.	若いころもっと一生けん命英語を勉強しておけばよかったのに。
We must hand in a history paper by next Saturday.	次の土曜日までに歴史のレポートを提出しなければならない。
I suggested to my father that Kumiko study in China.	私は父にクミコが中国に留学してはどうかと提案した。
I considered leaving school, but thought better of it.	私は退学する事を考えたが更に考え直して止めた。
I couldn't make myself understood well in English.	私は英語でうまく自分の意思を伝えることができなかった。
The longer I stayed in Paris, the more I liked it.	私はパリにいればいるほど、それだけパリが好きになった。
We chose a good present for each of their children.	私たちは彼らの子供一人一人に立派な土産を選びました。
Every one of us is more or less interested in art.	私たちは誰でも、多かれ少なかれ芸術に興味を持っている。
The job is interesting, and then again, the pay is good.	仕事はおもしろいしその上給料がいいのです。
He asked me if I had slept well the night before.	昨晩はぐっすりお休みになりましたか、と彼は私にたずねた。
Which player are you paying the most attention to this year?	今年、注目している選手は誰ですか。
We have a lot of social problems to think about today.	今日、私たちに考えるべき社会問題が数多くある。
The child of today is the man of the future in the making.	今の子供は、発達中の未来の大人である。
