To me, he is like a king.	私にとって彼は王様のような人です。
To my knowledge, she has not left yet.	私の知る限りでは、彼女はまだ出発していない。
To my thinking, business is improving.	私の考えでは、景気は上向きになります。
To own a library is one thing and to use it is another.	蔵書があるということと、それを活用することとは別のことだ。
To read a lot of books is a good thing.	沢山の本を読む事は良いことである。
To say is one thing, and to do is another.	言う事とする事は別問題だ。
To say is one thing, to do is another.	言うこととすることは別だ。
To see is to believe.	見ることは信じることである。
To the best of my knowledge, he will not come.	私の知る限りでは、彼は来ないだろう。
To the best of my knowledge, she's hard to please.	私の知る限りでは彼女は気難しい。
To us, school was a place to get away from as soon as possible.	私たちにとって学校は、できるだけ早く逃げ出したい場所だった。
To write a love letter in English is not easy.	英語でラブレターを書くのは、やさしくない。
To write good English requires a lot of practice.	よい英語を書くためには、たくさん練習しなければならない。
Today I have a lot of things to do.	今日は、することがたくさんあるんだ。
Today more and more people begin to use computers.	今日はますます多くの人々がコンピューターを使い始めている。
Today only 10 percent is covered.	今日では１０％の陸地しか覆われていないのである。
Today she can do many things humans can do with language.	今日では、彼女は人間が言語を使ってできることの多くのことができる。
Today we have more than three times as many vehicles as on the roads in 1950.	今日では１９５０年の３倍以上の数の車が走っている。
Tokyo Station is the third stop.	東京駅は三つ目です。
Tokyo is by far the largest city in Japan.	東京はだんぜん日本で一番大きい都市です。
Tom and Jim have been on bad terms for many years.	トムとジムは長年の間、仲が悪い。
Tom broke the window.	トムは窓を割った。
Tom came running with a letter from Judy.	トムはジュディからの手紙を持って走ってきた。
Tom cut classes again.	トムはまた授業をさぼった。
Tom has no wish to study.	トムは勉強したいとは思わない。
Tom is not able to drive a car.	トムは車を運転できない。
Tom is on good terms with John.	トムはジョンと仲がよい。
Tom is very kind.	トムはとても親切だ。
Tom is very kind.	トムは本当に親切ですね。
Tom often goes fishing in the river.	トムはよく川へ釣りに行きます。
Tom said that he had been cleaning the house all day.	トムは１日中家を掃除していたと言った。
Tom saved her from the fire.	トムは彼女を火事から救出した。
Tom saw John and Mary holding hands.	トムはジョンとメアリーが手をつないでいるのを目撃した。
Tom showed her the letter from Santa Claus.	トムは彼女にサンタクロースからの手紙を見せた。
Tom stopped to take a close look at the car.	トムはその車をよく見ようと立ち止まった。
Tom usually goes to bed at ten-forty.	トムは普通１０時４０分に床に就きます。
Tom will be able to drive a car soon.	トムはすぐに車を運転できるようになるだろう。
Tom works as hard as any boy in the class.	トムはクラスの誰にも劣らずよく勉強する。
Tom's Japanese is improving little by little.	トムの日本語は少しずつ進歩している。
Tom's already here, but Bill hasn't come yet.	トムはもうここに来ていますがビルはまだです。
Tom's house is near the church he goes to.	その家は教会の真向かいにある。
Tom, don't die.	トム、死んじゃだめ。
Tony did not often hear music.	トニーはあまり音楽を聞いていませんでした。
Too much of a good thing.	過ぎたるはなお及ばざるがごとし。
Torajiro made it clear that he was in love with me.	虎次郎は、私を愛してることを明らかにしました。
Try as she may, she will not be able to please him.	彼女がどんなに彼を喜ばそうとしても彼は喜ばなかった。
Try as she may, she will not be able to please him.	彼女はどんなに努力しても、彼を喜ばせることはできないだろう。
Try doing it once more.	もう一度それをやってみなさい。
Try it once again.	もう一度それをやりなさい。
Try it once more.	もう一度やってみて。
Try to do one thing at a time.	一度にひとつのことをするようにしなさい。
Try to improve your English.	英語が上達するように努力しなさい。
Try to make up your mind soon.	すぐ決心するようにしてください。
Try to see things as they are.	あるがままに物事を見るようにしなさい。
Try to see things as they are.	物事はありのままに見るようにしなさい。
Try to see things as they are.	物事をありのままに見なさい。
Try to see things as they really are.	ものごとをあるがままに見るようにしなさい。
Try to see things as they really are.	物を有るがままにみようよしなさい。
Try to stay on her good side and you'll be on easy street.	彼女に目をかけられれば、あなたは安泰でいられますよ。
Try to take account of everything before you make a decision.	決定する前にすべてのことを考慮するようにしなさい。
Try your best in everything.	何事にせよ全力を尽くしてみなさい。
Turn hard left.	左へ一杯に曲がれ。
Turn him down once for all.	きっぱりと彼の頼みを断りなさい。
Turn left at the first light.	最初の信号を左へ曲がって下さい。
Turn off the TV before you go to bed, OK?	寝る前にテレビを消してよ、いいね。
Turn off the light before you go to bed.	寝る前に電気を消してください。
Turn off the lights when you leave the room.	部屋を出るときには明かりを消しなさい。
Turn right at the next crossing.	次の交差点を右に曲がりなさい。
Turn that radio down at once.	そのラジオ、今すぐ小さくしてくれ。
Turn this to the right, and the machine will start.	これを右に回せば機械は動きます。
Turn to channel 1.	チャンネルを１にして。
Turn to the left.	左へ曲がりなさい。
Turn to the left.	左を向いてください。
Turning to the left, you will find the post office.	左に曲がれば、郵便局が見える。
Twelve years is old for a dog.	１２歳といえば犬は年寄りだ。
Twenty years already passed.	すでに２０年経った。
Two boys came running out of the room.	二人の少年が部屋から走って出てきた。
Two boys stood in front of me.	僕の前に二人の少年が立った。
Two figures will appear above.	上に２つ数字が出る
Two from ten leaves eight.	１０から２を引くと、８残る。
Two months have already passed.	すでに２ヶ月がたちます
Two months have passed since he left for France.	彼がフランスに去ってから２ヶ月が過ぎた。
Two people travel together.	二人の人が旅をします
Two weeks ago, I visited Disneyland for the first time.	２週間前に初めてディズニーランドを訪れた。
Two years have passed since I last met you.	２年間のご無沙汰でした。
Two years have passed since we parted.	お別れして以来２年たちました。
Two-thirds of the students of this school are boys.	この学校の３分の２が男子生徒です。
Type this letter for me.	この手紙をタイプで打ってください。
Until Mary gets back to work, we'll have to make do with Ken.	メアリーが復帰するまでは、ケンで間に合わせざるをえないだろう。
Until Monday or Tuesday of next week.	来週の月曜日か火曜日までなんだけど。
Until next time.	またこの次までね。
Until next week.	来週までごきげんよう。
Until the end of the week.	今週の終わりまでです。
Until the end of the week.	今週末までなんだけど。
Until when are you staying?	いつまでご滞在ですか。
Until when will you be in Japan?	いつまで日本にいるのですか。
Upon my word I will do it.	誓って私はそれをします。
Users can download the original-size file. 	ユーザーがオリジナルサイズのファイルをダウンロードできます
Various opinions will be heard.	色々意見が出ます
WHO stands for World Health Organization.	ＷＨＯとは世界保健機構を表す。
Walter Mondale ran for President.	ウォルター・モンデールは大統領選に出馬した。
War had already broken out.	既に戦争が始まっていました
Was it Jack that broke the window?	窓を壊したのはジャックでしたか。
Was she able to write a report?	彼女はレポートを書くことができましたか。
Was this letter written by Ken?	この手紙はケンによって書かれましたか。
Was this letter written by Mary?	この手紙はメアリーが書いたものですか。
Watch out for cars when you cross the street.	道路を横断する時には車に注意しなさい。
Watch out for falling objects!	落下物に注意！
Watch out for passing cars.	通過する車に気をつけなさい。
Watching TV is fun.	テレビを見ることはおもしろい。
Water is to fish what air is to man.	水と魚の関係は、空気と人間の関係に等しい。
Water the plants.	植物にお水あげて。
We all believe in good, free education for our children.	子供に自由で良い教育をすることをいいものと信じている。
We all have missed you.	みんな寂しがっていたんですよ。
We all have passed the test.	私達全員が試験に通った。
We all miss you very much.	君がいないのでみんなとても寂しく思っている。
We all searched high and low for the missing documents, but they were never found.	私たちはみんなで紛失した書類をくまなく探したがどうしてもみつからなかった。
We all stand by you to the last.	私たちはあなたを最後まで支持します。
We all stood up at once.	同時に起立した。
We all try to get together at least once a year.	私たちは少なくとも一年に一回は集まるようにしている。
We always begin with the hardest problems.	私たちはいつも困難な問題から始まる。
We are about to leave here.	私たちはここを去ろうとしている。
We are getting off at the next station.	私たちは次の駅で降ります。
We are having fish for our main course.	メインディッシュを魚にしました。
We are here in the name of Jesus Christ and King Charles.	私たちはイエス・キリストとチャールズ王の名のもとにここにきました。
We are in good condition.	私達は健康です。
We are just going to leave.	私達は今でかけるところだ。
We are keeping a big dog.	私たちは大きな犬を飼っている。
We are leaving Japan next month.	私たちは来月日本を離れます。
We are leaving Narita next Monday.	来週の月曜日に成田を出発する予定です。
We are leaving this country for good.	私たちは、この国を永遠に去ります。
We are not going to stay at the hotel again.	私達は２度とそのホテルに泊まりません。
We are not here for fun and games.	静かにしてくれ。
We are not short of oil in this country.	我々のこの国では石油は不足していません。
We are not sure, but she is right.	彼女はきっと正しいのだろう。
We are on good terms with them.	私達は彼らと仲がよい。
We are to meet at the station at nine.	私達は９時に駅でおちあうことになっている。
We are to meet at the station at seven.	私達は駅で７時に会うことになっている。
We are usually at home in the evening.	私たちは夕方はたいてい家にいます。
We asked several questions of him.	我々は、彼にいくつかの質問をした。
We began on a new project.	我々は新しい事業に着手した。
We believe in Buddhism.	我々は仏教を信仰している。
We believe in government by and for the people.	人民による人民の為の政治が良いと思う。
We believe in that man.	私たちはあの男とこの人を信頼しています。
We believed that the news is true.	その知らせは本当だと信じられています。
We call our dog Johnnie.	うちの犬はジョニーと呼ばれている。
We call our dog Pochi.	私たちの犬をポチと呼んでいます。
We came here to build a new town.	私たちは新しい町を作るためにここへ来た。
We came in view of the lake.	湖の見える所に私たちはやってきた。
We came in view of the lake.	私たちは湖の見える所に来た。
We came to the town, where we stayed for a week.	私たちはその町に来て、１週間滞在した。
We came together to form a group.	我々らは団結した。
We came upon them in New York.	我々はニューヨークで彼らに出くわした。
We can cut down on our use of energy.	私たちはエネルギーの使用を減らすことができます。
We can get three stations in this area.	この地区では三局受信できます。
We can just about read each other's minds.	彼と僕はツーカーの仲だ。
We can know the past, but the future we can only feel.	過去は知ることができる。しかし未来は感じることしかできない。
We can see Mt. Fuji far away on a fine day.	晴れの日には遠くに富士山が見えます。
We can see a church over there.	むこうに教会が見えます。
We can stay here for as long as our supplies of food and water hold out.	私たちは食料と水の蓄えがもつかぎりここにいられる。
We charge a commission of 3%.	手数料は３パーセントかかります。
We cleaned the room in turn.	私達は交替で部屋を掃除した。
We cleaned up our garden.	私たちは庭をきれいにそうじした。
We could go out together like we did last year.	去年みたいに遊びに行きましょう。
We couldn't stop him from hitting her.	彼が彼女をたたくのを私たちは止めることができなかった。
We crossed several rivers on the way.	わたしたちは途中いくつかの川を渡った。
We cut our living costs.	生活費を切りつめた。
We did everything for our part.	私たちの方であらゆることをした。
We did everything we could to save the boy.	その少年を救うために我々はできる限りの事をした。
We didn't go as far as Boston.	私たちはボストンまでは行きませんでした。
We didn't go very far.	我々はそんなに遠くへは行かなかった。
We didn't have much fun.	たいして楽しくなかった。
We didn't mean to leave Mary out of the plan.	われわれはメアリーをその計画からはずすつもりは無かった。
We didn't see any girls in the group.	そのグループには女の子は一人も見えなかった。
We die only once, and for such a long time.	われわれは一度だけ死ぬ、そしてそんなにも永い間死ぬ。
We die whether we make money or not.	金をもうけようともうけまいと、われわれは死ぬのだ。
We express thought with language.	我々は言葉によって思想を表現する。
We found the boy interested.	その少年は面白がっていた。
We get together once a year.	私たちは年に一度集まります。
We get together once a year.	私は年に１回集まります。
We get together once a year.	私達は年に一回集まります。
We go fishing once in a while.	私たちは時々魚釣りに行く。
We go fishing together once in a while.	私たちは時折一緒に釣りに行きます。
We go fishing together once in a while.	私たちは時折釣りに行く。
We go there often.	最近われわれはしばしばそこへ行く。
We go to the movies together once in a while.	私たちはときどきいっしょに映画を見に行く。
We got all the materials together.	我々はすべてのデータを一つにまとめた。
We got to the station at six.	我々は６時に駅に着いた。
We got together in the park.	私たちは公園に集まりました。
We got up early and set about cleaning our house.	私たちは早起きして、家の掃除を始めた。
We had a chat for a while.	私たちはしばらくおしゃべりをした。
We had a heart-to-heart talk with each other.	私たちはお互いに腹を割った話し合いをした。
We had better not remain here any longer.	ここにはこれ以上いない方がいいね。
We had better not remain here.	ここにはいない方がよい。
We had fine weather on that day.	その日はいい天気だった。
We had known him for five years when he died.	彼が亡くなったとき、私達は５年間彼を知っていました。
We had our photo taken on the beach.	僕達は浜辺で写真を撮って貰った。
We had really great weather during New Years.	このお正月、本当にお天気に恵まれました
We had to do without oil during the war.	我々は戦時中は石油なしで済まさなければならなかった。
We have a black and white dog.	白黒ぶちの犬を飼っている。
We have a lot of problems to deal with.	私たちには処理しなければならない問題がたくさんある。
We have a lot of very fine days in October.	１０月には快晴の日が多い。
We have all kinds of items.	当店はすべてのアイテムを取り揃えています
We have all kinds of time.	時間はたっぷりある。
We have already learned English.	私たちはすでに英語を学んでしまいました。
We have been friends ever since.	それ以来ずっと私たちは友達である。
We have been on bad terms with each other for a long time.	私達は長い間お互いに仲が悪かった。
We have cut back production by 20%.	わが社では生産を２０％削減した。
We have dealt with this store for 16 years.	私たちはこの店と１６年間取り引きをしている。
We have four seasons in Japan.	日本には四季があります。
We have had fine weather this week.	今週はずっと天気がよい。
We have lived in this town for five years.	私たちはこの町に５年間住んでいる。
We have lived in this town since 1960.	私たちは１９６０年以来この町に住んでいます。
We have lots of things to do.	私たちにはたくさんのやるべきことがある。
We have no reason for staying here.	私たちがここにとどまる理由はない。
We have not received a letter from him so far.	今までのところ我々は彼から手紙を受け取っていない。
We have planted the garden.	庭に種をまきました。
We have still a lot of food left.	食料はまだいくらでもある。
We have three dogs, one white and two black.	うちには犬が３匹いて、白いのが１匹、黒いのが２匹です。
We have to clear up the problem first.	まずその問題を解決しなくてはならない。
We have to do a great deal of reading.	我々はたくさん読書しなければならない。
We have to get off at the next station.	私たちは次の駅で降りなければならない。
We have to learn the right things.	私たちは正しいことを学ばなければならない。
We have to put off making a final decision until next week.	私たちは最終決定を来週まで延期しなければならない。
We have to start at once.	すぐに出発しなければならない。
We have to start at once.	我々はすぐに出発しなければなりません。
We have to stay a decision until he comes back.	彼が戻るまで決定できない。
We have two dogs. One is black and the other is white.	家には２匹の犬がいる。１匹は黒で、もう１匹は白である。
We have two gifts for those who signed the contract.	ご成約頂いた方には２つのプレゼントを用意しています
We haven't seen you in the past four years.	お目にかかるのは４年ぶりですね。
We haven't tried the drug out on humans yet.	その薬は人間に対してはまだ実験していない。
We hold a meeting once a month.	毎月一回会合を開いている。
We hope she will take heart soon.	彼女がすぐに元気になるといいのだが。
We hope that he can go there.	私たちは彼がそこへ行けることを希望する。
We hope that many of you will be able to join us.	ぜひ皆様のご参加をお願いします
We hope to meet you again.	もう一度お会いできればいいんですが。
We hope to see you again.	もう一度お目にかかりたいものです。
We hoped he would come and help us at once.	私たちは彼がすぐに来て、手伝ってくれるのを願った。
We hoped to have done with the work before the holidays.	我々は休み前に仕事を仕上げたかったのだが。
We hoped we'd be able to win the game.	ゲームに勝てるといいなと思った。
We kept standing all the way to Osaka.	私達は大阪までずっと立ちつづけだった。
We learn a good deal at school.	私たちは学校でたくさんのことを学ぶ。
We leave Japan at 3 p.m. next Friday.	私たちは次の金曜日の午後３時に日本を出発する。
We left the final decision to him.	我々は最終決定を彼にまかせた。
We left the final decision to him.	最終決定は彼に任せた。
We let him keep the dog.	私たちは彼にその犬を飼わせてやった。
We live close to the station.	私たちは駅の近くに住んでいます。
We live near a big library.	私たちは大きな図書館の近くに住んでいます。
We made a date to meet soon.	じきにまた会う約束をした。
We made fun of him about this.	我々はこの事で彼をからかった。
We made the boy our guide.	私達はその少年をガイドにした。
We made up our mind to come in any case.	ともかく来ることにした。
We make lots of things out of paper.	私達は紙から多くのものを作る。
We make much of the changing of the seasons in Japan.	日本では季節の変化を大切にする。
We managed to bring him around to our way of thinking.	私たちはやっと彼を説得して私たちの考えに同調させた。
We managed to get it back without her knowing about it.	わたしたちはどうにか彼女に知られずそれを元に戻した。
We managed to get it back without her knowing.	私達はどうにか彼女に知られずにそれを元に戻した。
We managed to get there on time.	私達はどうにか時間どおりにそこについた。
We managed to get through to each other.	私たちはなんとか意志の疎通ができた。
We may as well begin without him.	彼なしで始めてもよかろう。
We may as well go at once.	すぐ行くのがよいだろう。
We may as well set to work at once.	すぐ仕事に取りかかった方がいいだろう。
We may as well start at once.	私達はすぐに出発した方がいい。
We may as well stay where we are.	今の場所を動かないほうがいいでしょう。
We may as well stay where we are.	私達は今いるところにいったほうがよい。
We may meet again in the near future.	近い将来私達が再会する時があるかも知れません。
We meet here once a month.	私達は月に１回ここに集まる。
We met in Europe a few years ago.	私たちは２、３年前にヨーロッパで出会った。
We met in front of the school.	私たちは学校の前であった。
We met last year and hope to meet again next year.	私たちは昨年会い、来年もまた会おうと望んでいる。
We miss you very much.	あなたがいなくてとても寂しい。
We must act at once.	ただちに行動を起こさなければならない。
We must always stand up for our rights.	我々はいつも自分の権利を擁護しなければならない。
We must always try to serve others.	我々は常に人に奉仕するように努めなければならない。
We must be as kind to old people as possible.	お年寄りにはできるだけ親切にしなくてはいけません。
We must begin before five.	５時前の始めなければなりません。
We must deal with this problem.	私たちはこの問題を処理しなくてはならない。
We must go there whether we like it or not.	私たちは、好むと好まざるとに関らず、そこ行かねばなりません。
We must hold a meeting of the council of directors.	理事会を開催しなければならない。
We must keep our hands clean.	手をきれいにしておかなければならない。
We must leave early.	私たちは早めに出発しなければなりません。
We must look at the problem from a global point of view.	我々はその問題を世界的視野で見なければならない。
We must look to the government for a tax cut.	私たちは政府が減税してくれるのを期待すべきです。
We must make a decision on this right away.	これについてはすぐに決定を下さなければならない。
We must make the best we can of the few natural resources we have.	われわれは持っているわずかな天然資源をできるだけ利用しなければならない。
