It is this window that he broke.	彼が壊したのはこの窓だ。
It is three years since he died.	彼が亡くなって三年になります。
It is time I left here.	そろそろお暇します。
It is time for you to go to bed.	もうお前は寝る時間だ。
It is time to go to bed.	もう寝るときだ。
It is too good to be true.	話がうますぎて本当とは思えない。
It is too hot to stay here.	暑くてここにはいられない。
It is true of every case.	それはあらゆるケースに当てはまる。
It is true that he got full marks on the test.	彼が試験で満点を取ったのは本当です。
It is true that he is good at playing golf.	彼がゴルフが上手いのは本当だ。
It is true that he is over seventy.	確かに七十はすぎてる。
It is true that they talk a lot, but they say little.	なるほど彼らはよくしゃべるが、たいしたことは言っていない。
It is two years since he left for Hawaii.	彼がハワイに行ってから２年になる。
It is up to you whether to buy it or not.	買うかどうかはあなたしだいです。
It is very far as far as I know.	私の知る限りではとても遠い。
It is very fine today.	今日はたいへんよい天気です。
It is very fine today.	今日はたいへん天気がよい。
It is very fine today.	今日はとてもよい天気だ。
It is very important for us to love a river.	川を愛することは、私たちにとってとても大切です。
It is very kind of you to come and see me.	私に会いに来てくれてありがとう。
It is very kind of you to help me.	私を手伝ってくれて、あなたはとても親切ですね。
It is very kind of you to say so.	そう言ってくれて君は、とても親切だ。
It is very kind of you to show me the way.	道案内して頂き、ありがとうございます。
It is written in simple English.	簡単な英語で書かれている。
It is, as it were, a life and death problem.	それはいわば生死の問題だ。
It isn't always easy to know a good book from a bad one.	良書と悪書を見分けるのは必ずしも容易ではない。
It isn't clear which of them wanted that.	どちらが望んだのか判然とはしない。
It isn't easy for me to play golf.	私にとってゴルフをすることは、簡単ではない。
It looks as though we shall have to go without a holiday this year.	私たちは今年は休日なしで済まさなければならないようだ。
It looks like he will win.	彼は勝利したように見える。
It looks like he's winning.	彼が勝ちそうだ。
It looks like it is going to clear up soon.	すぐ晴れ上がりそうです。
It looks like we have everything.	全部そろっているようです。
It may be that he is not a bad man.	彼も悪い男ではないのかもしれない。
It may be true.	それは本当かもしれない。
It may or may not be true.	それは本当かもしれないし、そうでないかもしれない。
It may well be true.	それはおそらく真実かもしれない。
It may well be true.	それは多分本当だろう。
It remains to be seen whether or not going to America to study is good for me.	勉強しにアメリカに行く事が私にとってよいかどうかまだわからない。
It requires a lot of energy.	それがかなりエネルギーを使う
It requires a lot of work.	実に多くの作業が必要になる
It serves our purpose.	それは我々の目的にかなっている。
It serves you right.	それは当然の報いだ。
It shows this information in several languages.	それがこれらの情報を複数の言語で表示します
It took a long time to put out the fire.	その火事を消火するのに長い時間かかった。
It took a lot of time and money to build the machine.	その機械を作るには多くの時間と金がかかった。
It took me more than a week to put the model ship together.	模型船を組み立てるのに私は１週間以上かかった。
It took me three days to clean the room.	その部屋を掃除するのに三日もかかったのよ。
It turned out to be true.	それが正しいことだとわかった。
It turned out to be true.	それは本当だということがわかった。
It turned out true.	それは本当であることがわかった。
It was Mr Smith that told me how to use that machine.	あの機械の使い方を私に教えてくれたのはスミス氏だった。
It was Tom that saved the girl.	その女の子を救ったのはトムだ。
It was a big hit all over the world.	それが世界中で大ヒットを飛ばした
It was a long letter.	それは長い手紙だった。
It was ages ago.	それは何年も昔のことだ。
It was all I could do to keep standing.	立っているのが精一杯だった。
It was already the next day.	既に日付が変わっていました
It was an old man that was hit by the black car.	黒い車にはねられたのは老人だった。
It was clear what he meant to do.	彼が何をしようとしていたのかははっきりしていた。
It was fine all day.	一日中上天気だった。
It was fun playing in the park.	公園で遊ぶのはおもしろかった。
It was going to be from Saturday, but, with one thing and another, it ended up being from the new week.	本当は土曜日からの予定が、いろいろあって週明けからってことになった。
It was hard as rock.	それはまるで岩のように堅かった。
It was her wish to go to Paris.	パリへ行くことが彼女の望みでした。
It was hot. I couldn't stand it any longer.	とても暑くてそれ以上我慢できなかった。
It was just 6 years ago that I visited New Zealand for the first time.	初めてニュージーランドへ行ったのは、今からちょうど６年前です。
It was just two weeks ago that Ken came to see me.	ケンが私に会いに来たのは、ちょうど２週間前だった。
It was kind of her to show me the way to the station.	彼女は親切にも私に駅まで道案内をしてくれた。
It was my turn to clean the room.	私が部屋を掃除する番にあたっていた。
It was natural that X.	Xが当然だった
It was not clear what she really meant.	彼女の真意は明らかではなかった。
It was not clear what she said.	彼女が何と言ったのかははっきりしなかった。
It was not easy to put out the fire at once.	火事をすぐに消すことは容易ではなかった。
It was not long before the game began.	まもなく試合が始まった。
It was not so simple to write a letter in English.	英語で手紙を書くことはそう簡単なことではなかった。
It was not until I called that he came.	私が呼んではじめて彼は来た。
It was not until I got home that I missed my watch.	家に帰って初めて時計をなくしたのに気付いた。
It was not until I got home that I missed my watch.	家へ帰って初めて時計をなくしたのに気づいた。
It was not until I read the book that I knew about it.	その本を読んで初めてそのことを知った。
It was not until he was forty that he began to study German.	四十歳になって初めて彼はドイツ語を学び始めた。
It was not until last night that I got the news.	昨夜になってやっと知らせが届いた。
It was not until last night that I got the news.	昨夜になってやっと知らせが来た。
It was not until last night that I got the news.	昨夜になってやっと知らせを受けた。
It was not until last night that I heard the news.	昨夜初めてその知らせを聞いた。
It was not until the next day that they found her.	翌日になって初めて、彼らは彼女を見つけた。
It was not until the sun had set that the child came home.	太陽が沈んでからやっと子供も家に帰った。
It was not until this year that these documents were made available to the public.	今年になってやっとこれらの記録がみんなに利用できるようになった。
It was now a race against time.	今や時代との競争になった。
It was really cheap.	とても安かったのよ。
It was such a fine day that many children were playing in the park.	非常に天気がよい日だったので多くの子供が公園で遊んでいた。
It was such a fine day that we had a very good time.	非常に天気のよい日だったので、私たちはとても楽しかった。
It was ten years ago that he first came to Japan.	彼が初めて日本にやってきたのは１０年前だった。
It was that sound that brought her eyes open.	彼女の目を開かせたのはその音だった。
It was the best play that I had ever seen.	それはかつて見た最高の芝居でした。
It was three days ago.	それは３日前のことだった。
It was time to leave.	出かける時間になった。
It was too bad you couldn't come.	君がこられなくて残念でした。
It was twenty years ago as I look back on it.	回顧すればもう２０年の昔となった。
It was when I was thirteen that I fell in love with a girl for the first time.	私がはじめて女の子に恋をしたのは１３歳の時でした。
It wasn't clear what she meant.	彼女が何を言おうとしていたのかははっきりしなかった。
It wasn't until then that we knew her address.	その時になってはじめて、彼女の住所を知った。
It will also cause a change in your living environment.	それがまた、お客様の生活に生活環境の変化をもたらします
It will be little more than a hundred years before we use all the oil up.	我々が石油を使い果たすまでには百年かからないであろう。
It will be reduced from the current 12 years to 7 years.	現行の１２年を７年に短縮する
It will clear up by and by.	まもなく晴れるでしょう。
It will clear up soon.	まもなく天気になるでしょう。
It will not be long before spring comes.	まもなく春になるだろう。
It will not be long before the boy learns what life is.	まもなくその少年は人生とは何かがわかるだろう。
It will not be long before the new term begins.	まもなく新学期が始まります。
It will soon be New Year.	もうすぐお正月です。
It will soon be possible for us to go direct to New York by air.	まもなく飛行機で直接ニューヨークへ行くことができるようになるだろう。
It will soon come out all right.	そのうち何とかなるさ。
It will take a while to go away.	治るのにしばらくかかります。
It won't be long before we can live together.	私たちは間もなく一緒に暮らせるでしょう。
It won't be long before we can travel to Mars.	火星へ旅行できる日も遠くはあるまい。
It would be better for you to stay away from such a man.	ああいう男には近づかないほうが君のためによいだろう。
It would be better for you to stay in bed today.	君は今日寝ていたほうがよさそうだ。
It would have been better if you had stayed in America.	アメリカにいたほうがよかったのに。
It'll add to the same thing.	結局は同じ事になるだろう。
It'll pass in a few days.	２、３日もすればよくなるよ。
It's a good job, as far as the pay goes.	給料に関するかぎり、それはよい仕事である。
It's a good thing to read good books when you are young.	若いときにすばらしい本を読むのはよいことだ。
It's a long way to the station.	駅までは距離があります。
It's a long, long time since my girl's been gone.	それはかなり長い、あの娘が行ってしまってから。
It's a lot of fun to be with you.	あなたと一緒にいるととても楽しいわ。
It's about time you sent the children to bed.	そろそろ子供たちを寝かせてもよい時間だ。
It's about time you set about cleaning the table.	そろそろテーブルを片づけて始めてよい時間だよ。
It's all the same to me whether you go or stay.	あなたが行こうがとどまろうと私にとってはまったく変わりがない。
It's already September; however, it is very hot.	もう９月だ。しかしながら、たいへん嬉しい。
It's already cleared up.	もう晴れたよ。
It's already eleven. It's high time you were in bed.	１１時になってるよ、もう寝る時間です。
It's already eleven. It's high time you were in bed.	１１時になってるよ。おまえはもうねる時間でしょ。
It's already past 4:30.	既に時間が４時半を回った
It's already seven.	もう7時よ。
It's already time to go home.	もう帰らなければならない時間だ。
It's always cheaper in the end to buy the best.	一番よいものを買うのが結局は安くつく。
It's an answer to her letter.	それは彼女の手紙の返事だ。
It's been a long while since we had such fine weather.	しばらくぶりのよい天気だね。
It's been left in the room.	それが部屋に放置されてます
It's been ten years since I came to this town.	この街に来てから１０年になる。
It's below her to say such a thing.	そんなことを言うのは彼女にふさわしくない。
It's bigger than any other dog in this town.	この町では、どの犬よりも大きいです。
It's centered in the Kyoto district.	京都地区を中心にします
It's easy to make and it's cheap.	それはつくりやすいししかも安い。
It's easy to make and it's cheap.	それは作りやすいし、しかも安い。
It's fine day and I feel like going fishing.	天気なので釣りに行きたいような気がする。
It's fine today.	今日は天気が良い。
It's fun to play, too.	するのも楽しいよ。
It's fun to travel.	旅行は楽しい。
It's fun to watch TV.	テレビを見るのは楽しい。
It's fun to watch the race.	あの競争を見るのは楽しい。
It's going to clear up soon.	間もなく、晴れてきそうだ。
It's going to clear up.	晴れてきそうだ。
It's good to talk things over before you buy something.	君が何かを買う前に話しあっておくのはいいことだ。
It's great fun for us to be with her.	私達にとって彼女といっしょにいることはたいへん楽しい。
It's hard to bring it into focus.	それにはピントがなかなか合わない
It's high time you left for school, isn't it?	もうとっくに学校へ出かけている時間じゃないの。
It's high time you were in bed.	もう寝なくてはいけない時間でしょ。
It's in the cards for her to buy a car soon.	彼女はもうすぐ車を買いそうだ。
It's in the heart of the city.	それが市の中心部に位置する
It's just a little further.	もうちょっと先までいってください。
It's just down the street on your left.	この道をまっすぐ行ったところの左側がありますよ。
It's just time for children to go to bed.	子供はもう寝る時間だ。
It's just too good to pass up.	これは絶対見逃せないよ。
It's kind of you to drive me home.	私を家まで車で送ってくれるなんてあなたは親切ですね。
It's kind of you to say so.	ご親切にそう言ってくださってありがとう。
It's my favorite food.	それは、わたしの好物です。
It's my favorite song.	それが私のお気に入りの歌だ。
It's natural for you to think so.	あなたがそう考えるのは当然だ。
It's natural that Yoko should say a thing like that.	洋子がそういうのももっともだ。
It's near the center of the park.	それが公園の近くに位置する
It's not as though the world is going to end if she leaves.	彼女がいなくなったら世界が終わる訳じゃあるまいし。
It's not good for my heart.	心臓に悪いな。
It's not so far.	そんなに遠くありません。
It's not that he's claiming X.	Xを彼が主張しているわけではない
It's not until you have met him that you really understand a man.	会ってはじめて本当に人柄がわかるものだ。
It's only natural to keep up with the Joneses.	隣近所に対して見栄を張るのは人情ですよ。
It's said that they will soon be leaving Tokyo.	彼らはまもなく東京を去るということだ。
It's so kind of you to come to see me off.	お見送り本当にありがとうございます。
It's still hasn't gone much past 20%.	それはまだ２０数％に過ぎない
It's still very popular.	それが根強い人気を誇る
It's such a long time since he left school.	彼が学校を出てからずいぶん久しい。
It's the best book that I've ever read.	それは私が今まで読んだ中で最高の本だ。
It's the best score up to now.	それが今迄のところ一番いいスコアだ。
It's the best season of the year.	一年中で一番いい季節ですね。
It's the hottest season of the year now.	今は一年で一番暑い季節です。
It's the only thing I can think of.	考えられるのはそれだけだ。
It's the sort of day when you'd like to stay in bed.	寝床にずっといたいような日だ。
It's time for children to go to bed.	子供はもう寝る時間ですよ。
It's time for our children to go to bed.	子どもたちはもう寝る時間だ。
It's time for us to go to bed.	私たちが寝る時間だ。
It's time to go to bed.	もう寝なければなりません。
It's time to go to bed.	もう寝る時刻ですよ。
It's time to go to bed. Turn off the radio.	もう寝る時間です。ラジオを消しなさい。
It's time to hit the books.	さあ、そろそろ本気で勉強を始めなくちゃ。
It's time to leave off work.	仕事を辞めるべき時間だ。
It's time to leave.	私たちの出発の時間が差し迫っている。
It's time to leave.	私達の出発時間がさしせまっている。
It's too bad she can't come to the party.	彼女がパーティーに来られないのは残念だ。
It's too bad that X.	Xが悔しい
It's too early to go to bed.	寝るには早すぎる。
It's true that he is in America.	彼がアメリカにいることは本当である。
It's true.	これ本当さ！
It's up to you to make the decision.	結論を下すのは君の義務です。
It's very kind of you to help me.	お手伝いいただきありがとうございます。
It's very kind of you to put it that way.	そう言ってくださるとはご親切さま。
It's very kind of you to say so.	そうおっしゃって下さってありがとう。
It's very kind of you to say so.	そう言ってくださってありがとう。
It's very kind of you to say so.	そう言って下さるとは大変ご親切様です。
It's when you become able to move that the real value of health hits home.	動けるようになると健康の有難さを実感しますよね。
It's your deal.	あなたが配る番です。
It's your decision whether you go or stay.	行くかとどまるかは君の決断することだ。
JST stands for Japan Standard Time.	ＪＳＴは日本標準時を表わす。
Jack has no object in life.	ジャックは人生に何の目的も持たない。
Jack is now either in London or Paris.	ジャックは今ロンドンかパリのどちらかにいる。
Jack once gave a helping hand to Robert, who was in trouble; and now Robert, in turn, is of great help to Jack.	ジャックは以前ロバートが困っている時に力になってやった、そして今はかわってロバートがジャックを大いに助けてやっている。
Jack will not answer my letters.	ジャックはどうしても私の手紙に返事を書こうとしない。
Jane came to our town three years ago.	ジェーンが私たちの町に来て3年になる。
Jane didn't die a natural death.	ジェーンの死は尋常ではない。
Jane experienced many things in a year. So did I.	ジェーンは１年間に多くのことを経験しました、私もそうです。
Jane is not such a bad sort.	ジェーンはそんな悪い人ではない。
Jane was about to leave the house.	ジェーンはまさに家を出ようとしていた。
Jane was billed to appear as Ophelia.	ジェーンはオフィーリアを演じると発表された。
Jane was on top of the world when she got a record contract.	ジェーンはレコード歌手契約を結んだ時は有頂天になってた。
Japan is not what it was 15 years ago.	日本は十五年前とはすっかり変わってしまった。
Japan is not what it was ten years ago.	日本は１０年前とはすっかり変わった。
Japan is now very different from what it was twenty years ago.	日本は今や、２０年前の日本とは大変違っている。
Japan is now very different from what it was twenty years ago.	日本は２０年前とはすっかり変わってしまった。
Japan is one of the greatest economic powers in the world.	日本は世界有数の経済大国である。
Japan is very different from what it was fifty years ago.	日本は５０年前の姿とはすっかり違ってしまった。
Japan should be kind to other countries.	日本は他の国にたいして親切であるべきだ。
Japan today is not what it was even ten years ago.	今日の日本は１０年前の日本でさえない。
Japan was hard up for oil.	日本は石油が不足して困っていた。
Japanese history is my favorite subject.	日本史は私の好きな教科です。
Jennifer has a good eye for beauty.	ジェニファーには審美眼がある。
Jill is the only girl in our club.	ジルはわれわれのクラブでただ１人の女性です。
Jim has asked Anne out several times.	ジムはアンを何回か招待した。
Jim is not yet used to driving on the left side of the road.	ジムはまだ路上での左側運転に慣れていない。
Jim looked right and left before he crossed the road.	ジムは横断する前に左右を見た。
Jim stayed at my house.	ジムが私の家に滞在した。
Jim stayed with us while he was in Japan as an exchange student.	ジムは交換留学生として日本にいたとき、私たちの家に滞在した。
Jim studies far into the night.	ジムは夜遅くまで勉強する。
Jim wrote the letter for Betty.	ジムは、ベティーにかわって手紙を書いた。
John asked Mary whether she would like to go shopping.	ジョンはメアリーに買い物に行きたいかどうか尋ねた。
John broke the window.	ジョンが窓を壊しました。
John had cleaned the house when I came home.	私が、帰宅したとき、ジョンは家の掃除を終わったところだった。
John has already come to the station.	ジョンはすでに駅に来ている。
John hit me on the head.	ジョンは私の頭を殴った。
John is an American boy.	ジョンはアメリカの少年です。
John is interested in golf.	ジョンはゴルフに興味がある。
John is not the man he was three years ago.	ジョンは３年前の彼とは違うんだ。
John is not the man that he was three years ago.	ジョンは三年前の彼とは違う。
John is sure to win the game.	ジョンはきっとその試合に勝つだろう。
John sent me a letter written in German.	ジョンはドイツ語の手紙をくれました。
John stayed at home as he was told.	ジョンは言われた通りに家に居た。
John was not at home, as is often the case with him.	よくあることだがジョンは家にはいなかった。
John wins every time we play the game.	ゲームをやるたびにジョンが勝つ。
Johnny got leave to go home.	ジョニーは帰宅の許しを得た。
Judy sent her children to bed.	ジュディーは子供たちを寝室へ行かせた。
July 4th is a red-letter day in America.	７月４日はアメリカでは記念すべき日だ。
June is a social season in London.	六月はロンドンでは社交の季節だ。
Just follow your heart.	君の思うようにしなさい。
Just follow your heart.	自分の思うとおりにしなさい。
Just one year has gone by since my friend died.	友人が亡くなってから丁度１年が経過した。
Just stand there, please.	ちょっとそこに立ってもらえますか。
Kate keeps a dog.	ケイトは犬を飼っている。
Kate left this place for good.	ケイトは、これを最後に永久にここを離れていった。
Kate made her family leave home.	ケイトは家族に家を立ち去らせた。
Kathleen's statements turned out to be true.	キャサリンの言ったことは本当だった。
Keep a close eye on him.	彼をよく見張れよ。
Keep a good heart and go on writing.	勇気を失わないでどんどん書きつづけなさい。
Keep an eye on the baby for a while.	しばらくの間、ベビーをみていてね。
Keep an eye on the baby for a while.	しばらく赤ちゃんを見ていてね。
Keep an eye on the baby while I am away.	僕がいない間、この赤ちゃんをお願いするよ。
Keep an eye on the girls.	女の子たちから目を離さないように。
Keep away from bad company.	悪友に近づいていけない。
Keep away from bad company.	悪友仲間とつきあうな。
Keep away from me.	俺に近づくな。
Keep away from that.	それに近づくな！
Keep away from the dog.	あの犬には近づくな。
Keep away from the dog.	犬に近寄るな。
Keep away from the fire.	火に近づくな。
Keep in mind that you're not so young as you used to be.	あなたは昔のように若くはないということを良く覚えておきなさい。
Keep it in mind.	そのことを頭に入れておきなさい。
