She came to Japan for the purpose of studying Japanese.	彼女は日本語を勉強しようと日本に来た。
She came to the station to see me off.	彼女は私を見送るために駅まで来てくれました。
She can not have said such a thing.	彼女がそのようなことを言ったはずがない。
She can write a letter in English.	彼女は英語で手紙を書くことができます。
She can't have done such a thing.	彼女がそのようなことをしたはずはない。
She can't have said a thing like that to you.	彼女が君にそんなことを言ったはずが無い。
She can't have said such a thing.	彼女がそんな事を言ったはずがない。
She can't make up her mind whether to get a job or to go on to college.	彼女は就職か大学進学か決心がつかない。
She can't tell the good from the bad.	彼女には事の善し悪しがわからない。
She claimed to be the owner of the land.	彼女はその土地の所有者だと主張した。
She cleaned the room.	彼女は部屋を掃除してくれた。
She closed all the windows in the room.	彼女は部屋の窓をすべて閉めた。
She could not state her own opinion.	彼女は自分の意見を述べることができなかった。
She could pass for twenty.	彼女は２０歳といっても通用する。
She cut a picture out of the book.	彼女は本から一枚の絵を切り抜いた。
She cut in when we were talking.	私たちがおしゃべりしていると彼女が話にわり込んできた。
She did a great deal of work.	彼女はたくさん仕事をした。
She did come, but didn't stay long.	彼女は来ることは来たが、長くはいなかった。
She did it on purpose.	彼女はそれを故意に行った。
She did not come down until 8:00.	彼女は８時までおりて来ませんでした。
She did not come even as far as my house.	彼女は私の家にさえ来なかった。
She did not come until two.	彼女は２時まで来なかった。
She did what she believed was right.	彼女は正しいことをした。
She didn't go far.	彼女は遠くまで行かなかった。
She didn't show up until the meeting was over.	彼女はその会合が終わるまで現れなかった。
She died before coming of age.	彼女は成人前に死んだ。
She died in 1960.	彼女は１９６０年に死んだ。
She does not do things like that.	彼女はそんなことはしない。
She doesn't answer any kind of letter.	彼女はどんな手紙にも返事を出さない。
She doesn't have many friends in this town.	彼女はこの町にはあまり友達がいない。
She doesn't know how to play golf.	彼女はゴルフのやり方を知りません。
She doesn't understand me, either.	彼女も私の言っていることを理解していない。
She entered her terrier in a dog show.	彼女は自分のテリア犬を犬品評会に出した。
She feels bad today.	彼女は今日は気分が悪い。
She felt very bad that day.	彼女はその日とても気分が悪かった。
She gave me a large room while I stayed at her house.	彼女の家に滞在中は、大きな部屋を貸してくれた。
She gave me several books.	私は彼女から数冊の本をもらった。
She gave me the fish eye.	彼女は冷たくじろりとこちらをにらんだ。
She gave no answer to my letter.	彼女は私の手紙に全然返事をよこさなかった。
She gave up everything for her children.	彼女は子供のために全てを犠牲にした。
She goes to a girls' high school.	彼女は女子高校に通っている。
She goes to aerobics once a week.	彼女は週に１回エアロビクスをやっている。
She goes to the movies once a week.	彼女は毎週１回映画を見に行く。
She got off at the next station.	彼女は次の駅で降りた。
She got to the point of not thinking she would want to live in this town again.	彼女はもう二度と町にはすみたいとおもわなくなりました。
She got to the station at seven.	彼女は七時に駅に着いた。
She had already gone to bed when I phoned her at 11:00 p.m.	私が午後十一時に電話したとき、彼女はすでに床についていた。
She had gone to bed.	彼女は寝てしまった。
She had her first love in her memory until she died.	彼女は死ぬまで初恋の事を忘れずにいた。
She had lived in Hiroshima until she was ten.	彼女は１０歳の時まで広島に住んでいた。
She had no sooner seen me than she ran away.	彼女は私を見るとすぐに走り去った。
She had to part with her family when the war began.	戦争が始まったとき、彼女は家族と別れなければならなかった。
She had, I thought, no reason to do what she did.	彼女にはそうする理由がなかったと私は思った。
She has a big problem, though.	でも彼女、大問題を抱えているのです。
She has a clean heart.	彼女は汚れの無い心の持ち主です。
She has a feel for beauty.	彼女は美的感覚がある。
She has a great wish to travel around the world.	彼女は世界一周をしたいという強い願望を持っている。
She has a kind heart.	彼女は優しい心の持ち主です。
She has a kind heart.	彼女は心の温かい人です。
She has a small black dog.	彼女は小さな黒い犬を飼っている。
She has a way of keeping old letters.	彼女には古い手紙をとっておく癖があります。
She has already left the office.	彼女はもう会社を出た。
She has already lived in that town for five years.	彼女はあの町に住んでもう５年になる。
She has as fine a figure as I have ever seen.	彼女は今まで見たこともない見事なスタイルをしている。
She has been to England once.	彼女は１度英国へ行ったことがある。
She has been to Hawaii several times.	彼女はハワイに何度も行ったことがある。
She has blue eyes.	彼女は青い目をしている。
She has had to stay here.	ここにずっといなければならなかった。
She has her heart in music.	彼女は音楽に集中している。
She has her own way in everything.	彼女はなんでも自分の思い通りにする。
She has large blue eyes.	彼女は大きな青い目をしている。
She has little knowledge of science.	彼女は少ししか科学の知識がない。
She has made up her mind to go to America to study.	彼女はアメリカへ留学することを決心した。
She has made up her mind to go to the States to study.	彼女はアメリカ留学を決意した。
She has no thought of self.	彼女は利己心がない。
She has taken a great hold on the public mind.	彼女は大衆の心をしっかりつかんでいますね。
She has too much chat about her.	彼女は自慢が過ぎる。
She has visited New York once.	彼女は一度ニューヨークへ行ったことがある。
She hasn't cleaned her room yet.	彼女はまだ部屋を掃除していません。
She held out her hand.	彼女は手を差し出した。
She held up her head.	彼女は頭を上げた。
She helped an old man cross the road.	彼女は老人に道路を渡らせてあげた。
She is a beauty.	彼女は美しい。
She is a clear-headed.	彼女は頭のさえた人だ。
She is a good deal older than he.	彼女は彼よりずっと年上である。
She is a kind girl.	彼女は親切な女の子です。
She is a natural to play the part of Juliet.	彼女はジュリエットの役を演じるのに適任だ。
She is a real beauty.	彼女は本当に美しい。
She is a real beauty.	彼女は本当に美人だ。
She is a very kind girl.	彼女はとても親切な少女です。
She is about to leave.	彼女は出発しようとしている。
She is already back.	彼女はもう戻っています。
She is an estate agent.	彼女は不動産業者です。
She is as simple as a child.	彼女は子供のように単純だ。
She is away in Kyushu.	彼女は九州に行って留守です。
She is believed to be from China.	彼女は中国の出身だと信じられている。
She is by far the best player in that country.	ずば抜けて優秀な選手。
She is by far the best player in the club.	彼女はクラブの中で抜群に一番上手な選手です。
She is determined to leave the company.	彼女は会社を辞めようと決心している。
She is everything to him.	彼にとって彼女は全てです。
She is getting better by degrees.	彼女はだんだん良くなってきている。
She is getting better by degrees.	彼女は徐々に態度がでかくなった。
She is getting better by degrees.	彼女は次第に回復している。
She is getting well by degrees.	彼女はだんだん体調がよくなっています。
She is going to Sendai this spring.	彼女はこの春仙台へ行く。
She is her old self again.	彼女はまたもとの自分に戻った。
She is kind to old people.	彼女はお年寄りに親切です。
She is kind to old people.	彼女は老人に親切です。
She is kind.	彼女は親切だ。
She is made to be an editor.	彼女は編集の仕事にむいている。
She is missing the point.	彼女のいうことは的外れである。
She is most kind to me.	彼女は私にとても親切だ。
She is no beauty.	あの女が美人なものか。
She is no longer what she was five years ago.	彼女はもう５年前の彼女ではない。
She is not the kind of person you think she is.	彼女は君が思っているような人ではない。
She is not the kind of person you think she is.	彼女は君が考えているような人間ではない。
She is not what she used to be ten years ago.	今の彼女の人柄は１０年前の彼女の人柄ではない。
She is not what she was ten years ago.	彼女は１０年前の彼女でない。
She is now in a low frame of mind.	彼女は今気分が沈んでいる。
She is out now, as is often the case with her.	彼女にはよくあることだが今も不在だ。
She is out of her mind.	彼女は頭が変だ。
She is popular with other girls.	彼女は他の女の子達に人気があります。
She is quick at everything.	彼女は何事もするのが早い。
She is right in her opinions.	彼女の意見は正しい。
She is studying fine art at school.	彼女は学校で美術を学んでいる。
She is used to staying up all night.	彼女は徹夜するのに慣れている。
She is usually at home on Sundays.	彼女はたいてい日曜日は家にいます。
She is very cross with him.	彼女は彼のことをとても怒っている。
She is very kind to us.	彼女は私たちにとても親切です。
She is well able to read.	彼女は十分字が読める。
She is writing a letter now.	彼女は今手紙を書いているところです。
She isn't so green as to say so.	彼女はそんなことを言うほど世間知らずではない。
She keeps a record of everything she buys.	彼女はすべての買い物を記録する。
She kept her eyes closed.	彼女は目を閉じたままであった。
She kept her eyes closed.	彼女は目を閉じたままでいた。
She kept her eyes off.	彼女は目をそらした。
She knew a lot of songs, too.	歌もたくさん知っていました。
She knew better than to believe him.	彼女は彼の言うことを信じるほど馬鹿ではなかった。
She knew the story already.	彼女は既にその話を知っていた。
She knows she's looking fine.	あの娘は自分が素敵に見えるって知っている。
She knows she's looking fine.	彼女は自分が素敵に見えるって知っている。
She knows well how to deal with children.	彼女は子供の扱い方をよく心得ている。
She leaves for New York next Sunday.	彼女は今度の日曜日にニューヨークへ出発します。
She leaves for Tokyo next month.	彼女は来月東京へ出発します。
She left France for America.	彼女はフランスを去り、アメリカに向かった。
She left Japan, never to return home again.	彼女は日本を去って二度と帰国することはなかった。
She left for Paris at the end of last month.	彼女は先月の終わりにパリに出発した。
She left for Paris.	彼女はパリへ出発した。
She left here right away.	彼女はすぐここを立ち去った。
She left home five years ago, and has never been heard of since.	彼女は５年前に家を出たきりで、その後何の消息もありません。
She left home just now.	彼女は今家を出たところです。
She left me a note.	彼女は私に置手紙をした。
She left on Christmas Day.	彼女はクリスマスの日に出発した。
She left school two years ago.	彼女は２年前に学校をやめた。
She left the country to get work in the town.	彼女は都会で仕事を得る為に田舎を出た。
She left the room without saying a word.	彼女は一言も言わずに部屋から出た。
She left the window open.	彼女は窓を開けっ放しにした。
She let go of the boy's hand.	彼女は男の子を放した。
She likes Lake Mashuu.	彼女は摩周湖が好きです。
She likes being looked at by boys.	彼女は男性に見られるのが好きだ。
She lived all her life in that town.	彼女は終生その町に住んだ。
She looked at her watch and noted that it was past five.	彼女は時計を見て５時過ぎだと気がついた。
She looked down on the office girls she had worked with.	彼女はそれまでいっしょに仕事してきた女事務員たちを軽蔑した。
She looked down on the office girls she had worked with.	彼女はそれまで一緒に仕事をしてきた女性事務員達を軽蔑した。
She looked for her ring with her eyes wide open.	彼女は目を皿のようにして指輪を探した。
She looked in at the show window.	彼女はショーウインドウをちょっとのぞいてみた。
She looked me in the eye.	彼女は私の目を見た。
She looked out of the window.	彼女は窓から外を見た。
She looked pleased with her new ring.	彼女は新しい指輪が気に入っているようであった。
She looks as young as ever.	彼女は相変わらず若々しい。
She looks blue for some reason.	彼女はなぜかふさいでいる。
She loves the boy as if he were her own child.	彼女はその少年をまるで実の子のようにかわいがっている。
She made a face when she saw a dog.	彼女は犬を見ると顔を顰めた。
She made a man of a boy.	彼女は少年を立派な人間にした。
She made a tour of America, stopping in six cities.	彼女は６つの都市に滞留してアメリカを観光旅行した。
She made believe not to hear him.	彼女は彼のいう事が聞こえないふりをした。
She made believe not to hear him.	彼女は彼の声が聞こえないふりをした。
She made believe that she had not heard him.	彼女は彼に聞こえなかったふりをした。
She made believe that she had not heard him.	彼女は彼の言った事が聞こえないような振りをした。
She made believe that she had not heard me.	彼女は私の声を聞かないふりをした。
She made for the car right away.	彼女は直ちに車の方へ向かった。
She made it clear that she didn't like him.	彼女は彼が嫌いだということをはっきりさせた。
She made no response to my question.	私の質問に彼女は答えなかった。
She made the children clean up their own rooms.	彼女は子供たちに自分自身の部屋をきれいに掃除させた。
She made up her mind to go to America.	彼女はアメリカに行こうと決心した。
She made up her mind to stay with us for a while.	彼女はしばらくの間私たちのところに滞在することを決めた。
She made up her mind to stay with us for a while.	彼女はしばらくの間私達のところに滞在することに決めた。
She made up her mind to stay with us for a while.	彼女はしばらく私たちのところに滞在することに決めた。
She made up her mind to try again.	彼女は再び試みる事を心決めた。
She makes a point of going to church on Sundays.	彼女は日曜日には必ず教会に行きます。
She managed to drive a car.	彼女はどうにか車の運転ができるようになった。
She managed to learn to drive a car.	何とか彼女は車を運転できるようになった。
She managed to read a book written in French.	彼女はフランス語で書かれた本をどうにか読んだ。
She may be able to answer the question.	彼女はその質問に答えることができるかもしれない。
She may have left her car key in her room.	彼女は車の鍵を部屋に置き忘れたのかもしれない。
She may well be said to think of everything in terms of money.	彼女は何でも金銭の見地で考えると言われるのももっともだ。
She met him three years ago.	彼女は彼に３年前に会った。
She must have been a beauty when she was young.	彼女は若いときさぞかし美人だったに違いない。
She must have everything her own way.	彼女は何でも自分の思い通りにしないと気がすまない。
She must have once been a real beauty.	彼女はかつて本当に美しかったに違いない。
She opened the window, though I told her not to.	彼女に開けるなと言ったのに、彼女は窓を開けた。
She opens the window.	彼女は窓を開けます。
She passed away two days ago.	彼女は２日前に亡くなった。
She passed by without seeing me.	彼女は私に気がつかずに通り過ぎた。
She passed right by me without noticing.	彼女は気づかずに私の前を通りすぎた。
She pressed the child to her heart.	彼女はその子を胸に抱きしめた。
She put away a good deal of money.	彼女はたくさんのお金を貯えた。
She put her head out of the window.	彼女は窓から顔を出した。
She put on high airs with her learning, and she was not popular.	彼女は学識を鼻にかけていたので人気がなかった。
She put the children to bed.	彼女は子供を寝かしつけた。
She puts her own interests above everything else.	彼女は利己一点張りの女だ。
She ran her eyes over the letter from him.	彼女は彼からの手紙にざっと目を通した。
She read the book once when she was sixteen.	彼女は１６の時に、その本を１度読んだ。
She read the letter over and over again.	彼女はその手紙を何度も何度も読み返した。
She reads on average three or four books a week.	彼女は１週間に平均３、４冊の本を読む。
She remained single all her life.	彼女は一生独身のままだった。
She remained single all her life.	彼女は生涯独身であった。
She runs a beauty shop.	彼女は美容院を経営している。
She said he would be back right away.	彼女は彼はすぐに戻ってくるよと言った。
She said she must leave at once.	彼女はすぐに行かなければと言った。
She said she was twenty years old, which was not true.	彼女は二十歳だと言ったが、それは嘘だった。
She said she was twenty years old, which was not true.	彼女は２０才だと言ったが、それは嘘だった。
She said she would be back right away.	すぐ帰ってくると彼女は言ってました。
She said she would be back right away.	彼女はすぐに戻って来ると言った。
She said she would be back right away.	彼女はすぐに戻りますと言った。
She said that I should come home soon.	彼女は私に早く帰ったほうが良いと言った。
She said that it might be true.	それは本当かも知れないと彼女は言った。
She said to her husband: "Stop!".	彼女は夫に『やめて！』と言いました。
She says she is seeing things.	幻覚が見えると言っている。
She sent me a letter.	彼女は私に手紙をくれた。
She sent me a long letter.	彼女は僕に長い手紙を送ってよこした。
She sent you her best wishes.	彼女からよろしくとのことです。
She served the family for twenty years.	彼女はその家で２０年間働いた。
She should be there now because she left early.	彼女は早く出たから今ごろはそこに着いているはずだ。
She should not have done such a thing.	彼女はそんな事をしなければよかったのに。
She showed her album to me.	彼女は私に自分のアルバムを見せてくれた。
She showed me a letter written in English.	彼女は私に英語で書かれた手紙を見せた。
She showed me her album.	彼女は私にアルバムを見せてくれた。
She soon came to believe him.	彼女はまもなく彼を信じるようになった。
She started talking as soon as she got through.	彼女は電話が通じるとすぐ話し始めた。
She stayed at a hotel.	彼女はホテルに泊まった。
She stayed at home as she didn't have a car.	彼女は車がなかったので、家にいました。
She stayed at the hotel for several days.	彼女は数日間そのホテルに滞在した。
She stayed in the house all day.	彼女は１日じゅう家にいました。
She stayed there for a short while.	彼女は少しの間そこに滞在した。
She stayed there for several days.	彼女はそこに数日滞在した。
She stood by him.	彼女は彼のそばに立っていた。
She stood on her head.	彼女は逆立ちをした。
She stood up to answer the phone.	彼女は電話に出るために立ち上がった。
She stopped looking at the show window.	彼女はショーウインドーを見るのをやめた。
She stopped talking.	彼女は話をやめた。
She studies as hard as ever.	彼女はあいかわらず勉強する。
She studies as hard as ever.	彼女は相変わらずよく勉強する。
She takes a bad picture.	彼女は写真うつりが悪いね。
She takes everything for granted.	彼女はあらゆることを当然だと思っている。
She talked about the people and things that interested her.	彼女は関心のある人々や物事について話をした。
She talks as if she knew everything about it.	彼女はまるでそのことについて何でも知っているかのように話をする。
She talks as if she knew everything under the sun.	彼女はまるでこの世の中のことをなんでも知っているような口をきく。
She talks as if she knew everything.	彼女はまるで何もかも知っているような話しぶりだ。
She thinks much of others' opinions.	彼女は他人の意見を尊重する。
She thinks of everything in terms of money.	彼女は何でもお金に換算して考える。
She told him once and for all that she would not go to the movie with him.	一緒には映画に行かない、と彼女は彼にきっぱり言った。
She told him once and for all that she would not go to the movies with him.	彼女は彼とは映画に行かない、ときっぱり言った。
She told him to keep away from bad friends.	彼女は彼に悪友にちかづかないようと言った。
She told him to keep away from bad friends.	彼女は彼に悪友に近づかないようにと言った。
She told him to keep away from bad friends.	彼女は彼に悪友に近づかないように言った。
She told me once and for all that she did not want to see me again.	彼女はもう二度と私の顔を見たくないときっぱり言った。
She told me to open the window.	彼女は私に窓を開けるよう言った。
She took care of my dog.	彼女は私の犬の世話をした。
She took two weeks' leave and visited China.	彼女は２週間の休暇をとって中国に出かけた。
She traveled from Boston to San Francisco via Chicago.	彼女はボストンからシカゴ経由でサンフランシスコへ旅行した。
She tried to keep away from him.	彼女は彼に近づかないようにしようとした。
She turned her eyes away.	彼女は視線をそらした。
She usually goes to bed at nine.	彼女は普通９時に寝る。
She visited Kanazawa two years ago.	彼女は２年前に金沢を訪れた。
She was a beauty in her day.	彼女は若い頃は美人だった。
She was a girl of about our age.	彼女は私たちと同じくらいの年齢の女の子だった。
She was a little girl then.	その時彼女は小さな子供だった。
She was a track star once.	彼女はかつてトラック競技のスターだった。
She was a young girl about your age.	大体君と同じ年頃の若い娘。
She was about to leave the house.	彼女はまさに家をでようとしていた。
She was always able to answer all the questions.	いつもあらゆる問題に答える事ができたわ。
She was approaching thirty when I first met her.	私が初めて彼女に会ったとき彼女は３０に間近であった。
She was approaching thirty when I first met her.	私が彼女に初めて会った時、彼女は３０に間近だった。
She was at a loss as to what to do.	彼女は何をすべきかということについて途方に暮れた。
She was at a loss for an answer.	彼女は返事に困った。
She was at a loss for what to do.	彼女はああでもないこうでもないと悩んだ。
She was at a loss for what to do.	彼女はどうして良いか途方に暮れた。
She was at a loss for what to do.	彼女は何をしてよいのか途方に暮れた。
She was at a loss for words.	彼女はなんと言ってよいか分からなかった。
She was at a loss what to do next.	彼女はどうしたら良いのか途方に暮れた。
