The leaves fell.	葉が落ちた。
The leaves have all fallen.	木の葉はみんな落ちてしまった。
The leaves have begun to color.	葉が色付き始めた。
The leaves have begun to turn.	葉の色が変わり始めた。
The leaves turn red in the fall.	その葉は秋に赤くなる。
The leaves turned red as the days passed.	木の葉は日が経つにつれて紅葉した。
The leaves will turn red in two or three weeks.	２、３週間もすれば木の葉は紅葉するでしょう。
The letter does not say what time she will come up to Tokyo.	その手紙には、いつ彼女が上京するのか書いていない。
The letter is dated April 1, 1987.	その手紙の日付は１９８７年４月１日となっている。
The letter is for me.	その手紙は私当てに来た。
The letter runs as follows.	手紙の文面は次の通り。
The letter showed what he really felt.	この手紙から、彼が本当に思っていることが解った。
The letter was in the mail.	その手紙は郵便物の中にありました。
The letter was written by Bill.	その手紙はビルが書きました。
The letter was written by her.	手紙は彼女によって書かれた。
The letter was written using business terms.	その手紙は商業用語で書かれた。
The letter was written.	手紙は書かれた。
The library is now under construction.	その図書館は現在建設中である。
The light changed from red to green.	赤信号が青に変った。
The lines are crossed.	混線しています。
The lines are crossed.	電話が混線している。
The lives of most people are determined by their environment.	たいていの人の一生は環境で決まる。
The long and the short of it is that I was fired.	要するに私は首になったのだ。
The longer I stay there, the more I like the place.	そこに居れば居るほどその土地が好きになる。
The longer I stayed in Paris, the more I liked it.	私はパリにいればいるほど、それだけパリが好きになった。
The loss amounted to $2,000,000.	損失は２００万円にのぼった。
The loss must be made up for next month.	来月は、損失を取り返さねばならない。
The lower a golf score is, the better.	ゴルフではスコアが少ないほど良い。
The machine has been out of order since last month.	その機械は先月から故障している。
The machine has some of its parts missing.	その機械は部品が足りない。
The machine is out of order.	その機械は故障している。
The machine is used in this way.	その機械はこのように使われている。
The machine takes a lot of room.	その機械は場所をとる。
The magazine comes out once a week.	その雑誌は週に一回発行される。
The man got away from the city.	その男は町から逃げ出した。
The man hit me on the head.	その男は私の頭を殴った。
The man ran away.	その男は逃げていった。
The man standing over there is Mr Smith.	あそこに立っている人はスミスさんです。
The man standing over there is the owner of the store.	あそこに立っている人が店の主人です。
The man stood up.	その男は立ち上がった。
The man took the boy by the hand.	その男は少年の手をつかまえた。
The manager deals with many problems.	マネージャーはたくさんの問題を扱っています。
The manager said, "Let's begin with this job."	この仕事から始めよう、と支配人がいった。
The manager will make sure of the content.	管理者が内容を確認する
The market is held every Monday.	市は月曜ごとに立つ。
The medical congress was held in Kyoto.	その医学会議は京都で開催された。
The meeting begins at three.	会合は３時から始まります。
The meeting can't be held until Monday at earliest.	その会は早くても月曜日まで開けない。
The meeting has been put off until next week.	会議は来週までのびた。
The meeting is held once in three years.	その会は３年に１回開かれます。
The meeting is scheduled for 10 a.m.	会議は午前１０時に予定されている。
The meeting is ten days away.	会議は１０日後。
The meeting is to be held at three.	その会は３時から行われることになっています。
The meeting is to be held next Thursday.	会合は来週木曜に開かれるはずです。
The meeting is to be held next week.	会議は来週開かれることになっています。
The meeting lasted until 5.	会議は五時まで続いた。
The meeting was called off as there was no hope of agreement on either side.	その会議はどちらの側にも同意の見込みがなかったので中止された。
The meeting was held here.	会議はここで開かれた。
The meeting was held last month.	会合は先月行われた。
The meeting was put off until next Friday.	会合は次の金曜日まで延期された。
The meeting was put off until next week.	打ち合わせは来週に延期になった。
The meeting will be held at 10:30 a.m. on Saturday.	その会は土曜日の午前１０時半に開かれます。
The meeting will be held next month.	会議は来月行われるでしょう。
The meeting will be held next week at the earliest.	その会合は早くても来週になるでしょう。
The men were at a loss.	男達は困りました。
The money is due to him.	そのお金は当然彼に支払われるべきだ。
The most important thing in the Olympic Games is not winning but taking part.	オリンピック競技において最も大切なことは勝つことではなく参加することであ。
The movie is not so interesting as the original.	その映画は原作ほどおもしろくない。
The movie is popular with young people.	映画が若者の間で流行している。
The name of the character is Hamlet.	登場人物の名前はハムレットです。
The name stands out.	名前が目に付きます
The new building cut the view from my window.	新しいビルが私の窓からの眺めをさえぎった。
The new library has been under construction since last year.	その新しい図書館は昨年から建設中です。
The new machine brought in a lot of money.	新しい機械は多くの収入をもたらした。
The new machine will be in use.	その新しい機械が用いられるようになるだろう。
The new machine will take a lot of room.	その新しい機械を置いたら、スペースが随分なくなるだろう。
The new model car was put through several tests.	その新型車は何度か厳しいテストを受けた。
The new movie was a big hit.	その新しい映画は大当たりだった。
The new picture has made a record breaking hit.	今度の映画は記録破りの大当たりだった。
The new school year begins in April in Japan.	新学年は日本では４月に始まる。
The new station building is under construction and will be completed soon.	新しい駅ビルが建築中で、まもなく完成する。
The new term starts in April in Japan.	日本では新学期は４月から始まる。
The new term starts in April.	四月から新学期が始まる。
The news broke her heart.	そのニュースは胸が張りさけんばかりだった。
The news can't be true.	その知らせは本当であるはずがない。
The news is too good to be true.	本当とはおもえないほど良い知らせだ。
The news may be true.	そのニュースは本当かもしれない。
The news may well be true.	そのニュースは多分本当だろう。
The news turned out to be true.	そのニュースは本当だとわかった。
The news turned out true in a week.	１週間してそのニュースは本当になった。
The next station is where you get off.	次が君の降りる駅です。
The old church stands north of the town.	古い教会はその町の北にある。
The old man died last week.	その老人は先週なくなりました。
The old man served the king for many years.	その老人はその王に何年も仕えた。
The old man served the king for many years.	その老人はその王に何年も勤めた。
The old man stood on the hill.	その老人は丘の上に立った。
The only thing in the world which one can never receive or give too much is love.	この世で、いくら受けても受けすぎることはなく、いくら与えても与えすぎることのない唯一のものは愛情である。
The opinions of the author are shown below.	筆者の考えを以下に示す
The other day I saw the girl.	先日私はその少女を見ました。
The other team tried to keep them from crossing the line.	相手チームはラインを越えさせまいとしたのです。
The papers say that there was a big fire in Nagoya.	新聞によると名古屋に大火災があったそうです。
The party crossed over to America.	一行はアメリカへ渡った。
The party has been put off until next Tuesday.	そのパーティーは次の火曜日まで延期された。
The party is just beginning.	パーティーはちょうど始まるところです。
The party is to be held next Sunday.	パーティーは次の日曜日に行われる予定です。
The party stayed in Kyoto for a short period.	一行はしばらくの間京都に滞在した。
The party was a lot of fun.	パーティーはとても面白かった。
The party was fun. You should have come, too.	パーティーは楽しかったよ。君も来ればよかったのに。
The party was held on May 22.	パーティーは５月２２日に行われた。
The payment of this bill is due today.	この請求書の支払いは今日になっています。
The people there made way for the fire engine.	そこにいた人たちは消防車のために道を空けた。
The performance of the computer will improve.	コンピュータの性能が向上する
The period of hot weather is very short here.	ここでは暑い天気の続く期間はごく短い。
The person in question is now staying in America.	問題の人物は目下アメリカに滞在中である。
The phone kept ringing.	電話のベルが鳴りつづけた。
The phone was ringing, but there was no one to answer it.	電話が鳴っていたが、それに出る人はいなかった。
The picture is true to life.	この絵は実物にそっくりだ。
The picture is true to life.	その絵は実物そっくりだ。
The picture is true to life.	その絵は本物そっくりだ。
The place is at its best in spring.	その場所は、春が一番よい。
The place where a river starts is its source.	川の始まるところが、水源である。
The place where he lives is far from town.	彼が住んでいる所は町から遠い所に在ります。
The plan will develop our city.	その計画は私たちの市を発展させるだろう。
The plant ranges from the north of Europe to the south.	その植物はヨーロッパの北から南まで分布している。
The plants must have died because no one watered them.	誰も水をやらなかったので、その植物は枯れたに違いない。
The play begins at 2 p.m.	試合開始は午後２時。
The play begins at six this evening.	その芝居は今晩６時に始まります。
The play ended all too soon.	その劇は残念なくらい早く終わった。
The play ended all too soon.	劇は残念なくらい早く終わった。
The play was a lot of fun.	その芝居はとても面白かった。
The play was a lot of fun. I wish you could have been there.	その芝居はとても面白かったよ。君もこれたらよかったのに。
The point is whether he will read the letter.	問題は彼がその手紙を読むかどうかである。
The point is whether she will come or not.	問題は彼女が来るかどうかである。
The point is whether she will read my letter or not.	問題は彼女が私の手紙を読んでくれるかどうかです。
The point is whether she will read the letter or not.	問題は彼女が手紙を読んでくれるかどうかです。
The post office is not far from your college.	郵便局は君の大学から遠くない。
The practice has long been done away with.	その習慣が廃止されて久しい。
The practice should be done away with.	その慣行は廃止すべきだ。
The president is getting into the car.	大統領は車に乗り込むところです。
The president is out now.	社長は外出中です。
The president made a statement on the issue.	大統領はその件について声明を発表した。
The president put off visiting Japan.	大統領は訪日を延期しました。
The president was quoted as saying he would like to visit Japan soon.	大統領は近く日本を訪れたいと述べたと伝えられた。
The president was visiting France that month.	大統領はその月にフランスを訪れることになっています。
The president's term of office is four years.	大統領の任期は四年である。
The price index hit an all-time high.	物価指数はこれまでの最高に達した。
The price is kind of high for a used car.	中古車にしては、値段が幾分高い。
The price is kind of high for a used car.	中古車にしてはこの値段はやや高い。
The price of oil is going up.	石油の値段が上がっている。
The price of this car is discounted fifteen percent.	この車の値段は１５％引きになっています。
The problem came about as time passed.	時が経つにつれて、問題が生じてきた。
The problem is far from easy.	その問題は決して容易ではない。
The problem is whether the plan will work.	問題は計画がうまくいくかどうかだ。
The problem is whether you can follow her English.	問題は君が彼女の英語を理解できるかどうかだ。
The problem was the death of me.	その問題で僕は死ぬほど苦しんだ。
The problem will soon be dealt with.	その問題はまもなく処理されるだろう。
The problem with our plan is not so much the cost as it is the time required.	我々の計画の問題点は費用というよりもそれにかかる時間だ。
The production cost is very high.	非常に生産にコストがかかります
The question is where to stop the car.	どこで車を止めるかが問題だ。
The question is whether Mike knew the fact or not.	疑問なのはマイクがその事実を知っていたかどうかだ。
The question is whether he can do it or not.	問題は彼にそれができるかどうかだ。
The question is whether he will come on time.	問題なのは彼が時間通りに来るかどうかだ。
The question is whether he will come to visit us next month.	問題は来月彼が私たちを訪ねてくるかどうかだ。
The question is who will make the decision.	問題は誰が決定を下すかということだ。
The question whether we should go or stay comes next.	行くべきか、留まるべきかという問題が次にやってくる。
The reason I'm here is because I was asked to come.	ぼくがここにいるのは来いと言われたからだ。
The reason which he gave is hard to understand.	彼が与えた理由は理解しにくい。
The reasons are as follows.	理由は以下のとおりである。
The report is only too true.	その報告は残念ながら事実だ。
The report soon became known all over the country.	そのうわさはすぐ国中に知られ渡った。
The request was granted.	要求は認められた。
The result remains to be seen.	その結果はまだ調べられていないままだ。
The return on the investment will be high.	投資の収益は高いだろう。
The river has become much cleaner than before.	その川は以前よりずっときれいになった。
The river is no longer as clean as it used to be.	川はもはや昔のようにきれいではない。
The river is the widest in Europe.	この川はヨーロッパで一番幅が広い。
The river is very low.	川の水位が非常に低い。
The river is wide.	その川は幅が広い。
The river is wide.	その川は広い。
The river is widest at this point.	川はこの地点で一番幅が広い。
The river runs through the town.	川が町の中を流れている。
The river was not so clean.	その川はあまりきれいではなかった。
The road turns left there.	その道はそこで左に曲がっている。
The room charge is 100 USD a night plus tax.	料金は、税別で一泊１００ドルです。
The room has two windows.	その部屋には窓が２つある。
The room is cleaned by Mrs. Smith.	その部屋はスミス夫人が掃除します。
The room is cleaned by me.	部屋は私によってそうじされる。
The room was full of girls in white.	部屋は白い服を着た女の子でいっぱいでした。
The room wasn't cleaned by Kate.	その部屋はケートが掃除したのではありません。
The same holds good of us students.	同じことがわれわれ学生に当てはまる。
The same is true of Japan.	同じ事は日本にもあてはまる。
The school is farther than the station.	学校は駅よりも遠いよ。
The score is one all.	スコアは１対１だ。
The seasoning is just right.	いい塩梅だ。
The second showing will start soon.	二回目の上映がまもなく始まります。
The second term came to an end.	二学期は終わった。
The service charge will be reduced by 36%.	サービス料金が３６％安くなる
The ship is bearing due north.	船はまっすぐ北に向かっている。
The ship left every Monday.	その船は毎週月曜日に出航していた。
The ship soon came into view.	船が見えてきた。
The ships left the port never to be seen again.	船は港を出港して、二度と姿を見られることはなかった。
The shop is just in front of the station.	その店はちょうど駅の真ん前にあります。
The shop sells articles of all kinds.	その店ではあらゆる種類の品物を売っている。
The sign "&" stands for "and".	＆のマークはａｎｄの文字を表す。
The sign '&' stands for 'and'.	＆という記号は、ａｎｄを指す。
The sign on the board put me in mind of something I had to do.	そのボードに書かれていた表示を見て、僕はやらなければならないことを思い出した。
The small dog tried to get away.	その小さな犬は逃げようとしました。
The smallest child knows such a simple thing.	どんな小さな子供でもそんな簡単なことは知っている。
The social structure is not much different.	社会構造はそれほど変わらない。
The society made him president.	協会は彼を会長にした。
The song was a big hit.	その歌は大ヒットだった。
The sooner, the better.	早ければ早いほどいい。
The sooner, the better.	早ければ早い程よい。
The sound died away.	その音は消えていった。
The speed of light is much greater than that of sound.	光の速度は音の速度よりずっと大きい。
The speeding car missed the child, who ran out into the road, by only a hairsbreadth.	そのスピードを出した車は道路に飛び出した子供を、間一髪で、避けることができた。
The spring was still young.	春はまだ浅かった。
The staff exchanged opinions in the meeting.	社員達は会議で意見を交換した。
The stars were beginning to appear.	星が見えはじめた。
The station is a little way off.	駅は少し離れている。
The station is far from here.	その駅はここから遠い。
The station is near at hand.	駅はすぐ近くです。
The station is not far from here.	駅はここから遠くない。
The station is to the west of the hotel.	駅はホテルの西の方にある。
The store is closed until further notice.	当店は追ってお知らせするまで閉店いたします。
The store might be closed already.	その店はもう閉まっているかもしれないよ。
The store was already closed when I got there.	そこへ着いたときには、店はすでにしまっていた。
The stories which you will read in this book deal with some of the many problems which face young people.	この本に入っている話は若者が直面する多くの問題のいくつかを取り上げている。
The stories written by Amy Church are all interesting.	エイミー・チャーチが書いた小説はみな面白い。
The story appears to be true.	その話は本当らしい。
The story begins far in the past.	話は遠い昔に始まる。
The story didn't sound true.	その話は本当に様には聞こえなかった。
The story lived on, passed from person to person.	その物語は口から口へ伝えられて生き残った。
The story sounds true.	その話は本当のようにきこえる。
The story turned out to be true.	その話は本当である事が分かった。
The story was true.	その話は本当でした。
The street is named for President Madison.	その通りにはマジソン大統領の名が付けられている。
The streets in Hokkaido are wide.	北海道の道路は幅が広い。
The streets of Hokkaido are very wide.	北海道の街路はとても広い。
The streets of New York are very wide.	ニューヨークの道路はとても広い。
The students of this school are kind.	この学校の生徒は親切である。
The students turned in their term papers.	学生たちは期末レポートを提出した。
The sun appears every now and then.	時々太陽が顔を見せる
The sun had already set when he got home.	彼が帰宅したときには、太陽はもう沈んでしまっていた。
The sun having set we stayed there for the night.	太陽が沈んでしまったので、私達は一晩そこに滞在した。
The sun having set, they left off their work.	日が沈んだので、彼らは仕事をやめた。
The sun will come up soon.	もうすぐ太陽が昇るだろう。
The supplies are beginning to give out.	在庫がなくなりははじめている。
The supplies are beginning to give out.	補給が尽きはじめている。
The supplies will give out soon.	補給がまもなく不足するでしょう。
The supplies will give out soon.	補給はまもなく不足するでしょう。
The thing is, I don't really want to.	本当は気がすすまないんだ。
The thought flashed through her mind that she was going to die.	死にかけているのだとという思いがさっと彼女の頭をよぎった。
The thought is not bad.	その考えは悪くない。
The three boys looked at one another.	三人の少年たちは互いに顔を見合った。
The three people leave the shop.	三人が店を後にする
The time came when I had to leave Japan.	私が日本を去らなければならない時がきた。
The time has come for us to stand up.	我々の立ち上がる時がやって来た。
The time is approaching when we must leave.	旅立ちの時が近づいている。
The time may come when people will have used up all the oil.	人間がすべての石油を使い切ってしまうときがおとずれるかもしれない。
The town has a European air.	その町はヨーロッパ風のところがある。
The town has changed a great deal since then.	町はその時以来ずいぶん変わった。
The town is supplied with water from the river.	その町はその川から水を供給している。
The town is supplied with water from the river.	その町はその川から水を提供している。
The town will change in another ten years.	もう１０年経てばその町は変っているだろう。
The traveler stopped to ask me the way.	旅人は立ち止まって私に道を聞いた。
The true light that gives light to every man was coming into the world.	すべての人を照らすまことの光が世に来ようとしていた。
The two boys are much the same in English.	その二人の少年は英語の力がほとんど同じだ。
The two classes were brought together into a larger class.	２つの組は合併されて大人数のクラスになった。
The two houses stand back to back.	その２軒の家は背中向かいにたっている。
The two houses stand side by side.	その二軒の家は並んでたっている。
The two houses stand side by side.	その２軒の家は並んで建っている。
The two roads cross there.	二本の道はそこでクロスしている。
The war between the two countries ended with a big loss for both sides.	二つの国の戦争は両国の大きな損失で終わった。
The war took place 45 years ago.	その戦争は４５年前に起こった。
The water has been cut off.	断水しました。
The water in this river is very clean.	この川の水はとてもきれいだ。
The water of the river was very clear.	川の水はとても澄んでいた。
The weather changes very often at this time of year.	１年のこの時期は天候がよく変わる。
The weather changes very often in England.	イギリスでは天気がよく変わる。
The weather couldn't have been better.	絶好の天気だった。
The weather does not look like clearing up today.	今日は晴れそうもない。
The weather has a great deal to do with our health.	天候は我々の健康と大いに関係がある。
The weather has been good until today.	今日までいい天気でした。
The weather has improved.	天気が回復した。
The weather is as fine as can be.	天気はこの上なくいい。
The weather is fine in London.	ロンドンの天気は晴れです。
The weather is not so good.	天候があまり良くない
